,sentence
7350,"However, it should be noted that scientists (in the area of airflow) knew that some transmission via aerosols was happening and they were ignored rather rudely in favor of a constant (5 microns) that no-one knew where it came from."
7351,The WHO panel was unwilling to listen to them or research the issue more fully.
7352,They in fact cut them off citing this 5 micron constant as criteria for what's considered airborne.
7353,"As it turns out, most of the respiratory viruses have some level of aersol transmission."
7354,It's fairly obvious that flu transmits that way as well.
7355,"Of course these viruses also transmit via droplets and surfaces, but the five micron constant was just accepted as fact with no room for argument."
7356,"There was no common sense in that if course there's nuance, as droplets of larger size can be suspended in air, just for shorter time periods."
7357,In fact flu viruses have long been found in areas they should not be if the prevailing wisdom were true (like air vents for example).
7358,Yet no-one questioned the prevailing wisdom as they should have.
7359,The lesson here is that we shouldn't just accept constants as fact without understanding the context.
7360,The WHO panel and the CDC were guilty of accepting an old data point as fact without first understanding the full context of the study that produced it.
7361,The only thing that convinced them was a group of determined people researching the origin of that number and plainly showing that it was false.
7362,"In other words, a scientist can be just as capable as the rest of us at making false assumptions."
7363,"So if they’re private entities, how is the EU exporting anything?"
7364,&gt;Grasset shared e-mails with Euronews that show a proposition from someone claiming to work for a UK-based PR company.
7365,She’s toast.
7366,"No, they'll get it and, statistically speaking, walk away from it with little issue for the most part."
7367,They'll rave about how bad covid wasn't for them and validate their shitty decisions about not getting vaccinated.
7368,They'll continue to denounce the vaccinated crowd for wasting their time and being so afraid of the big bad covid.
7369,"Sure, some will have a bad experience or even die, but they'll be the minority."
7370,"This is terrific news, because I think it's almost certain to push us up above the threshold for herd immunity."
7371,Lots of people who already had covid are (quite reasonably IMO) saying they don't feel the need to also get the vaccine.
7372,N
7373,You don’t see any distinction between promoting a moisturizer and promoting anti-vaxx during a pandemic?
7374,[removed]
7375,They came to my area once.
7376,"Two weeks after the rally, outbreaks started popping up."
7377,Hillier is a disgrace to Canadians.
7378,Mutiny chargrs might mean byebyefreedom for a while.
7379,Ok well what other people do with their own children is really none of your business I’m not sure why you care so much.
7380,As a parent we each have to make our own choices based on what we think is best for our family
7381,"Surely if vaccine passports were ever issued, they would also be given to people who had a positive antibody test indicating they had COVID?"
7382,This post appears to be about vaccines.
7383,"We encourage you to read our helpful resources on the COVID-19 vaccines:
   
[Vaccine FAQ Part I](https://www.reddit.com/r/Coronavirus/wiki/faq#wiki_where_can_i_find_information_about_the_mechanism_and_progress_of_vaccines.3F)

[Vaccine FAQ Part II](https://www.reddit.com/r/Coronavirus/comments/mnitdo/vaccine_faq_variants_chronic_conditions_nsaids)

[Vaccine appointment finder](https://www.reddit.com/r/Coronavirus/wiki/faq/vaccinefinder)


*I am a bot, and this action was performed automatically."
7384,Please [contact the moderators of this subreddit](/message/compose/?to=/r/Coronavirus) if you have any questions or concerns.
7385,*
7386,Lol we’ve ceded landed before.
7387,Most notably in the 1970s to Mexico but these people don’t want to join canada
7388,I just see so many people on this sub talking about how they won’t let their kids see their friends or family members since they’re not vaccinated and it just pisses me off
7389,It turns out ignorant stupidity knows no national allegiance or boundary.
7390,I was impressed seeing the Reston Home Depot enforcing masks at the door
7391,"USA update on first dose shots:

470,431 first dose shots."
7392,"Last week 538,203

7 day rolling avg is now 858,978 (868,660 yesterday)

164.3m age 12+ have first dose - 57.9% (163.9m - 57.7% yesterday) 

158.9m adults have first doses - 61.6 %  (158.7m - 61.5% yesterday)

85.3% of 65+ have first dose (85.4% yesterday) 

49.5% overall (49.4% yesterday)

At this rate, the first dose shots:

On

May 31st - 169.5m

June 15th - 182.4m

**12+ population numbers (based on 284.1m population)**

On

May 31st - 59.7%

June 15th - 64.2%

60% on  6/1

70% on 7/4

**Total population numbers (based on 332.6m population)**

On

May 31st - 51%

June 15th - 54.8%

50% on 5/28

60% on 7/5


**Path to 180.6m/70% of Adults (based on 258m population)**

7-day rolling avg for adults is 596,505 (611,197 yesterday)

May 31st - 162.5m - 63%

June 15th - 171.4m - 66.5%

70% on 7/1"
7393,"I think the real issue here, possibly of greater importance than whether or not in this particular instance COVID escaped accidentally from a lab or arose in nature, is that all discussion on this important topic was ruled out of bounds, and you had organizations like politifact going around saying that thinking it might have escaped from a lab was a 'debunked conspiracy theory' and it was all just misinformation that needed to be censored and suppressed."
7394,"If you even hinted at thinking it might have escaped from a lab, you were called a racist."
7395,You were called a xenophobe.
7396,You were blamed for the rise in anti-asian hate crimes.
7397,"That is alarmingly orwellian, and anti-scientific."
7398,"Now we see again, as was obvious shortly after the breakout, that it is at least plausible that it originated in a lab accident and it is important to be able to discuss such things and try to arrive at the truth of the matter."
7399,At least now hopefully no one will any longer make the mistake of considering politifact an authoritative or reliable source.
7400,[deleted]
7401,I don't quire get the logic.
7402,What does it have to do with the origin of a company?
7403,Company != government.
7404,"American or not, it's a private entity."
7405,"AZ is British and Swedish and the J&amp;J vaccine was designed in Leiden, Netherlands, but you don't hear anything about the Swedish or Dutch roots, maybe because these companies are treated just as private entities."
7406,"And yes, I'm ignoring the British side because of their recent history.."
7407,"Yes ofcourse my isp knows that I am connected, I pay for it."
7408,But what do I care if it knows I am connected to internet I chose and payed for it?
7409,"It can't get  much if I use pgp mails or other encypted services, and I never ever connect to public wifi and if I don't need my phone I don't take it with me."
7410,I don't understand why this sub is full of Americans who don't even are bothered by this issue but still keep pushing it on Europeans.
7411,"If you're not sure you vacation to Europe will be safe, just go somewhere in the US lovely places enough and try again next summer."
7412,[removed]
7413,"Your submission has been removed because


* **You should contribute only high-quality information."
7414,"** In specific, amateur research and analysis are not allowed."
7415,"We require that users submit reliable, fact-based information to the subreddit and provide an English translation for an article in the comments if necessary."
7416,"([More Information](https://www.reddit.com/r/Coronavirus/wiki/rules#wiki_rule_5.3A_keep_information_quality_high))


* Blogs are typically not allowed as posts



If you believe we made a mistake, please [message the moderators](http://www.reddit.com/message/compose?to=/r/Coronavirus&amp;subject=Removed submission&amp;message=I'm writing to you about the following submission: https://old.reddit.com/r/Coronavirus/comments/nkvz84/-/)."
7417,9 months might be tricky.
7418,"For children, safety profiles can’t just be very good like they have been, they need to be essentially flawless."
7419,It could well be on that justification no vaccine is approved for the u12 group.
7420,"If approved, there seem to be two internal groups- 2-12 and 6 months and up."
7421,6 months and up is a lot harder to approve than 2-12.
7422,Absolute earliest we would see approval for any group under 12 would likely be September.
7423,Per your own article only 2.3% of children had symptoms lasting longer than 12 weeks.
7424,"Sorry Canada, did some of our Republicans leak over the border to you?"
7425,This Hillier fella sounds like he has the same selfish entitled attitude we see so much of down here.
7426,"I’m not holding my breath for MS, AL and GA."
7427,That woman from Michigan is such a hypocrite
7428,"I remember what it felt like to be a teenager, thinking the entire world was simultaneously unfair, yet still somehow revolving around me."
7429,"I'mma guess you didn't read the article, and your reaction is similar to mine before realising he was calling on troops to *refuse to help distribute* the vaccine, not refuse to be vaccinated."
7430,"In other words, he was telling people to refuse to lift some boxes of medicine into the back of trucks to take to hospitals and health centres."
7431,"I assume that because I can't believe anyone is actually nuts enough to defend a soldier disobeying orders that don't harm him in any way and fall in the normal, every day peace time expectations of the job."
7432,Are you gonna call on baristas not to serve customers coffee next?
7433,"Your comment has been removed because

* **Incivility isn’t allowed on this sub."
7434,** We want to encourage a respectful discussion.
7435,"([More Information](https://www.reddit.com/r/Coronavirus/wiki/rules#wiki_rule_1.3A_be_civil))

*I am a bot, and this action was performed automatically."
7436,Please [contact the moderators of this subreddit](/message/compose/?to=/r/Coronavirus) if you have any questions or concerns.
7437,*
7438,[removed]
7439,"From your second link

&gt;	A recent study found that 13.3 per cent of adults with symptomatic covid-19 have symptoms lasting more than 28 days (medRxiv, doi.org/ghgdsv)."
7440,"And

&gt;	Evidence from the first study of long covid in children suggests that more than half of children aged between 6 and 16 years old who contract the virus have at least one symptom lasting more than 120 days, with 42.6 per cent impaired by these symptoms during daily activities."
7441,"These interim results are based on periodic assessments of 129 children in Italy who were diagnosed with covid-19 between March and November 2020 at the Gemelli University Hospital in Rome (medRxiv, doi.org/fv9t)."
7442,These numbers are wild.
7443,"But even if it’s true, OP’s original statement of 10-30% of kids infected experiencing symptoms for 6 months is incorrect."
7444,First quote:  13.3% of **adults** with **symptomatic** covid experience them for over 28 days (let alone 6 months).
7445,Is the article trying to say kids are at higher risk for greatly longer symptoms from covid than adults?
7446,I haven’t heard even a whisper of that anywhere else…and it would be a HUGE deal if true.
7447,The second quote is based on a study of kids diagnosed in a hospital.
7448,A sample of kids that have been taken to a hospital can’t be equated to kids as a whole.
7449,I have empathy for parents and what they need to consider right now.
7450,I’m not one of those people who got vaccinated and doesn’t give a shit about other people now.
7451,I’m just saying throwing out an outlandish claim that 10-30% of kids who are infected get sick for 6 months is extremely reckless.
7452,We need to make decisions based on the best information possible.
7453,"I’ll throw out another quote from the second link because it’s just too much

&gt;	UK advocacy group Long Covid Kids says that it currently has details of 1200 children with long covid from 890 families in England."
7454,"“And that number has been rising quickly,” says founder Sammie Mcfarland."
7455,"“Not one has returned to their previous health, and most are unable to do their normal activities.”

**Not one has returned to their previous health??"
7456,Really??
7457,"**

IMO an article that would even consider including a ridiculous quote like that should be dismissed entirely."
7458,I was told 24 hours on Ibuprofen and that Tylenol can be taken as needed.
7459,Taiwan numba one!!
7460,!
7461,Walked into a store today and was the only one wearing a mask.
7462,Felt like I was finally stepping out of the Twilight Zone.
7463,Change the title to “Man in soldier cosplay who called on troops...”
7464,[removed]
7465,"I've been quoting that line Goodwill Hunting all the pandemic long....augh, what a time to catch feelings"
7466,Thank you for Americanizing.
7467,A CAP officer being charged with mutiny for being an idiot is some delightful comeuppance.
7468,"Good for you, Canada!"
7469,Issue with the previous administration is they too often blurred the line between the official functions of the office of the president and campaign rallies to the point where basically everything was treated as a campaign rally.
7470,"Yep, I'm familiar with that."
7471,"Your post or comment has been removed because

No Compact Nations are mentioned in the article."
7472,* **You should contribute only high-quality information.
7473,"** We require that users submit reliable, fact-based information to the subreddit and provide an English translation for an article in the comments if necessary."
7474,A post or comment that does not contain high quality sources or information or is an opinion article will be removed.
7475,"([More Information](https://www.reddit.com/r/Coronavirus/wiki/rules#wiki_rule_5.3A_keep_information_quality_high))

*If you believe we made a mistake, please [message the moderators](/message/compose?to=/r/Coronavirus)."
7476,*
7477,It's complete Luddite speculation.
7478,"There is absolutely no reason why these apps would need to be connected to a location tracking database, and it would be way easier to design a system which doesn't."
7479,"If the EU wanted to track you, there's a thousand better ways to do it."
7480,"Civil Air Patrol seems like the best analogue, if you're familiar with CAP."
7481,Since when did not taking a vaccine jump the line to mutiny?
7482,This is a bizarre world we’re living in today and you who are reading this post can’t even comprehend it!
7483,Wait until these people find out that you need a beer passport to legally purchase beer.
7484,What does this even mean lol
7485,I got the my first dose of the Pfizer vaccine.
7486,"Right before I got it, one of the nurses told me not take NSAIDs, e.g."
7487,"ibuprofen, but I forgot to ask for how long."
7488,Does anyone know?
7489,Thanks.
7490,It was also just bad luck.
7491,I believe AstraZeneca did believe they could ramp up production to meet UK and EU orders.
7492,Unfortunately they couldn't and needed to figure a way out.
7493,"lol 'prime minster'
Please use the correct word; 'Taoiseach'

We don't call xi jinping the king of China because that's not the correct title either."
7494,[removed]
7495,"The goalposts for the ""lab theory"" have been incredibly wide though."
7496,When it first started making the rounds last year it was a deliberate bio-weapon created by the Chinese to hurt a specific individuals political approval ratings.
7497,There's a sizable distance between the above being absolute fact and being open to the possibility that it accidentally escaped containment.
7498,[removed]
7499,"Your post or comment has been removed because

* **Off topic political, policy, and economic posts and comments will be removed."
7500,"** While we encourage and allow political, policy, and economic discussions, we ask that these discussions pertain primarily to the current Coronavirus pandemic."
7501,These offtopic discussions can easily come to dominate online discussions.
7502,Therefore we remove these unrelated posts and comments and lock comments on borderline posts.
7503,"([More Information](https://www.reddit.com/r/Coronavirus/wiki/rules#wiki_rule_4.3A_avoid_politics))

*If you believe we made a mistake, please [message the moderators](/message/compose?to=/r/Coronavirus)."
7504,*
7505,"Abstract:

&gt; Using anonymized and aggregated mobility data from opted-in Google users, we found that state-level emergency declarations resulted in a 9.9% reduction in time spent away from places of residence."
7506,"Implementation of one or more social distancing policies resulted in an additional 24.5% reduction in mobility the following week, and subsequent shelter-in-place mandates yielded an additional 29.0% reduction."
7507,Decreases in mobility were associated with substantial reductions in case growth two to four weeks later.
7508,"For example, a 10% reduction in mobility was associated with a 17.5% reduction in case growth two weeks later."
7509,"Given the continued reliance on social distancing policies to limit the spread of COVID-19, these results may be helpful to public health officials trying to balance infection control with the economic and social consequences of these policies."
7510,AZ voted for Biden and is a very desirable state now
7511,"Since all 26 vouchers could be used in the first year, I assume United will send the tax documentation for the full amount for this year."
7512,"You'd have to work with a tax professional to spread the tax out over two years, i.e."
7513,the years where you actually use the vouchers.
7514,"Your comment has been removed because


* **Off topic political, policy, and economic posts and comments will be removed."
7515,** We ask that these discussions pertain primarily to the current Coronavirus pandemic.
7516,These off topic discussions can easily come to dominate online discussions.
7517,"Therefore we remove these unrelated posts and comments and lock comments on borderline posts.. ([More Information](https://www.reddit.com/r/Coronavirus/wiki/rules#wiki_rule_4.3A_avoid_politics))



If you believe we made a mistake, please [message the moderators](http://www.reddit.com/message/compose?to=/r/Coronavirus&amp;subject=Removed comment&amp;message=I'm writing to you about the following comment: https://www.reddit.com/r/Coronavirus/comments/nknhgq/-/gzeqb49/)."
7518,[removed]
7519,The problem is a certain orange elephant in the room caused all discourse on both sides of the issue to become irrational and partisan.
7520,I think now with a less politically charged atmosphere we're all able to step back and look at things in a more sober way.
7521,"As much as it pains me to say it, i have to agree with you."
7522,No loss of life is acceptable.
7523,"No matter your age or disability you matter, but this is not very different from combat triage."
7524,If you have 2 patients and only have resources to save 1 you have to make the difficult decision to pick which one you are going to attend to.
7525,This is why i could not be a doctor.
7526,The decision is necessary but i would not want to have to be the one making it.
7527,"Phenomenal reading comprehension, my guy."
7528,"If you have the option, definitely pfizer/moderna &gt; j&amp;j &gt; all others."
7529,"But any single dose of any vaccine asap is going to give you a huge level of protection against severe outcomes, and you can always get a booster in 6 months."
7530,"Not to be Debbie Downer, but remember the vaccine will likely have an effective life span."
7531,So between that and new variants there will be possibilities for future resurgences.
7532,I guess I'll keep my unused masks just in case....while I'm waiting for my booster.
7533,:(
7534,Garbage
7535,Like without masks.
7536,"He sees them at school, with masks, and socially distanced."
7537,[removed]
7538,&gt; What he's saying is that we don't know yet.
7539,"The problem is that for most of the last year people have been insisting that we *do know* and that anyone who was skeptical of that conclusion was a ""conspiracy theorist""."
7540,So once there was no doubt.
7541,Now there is doubt.
7542,That's a significant change in attitude even if it's not a significant change in fact.
7543,"So, him being on Joe Rogan makes him a unreliable source?"
7544,"I don’t care if I get downvoted, it’s the truth, he sheds light on the subject via great investigation and reporting."
7545,“Pro tip”?
7546,"I’m not here making a living, I’m going to say what I want, I’m not gaining experience."
7547,[deleted]
7548,Good thing this article references the vaccines and not covid.
7549,It also states that they don’t know if there is a link between the shots and myocarditis.
7550,"It’s also states that these events are rare, go away on their own, and experts still urge people to get their shots."
7551,It’s almost like you didn’t actually read the article.
7552,It would be INSANELY hard to prove malicious intent.
7553,But maybe some sanctions and third party UN observers for negligence?
7554,"Cases are very rapidly going to 0 in my state (though right now they are still high, but this is based on infections from two-ish weeks ago so current infections are already probably ~half of that)."
7555,So long as they continue doing so there should be minimal risk.
7556,All your risk is determined not just by your level of protection but by the level of prevalence in your area.
7557,This is now definitely something to watch closely.
7558,u/joeloveschocolate whats with your title?
7559,"At first glance here, I think it may be worth noting (FYI, I intend to research this further this evening unless someone has the legal details on-hand)

Assuming all involved are operating within HIPAA rules, the data may not reflect many who have recieved their shot and under 18."
7560,"It is always a must for consideration, and should accompany interpretation of any statistical medical data/model."
7561,I mean poor lab protocols definitely seems more likely than a pangolin having sex with a bat and a person eating it or whatever the alternative theory is.
7562,I admit my memory was fuzzy on that and the want.
7563,"Still, government intimidation over that doesn’t give credibility to their version of events."
7564,I wonder if there are a lot of babies/children being taken out for the first time in a year+ who are now getting exposed.
7565,Hopefully the warmer weather will help keep it under control.
7566,(Can’t remember the seasonality of those viruses off the top of my head.)
7567,[deleted]
7568,"The workers can wear a mask if they aren't vaccinated, but there's also no reason to not be vaccinated at this point."
7569,And so no reason to require masks imo.
7570,Kids can easily transport themselves places nowadays with things like Uber
7571,I love how everyone on the internet got their PhDs in virology over the course of the last year.
7572,But … I keep getting told coronavirus is never a problem for kids.
7573,TIL there's Manaus translation in Spanish
7574,This post appears to be about vaccines.
7575,"We encourage you to read our helpful resources on the COVID-19 vaccines:
   
[Vaccine FAQ Part I](https://www.reddit.com/r/Coronavirus/wiki/faq#wiki_where_can_i_find_information_about_the_mechanism_and_progress_of_vaccines.3F)

[Vaccine FAQ Part II](https://www.reddit.com/r/Coronavirus/comments/mnitdo/vaccine_faq_variants_chronic_conditions_nsaids)

[Vaccine appointment finder](https://www.reddit.com/r/Coronavirus/wiki/faq/vaccinefinder)


*I am a bot, and this action was performed automatically."
7576,Please [contact the moderators of this subreddit](/message/compose/?to=/r/Coronavirus) if you have any questions or concerns.
7577,*
7578,Weird.
7579,I don't recall people specifically saying it wasn't airborne.
7580,"I do recall people thinking it spread through surfaces, of course."
7581,But not only that way.
7582,A plateau requires a reproductive rate very near to 1 and is not sustainable.
7583,We'll either have R&lt;1 and cases go to 0 or R&gt;1 and everyone (in a particular area) will catch it.
7584,R values are going to be different for each different strain.
7585,We don't actually know which lineages are different strains (versus simply variants).
7586,R(t) is certainly much less than 1 for B.1.1.7 and B.1.526 which account for the large majority of cases in the country.
7587,R(t) may be near to 1 but is probably below for P.1.
7588,"R(t) may still be above 1, possibly well above 1, for B.1.617.2, but there aren't enough cases of this for it to matter for some time."
7589,"Of course we know that vaccines are basically fully effective against all current lineages, so dealing with more contagious lineages just means vaccinating more people."
7590,"The actual R(t) depends on the serial interval between transmissions which is just guessed at (the CDC has a study that shows an algebraic average of 3.96, for instance - but the algebraic average isn't actually the relevant value here sadly)."
7591,But weekly growth is a great proxy.
7592,We're currently at -24% per week; at that pace we're something like 6 weeks away from 10k cases a day (an arbitrary but reasonable milestone for the end of the pandemic).
7593,"However that pace of shrinking is accelerating so it might be faster (we are still vaccinating 3-4% of the unvaccinated per week, dropping R(t) by a similar amount after whatever delay period)."
7594,"In the best case scenario, local transmissions will go to 0 for any R(t)&lt;1 value everywhere in the US, but we'll still get a steady trickle of imported cases for the next months at least."
