,sentence
4916,"While obviously the higher the protection against any symptomatic disease the better, what is arguably most important is protection against hospitalisation and/or death."
4917,Both Vaccines do a tremendous job of reducing the chances of either.
4918,AZ is also more efficacious with a longer gap.
4919,PHE expressed the opinion that the data for AZ is likely to improve as time goes on due the timing between doses and the fact that AZ seems to take longer to reach peak effectiveness.
4920,This was my point.
4921,Thank you.
4922,But it WAS 1%.
4923,"&gt; AstraZeneca has never actually trialed this idea

Yeah, true."
4924,"It's based on data collected after the fact, not randomized."
4925,Pretty backwards.
4926,"I would say the victims are us people, the abuser is the media, the social media platforms etc."
4927,"The victims are those who consume this, those of us being filled with misinformation while the truth is suppressed simply because it aligned with the thoughts of those they dislike politically - that's literally what has happened right now."
4928,"You're basically excusing the abusive husband (the media) using the 'You made me do it, I did it because I love you' type shit."
4929,"Using Trump, however shit he was, as a scapegoat for everything doesn't work anymore,  people need to take responsibility."
4930,Wrong.
4931,"Canada is doing up to 16 weeks, with that delay being reduced as supply increases (already starting to happen)"
4932,They could literally just send it across the border to Shenzhen.
4933,Recently in the mainland demand has outstripped supply.
4934,"In my city (Shunde), the mass vaccination site's been running out after the first half hour that they open."
4935,"The vaccines do not appear to be very effective at stopping infections completely, especially the P.1 variant."
4936,They do seem to be very effective against serious cases.
4937,The death rates in Chile and Seychelles have not spiked along with the number of infections.
4938,There are only 2 people in the Seychelles that are in intensive care.
4939,https://www.cnn.com/2021/05/14/africa/seychelles-covid-vaccination-infection-intl-hnk-dst/index.html
4940,"Science is the best tool we have for learning new things, and for finding truth when the answer isn't known."
4941,Science isn't a replacement for religion -- I know a number of religious scientists -- but when confronting the unknown you're much more likely to learn something useful with science than an ancient religious text.
4942,"Science questions, measures, adapts and changes."
4943,"Religions don't, and often struggle to adapt after science contradicts their teachings."
4944,The political narrative you describe is a direct result of a particular political party attacking science and scientists.
4945,"Mask wearing denial, anti-vaccination, denial of climate change, and pushing to ban the teaching of evolution in school are all things that have been pushed by conservatives, regardless of party affiliation."
4946,"It might smell self-righteous to you, and surely there are those that look down their noses at conservatives, but I'd invite you to see what it feels like to have a report on the impacts climate change censored by your boss."
4947,Or to have your decades of research into measures we can take to slow the spread of COVID ignored while your fellow citizens are dying.
4948,National smelly pee day
4949,More like WHObei amirite??
4950,Okay I’m done.
4951,[deleted]
4952,"common sense, and other viruses vs vaccines."
4953,"Such as, influenza vaccine can cause myocarditis, but it does so at a rate less than influenza infection does."
4954,"The way vaccines work, we can have some of the same symptoms as the virus itself, but they should happen less often, and more mildly when they do."
4955,"Covid infection causes myocarditis, that much is known."
4956,&gt;It was the same reason they took so long to confirm human to human transmission.
4957,"If they didn't know one way or the other, why was WHO so quick to push the Chinese claims that there was no H2H transmission then?"
4958,&gt;The Jan. 14 tweet came less than two months before WHO declared COVID-19 to be a global pandemic.
4959,"&gt;“Preliminary investigations conducted by the Chinese authorities have found no clear evidence of human-to-human transmission of the novel #coronavirus (2019-nCoV) identified in #Wuhan, #China,” the organization had said."
4960,&gt;It also relied on information from Chinese health authorities who have been accused of obscuring facts and figures during the course of the outbreak.
4961,"Might be because besides the UK, Belgium has a high number of cases with the Indian variant, so cases are bound to increase."
4962,"Hopefully, since they’ve vaccinated a decent amount of their at-risk population, it should be under control."
4963,Hiding deaths would be NYC where there photographer's house gets raided and files confiscated after shooting images of mass graves.
4964,We can see bodies in India just fine.
4965,re-read.
4966,"I said ""**partial herd immunity**"" not ""partial immunity""."
4967,**Partial herd immunity** is in fact a concept.
4968,"[https://www.medrxiv.org/content/10.1101/2020.03.25.20043679v1.full.pdf](https://www.medrxiv.org/content/10.1101/2020.03.25.20043679v1.full.pdf)

**Partial herd immunity** is in fact applied as a concept to **influenza**."
4969,"[https://journals.plos.org/plosone/article?id=10.1371/journal.pone.0009360](https://journals.plos.org/plosone/article?id=10.1371/journal.pone.0009360)

Any other nitpicks?"
4970,Where am I able to get these numbers :)
4971,"Yeah, it mostly shows restrictions work well, as R0 goes up immediately after."
4972,Nothing that suggests the vaccine drive (and maybe seasonality) would not keep driving the numbers down.
4973,"Positivity rate remains pretty high, though."
4974,"Retail is doing better than ever expected because people can't travel, so are spending that money on more stuff in NZ."
4975,Hospitality isn't affected much by tourism in most of NZ.
4976,"It's bad in a few areas of South Island which had totally geared their economy to international tourism (Queenstown, Te Anau for example)."
4977,But all the main towns and cities are fine.
4978,Unemployment is back around where it was pre-Covid and the latest Treasury predictions are for massive growth above the OECD averages for the next 2-3 years.
4979,It's extremely important to know where it came from.
4980,What a horrible statement.
4981,"Well, that’s horribly depressing."
4982,"Just to clarify, Australia isn't in an indefinite lockdown."
4983,"Some states implement temporary lockdown, 3 days seems to be the most common when there is an outbreak (I.e."
4984,one or more cases in the community).
4985,Most states would have had less than 5 outbreaks.
4986,I live in the largest state.
4987,"Since about June last year, we have had only one lockdown which was restricted to a few suburbs in Sydney."
4988,Victoria went into a longer lockdown last year after they lost control of an outbreak.
4989,"For the typical Australian, life has been largely normal for the past year."
4990,"Shops are open, you can dine in at restaurants, you can pack out stadiums or concerts, theatres have been running, people are free to go about and do whatever they want and typically there is no requirement to wear masks."
4991,Just describe what it is.
4992,Officials in those countries should know by now that any figures/numbers provided by China are almost always fudged to some degree.
4993,[removed]
4994,[removed]
4995,"I’d be surprised if retail and hospitality were at full capacity, or that economy is doing well, without tourism."
4996,"Doesn’t matter when the US far exceeds Japan’s vaccine rate, and it’s not like US healthcare facilities are as strained as some parts of Japan are right now."
4997,My parents (51 and 52) will be vaccinated on Thursday xo.
4998,Just three weeks left of pandemic for me.
4999,add China's zero transparency and coverup and you get a weapon that siphoned.
5000,For Belgium.
5001,"Cases up by 10%, testing up by 14% and testing positivity decreased."
5002,Belgium also partially opened up a few weeks ago.
5003,"Overall, it doesn't seem that worrying but it's something to watch."
5004,"Your comment has been removed because

* **Purely political posts and comments will be removed."
5005,** Political discussions can easily come to dominate online discussions.
5006,Therefore we remove political posts and comments and lock comments on borderline posts.
5007,"([More Information](https://www.reddit.com/r/Coronavirus/wiki/rules#wiki_rule_4.3A_avoid_politics))

*I am a bot, and this action was performed automatically."
5008,Please [contact the moderators of this subreddit](/message/compose/?to=/r/Coronavirus) if you have any questions or concerns.
5009,*
5010,[removed]
5011,A perfectly reasonable statement.
5012,We don't have definitive evidence.
5013,Yeah my experience too - knew a family that it really did a number on and they were all bigger people.
5014,I guess families share genetics but often health habits too.
5015,…in Belgium.
5016,It’s so easy to cheat that the kids who fail trying the honest way can only blame themselves.
5017,"I could really do without another surge of cases, and of deaths, and another lockdown."
5018,Get vaccinated please.
5019,This post appears to be about vaccines.
5020,"We encourage you to read our helpful resources on the COVID-19 vaccines:
   
[Vaccine FAQ Part I](https://www.reddit.com/r/Coronavirus/wiki/faq#wiki_where_can_i_find_information_about_the_mechanism_and_progress_of_vaccines.3F)

[Vaccine FAQ Part II](https://www.reddit.com/r/Coronavirus/comments/mnitdo/vaccine_faq_variants_chronic_conditions_nsaids)

[Vaccine appointment finder](https://www.reddit.com/r/Coronavirus/wiki/faq/vaccinefinder)


*I am a bot, and this action was performed automatically."
5021,Please [contact the moderators of this subreddit](/message/compose/?to=/r/Coronavirus) if you have any questions or concerns.
5022,*
5023,"Borders will definitely be open next year, just depends if it’s the first half of the year or second."
5024,"Australia ordered enough vaccine doses for like three times its population and will have them all delivered this year, but their vaccine rollout is so abysmal it may take a lot longer to get fully vaccinated."
5025,"That significant minority of people aren't exactly going to change their thoughts from an article that has 2 quoted sentences, though."
5026,It just seems like an odd article.
5027,"It's a 2 sentence quote of something that I'm pretty sure all reasonable people know already, and the people who disagree with that aren't the kind of people who are going to be swayed by this kind of article."
5028,https://reddit.com/r/Coronavirus/comments/nkccfm/_/gzdfjcs/?context=1
5029,I should’ve been more clear.
5030,What *I* don’t want to mess with is the chance of getting/spreading covid.
5031,Which is why any potential long term risks were outweighed by the benefit of the shot.
5032,"And like you said, most things occur within the first two months."
5033,And we just aren’t seeing problems in that time frame.
5034,Wow... 93 percent effective after the first dose against *any* infection is incredible.
5035,I said the language of science values certainty.
5036,"Because science is incertain, he’s not likely to make a certain statement on this question."
5037,And that gets amplified into “Fauci says coronavirus may have escaped from a lab” which is a misrepresentation of what he said.
5038,"This thing is 100% EU effort, lol, US, Russia, Brazil and India don't want it, China said nothing."
5039,This will not go anywhere.
5040,&gt; why anyone would choose the COVID virus over a vaccine.
5041,No one said that.
5042,I just wanted some reading material on/if *long term affects*.
5043,"This is 100% it, not like unvaccinated don't know this shit."
5044,They just could not care less because they're bad people.
5045,[removed]
5046,[removed]
5047,So grateful for our neighbors and leadership here in Maryland right now.
5048,I couldn't even tell you what airlines I've flown on in the US.
5049,I'm guessing it's people who fly a lot or had a particularly bad experience that have strong opinions.
5050,This post appears to be about vaccines.
5051,"We encourage you to read our helpful resources on the COVID-19 vaccines:
   
[Vaccine FAQ Part I](https://www.reddit.com/r/Coronavirus/wiki/faq#wiki_where_can_i_find_information_about_the_mechanism_and_progress_of_vaccines.3F)

[Vaccine FAQ Part II](https://www.reddit.com/r/Coronavirus/comments/mnitdo/vaccine_faq_variants_chronic_conditions_nsaids)

[Vaccine appointment finder](https://www.reddit.com/r/Coronavirus/wiki/faq/vaccinefinder)


*I am a bot, and this action was performed automatically."
5052,Please [contact the moderators of this subreddit](/message/compose/?to=/r/Coronavirus) if you have any questions or concerns.
5053,*
5054,"Your submission has been removed because


* **Reposts will be removed."
5055,** Reposts also cover new posts containing only information that has already been posted.
5056,"([More Information](https://www.reddit.com/r/Coronavirus/wiki/rules#wiki_rule_3.3A_avoid_reposts))



If you believe we made a mistake, please [message the moderators](http://www.reddit.com/message/compose?to=/r/Coronavirus&amp;subject=Removed submission&amp;message=I'm writing to you about the following submission: https://old.reddit.com/r/Coronavirus/comments/nkoehb/-/)."
5057,"Your submission has been removed because


* **Reposts will be removed."
5058,** Reposts also cover new posts containing only information that has already been posted.
5059,"([More Information](https://www.reddit.com/r/Coronavirus/wiki/rules#wiki_rule_3.3A_avoid_reposts))



If you believe we made a mistake, please [message the moderators](http://www.reddit.com/message/compose?to=/r/Coronavirus&amp;subject=Removed submission&amp;message=I'm writing to you about the following submission: https://old.reddit.com/r/Coronavirus/comments/nkoye0/-/)."
5060,Wow.
5061,Not going to argue with you.
5062,Yep.
5063,I got vaccinated.
5064,Spouse vaccinated same day.
5065,Child hasn’t yet.
5066,But we’re in talks with doctors about it.
5067,I took the risk for myself knowing that we could see negative negative consequences in the long term future that we aren’t aware of.
5068,The risk of covid was greater.
5069,"For the kid, we’re making safe plans for a vaccination in a place where support is available should she need it."
5070,I think my entire point is no one can say there is NO chance of long term impact.
5071,We simply don’t have that data.
5072,We have history and safety of MRNA research.
5073,But anyone who says there is zero chance of long term risk is irresistible in my opinion.
5074,Just my thoughts.
5075,I took RyanAir and I flew from the city I was in to the city I wanted to go to for like $40.
5076,No complaints.
5077,[removed]
5078,"&gt;Nah, Ryanair has a far more generous luggage policy than Spirit."
5079,"I don't know about Spirit, but Ryanair's policy is basically ""backpack or purse allowed""."
5080,"Cabin bag costs only 12$ more, though, it's close to half of original flight cost."
5081,I never believed those.
5082,"lol, at the beginning when nobody really knows much, mountain of salt is needed when digesting the flood of information."
5083,It really upset me that people were so quick to ignore the possibility.
5084,The fact that there is a research lab that researches coronaviruses in the epicenter of the pandemic makes it a likely scenario.
5085,"Lab leaks happen all the time, but are usually quarantined when discovered."
5086,"Covid is just the perfect storm of taking a long time to show symptoms that could range from mild to severe, that it was hard to see if anything was happening right away."
5087,I’ve often wondered how Australia and New Zealand are going to fair given their slow vaccine programs.
5088,"Yes, they have suppressed the virus, therefore, saving lives."
5089,"But their borders will remain closed for another year, at least?"
5090,"How sustainable can that be for them and their economy, let alone the people with family abroad?"
5091,"Not criticizing them, just curious how their situation will play out"
5092,Our school district in Illinois has already said they will use remote learning instead of snow days in the future 😕
5093,https://www.kantei.go.jp/jp/headline/kansensho/vaccine.html
5094,They didn't just not admit they actively denied that it was airborn which isn't consistent with scientific standards
5095,"Your post or comment has been removed because

* **Off topic political, policy, and economic posts and comments will be removed."
5096,"** While we encourage and allow political, policy, and economic discussions, we ask that these discussions pertain primarily to the current Coronavirus pandemic."
5097,These offtopic discussions can easily come to dominate online discussions.
5098,Therefore we remove these unrelated posts and comments and lock comments on borderline posts.
5099,"([More Information](https://www.reddit.com/r/Coronavirus/wiki/rules#wiki_rule_4.3A_avoid_politics))

*If you believe we made a mistake, please [message the moderators](/message/compose?to=/r/Coronavirus)."
5100,*
5101,LOL have fun and stay safe!
5102,[removed]
5103,Not to mention the “kids aren’t at risk for severe Covid” that we’ve been hearing on repeat for a year now.
5104,"If vaccination in adults is pushing illness towards the younger population, that’s significant."
5105,"The same link had the list for USA over 100,000."
5106,World wide list is [here](https://en.wikipedia.org/wiki/List_of_epidemics).
5107,Someone stating that this pandemic is a pandemic does not sound like any information.
5108,"What's ""nice"" about it, exactly?"
5109,"I want the truth no matter what it is, but if it turns out this is from a lab leak I can't say I'll be thinking this is ""nice"" - this isn't a game or something where the people who guess the origin win a prize."
5110,[removed]
5111,"Wow, that's a good way to market your business."
5112,The link is in Polish but basically it says that the country is going to organise a lottery for vaccinated people.
5113,"The highest prize will be 1,000,000 zł (~$275,000) but there will be many other prices such as lower amounts of cash, cars, scooters, vouchers etc."
5114,"

An allergic reaction is a perfect example of a short term side effect."
5115,"Done with medical supervision, vaccination will be safe."
5116,&gt;Not something I want to mess with.
5117,But you got vaccinated?
5118,Or are you speaking for your child?
5119,Did you really get vaccinated?
5120,What's long term for you?
5121,When is it safe?
5122,Or is this just covering up for not wanting to get the shot?
5123,"There were like three videos of that happening, and China probably was running 10-40x the cases they thought they had and no one knew much about CoVID19."
5124,CoVID19 makes people “happy hypoxics” where they don’t know just how little O2 they are getting.
5125,It also causes clots which can cause a stroke which can cause collapse.
5126,Now that we know about it we are getting to people before this stuff happens.
5127,This post appears to be about vaccines.
5128,"We encourage you to read our helpful resources on the COVID-19 vaccines:
   
[Vaccine FAQ Part I](https://www.reddit.com/r/Coronavirus/wiki/faq#wiki_where_can_i_find_information_about_the_mechanism_and_progress_of_vaccines.3F)

[Vaccine FAQ Part II](https://www.reddit.com/r/Coronavirus/comments/mnitdo/vaccine_faq_variants_chronic_conditions_nsaids)

[Vaccine appointment finder](https://www.reddit.com/r/Coronavirus/wiki/faq/vaccinefinder)


*I am a bot, and this action was performed automatically."
5129,Please [contact the moderators of this subreddit](/message/compose/?to=/r/Coronavirus) if you have any questions or concerns.
5130,*
5131,How do we know the long term effects of getting a COVID infection?
5132,"It's a risk-benefit between getting vaccinated and being infected by COVID, and by all indication with tens of millions of people in either group it's far safer to get vaccinated."
5133,The future is uncertain but I don't know why anyone would choose the COVID virus over a vaccine.
5134,I never said it's not possible for it to be natural.
5135,I'm just saying the writing is on the wall.
5136,You have some significant minority who believes that COVID is either a hoax or no worse than the flu.
5137,"They may understand they can spread it, but don't care."
5138,"If you think a virus like this cannot possibly be natural, you really need to take a class on viruses lol."
5139,It could have been far worse.
5140,"Judging by the behaviour of the people near me, this news will help it jump back up."
5141,"The minute we had news of lowering cases, one could see crowds (huge crowds) flocking malls, movie theaters, beaches and restaurants."
5142,With extremely ill fitting masks and no regards to social distancing.
5143,I have no hope.
5144,I'm waiting for my vaccination to protect myself.
5145,But sadly that too looks about a year away
5146,This post appears to be about vaccines.
5147,"We encourage you to read our helpful resources on the COVID-19 vaccines:
   
[Vaccine FAQ Part I](https://www.reddit.com/r/Coronavirus/wiki/faq#wiki_where_can_i_find_information_about_the_mechanism_and_progress_of_vaccines.3F)

[Vaccine FAQ Part II](https://www.reddit.com/r/Coronavirus/comments/mnitdo/vaccine_faq_variants_chronic_conditions_nsaids)

[Vaccine appointment finder](https://www.reddit.com/r/Coronavirus/wiki/faq/vaccinefinder)


*I am a bot, and this action was performed automatically."
5148,Please [contact the moderators of this subreddit](/message/compose/?to=/r/Coronavirus) if you have any questions or concerns.
5149,*
5150,Is the vaccination rate slowing down?
5151,"I recall doing some quick maffs in April and I was convinced we should have around 60% at least one dose by 2nd week may but looking at the data, it's only at 49.9%."
5152,Are we not administering more than 3 million doses now?
5153,What are you suggesting?
5154,"&gt; Maybe you don’t realize that Covid triage has been well discussed all over the world, for over a year now."
5155,"Yea, and every time it hits the general press in the United States special interest groups come out of the woodwork, politicians grandstand and then everyone outside of the medical field quickly puts their heads back into the sand."
5156,If you go back to my original comment you will see that it was general in nature.
5157,And it is a general discussion that is badly needed in the United States.
5158,Odds are the trio will speak about this during the press conference this afternoon.
5159,"If Aaron Derfel found out, then it must have been close to being announced anyway."
5160,"Yeah, there's no signs of covid changing so much that immunity doesn't work anymore."
5161,It may even be a scientific impossibility that it changes to escape immunity.
5162,I was thinking the same thing
5163,"&gt;""Adults who delay getting vaccinated present a risk to those who have not been vaccinated and to those who have been vaccinated but have a compromised immune system, like the elderly,"" Peacock said."
5164,"""Those are reasons why we are aiming for 70% of the population being vaccinated because we need that level of immunity to protect the whole population."""
5165,"This may be the biggest ""no shit, sherlock"" article I've seen recently."
5166,How is this even news?
5167,Literally everyone knows that unvaccinated people can spread COVID-19.
5168,At least Western WA is mostly picking up the slack.
5169,"As of yesterday, in King County, 60.3% of 16+ are fully vaccinated and 72.7% have received their first dose."
5170,"Get it, hon!!!"
5171,"(What they didn't tell the rest of the country was that Hogan put Old Bay in all the doses, pretty much guaranteeing that all of us Marylanders HAVE to take it.)"
5172,I'm actually surprised people have been investing in relationships.
5173,Was just the opposite for me since I couldn't get together with them.
5174,Have lost some friends that weren't as close because of it.
5175,"And yeah, I played games though some with my friends so that actually did keep up friendships."
5176,Fair.
5177,But most of people don't have choice.
5178,"If it's the only thing they can get, then it's a net positive."
5179,"Also it has 90% protection against hospitalization and 100% against death, so it's good enough."
5180,Exactly my thinking.
5181,Hoping we hear more about it soon.
5182,Absolutely.
5183,This is why we’ve been vaccinated.
5184,"But until we have long term data, I just don’t agree that we can guarantee."
5185,Just like my child’s doctor told us she cannot tell us what will happen when she gets her covid vaccine since she’s had a vaccine allergic reaction in the past.
5186,We just don’t have that data yet.
5187,"But you are right, we have longer term covid data."
5188,Not something I want to mess with.
5189,[removed]
5190,[removed]
5191,"Your comment has been removed because

* **Incivility isn’t allowed on this sub."
5192,** We want to encourage a respectful discussion.
5193,"([More Information](https://www.reddit.com/r/Coronavirus/wiki/rules#wiki_rule_1.3A_be_civil))

*I am a bot, and this action was performed automatically."
5194,Please [contact the moderators of this subreddit](/message/compose/?to=/r/Coronavirus) if you have any questions or concerns.
5195,*
5196,[removed]
5197,Canada is doing a 16 week interval to get more people having one shot.
5198,That's why our percentage of fully vaccinated is so low.
5199,[removed]
5200,I just hope they get some sort of definitive answer at some point.
5201,All of this speculation is pointless and is mostly based on our own biases more than anything.
