,sentence
0,[deleted]
1,"&gt; I pointed out the relative success of Ontario's vaccination program (compared to Ohio's)

No you didn't, you gave some one sided statistics and are currently ignoring anyone pointing out that yes at the moment the % of people in Canada that have gotten half a treatment is higher then the state of Ohio, however the % of adults that have completed their full course of treatment is another matter."
2,It definitely is.
3,Humans are by nature tribal.
4,We can only connect closely with approximately 150 individuals.
5,That is our “processing capacity” for social interaction.
6,I'm hoping for confirmation of this soon.
7,I don't think it's unreasonable to do.
8,Especially when under 30s haven't been offered the vaccine yet widely.
9,"And they're pushing second does now a lot, will be insensitive at worst to not do these requirements for entry."
10,[deleted]
11,"Your comment has been removed because


* **You should contribute only high-quality information."
12,"** In specific, conspiracy posts and comments are not allowed."
13,"We require that users submit reliable, fact-based information to the subreddit and provide an English translation for an article in the comments if necessary."
14,"([More Information](https://www.reddit.com/r/Coronavirus/wiki/rules#wiki_rule_5.3A_keep_information_quality_high))



If you believe we made a mistake, please [message the moderators](http://www.reddit.com/message/compose?to=/r/Coronavirus&amp;subject=Removed comment&amp;message=I'm writing to you about the following comment: https://www.reddit.com/r/Coronavirus/comments/nk3vlk/-/gzc15wj/)."
15,[removed]
16,Interesting
17,"Your comment has been removed because


* **You should contribute only high-quality information."
18,"** In specific, conspiracy posts and comments are not allowed."
19,"We require that users submit reliable, fact-based information to the subreddit and provide an English translation for an article in the comments if necessary."
20,"([More Information](https://www.reddit.com/r/Coronavirus/wiki/rules#wiki_rule_5.3A_keep_information_quality_high))



If you believe we made a mistake, please [message the moderators](http://www.reddit.com/message/compose?to=/r/Coronavirus&amp;subject=Removed comment&amp;message=I'm writing to you about the following comment: https://www.reddit.com/r/Coronavirus/comments/nk3vlk/-/gzc05z9/)."
21,This isn't surprising.
22,The CCP is obsessed with saving face.
23,"Beyond that, Chinese New Year is the most important holiday in the year."
24,"If they implement a lock down right before, that would seriously anger/demoralize the entire populace."
25,It's not surprising that they waited until almost the last minute to determine a) it can't be contained with traditional methods b) it was dangerous enough to cancel Chinese New Year.
26,[removed]
27,[removed]
28,[removed]
29,"Be fair, there was no evidence of this at all early in the pandemic."
30,It’s no surprise that it got filed away as conspiracy nonsense.
31,"Not to mention, at the time we had more important things to think about and figure out."
32,"It was perfectly reasonable to dismiss this back then, just like now it’s reasonable look again and consider the possibility...because new information has come to light."
33,"And we still don’t KNOW this escaped from a lab, people like Fauci and Gottleib are just saying it’s a possibility and should be investigated."
34,[removed]
35,"I cant speak for others but all i would think is that if China is doing it, you can bet your ass that the U.S. and other nations are making/studying virus' like these the same exact way."
36,"We already know that the U.S. has a bunch of deadly virus' being researched right now in the U.S.. if it were a lab leak in China, then it's just a matter of time before the same thing happens in the U.S."
37,I feel bad for anybody working in a water treatment plant tomorrow.
38,It's about to be hella smelly.
39,"Your comment has been removed because

* **Purely political posts and comments will be removed."
40,** Political discussions can easily come to dominate online discussions.
41,Therefore we remove political posts and comments and lock comments on borderline posts.
42,"([More Information](https://www.reddit.com/r/Coronavirus/wiki/rules#wiki_rule_4.3A_avoid_politics))

*I am a bot, and this action was performed automatically."
43,Please [contact the moderators of this subreddit](/message/compose/?to=/r/Coronavirus) if you have any questions or concerns.
44,*
45,[removed]
46,I think the hypothesis should be checked out seriously too.
47,As does Fauci.
48,That doesn’t mean that scientific consensus is changing.
49,The scientific consensus AFAIK is that there is not enough evidence found to prove anything or rule anything or.
50,"Ok, in your mind when do we open the world up?"
51,we run acceptable risk on every single thing on the planet.
52,Driving has an acceptable risk and your far far far more likely do die in a car accident than you are of covid at this point.
53,"There are still some lingering cases of the measles going around, should we stay inside and wear masks until that’s eradicated."
54,"Even the CDC has said at this point if you’re vaccinated, you can go indoors without masks with other people."
55,So why should I go by your standard over theirs?
56,"my sister turns 12 in july, so my family is just waiting until then"
57,&gt;the genome of the virus does not look like it came from natural evolution.
58,How so?
59,"&gt; It came into existence already with infectivity never seen before in nature

How do you know this?"
60,[Looks like 63.7% to me.
61,Probably just a day or two off.
62,](https://covid19vaccine.health.ny.gov/covid-19-vaccine-tracker)
63,Croatia is beautiful and well worth the trip.
64,"They're not doing that for some reason, it would help so much."
65,[deleted]
66,[removed]
67,"Shit, theres a huge one in Galveston, Tx and a bunch of people freaked out because when harvey hit, they worried that facility got flooded."
68,"https://www.oregonlive.com/today/2017/08/galveston_lab_that_houses_dead.html

Edit: had to post a link with the story"
69,"Your comment has been removed because


* **You should contribute only high-quality information."
70,"** In specific, misinformation are not allowed."
71,"We require that users submit reliable, fact-based information to the subreddit and provide an English translation for an article in the comments if necessary."
72,"([More Information](https://www.reddit.com/r/Coronavirus/wiki/rules#wiki_rule_5.3A_keep_information_quality_high))



If you believe we made a mistake, please [message the moderators](http://www.reddit.com/message/compose?to=/r/Coronavirus&amp;subject=Removed comment&amp;message=I'm writing to you about the following comment: https://www.reddit.com/r/Coronavirus/comments/nk3vlk/-/gzbyhhj/)."
73,"Imagine being either this oblivious to basic public health precautions, or this much of a sociopath that you're aware of the dangers and choose to do it anyway."
74,"If 3 turns out to be the case, I suppose they technically accomplished their goal…"
75,"This doesn’t make any sense to me, how else do you determine how well the vaccine is working?"
76,"Your comment has been removed because


* **You should contribute only high-quality information."
77,"** We require that users submit reliable, fact-based information to the subreddit and provide an English translation for an article in the comments if necessary."
78,"([More Information](https://www.reddit.com/r/Coronavirus/wiki/rules#wiki_rule_5.3A_keep_information_quality_high))



If you believe we made a mistake, please [message the moderators](http://www.reddit.com/message/compose?to=/r/Coronavirus&amp;subject=Removed comment&amp;message=I'm writing to you about the following comment: https://www.reddit.com/r/Coronavirus/comments/njv3nr/-/gzbwbvn/)."
79,[removed]
80,Well the good news is that they won’t rush them regardless of how much we want it for the school year!
81,And I saw your local cases are pretty low so that’s good too.
82,Ours are still high (25/100k) so we’re just taking advantage of the summer weather and doing as much outside stuff as we can and doing curbside for restaurants / stores.
83,What are we supposed to do for the immune compromised?
84,They will likely never be able to get this vaccine correct?
85,So how long do we have to wear a mask and social distance to protect them?
86,"I understand that may sound flippant and unfair but at some point we have to go back to living, right?"
87,The best way to protect them is herd immunity and I got my vaccine the moment I could.
88,"Talk to the anti vaxxers, they are the reason we can’t have nice things 

As for kids, it’s a bummer I agree, but 12 and up can get it now and afaik September is when they’re shooting for I believe 2 and up."
89,But kids aren’t particularly high risk.
90,"I know it’s not a no risk situation, but again are we supposed to keep this up until middle of next year until every single kid can get the shot?"
91,Compare articles detailing India’s known gross underreporting with China’s unknown underreporting and seeing the discrepancy in vitriol is hilarious
92,How about you don’t paraphrase and show me what he said.
93,"Hint: what he has done consistently is present facts as they are known, and/or ask for more investigation to be done."
94,Seasonal if you're not in a state where it's so hot everyone stays inside.
95,It spiked in the South in the summer because everyone was inside with the AC.
96,"I would imagine outside camp would be safer this year than last year, as there's lower prevalence of the virus due to many who can being vaccinated."
97,Your school district has to be really wealthy.
98,We only have chromebooks for 30% of our kids and that was a big improvement.
99,He was questioned and released.
100,That's very much different from imprisoned.
101,Does every kid have access to a chromebook/computer in NYC?
102,That's crazy to me.
103,I can imagine how many schools have the infrastructure where every kid has internet and computers at home.
104,Snow days are here to stay around me for this reason.
105,You can't tell a Texan they're not the best at something.
106,"They'll just flip the narrative and say the opposite is superior, thus putting them in the lead and doubling down on the opposite end of the spectrum instead."
107,meanwhile i'm the lone one in my family that got the vaccine (1/2 of the pfizer) and my brother just got covid (unvaccinated).
108,my mom is anti vax and 70 yrs old and I have an uncle that is severely at risk.
109,it's completely selfish for her to continue with her mentality of natural news being a source of unbiased information.
110,i really hope to god nobody in my family gets more sick from this.
111,fuck.
112,Wait till you find out how permanent dying from preventable disease is.
113,Your submission linking to yahoo.com has been automatically removed because the source may not be reliable or may be dedicated mostly to political coverage.
114,"If possible, please re-submit with a link to a reliable or non-political source, such as a reliable news organization or an recognized institution."
115,Thank you for helping us keep information in /r/Coronavirus reliable!
116,"*I am a bot, and this action was performed automatically."
117,Please [contact the moderators of this subreddit](/message/compose/?to=/r/Coronavirus) if you have any questions or concerns.
118,*
119,"I think most people are talking about the latter, but I'm sure there's *some* talking about the former."
120,There's no biologically plausible mechanism by which a vaccine could decrease sensitivity to and/or production of androgens which cause male pattern baldness.
121,Male pattern baldness that suddenly reverses itself without explanation tends to not actually be male pattern baldness.
122,Stress-related hair loss is definitely a thing.
123,"If you had a ton of covid-related stress, that could have easily caused hair loss that mimicked male pattern baldness."
124,"Now that you're vaccinated, covid stress is gone, and boom."
125,Hair comes back.
126,Dude I did everything that was asked of me for a fucking year.
127,"I didn’t travel, I didn’t go to peoples houses, I didn’t see anyone for a year.l so that I could help high risk individuals."
128,I’m sorry that I am not interested in protecting idiots from themselves
129,Meanwhile the US still doesn't allow unrestricted exports while there are still unvaccinated healthcare workers all across the world.
130,As a concept that's good but in reality does it really work?
131,There's been countless times in university where I was told to come in having read a certain chapter and I didn't just because I had a bunch of other midterms to study for or something.
132,I'm just glad we're making it a competition
133,I’m the person that said it and that is not what I said.
134,I said I don’t care about people who refuse to get it.
135,I’ve literally done every single thing that has been asked of me for over a year.
136,"While almost everyone else travelled for Christmas or balked at the rules, I stayed in my house and didn’t get within 6 feet of anyone else for over a year."
137,I’m sorry if I don’t have patience or the mental capacity to continue to try and protect people from something they don’t or won’t protect themselves against.
138,The whole purpose was to protect high risk individuals and keep the hospitals from being overrun.
139,Both of these are no longer an issue with the highest risk people and well almost everyone in the states have had the opportunity get vaxxed for months now.
140,I said if there is a variant that escapes immunity than I will go back to doing my best to help the people that are at high risk until there’s a new vaccine.
141,"But, I’m sorry we can’t be asked to love this way forever."
142,"And frankly if people are unwilling to get the shot, that’s on them at this point."
143,There are a number of problems with the idea - which may have merit - of spacing the shots for higher efficacy.
144,1.
145,"What you say, if it's a crisis you're trying to outrun, you don't have months to wait."
146,2.
147,Logistics of tracking people down after multiple months.
148,J&amp;J's single shot is highly preferred for transient populations for this reason already.
149,3.
150,"AstraZeneca has never actually *trialed* this idea, so it's inherently speculative and not something that will be approved in countries with strict licensing regimes."
151,"&gt; Anyway, I am beyond done

That's a good idea."
152,Crazy how fast we got to two and how slow to get from two to three.
153,"Detained/interrogated/etc - take your pick  
Last I checked he was never given a court sentence."
154,"https://thewire.in/health/origins-of-covid-19-wuhan-china-coronavirus

This is an excellent longform summary of the reasons that people are taking the lab leak hypothesis seriously."
155,I thought it was very balanced and admittedly it made me reconsider my own thoughts on the issue.
156,This is a good point - we probably should continue to wear masks so our son doesn't feel weird.
157,He does have an existing risk factor so that is definitely a concern.
158,He did go to an outside camp last year and that worked out fine.
159,"Just based on what data we have, it definitely seems like this thing is seasonal, because the rates went down so much lower in NJ as soon as warm weather set in."
160,"You're right I looked it up, a vaccinated elderly person is at similar-ish risk to an unvaccinated young adult."
161,"So in that case it's only fair that everyone follows the same rules, with everyone in a roughly similar effective risk category."
162,Is it National Asparagus Day?
163,That's amazing because we gorged on asparagus with dinner tonight.
164,Where I live I would say there is still 85-90% mask wearing indoors.
165,I see less people wearing them outside.
166,I think there will be some people who will literally wear a mask until the day they die.
167,They will be probably be buried with one.
168,Imagine being this into partisan culture wars lmao
169,[removed]
170,"I mean, I'm not gonna blame it all on gerrymandering but that has its place."
171,Also antivoting laws has been an issue for many many years.
172,"Texas is a place that votes bluer than you would think, but like most states with large rural populations it tends to lean a certain way"
173,Which they haven’t done yet.
174,"Yeah I think that's what we're going to do - I mean we've mostly avoided indoor spaces with my son over the past year anyway, other than when we went to the beach and he had to go in the bathroom, or taking him to get ice cream, etc."
175,We just talked about it and he's cool with double-masking if we need to be in indoor spaces for longer periods.
176,Hopefully it will all continue in a good direction.
177,"I hope they can get the vaccine trials done for younger kids by school time, though I also don't want them to rush it!"
178,"J&amp;J should be fine, it showed good efficacy with one dose."
179,This sort of finding more concerns people getting only one dose of what are approved as  two dose shot regimes.
180,"Either because that's the vaccination policy, or they forget, or the second shot winds up being in shortage."
181,Try reading the article.
182,I highly doubt that they were wearing masks outside since that's not really done anywhere in the UK.
183,"Yep, and there is plenty of evidence to show that the ccp knew for about a month that there was a new virus whose origins were in wuhan before they did anything about it."
184,"In an effort to save face, they covered up the news as long as possible until they couldn’t anymore."
185,I don’t necessarily think members of the government there knew the severity and the ramifications of not locking down sooner.
186,But their unwillingness to acknowledge the problem for that month is what made this a worldwide pandemic.
187,I can’t find the source for the video I learned about this from.
188,The channel is laowhy86 on YouTube.
189,He basically tracks job postings from late 2019 from the wuhan institute of virology.
190,In late December they made a posting asking for more researchers to investigate recent discovery of human to human transmission with a new coronavirus.
191,"As many of you know, the ccp would’ve known about this instantly."
192,But they didn’t start their lockdowns until January 23 2020.
193,Right?!
194,He'll never say he's convinced one way or the other.
195,It makes sense if we want everyone to have a chance at vaccination before opening things up fully.
196,"Vaccines opened to everyone here 4/15, so if it takes at most 6 weeks for full protection (if you get Moderna) that gave the general population 2 weeks from when it opened up, to get a vaccine and be fully protected by 6/15."
197,I think that's reasonable and fair.
198,"We've worn masks for a year now, a few more weeks won't hurt."
199,All these states have something in common.
200,Does anyone know what that is?
201,Vaccine procurement too.
202,"That's what the EU didn't do right, but most of us are doing a good job with the administration of the,."
203,Signed up our 12 year old the first day it was available and had an appointment the next day.
204,"That was the last day our county mega site was open, they were transitioning to a smaller venue."
205,&gt; It's possible with additional trials that Moderna could reduce the dose but it probably isn't worth the effort.
206,"They're working on it for the boosters they're developing:

&gt; Moderna plans to evaluate three approaches to boosting, including:

&gt; * A variant-specific booster candidate, mRNA-1273.351, based on the B.1.351 variant first identified in the Republic of South Africa, at the 50 µg dose level and lower."
207,"&gt; * A multivalent booster candidate, mRNA-1273.211, which combines mRNA-1273, Moderna’s authorized vaccine against ancestral strains, and mRNA-1273.351 in a single vaccine at the 50 µg dose level and lower."
208,"&gt; * A third dose of mRNA-1273, the Moderna COVID-19 Vaccine, as a booster at the 50 µg dose level."
209,The Company has already begun dosing this cohort with the booster.
210,"&gt; Second, the Company plans to evaluate mRNA-1273.351 and mRNA-1273.211 as a primary vaccination series for those who are seronegative."
211,These candidates will be evaluated in a two-dose series at the 100 µg dose level and lower.
212,"https://investors.modernatx.com/news-releases/news-release-details/moderna-announces-it-has-shipped-variant-specific-vaccine

Note the ""*... and lower*"" for all the dose levels."
213,Why does the CDC have 115 countries as DO NOT TRAVEL when many of these countries have objectively not bad outbreaks?
214,"Also, this list includes countries like France that are about to open to vaccinated US tourists."
215,What is the point of this list?
216,[removed]
217,everyone at my work is vaccinated:(
218,Cool.
219,"It's only the Republicans putting other people at risk, though."
220,Because they're selfish assholes.
221,[removed]
222,https://youtu.be/Z7_QQn_2McM
223,"The source has been provided already- but here is the complete excerpt published concerning Lipkin

“I spoke about Nick’s article last week with Dr. W. Ian Lipkin, the renowned Columbia University virus hunter who was one of the five co-authors on the seminal “proximal origin” paper."
224,"He favored a natural origin theory, he said, in part because he had assumed that all the Wuhan Institute’s 2019 work with SARS-like viruses had been done in its top-level BSL-4 lab, which was cleared to operate in 2017."
225,(State Department cables from 2018 raised questions about how well-run the lab was.)
226,"But later he learned of studies with Dr. Shi’s name on them showing that work he considers dangerous had been done in level BSL-2 labs, which he considers highly porous to leaks, not just in 2016, but in 2020."
227,"“That’s screwed up,” he said."
228,“It shouldn’t have happened.
229,People should not be looking at bat viruses in BSL-2 labs.
230,"My view has changed.”
That is still not, as he pointed out, direct evidence of a lab leak."
231,There is no proof of a leak.”
232,"At this point, a lot of the people who were originally saying “follow the science” have thrown that out the window in exchange for “more restrictions = better no matter what.” It’s just a flipped version of what the antimaskers were doing."
233,It makes sense if we want everyone to have a chance at vaccination before opening things up fully.
234,"Vaccines opened to everyone here 4/15, so if it takes at most 6 weeks for full protection (if you get Moderna) that gave the general population 2 weeks from when it opened up, to get a vaccine and be fully protected by 6/15."
235,I think that's reasonable and fair.
236,"We've worn masks for a year now, a few more weeks won't hurt."
237,"Yeah, that's what everyone assumes."
238,They turned any positive cases that came up which substantially reduced the potential of spread.
239,I'm not sure if there have been any similar studies done with the events that have been hosted in the US.
240,Sometimes irregular heartbeat just happens.
241,"I get it when my thyroid hormone is low, and my brother has always had it as a response to stress."
242,"If it happens again, maybe ask your doctor about doing some tests, but it happens to most people at least once."
243,What you just said makes no sense at all.
244,"""Considering"" successful vaccination strategy means it's a cause for concern to you?"
245,What do you think vaccines do?
246,One persons policy approach included calling it a hoax and didn’t listen to the experts.
247,Then embarrassingly got it.
248,The other persons policy included listening to the experts.
249,Put people in positions who weren’t his son in law with good experience.
250,Keep repeating the lies it’s why you guys lost in a landslide.
251,Adults are now in charge.
252,It’s why we are seeing good results now.
253,"When avocado toast is the best you’re going to get because economics is keeping you down you, by God, eat the avocado toast!"
254,"I don't think the biggest problem is actual anti-vaxxers, but just people not bothering or caring."
255,Just look at how few young people have gotten it.
256,[removed]
257,That is a really good point.
258,"Even though I'm in NJ which has been one of the hardest hit all along, we still do have county-based variations."
259,"And I actually just checked here, even in the worst NJ county now it's only 9 cases per 100,000 which isn't bad!"
260,"It's reducing so quickly, even though I just checked a week or so ago the numbers seem way better already."
261,WTF?
262,"I wouldn't say it's useless, lets say 2 countries were at war and they had to deal with a covid domestically - that would shut down production of weapons, strain supply lines, and overwhelm hospitals all of which serve as useful distractions."
263,It's also possible that it was just a research strain in the early stages that later on would have been developed into something more infectious or possibly something much more lethal but less infectious.
264,Either way if it was a lab leak I'd place my bets more on researcher fucking up by dropping something and keeping their mouth shut so they don't get in trouble rather than some evil diabolical master military plan.
265,Where are you wanting to go?
266,"Luckily for us, NJ vax rates are very high and even moreso in my community."
267,"I'll bring my kids into stores for short periods of time, but most of the other things we do are outdoors anyway."
268,I don't plan to bring them to restaurants right now.
269,My kids have been in school since September and will be going to summer camp.
270,Sure.
271,"Do you have a source that includes the sentences he was responding to, so we can know context?"
