,sentence
2413,"Do you trust them, when they test only about 8,000 people a day in the Kansai area?"
2414,I had COVID at the end of December and I still believe I'm recovering from it.
2415,My lung capacity seems to have just now started improving back to pre-COVID.
2416,"Saving you a click:  Argentina, Nepal, Bahrain, Taiwan."
2417,Article has some graphs and statistics plus some explanation for each country.
2418,Have you been to India?
2419,It’s not easy out there.
2420,People try to avoid hospitals (and any government office) because it is too much of a hassle.
2421,Folks in rural India don’t care too much about fevers/minor illnesses.
2422,And what would getting tested achieve for them?
2423,"They are already probably given it to their household members

So there isn’t much incentive in getting tested for majority of the folks"
2424,This post appears to be about vaccines.
2425,"We encourage you to read our helpful resources on the COVID-19 vaccines:
   
[Vaccine FAQ Part I](https://www.reddit.com/r/Coronavirus/wiki/faq#wiki_where_can_i_find_information_about_the_mechanism_and_progress_of_vaccines.3F)

[Vaccine FAQ Part II](https://www.reddit.com/r/Coronavirus/comments/mnitdo/vaccine_faq_variants_chronic_conditions_nsaids)

[Vaccine appointment finder](https://www.reddit.com/r/Coronavirus/wiki/faq/vaccinefinder)


*I am a bot, and this action was performed automatically."
2426,Please [contact the moderators of this subreddit](/message/compose/?to=/r/Coronavirus) if you have any questions or concerns.
2427,*
2428,Is China lying or supressing stats?
2429,"Certainly, there is no way they have literally zero cares and deaths in a country of that size."
2430,Are they in a bad situation?
2431,Almost certainly not.
2432,This is impossible to hide.
2433,China is still not North Korea.
2434,[deleted]
2435,And when was the first?
2436,"I hear lots of complaints of her breaking the rules, but they are all incorrect."
2437,"Her trip to Florida when she banned travel...not true because she didn't ban travel...she said she was concerned about travel, so if you travel to get a test when you get back."
2438,"Her husband breaking the rules by trying to get his boat on the water while in lockdown...not true, because the boat was at their vacation property and she had opened travel to a 2nd home/vacation property about a month earlier."
2439,Several others I can't recall but I know we're portrayed incorrectly.
2440,So do you have something legit?
2441,"If so, please share it."
2442,[deleted]
2443,"I mean, that's not a surprise."
2444,"It's old news that every single western vaccine gets a lot of trolls spreading misinformation about it, while they never seem to do the same thing with Russia's vaccine."
2445,What a coincidence.
2446,;)
2447,If they showed up in support of Trump you bet your ass those liberals would of threw the book at them.
2448,"I think he misspelled ""otter""."
2449,"As in ""well there goes an otter airline."""
2450,It's a common saying.
2451,"I would like to have an educated and sane discussion here to go through the numbers please -

""With those odds your chances of dying from COVID after receiving the vaccine is 1 in 627,329""

\- This comparison assumes that all 101 million people who got the vaccine were exposed to COVID, which is unlikely since the vaccine has been around for 5 months or so."
2452,"So the only way at this point in time to understand the true effectiveness of the vaccine is to see how it's doing against what it was designed for:

1."
2453,"According to the CDC: ""Studies show that COVID-19 vaccines are effective at keeping you from getting COVID-19."
2454,Getting a COVID-19 vaccine will also help keep you from getting seriously ill even if you do get COVID-19.
2455,"""Source: [https://www.cdc.gov/coronavirus/2019-ncov/vaccines/keythingstoknow.html?s\_cid=10493:vaccines%20for%20covid:sem.ga:p:RG:GM:gen:PTN:FY21](https://www.cdc.gov/coronavirus/2019-ncov/vaccines/keythingstoknow.html?s_cid=10493:vaccines%20for%20covid:sem.ga:p:RG:GM:gen:PTN:FY21)
2."
2456,COVID-19 is the disease developed from SARS COV-2 the virus.
2457,"Source: [https://www.mayoclinic.org/diseases-conditions/coronavirus/symptoms-causes/syc-20479963#:\~:text=In%202019%2C%20a%20new,COVID%2D19](https://www.mayoclinic.org/diseases-conditions/coronavirus/symptoms-causes/syc-20479963#:~:text=In%202019%2C%20a%20new,COVID%2D19))."
2458,This means that we can try and gauge the true effectiveness of the vaccine based on data about people known who have contracted the virus.
2459,3.
2460,"""A total of 10,262 SARS-CoV-2 vaccine breakthrough infections had been reported""

These are the number of people known who have contracted the virus after vaccination."
2461,4.
2462,"Case Fatality Rate: ""CFR is the ratio of the number of deaths divided by the number of confirmed (preferably by nucleic acid testing) cases of disease. """
2463,"Source: [https://www.virology.ws/2020/04/05/infection-fatality-rate-a-critical-missing-piece-for-managing-covid-19/](https://www.virology.ws/2020/04/05/infection-fatality-rate-a-critical-missing-piece-for-managing-covid-19/)

CFR is a metric to determine fatality based on number of people known to contract the virus."
2464,5.
2465,"(Jan 28, 2021) - ""Between the first peak in mid-April and the second peak in mid-July, the case fatality rate in the United States fell from 7.9% to the 0.7%–2.3% range, where it has since remained despite cases rising again into an (ongoing) third wave:""

Source: [https://delphi.cmu.edu/blog/2021/01/28/unpacking-the-drop-in-covid-19-case-fatality-rates/](https://delphi.cmu.edu/blog/2021/01/28/unpacking-the-drop-in-covid-19-case-fatality-rates/)

So the CFR of the 'control' is between .7-2.3% since the vaccine wasn't really widely available a few months back."
2466,6.
2467,"The CFR according to the breakthrough cases of  death (if we remove  the 28 people who died for unrelated symptoms) is broken down like this:

(160-28)/(10,262-28) = **1.3% CFR."
2468,"**

The CFR of vaccinated individuals fits within the .7-2.3% CFR range of mostly unvaccinated individuals data from Jan."
2469,So can someone tell me how this shows that the vaccine is actually working well in this context?
2470,"To me it seems like if the vaccine was working as good as advertised that CFR would be a lot closer to 0%, or at least below the .7%-2.3% CFR from the 'control'."
2471,Thoughts for discussion?
2472,"Or he's been an NCM most of his life and decided to ""retire"" from reg life by joining the CIC recently."
2473,Thanks-I was freaking out but looks like everyone i speak to took advil/Tylenol.
2474,Anyway next time just water and electrolytes
2475,I wonder if it made the severity worse by ensuring exposure was from inhalation deep into the lungs.
2476,[removed]
2477,Doesn’t even bother to read the article but has stats to show how aMeriCa bAd.
2478,The article talks about the Federal government distributing doses **to US states** based on demand and not population.
2479,"&gt;	The Biden administration announced Tuesday the federal government will only distribute COVID-19 vaccine doses based on states’ requests going forward, replacing the current system of automatically allocating doses to states based on population."
2480,"You aren't getting downvoted in this sub for saying that, dude."
2481,I’ve never heard that before.
2482,Doesn’t really make sense as J&amp;J is a single dose.
2483,33 million people would have to cancel their second dose to stop at 50% full vaccinated.
2484,1-The news report says he is a Cadet which has to be wrong unless they are accepting old farts into the military.
2485,2- Even a Flat Earther/Anti Vax person would would have to see this as a major professional failure as he is using his uniform for political purposes.
2486,"Giving away two tickets a day through June, and one year pass."
2487,Very misleading title.
2488,I'm guessing that the actual number of people that caught it but were asymptomatic is probably way way more
2489,This is why we can't have nice things.
2490,"Since his mother is fully vaccinated, and he’s halfway, you really don’t need to quarantine."
2491,"But if it makes you feel safer, five days is long enough to know if he has an *extremely unlikely* breakthrough case."
2492,People have to remember reddit is not real life.
2493,"Not everyone is up to date on the science, or as passionate about public health as the people posting on this sub."
2494,I know tons of people that are vaccine apathetic.
2495,"They aren't anti-vaccine, they are just like ""whatever""."
2496,"We need to convince the ""whatever"" set to be vaccinated and that's where things like lotteries come in."
2497,"The hard cord anti-vaxx are unlikely to change their ways, but tons of others that are not completely against it, but for one reason or another haven't gotten it are the people we should focus on."
2498,"Your comment has been removed because

* **Purely political posts and comments will be removed."
2499,** Political discussions can easily come to dominate online discussions.
2500,Therefore we remove political posts and comments and lock comments on borderline posts.
2501,"([More Information](https://www.reddit.com/r/Coronavirus/wiki/rules#wiki_rule_4.3A_avoid_politics))

*I am a bot, and this action was performed automatically."
2502,Please [contact the moderators of this subreddit](/message/compose/?to=/r/Coronavirus) if you have any questions or concerns.
2503,*
2504,[removed]
2505,"Your comment has been removed because


* **Off topic political, policy, and economic posts and comments will be removed."
2506,** We ask that these discussions pertain primarily to the current Coronavirus pandemic.
2507,These off topic discussions can easily come to dominate online discussions.
2508,"Therefore we remove these unrelated posts and comments and lock comments on borderline posts.. ([More Information](https://www.reddit.com/r/Coronavirus/wiki/rules#wiki_rule_4.3A_avoid_politics))



If you believe we made a mistake, please [message the moderators](http://www.reddit.com/message/compose?to=/r/Coronavirus&amp;subject=Removed comment&amp;message=I'm writing to you about the following comment: https://old.reddit.com/r/Coronavirus/comments/nkpi85/-/gzft642/)."
2509,I understand your point but a random journalist should not be publishing pandemic advice and predictions.
2510,Leave that to the medical professionals and the people actually performing the research.
2511,That is not the job for a writer for Vox Media.
2512,They also hacked EMA doing the approval process to get their hands on the data... some big inferiority complex right there.
2513,[Source: Reuters/Volkskrant](https://www.reuters.com/article/us-eu-cyber-idUSKBN2AY0F1)
2514,I'm jealous of all these states running lotteries and seeing their vaccine numbers jump up.
2515,My state will never do it because its leaders must play to a base that largely thinks Covid is a hoax and the vaccines are a conspiracy.
2516,"If my boyfriend just got 1 Pfizer shot 14 days ago, and he meets indoors with his mother who's traveling around but fully vaccinated, how long should I quarantine from him if I want to ensure I do not catch corona?"
2517,"I understand there's a *low* chance of transmission in their case, but I really really don't want to catch this crap."
2518,"I'm not at all vaccinated and due to a current health issue, I'm sure my immune system is in shitty condition right now."
2519,I'm barely sleeping at night etc.
2520,"&gt;French and German YouTubers, bloggers and influencers have been offered money by a supposedly UK-based PR agency with apparent Russian connections to falsely tell their followers the Pfizer/BioNTech vaccine is responsible for hundreds of deaths."
2521,"The French investigative news site Numerama also published extracts from the exchanges, including Fazze’s exhortation to “encourage viewers to draw their own conclusions, take care of themselves and their loved ones”."
2522,And Illinois isn’t in that group.
2523,This post appears to be about vaccines.
2524,"We encourage you to read our helpful resources on the COVID-19 vaccines:
   
[Vaccine FAQ Part I](https://www.reddit.com/r/Coronavirus/wiki/faq#wiki_where_can_i_find_information_about_the_mechanism_and_progress_of_vaccines.3F)

[Vaccine FAQ Part II](https://www.reddit.com/r/Coronavirus/comments/mnitdo/vaccine_faq_variants_chronic_conditions_nsaids)

[Vaccine appointment finder](https://www.reddit.com/r/Coronavirus/wiki/faq/vaccinefinder)


*I am a bot, and this action was performed automatically."
2525,Please [contact the moderators of this subreddit](/message/compose/?to=/r/Coronavirus) if you have any questions or concerns.
2526,*
2527,"You mean like, the same day, in a major news agency?"
2528,[Ok.](https://www.reuters.com/lifestyle/science/immune-system-has-long-term-defenses-after-mild-covid-19-children-may-be-key-2021-05-24/)
2529,"But for EU citizens, travelling between member states is hardly “abroad”."
2530,Not allowing someone to travel from France to Italy because of the vaccine is like not allowing someone to go from California to Texas.
2531,People in the trials were told not to take it so that's the official guidance.
2532,It's not going to measurably hurt your immunity.
2533,Headaches are usually from dehydration though.
2534,Ibu can hide the symptom and make you even more dehydrated.
2535,Next time just use water and electrolytes for that.
2536,?
2537,"I’m one of the only employees at my work to go maskless, I’ve gotten a few dirty looks from mom types but I also wrote “fully vaxxed” and “pfizer’d up” on my name tag for the sake of smoothing tensions and I’ve had a few people thank me for getting vaccinated."
2538,So it’s been a mixed bag
2539,"We had Cheney come to Camp Lejeune to give a speech so it was at least a weeks worth of cleaning, inspections, drill, etc."
2540,Like the fucking VP is going to inspect the shitter at the Battalion office or something.
2541,On the day of the speech every single unit was out and standing in formation wherever they could for when Cheney would drive by.
2542,"We stood there for at least 4 hours before someone realized that Cheney had already arrived, given his speech, and left."
2543,Want more people to take the vaccine?
2544,"Isolate the virus, deactivate it and make a traditional vax."
2545,"65-74 year olds are at 87% vaccinated and still managing to find almost 1% of their population a week to start the process, which is pretty incredible."
2546,&gt;TORONTO -- Health officials in Ontario have recorded the first death of a person with a rare blood clot who received a dose of the AstraZeneca COVID-19 vaccine in April.
2547,&gt;Associate Chief Medical Officer of Health Dr. Barbara Yaffe confirmed the news during the province’s bi-weekly update on its COVID-19 response Tuesday.
2548,"&gt;“Unfortunately, I must report that we now in Ontario have our first death associated with VITT,” Yaffe said."
2549,"&gt;She said the man in his 40s received his first dose of the AstraZeneca vaccine “toward the end of April” and died a “few weeks later.”

&gt;Yaffe explained that while an investigation into the man’s death is ongoing and the final cause of death has yet to be officially determined, it has been confirmed that he had VITT at the time of his death."
2550,thanks
2551,Wow.
2552,There is ZERO evidence that the virus creates the same immunity to other strains.
2553,Why is this hard for you people to admit?
2554,It is scientific and medical fact.
2555,It creates a short term immunity to specific strains but offers ZERO protection from other strains that the vaccine DOES provide immunity to.
2556,Again please grow up.
2557,"Yep, I'm in Munich and it's a totally unfair system now."
2558,"I've got a roommate who's a cancer patient, and I've got 0 vaccine in me so far..."
2559,But my bf who's German signed himself up somehow for Astra zeneca weeks ago.
2560,Ended up getting a Pfizer shot instead that day because they were out of Astra.
2561,"Of course by the time he told me about it, they were out of appointments."
2562,I'm annoyed as hell now because he's extra impatient and wanting to meet up with friends/family like he's totally vaccinated.
2563,He's only like 2 weeks into having 1 shot.
2564,"And there's an upcoming business trip of his where he'll meet a bunch of people in person far away from here, including a bunch more family."
2565,After only having 1 Pfizer shot.
2566,Ugh.
2567,I guess we'll be quarantining from each other a lot in the upcoming weeks...
2568,This post appears to be about vaccines.
2569,"We encourage you to read our helpful resources on the COVID-19 vaccines:
   
[Vaccine FAQ Part I](https://www.reddit.com/r/Coronavirus/wiki/faq#wiki_where_can_i_find_information_about_the_mechanism_and_progress_of_vaccines.3F)

[Vaccine FAQ Part II](https://www.reddit.com/r/Coronavirus/comments/mnitdo/vaccine_faq_variants_chronic_conditions_nsaids)

[Vaccine appointment finder](https://www.reddit.com/r/Coronavirus/wiki/faq/vaccinefinder)


*I am a bot, and this action was performed automatically."
2570,Please [contact the moderators of this subreddit](/message/compose/?to=/r/Coronavirus) if you have any questions or concerns.
2571,*
2572,Same with the flu.
2573,And not everyone gets that vaccine.
2574,Get over it.
2575,"Oh, wish I lived closer, although I'm not sure 6 months is 'close enough'."
2576,Anti-Vaxxers.
2577,No medical and scientific professionals did...
2578,Please grow up.
2579,*laughs haughtily in Vermont*
2580,"&gt;Oh.., he's even lower than Reservists... while technically a Reserve officer, he was a Army Cadet Instructor..."
2581,Which is a youth organization akin to Boy Scouts/Guides.
2582,Not in the Chain of Command at all.
2583,"&gt;

Would that be similar to the ROTC in the US?"
2584,"Dunno how real the news article is, but you can get vaccinated in Russia in just about every major shopping mall or pick a date and time to get vaccinated at your local hospital."
2585,I got my shots on the 29th of April and on the 20th of May.
2586,It was free and hassle free.
2587,"5 mins to set up an appointment via a mobile app, 10 mins for paperwork on your first visit."
2588,And about 15 mins of sitting after you get the shot just to be safe that there is no allergic reaction.
2589,So if there were that few doses I doubt you would be able to get an appointment at any time or date that you wish for your shot.
2590,Your immune system fights it off.
2591,There is a lot of hesitation about the vaccine among Muslims in my country.
2592,This should help I think.
2593,I mean we did.. in march 2020... then stopped by April 2020 when the science said it was pointless/very low risk.. didnt realized ppl were still doing this....
2594,[removed]
2595,Murphy’s really fucking that mask chicken
2596,But it’s United 🤮
2597,"A soldier can (in general) express his opinion, but he can’t express his opinion about government policy, rules, etc."
2598,as a soldier.
2599,Mr.
2600,Idiot can say “I hate the government” all he wants.
2601,OCdt Idiot can’t because he is the government.
2602,If he gives an interview as Mr.
2603,"Idiot and doesn’t mention that he’s a soldier, it’s (generally) a different story."
2604,"He could still be held to account for things (racist stuff, hate speech, etc.)"
2605,but he’s allowed to express political beliefs that don’t mesh with the current government’s.
2606,"Importantly, he isn’t being charged with having a different opinion, but because he urged soldiers to disobey orders."
2607,That’s no longer “I don’t like this policy” or “I think we should vote for this other dude in the next election” but rather “don’t listen to the Sergeant when he says to do X.”  That’s a crime to do even if he was a civilian; as a soldier it’s a REALLY big deal.
2608,(14 years max vs. Life as the max.)
2609,well there goes an other airline.
2610,The fatality rate in the estimates can scale much higher than that.
2611,People are having a difficult time getting medical oxygen and the rural population won't have that at all.
2612,AZ?
2613,Same.
2614,They're not lying and they're being told it's close enough.
2615,It's only one major hospital in the area.
2616,I completely agree.
2617,I would feel comfortable with kids going unmasked in schools next Fall.
2618,I am wondering when the masses will feel okay about it.
2619,"Alas, poor William, I knew him well."
2620,Chinese Communist Party
2621,Hardly anyone here thinks the restrictions are still needed.
2622,Even the ending of mask mandates is celebrated due to so many people being vaccinated.
2623,"Oh, we will."
2624,If we haven't already.
2625,Probably a solid chunk of the remaining 40% have probably gotten covid by now.
2626,"Well, he is 81, so I wouldn't rush to any conclusions"
2627,That's an outdated description of the sub.
2628,"Most users here have been fine with restrictions being lifted after they feel enough people are vaccinated, which is why the person you replied to was upvoted so much."
2629,Wow.
2630,Why can't Illinois do something like these other states?
2631,Really?
2632,Jeez I mean I did it last spring but after it was evident that COVID doesn't survive on fomites I stopped doing it.
2633,Hell I think even oversanitizing outside healthcare settings can be overkill (but still wash your hands!)
2634,"It was an IGG test that looks for the S (spike) protein, which is what the shots do."
2635,I got mine at my doctor but IIRC Kroger carries this type of test at the pharmacy.
2636,Wow.
2637,Brazil's official attribution tracks surprisingly well with excess deaths.
2638,Some US states show higher attributions on the back end of the winter surge.
2639,This is likely due to clearing death certificate backlogs.
2640,But how many thunderstorms compared to contagious humans?
2641,"2nd one was not fun for me, but any effects should only last a day or two!"
2642,good luck!
2643,Europe this summer will be mad.
2644,Already booked trip to Budapest and Split.
2645,It's party time.
2646,"I think an executive branch directing the DOJ's affairs is corruption, and the response to the most corrupt administration (in probably all U.S. history, not just recent) isn't more corruption."
2647,"The verdict isn't out yet on whether ""they"" let Trump off easy, if establishment Democrats are who you are referring to."
2648,Merrick Garland isn't a Democrat.
2649,"He is center right, Biden is center left."
2650,"I think both have their own legitimate, personal reasons to want to shame the previous administration."
2651,"I'm most interested in the civil and state level actions being taken, especially the multiple grand juries in session regarding Trump and family business matters."
2652,[removed]
2653,"Your comment has been removed because

* **Incivility isn’t allowed on this sub."
2654,** We want to encourage a respectful discussion.
2655,"([More Information](https://www.reddit.com/r/Coronavirus/wiki/rules#wiki_rule_1.3A_be_civil))

*I am a bot, and this action was performed automatically."
2656,Please [contact the moderators of this subreddit](/message/compose/?to=/r/Coronavirus) if you have any questions or concerns.
2657,*
2658,[removed]
2659,I just looked up her twitter.
2660,And she fucking sucks lol
2661,This post appears to be about vaccines.
2662,"We encourage you to read our helpful resources on the COVID-19 vaccines:
   
[Vaccine FAQ Part I](https://www.reddit.com/r/Coronavirus/wiki/faq#wiki_where_can_i_find_information_about_the_mechanism_and_progress_of_vaccines.3F)

[Vaccine FAQ Part II](https://www.reddit.com/r/Coronavirus/comments/mnitdo/vaccine_faq_variants_chronic_conditions_nsaids)

[Vaccine appointment finder](https://www.reddit.com/r/Coronavirus/wiki/faq/vaccinefinder)


*I am a bot, and this action was performed automatically."
2663,Please [contact the moderators of this subreddit](/message/compose/?to=/r/Coronavirus) if you have any questions or concerns.
2664,*
2665,Innocent until proven guilty.
2666,"He's still entitled to due process, which isbwhy He's still in."
2667,"I don't know what the scope of punishment is for these charges, but it could be pretty heavy handed, or it could be relatively minor, depending on how it plays out."
2668,"He's an OCdt which means he's not yet received his commission, but he's still held to the code of conduct."
2669,"He's also a cadet instructor, which I think is leading to some confusion."
2670,That's essentially a sub component of the Reserves that run the Cadet program.
2671,CO said they'll be announcing scholarship sweepstake details soon for 12-17 year old's as well
2672,[removed]
2673,Why doesn't earth have an anti meteorite iron dome yet?
2674,What are my taxes paying for?
2675,!
2676,"emphasis on ""low vaccination rates"", not ""right leaning""!"
2677,their politics should never be a part of it
2678,"[NDA 79-81](https://laws-lois.justice.gc.ca/eng/acts/N-5/page-11.html#h-375432)

In a military context, it’s joining together with others to refuse (lawful) orders."
2679,The “joining together” bit is important.
2680,"Refusing (lawful) orders is a crime, but getting a bunch of your pals together and doing it all at once is a whole different can of worms."
2681,According to [CDC](https://www.cdc.gov/coronavirus/2019-ncov/vaccines/second-shot.html) three weeks for Pfizer and four weeks for Moderna.
2682,"Okay, thanks!"
2683,That makes sense!
2684,Got my first shot yesterday and was told my second shot would be in the first half of September.
2685,Excited to be able to move it up a month or two :)
2686,"Although I'm not sure if this is just for higher ranks or not, in Brazil there was recently a case of a general partaking in a rally with the president, but apparently he couldn’t be there AT ALL, uniform or not."
