,date,text
Covid hates outdoors. Came say this. 🤣 I've saying quite time, wanna definitely make people talk get get vaccinated? Make commercial Trump, Biden Obama saying country needs united get get vaccinated help everyone. disgusting  I’d much rather scan QR code phone. definitely ways this. Yesssss! c'mon let's get data 6 months+! confident daycare vaccinating and/or keeping masks day. Awesome. Make new rule. stupid morons locked house, allowed restaurants, hotels, trains planes... now!!! ""real world"" results mass vaccinations started (not phase 3 trials) south american country (I know Chile another country) Sinovac around 63%. Yes  idea means lol fully vaccinated person, I'm fine OK it. Low risk part getting sick (and ""low"" serious understatement). unvaccinated determine acceptable level risk. 

That said, friend group, probably 70% already fully vaccinated remaining 30% already first shot gonna moot point soon. obvious vastly undercounted AZ related blood clots UK. I'm angry that, wonder whether ever admit it. 

Here Canada scientists feel risk turn least 1 50,000, 1 250,000 Brits reported. wish waited Pfizer. Got shamed 'vaccine shopping' strangers take care stroke. important bill we've long time. definitely worth even lost shots. No. Given American production capacity, could exported limited amount day one. Keeping instead would've still prioritised US citizens. judged everything metric, would living life right now.

Also, vaccine safe. cut bureaucratic red tape, safety precautions. sounds right.  guess still better February tho.

Happy Cake Day! Yeah, hosted backyard party neighbors weekend. adults vaccinated three kids wore masks. vaccinated adults wearing masks 80% time kids wearing masks 100% time still one person leave early concerned many unmasked people around.  get paid get spit face im kind desensitized point happens, talk it. want serve least three months house arrest effectively age world made boomers boomers. political choice strict priority system based age either admit virus next harmless young people, admit chose let smaller number young people die save older. 

Let guess, already vaccinated boomer dreaming summer Mallorca? Free weed beer? almost makes want move there… 🤣 assume go restaurants flu season pre-Covid? go store without wearing mask? not, not? assume vast majority people haven’t. depends someone CT from. CT believe still biggest wealth gap discrepancy country. beautiful landscaping, lot areas still heavily forested (on walk home last night work whole family deer crossed road front week saw fox road house, neither phased me) best education schools like Yale, wealth gap apparent. Look photos Greenwich look photos areas New n remind that's state. Yeah shocked absurdity response, although maybe he's way everyday life weeks least. see now. like ""put mask keep 5 months helping others"".  already blocked you. sh&amp;t Sherlock. trials weren’t exactly long term. 8 months-ish starting fifth month vaccines. 

Stop living scared. you’ve mRNA vaccine, B117 essentially effect efficacy. I’d go far say adenovirus vaccines, data produced front. people immunosuppressants double vaccines they’re body doesn’t respond normal dose. something would need discuss doctor feel like need extra dose vaccine. don’t think particularly egregious, even driest statistics misleading information framed certain way. make climate change seem really strong basically non-existent using dataset changing it’s presented example. 

If country one COVID case one day two next „COVID CASES DOUBLED“ would factually correct headline, one sending message I’d least consider misleading. Heh, already therapy. doubt topic comes sessions though. weird, like completely flipped switch one month ago even though cases lowest now. He's first dose two weeks ago well. wasn’t like made appointments CVS three family members. end March/beginning April. let pick day first, time. Granted, like three four days out, let choose it. second doses.

Either way, think lot people probably agree it’s time walk-ins places like instead. law definitely get struck courts. fully vaccinated people getting mask wearing fatigue? Caught walking gym early morning mask pulled immediately thought ""can please done shit?"" know that's wrong ways go (in state) everyone know vaccinated I'm getting increasingly tired  Great, want stand solidarity vaccinating population? Lucky Arkansas kids spend 8 hours day wearing mask. Ah, meant pipe dream scheme hasn’t transferred single piece intellectual property full year existence. (The program meant refer typically styled C-Tap.)

The thoroughly ineffective throughout pandemic; organization refused months even acknowledge *in* pandemic *today* finally acknowledged aerosol transmission year dangerous denials.

The painfully unequipped manage pandemic. It’s huge problem world needs fix, transferring IP isn’t going get vaccine doses produced letting manufacturers actually factories necessary institutional knowledge handle it. Even acknowledges innovative initiative potential middle longer term, aware outset would take greater efforts longer timeframe bring different interest groups together,” spokesman global-access initiatives Covax, vaccine-sharing scheme, relied “to deliver results rapidly”, added. small 'state' fully sorrounded Italy, easy say reached proper herd immunity. Sputnik likely effective (this Russia eager help San Marino, guess). Spain every dose administered, use 95% sometimes even everyweek matters many doses get government wasteful! Oop yep missed that. Thanks! FULLY vaccinated; Says we’re 69% adults one shot holy shit we’re going quick! thankful state full intelligent people. real concern antimaskers antivaxxers try fake spread immunocompromised.

It makes sense keep masking distancing least. Damn it. appointment tomorrow. 

Is late cancel?  Yeah, would best approach target demographic?  started trails, later year. deaths finally going again? mostly making joke there.

AZ absolutely critical Australia. 20M Pfizer ordered (less million delivered?), local onshore manufacturing capability AZ. CSL (an Australian pharmaceutical manufacturer) contract produce 53.4M doses, started production recently.

However, TGA recently recommended Pfizer/BioNTech ""prefered"" vaccine 50. 50 either wait doses PZ/BNT arrive (probably six months more), take AZ vaccine signing disclaimers etc.

Many people avoiding result. Trumps supporters would say holograph that. find excuse what’s best country. pacific northwest full people think covid conspiracy vaccine dangerous...Its frustrating healthcare worker part country. Holy fucking shit!! really lost hopes point 3-4 months ago shitstorm never gonna end. Go UK think missed word “fully,” confused second though hope CCP pays you, honestly. work NYC already seen mask wearing way outside. Since I'm fully vaccinated wear mask outdoors NYC anymore. Ok, great rest folks encouraged get it. NJ announced bunch Promotions incentives try get hold outs vaccinated hopefully states same. also see increase college kids go back fall possible concerns health problem know about, makes feel vulnerable. maybe someone lives with, sees regularly problem. event, give time. less virus that's circulating less worry about, numbers dropping rapidly here. access good masks? decent one might make feel safer. he's fully vaccinated, hopefully soon (some people can't though, medical reasons). he's still anxious months (hopefully) circulating virus REALLY low, getting vaccinated, might need professional help. I'm sure virus related PTSD thing. No, it’s actually well-balanced interview. think going see many 16+ voluntary vaccinations. Probably need wait full approval soft mandates (work, schools, unis...) see accelleration demographics. month ago, CVS give 10M doses. figure Walgreens similar. Even super conservatively say 20M doses, wasting less 1% seem awful. Especially last month seeing demand drop, seem bad me. I'd obviously prefer used, tragedy.

I can't quickly find many doses they've given. found article 4/1 stated CVS give 10M doses. school open, 12 students per day 4 periods. Parents sending students in. I'm room teaching handful students person 25 others online period. US overwhelmed hospitals right now? Even Michigan seeing steady hospitalization decline.. Vaccines + school + youth sports. Come now, seniors got vaccinated Covid cases tanked 65+, Covid cases tanking young adults/adults since getting vaccinated... trend pretty obvious lol Yeah Chile heavily P1 would expect loss efficacy That’s opinion. 
~10% opinion. I’m WA. made appointment went got it. easily passes 16. I’m sure wasn’t technically legal, don’t care. link trend several factors – particularly high vaccination rates among older Americans. U.S. recently announced 100 million people fully vaccinated COVID-19. dynamics also play, new COVID-19 variants loosening restrictions school also worth noting vast majority pandemic, age group highest case rates 18 24 U.S., Centers Disease Control Prevention note kids still represent really small proportion worst-case true. somewhat nuanced conversation though. Michigan, they've reporting higher rates hospitalizations kids [been]. unclear simply represents intense transmission versus actually increased severity. think that's entirely clear yet. Colorado, little surge going on. states actually, cases going down. We're still kind plateau, maybe increasing bit Colorado. seen slight uptick kids hospitalized COVID-19 Children's Hospital, dramatically so, like seeing November, December part conversation severity gets little bit complicated yes, absolutely true less severe kids adults, particularly older adults. also true say completely benign kids. Fortunately, pediatric death fairly rare event. look top 10 causes death, annual basis, year, we've had, depending whose numbers use, somewhere 300 600 pediatric deaths COVID-19 far. That's probably undercount. would fit somewhere top 10, somewhere like No. 6 No. 9 terms causes death point I'm making, yes, less severe, still potentially severe disease. We've seen tens thousands hospitalizations already. need vaccine children, protect, achieve herd immunity, also protect children themselves.

…

Article continues Yes big difference. Turkey time wild type variant Brazil mostly P1 Chile also suggesting 55 60% efficacy mostly totally P1 troll headline? live Friend, disagree you. respect you. good night also know people are/were vaccine neutral waiting convenient walk-in locations. also know people waiting full FDA approval, think reasonable benchmark. Getting two groups vaccinated going lot easier breaking true anti-vaxxers. sent back school soon, unvaccinated, concentrated sealed boxes sharing air eight hours day, airborne pandemic raging, idiots! Probably lowest late 2019 honest like October November can't wait see youngest nieces nephews person! definitely relate hesitancy jump back in. There's need rush live area still putting high daily numbers. I've able things vaccine good masking, put previously. getting easier. helps lot local numbers low. aren’t vaccinated yet? may aware, bank/public holidays particular constituent countries UK. e.g. English bank holidays Scottish bank holidays... meaning ""bank holiday"" different England Scotland :-) NY Times confirmed story made appointment 12 14 year olds state site next week. wouldn’t allow use real birth years, made temporarily older system catches up. 

I think public school vaccine issue probably largely dependent live. Unfortunately probably along red/blue lines now. case dad suffering advanced prostate cancer. money pit. spectators Olympic village athletes stadiums ready go don’t vaccine yet Good luck you! Yep. “WhAt VaRiAnTs” Good you, thing. I'm telling to.

Rather, I'm explaing I'm going counteract 95% reduction risk things greatly increase risk, community spread low enough provide additional layer risk reduction. 

And take much longer am. People getting vaccinated cases starting go way down. Pretty soon reduction risk lack community spread dwarf individual protection vaccine. resume normal activities. expect full FDA approval? 250+ million doses, 100+ million doses, 6+ 
months data ever collected analyzed around vaccine. world delay for, especially Moderna/Pfizer? nice. Where? I'm 25 California got first dose back February. vaccine opened literally everyone weeks ago within 2 weeks everyone wanted one able get one. demand fallen cliff 40%. There's restaurant/bar near NJ that's pretty much ignored capacity rules since went 50%. ate lunch day packed. Text zip code GETVAX (438829)
Or VACUNA (822862) Spanish 

Will respond three vaccination locations near you.

Pass on. specify: exactly mRNA vaccine feel justified? cannot refute give specifics. bit specific ""safety testing"".

I'm trying make story you, must understand many currently making story vaccine. get 14 year old vaccine already? I'm aware choose get now, age group got emergency approval yet? think thats... legal lol. wrong would love learn. Need get 60% overall July-August. Ideally 70% fall avoid winter wave altogether. Probably wouldn’t big anyways, would rather none smaller one. work midtown. city hurting cash right now, think could stay locked longer. Pay wall :( suggested people get vaccine also said it’s right get something dumb along lines. 2 year old 5 year old here. Can’t wait it’s approved kids We're talking VACCINATED people here, buddy. Meaning risk serious complications post-Covid-vaccination LESS risk serious flu complications. whenever finally feel comfortable emerging society again, flu risk big concern, Covid, since greater potential threat you. 13 joined cross country running team, wasn’t tall son 16. Normal teenage food plus adding running anywhere 10+ miles day. grocery bill likely glad little brother didn’t get organized sports. *Let's run government like CVS pharmacy!* Ohio data example success efficacy vaccine. 

I also linked data posted another thread CDC data significantly better trial data. 

Your comment “1.8 MM people wouldn’t gotten Covid” weren’t taking risks assumption. 

Even so, vaccinated, expand behaviors confident risk contracting Covid lower. 

Why world getting vaccinated - expectation significantly lower risk contracting virus do, won’t serious symptoms, need hospitalization. 

Basically guys point data young sample size enough. 

I disagree - 96 MM vaccinated far greater sample size trials. trials 8 months long. giving vaccine since mid Dec. 

And current cases significantly less trial periods. Aw hell EDC Vegas moved October ,now there' sa second chance cancellation. I'll gladly wait 2022 though means things 100% safe. Okay then, you’re much better everybody else. won’t missed. might slightly less last monday basically steady past week so, cases continue go deaths ￼I wish vaccinated-only events. I’d chum masses then. Plus it’s like reward acknowledgement right thing. there’s relief around people actually care. Right vibe area “Don’t ask, don’t tell. Also, lol, believe vaccines/COVID?”

Lots businesses happy give rewards signing dumb email ads year older. vaccine related promotion I’ve seen one donut shop dislike.  I'm nervous too. much still infected second vax readjusting social anxieties gotten 2018-2019. Little afraid cat callers street harassment bolder, little things like that. point is, are.

They want stay home themselves, want force us to, makes unacceptable.

I force someone go things they're vaccinated, people sure fuck would force stay way.  comment linking facebook.com automatically removed source may reliable may dedicated mostly political coverage. possible, please re-submit link reliable non-political source, reliable news organization recognized institution.

Thank helping us keep information /r/Coronavirus reliable!


*I bot, action performed automatically. Please [contact moderators subreddit](/message/compose/?to=/r/Coronavirus) questions concerns.*  read article. supposed take things like this?

“The goal “a generation two” would transition coronavirus cold-like virus easier control, experts told newspaper.” He's probably taller too. Kids grow like weeds. Id manage expectations bit. point lift regulations NJ, excited family lives there. herd immunity. CDC's latest would need 90% vaccinated get immunity, expect ever will. However, expect people vaccinated, additional risk. Since anyone wants vaccine able get one end summer likely fully vaccinated point, point maintaining restrictions. WA governor hoarding anything, redditor lying. I've always Pfizer vs Moderna vs J&amp;J tattooed arms. Would make cool story tell grandkids Yeah, live couple hours Sacramento people getting vaccinated, case numbers going up. it’s weird see articles saying California cases low see something affects schools accept state funding. realize younger people recently, could even get vaccine begged it. CDC reported last week vaccines 95% effective preventing hospitalization. correct, 100%. I’m willing take chances 95% go back living again. Also ice pack spot couple minutes makes hard feel needle live WA lying. Many places King County (by far populous country) allowing walk-in vaccinations without ac appointment. counties literally begging covid-deniers come get shot. I’m waiting. I’ve 14 year old done already. Six months isn’t really going make much difference youngest 11.5. :) Scaling global production requires sharing manufacturing processes expertise addition IP waivers. putting together system international cooperation knowledge sharing could done, Gates used money influence inside organization put stop facilities around world could've making vaccines route open science manufacturing processes pursued. answer Make sure keep least 6 feet away lions, gorillas, carnivorous bears, etc enjoyed made story people phones. that, SF still lot terms social distancing, mask wearing, etc.

But that's point, much complicated ""well, natural immunity."" really think ppl going continue wearing masks lives disrupted year half?
once masks done, i’m done. I'm talking mistrust CDC...? Stable public health low threat infection guess? live NY we’re technically longer required wear outside, people still less ~35% population vaccinated. imagine less less people care wear mask higher number goes. terms governmental control, can’t really buy idea people power jizzing they’ve required masses cover mouths/noses cloth. It’s science-led public health, intellectually easy get behind one recognizes half million people died disease country Sarcasm. country safe reach herd immunity. Otherwise threats continue come outside. US infection rate explode, like India. trick getting vaccine-neutral vaccinated make easy possible them. Find walk-in clinic, offer drive there. Add bribery need to, got two sisters vaccinated telling time place get vaccinated, arranging transportation childcare them.  know long covid permanent though? People ls conditions improved time especially vaccination. wonder much true covid anxiety much people found enjoy quieter lifestyle living before? Everyone gets infected offers another chance bad mutation. vaccinate everyone reach. went outside week vaccinated WTF??? Everyone still wearing masks!! ridiculous.

How much longer supposed wear masks for??? Impossible talk strangers without feeling like weirdo. made statement you. exact comment related ""Most people know"" even made concession ""I'm sure that's true everyone"". Based personal experience (once again, important qualifier), exception rule.

Beyond that, difference EUA full FDA approval amount time test. Full FDA approval requires least 6 months. Vaccines show major issues within first weeks most. regardless, receive full FDA approval within next month two. People like able get it, people know find another reason say unsafe. Again, *extremely* privileged outlook, made-up story homeless acquaintances notwithstanding. USA update first dose shots:

470,722 first dose shots. Last week 991,183

7 day rolling avg 935,439. 1,009,790 yesterday.

147.5m age 16+ first dose - ~55.4% (147m - ~55.2% yesterday)

145.3m adults first doses - 56.3% (144.9m - 56.1% yesterday) 

82.8% 65+ first dose (82.7% yesterday) 

44.4% (44.3% yesterday)

At rate, first dose shots:

On

May 15th - 158.7m

May 31st - 173.7m

**16+ population numbers (based 266.3m population)**

On


May 15th - 59.6%

May 31st - 65.2%

60% 5/16

69.420% 6/12

**Total population numbers (based 331.9m population)**

On

May 15th - 48%

May 31st - 52.5%

50% 5/23

60% 6/27


**Assuming follow % people willing take vaccine (based 266.3m population)**

60% (~159.8m people) - 92.3% way done

70% (~186.4m people)- 79.1% way done
______


Rough day need remember end game. 

Hopefully 12-15 gets approved week see nice little bump them. Numbers adjusted approved. state might (for while) - states sure.

Also keep mind children get it, that's parent/guardian's decision whether ""want it"" not. course could go ways. Or, 90% vaccination + infection. Vaccination serve limit body count get point, though. trend, India may reach casualty one year. still important thing now, idk is. Maybe you, coz freedom. Big brain time, NPR  dont think message, people thought wont get enough crowd worth everyone said nothing would happen Florida. Text book American living Canada helps understand Canadian culture much. Thank you. means wasted hundreds million vaccines. Alright world anyone slightly higher normal BMI taken parents set fat camp probably want parents executed re-educated too. me. whole office vaccinated we've stopped wearing masks building, I've gone eat times, seeing friends more. fuckin awesome. fantasy land Dentist.  
Please don’t bite. Ok, bite. job? Good hear.  also don’t need wait vaccine shipped distributed.  capacity already there. Miami pretty much walk CVS’s get Pfizer vaccine.  Worst case make appointment next day. Wow, data incredible. Kind hard picture seven-one thousandths one percent much less one-ten thousandths dying. Yes heard so, too. also seemed like earlier year US keen trying change policy quickly. DPA could've revoked time afaik. 4 million doses AZ could exported (token) ""loans"" Canada US - circumventing Trump's contract clauses. would've possible AZ doses, maybe even producers. I'm denying legal hurdles though. least social media article seems require subscription could summarize copy/paste? thats bad dude conservative Brazilian coworker says communist propaganda! denies pandemic problem Brazil! read multiple places piece protein. case right well, virus safe, less 1/million issue past immune response. 

The problem people use something like ""the vaccine produces spike proteins"" scare tactic... purpose? prolong pandemic? hope works!!! really difficult time since January finding vaccines entire family. last get 2nd dose Sat!!! sore arm amid mild 2 hour headache first (but could stress wondering going side effects. lol). quite sleepy second.  also overrun people thinks vaccines gives immunity infection lol There’s sortable chart end NPR link. 

From chart: 

Iowa 13th adult vacation%, 8th 65+ vaccination % 24th one dose administration 6th percentage total vaccines distributed. That’s better most. 

If link data indicates different, please provide it. internet probably mistake  depends live, cant make general rules without knowing situation is. would complain limited amount. US owe anything. long time. No. got big brain telling im anti science genuinely wished moment someone would nuke world. can't take anymore That’s rather awesome. I’m two weeks well haven’t gone anywhere...yet. basically phase 1/2 trials, determine optimal dose. Essentially vaccine want one size fits idiot proof though. 

Basically ship boxes anywhere same. less steps better, especially want vaccinate population globe 1-2 years. ""and stupid Pfizer kid came said 'I heard Canada last year ate dog'. explain whole class teacher heard part story"" Since people aren’t dropping dead vaccines pivot say latent effects line That’s unfortunate. district sends emails parents staff someone school tests positive. list school though unless someone close contact told information. *clearly* said does, fact, find quite annoying... even read said?  testing indian variant? Same.  I'm fully vaccinated WANT go places leisure still wear masks.  reason we're taking kids Disney World going cruise later year - I'm paying money fun mask constantly.  Thank you! mostly looking see anyone experienced delayed symptoms made appointment get tested tomorrow morning we’ll know sure. I’m curious. Idk helps reassure extremely unlikely event vaccine-caused health problem long-term effects, Canada-wide program help support financially recovery. 

Also linked article including instances multiple types clotting events, rare/serious VIPIT. Best get tested. one online forum really give concrete answers. Good luck both, thanks getting vaccine! post appears vaccines. encourage read helpful resources COVID-19 vaccines:
  
[Vaccine FAQ Part FAQ Part appointment bot, action performed automatically. Please [contact moderators subreddit](/message/compose/?to=/r/Coronavirus) questions concerns.* testing indian variant? Nice job   requires sharing manufacturing processes expertise 

Which requires government action even would produce global production.

So link article Bill putting together system international cooperation knowledge sharing could done, Gates used money influence inside organization put stop this: 

This incorrect. Even article said would facilities around world could've making vaccines route open science manufacturing processes pursued.

 know fact how?

And incentive would Pfizer, example, spending billions without IP protection?

Why wait? company wait another go first fail succeed?

