,date,text
Seattle far fewer people per 100,000 get covid. would feel good NYC's plan lived there. That's normal Pharma. Even average. what? whole bunch industries technologies wouldn’t exist without government funding. doesn’t mean companies aren’t entitled profit. 

These vaccines wouldn’t exist without companies researchers, don’t understand argument. potential profit makes 10’ish vaccines worldwide possible year, otherwise it’d risky.  really well. don’t trust people smart tbh numbers dropping record low levels. issue people [went full tilt lockdown won’t get vaccinated left seem think overcaution way go, making people right question effectiveness vaccines,” Gandhi told me. Public figures policy makers try dictate others’ behavior without scientific justification erode trust public health make people less willing take useful precautions. marginal gains staying shut might justify potential backlash. MRNA HIV vaccine heard ? FWIW article poorly written  There's rational reason think would prevent that. They're different vehicles delivering largely antigen. seeing experts recently say chance reaching herd immunity

People put way much thought ""herd immunity"" sort talisman. not. greater percentage population immunity vaccination prior infection, slower disease spread less likely non-immune person encounter it. magic number suddenly disappear though. celebrating fact 56% adults US received least one shot vaccine, yes obviously pushing get vaccinated, lamenting ""we'll never reach herd immunity"" whatever even means. Get vaxxed get axed. super hot, AC India surging seasonality means drop?

Not OP, best guess combination of:

* Different variants better different climates (e.g., South African variant, barely got anywhere UK); and
* Supposed seasonality largely reflection people's behaviors (e.g., Covid surges people meet indoors, rather coldest such). NYT story may never reach herd immunity anti-vax holdouts sending anxiety spiral. fuck supposed society, keep waiting people trust scientific advances? funny people way get back normal avoid years Zoom, elbow bumps, masks, trust Crazy Aunt Hilda FB confirm priors hold rest us back. want wrong this, esp. herd immunity impossibility part. many public areas? Yes. restaurants, bars private gatherings either. Storytime! :-) Yep. Basically comes is: terminate almost reason, except limited number reasons would considered discriminatory, one them.

The exception could maybe see someone part established religion specifically allow get vaccine/inject anything etc. case, would turn issue workplace safety etc. 

Sort like US military, beards/turbans banned long time safety reasons. anyone military request waiver allow facial hair/headwear kind, that's it: get waiver, *allowed* wear those, *right* remain employed. dude passionate thread titles.  CDC guidance March indicated need quarantine COVID exposure vaccinated

Can someone tell Canada? Got 5% population city quarantine due exposures last days. People fully vaccinated required quarantine someone house *exposed* COVID, *has* COVID, contact someone does. insane. added relevant data. BTW much higher virulence meant even short exposure time carries high viral load. effect antibody efficacy. Maybe uneven distribution explains cases kept coming even overall infection percentages inferred death count quite high. Good hear this!

I hope least -some- under-12 group gets approved relatively quickly, also. son 11, turn 12 right around time I've seen lot folks guess it'll come available under-12 (end year/start next year) applies testing done early.

In countries overwhelmed, lot people tested go hospital, happens they're close death.

In India's case, deaths might lagging behind cases days. Everyone still wearing masks. used talking point anti-vaccine forces spreaders misinformation. assure full licensure absolutely nothing stop them. claim simply bribe FDA Pfizer, nonsense make seem full licensure real thing. good, honest people bound encumbrances reason.

What full licensure allow organizations mandate vaccine. Admittedly, it’s clear couldn’t already this, remove doubt.  Let's put way: Pfizer started company producing food additives. point, world's leader citric acid manufacturing, used mold precursor. became pharma manufacturer WWII, adapting mold breeding process penicillum mold, point supplied something like 90% penicillin worldwide. And, yes, made profit this.

 Since then, Pfizer instrumental bringing many new critical drugs market.

 Yet criticism brought Pfizer back then: simply profited nature's penicillin. describes sentiment really well. decided ""good enough"" instead actually ending pandemic. Reminds beginning get together try stop initial spread.  [CDC report age-specific dose number information CDC, data Texas represented figures. question almost impossible tease causes effects, look graph New York City cases impossible notice near zero cases summer, mountains cases last winter/early spring, year. respiratory viruses seasonal numbers show seasonality. goal prevent mountain cases showing next fall.  people keep denying severity problem grow serious

This seems sub now. see many people downvoting want get back ""normal."" I'm still wearing mask one thinks I'm anti-masker.

no offense, really dumb reasoning.

follow science. fully vaccinated want wear mask outside, CDC saying ok, wear one. gives fuck people think. lunatics judging way.

obviously long mask mandates still wear one indoors, everyone afraid judged shamed going back normal, forever stuck bullshit Covid lifestyle. mean category 5 hurricane gone? Novavax Curevac great new additions vaccine lineup. Curevac mRNA seems work well, Novavax peptide + adjuvant based technology also seems work well. Maybe get hesitant people get Novavax jab like idea traditional vaccine technology (similar flu vaccine)? Yeah quite wrong..Lol troops pulled Afghanistan year.  want stay home themselves, want force us to, makes unacceptable.


That's one hell generalization, boss None profits vaccines (and many drugs) would even possible without government research, don’t really understand argument. Pretty sure venn diagram people 'overly love America', 'anti-mask', 'vaccine hesitant' one circle. City fully opened rumor mask mandates stay place next year. I'm sure agree ""fully opened"" first Pfizer produced soreness arm went lymph nodes three days. second shot anything. dying horrible disease little motivation most. ironically, tied stimulus vaccine would lines door. Yes! want infant vaccinated ASAP! November, baby almost 1 year old. Seven months unprotected daycare makes anxious there's nothing else done besides daycare teachers getting vaccinated continuing current safety measures shit saying penalties honestly fucking insane lol. Imagine flu shot travel shit. news children’s timeline legit made day. three kids six cannot wait fully vaccinated. Israel rigourous testing CDC did. Lol too. 

So happy though. may right, say claim got vaccinated get COVID. employer could fire think lied vaccination. guess worse case scenario, get fired. has, right: people generally respond, even respond negatively celebrity campaigns.

But rather cite source, I'm going slip Chappelle here: yea lol, theres inflation almost every single year last 70 years ask yet? poorest state India, medically challenged even best times. Covid caused lot devestation. Also moderna anounced started working toward two weeks ago. way. People need fucking grow pair, god.

Why people fucking awful gauging risk? 

At literally point past 12 months, remotely scared COVID.. 99.5% chance shrugging I'm early 30's fit guy. 

0.01% less chance death. 

And assumes I'd actually catch it, given. We're already exporting vaccines, article says third shot likely required 6-12 months first, all. 

So concern really rooted reality. sorry, 0% chance happens. Likely. appear bit different:

""We observed weak association increased T-cell response vaccinated Moderna compared Pfizer. Though subjects needed confirm validity trend, difference could consequence higherdoseof mRNA Moderna vaccine compared Pfizer""

in annoying go watch fireworks -- traffic, crowded, really hot &amp; humid, kids staying late school night, etc., etc. really miss last year. absolutely terrible.  Fourth July lit. 🇺🇸💥💥💥 That’s.......kind genius IMO. disagree trying say, think statistic reliable. observe cause transmission vast majority infections (somewhat pedantically observe cause anyone make really good guesses cases). possible true number way higher. got sick unmasked person street coughed you, able tell outdoor transmission. either really confused arguing bad faith. never said wanted go around ask people vaccines personally. said pro enforcing people get vaccines societal good bring. we've done life school college requiring people get vaccines.

I'm pro vaccines requirement job, requirement anyone wants live interact society. getting vaccinated helps everyone, preventing creations new variants protecting might great immune system.

Beyond makes sense businesses require means workforce take less sick days shows employee level education least willing team player instead caring one around them.  want nothing fully vaccinated 4 weeks first Pfizer still dealing extreme restlessness insomnia... don’t know do! think lot companies benefited covid mom pop shops taking biggest blow. you’ve sort make effort go get it. take people - pop ups communities, businesses, sporting events, etc. - better coverage you’ll get neutrals. tell Moderna farther along 12 studies. company given definitive progress reports though, guess. However surprised Moderna gets younger group first. I'm hoping race actually - faster get young kids vaccinated better. $ex? Asking friend. Ignorance stopped good excuse least decade ago. We're internet age now. hard find real information virtually topic. someone really 'hesitant' 'full understanding', well they've *months* educate themselves. somehow managed find time? 


At point, 100% people claiming they're 'hesitant' anti-vaxxers hiding behind bullshit excuses save face. Excellent point!!! makes anyone feel better, hardly felt it. would possibly get caught? state local federal registry. They'd call place claim got vaccination place gives info without consent HIPPA violation. feel like showing face public much fundamental right driving vehicle intoxicated.  Cases beginning fall DoFo's province. paraphrase Wes Mantooth: ""Even guy can't think something!"" literally didn’t even feel mine ask guy stuck yet. think nuanced. evidence largely suggests outdoor transmissions rare mask wearing needed (both based evidence + accumulated knowledge past viral transmissions). However, Covid-19, public health guidance treat Covid-19 utmost caution due novel nature virus. CDC guidance based science still decided over-rotate safety aspects mask wearing enough accumulated evidence.

I'm willing bet decent amount money scientific commentaries around outdoor transmissions hedged lot ""it's unlikely."" Certainly commentaries based science strong theory based assumption airborne virus like Covid-19 behave similar airborne viruses decent amount accumulated knowledge in. Lol booster end necessary due variants original two doses wearing screwed. fully vaccinated people thread already saying get booster. already going reach herd immunity first two shots boosters end needed keep protection even less people protected near future. Community protection drop point Covid comes roaring back. first world problem have. wish needle fear thing held back getting vaccine - rather availability vaccines. think they're going die
.. care killing others Unless slam dunk case, plaintiff front money. Attorneys work contingency iffy claims. friend lives Noida say many dead people running wood burn bodies. 

Rich people fleeing country Europe Thailand places several cases police used take oxygen tank patients give VIP patients. 

It really hard listening Signal, holding tears back. really sad! Pfizer booster based SA variant months later!

ALL ANTIBODIES joke, seriously shit needs stoo Getting vaccine approval people 16 probably help, too. lot unvaccinated places kids. it’s flu season there’s outbreak going cancer otherwise immunocompromised baby it’s really common  completely ignored entirety conversation lol

""But so-called extreme weather attribution studies clearly repeatedly found climate change exacerbates heat waves, help create conditions wildfires burn intensely spread rapidly.""

from Cannot come soon enough! Finally feling good in-person school fall 1st grader! ethical lawyer would take money people trying sue business meeting CDC guidelines order try force employees get EUA vaccine legally questionable manner. legal threat go 'both ways'. Looks like 12-15 year olds, Pfizer requested emergency authorization April 9th could granted late week next week. So...a month-ish? sure lag longer younger kids one adolescents interesting recent benchmark. /r/selfawarewolves Vaccine free. want, even tell person giving vaccine currently insurance. note down, bill state. attractive bridesmaids? big hurrah reached 3m covid vaccinations day.

Well 3m day year, every year, flu vaccines.

So got process place mass-vaccinations year. need adapt covid vaccines, seems do-able.

So personally, much doubt getting booster hard getting first shots. insignificant number people feel like vaccine EUA tested enough, waiting fully approved get it. approval removes one barrier hesitancy.

Full approval anything 'hesitancy'. Precisely *zero* people claim ""it's emergency authorization, bro"" absolutely *any* idea difference EUA full authorization. propaganda talking point got anti-vax FB support group. know means, care. instant vaccines receive full approval, dumb happy asses jump right next bullshit excuse take it. would need percentage vaccinated israel see cases falling? I'm sure common was, Hep B lives surfaces much month cases. common AIDS, lot transmissible. press conference yesterday, Public Health said partially due reporting lag. time, look number deaths episode date rather they're reported, county averaging maybe 4 day. Lamont

I'm assuming fall fairly quickly - MA/Boston seem outliers days. LET GAMES BEGIN Problem developing world lack money royalty. lack resources corruption. I'm guessing talking India rn. example, gave thousands crore worth contract manufacturing ventilators. One companies exist three months ago. failed deliver order. 

I trust vaccines trust government check maintain quality standards manufacturing vaccine.   Kind absurd study most, patients see ICU severe Covid Heparin drips. Which, much powerful anticoagulant. ""This time GME's definitely dying! I'm sure it!"" already inflation ~~concerns.~~

FTFY facilities territory? Sure lets redefine social contract thousands years vaccine drive WV plateauing generally stalling out. governor throwing around interesting ideas hit 70% (that's wants dropping mask mandate). interesting see actually implemented. $100 payments &lt; 35 still work They'll take clinics fixed sites mobile sites high-traffic areas, said. include places fairs, festivals, church parking lots, sports events, parks, bars restaurants, malls shopping centers, community civics business They'll accompany homes visits Meals Wheels, senior services home health agencies. hospitals they'll vaccinate patients discharge. They'll open availability doctors' offices want encourage businesses offer vaccine-related discount ""It may even come this, we're going door door, "" said. ""If go door door we'll go door I'm doubting issue year two. BioNTech know (or capability learn) make billions doses vaccine?

Really, collaborative effort. BioNTech brought mRNA research, Pfizer brought capacity necessary clinical trials manufacturing muscle turn work product could put billions arms. Always like Biden make July 4th official Víctory day covid looking press conference rn

I want direct word word copy speech Independence Day, maybe word aliens replaced Covid-19. we’ll get enjoy restriction-free summer ability actually travel abroad relatively free without treated like common criminals. I’m ok failing. ok trying  Can't help picturing everyone living cowboy hats/boots karate gi's. It'll mid-July shall see  decent amount literature indicating people really respond ""I'm celebrity, please listen me"" outreach efforts? local church/doctor/school/other localized trusted person. currently available online, question surrounding whether effective producing immune response given risks associated Covid-19 infection cirrhosis, seem downside getting vaccinated Covid-19. 

&amp;#x200B;

Article reference: Getting vaccine going much better getting infected.

If me, would want totally sure injection deep muscle hit vasculature. 

Some mRNA adenovirus land liver regardless. did, variants running wild among anti-vaxxers high numbers cases still... Tried taking toddler yesterday play place 75% people took masks inside. People refusing we're never going reach herd immunity. since best incentive DYING already exists

Yeah DYING GETTING BOBBLEHEAD DOLL even better /s watch attitude im downgrading l.a. 3 spite remember that, recall device drawing blood much like that. found spread AIDS (they reuse needle, rest machine well cleaned) used anymore. bad, quick painless unlike now. Lets return back normal, back normal cases 0 right variants destroying India. already inflation concerns. see moderate democrats let alone republicans advocating another stimulus check almost circumstances. understand phobia.

&amp;#x200B;

***persistent, excessive irrational **phobia** type [anxiety defined persistent excessive fear object situation

&amp;#x200B;

In addition memory, amygdala also triggers ***secretion of*** ***that affect*** ***and*** fear aggression response initiated, amygdala releases hormones body put human body ""alert"" state, prepares individual move, run, fight, defensive ""alert"" state response known [fight-or-flight I'm quite mandate skeptical, biggest gripe simply governors unilaterally imposed restrictions without balls say ""when hit X, we'll lift mask mandate"". seemed like great chance kicked road indefinitely. I'm elated Governors coming publicly making statements. makes much difficult later change minds without incurring significant backlash. hoping Cuomo makes similar announcement coordination Gov. Murphy NJ Governor CT (can't remember name). 70% vaccinated masks. Question potential 3rd Pfizer dose. got vaccinated J&amp;J month ago. know currently studies done UK vaccine mixing plan results June see safe effective is. wondering potential 3rd doses Pfizer (and maybe Moderna) mean got J&amp;J jabs. Would J&amp;J own? people got J&amp;J even need get 3rd booster? 

I know efficacy numbers fairly close Pfizer/Moderna J&amp;J (after month). I’d love maximize protection even still continue stay work home, also option visiting family haven’t seen 1 1/2 years. ambitious goal he's announcing like confidence plan place.

Now time incentivize vaccinate, got vaccine offer $100 I'm going salty. takes vaccinate I'm open it, lets get 70%! could always encourage people get vaccinated Friday. way weekend recover need it. 56% adults gotten far.

That means need ~32% people haven’t gotten yet get next 2 months order meet goal.

That’s ~36M adults next 61 days, **~592,000 first doses among adults per day.**

Our 7 day average currently ~950,000 first doses day, steadily declining. 

Assuming rate continue decline, it’s going close, think it’s achievable provide incentives vaccinated. CT signed law (last week) repeal religious exceptions required vaccines starting 2022. Children allowed attend public school unless vaccinated per CT requirements medically exempt. child currently school w/a religious exemption grandfathered graduate. CT 6th state religious exemption. lawsuit filed day signed law; ""The plaintiffs alleged state violated First Amendment right free exercise religion rights guaranteed Fourth, Fifth Fourteenth Amendments. also claimed unlawful discrimination violation Individuals Disabilities Education Act."" That's extremely common symptom hundred different problems, doubt anything vaccine unless first dude new niche side effect hundreds millions people taken vaccine. People ""irrational"" fear treated irrational, confined accept vaccination. ""Irrational"" people allowed endanger sane.. dead yet! Lol, places need work vaccinations, people never wore masks first place True take get pandemic guess  long residents stay there.... course virus isn’t FDA approved won’t know full extent COVID damage time passes either. people reasons. 

Still suppose positive hopeful right course maybe something simple like paying folks get jabbed enough.  Yeah forgot 56%! adults first shot, actually could well possible, need massive advertising campaign.  already roaring 90s dot com crash ca. 2000-2001, housing market crash 2008. Yeah. got really close edge disaster US cities, started lot resources poorer Indian states. India’s gone ledge hard. going run arms. need incentivize people getting vaccine fence. That's me. really want get vaccinated. tons open appointments J&amp;J near (so need one dose). would described severe fear needles. I've pulled page make appointment dozens times can't it. start panicking thinking it. That's exactly thinking, that's big goal imagine solid plan they're announcing like this.

This genuinely makes little hopeful future. even there's source, think worry comes market.  Maybe never happen. probably till get children eligible. able vaccinate 16 right making reaching herd immunity much difficult. children become eligible likely reach it. Maybe add crowdfunding goals policy: *Reach 70% legalise weed.* Yes, 50/50 gross profit share (excluding China, works Fosun). Yes still label ice cream trucks. they're handed ice cream, someone sneaks around back truck, surprise jabs them(J&amp;J necessary since back), hands cdc card. dont remember age probably woud want forget. worry alright. Ya, evidence third shot much weaker original studies. Depending things go long immunity lasts (we really don’t know all), might given people weaker immune systems (old cancer etc) high risk (health care). 

But let’s honest here, everyone making go along. I’m pretty sure vaccinated personally know multiple people “pro-vax” haven’t taken steps needed get theirs. don’t get personally. [Hey that's actually pretty Yeah know. Vegas put betting odds whether goal going hit think people would put money side. Many international flights already require vaccines diseases youre already required vaccinated several diseases going public schools. Lol. Chinese extreme contact tracing Wuhan. 7000 cases traced, linked one outdoor transmission. literally gone brother. Explaining process IRB submission, Serious Adverse Event reporting, data analysis... everything. response 'oh.. get advanced degree mRNA science? know scientist.' maddening. spent hours explaining trust system. know safeguards there, deal daily, done 2 decades. sat there, waiting try 'gotcha!' actual scientist studied mRNA. (spoiler: he's eithe

The people waiting FDA approval going move goal posts. politically correct way refusing. full licensure allow organizations mandate vaccine. 

California already mandated college classes fall. military whatever wants I'm sure hospital chains mandate whatever want. mean, also think that's reasonable thought, US done vaccines past specific areas. gotta get Yellow Fever vaccine going Ghana Kenya example. Great goal vaccine ""hesitant"" indoctrinated ""alternative facts"".

Can't see one getting accomplished many people refuse part society. dying disease motivator people already dying disease. Also bunch still convinced hoax numbers faked. Yup need check tied getting second dose pfizer/moderna single dose j&amp;j. Tell people get $500 get vaccinated, actually it. someone fell ""vaccine hesitant"" camp first started, made appointment shot #1 Saturday know 2 people boat made appointments.

People coming around!  Pfizer make money.

I'm really behind homebrew COVID vaccine I'm glad go get one free. weird lazy would unhappy caught covid could vaccinated. still going get vaccine travel anyway.

If going get vaccine either way, I'd want ASAP. Transmission outdoors extremely low according data. don’t fully vaccinated wear mask outside. We’ve known awhile. “guidelines” incredibly slow update.  vaccine disease? Thanks sharing this.  I’m going send friend hasn’t gotten reason.  She’s hoping get J&amp;J one hates needles much. like 1800 deaths per million. Yeah congrats bad Brazil. 

Canada 650 deaths per million.

It's always funny countries Americans choose compare complaining they're ""not bad circlejerk claims"". Reminds ""don't realize Venezuela worse? We're even Honduras levels murder, like Somalia. SMH damn uninformed circlejerkers""

Your 2020 covid response, many aspects country, absolutely shameful given wealth hoarded powerful America. things never get better long worried ""dem smug foriners"" fellow countrymen. Mind route United States wanted go, blowing off. \**un*fair enough CDC came back 90% pretty close Israel saw. Please send vaccine Cuba. think lot people get flu shots regularly, every year, maybe percent think help gotten higher? would help.

I also think one roadblock lot people covid see need. think saying need one shot instead 2 vaccine antibodies would also help drive vax rate.

