,date,text
Needless say, he's happy vaccines. would assume UK's excellent rate vaccinating people but.. that's course speculation. incidence thrombosis ""potentially"" due Moderna/Pfizer vaccines actually much higher found J&amp;J CVT, makes stranger. Though MRNA vaccines seem resulting abdominal thrombosis, know severity outlook vs. CVT. Whatever thinking, exact opposite!! Almost 2 million people die due diarrhea yearly I've never heard anyone concerned Choosing get much different available.

We're within weeks every adult able get one. Naysayers like ""what people BFE, people without cars, etc"". People find way stuff matters. flew state twice it. even enter Alaska international tourist permanent US residency moment? large party floor, usual weekend. fucking joke. gave shit, they'd lean harder condo buildings self-enforce rules patrol halls loud parties. mention likely airBNB jackasses partying away homes. did? France spent tons Sanofi, Sweden runs half AZ Jansen Belgium. American would say Probably unpopular opinion: purposefully baby global pandemic, hospitals most/many areas either strained completely overstressed, pretty selfish 🤷‍♀️ really think worth comparing numbers context. There's likely pretty large difference two country's abilities capture cases deaths accurately. UK 1 2 million tests day school kids regularly tested. Lateral flow tests followed PCR positive. said measles seems work covid well. get offered appointment states type vaccine. unhappy decline appointment choose another one. always vaccines site. got vaccinate two days ago everyone day vaccination site got Moderna. horrendous people even know what's going there. friend 35, healthy, family. developer Fortune 500 company extremely kind, patent, bright.

He came last week two never bad enough get hospital bed. friends family searched oxygen non could found. food shortages top it. lucky, could order 'box' food everything delayed combating malnutrition.

He messaged earlier morning checking hospital status. responded ""yes get bed things good."" knew late. 

The rest messages went viewed. got call 2 hours ago

The last photo oxygen mask on, sweating, bloated. India needs help. Meanwhile UK open pubs they're completely sold months Life's tough really Merkel. ministers *are* incompetent, main problem Merkel power impose measures like lockdowns school closures.

That's individual states, even states run party listening her.

You see [a massive difference infection states. trust sources Reddit says trust - yet reddit apparently operated pedo lovers mentally ill gender swappers. long get fix subway poles? ""nearly half residents shot"" work super well either 40% population first shot. far over. eligible Pfizer yet. Berlin many states opened AZ vaccinations anyone 60 since lot intended younger people, can't given now. places still vaccinating people priority group 2 Merkel probably priority group 3 (we know personal health problems course going age group). wanted Pfizer vaccine still would wait prio 3's turn. lying? open mean there's enough onhand everyone. State 800,000 people left vaccinate first shot like 1.2 million second shot. getting 100,000 doses week. going take least another 10 weeks everyone wanted opportunity get it. whatttt idea this!

Really good know, especially P1 variant around. TLDR: Germany morals.

Said non-German, quite obvious Germans moving towards status leader free world. Especially helped US UK abandoning indications wanting engage international collaboration.  Symptomatic stricter standard serious disease, anything mRNA vaccines would look even better.

The studies followed guidelines meant make possible compare vaccines. Bigger methodological differences par course comparing medical treatments. Yah know. It’s related comment people talk like vaccine shop go buy vaccines. UK, EU US particular well secured supply early actually helped fund coordinate start. countries simply luxury wait Thank this, keep reading 6 blood clots always assumed meant deaths. Thank I'm sure publicity plays big role, also would eligible Pfizer Moderna yet. age would priority group 3 (of course might health issues putting higher, none publicly known). Berlin yet started vaccinate prio 3. opened vaccines AZ anyone 60 lot give younger people prio 2 anymore. episode Naked Now? got infected virus made everyone... extra excited. Data even got Tasha Yar. sub downvotes anything that's circle jerk pandemic ""already over"". border open still haven’t gotten vaccine (which likely considering Canada fucking HARD vaccine rollout), I’ll getting vaccines states.  dozen Borg break door, need distract escape! weird adopted brits. think sometime last year lot articles AZ/Oxford used jab headline UK publications, US media co opted term shots point happen vaccine increased risk one vs other, reason happens investigated, biggest worry personally always happens 1e dose never 2e dose, means controlled factor could cause this, case probably preventable to. Yeah, cares? Screw immune compromised children, it’s important people go bars! /s Dang. second one Thursday last night went out. Felt great reactions. thinking thing, turns acceptable. submission linking slate.com automatically removed source may reliable may dedicated mostly political coverage. possible, please re-submit link reliable non-political source, reliable news organization recognized institution.

Thank helping us keep information /r/Coronavirus reliable!


*I bot, action performed automatically. Please [contact moderators subreddit](/message/compose/?to=/r/Coronavirus) questions concerns.* Dam sounds terrifying girl, especially 18? That’s terrible.

It sounds like really fucked thing get, understand governments hesitant least, desperate times calls desperate situation I’m glad it’s back administered people. 

But dam blood clots brain, scary. Kids get crazy high fevers sometimes. unheard even times. Concerning course unusual like opinion wanna manipulate free speech else think it, even visible. US cut transportation Brazil India? did? Taiwan app must install phone. must answer house call twice day, arrested not.

This true all... Lol people entering country borders closed given special sim tracked government. *only* applied quarantine coming Taiwan foreign countries. keep patrons safe? require proof vaccine negative Covid test eat there? Quebec 75k vaccines, people Montreal still complaining seeing empty vaccination centres. bodes well ability massively ramp vaccination capacity short notice. European vaccine manufacturing par USA, european vaccines also exported, unlike currently happening USA. agree mostly. main problem poor countries led horrible leaders steal given vaccines try profit them. 

For us gift vaccines, needs agreement place they, WHO, whoever, comes handles vaccination efforts. post link think start soon. Jabs probably prevented another big wave (in states). simple concept.  people get it, likely thing mutates further. Eventually get much dangerous virus mutation. Got second dose two days ago. Felt icky yesterday, feeling great today. around two weeks, I’m going go fucking crazy Tinder, Bumble, Hinge. think much hesitancy lack infrastructure. eradication virus. exist rest life. 

The quicker accept this, quicker get back life. Aldi suburban Palm Beach County yesterday two seniors ranting would never get vaccine they're STILL flu. 

My mother, severely immunocompromised, refuses get apparently woke symptoms yesterday. try find way convince get tested hundred miles away without exposing half vaxxed ass her. number Ontario skyrocketing - hopefully get many needles arms quickly. 

I would love see open anyone wants one. Yeah makes sense cause less stuff coming system. Man hate young people huh Well, least ones still alive. without victimhood claim ephemeral moral high ground?

That said believe- see first hand- problems lock caused. vaccination passport indeed controversial.

Some months ago, many organizations (I think even WHO) showed criticism due lack effectiveness discriminatory.

Even EU says passport required travel. seems changed point view.

As mentioned, fact vaccinated prevent virus contaminate others, indeed use masks PCR seems appropriate even people vaccinated. Even article admits we’re battling issue testing reporting lot countries (typically poorer ones). that’s case, along confounding factors like poorer countries less likely vax likely worse medical care hunger, don’t think say rise Brazil’s infant deaths due P1 alone. evidence P1 evolved become deadly infants specifically - think we’re seeing result country poorer infrastructure struggling widespread covid lack vaccines. think transmitting real problem there. asymptomatic case big deal till give granny. Large scale vaccination still saves lives costs...

Nevertheless, think would wise use J&amp;J vaccine older folks lot European countries suggested AZ. Rome issue years. pandemic aggravated it. AZ JnJ, they've seen temporal connection (i.e. happens within week two vaccination) rare type clotting, much greater expect random chance. also seems particularly affect young women.

What makes things especially ethically complicated, within low Covid prevalence population (e.g. Norway), may risk complication comparable risk firstly catching Covid, seriously affected, younger age groups - Covid risk low.

As AZ, pause JnJ allow health officials get better idea (very small) risk, update recommendations regarding age groups etc, resume rollout. know what? They're going fine. cares? really know voted Hey, always curious since Northern Exposure! Alas, I’m America. South Korea probably won’t start vaccinations 65 Nov — plans, contracts, inventory atm KCDC MOHW constituency Administration. People happy here. definitely. bit cloth lol stops getting spreading illness fuck it. Least do. I.never said businesses ""should shut down"". said businesses right shut (and depending business, think maybe should). sit nothing saying use r&amp;d manufacturing produce products protect people. Well guess what. get make decisions. do. like every business world.

I know think fun try paint Democrat republican fit little box made me. 

Try think yourself. whatever think makes initial post work thinking yourself. say piece let go. go everyone what’s best family already made choice. Proudly vaccinated. choose live consequences crop like choosing refusing shot. know resident requirements california someone stayed families house hotel put address would zero questions asked. Remember open everyone, even homeless people without insurance tourists would go fine made sense vaccinate older ""at risk"" people 1st (along medical-responders front-line workers). think ""bad decision"". we're making great vaccination progress NOW.. stuff we're stuff 6 8 months ago (delayed due abysmally idiotic leadership). 

In area live,. vaccinations wide open anyone 18 over. (has weeks now). 

Be may. .there still fault correctly pointed younger people ""mingling"" unsafely. live downtown area go walk around Friday Saturday night,. Bars clubs ""social-spaces"" packed gills unmasked people. That's recipe successfully beating pandemic. 

I mean get it.. ""pandemic-exhausted"" (or whatever they're calling now). Here's problem though:.. virus get ""exhausted"". cause ""inconvenient"" think is. It'll still everything possible infect kill people. ""long tail"" eradicating virus going slow painful nobody follows rules. Like real estate - location, location, location. I'm sure would see depends located, places frequent, time out, etc. think lot depends venue. Probably high compliance grocery stores, lower compliance social school indoor sporting events. take limited vantage point maskers still wearing masks anti-maskers not. began wearing still are, never grudgingly wore still aren't. That's dangerous really. seem lot fear mongering expected side effects. guess people attached oc downvoted. Thank posting this. super ignorant friend mine recently posted something along lines fun research subjects, vaccines don’t work still get it, etc. Early research shows Indian variant might resistant natural immunity vaccination. really hope case. Either way, India needs seal borders keep spreading asthma, premature. could officially diagnosed, since don’t call asthma 15 month olds, caught respiratory virus (neither RSV flu) knew sick, sounded like normal cold, went planned training run. seven miles mile away car husband called say Kiddo blue going ER. set mile PR getting back car meet there, Kiddo got spend couple days hospital. got nebulizer shortly thereafter. Good luck you! Here’s registry I’m part invited part larger Covid study vaccination: Alaska is. Beautiful state tourism added bonus still using nasopharyngeal swabs? We've spit tests nose pick tests weeks. Thank explanation. would much rather show passport shit shoved nose hard enough make bleed again. that’s guess Don’t forget China Doctors awful, especially US, communicating risk survivors. I’m “lucky” pre-existing heart murmur extra heart tests done chemo. also noticeable scarring lungs post-treatment x-rays ended bleomycin toxicity. doesn’t affect much daily life, basically like exercise-induced asthma, recent hospitalization warn everyone dangerous pure oxygen lungs needed extra team members anesthesiology supervise surgery last month. 

I’m 15 year survivor definitely self advocacy. I’ve found helpful. also signed Hodgkin’s International really great communication survivors. I’m lucky enough cancer survivorship clinic nearby popping helping coordinate whole care getting old records, running tests, even things like dentistry vision you’re lucky. 14-day quarantine, said, school arranged take COVID-19 test hospital April 14, results Saturday came positive.

The CECC spokesman said two men asymptomatic far contact tracing necessary, everyone come contact hospital well protected.

To date, Taiwan recorded 1,072 cases COVID-19, 956 classified imported. total, 1,033 recovered, 11 died 28 hospital, according CECC statistics.

Globally, COVID-19 infected 139.51 million people 193 countries regions, 3 million fatalities Saturday, CECC data shows.

(By Ko Lin)
Enditem/J parents live Arizona, high risk, absolute shit show trying get vaccine. walk pharmacist's window, tell anything. say go website. websites hard use. Older people good navigating complicated, buggy, websites. call around different places, everyone says appointments.

My parents' primary care physician office vaccine idea get it.

The reason parents recently got vaccine went online Walgreens website figured sign process them. walked every step process phone, button click button click. easy simple.

This whole thing complete cluster. service run local government whereby put name, phone number, email list call say, ""go day get vaccine"". Ugh. ""Smear campaign"" - that's CCP usually uses want silence discredit something like. arguing businesses Michigan shut ""to protect employees""(left), also arguing private companies whatever want workers basically cogs machine(right). Try pick side, arguing whatever think makes initial post work side. Yes risk same. terms saved human lifes, would effective share vaccines focus people danger.

But countries also thinking economic impact sharing case would help Ok I’m extremely worried partner appetite plummeted know that’s usually something bad. happened around time vaccine hopefully it’s related resolve Nothing vaccination? treatments aren’t going shit hospitals get overwhelmed. new scare resource. post appears vaccines. encourage read helpful resources COVID-19 vaccines:
  
[Vaccine FAQ Part FAQ Part appointment bot, action performed automatically. Please [contact moderators subreddit](/message/compose/?to=/r/Coronavirus) questions concerns.* delayed getting blood tests due surprise gallbladder attack required hospitalization removal. I’m process getting new lab test orders hopefully I’ll know soon! I’m position evaluate whether J&amp;J linked particular condition not, don’t believe there’s sufficient data support it.

Just reference, anual rate CVST Europe around 14 per million. problem is, that’s comparable. can’t blindly compare anual, non-stratified rate one-off even taking vaccine.

What *can* compare prevalence rate two vaccines equivalent population. 

This easier do. problem AZ: compared Pfizer, shows far higher rate. turns it’s really easy decision see kid blue struggling breath. 

shit. yeah that'd make straight forward decision making process two years, still nightmares. 

so pre-covid? whatever happened, hope recur exacerbated covid. good luck wherever are! fuck smile? started process invited later on: post appears vaccines. encourage read helpful resources COVID-19 vaccines:
  
[Vaccine FAQ Part FAQ Part appointment bot, action performed automatically. Please [contact moderators subreddit](/message/compose/?to=/r/Coronavirus) questions concerns.* That’s evidence says You’re clearly misinformed evidence. might find preconceived notions accurate. got first pfizer yesterday. Wow injection site sore suprisingly nothing else. tend bad reactions medicine maybe Ill get smitted second shot argument force children experimental medical trials, benefit benefit adults? evidence shows wake call Useless comment. like saying lives matter black person. COURSE people suffering. one said vaccines gives full immunity. lowers risk getting severe symptoms. Co-worker got positive result weeks ago got shots pfizer january. sorr throat headache wich good since got one lung. take condition friends father lightly, amount people afflictions probably remain constant regardless vaccination rate. advocating maintain guidelines forever?

To point, restrictions severely impact 50x many people, them? write everyone check every two weeks forever. Even Andrew Yang’s proposal $2,000 month would get evicted work. It’s zero sum game. everyone screaming resources ones without advocates get pushed back line. Yup. person know hasn’t possibly pregnant she’s waiting confirmation either way booking appointment. Dental students turns it’s really easy decision see kid blue struggling breath. It’s year, still nightmares. Dental schools north 100k decade already  seem obsessed telling private companies run business. Rgr Alaska beautiful state incredible bounds nature. hope they’re least vaccinated. spreads risk kids people can’t vaccinated health reasons are. greater risk mutating form evades vaccines. wasn’t worth before. piece paper thing “worth” anything. I'm kinda feeling like neither Federal, Provincial, Municipal layers government well this. say knowing manual stuff everyone thrust it. Even caveat done better. partisan divide willingness get vaccinated first found opinion polling starting clearly show [actual vaccination going big challenge solve Thank you. know popular narrative badly Canada vaccinations, it’s far truth. I’m 41 conditions job makes priority, fully expect I’ll probably first shot sometime early mid May. Gee wonder works retail/restaurant jobs everyone demanding open? Everything find online, specifically trying find information years ago related vaccines, talks incidence rate CVST like 5 per million annually, commonly women. far they’ve reported 1 per million connection J&amp;J unless gone recently. don’t know AZ though. sounds sensible, thanks! Americans pay advertised prices, get financial aid. Sticker price rich foreign students. Sadly politicized year ago now. wearing mask (or correctly, wearing mask) became political statement, pretty much closed door stopping spread. study finished yet. course also depends case definition. never got flu shots year. I’m young healthy never particularly afraid getting flu going way get vaccine never really occurred do. changed year get vaccine every year on. I’m sure I’m one. Replying ""half vaxxed"" meaning first shot... mean mix vaccinated unvaccinated, different advice.

I recall seeing graph showing rate new infections would decline around 10 days first vaccination (think Pfizer Moderna). sounds promising, supposed full immune response place week two 2nd dose. general guideline would mask safe, would suck get virus close full immunity.

If mean mixture vaccinated unvaccinated people, think unvaccinated people would higher risk contracting virus getting severely ill, whereas vaccinated would greatly reduce chance getting virus even greater reduced chance severe illness.

Basically, mantra would everyone vaccinated, probably forego masks. Otherwise, would varying levels risk masks would certainly help towards protecting anyone fully vaccinated still working vaccination schedule. statewide mask mandate, assume. blue parts state mostly going right thing anyway, rural parts hard time understanding science.  hate country mean hate mine. Also wrongdoing certain members government military change view country. Unless country truly evil think modern countries even China Russia pride certain things less China Russia still China can't think many countries would wrong proud least part country. I'm including far past post appears vaccines. encourage read helpful resources COVID-19 vaccines:
  
[Vaccine FAQ Part FAQ Part appointment bot, action performed automatically. Please [contact moderators subreddit](/message/compose/?to=/r/Coronavirus) questions concerns.* Totally understandable, respect anyone getting getting vaccine nearly reason(5g withstanding), advise everyone talk child's doctor voice concerns, get feedback whether applicable given individual. new, doctors probably deep dive order divine answer. point, people Ontario ever say “enough enough” engage mass disobedience, protests, things like that? people roll keep eating whatever shit sandwich Ford &amp; Co. feed them? nonessential travel pandemic needs stopped, period we’re well beyond point sick, man. free country, cant force people things will. tyranny.  much though got vaccinated Sinofarm available country time. got certificate Chinese vaccine EU recognizing it. Fuck using politics push vaccines punishing innocent people profits. twisted part Chinese citizens got vaccine travel EU. know, really missed licking doorknobs. Got second dose today, fairly large facility it. 

One thing interesting place 800 appointments second doses today, 70 first doses. 

I say worrying though, 800 like - got first dose 3-4 weeks ago. Back then, mostly first doses, bound happen. get people genuinely worried I'm getting tired hearing ""but long term effects"" thing. long term effects possibly going happen months vaccine left system? stage 3 trials months ago vaguely defined long term effects found.

It's moving goalposts, say ""but long term effects"" literally forever. Hahaha said thing.
It really make wonder, watch news go social media would even know anything going besides masks. guess office buildings one one really amount people walking around, driving, stores restaurants. Republicans applauded governor's resistance calls rules, federal health officials said way Michigan put end become nation's worst COVID-19 outbreak. 

This tried use loopholes enforce lockdowns. Can’t way people. 

/puts downvote helmet Like covax going tell United States  It’s important remember partly J&amp;J vaccine tested strains, like UK &amp; SA. time Moderna &amp; Pfizer, tested earlier strains. submission linking washingtontimes.com automatically removed source may reliable may dedicated mostly political coverage. possible, please re-submit link reliable non-political source, reliable news organization recognized institution.

Thank helping us keep information /r/Coronavirus reliable!


*I bot, action performed automatically. Please [contact moderators subreddit](/message/compose/?to=/r/Coronavirus) questions concerns.*  copper, good already. Copper excellent anti-microbe properties. also used taking medications jabbed prodded nurses. Airborne sized droplets pass regular masks without hindrance. thing disinfecting everything there. year later one confirmed case surface transmission worldwide. Fuck Y.O.U. speaking French? say originally? I’m sure people walking around face shields instead masks something this. 

I’m looking you, Costco. least universal healthcare Given scale vaccine rollout surprised either. least given decade two.

But history mankind ever eradicated one disease, smallpox. We're close polio we're quite yet. Mmm, start comment ""Hello together!"" sincerely doubt German squarehead claim. Look population weighted density (PWD) you’ll see it’s ”an issue” comparing Sweden Europe.

Norway actually terrible comparison, since PWD way lower. read Slate Atlantic articles says kid like vaccinated adult. never says kids still wear masks. True, doesn’t explicitly say shouldn’t. says “they’re vaccinated adult!” CDC saying vaccinated adults gather without masks, heavily implies thinks kids same. there’s something else says need wear masks, I’ve missed seeing one.  mean use excuses want, reason vast majority simply exercise all. curious, Columbia part initiative provide countries vaccines, mostly AZ? pricing fairly transparent relatively Chinese vaccines suffered severe lack transparency NDAs. democratic country, thought typically easier obtain pricing information authoritarian countries time also multiple ways obtain AZ, India makes really low price. shocked people getting fleeced Pf pricing AZ. That's unconscionable. making money selfish? found important make money crisis vaccinate populations - that’s selfish stupid.   nausea diarrhea past couple days COVID symptoms, went see doctor today rapid test came back negative PCR test likely come back Monday. 

