,date,text
(Life insurance another matter - they're allowed consider pretty much whatever want far health history.) turn corner - horizontal vertical, straight up. even get plaster! I'm person wrote that, know two people MS work doctors find right window vaccinate based medications. One finally got first dose week another waiting till certain window. So, point, unvaccinated still running errands her. ask personal medical information beyond offered. said know eager get it. seems similar people getting advice oncologists works treatment Unless they're trumps emails coworker close friend advised get figure autoimmune thing she’s got going on. hopes get it, don’t want yet could cause sort flair up. Unfortunately nowhere near control whatever happening body flared last week.  vaccines paid federal money can’t exported states. Makes sense, otherwise, US states could accept kinds things federal government resell them.  something reliable recent?

Fauci ""If deficient vitamin D, impact susceptibility infection,” said Dr. Fauci, director National Institute Allergy Infectious Diseases. “I would mind recommending, myself, taking vitamin supplements.”

Which good *general* advice says nothing specifically COVID-19. I've tested, Vitamin deficiency like lot people 50, I've supplementing years. Vitamin pushed specifically miracle preventative COVID-19 based poor evidence. Many, many people sub still arguing masking spite updated CDC guidance. shit Sherlock believe second vaccinated, caught it, is. thought would, sort fake 'til make scenario. vaccinated now, would highly recommend taking small steps reintroduce things enjoyed before. things ramp back up, less chance get back normal pace. recent preprint finding recovery covid followed 1 dose Pfizer produces higher persistent antibody levels 2 doses Pfizer someone never COVID.

See [Influence past infection SARS-CoV-2 response BioTech/ Pfizer BNT162b2 mRNA vaccine health care workers: kinetics durability humoral compared antibody responses two doses BNT162b2 mRNA Covid-19 vaccine HCWs laboratory-confirmed SARS-CoV-2 infection vaccination (experienced HCWs) HCWs previously infected (naive HCWs). Results: Seven days first vaccine dose HCWs previous infection experienced 126 fold increase antibody levels (GMC 26955 AU; 95% CI 18785-35125). However, HCW naive group response much lower 5 showed positive antibody levels AU). HCWs previous infection significantly increased antibody levels second dose significant increase naive HCW group (16 fold; GMC 20227 AU; 95% CI: 15179-25275). Approximately two months completing vaccination, level antibodies much lower naive HCWs (GMC 6595 AU vs. 25003 AU; p&lt;0.001)

Chances good true vaccines.  

As boosters, right nobody knows happen.  Vaccine makers testing various formulations dosages multiple options available turn necessary. Testing random sample population irrespective symptoms. would tell true incidence infection. Comedian 👍 Enough suspicion though Fauci Biden openly support investigation. chose vaccinate first dose instead give people protection rather 0. 

It excellent decision backed science results amazing. youth vaccination rates good well eventhough started

We also higher risk groups like healthcare workers get fully vaccinated sooner. wife fully vacinated since February since nurse, got first dose near end April appointment second dose currently end July , probably sooner vaccines have

Feds done amazing job !  I'll fun giving shit fellow human rather putting others risk selfish convenience. Might sent soon. Ten minutes later, US announced send vaccines Taiwan. Japan also sending vaccines. Correct one greatest conspiracy theories, ""lab leak"" hypothesis supported even Fauci Biden administration. understand concerns benefit outweighs risk, eyes. don’t know effects virus body we’re seeing pretty significant adverse effects already. proof coworker proudly four completely unvaccinated children yet accepted COVID vaccine herself. I'm glad got vaccinated, enigma. ...what? First doses basically done across country already, 2-3 million new doses delivered every week; second doses moved many weeks. Quebec cut interval half, Alberta already started rescheduling appointments. saying true since early April. ""The CDC tends change things though day day. issue need make messaging consistent.""

Followed by: 

""I take word it""

Goodness. Covid main concern thought process like that. That's MLK - seemed work him.  


/s media tried *very* hard paint picture federal government totally failed procuring vaccines, true. got slightly slower start countries domestic production capacity, rapidly surpassing countries vaccinations anyway. 
“After single dose Pfizer-BioNTech vaccine, people prior COVID-19 infection antibody levels similar people without prior infection two vaccine doses.
The results, need confirmed large, diverse populations, may point strategy stretch currently limited supply vaccines COVID-19.” probably take comfort knowing you’ve got substantial immunity covid receiving one dose; however, receive second dose. fully vaccinated point, isn’t enough data determine long effective immunity would receive one dose series. Firstly can. Americas all. nice easy Monroe doctrine US also take responsibility.

Secondly control spread virus often leads new variant. Sooner later variant might pop existing vaccines work.

Then new variant eventually spread US causing mayhem death again. And? Cases, hospitalizations death plummeting like rock thrown pond, strategy getting many first doses possible clearly worked. Plus provinces start shifting focus second doses week, we're gonna see fully vaccinated number start shoot almost vertically graphs. stand higher percentage fully vaccinated people US end summer. liked movie. watch every October. Christina Ricci witch trying protect Ichabod. Upper Crust town ones actually summoning Horseman (who played Christopher Walken. Heat shock proteins, bruh!  Nailed it.

Also: ""masks work."" Personally lol'd fine piece advice CDC. Wonder many died it. sides stupid people.  entire mentioning ""US citizens regardless nationality"" meaningless

I say ""US citizens regardless nationality"". used terms two different sentences contexts. read article, I'm relaying NPR June 1, anyone age 12 older anywhere around world get vaccine Alaska.

If inaccurate misleading information, take NPR. reason thought newsworthy. continue good show. Lower numbers, less alarming  I've wrong several times. recognized wrong changed opinion. people ever done that?

Most conspiracy nuts going get vaccinated. argument, appeals reason, coddling, bribery work. go around them. Might well mock make feel like shit much possible. know discussing vaccine virus, quote provided discussing bacteria right?

Also source: ""Natural immunity coronavirus fortunately quite strong. vast majority people infected produce least antibodies immune cells fight infection. evidence far suggests protection persist years, preventing serious illness, reinfection.""

I time read entire article, find source actual study coms conclusion title article suggests. think it’s simply American people lost confidence American neighbors…

People simply can’t trust others right thing, pushback mask, restrictions, vaccines. US vaccination rates dropped point pulling bribes. mean, yeah, bigger point ""scientific reasoning"" technique, American public school abysmally terrible teaching (or much anything else beyond basic literacy). always response people's reports crap facebook be. site issue, people know use it. Looks good plan covering everything everywhere, lol  Quebec hit target 5.3 million first 500K second doses June 24th, *today*. rapidly catching everyone else, people still showing get jab. dosing interval officially lowered 8 weeks Quebec, may well see totally normal August province. Absolutely outstanding work everyone! Okay thanks. What’s surveillance testing though? available buy... Everyone wrong Covid several points last year half. exception rule.

I feel this. thought sure masks would totally ineffective stopping transmission back Feb/March 2020. I'm glad wrong. often people I'm referring telling watch? ""do research"" folks... meant fly Portugal Sunday that’s drain guess, gutted :( Eyy country list partner recipients. Thanks USA, need help get actually destroy Covid floating around air entering room. Use power good. Here's CA. Huh! grew Bellevue TIL Island County thing, also apparently liberal. think island(s) went San Juan Skagit counties.

Where one find affordable house West half state¿¿¿¿¿ say so. fun face masks lmao  many people trust experts, especially constant shifting expert opinions various topics throughout crisis.

I'm saying vaccine hesitant right, concerns largely long-term health effects saying ""but 2 billion people got shot within past months dead yet"" really going convince anyone. time medical experts also said cigarettes perfectly healthy several decades people found wrong experts were. course, forget classic videos kids pools getting sprayed DDT hoses experts convinced perfectly safe well. Everyone wrong Covid several points last year half.

speak yourself. takes 22 days form antibodies first dose safe brother. read backing papers. Sometimes fully understand what's said hit Wikipedia background info.  Canada recently changed interval doses. live reduced 16 weeks 8 weeks. “Not normal”. dumb statement. shit, Sherlock. That’s true. Around number kids died shutdowns, masking, etc. drop precautions rise substantially. Plus unknown long term effects. It’s causing diabetes kids normally would have. 4/28 second shot? Yeah meanwhile it’s still quite difficult vaccinated Europeans get US. don’t understand won’t give 18  could possibly happen??? Given track record cops area, really, really, really hope opposition crops paying entitlement family.  Blue states blue population centers voting blue. Central Valley red come, nearly rural agriculturally focused areas. Rural Alabama Rural California might well two different accents. post appears vaccines. encourage read helpful resources COVID-19 vaccines:
  
[Vaccine FAQ Part FAQ Part appointment bot, action performed automatically. Please [contact moderators subreddit](/message/compose/?to=/r/Coronavirus) questions concerns.* states same, it’s Alaska ones using promote tourism. Plenty wealthy Mexicans Arizona, California Texas getting it; South Americans Florida. sub:

“Lalala! can’t hear you!” not; entire mentioning ""US citizens regardless nationality"" meaningless. US citizens US nationality, period.

They made clear human beings able come Alaska (from anywhere world) get vaccinated. Obviously, anyone come (due visa restrictions, Covid making especially hard get visa now, plus overall cost journey). 

In fact, states - nowhere vaccination appointment process, would specifying one's immigration status citizenship.  Alaska seems first start advertising this. great, I’m waiting complaints people don’t want vaccines hit Facebook page.  take years, help everything. bunch different process nodes use. There's way they'll ever replicate US. Cutting edge processes used things like computers smartphones, likely they'll build new factories. Things like automotive chips causing line various car factories built older technologies. manufacturing facilities built paid cutting edge stuff cutting edge continue used long time things. Early kept saying best thing people stay active supplement Vitamin D, basically turned meme subs like one people saying vitamin nothing akin healing crystals. Fauci came said takes daily vitamin dosage way recommended daily amount precaution kinda got memory-holed.  Well clearly need dead morgue workers. solve problem.  We’ve lulls before. We’re level cases last year around time. Texas Florida pretty much always mostly open. 

Key difference vaccines can’t look cases say pandemic. bet money would say worst behind us don’t like giving Covid inch know takes mile. got bit vaccine, still enough second doses. People wait months get second dose relatively little supply. Great news people think they're soooo clever, really they're treading tired groove others share dead-end ideology trod thousand years. exhausting. course nothing 100% effective, earth coming person clearly good reason wearing mask around irresponsible people?

A vaccine effective, yes, 100%. mask, offers level protection, 100%. combine together get something close 100% protection working enjoying normal life wearing mask. person need lock away achieve near 100% protection, make personal choice wear mask accordance risk tolerance. 

Enjoy wearing mask vaccinated - us comfortable yet depending community people interact public. affect all. can't think single thing want can't. sounds like bogus conspiracy G actually opposite 

asymptomatic actually lot less previously estimated

around 1/8th originally inserted mode

and asymptomatic spread since cough/sneeze much.. Italy also high uptake far, I'd wager Germany Netherlands would reach 85% least. Eastern Europe otoh bit shitshow. Multiple experts stated biggest risk adverse effects would apparent within first 6 weeks. 

The beauty logic also don’t clue long term effects COVID people don’t seem bothered one seem hear “99.9% survival rate!!” He's man integrity. Didn’t buy enough vaccinate everyone twice?  Israel 57% population **fully vaccinated**. We're 6%, far behind US UK. Yeah I'll surely getting doses, never questioned that. wanted know long-term immunity could different someone got doses recovered, whether I'll needing booster. caught week got first shot, context. Yes, fair - Seychelles bit complicated. seen anything breaks AZ vs. Sinopharm effectiveness Seychelles. 

AZ higher headline efficiency evidence struggles bit variants (the stabilized spike protein mRNA JnJ vaccines probably helping there). extremely rare. Much rarer dying flu, example line reason don’t hate George Cluny friend MS got vax second eligible

She actually traveled CA NV get shot MS made eligible NV eligible CA Looks like previous person deleted comment. 

Can one believe Covid real risks low?

Can share recovery rate is/was? thought r/CoronavirusWA sec Yes. seen LOT. almost always antivaxxer. never back statements. May even person. house. cannot catch covid house. Covid transmitted people, buildings. sure that's coming from, people immunosuppressants urged get vaccinated. may may work (post-organ transplant, 25%) refrain Reddit immunocompromised people get vaccinated simply wrong. friends told this, need speak another physician, general concern people MS getting vaccinated apply mRNA vaccines.

Here link information MS COVID 


Do sources statements? actually change day day; although, changed time.

Vaccinated safe ever manage be. thing vaccinate for. Remember never anything 100% safe, practical purposes fine.

Don't worry variants. someone administers vaccine, please make sure tell people working bad needle phobia soon go in. way they're prepared even offer private room (or I'm sure ask), make comfortable possible. 

I woman come day, first thing said front desk needle phobia, took private room administer vaccine, far comfortable environment. even commended 2nd person ever cause pass out, although put atmosphere able create result letting us know phobia.

Best luck! They'll take good care you! think part government say they’ve literally done everything power allow people get vaccinated. 
 
Now there’s free childcare, free Uber/Lyft rides, 24hr Friday vaccine clinics, employer incentives time vaccines. 

Before lifting restrictions, make sure barriers prevented certain groups getting vaccinated. certain point say anyone hasn’t vaccinated didn’t want to, couldn’t. look opposite direction let thing. likely feel anything (but sore arm day two later happen). UK 12 week dose spacing AZ, they're Pfizer too. Similar Canada's 16 weeks (which shrinking). Finland also 12 week spacing vaccines. fact Pfizer Moderna ran trials short dose spacing wanting finish trials quickly general understanding optimal vaccine dose spacing.

And Canada's first AZ doses received early March Serum Institute (technically CoviShield, essentially rebranded AZ). US loaned doses four weeks later followed COVAX.

That said, vaccines approved Canada March 2021 unexpected, hence scramble obtain doses sooner Q2 2021.  CDC says safely go crowded indoor event full unvaccinated people without masks, vaccinated. would think would also significant number crystal wielding natural cure supporters there. Hell yeah let’s keep - let anti vaxxers wipe scientists, scientist. look background. said found cure coronavirus 10months ago. guy's wacky.

Just inbox mean trusted source. Remember: hundreds MDs still saying Covid real. emailed him, would believe MDs? Well, still die. 

The vaccines help great deal still get sick even die.  parents siblings refuse get vaxxed matter many times debunk claims think I'm crazy portland libtard. pisses much also makes scared. might dead ever see again. Bunch woke morons thread going one day contribute destruction civilized life. How? mean realistically, unless he's obese old overwhelming chances he''ll survive reproduce. People MS every single type cancer explicitly encouraged get vaccinated. tell patients, equally important around vaccinated don’t know degree vaccine confers immunity individually given immune compromised status. one third world country? backwards parts full tribalism, ignorance, superstition extreme religious beliefs it’s unbelievable. understanding youre vaccinated get lot mild. So, still worth. basically discovered studies huge difference vaccinated unvaccinated terms numbers asymptomatic positive tests. vaccinated show positive tests nearly much. isn’t necessarily positive person can’t spread disease (although viral loads would likely much lower)...it’s don’t carry virus much We've already spent 30 billion something vaccines. wonder would cost? Probably crazy amount more. got source this? wonder cos I've heard people getting 2nd dose 8 weeks; would nice see confirmation it. US absolutely woods.  What? Since when? abc tracker I’ve following says 55% least one shot. Even reduces chance transmission 30%, that's large amount dealing something exponential. Going pandemic made lot reflection lockdown. realize I’ve investing people give back relationships. Looking forward putting end finding real friends once. sure mean quote. current mixed ICU (previously exclusively COVID+ patients) unsurprising demographic. relatively true weeks.

It interesting hear patients nearing death intubation talking family phones iPads absolutely adamant covid real. Pretty surreal. suppose reality isnt convincing enough people heavily propagandized Immunocompromised cancer patient take it. 

I'm Immunocompromised took Every time I've seen post next response similar dead air. 

Not saying people prohibited there's never response friend ms can't. Seems odd. There's bunch Ricky-isms ""get two birds stones once"" one can't remember more, Hell stage give every kid guaranteed free college get vaccinated. I’m shit.  like 5 months distributed evenly among everyone. worked home entire career office-working friends envious. Initially excited WFH finally, 15 months home, actually want go back office least half time. need cautious. absolute knife-edge Victoria whether bring control rapidly develops further. don’t think helpful seed alarmist doomsday-type thoughts community.”

Bizarrely, guy said [earlier last virus win. won’t devastating impact strain transmissible severe, severity comes lower age groups,” Professor McCaw said.

Can't quite reconcile that, myself. Washington also large anti-vaxxer contingent? seem remember Washington issues measles outbreaks back 2019 it. Current projection [43 days catch US overall probably less since US slowing down.  think prioritization compared oxygen masks drop airplane put first helping others. Lmao real. told coworkers I'll see summer 2021. are, back work lol. anyone bothered read anything pandemics, we'd better shape. pharma gotta make $$$ Yeah, lot people complained Canada over-buying vaccines, given problems AZ J&amp;J looking awfully smart retrospect. Oh hush logic reason. Lol Yep. account asymptomatic cases people would even know?

Even estimated 90% sterilizing immunity amoung healthcare workers CDC study. Older immune comprised people always going end lowering levels world.

But even so, vaccines still amazing numbers soooooooo much better percentage wise unvaccinated.   six countries world yet started vaccinating — North Korea, Haiti, Tanzania, Chad, Burundi Eritrea


What happened Tanzania Burundi? usually better African counties... took long realize r/NYC say Kings County (Brooklyn)   boat. It’s nice drive 6 hours holidays, I’d love kids see grandparents.    go years without vaccine get sick, probably find something new argue get sick probably never will.  ot wrong. flying past second doses well future. Last time checked requirement second dose first dose. person hard time lockdown anxiety reopening. binary.  Agreed! would love see numbers unfiltered without changed percentage, support. 
This great all, 3 percent Japan fully vaccinated.. try encourage citizens vaccinate? America tell vaccinated asking last election Moderna, Pfizer J&amp;J empathy someone gets sick spreads others chosen get vaccine.

I empathy terribly ill, could protected convinced otherwise. one deserves die incredibly ill, even they're dummy. Hoping people start coming senses. Remindme! 14 days people legitimately cannot get vaccinated. isn’t complete non-problem. It’s it’s important get stupid people stop stupid, doesn’t affect stupid people. sure downvoted. Everything said completely true. think people wish covid longer face impacts, that's simply true. 

It take months, years, many cases forever overcome physical mental changes pandemic. may feel vulnerable public without mask claustrophobic around strangers, change overnight. Immunocompromised individuals cannot get vaccinated weakened still get still risk. have. Family friend undergoing chemo got sick tested positive gotten Pfizer three months before. Remindme! 60 days 100% never going real world. Vaccinated people definitely needed hospitalization died. severe case efficacy real world still like 99.9%. heartwarming see Greek-Macedonian relations recovered since name change. politicized well election. Trump retweeted kind anti mask conspiracy stuff. republican President best chance United uniform covid reponse, trump blew  Exercise useful panacea

Rogan never said panacea. said people try stay active help reduce risk COVID labeled ""victim blamer."" everyone wants 'right' everything. want start seeing people good again. No, though control perception situation, point. felt like treated like shit control even first priority.

Unvaccinated BILs father dying hospital right everyone cared feelings health.

What do? Something...

The comment replying coming wrong place wrong assumptions paints wide brush.  may good reason investigate, occurence low view experts actually see legit threat. scientific way say anything possible unless completely disproved scientific method. Gravity become part physics mathematically confirmed. That's language science works. Even Chubbyemu? good video explains older likely symptoms, needd hospitalization, died. least Oregon's data.

But get shots. numbers still low would much higher unvaccinated. People need stop trying paint negative narrative around absolutely everything. fiRsT doSEs argument tired unproductive. hard numbers infections, number vaccinated, number vaccinated? easy throw around percentage use fear tactic get people vaccinated.  
For record I'm fully vaccinated choice.  RIP Dr. Fauci then. takes way recommended dosage. Yeah dont know put second phrase lol. think hard time disagreeing people know need change that. Damn. Thanks. fun hundreds deaths According Bloomberg we've hit 2 Billion worldwide doses!

Days from:

0-200M: 68 days

200-400M: 26 days

400-600M: 15 days (April 1st)

600-800M: 12 days (April 13th)

800M-1B: 11 days (April 24th)

1.0-1.2B: 11 days (May 5th)

1.2-1.4B: 9 days (May 14th)

1.4-1.6B: 7 days (May 21st)

1.6-1.8B: 7 days (May 28th)

1.8-2B: 6 days (June 3rd)

7 day worldwide average around 35M/day, great stuff. Getting enough vitamins help, mega-doses particularly fat soluble vitamins quite harmful.  Rogan promote panacea, said people supplement reduce risk. now, vaccines made Moderna, Pfizer Johnson &amp; Johnson distributed, official told likely exposed fully immunized. daughter would exposed 2-14 days symptoms. would likely around environment getting exposed (as parent taking care young child would likely be).

Glad least one full dose working keep disease less severe. Heal -- likely super immune 2 doses exposure. anti vaxxer friends coworkers half gotten Covid vaccine. Exercise useful panacea. Weight management useful panacea. personal protection vaccines available, goes:

