,date,text
0,2021-06-08," put great show. Rock on! ought form public exchange vaccine data. anyone still listening guy? 

But get vaccinated consider removing testing req vax? Seems huge waste resources now. also dont know long term effects virus. better immune hope doesnt cause damage later. know American’s don’t take Covid seriously? Many do. Canadians like characterize America hard right trump group, truth America much bigger diverse that. Canadians like define North Americans aren’t States. truth opportunity, land, better weather, diversity United States. Strange seems, find Canadians patriotic liberal Americans. disguise “ha ha ha hur hur aren’t stupid Americans!” guess Canadians instill patriotism country bit negativity US, otherwise many Canadians would move south. short, many, many Americans care deeply reducing spread Covid.  We're going know yet. Immunity vaccine wane people vaccinated still risk. still ruled booster specific reason. people assume can't transmit virus they've vaccinated little naive best little disingenuous worst.   I'm sure figure dosing. Scalping bad pre pandemic concerts, spread everything! It’s day made Reddit account, like IRL birthday, give cake apologize them?  Risk infection reduced 90%. Even get infected unlikely spread virus *anyone* due reduced viral load. CDC says mask, distancing vaccinated people. quarantine travel known exposure. vaccine works. Hey asshole, good bad people everywhere grow fuck up.  defense Foo Fighters isn’t unlimited supply talented black music steal claim own.

Also Rolling Stones haven’t good created anything interest past 25 years so...  don’t get vaccinated? protected. don’t get Housing prices everywhere man. I’m Northeast corner (kingdom!) several Amish families moved here, purchasing old farms really thriving. Brings much needed relief economy. NYC turds stay fuck away please. parents vaccinated dude, call Dayton rural. Check reading comprehension try clap back. Lol remember coronavirus causes Covid disease product human activity. say that, humans putting animals together tight spaces would otherwise connected, probably wouldn’t dealing coronavirus. 

I get idea returning natural state, live different world. Everything eat cultivated engineered. paleo want, stuff fine tuned centuries centuries cultivation humans. think it’s worthwhile rethink “natural” actually means.  likely allowed WeChat access location, Suikang Code applet could use WeChat get geodata. maybe park incorrectly registered Liwan district recorded Liwan district scanned code enter. Alpha, British one. Even Little Rock Arkansas roof. Pandemics aren’t really normal. Seriously… I’d pull kids virtual school first thing tomorrow rush get jab. 
Damn hope somehow makes time new school year. 
Doubtful, I’ll keep hope something changes. find concerning UK almost identical 2 dose vax percentage US, cases rising like another wave coming, dropping like rocks. Like everything past year, we'll wait see something really gotta worry about, odd anomaly.

Shoulda said 'fully vaxed' believe UK one dose vaccinations. Makes wonder bigger percentage people one dose might influencing variable.  Legit Desantis idiot. places could require vaccine passports Florida get away it. People would shun sue oblivion. It’s unnecessary law served fuck cruise industry. kid less 2 years old got entire cousins family sick. stupid virus going end already...  took blood-clotting vaccine, lmao. 4 per million people Pfizer 5 per million AstraZeneca. much higher chance getting blood clot sitting around campfire.  fount ... something. Luckily stupidity replicate fast CoVid can… pandemic refugees caused housing prices fucking skyrocket

Is place country case? Even sunbelt fucked. need expert figure one out. many dumb people. vaccines, want get them.

I think anyone beg someone get vaccine. Facebook? Ew. spite risks, would still prefer live virus vaccine since would provide natural immune response. would argue unknown risks taking vaccine attempts induce immune response unnatural way.

The vaccines 1976 Swine Flu rushed production. Sound familiar?    It’s pure disinformation trying marr vaccines goal.

Well thank heavens bullshitters Reddit like who've spent years internet bullshitting tell us ""truth"" protect us ""deceitful lies"" actual experts spent years research study opinions hold actual value. fun see Vermont news much good way last years. Bernie ran, think country probably thought us cold maybe part Canada. we're known cold, actually part US name sentiment, filled craaaaazy socialists, CRUSHING COVID! 

If anyone's interested visiting, also really good cheese, craft beer, scenic views. please, please, PLEASE move pandemic refugees caused housing prices fucking skyrocket locals afford buy. jobs exactly plentiful lucrative. hope proud determination get done, think that's amazing! (even ridiculous hard). always stupid people call people stupid without leaving explanation. Let guess....Walmart lab studies Syrian hamsters prove surgical masks work reduce transmission. might be, world not—and it’s approved kids. least done next month 5/6-12 year olds (my guess, depends studies data date.   Imagine thinking simple that. frozen water they're delivering. something go people's bodies takes time get ball rolling.  Well thankfully decisions made based opinions Reddit keyboard bullshitters based experts like wrote article actually years research backing opinions unlike years bullshitting you. way contain outbreak infectious virus mutates fast. Governments need one step ahead virus terms identifying hosts, sequencing virus deploying vaccines. Time critical essence here. That's basically idea. Go look bottle kids medicine. say age 6-12 dosage. tiny fever less day. that’s mean America isolationist policies? Pearl Harbour reason America entered, public support war like 40% SEC filing dated July 23, 2020. various news sources, deal surely finalize time. However, according sources, Fosun-BNT deal done least May, 2021.

As “ongoing” discussion, think BNT means supplying Taiwan via Fosun, Taiwan refuses due political considerations. can't convince people. shit show? can't even tell anymore. rhetoric surrounding virus frustrating deal with. feel like Reddit two extremes: pro-restrictions anti-restrictions, much room nuanced positions. Christ

Sounds like needs shitcanned blacklisted ever working medical field again.  | India almost one vaccinated

Honestly, that's thought initially well. look vaccine data, lot healthcare frontline workers vaccinated time second wave got control. Given India's sheer size, say that's bad.

Looking now, given variant contagious India gotten relaxed beating first wave, India doomed start. large population density, nearly impossible contain spread virus. extended 30 days based new scientific data. wave arms decide they'll change expiration date.

The Serum Institute India extended *3 months*. Why? data allowed it. checked stability sterility made sound recommendation. 2019. Best vacation ever!!!! Much less likely get severe covid much likely tell never asked 2nd shots moving pretty quick Canada. Civilization = denying basic humanity?  Maybe driving 17 hours plus safe. deregulating stupid stuff idk see mandating limits drive time good everyone. thank scientists vaccines Desantis loser That’s put space suit negative tests kinda assume some_where_else troll actually doesn’t want form lockdown/restrictions. statement “This taking virus seriously looks like” definitely scare mongering. 

A form rhetoric intended make people think taking virus seriously suckers game, need lose humanity order “take coronavirus seriously”. he’s troll, stop commenting like would clearly opposite effect intended. lol I'm sure person thinks majority people around always right one who's fool dropped this: /s why? I'm sure they're better financially countries. economy wide open since time last year, exception short lockdowns. also get tourists Australia.  little bit both. 120 miles, closer 70. assume math using 60 mph average speed? going hit 60 Tennessee mountain roads longer seconds.

Road conditions design bigger problem, honestly, matter? takes 2 hours get safely, takes 2 hours.

Have ever heard RAM? That's Remote Area Medical, supply medical care places like this, lot people live there, yearly RAM visit time receive kind medical attention.

I say seem incredulous idea place like exists. Look ""food deserts"" sometime. lot extremely isolated communities across country. Lmao, expected Rick roll even better want people hermits rest lives? mean New Zealand decent rugby? Let’s go Vermont! really do.
The CDC done enough damage credibility  last year; least get right salvage bit. Astrazeneca one tested various timings, apparently one reasons UK went 12 weeks instead 3-4 (along getting people part-protected early on, instead half many fully protected) - thought better results group got half-dose second time, turned timing dosage. Italy still require test prior flight land even vaxxed realize rest world well? Deaths, overwhelmed hospitals, unemployment, lockdowns, mutations, long hauler, etc. NZ barely deal that. Israel US well, they're close herd immunity. NZ started vaccinating people. always going people decide ""common sense"" cursory knowledge means ""expert."" sucks, people actually curious world. 

Never hurts info how, when, massk work don't. could find, ton research before, conclusive. feel like without reason widespread usage probably something studied.  course, want people die. CDC website states stopped tracking breakthrough cases May 1st also recommend vaccinated people get tested close contact positive person. 

In contrast, go Singapore MOH website covid 19 click local situation/updates provide synopsis person tested positive even give dates someone vaccinated, covid symptoms, age, etc. Chi-Loong Chan runs local Singapore community website visualizing Singapore data MOH. Singapore government, despite using Pfizer Moderna vaccines, forthcoming transparent fully vaccinated folks transmitting others. 11 yo would actually prefer get lower dose. children younger I’m relieved smaller dose feel confident giving it. time it’s approved time study complete... think dates different one another. called Indian variant it. scientific articles papers start using delta variant follow source information. 

If keep pumping data concerning delta variant yet keep renaming Indian variant, creates confusion. following source, nothing political lmao. everything political people wonder they're going play one song starts quiet gets loud. Good. researchers found wearing mask talking reduced particles directly mask average 93%, bottom 91%, sides 85% top 47%, although substantial variability individuals. got similar results team used simulations model overall reduction particles due wearing mask, allowing leakage around edges. calculated overall efficiency masks 70% talking 90% air escape limit overall efficiency surgical masks reducing expiratory particle emissions, masks nonetheless provide substantial reduction,” Cappa said. “Our results confirm mask wearing provides significant reduction probability disease transmission via expiratory particles, especially infected susceptible individuals wear masks.” complete lack understanding protects. Zombie bites isn’t one them. got ""reactive"" result included antibody blood test donated vaccination. ""negative"" time. 

For whatever worth. actually take HIPAA training hearing always make kind smolder. Besides obvious ""Vegans eating 10lbs red meat week"", look demographics vegan see? Surprisingly rich turning vegan (surprised me!) often less affulent, **young** demographics vegetarianism veganism common.

I'd like see study account age wealth comparisons.  even read comments. OP said countries need more. “table 4” actually thought. would make sense. writer article presented ""they've tested fraction cases, therefore likely higher"" make grand statements ass zero evidence back up. sure maybe takes awhile sequence time get statistic it’s already changed. Since it’s infectious maybe assuming it’s growing faster rate. part ""both fully vaccinated tested negitive multiple times fight her"" understand? Nice confirmed guess, although plague rats still struggling basic concepts like ""oxygen molecules smaller virus"" Manager: Wow social distance?

Foo Fighters: No, enough people bought tickets. /s article reading? said nothing like article.  Pretty sure one vaccinated people would still violate Florida law even different one without requirement. Also one openly advertised unvaccinated people would seem like massive liability since staff get sick could sue. DeSantis genuinely nasty, evil person. comment automatically removed linked source may reliable may dedicated mostly political coverage. possible, please re-submit link reliable non-political source, reliable news organization recognized institution.

Thank helping us keep information /r/Coronavirus reliable!


*I bot, action performed automatically. Please [contact moderators subreddit](/message/compose/?to=/r/Coronavirus) questions concerns.*  survey asking people covid going useful. 2 dose trial press release here, November Yeah, get that. know name is. chances everyone masks, there's definitely degree anonymity. describes causative factor. Eating vegan helps (though instant cure for) overweight, overweight tremendously aids general immune system health. proof, existence causal reasoning key component scientific evidence. Right wait everyone catches King Gizzard Lizard Wizard. They’re cranking insane amount albums, variety styles sounds they’re almost bangers. Something everybody swear. Mellow, rockin, trippy, metal. need one refrigerated airplane. It’s trivial. they’ve got body bags morgue.  

So it’s fine. to, source validation official records consent sharing. Similar schools ask proof vaccination doctor. Certainly US countries reached ~50% vaccinated, look national-level large-scale populations.

There brushfires popping due (a) uneven distribution vaccines, (b) population heterogeneity, (c) general insidiousness airborne pathogens. submission automatically removed linked source may reliable may dedicated mostly political coverage. possible, please re-submit link reliable non-political source, reliable news organization recognized institution.

Thank helping us keep information /r/Coronavirus reliable!


*I bot, action performed automatically. Please [contact moderators subreddit](/message/compose/?to=/r/Coronavirus) questions concerns.* Wait, method log-in CDC (US version) verify vaccine status. 

As far understood it, administration conducted States Federal Government.

Edited remove extra word.  Sometimes years prime boost.  rest world needs do. sneak ""streets ahead"" article like nothing? would comfortable indoor stadium 20,000+ people, subway? folks egg allergy still safely get flu vax, usually allergist supervision. Eggs contraindications covid vax. perhaps allergic ingredient? Protected HIPAA Reference: Expired exhale. title original paper( link article) is:

Expiratory aerosol particle escape surgical masks due imperfect sealing Mainstream media negativity bias? Potential bad outlooks get clicks potential good outlooks? DeSantis committed dumbest thing possible.

Wouldn't want embarrass big man flagrant idiot. didn’t know JJ working booster second dose. read NIH currently trial mixing vaccines anyone got Pfizer, moderna, JJ Yup. Look high price tickets, wait tickets hours minutes concert. Watch fast drop price stay away it!

Because weird. Man sucks, glad felt better right away. still refusing done so. think still referring first case brought forth State. fed/supreme court overruled decision bias religion. amazon.com e-commerce website allowed posts comments. 

If believe made mistake, please let us know.

Thank helping us keep information /r/Coronavirus reliable!


*I bot, action performed automatically. Please [contact moderators subreddit](/message/compose/?to=/r/Coronavirus) questions concerns.*  David Fisman Zeynep two hammering angle forever. clickbait. graph shows percentage deaths kids, adults elders. see Brazil different places. show want.

Besides that, Brazil slightly deaths group proportionally kids developed countries many people would hide bite. already hit herd immunity

People keep saying various countries *never* close true. Well, happened Republicans decided edgelord viable political stance. satisfying. seems like many people anti-vax spout stupidity face consequences. It’s nice see justice without idiot die.

Also: pharmacist house arrest mom dad’s place?  Yep. spike shown graph likely result thanksgiving/christmas/new years. see trending along administered vaccine doses closely. We'll see lower case numbers continues trend. eggs used production either mRNA vaccines (Pfizer, Moderna) adenovirus vector vaccines (Johnson Johnson, Astrazeneca).

Most influenza vaccines produced eggs, none Covid vaccines approved US made way, sort egg protein them.  son newly 12 second shot knocked day. bad body aches felt like could barely walk. sat couch entire day, moving go bathroom. next day completely back normal. mean cruise lines access information. Important point blood clots, micro clots, known symptom. random new thing, smaller clots causing new issues.  Yup, missed point think they'll remove ban? can’t completely attribute decline vaccinations though. It’s also seasonal. look curve live NJ, it’s almost exactly spring last spring. low rates summer 2020 cold weather came back fall. It’s little lower now, I’m sure vaccines effect, don’t think we’re really going see full effect fall. Heh, know invade kill cells every organ persons body, cause sorts neurological issues. odds us finding even long term issues roll forward significant. 

As opposed shot vaccine technology studied something like decade now, well understood, shown long term impacts. refusing allow dying people leave see families, barred entry.

This past year shown lot different societies. nothing important everyone's lives stay healthy prevent others getting sick, litterally point living protect stay helthy mean that's fair. It'd like asking Dave directions venue. venue guidelines. Seems like require vaccinations attend though good them. point whether children ward exposed potentially infectious adults. kinda weird, gotta draw line somewhere guess. hard study based sliding dosages. Although agree, almost everything really customized dose body weight. cultural thing suppose.  God forbid put people scale measuring shot.

With thing think matter much. tiny amount mRNA. yep, I'd kinda rather son get full dose too. talking about??? anti-vax people dumb deny science, allowed society Unless you’re Canadian! live Canada wait 2057 open Lmao would death trap somehow conspiracy them. aren’t eggs Covid vaccines far aware 😘 Humira. Requested approved labcorp spike protein test. week hit 2 full weeks post shot 2. know value amounts protection, I'd like know I'm average, low, none. adds level comfort even test cells take look, lot came Israel initially (they excellent studies vaccinated population quickly). honesty, enjoy little Rolling Stones’ music. I’m fan Mick Jagger’s voice. opinion, Wasting Light enjoyable album Exile Main Street. gonna tell subjective opinion music wrong?

Just don’t like Foo Fighters doesn’t make worse Rolling Stones. think opinion Exile Main Street fantastic album completely valid, opinion, like opinion Wasting Light.

Music isn’t competition, it’s fucking useless time-wasting so. treat music “what’s best” miss lot great music. Flu fighters CDC currently recommends single, valid vaccination series (i.e., either two-dose mRNA COVID-19 vaccine series single dose Janssen COVID-19 vaccine) administered. People recommended receive one complete COVID-19 vaccination another name J&amp;J vaccine).

Will interesting see recommend 2-dose J&amp;J trial reports out.  using 'reputation' though, reasons behind actual outbreaks cruise ships trying connect norovirus cruise ships they're plague ships. Yes, coronavirus different, reasoning using norovirus completely wrong. take joke. Aside occasional lockdown, Covid something Australians watch TV.

Australia's response excellent. 

Of course appreciate delude actually agency lives, anything totally dependent others around wider community. Covid must nasty shock, find must follow directions good everyone, understand lives conditional things control over. good time grow perhaps. private, tell getting vaccinated room hundred people it. Fitting AIDS deniers putting massive show still middle pandemic. long test people and/or validate vaccination, there's really reason let people fly in. Even tiny chance someone false positive test successfully forges documentation, risk longer outweighs benefits letting noncitizens enter.

*Especially* since U.S. citizens flying back high-risk countries unimpeded throughout pandemic anyway. Honestly even good vaccine might enough dozens people covid close quarters, since crowd tends older weaker immune systems. Pennyroyal tea. China population ~21 times bigger UK, we're average 500,000 doses day, almost double UK doing.  AZ 2 dose vaccine. Even though technology similar, think extrapolate half prescription AZ full course J&amp;J. It’s extract article. post appears vaccines. encourage read helpful resources COVID-19 vaccines:
  
[Vaccine FAQ Part FAQ Part appointment bot, action performed automatically. Please [contact moderators subreddit](/message/compose/?to=/r/Coronavirus) questions concerns.* European here, planning New England road trip while, I'll sure come over. I’ve heard many horror stories, people waiving inspections, appraisals, etc. glad bought house 2018. Housing skyrocketing country, bud. reaching new level stupidity world hard understand. Magic Hat trash beer since exited Vermont anyways. Sold brewery Zero Gravity. Australia time action like this. Also, think may miss-characterising people masks. people spoken to, acknowledge carriers wearing masks reduce transmission, believe governments able force individual people wear masks, get vaccines matter; really political stance government power medical appraisal. Right? Hill Farmstead, Alchemist, Lawsons? many amazing options guess own. thinks that? see single comment thread suggesting might think that. Everyone knows China huge population. I’m Vermonter getting 2nd dose morning. LETS GO. many fully vaccinated test? 267 tell us much load doses dart guns drive around areas low vaccination rates dart people walking by? wrong? sounds might infected home party days bubble. short clip party title video mention gangster rapper 1.Cuz also party.)

This new level stupidness even Sweden still acknowledge airborne presymptomatic transmission. beer

You Heady Topper Alchemist. needs said. Sold! literally fairest comparison Canada nowhere near highest first shot country world, Canada even domestic vaccine manufacturing capacity. Tbf, I've also kmown woo-woo doctors. disturbing. friend got 2 doses Pfizer one dose J&amp;J. definitely possible. could probably get four brands states point really wanted to. find studies convincing personally, lab conditions replicate real world. often someone come right sneeze face? Pretty much never... happen, need study tell mr sneezer wearing mask going reduce transmission probability... really want know much mask wearing reduce transmission normal real world situations, two people coffee together example. Like 7th caller radio show, give 3,139th person prize. Maybe year's supply cheese maple syrup. I’m little reluctant call Ivermectin either bogus drug proven treatment COVID yet. Summer break kids mid July, plenty time swap diseases :( Comparable *orders magnitude*. People see 20 million think: 50/100 *times* faster country. close case. don’t understand. perfect storm gave Vermont lead? comparable currently 50% 100% faster? beautiful 

thank assume j&amp;j need booster too... right ? hair looks like colony lice trying leave sinking ship moral compass. Exactly! that’s dope :) thanks sharing biggest difference age. U.K. vaccinated ninety-lots percent vulnerable 30s, sociable. 

So USA probably lower transmission higher deaths, situation delta U.K. possible ? joking? :) THANK !!!!

it’s annoying !!!! 


fuck!

like many cities one shot vaccine drives stadiums stuff everyone getting vaxxed first 

it’s annoying :( AZ 33% efficacy 1 dose. Would J&amp;J similar? Yes. per capita fairest comparison. Germany vaccinating 1.5% population day, China 1.5% would equally impressive. you’re saying like saying India much richer country Denmark higher total GDP Yeah, actually think it, messed percentages head. Still, point stands, least comparable countries soon? Would people still need follow covid precautions? post appears vaccines. encourage read helpful resources COVID-19 vaccines:
  
[Vaccine FAQ Part FAQ Part appointment bot, action performed automatically. Please [contact moderators subreddit](/message/compose/?to=/r/Coronavirus) questions concerns.*  school year already WV. speaking reason attended school virtually entire year return back person school fall school starts again. trying make feel guilty purpose, daughter extremely sensitive afraid returned school (prior vaccinations available) would unknowingly bring virus home me. fully vaccinated worries getting COVID gone. mean Dunkaroo’s? Germans burning things one man? heard one before....  would China repatriate citizens Australia China pandemic mostly China?

That make sense.

