,date,text
I struggle children constantly think it’s witty funny say something slightly hurtful causes reaction. didn’t teach that. Mr. Rogers didn’t stand that. Nobody actually thinks work. mainstream media propaganda make unvaccinated look stupid. people lived used go doctor thought coming cold flu get penicillin shot. thought antibiotic worked prevent virus, doctor agreed this, never understand.  +20 virus defense 
+17 virus defense 
+12 virus defense 
+15 virus defense Less ten percent available beds still free [in Hesse]. 

Regardless everything else, let's please stop reporting number. super misleading. hospital beds *always* occupied, completely independent COVID19. Currently, ~12% beds seem used COVID19 patients. Looking like this, 10% free means half available capacity free, tenth.  sufficient keep cases check, sufficient bring cases down.

There difference starting 2.000 cases per day try keep level starting 25.000 cases per day, case *bring cases down* risk clogged hospitals.  remember ""Look helpers"" thing much helped child went crisis. also stood up, rudely loud anything, front Congress. wish still alive try see idea would dealing world right now. 

 glad share old episodes Mr. Rogers also Sesame Street kids try show people world care, even obvious right sometimes. brutal. still chest pain six months that. That's take COVID stuff seriously, even fraction H1N1, want nothing it.  real? Wow 😂 Oh internet points people follow celeb advice! Yeah wow revelation.

When cases low easier keep low, know 18 months now. 
When cases already exploding, measures less keep R stable 1.00 sufficient. 

That's said late already Netherlands implement rules. mean, huge part world said Christian countries. IIRC news report international worker (I think officer shipping line), wound getting half dozen vaccine shots, countries work would recognize others approved vaccines time (e.g., Sinovac, AZ, Pfizer). may many good reasons boycott Tesco, surely one them.  Thank much helpful reply. We’ve always told kid one million, proof! Appreciate it! Ah well. 5-11 get majority people able get vaccinated months. consequences unvaccinated them, placating. bet Ted Cruz gonna tweet this. anyone attitude deserves repercussions repercussions. toys unvaxxed Christmas, serves right spending last 2 years throwing . Merry Christmas rest us 🎅👍💉 unlikely matter much. Getting booster sooner much important choosing moderna pfizer booster. Maintain hand-washing vigilance keep wearing mask might able avoid colds flus. Probably interacting maskless children age absolutely distancing. Plus, lots parks covered slides pockets stagnant air waiting covid delivery systems. Scott Gottlieb talked hit pointless spend effort attempting reach 18% NOPE vaccination. vaccinated people unvaccinated. effective thing make sure vaccinated completely equation terms getting sick transmitting. That's easy AF achieve people problem getting boosted. going far better results taking 70% people equation completely brining infection 95% (from 50-70) reaching maybe 1-2% 18% get vaccinated circumstances.

This entire conversation dumb AF. blame Tedros started crusade boosters right Biden's administration put forth boosting plan. Subsequently boosters torpedoed FDA CDC. bullshit us want lack data, data clearly there. Israel ones gave 0 fucks right thing. Look sitting pretty 0.5% positivity rate now. Last week FDA asked Pfizer refile boosters likely get authorized everyone shortly.

Of course entire freaking hoopla, mixed messaging, infighting scientific community vaccine efficacy infection/spread... usual day late dollar short approach plaguing us since pandemic began. boosters implemented Biden's administration planned, we'd FAR better place. Absolutely. plague-bearing needle-dodgers seen? Count in! Almost killed young healthy happened. Wound whopper hospital bill, too. Get flu shot, people.  Intellect? high school grades enter college attended Butte JC. graduate. enough credits Cal accept transfer, graduate Cal, either. degree. estranged family behavior toward them, least that's implication. primary source health information seems failed comedian hosted show people paid get box full spiders. Well, there's global pandemic, possibly worst one recorded modern history, wrong full vaccinated? ""The KDCA expects full vaccination rates reach 80 percent around mid-December.""

They'll fine then. Probably measuring case numbers anyway.   Shh. 

If think they're beating system getting vaccine ""reversing"" it, say power them. Fellow 2009 Swine flu sufferer here. Holy HELL rough one. 

I very, rarely get flu - think maybe three times life. Swine flu crazy bad, stand bed couple hours weak tired. I've never run fever like since life. I'd sitting blankets could find, shivering bad teeth chattering, fever broke I'd instantly soaked sweat. Like drops would start rolling ribs, crazy. also concern high fever got - using ibuprofen tylenol keep still nearly hit 103 one point. (I late 20s point good health.) I'm fat lifter shop MORONS-R-US anyway. military dependant went South America family state department duty, lots shots, many shot. yeah, fully agree shake head notion military personnel refusing.   measles something worry I’m vaccinated it? 6 months 13 yo Dec 3rd. bit overweight I'd really like get booster. unless approve age group see way get one. seriously saying children Philippines school physically nearly *two years*?

I dread think long term knock-on effects be. Man, true failing society we're producing Fred Rogers type humans.
 
We constantly bombarded hateful people ideas, need strong peacemakers.  saw ad thought pandering anti-vaxers.

The whole advert stop (having big christmas) caters people furious lockdown last Christmas.

Nobody advert, including full plane wears mask.

The border agent grumpy looking beaurocrat.

Seems managed piss everyone off. Thanks lot. helpful else get sweet clicks? documented rare others might commonly see it. apparently goes away would good report doctor documented official side effect.

From Pfizer rashes BNT162b2 recipients (observed arm, torso, face, body, consistent pattern) considered related vaccination; rashes mild self-limiting, onset typically 7 days park, that's like 0.001% chance getting it. buy kid lottery ticket :). Anyone know dose administered booster? US, Moderna booster dose (.25mL) half dose given primary series (.5 mL). believe mix match research used full dose boosters trials, half doses ultimately approved. I've seen father's cousin. still alive least 80 years old. pretty rare.  It’s time stop focusing case rates focus hospitalizations deaths. It’s become clear vast majority serious covid cases unvaccinated, vaccinated populations extremely well protected. 

We can’t hold world hostage willingly unvaccinated people. kinda needs it. Even get sick, according Fauci, deer risk ""War Christmas"" keep hearing about? Hey, wall. keep out. elves vaccinated tho Ask Taliban going. know, know. I've 3 jabs Spuntik year (2 doses regular vaccine + Sputnik light booster shot summer)  


I vaccine tour get EU Green pass EU, WHO, US recognize Sputnik legitimate vaccine, even though I'm walking antibody point Millions people think way.

It's science, trust. Facts matter people, finding someone trust. default mode human thinking, even though strange educated westerners.

This deniers present sort credible argument climate change, COVID vaccine, election results. sow distrust experts get millions people take side. I've asked really info tinnitus recognized rare side effect, studied. got mild tinnitus J&amp;J really want get booster - really want risk getting worse. hoping tinnitus limited J&amp;J, sounds like potentially cause it. know effect random i'm susceptible side effect. Yeah, get vaccinated, they'll get covid passport detox themselves..i see flaws. Get Thanksgiving. Get Christmas. need avoid another huge winter wave. easy forget, since generally hospitals morgues due COVID.  talking cemetery go walks infant child section. pretty big mostly dates vaccines Unsurprising. Looking forward booking booster soon can.   want idiots State Charge Cards anyway! I'm ok maybe people get vaccinated get vaccine passports. matter that. Process website. Publish federal register wait 60 days public feedback.  Adopt standards.  Even talks emergency orders 6 months made permanent.  Here's thing: denial, resentment. denial merely way resolving cognitive dissonance asserting tribal identity. 

They understand climate science, making serious case climate science wrong. Rather, see issue one ""people best interest heart telling sacrifice intention themselves."" 

That immune facts. never facts, trust. Also, default mode thinking humans. Logical analysis reasoning much exception. people start recommending drinking bleach   hear ya. it’s hard. it’s easy tell people dumbass AR someone brings name. sounds entirely concocted way justify getting vaccine vehemently claiming things anti-vaxxers claimed it.

Hopefully means they’re finally coming around You’re 4 steps ahead! Oh, number - perhaps - generous estimate.

I personally know someone (she got anyway, really rough her) speculating near zero. personally know many people. 


edit: looked information. certainly appears lower 3%. I've seen anywhere .3 2%. talking them. talking vaccinated people. humoral immunity vaccination/recovery. immunity wanes exposed many times time old. virus also likely forced mutate eventually better completely escape immunity likely come cost fitness virus.

It unlikely there's kind reset virus goes back lethal.

It never cause zero deaths, immunity lifetime exposed it, it'll become another viral pneumonia. known ""the old mans friend"" tend get everyone end, often eliminate suffering chronically ill elderly.

And there's precedent respiratory virus this, since 1918 H1N1 pandemic came back every season seasonal influenza. come back pandemic waves killed 2.5% population every years.

And H1N1 jumped back humans 2009, everyone born 1957 T-cell B-cells H1N1 partial immunity took edge 2009 pandemic since older people partially inoculated ravage nursing homes. conclusion one draw mix match boosters? Okay get vaccinated bathe poison want Well fair, don’t issues come territory age group?   Madej spreading lies money Hmm definitely disagree assuming many people irresponsible. Everywhere go, people masked staying 6ft away. high vaccination rate, Vermont showing Covid always us. political science, epidemiology. I'm familiar generalized social science methodology quantitative methods necessarily specific tools epidemiologists use or, whatever reason, avoid using.

This study makes weird choices. eye, choices bad enough find difficult understand made review.

(1) country study, they're looking confirmed case rates particular week comparing vaccination rates. would mostly measuring whether country before, during, delta-related surge.

(2) analysis US counties boxplot bar chart. including manner actual analysis generate estimate statistical discernibility?

(3) Even treat using figures instead analysis acceptable, figures US counties show appears eye obvious downward slope -- relatively highly-vaccinated counties better. Frankly, think they're showing estimates statistical discernibility here.

(4) analyses countries counties weight population size, means low-population countries/counties over-represented data. Low-population countries/counties inevitably going noisier levels vaccination rates covid.

(5) They're reporting percent counties increase. Why? dumb. raw information simply compute change case rates use DV. wish twitter would get rid trending tags feature media moronically abuses it. bet 80% tweets causing trend people ridiculing it. Poor John Green, caught crossfire. Honestly, issue they're couple dumbasses, people (speaking generally) always want listen sports stars/celebrities issues specific expertise. 

This seems bug human beings wired. post appears vaccines. encourage read helpful resources COVID-19 vaccines:
  
[Vaccine FAQ Part FAQ Part appointment bot, action performed automatically. Please [contact moderators subreddit](/message/compose/?to=/r/Coronavirus) questions concerns.* Unless mutates something far deadly totally vaccine resistant it’s going end humanity. Relax. high school grades enter college attended Butte JC.

This incorrect, receive D1 attention high school, 6 ft 180 underdeveloped, academics issue. 

There enough evidence dumbass, need fabricate another $39.99 they’ll restore virginity balance midichlorians. study. letter editor.

In letter, authors discuss superficial look several sources aggregate data correlate well allow proper correction factors.

We done here. Yeah pretty much saying 2 shot initially. count 1 shot giving adequate protection. heard recently baffled. always meant ""okay"" going take away next? centro-oeste region. may depend region, since Brazil major regional socio-economic differences. getting 3-5% number from? New Zealand government’s vaccination advisory panel estimates fewer 100 New Zealanders able get vaccine medical reasons. That’s country 5 million. many people eligible another vaccine future, NZ using Pfizer moment. 

The number people legitimately cannot get kind vaccine tiny, inconsequential number. It’s almost nobody. Variants, allowed exist passed many(even though majority) irresponsible people. submission automatically removed linked source may reliable may dedicated mostly political coverage. possible, please re-submit link reliable non-political source, reliable news organization recognized institution.

Thank helping us keep information /r/Coronavirus reliable!


*I bot, action performed automatically. Please [contact moderators subreddit](/message/compose/?to=/r/Coronavirus) questions concerns.* government, function constitution required (to best abilities) ""promote general welfare"" population.
  People United States, Order form perfect Union, establish Justice, insure domestic Tranquility, provide common defense, promote general Welfare, secure Blessings Liberty Posterity, ordain establish Constitution United States America.

One thing ridiculous individualists seem gloss government specifically setup ""promote general welfare"" population. means public works, aid, even \*gasp* welfare/healthcare wrapped that. also one core principals constitutionally gives federal government right institute public health safety measures. 

I mean...Washington required vaccination troops, one guys wrote damn thing, think arguing solid ground trying challenge constitutionality vaccine mandates. didn’t say wouldn’t weaken transmission everyone fully vaccinated boostered time (clearly vaccine effectiveness wanes) - realistic that? always people refuse also people cannot take it. people coming countries potentially bringing new variants them…People bad side effects days even true vaccine injury shots going want booster risks every 6 months indefinitely…

In many countries traditional 70% reached herd immunity - it’s enough. Also, UK health security report, showing seropositivity COVID antibodies (whether post-infection post vaccine - though distinguish two) 96% adult population. Yet case numbers high. I’m beginning think herd immunity simply possible virus (like isn’t common cold) unless manage vaccinate everybody - babies medically exempted. anyone left uncovered, variants form continue infect people. variants surely form amongst vaccinated get infected sick, right? 

We still getting vaccinated, course - especially health. need treatments perhaps better vaccines line really want make pandemic thing past. Well, tried. probable subnotification hidden numbers. Yes app used clubs bars. data shows clubs bars cases. conclusion wrong: like checking yellow flowers yellow, ignoring others. Weird. Well, gotta trust science.i suppose. Exact me. chills, fever, etc 36 hours second Moderna dose, anything Pfizer booster. Also got flu shot time booster. research based b/s premise seem agree cling it? 

SHAME **The authors support vaccination**. say measures like maintaining safe distance, handwashing, promoting better frequent cheaper forms testing needed well:


“The sole reliance vaccination primary strategy mitigate COVID-19 adverse consequences needs re-examined… pharmacological non-pharmacological interventions may need put place alongside increasing vaccination rates.”  Time invest Borax!!! Dang. That's expected happen. felt fine. post appears vaccines. encourage read helpful resources COVID-19 vaccines:
  
[Vaccine FAQ Part FAQ Part appointment bot, action performed automatically. Please [contact moderators subreddit](/message/compose/?to=/r/Coronavirus) questions concerns.* Four hundred years later..... hope elves vaccinated well. 🎅 now. Keep mind example Austria denies green pass single J&amp;J shot. sure countries follow. get stuck *are baddies.* Mindset forget antivaxxers everywhere.    dont think people getting vaccinated overly concerned taking risk-avoiding measures  Gotcha, dive deeper, thanks chiming :) LeVar Burton reads it? Wow! definitely check out! seems like genuinely caring person too. 

 like learning people love realize everyone human good learn whole person instead part shown.  Tell Vermont. state one highest vaccination percentages, strict mask mandate, etc. experiencing record number covid cases hospitalizations. what's going there? Great insight, appreciate it. check Scott G. Literal first word ""INDOOR"" dunce.  Now? get triggered someone says “merry x-mas” “happy holidays”. also bitched Starbucks cups. tradition find something outraged holiday season.    Moderna #2 gave symptoms. Moderna Booster gave fever chills 2 days. Things come mind reasons:

A) less social distancing
B) delta variant
C) big events happening again

Not argue here. mentioning. want discuss 😅  places go.

... stick it. would real incentive go there. I'm tired getting hairy-eyeball anti-maskers grocery. 

Like, dude... see cashiers? See still wear masks? long wear mask indoors, too. fair. heard ivermectin blow everything system. vaccines give type protection infection. simplify lot: vaccine, say, halves chance becoming infected, things like opening society makes one 10 times exposed virus, end result one 5 times likely get infected. reason see fivefold numbers cos vaccines likely result asymptomatic infections, means less testing.

Also vaccines may halve probability infection, mean probability given exposure drops 65% 15%, something like 2% 1%, long time exposure something like 21% 11% (the Dutch study spread within households).

Many factors make bigger difference. seasonal variation alone huge already vaccinations.

Edit: Dutch souce OK, uneducated downvoting me? know talking downvoting please explain why.

Especially since two top comments said did... Singapore, Moderna booster also half dose given primary series.

Source: booster dosage Moderna vaccine less 100 mcg used first two doses. data shown 50 mcg dose effectively boosts immune protection COVID-19.* similar thoughts summer listening biography. really recommend it, especially audiobook form Levar Burton reads it. It’s extremely calming, better sense well-rounded human still liked person. felt awful Moderna #2. Moderna booster caused nothing sore arm. mom reaction Pfizer 1&amp;2, felt awful Pfizer booster. Seems random! Variants irresponsible people(using masks, social distancing etc. less). I’m totally guessing here, likely due poor vaccination rates people sense returning normal. you’re trying make type correlation question, pray may bring answers seek? Frankly, I've neither seen heard evidence intelligence. throw football. OMG STOP BATHING ROACH POISON!

Something distinctly unprofessional begging trashed despite obviously good advice like right? sure Biden force issue. mean governors making recommendations seek.

Plus many doses ready go. could give basicly sterilizing immunity good chunk population matter weeks  Santa communist like Big Bird Still, trouble getting college due academics and, frankly, anyone would take animal dewormer follow Joe Rogan's advice least dumb ass. try avoid using moron describe people like that. Subsequently boosters torpedoed FDA CDC.

I think including CDC inaccurate. Pretty sure saying FDA ultimately powerless handed CDC blank check CDC proceeded write generous possible guidance high percentage people get boosters.

I mean, shoot, even opened door states like Colorado say ""Due high spread, everyone lives high risk environment"" curious osteopathic doctors likely recommend things like this? could coincidence seems like see D.O. pop often anti-vax content. Hahaha . fools money easily deservedly parted. FYI get booster pretty much anywhere US even hasn’t officially approved demographic. people turning away second shot less 6 months ago  Rodgers actually intelligent there’s fine line. personality, ego intelligence trend certain directions end people like L. Ron Hubbard Lyndon LaRouche. Listen press conferences that’s kind is. That’s exactly Big Apple desperately needs order avoid another disastrous pandemic like last year 😷 🍏 🍎 Sounds like one big reasons increased infections everywhere waning immunity - 6 months boosters needed. Combine waning immunity covid restrictions, anti vaxxers time spent indoors winter get. Rodgers moron. Testosterone, muscles, IQ rodent. Worthless QB, human. stupid comments reflect **Green Bay Packers**, fire guy moron Allegedly.  technician probably hates job took Yup, unfortunately that’s problem lot Southern states. I’m SC, many people well taken stance “I refuse take safe, effective vaccine grounds Democrats say it’s good thing. might die, least I’ll pwn liberals.”

Cutting nose spite face. Quite sad, really. Really? shitty click bait article crap source reflect reality? shocked! Truly shocked! /s Here's problem: least US, people waste time thinking something to. read headline instead full article. 

So point messaging. 

If read full list criteria makes eligible booster, absurd covers like 80%+ adults US. must people that. read headline says, ""FDA CDC reject Pfizer's request approve boosters adults"" think, ""well shit, guess can't get booster."" NEVER THINK AGAIN.

The FDA CDC fumbled messaging time time pandemic, point inexcusable they're still getting wrong consistently. covid numbers high? Obviously that's 2/3 population, still. countries around numbers breaking records.   distrust spread around quilters? I'm sure people shop Morrison's Asda anyway, based sheer amount anti-maskers I've seen stores. rates fully vaccinated people (of entire population):

Sweden - 67.72% 

Germany - 67.53% anyone noticed seems increasing radicalization pro-NPI people social media (Ding, Lucky Tran, Yaneer, Denise Denwald, ""MDs"" platforms really seem real), that, pretty much everyone moved on? Even areas technically mask rules, people seem kind ignoring doors.

Do radical social media personalities stock masks? filtration systems? afraid loosing followers fading away obscurity? grift? heard dad's friend's sister's uncle's hamster's nephew's coworker, chiropractor, beat head mallet 69 times full moon, vaccine dematerialize inside veins detox body. Stop bus people! conservative triggered something don’t like.   comment made day. ☺️ Yay borax! less covid carriers. you’re telling still hospitalized spread virus post vaccination? less likely? 

And don’t believe got vaccinated “reduce risk test.” Can’t arm vaxxed syringes car purses/backpacks, ‘infect’ in-vaxxed? Germany seeing high cases people getting vaccinated?  It’s largely meaningless though. whole point everything keep people becoming sick, overrunning medical system dying. 

Stuff like Austria locking unvaccinated people precisely stuff like this. doesn’t matter much vaccinated person symptoms transmits another vaccinated person also symptoms, go daily lives. problem gets person end ventilator hospital.

When wild animals catch you’ll never able fully contain it. people hate cancel culture sure love cancel culture That's true. Lesson: unvaccinated Florida.  good authority it’s effective second shot — that’s key getting properly detoxed. anti-vaxxer's list ""conversation stopper"" words/phrases think shut inquiries people leave alone. thought saying ""HIPAA"" would enough, ""religion."" fails people keep pressing, usually get belligerent pretty quickly. problem get bunch contrarian blowhards, force become opposition stupid wrong. compromise contrarians, go get whatever want without considering views actual facts situation.

So contrarians force become uncompromising approaching things good faith.

I think Mr Rogers anything showing response dealing people acting bad faith. there's way much bad faith running around right now. I'm willing say bad faith right use be, idea reject common idea ""things use better"" usually espoused people ignored true situations past. Oh God damnit came back wtf here. Moderna 1, problem. 2, laid out. Fever, chills, malaise, joint pain. Moderna booster yesterday--just sore arm.

I've read reacted first dose Pfizer/Moderna second, means COVID. way around, reacted second shot, COVID. I'm curious non-reacting booster means, anything. thing Rodgers proven be, smug. Soon everything way. Sometimes stars something intelligent say. glibly shrug Covid extremely dangerous. That's people like AR Matthew McConaughey keep opinions quiet. many people think they're ""experts,"" want believe are, anyway. So, saying anti-vaxxers would upset US, previously said? sure effectiveness judges' rulings. Unconstitutional mandates government stay home leave house would ACLU goldmine. thought legitimate case they'd it. Thank young minds. going rant veteran 60, taken vaccinations life. 

But blessed see comments know world good hands.

