,date,text
0,2021-04-16," great idea honestly. Well played Alaska *not* ban, bilateral contract vaccine manufacturers could've signed country. US also spent money front, act like anybody deserves move ahead line. export bans.

The defense production act around since 1950 also export ban, simply moves *vaccine manufacturers* front line comes procurement raw materials, also export ban. 

Trump's executive order nothing toothless flex declares America prioritized, actually anything contracts vaccine manufacturers. Reading experience co-worker flying back Taiwan sure sounds like tightly enforced mRNA companies already making boosters target B-351 (South Africa) that. enough indication needed. submission linking google.com automatically removed source may reliable may dedicated mostly political coverage. possible, please re-submit link reliable non-political source, reliable news organization recognized institution.

Thank helping us keep information /r/Coronavirus reliable!


*I bot, action performed automatically. Please [contact moderators subreddit](/message/compose/?to=/r/Coronavirus) questions concerns.* likely missed vaccine link trial, added they're reviewing records. depends. want bring mutations start hotspot etc. area (Virgini) statewide mandate. Leaving business would tricky would competitive, business requiring masks would get less business don't, people would complain business owner rather state local officials. go back U.K.? Dr. Scott Gottlieb estimated 30% population exposed end January. confer 100% immunity people immunity. percentage surely higher now, maybe 40%.

I agree probably percent people natural immunity. really studied makes sense based numbers.

Add 35-40% vaccinations overlap groups think we're surely 50% immunity, probably 60%+. would also explain dropping cases almost every part country. think we're almost there! take much public transport, I'm ton 2 kids daycare. Healthy eating tons exercise seems work me. happy lower case counts US, US came around vaccines, Canada suddenly realized completely fucked.

And thing ... people Canada seem get it. seems like still stuck mindset better everybody ... like said comment. think problem lies fact Canada innovate competently unlike USA. get second shot today! Unfortunately, I’m also hungover. Sigh :( Meanwhile 40% citizens getting it! touch gentleman’s sausage or... good article exactly 36,000 people involved Pfizer’s late-stage vaccine trial half received shot another half placebo. total, 170 people developed symptomatic COVID-19 — 162 placebo group eight vaccine group.

This 95% comes from, 162/170.

And usually one statistic getting kind symptom, another much lower statistic serious illness death. Like vaccines like 99.9% effective preventing death even overall efficacy varies 62-95%. Nice. Thanks. Talk another time maybe. Bye u/SAKabir 100% correct. theory MMR vaccines protective effect. yet MMR vaccines would likely get ill die, way around... Cool daily reminder vaccines extremely effective catching **and** spreading virus. Carry on. believe varies state. dad vaccinated neighboring state and, example, Ohio allows vaccinating non-residents.
 longer delay doses, time people vulnerable doses without full protection. Optimally, we’d still giving second doses Pfizer Moderna 3-4 weeks, even giving Pfizer Moderna 4-6 months shown increase efficacy.  getting people 60-70% protected (using data UK Isreal) 90-95% protected better making stay 60-70% 3-5 months get 92-97% protected.

With said, given supply constraints, fan current delayed second dose policy. Right? I'm getting tired shit. dangerous **is** causing vaccine hesitancy. thing ... people give fuck attitude USA. Like early pandemic, would hear stories people coming back international travel going straight grocery shopping. people gathering parks chat lockdowns everything closed.

This mentality works USA massive industrial output(like Moderna Pfizer plants constantly supply fresh flow mRNA vaccines gold standard). vaccines. story N95 masks made 3M(again gold standard comes masks). 

I think also reflects incompetence general Canadian economy vs American economy. Probably quick comparison Americans invest businesses innovation Canadians invest ""homes/real estate"". Obviously former much better comes mobilizing resources fight pandemic.

All say Canada used great country live in(in 90s). 90s anymore. wide gap every aspect developing change way economy works things, probably keep sinking down. joined headlines would’ve “Pfizer Moderna Investigating Blood Clot Risks” anti-vaxxers would hit share button without reading anything Something shot remember actual shot, needle, injects nontrivial amount liquid muscle. Regardless vaccine itself, painful shoulder, physical standpoint, like someone punching you. shoulder area actually complex bunch muscles tendons shot goes probably makes difference.

I lift weights pretty big shoulders (humble brag know) felt nothing got shot. thin beautiful wife little muscle around shoulders sore shot raise arm head like 3-4 days. YMMV. Studying potentially solving blood clotting issues associated adenovirus-based vaccines something shake sleeves find solution for. think reasonable Pfizer jump save another company allocation R&amp;D resources really naive.

There reason article saw light day: J&amp;J looking spread blame. Real efforts solving would, arguably should, center around public research teams. Israel, chart know? image caption say vaccine people received. describe see picture: medical staff give shot pfizer biontech. 

Unless explicitly saying people received vaccine way know. PEOPLE... still contract virus getting vaccine. putting random shit body, still eating poorly exercising properly. use heads let people screens tell us think. fuck would give two year old child vaccine hasn’t even tested year, virus 99.9% survival rate? scared? Holy shit slaves country doomed we’re fucking stupid think empathy emotion objectivity logic. Universities open, teaching online part. cases things need person (like labs practise things), pupils go days/week building itself. part online yep... :/

Keep up, it! Honestly think vocal minority. article says 2/3 anti-vax propaganda internet comes 12 people constantly circulate reportedly 80% people 65+ taken vaccine. people posting bunch nonsense twitter mean effect.  Never underestimate thieves. 

I decided fire Oregon Trail week. Bought 8 oxen start, since recommend 6 want get stranded. First week trail, thieves steal 7 oxen night remaining one died weeks later. stuck like month waiting someone trade oxen. convince children almost anything. know parent them. It’s parents fault kids refuse create issues it. CDC says wear masks two layers, completely cover nose mouth, fit snugly sides face, don’t gaps, nose wire. 

Anytime anyone meets face face they're spraying large droplets though, I'm sure get point. Lots friends, family, coworkers regularly meet person, doors, without masks said poor quality poorly fit. force inhalation still enough draw larger particles. 

Contract tracing seemed show vast majority time transmission comes close contact walking room infected person two hours prior. work? would call place due get 2nd shot ask them. need miss appointment probably reschedule you. “In short, Dalcolmo says, that
the new variant prefers young people, youth go therefore exposed.” Indeed, important continue building improving production virus eradicated. absolutely get vaccinated states right now, already places walk-ins large scale including NYC. would go home state specifically state likely high vaccine hesitancy (so states like VA, WA, CA, MA). want absolutely guaranteed get vaccine, would go state high hesitancy walk-in appointments already, honestly think places find somewhere get within 2-3 hour drive.

In terms proof residency, states actually requiring (example: check specific state/site going case -- think easily find something. No, validity. interesting meanings side effects people dream up. I've also heard one-upmanship like, side effects stronger immune system must better.

It's nonsense. Everyone's system different probably lot people exposure virus getting vaccinated. even read article? said anything Americans turning away vaccine Alaska? research structural biology, including published covid itself. There's immense collaboration things countries Europe financed research development that's going vaccines we're seeing now.

Claiming kind German invention blind nationalism. Woo-Hoo!!! Half!!! It’s respectable side finished yet!!! alaska go Yea. work cancer patients. Covid cure cancer. plotline Hangover.

I KNOW HAPPENS IM RANDOMLY MARRYING SOMEONE ENDING TRUNK...

...after going Reddit visit Vegas buffets. 

FTFY think US going start sharing vaccines pretty soon hope friends north one first places. Florida, lockdown, less deaths per capita California, strict lockdown. worry, can't neutralize vaccine wine. Chills sore arm normal. border stuff likely prevent tourism travel, since two things likely means contacts. Alaska gets tourists? 

### Findings

During first surge (ie, June, 2020), 533 381 people tested, 11 727 (2·20%) PCR positive, 525 339 eligible follow-up second surge, 11 068 (2·11%) tested positive first surge. Among eligible PCR-positive individuals first surge epidemic, 72 (0·65% \[95% CI 0·51–0·82\]) tested positive second surge compared 16 819 (3·27% \[3·22–3·32\]) 514 271 tested negative first surge (adjusted RR 0·195 \[95% CI 0·155–0·246\]). **Protection repeat infection 80·5%** (95% CI 75·4–84·5). alternative cohort analysis gave similar estimates (adjusted RR 0·212 \[0·179–0·251\], estimated protection 78·8% \[74·9–82·1\]). alternative cohort analysis, among aged 65 years older, observed protection repeat infection 47·1% (95% CI 24·7–62·8). found difference estimated protection repeat infection sex (male 78·4% \[72·1–83·2\] *vs* female 79·1% \[73·9–83·3\]) **evidence waning protection time (3–6 months follow-up** 79·3% \[74·4–83·3\] *vs* ≥7 months follow-up 77·7% \[70·9–82·9\]). benefit US public gets Moderna taking public funds rights Moderna doses made States.  That’s pretty big public benefit. Uhhh spread uber eats delivery grocery deliveries entirely possible prove. know plenty people left homes work home. get tons delivery though. cases that? It'd super easy contract trace types actually. also &amp; rather sent countries prioritise vulnerable. Rather rich little risk &amp; pay pocket without batting eye. 


This dose, give likely die ultra wealthy. ""Flying blind""?
I thought homing in: really glad media gets information reporting /s province Ontario lot health regions like registration websites shit feel successful, though rest world didnt get shipments promised guys blocked resent US (even lol).

Instead donating vaccines prevent mutation (that potentially could immune vaccines) happening places Covid still widespread, states alaska instead tries profit vaccines giving tourists. fact longer wide spread Covid around, greater risk mutation - US strategy ""vaccine nationalism"" hurtful preventing this. Sorry, really cant respect US - they're shitty short-sighted. First tweet calls numbers horrifying tactics. Second vague. doctors crying schools closed even evidence cause schools closed cases still skyrocketing switching new flavour. Quebec 33% cases us paid sick leave. I'm getting sick people trying bring politics solutions. already crsb. mention workers paid sick leave already.

One thing agree spreading outside. reduce occupancy essential business 25% like they're anything workplaces. school closures outsiders necessary though. friend irrational. gonna tell nobody meets Corona still going spread? Distancing works distancing work. love people complaining shit clue about. Obviously media censored post BS public forum, Corona demonstrations. Omg censored. Stop fear mongering listen experts Facebook groups. verifying mean necessarily state even US ID. 

i went different state residency requirement first dose accepted ID home state. want know i'm right person record gave to. understand could gotten away even work university ID, though think write driver's license number records purposes. Good point! I’m totally down. Uhm yes do. ? even sure research itself. one man blood clot symptoms J&amp;J trial too.

Before made recommendation like think would probably want find biological/physical reason blood clots rather statistics. think they'd also want wait longer make sure 6 cases seen them. US good deal, vaccine costs 20 usd tourist leaves behind lets say 100 usd taxes... research suggesting UK variant takes longer clear.

New variants people expel larger viral loads means imperfect masks help less. accurate, crucially ignores receive it. Yeah policy put place last year, tables starting turn, Ontario way record spike. 
 
I suspect keep closed couple months vaccination catches up, we're hoping everybody first shot June September. doubt it, even sneeze guards. 

However, Vegas kinda world unto itself, anything’s possible. Who’s tell religious service is? I’m starting own. EU slow &amp; cautious organization compounded current leadership. Jean-Claude Juncker thorn side UK would done much better job. Ursula von der Leyen entire career consisted make mess &amp; run away leave one else clear up. Shes politician whos career based tied Angela Merkel. 



The US &amp; UK ran around throwing piles money anything said covid vaccine. Manufacturers ask money supplies, heres dumpster full cash. need produce vials, heres another pallet full cash. need needles, heres another lorry full cash. Rinse &amp; repeat basically anything needed cash least claimed need it.


There undoubedly wasted money 2 days lockdown costs spent. Germany early took approach moving towards EU unified approach. meant getting everyone agreee work fast situation demanded speed. Anyone else Germany wanna fly me? Well US Brazil tell us something else, sure believe want cherrypick. even close ""pessimistic prisom."" simply wording prefer. land borders closed non-citizens*

It's illegal sides deny entry citizen. I'm american taxpayer I'm A-OK taxes paying vaccines anyone. Much better use money weapons kickbacks trump family whatever bullshit we've spending money Yes European Union purchased AZ vaccine august example, guarantees. BioNTech/Pfizer, curevac, GSK/Sanofi, J&amp;J etc.. Dates vary example (curevac example) phase 3 trials still finished. 
The us earlier Pfizer/BioNTech, get it’s highly questionable one month would made difference. 

You right, legal difference ban contact, doesn’t help say Canada, waiting vaccines example. Also obviously countries like India EU could negotiated similar contracts, didn’t. 
That said, US *there least one executive order* used halt exports ingredients, example lead production problems serum institute India. 
On contrary, example J&amp;J vaccine example produced least partially Europe, shipped US bottling distributed. 

I get points legal differences contracts us delivering earlier, really. point much basic one: everybody would played game US, US also wouldn’t situation right now. Export restrictions make vaccine production difficult everybody. it’s really sad see nationalism hindering global fight catastrophe Covid been..

I won’t link detailed sources said rather refer overviews references hope starts trend :)

I've got good news Yes know risks precisely. able figure set assumptions takes decision borderline case (benefit=cost). would much easy provide feedback probability assumptions accurate. Obviously could case one assumption wrong one direction another opposite can't concentrate one assumption.

But would much easier methodically evaluate decision, bringing research experts comment particular assumption. one FDA possibly expertise areas go this. cant stop fuck **whose vaccine also raised concerns regulators blood clots**, agreed join effort, Journal said. 

jeez, wonder agree join Yeah, prevent death disease right? People always dying, cares? 
/s Hello dear fellow comrade types,

thank reading understanding given statement whole thank adding comprehensible concerns ongoing discussion already announced circumstances.
 
Statements well opinions adressed subject certain circumstances.

Thank interest taking partial action enhancing ongoing process clarificating necessity details public publications.

mfG: Bob take vaccine already covid? Totally pointless since immunity already established. **Not BCG, vaccines polio, hepatitis, diseases could protect Covid**
US researchers study efficacy non-Covid vaccines SARS-CoV-2 virus find polio vaccine offers vaccine may affect course COVID-19*
Kaiser Permanente research finds older adults vaccinated pneumococcal conjugate vaccine received protection recently authorized COVID-19 vaccines remain important strategy preventing COVID-19, investigators found older adults received pneumococcal conjugate vaccine (PCV13), prevents acquisition certain pneumococcal strains, experienced 35% lower risk COVID-19 diagnosis adults receive vaccine. contrast, alternative pneumococcal vaccine (PPSV23), prevents severe pneumococcal disease block acquisition bacterium, associated protection. sure? trustworthy data outside Europe US. reason approve Pfizer&amp;Moderna

What? serious? 

India sizeable number people willing pay Pfizer/moderna jab, atleast vaccinated approving jabs.
We need help get. main problem Netherlands protests people attending protests called “complotgekkies” meaning believe conspiracy theories. government knows thinks people go protests insane anyway majority people support measures, believe case. 

I don’t get people still tolerate either. We’ve lockdown measures coming us since October.  I’m seeing 32 million people visited Arkansas 2019. Tourist... Alaska ... uhm... ok... give healthcare providers time learn them. treatable condition caught early, symptoms vague (abdominal pain, blurry vision, shortness breath, headache) could bunch things. also need managed delicately, ideally family physician would identify early treatment handled trained specialist. AZ honouring contract, think would hauled judge?

If buy EUs propaganda, might wondering happened. Hands like cats. They’re self cleaning, duh. I’ll definitely wear one planes! don’t fly work, I’ve several vacations ruined nasty bugs think picked plane destination. I’ll happily wear mask avoid happening! European here. 


You one successful vaccine supply chains state side ocean distributing vaccine free. 


Why would ? European countries socialized medicine &amp; give away vaccines free. vaccine widely available around globe day 1.


With magic producing billions doses day 1 I'm even living poor country. can't imagine living India Africa.


India worlds vaccine king, Europes importing sorts covid supplies them. UK imported 5 million Az doses, India poor worlds pharma heavy weight. Floridians died well twice rate people state. yeah, can't like Florida? Please send poutine. Kthxbai. Even 40, 50 60% people vaccinated, there's still LOT fuel virus. That's many government officials imploring states lift restrictions reach higher threshold vaccinations, first. incredibly premature every state it. frustrating. US citizens enter Canada truckers heading lower 48 moving lower 48 Alaska need use ALCAN highway.  tests aren’t perfect, correlate academic success college, test everybody (vs. 1000s individual school curricula).

I get people score artificially poorly test opposed genuine potential, casting artificial barrier disingenuous. No, second whack ”Study marine recruits finds covid grants 80% immunity"" Mexico, tourist person visiting family/ friends Texas able get vaccine 1B allowed. provide proof high risk condition residency, know people visiting Europe South America got shots Texas. poor immigrants though people enough money visit month. idea benefits elderly killed many young people last year. :( Buckle up, gf went like fun couple days lol comment I’m responding suggesting “who cares” young adults get they’ll fine. implies taking precautions vaccinated, catching covid. That’s I’m talking about. People catch spread don’t care personally fine. think changes things waiting vaccinated. It’s still important take precautions crowded public places numbers control. vaccinated want gathering vaccinated friends? fun. You’re I’m talking here. know. I’m saying they’re related, agree probably pausing looking good thing. interested numbers. know what... kudos you. That’s dedication. shit Trump get vaccinated TV even that. Man lives spotlight except would actually helpful Oh, blind.  people 20s know want stay home more. Maybe ages got pushed bit 40 new 20. :) No, fully vaccinated masking distancing. over. got second dose pfizer yesterday. Last night really rough. morning im better still weak feels like hangover. long normally take feel normal again? assume meant patron patron, vaccinated staff Yes 60 minutes probably went line little bit let's honest DeSantis really creep. mother 80 vaccinated ready party quilting guild. Elderly don’t want give every aspect lives either. matter it’s federal provincial government blame. 1.2 million (or whatever number) doses freezers almost AstraZeneca. 55+ crowd doesn’t want it, infuriating since NACI recommendation could offered younger people. 

[Great Twitter thread explains mean tbf 1 million like span couple months  It’s bs headline, Canada everyone vaccinated July least one shot. 50 checking in....ready go! yet [test hovering ~3 - 8% last year, indicating there's giant upwelling disease they're missing. Also, ICU capacity excess deaths extremely mild, less people died Japan 2020 2019. Yeah cool know buddy. Masters Biology. Virology one aspect pandemic. rest policy, ethics, civics, economics, risk management tolerance. There's life avoiding respiratory virus. Mutations typically become less lethal more. Wonder true figure disingenuity showing. It’s “open all” it’s approved children. Maybe. new, nan got vaccinated months ago received card. Name date vaccine make batch number.

I think messed card up. social life end deemed necessary never chance hell gonna stop making douchebag money. flu shot help common cold viruses transmit via droplets? Eh, would normally agree you, think climate change guaranteed another pandemic lifetime. thousands Hindu devotees flocked Monday take holy bath India's Ganges river, even nation racked world's highest tally new daily coronavirus infections. full opening economy last year's crippling lockdown, coupled mass religious festivals political rallies states heading elections fuelled crisis. ""With 1.2 million active cases, daily number reaching 200,000, it’s bizarre poll rallies full Kumbh Mela,"" political commentator Shekhar Gupta said Twitter. Get lawn 😤 articles pointing that. I've trying read variant more. Yes, Taco Bell Chipotle, too. Thanks that. I’m tired seeing people defend kind behavior. I’m tired people acting like saying “we normal activities, masked distanced stay safe” equivalent saying “shut everything forever.” feels like us responsible keep paying price aren’t. people selfish, I’m going point out.

It’s also healthy 20-somethings acting way. live NC Duke outbreak tied frat parties shut things down, many students pissed losing in-person educational opportunities need entitled frat boys refused follow rules. Young people close 100% survival rate.

Except problem accurate precise way know mild severe case SARS-Cov2 person person. **GENERIC** (averaged) odds survival ""close 100%"".. cannot exactly extrapolated individually. (you may medical history unknown condition genetic-predisposition makes worse individually). 

Masking social-distancing done because:

* asymptomatic (you carrying spreading SARS-Cov2 aware are)

* can't know exact medical history random people around you. 

Your negligence get people killed. Masking social-distancing tools try reduce minimize that. ""what even point vaccinating people.""

Vaccinations 100% perfect magic wand. Vaccinations tool try give us fighting chance. trains bodies immune system better fight virus (reducing negative effects). .and also shortens timespan spread it.. helps break cycle social-spread. 

But perfect (hence terms like ""herd immunity"" exist). reach high enough number vaccinations,. virus ""wins"" continues spread kill people. Given username, make sense download Taco Bell app too? India significantly younger country. numbers per capita never match US fact alone.

African numbers also low. Age health massive factors deaths. There’s doubt India reporting- almost every country has- scale people thread saying. be. people risk dying hospitalized COVID vaccinated now. aiming get back normal ASAP. think that's OK stay home. 

The media continue peddle fear porn want, we're listening. next pandemic probably lifetime. reason spaced far apart. happened often enough wouldn’t able adapt evolve. Asymptomatic reinfection lead long Covid

