,date,text
I could go on.  catch covid twice. What's science bodies react well catching naturally compared vaccine? really hope medical facilities nursing homes keep mask requirement place visitors. shudder think many lives could saved years people warn masks protect elderly immune compromised. You’re making assumptions know nothing about. diverse workforce there. hateful judgmental? Jesus Christ…. Interestingly 5172 unvaccinated cases, 90 hospital stay = 1.74%, 267 fully vaccinated 7 hospital stay = 2.6%

I expect honest, higher hospilisation fully vaccinated case vs case

Vaccine seems good sterilising ( getting infected ) avoiding hospitilsation get infected seem thw best here. Lmao that’s cap. swear all. That’s common line around parts. Aparently read tha first couple paragraphs article.

There go then. 63% first doses 56% second doses AstraZeneca UK. That's going large chunk vaccinated population left fairly open least minor-moderate infection Delta variant, significantly increasing spread compared US.

We might end needing autumn Pfizer booster shots UK all. Here, dropped 

**/S*****arcasm ...*** 

I think that's reason downvotes. Automatic translation bot, action performed automatically. Please [contact moderators subreddit](/message/compose/?to=/r/Coronavirus) questions concerns.* post appears vaccines. encourage read helpful resources COVID-19 vaccines:
  
[Vaccine FAQ Part FAQ Part appointment bot, action performed automatically. Please [contact moderators subreddit](/message/compose/?to=/r/Coronavirus) questions concerns.*  4.	“It’s cold flu, get every year, what’s big deal one???” worst.   countries could still two months date uptake high, new vaccines would helpful. Federal troops blockade football stadium till vaccination rates 75%. Also lottery getting vaccinated consistently like whole time. stories people prevented seeing dying relatives largely made covid fears.

But given exemptions people entertainment film bringing lot money state and, say, need every single dollar state.""  benefit community actually believe economy enormous Except bring enough quality food 2 extra weeks, getting 2 weeks oatmeal /s literally developed vaccination based relatively new technology combated virus 89-95% effectiveness (depending study variant) window less year yet still articles somehow confirm simple idea masks reduce airborne pathogen transmission. 

Seriously.    Couldn’t figure cake there… Ya, expect spread mostly among young adults kids. summer outbreak last year began towards end June abated late July/early August however vaccines probably take big longer year, maybe mid late July. Alot people denial regarding Delta variant transmissibility among unvaccinated partially vaccinated. \*\*NOT\*\* vanilla variant last summer past winter ... much transmissible people realize this.   get disease extremely low level contagious. Well yes care. Alabama disaster state help vaccinations think should. idea practically though. It’s frustrating could better refuse. Surprised Australians come defend insane covid rules.  easy implement existing HVAC systems. often requires new systems expensive expensive run. work commercial hvac industry. Yep, Vaccinations key. E.g. Canada hit hard 3rd wave Kent VOC vaccinations getting started time. cases plummeted vaccinations ramped up. Delta , doses important. I’d actually assume opposite, you’re actively selecting sequence possible cases specific variant (because contact tracing). Definitely shows priorities. Children treated well USA general compared European countries. expect moms drop daycare 6 weeks old, prioritize quality child care schools. adults school much important kids. criminal justice system took sweet time, thing. Yeah, fucked schools US closed since pandemic began, yet hospitality mostly open. government's goal schools would last close first reopen. majority pubs Dublin well open since last March. really understand someone would go effort create something like this. 

Nation Islam believes lot paranoid conspriacy theories. remembered dissertation concepts. tutor help clarify 🤣

Correlation mean change variable change values variable. yes, given card could easily reproduced, probably even MS paint, printed printer print card paper. it’s meaningless i’m interested carrying around presenting kind virtue check every time go out. post appears vaccines. encourage read helpful resources COVID-19 vaccines:
  
[Vaccine FAQ Part FAQ Part appointment bot, action performed automatically. Please [contact moderators subreddit](/message/compose/?to=/r/Coronavirus) questions concerns.* save dying covid. need promote vaccination, real enemy black community. Double mutant delta nice ring it. CNN steal idea tomorrow's headline one gonna epic, non vaccinated premium gonna rough.  worked hospital, give medical records immunizations. let hospital without them. didn’t take records without consent. better grasp risk vs reward there, opinion. can't figure EU sees education civil right USA sees sort nice.  say, worry much. I'm little worried, too. Definitely something keep eye on. I'm worried others though. Oh tough country barely hesitancy, it. even get stickers Ireland. thought airborne particles talk cough, face mask not.   I'm person super scared variants, fully vaccinated worry much.

I'm super worried I'm little worried. new pandemic. context European countries, children 12 never wear masks including school they've mostly open last year. dumb question. vaccination certificate got final shot two weeks ago still get tested Covid? ...and care Alabama mmmm.... no. causal relationship decrease calories results weight loss. Going vegan correlational. vegan CAUSE weight loss. said yourself, going vegan always cause weight loss. *possibility* calorie consumption dropping. calorie consumption dropping CAUSES weight loss. little time left? news thanks France supposedly opening American tourists tomorrow feel like really unclear. process strange confusing. Interesting. know that. know UFOs playing gigs again. Shhh, pandemic's over.  I've Nudist long time attended two Nude Weddings, even preacher them. issue South surge starting mid-June last year. Southern states protected good percentage vulnerable elderly. going wait see.

Alabama already 8th terms death per capita maybe don’t care? It’s possible. post appears vaccines. encourage read helpful resources COVID-19 vaccines:
  
[Vaccine FAQ Part FAQ Part appointment bot, action performed automatically. Please [contact moderators subreddit](/message/compose/?to=/r/Coronavirus) questions concerns.* ending comment literally say need vaccines cases, thanks omitting “master” analogy.

“Or someone tests positive covid” test? Pcr? Again, it’s cute don’t debate efficacy pcr test reply, even though linked rudimentary video explaining pcr tests, even child could fathom. 

If entire premise testing covid positive (the pcr test) flawed, everything else comes skewed data. 

I acquaintance believed covid never got tested. life person lived quite unheathy, supposed disregard context covids severity? No, that’s scientific. virus comes kills people eat McDonald’s everyday, no, I’m going take virus seriously don’t eat McDonald’s everyday, allow affected take health seriously. Instead people poor health trying blame healthy covid troubles. 

Boohoo friend lost sense taste/smell, literally happens every time get seasonal flu cold. don’t let last 2 weeks, actually something laying bed ordering Uber eats pretending I’m going die virus 99% survival/recovery rate. Remember, mental state one biggest things helps survive near death medical issues. give that’s die. 

If think telling you, know better manage health you, “thinking know better everyone” insecurity issues. Call therapist kiddo resolve trauma promptly. 

Are seriously trying take moral high ground “all you’ve got YouTube video support claim” literally saying “yeah friend got covid never tested numbers actually much higher” 

I used pretext say outright, video sending rudimentary explanation, know word means? Look up. you’re saying outright “yeah friend experience numbers must higher”. Sorry that’s statistics work kiddo. degree evidence support claim? comment overall explaining basic science you, understand you’ll know covid really serious. 

Your immature belief believe healing crystals shows one track minded are, open minded civil discourse, you’re vilify anyone doesn’t agree countries narrative, seems narrative accept support. 

If don’t wish learn anything biased perspective, you’d well fuck right internet entirely. world soon move without Australia You’re pretty dense. phrasing way doesn’t say you’re claiming trying give benefit doubt. I’m asking back saying won’t, can’t. look Delta variant swept England, think that’s what’s next US. It’s going take months likely won’t surge Fall. black people specifically - large numbers white people refusing vaccine (even different reasons).

The disease spreads, likely variant appear evade vaccines... point go bullshit again. I'm saying likely, risk want deal with. sounds terrible terrible can't imagine parents going through. talk exception difficult fragile part hospital causative factor. Here's intuitive explanation: say told beginning pandemic dropping weight would help. research decided change diet going vegan lose weight. would (causally) improve pandemic outcome.

Going vegan automatically always cause weight loss, absolutely causal relationship. Exactly. Last checked 49th 50 states vaccinations. Mississippi good news though know two-dose mRNA vaccine like Pfizer Moderna — get doses — appear effective Delta variant also poses greater risk young people, aren’t getting vaccinated quickly age groups. Alabama, 21.6% 18 29-year-olds gotten first we’re seeing Delta variant U.K. significant transmissibility 12 20 years olds,” Choucair said. “So whether you’re young, whether you’re older, you’re eligible vaccine — country, means anybody who’s 12 — please get vaccinated. It’s never easier get President Joe Biden stated country’s goal 70% eligible Americans vaccinated Fourth July. According Alabama Department Public Health, 35% people Alabama received least one dose. Here's hoping... happy cake day way April, 47 members National Association Attorneys General sent CEOs Twitter, Shopify eBay letter requesting take immediate action bad actors spreading COVID-19 misinformation using sites sell fake vaccine cards. letter read, ""The false deceptive marketing sales fake COVID vaccine cards threatens health communities, slows progress getting residents protected virus, violation laws many states."" Bill sponsor Sen. Anna M. Kaplan said press release, ""We're already seeing anti-vaxxers spread tips online create fake cards order get around vaccination mandates, need put stop effort defraud public recovery pandemic keep moving forward."" you’re dumb enough generalize entire state I’d assume walking nurses right? File “no shit.”  Yup, Variant hitting Singapore. went fully vaccinated frontlines asymptotic spread. spreads happily people fully masked (we superspeeder tutor give like 10 student despite everyone masked); restrauncts spread like wildfire. Quite fully vaccinated people pass on. 3 week dwell time, 10% people getting needs Oxygen. I’ll personally drive Ohio pick Canada. tomorrow needed. Plenty time.  Foo FIYYYtahs causative factor. exactly correlation. said, *helps (though instant cure for) overweight*. 

You defined correlation. Vaccination mandate w/ verification concert. Nothing sort subway.  much. idea, maybe end July / August US reporting actually pretty much spot on. covid deaths line closely excess deaths. No, that. single instance text “table 4” can’t figure find search function interested teaching you. Agreed. lockdown sceptical side especially can't see even consider personal risk virus small (although granted good portion population quite large!), risk serious adverse effects vaccine least *a thousand times smaller*. exact kind reasoning used argue focused protection, seem fallen trap poor relative risk assessment. head in, loudly complain fearmongering virus ones fearmongering vaccines!

Now, could argue Bayes' Theorem multiply exposure risk risk death/serious disease get actual risk level time covid, (for younger people) would justify risk/benefit balance. understand dealing pandemic without vaccine would require large number people get *at point* - words, passing 'recovered' compartment Kermack-McKendrick model somehow, infection vaccination. better latter former. 

All all, herd immunity practical way places world except isolated islands, either vaccination infection. Vaccination much less risky individual level essentially age groups, societal level make infectious practicalities (or impracticalities) shield vulnerable sections society longer considered.  much Alabama vaccinated? lotteries killer. Care give page #? It’s lot pages couldn’t find says this.  ""Just Floo"" Fighters Alchemist rated. Heddy Topper straight good beer, understand people love it. Sip Sunshine anything Upper Pass Brewing beats Heddy Topper hands Everyone predicted this. knew unvaccinated people would stop wearing masks start infecting other.

If wouldn’t listen, wouldn’t get vaccinated going infected.  already Asia, really hope something stick around North America. amazing flu season last year, imagine could accomplished moving forward people openly spreading disease like past. Automatic translation bot, action performed automatically. Please [contact moderators subreddit](/message/compose/?to=/r/Coronavirus) questions concerns.* post appears vaccines. encourage read helpful resources COVID-19 vaccines:
  
[Vaccine FAQ Part FAQ Part appointment bot, action performed automatically. Please [contact moderators subreddit](/message/compose/?to=/r/Coronavirus) questions concerns.* think problem tracts focus much ""What's correct"" bubble questions actually making sure fundamentals quality patient care (oops patients anymore ""~~for profit~~ clients.""😒)

Me sister completing CNA nursing program school covers nursing skills, lacks depth common topics like vaccines, encourages people ""do research"" without telling Nancy Facebook textbook.

We definitely cover anatomy, biology though, mean senior nurses run things.

Most people need science background understand vaccines though. basically said, ""I hate thing, I'm going go anyway people seem like it."" sound backwards. seems maybe suspect vaccinated people could still infected? *cries Texan* get anyway sure? There's practically downside vaccines. deported would get belligerently drunk accost service employees 2am chain smoking? Foreign investors, especially Chinese. :( would contribute torpedo sun. Maskless know could breath. Oh boy! asked wear small piece fabric upsets much he's going really hate shirt shoes requirements gets back USA! decided stop misleading people? funny, see fast rollout ""A lot money resources put worldwide pandemic, got done faster."" rather ""We rushed knows what's wrong it?""

Not mention earliest vaccine trials happened year ago; there's plenty time bad side effects become apparent. vaccines proven safe; everyone get them.  pay tax still lower total COL. people like curious lazy read article, says ""60% transmission advantage,"" means ""60% transmissible Alpha variant"". Even richer people moving apartments smaller houses need extra space WFH  People personally know refusing vax dependent family are, fact, enjoy delving marmalade. ones getting 2001-types people really care politics still pull reddish lever. think done - columns include 

Unvaccinated

&lt;21 days post dose 1

≥21 days post dose 1

Received 2 doses manage amount people calling in/trying book appointments online time.

I called weeks ago concerned second vaccine appointment letter yet number 148 queue (although took around 3 minutes get confirmed appointment immediately).   % anti-vaxers would ever try leave America? Pretty sure correlation non international travellers would high rent small 2 bedroom house, pay $2700 rent. house went market would 1.5 million. CA real estate prices insane. Probably nations can't record deaths lack infrastructure. thanks people freedom refuse vaccine.

people ALSO freedom refuse people job!  Yep. hard lot people see past income tax.  Definitely potential! Make contest states, too. much rivalry states, it’d fence-sitters suddenly clamouring get jabs. also case many us Californians lived whole life despite working hard, never able afford house. find ways save money work remotely, move another state actually afford buy property.

In city average home price nearly 1.5 million dollars. partner work good jobs, absolutely chance buying here. We're moving state year two actually start future feel awful part problem, else do? want rent forever CA prices completely unrealistic.

My goal least work remote, start satellite office another state hire train locals contribute local economy. 1. Theyre exploding, thats sensationalist media crap

2. Antibodies doesn’t equate protection. UK hasn’t vaccinated ton doses, people 30 recently became eligible. Almost spread among unvaccinated younger people. Housing skyrocketing everywhere

It’s global problem due central banker policy 

Sad :(

Nowhere live    take moment, assess comment, realize commenter correct vaccinated individuals perpetuating pandemic. chicken littles like Eric Feigl-Ding tried scare people week week scary new variant really poisoned ""concern"" water. Even delta variant finally turn something notable US (and I'm convinced will), repeated ""we're gonna die!!!!!!"" that's preached people gotten people tune out. punish people getting vaccine, reward get it.  Airlines requiring it. It’s perfect stance take. You’re free get we’re free keep hired. Union employees MIGHT shot beating this. Hospitals likely require too. think fail realize many people healthcare don’t care patients. It’s real result job burn out.

Edit: say need find another job, realize every healthcare worker burned left, whole system likely fall apart they’re already short-staffed even now.   beer visit past Saturday. 

I wore special Santa hat says ""Beer Elf"". Made lot people smile.

I'll back Christmas 😁 Yes, yes do. virus family well-established seasonal migratory pattern varied immunity population spread differently novel virus virgin field. scientists article commenting said thing: travel restrictions closed schools primary factors limiting flu spread. vaccination private talk it, encouraging conspiracy theories put followers risk getting vaccinated

Ditto Tucker. vaccinated, family vaccinated, yet goes TV every night rants evils vaccine.  People recovered virus’ predecessor, SARS-1 still immunity today, something like 15 years later. reason believe immunity would fade quickly SARS-2?

You can’t compare coronavirus flu, caused rhinovirus. Rhinoviruses fast-evolving viruses. Coronavirus complex, built “self correcting” replication feature. virus replicates, second mechanism kicks “proofreads” code try correct errors. makes coronaviruses much stable less prone replicative mutations. Though mutations happen, quickly.

It’s likely immunity fading day. case, lot people would likely see point taking vaccine, also would confer lasting immunity. like people never bothered taking yearly flu shots. UK areas concentrated outbreak delta variant. It’s common cause cases. UK delayed second doses number people give people least one shot. pushing vaccination hard.

Europe surge coming I’m sure mean. US isn’t sequencing enough know widespread delta variant lagged UK alpha Kent UK variant.  state calls decision separately. investors buying house prices areas historically guaranteed sure fire return investment, surely they'll caught people leaving droves, demand must going down? likely US states. NPR telling us, water wet. I'm saying stats good, places publishing stats compare vaccinated vs non-vaccinated groups time frame? hard without in-depth study? Currently living country wont get vaccinated around October November. Thinking visiting another country getting vaccinated I'm there. 

If get J&amp;J vaccine several months later I'm able get vaccinated live, woulf dangerous get well? Basically, studies information getting two different vaccines spaced apart some?

Another option, I'm sure yet. could get 1st dose phizer, several months get second different country. assume problem since same, right? go Jungle Jim's

Jungle Jim's International Market
(513)  exactly 'typical life' argument put forward though it? ""People dying""

I've trying get stats deaths Africa I've really heard South Africa Muslim North Africa. Everything else? *crickets* think different guy though. “When first saw furin cleavage site viral sequence, arginine codons, said wife smoking gun origin virus,” said David Baltimore, eminent virologist former president CalTech. “These features make powerful challenge idea natural origin SARS2,” said. [1]

which apparently bullshit many reasons. Oh please, really hard wear damn mask? You’re reason pandemic keep going forever.  comments like trigger people? Good! shit must go unchallenged. You’re selling maple-scented corn squeezin’s, sir. maple syrup. fair enough, view theres lot people plenty examples people reacting. obviously think someone literally thinks hoax gets super sick like ""uh yeah, hope learned something."" time, many threats dont pay much attention affect us. threats wont hit home, will, thats life. ftr though quite cautious vaccinated even allowed talk topic here?  Sorry, eh. Didn’t mean intrude. heard someone say maple syrup. Try bundling vaccine $50 coupon Walmart. I’m still mad y’all didn’t get Susan Collins hell wonder there's difference hospital capacity, addition dangerous variants.

In NYC last Spring, would admitted hospital unless verge death, hospitals full. might milder version Winter across country wave. Marginal cases might admitted whereas would turned away then. also hospital triage policy, people sick may hear news reports full hospitals try tough home. would spike protein vaccine influence this? Unfortunately, individuals keep ""ugly American"" stereotype alive provide new levels ugliness. moon option. infect anyone there, though he'll still wear mask. tried move NYC else feels like home. Granted moved Astoria Manhattan 2012 Brooklyn like everyone else think made huge difference. New York different friends Manhattan Brooklyn. good. Let's consider purge people working healthcare. curse words table. Results may vary one starts N.

To prove it, I'm going say it.....  knew Minecraft blame COVID Thanks!

Do think would better get Phizer vaccine even get one dose? I'll think I'll eventually able get second dose.

Iirc one dose shown effective J&amp;J. mean, I’ve seen lot doctors look pretty much everyone, it’s extremely obvious terrible patient care. Great comment. It’s crazy people believe country produces 20% global GDP second highest population wouldn’t tackling problem quickly. It’s like people want China drag feet fits narrative. learned months ago. sure news. vaccinated would still mask. nearly robust data reinfections versus vaccinated. rooting 4 u vermont &lt;3 vaccination rate get better, could vulnerable another outbreak. Shoulda arrested 3rd. Whatever takes Thanks. data find don’t even strong opinion UK delta variant. could beginning new wave, result targeted sequencing, imported cases abroad knows else (I saying hypotheses likely true, I’m listing first ones came mind).

In fact still probably early research groups reached firm conclusions. confident research published soon. Apparently not. comment explaining would gap, even politics play got removed. AutoMod blood. taiwan one peacful tourist places earth. Send idiot back belongs dont need that, Well can't use FDA still approved blocked J&amp;J doses.

The report 5 days late that. I’m sure plays huge part. I’m going sit say J&amp;J useless, everyone Ohio that’s eligible also eligible Pfizer Moderna. became eligible, able choose because, like people, didn’t become eligible supply increased. chose Pfizer. It’s much effective vaccine. 

Take get, choice? That’s different story. [international travel &amp; often already require vaccinations.

The slight difference ""new"" vaccine yet full FDA approval. Full FDA approval right around corner, though, different vaccination requirements commonly found society. Texas absolutely fine 100% open, nothing cry Lol first comment literally starting blame game US surplus, Africa need. There's solution somewhere... Nah bro, sides equally blame problems.
 
I intelligent. appreciate post. feel like I'll get vaccinated later, reading vaccine reactions recovered individuals intense makes want least wait. I'll read links gave me. That's exactly live. Many county officials told residents enforcing state mandates within counties' limits residents visitors counties consider Covid prevention measures strictly voluntary. people regularly wore masks ones chose took seriously. ones got vaccinated soon could. people never wore masks unless absolutely get ones never get vaccinated, ones refused anything protect vulnerable people said ""let sickly scared stay home, live lives freedom"". made choice opt pandemic management year ago. time let go let live consequences choice. Either vaccines work choose get protected, they're not. can't keep wringing hands fretting actions people care. unvaccinated won’t listen ever place child motor vehicle? They're literally 4 times likely die car accident COVID.

