,date,text
I see moderators might think harmful ""overly cautious"" get misinformation warnings issue people present stuff fact clearly personal opinion incorrect perception. person got debate fomite transmission commented covid ""literally everywhere"" (on surfaces) one point, got downvoted like crazy, where's warning that? clearly lie designed promote fear paranoia. Treat anti-vaxxers. Nuance dead hail absolutism. virus continue mutate theres unvaxxed people wearing masks. scientific fact. vaccines work currently known variants isnt say always case. That's theres multiple flu vaccines theres significantly different ones vaccine must change. may case now, that's say couldnt changs theres spread mutations. two month long superspreader events - elections kumbh always runs deep, risk turning every thread seminar go deep. spring fall, I've found masks help allergies I'm gonna keep wearing masks winter even covid magically disappear face Earth tomorrow, I'd rather get colds flu help it. West Virginia weird place. assume, think it'd area vaccine hesitancy seems like, given right messager, good portion population open vaccine. true scientifically, also really concern practically. lot problem translating science talk news talk normal people talk. scientific terms variants able evade vaccines. However, vaccines effective real-world practical effects vaccinated extremely miniscule.

Like scientifically speaking, person hit 5 bullets torso much less harmed somebody hit 50 bullets torso. people (shot 5 times vs shot 50 times) probably dead practical terms real world matter.

So yeah... wowee zappo goes scary variants evading vaccinated immune system lot normal coronavirus does, 100% true lie... still gets defeated end, almost exact % effectiveness.  think interest increase border reopening date announced? mean, point, international tourists Australia anyone vaccinated playing fire. believe anything else even likely would pretty antiscience well. Mark words people, Florida probably going spawn variant bypasses current vaccines. submission automatically removed linked source may reliable may dedicated mostly political coverage. possible, please re-submit link reliable non-political source, reliable news organization recognized institution.

Thank helping us keep information /r/Coronavirus reliable!


*I bot, action performed automatically. Please [contact moderators subreddit](/message/compose/?to=/r/Coronavirus) questions concerns.* generalization, like generalized people enjoy etymology therefore think words sum parts. Also notice first said ""westerner"" admittedly accurate ""weeb"" Unless test entire population everyday, it’s going impossible keep count.  Tell go take tour capital without mask see Abbott really stands. Visit linked subreddit risk. may high amount misinformation.


*I bot, action performed automatically. Please [contact moderators subreddit](/message/compose/?to=/r/Coronavirus) questions concerns.* /r/coronavirusUS might speed. always knew anti-vaxxers thing, covid hit, never knew many were. number way fucking high. Well own. 2nd dose pfizer kicked ass hard. move next day, sore head toe solid fever. body aches lessened next day still 101F one. 

Would heartbeat though.  yes, vape. It’s America. school district former student going japan Olympics whole town parading around dudes name. would GLAD see canceled. Psssst.. talk that. Like talk disgrace minister traffic digital infrastructure. saying basically variants

I believe so. variant think useful find out:

 * effective vaccine variant?

 * quickly variant spread vs variants?

From article posted sounds like one risky fast spreading variants nothing changes far existing precautions. spot on. Maybe additional benefit increasing flu shot uptake. evidence current vaccines time longer period greater success. means works exactly advertised... reduces chances hospitalization, death lower, non-zero number. number potentially higher exposed variant original coronavirus. Preprint articles require higher degree scrutiny rigor accurately evaluate many types articles. kind discussion would appropriate strictly scientific subreddit /r/COVID19.

Thank helping us keep information /r/Coronavirus reliable!


*I bot, action performed automatically. Please [contact moderators subreddit](/message/compose/?to=/r/Coronavirus) questions concerns.* mask compliance low sticks. actively anti mask. one thing lazy care. another go rant freedom making bullshit excuses McDonalds lobby ultimately getting kicked out. 

I like walk across street grab lunch seen multiple people refused service they've total assholes it. Best part I'm scrubs coat point door shoo away look like I'm going back up. church groups worst. They'd come dozen people masks. However told government must get vaccine attend full approval there's side effect like next year, pretty open shut case. reason announced anticipate 3 vaccines full FDA approval fall, covering asses. Like one yet make syringe billion previous leadership better anyone else's, really bungle up? Ofc helps extensive Healthcare pharma system world, Trump admin great job rushing vaccine, much them. post appears vaccines. encourage read helpful resources COVID-19 vaccines:
  
[Vaccine FAQ Part FAQ Part appointment bot, action performed automatically. Please [contact moderators subreddit](/message/compose/?to=/r/Coronavirus) questions concerns.* Sure, that's good, remember - Wright Brothers, evidence humans could fly. Absence evidence evidence absence, evidence improbability impossibility. Thanks, think point might one vaccine something. 🤷‍♀️ I'm sure think random person commented r/Coronavirus weeb.  complete gamble. evidence vaccines available time effectiveness set period delayed evidence particular vaccine. Five cases? vaccinated rich western country chance community spread? chance borders would close. politically legally.  travel thru changi airport March 2020 already impressed serious taken, professional setup screening station airport.  Following UK distribution plan then. seems worked well them! doses delivered, they're later planned.

Like ordering something online new company comes weeks late due issues new factory. vaccinated people individuals know get revaccinated? Otherwise numbers ramp protection dies off. ballparking, still absolutely check reasonableness, reasonable. 

USA 600k total covid deaths, reported 500k Feb 20-21. used roughly 500k figure majority within 2020. 

Flu deaths 2019 22,000... even dent total USA deaths. USA averaged nearly 8,000 deaths per day covid, leading causes heart diseases, cancers, respiratory illnesses, etc, didn’t disappear. 

With roughly 8,000 deaths per day pre-pandemic, that’s 2.9M deaths per year without covid. 3.4M deaths, ~500k covid deaths accurate. 900k article mentions isn’t even realistically possible unless saw death toll like 3.7M+ honestly (even overlap deaths died versus covid). Nope, school multiple times told us classes limited capacity masks distancing. Things certainly looking better housing front (they've moved ""one person per room, students in-person classes"" ""anyone wants campus, things looking even better- updates come""), actual academic experience is, moment, still shambles.

I've worried because, recently, school even seem planning possibility things would better come Fall, hunkering idea Fall 2021 much different Spring 2021. seems changing, I'm still anxious it. “The number based adding particular diagnosis based medical records. 

At least 16,000 people Sweden health damaged long-term Covid-19 infection, reports Swedish Radio News.

Tomas Lindén Board Health Welfare says shows live consequences pandemic long time.

The figure differentiate suffering serious symptoms trouble breathing chest pains, mild symptoms.” Really flexing ""I'm qualified"" part suggestion essentially 'stop reporting variants'. used word ""sensationalist"", experience term really used people either stubborn ignorant see reality situation.

As global economy, ""isolated outbreak"" somewhere absolutely isolated. People travel (especially poor), near 2 week incubation/infectious period, lot harm amount time. Considering manufacturing trade shipping area, could easily become bad claim. Especially affluent people traveling abroad.

I'm hunting anything btw, pretty loud advocate people pulling heads asses since start. get AZ right want. health authorities determined 50s risks don’t add AZ. 

In opinion abundance caution. accept many workplace deaths 1 million, AZ necessary open things back up, it? jinxed now! Drink lots water take advil Shin Godzilla basically movie criticizing Japanese bureaucracy showing inept could respond giant lizard terrorizing homes. walked past giant, human shit steps local subway station yesterday. saying. 


Don't get wrong, love city, yeah agree stations exactly sanitary. they’re better Canada still? :( Automatic translation bot, action performed automatically. Please [contact moderators subreddit](/message/compose/?to=/r/Coronavirus) questions concerns.* remarkable feat! Simply stunning!! Except examples work words ""Door"" ""Man"" literally describes ""Doorman"" means. ""Five rings"" mean ""Five rings,"" means Olympics. another replier pointed out, animals ""Moving objects,"" they're animals.

Also entire first paragraph nothing prove point. exists every language, yet people describe talk Japanese like quirky unique manner. far, yes, read today ""B.1.617, found preliminary studies spread easily original virus evidence may able evade protections provided vaccines"".

Source: seems evading 

What wrong opening everything requiring masks non-bar/restaurant businesses? Washington 49.5% first dose. Arizona 42.3% first dose. difference, wide 20+%. updating ensure is/are:

- 100% longer term immunity
- zero side effects
- requirement second shot problem ""there evidence adaptation \[...\] necessary"" is: necessary what? prevent vaccinated people dying? reach global herd immunity suppress covid transmission?

The efficacy BioNTech's vaccine variants still pretty good.

However, everyone world get vaccine (vaccine hesitancy + access). 60% population vaccinated, I'd rather vaccine stopping 85-90% transmission 60-70%.

We already see importance better vaccines: Seychelles Maldives [have vaccinated greater population Israel. mix Sinopharm Astrazeneca. Cases increased recently Seychelles Maldives. infection statistics [are coherent phase 3 efficacies vaccines reduce death toll sure, prevent significant waves.

If new variants keep coming, BioNTech's vaccine might look like Sinopharm/Astrazeneca today: good vaccines, preventing lots deaths, good enough prevent new waves (even vaccinating people). Really? That’s reaction? “they said every single one variants, maybe wait panicking?” oops. Cards. Edited. miss it, phrase right based memory.

 Wish had, much impressive way. Lol. people downvoting probably live NYC. got vaccinated soon eligible, believe vaccine extremely safe. there's way I'm letting needle go arm (or even directly outside) subway station. They're literally disgusting areas entire city, saying something. 

Even covid would compulsively sanitize hands stepping subway station. Maybe given far demonstrated zero idea anything going on. considerations, barriers, questions listed absolutely real important need considered.

But Japan year consider them. 99% questions remotely unique Japan countries answer tough questions like ""who vaccinate first""

Your mileage vary believe answer questions is. also shown many strategies we've seen worldwide everything early eligibility dosing schedule.

But know able find single reasonable person would argue best nothing come consensus absolutely *best* option

This *especially* true Japan since I'd argue country much need quickly possible. genuinely jaw-dropping. “We regret stickers evoked negative associations among visitors. never intention therefore also apologize,” said IKEA spokesperson. “We sorry received unhappily.” Cautious mean need close borders. People fully vaccinated flu still hospitalized risk small enough close borders over. saw video hockey team. together celebrating own, 10-15 feet away anyone else.  links on-hand right now, THC immunomodulator, lowers immune response. That's one reasons works well auto-immune diseases, like Crohn's. search, pull something pretty quickly, think. Tbh feel like people would want get evening commute rather morning. Uh, didn't, say did. confusing exchange me. point vaccination decrease transmission way masks do, even effective masks.

/s means sarcasm/joking, way. Gift cars?! feels like re-run. Could sworn exact thing happened year ago, cancelling impossible inevitable short period time. Japan needs get clue this. paying attention scientists saying Indian strain believing science? guess according believing science entails listening scientists whose theories line want happen.

The Indian variant Pfzier already works on? Europe utopian paradise? Hahahaha... no. we’ll vaccinated back normal guys still getting tickets walking outside. 

Europe treats poor better, sure. middle class higher better here.  yeah break hospitalizations age, would interesting see age group makes it. That's true. large majority people US either vaccinated plan get vaccinated. also infuriates parents suspended students video UMass Amherst Hockey Team celebrating national championship campus. students, including players, could seen wearing masks.

Also given 0 warning judging picture took place St. Patrick’s day, almost 2 months ago getting punished now. know lockdowns well?.

Like locked HARD Maharashtra overall April 15th.
 know compares lockdown New Delhi in?

Started Aril means probably accurate. first thought covid also account lot sick people would've died anyway. excess covid deaths, subtract expected deaths year get decent representation many people covid actually killed. Right right seem like vaccines ineffective variants. seem effective regardless variant I’m saying shouldn’t return normal. should. It’s great won’t reach herd immunity though. don’t want get booster every year, don’t want people die this, are. aware universal beacoronavirus vaccine making (SARS/SARS-COV2/MERS/COLDs/future variants) think Diamond Princess really bad example. might make argument since people wore masks reduced average viral load contraction things worse now. raw data point view, [here's old paper Another [more recent lot examples find. big assumption younger people notice lungs getting scarred some, people may heal lungs time. 
That determined therefore I'd rather get it.  
 
Similarly children recent study showed biomarker many contracted virus. see discussion /r/COVID19 main idea perhaps signs active recent infection, body recover time. may cause long term damage. know yet. 
 
So think it'd wise us still try get virus. effectively means keeping foot gas case numbers around us drop nothing. simply waiting individually vaccinated pandemic personal experience along. saw post noticed quite people Instagram posting getting first shot today. said wearing mask properly prevents getting COVID... would happen 100% effective.

It's fault simpleton posting misinformation BS.

Want correct said before, going double ""implying"" fully vaccinated Covid-19 Ward Staff thereafter required wear face masks PPE.

You really dense. never said masks nothing, also never said vaccine 100% either. Also medical staff wore masks COVID realise protect patients.... I'm medical professional like you, may find stats many dies blood cloths low platelets per year/number population? get vaccinated currently nasty cold?

My nose running I'm feeling groggy, headache. symptoms. I've done 4 tests home, negative. going week now.

I waited 10 weeks first Pfizer shot want call off.  Ok, here's one many articles online students side, look good them:

Students campus say rules tight year good reason. “Maybe little harsh like understand you’re supposed that,” one student told WBZ Friday night.

“The town Amherst made really clear don’t want big parties,” another student said.  they'll know Influenza, common cold/HCoV, SARS-CoV-2 distinct. Agree! know trajectory different summer. Follow whatever guidelines place venue, assessing personal risk tolerance, know 6' completely made number pointless enough ventilation room extended period. least getting minimum wage. giving vaccines county volunteering. second vaccine retired orthopedic surgeon. Outbreaks lots disease happen every year.

They localized, smaller, impact vulnerable population covered vaccine. acceptable risk return normalcy. I’m idiot. That’s bad. edit.  big revelation notice they're really bunch rich people privileged backgrounds, whose career largely revolves around laughing things poor people economically-deprived regions believe. sure felt much anxiety depression this. I’ve working home don’t know interact people anymore don’t want either honest Someone needs reboot bot. get - ""whats point"" real thing empathize. honestly feel even though fully vaxxed. know ridiculously low chance breakthrough case, CDC. control vaccine, even non-vaccinated countries. 

India terrible solely variant -- willfully gathered gigantic groups, wholly irresponsible. 

America never numbers like even worst, despite stupidity anti-vaxxness, still prohibited giant gatherings like done India.  mean, don’t hate anime, also World War II man... high-risk person older person? I'm 27, gf 26, we'll likely fully vaccinated somewhere August we're lucky. I'm jealous American friends around age already shots. It’s consistently 3-4 hundred less data 7 days ago couple weeks now. Really great see. deaths maybe, suspect may murder... nobody wants one, stop trying make happen NYer, approve!! wish started little earlier morning commute crowd. hope targeted vaccine hesitant neighborhoods.

I went NY.gov here's full list:

* Penn Station - 34th Street Corridor.
Open: 3 PM - 8 PM

* Grand Central Terminal - Vanderbilt Hall.
Open: 8 - 1 PM

* East 180th Street (Bronx).
Open: 8 - 1 PM

* 179th Street (Queens).
Open: 8 - 1 PM

* Coney Island (Brooklyn).
Open: 8 - 1 PM

* Broadway Junction (Brooklyn).
Open: 3 PM - 8 PM

* Hempstead (LIRR).
Open: 3 PM - 8 PM

* Ossining (Metro-North).
Open: 3 PM - 8 PM first safety trials Moderna began 14 months ago, I’ve hoping they’ll publish something participants. Though dozen people dosing hadn’t worked yet. Actually, 38k 7-day average now.

Still similar last fall...though trending we're trending down.

Last summer low 18k June. break get new cases lowest they've since March 2020, things really start changing. Thanks explaining simply. Going data knowing Indiana... tracks. Read actually WROTE, ""thought implied""...

Otherwise, ""implying"" fully vaccinated Covid-19 Ward Staff thereafter required wear face masks PPE. trying get vaccines Europe?

Can't generalize whole Europe. common thing EU countries vaccines bought countries common EU treaty, country gets proportional share vaccines whole batch bought EU. distributed inside country country business.

Here Estonia prioritized elderly, teachers, healthcare workers. January 80+ old eligible, 50+ old, 17th May everyone older 18 allowed. set appointment either call family doctor register national healthcare website. registered time comes, go get shot. Plus know many people called ""danger groups""/""frontline workers"" got call/mail health department saying vaccine shot already reserved them. much problems administering doses, always limited supply.

But I'd say Estonia bit exception rule - centralized online healthcare system almost citizens registered apply appointments set many years whole covid things. prepared pandemic. rate would consider alarming? people really think 75% Americans would agree anything, even obvious vaccines? now. mean, sure, don’t care outbreaks happening every year, it’s fine. jerks clearly people wear mask be. Mask wearing minimally intrusive always helpful degree. Peer pressure wear mask strictly necessary public health (but still helpful) jerk all...  different Japanese Baseball league? spectators required vaccinated? won’t reach herd immunity years

That’s completely unnecessary virus like Covid. crazy protests STOP something greater good population. America's opposite. sad government take every step protect people crisis. We've seen especially India Brazil, Japan. ...and look got you, lmao. could living utopian paradise, instead, stuck declining life expectancy highest maternal mortality rate developed world. Awesome. I'm talking death counts, studies saying like 900K US death 580K today. That's 50% difference. I'm trying get banned sub, let say this, since desperately want insulted: existence applies set lyrics sung Sum 41. Read lines, AH. I’m vaccine denier got vaccine week ago? Unlike don’t believe I’m knowing god layered protections make sense every domain systemic societal risk. Even Fauci agrees way. 

You hyperbolic moron thinks extra months encouraging people wear mask Walmart kill someone. parody. person. Suspended wearing masks Moderna’s safety trial started second half March last year Seattle, February. bad reactions dosing experiments high dosage said weren’t going forward dosage time results made public ~April. day average diving. want India? Ireland UK, need state obvious, fellow Brit! post appears vaccines. encourage read helpful resources COVID-19 vaccines:
  
[Vaccine FAQ Part FAQ Part appointment bot, action performed automatically. Please [contact moderators subreddit](/message/compose/?to=/r/Coronavirus) questions concerns.* passersby need ""protect"" diners? obligation protect people engaged non-essential activity dining out? diners similar obligation?  Moderna second dose side effects bad, actually. got jab Saturday, pretty ache-y tired yesterday, feel fine back normal today. People talking like gonna bedridden lol. US people don’t want get vaccinated. They’d rather “Covid cases continue rise add cases other!” Sum way better avg making scary headline.  numbers Seattle vs Phoenix. handy numbers statewide, thanks. much closer. Pfizer. Fever &amp; body aches 2nd night made rough night's sleep. Woke next morning finally took acetaminophen. Went back sleep woke noon finally feeling better. Biontech, Fosun Pfizer together produce 4 billion vaccine doses starting 2022, would enough vaccinate half world population single-shot booster vaccine. 

That leave awful lot market share dozen current competitors. newcomer conquer market share, would provide substantially improved vaccine. Connecticut posted weekend numbers, 7.7 new cases per 100k weekend. 3 weeks ago averaging 30 per 100k. 

Seems like state's government timing reopening May 19 nearly perfectly. 71%+ 18+ population least 1 shot. 

Cases started plummet here, going continue!

Let's go! sister lives Australia. Anecdotally, says nobody motivated get vaccine they've business usual long. people generally travel life normal. Many adopting ""wait see"" approach long-term impact vaccine. Seems kind crazy understand motivation would bit different versus Canada still lockdown hell anything get lives back. crazy Japan loads things efficiently yet complete end spectrum others Bullshit mandated Funny actually came around correct answer wrong information:  


In 2020 350k deaths officially attributed virus. yet calculate 500k+ deaths. 


Basically misunderstood 580k number article. included year well. personally, I'd like another year two data. partner trying become pregnant, TPTB say vaccine safe pregnant women, I'm skeptical since babies carried full term point. every unvaccinated person risk new variant could breakthrough current vaccines.

I understand, deny that's risk. fact Moderna developing booster would suggest getting vaccine would sufficient fully ameliorate risk. dose two seems fine low risk. remain way 3rd dose, 10th, live society means things greater good, one situations.

I hope think disagree premise even may disagree notion greater good unqualified supreme value. That's I'm approaching seriously thoughtfully. hospitalizations decline flat month so. 7-day average 14% last 7 Mandating crock shit. That's said worse. I’ll leave here: causes death disappeared 2020 (they didn’t), make pretty educated estimate total covid deaths, especially considering know total 3.4M deaths 2020. That's irrelevant point, recently falling slowly. 

