,date,text
And many hospital beds nowhere near rural villages. places, severe Covid case unlikely survivable. Per Vaccine Adverse Event Reporting System (VAERS) used collect reports adverse events vaccination general public. primarily used identify potential topics investigate regards vaccine reactions. However, event data VAERS often verified often self-reported, assumed adverse events VAERS actually associated cause vaccines, possible estimate frequency adverse events data.


*I bot, action performed automatically. Please [contact moderators subreddit](/message/compose/?to=/r/Coronavirus) questions concerns.*   Egypt destroyed chat (200k real deaths instead official 18k) Okey doke  Whatevs  go jail saying wrong thing wrong person world, other, worse places far Cuba even murdered cold blood ethnicity.  post appears vaccines. encourage read helpful resources COVID-19 vaccines:
  
[Vaccine FAQ Part FAQ Part appointment bot, action performed automatically. Please [contact moderators subreddit](/message/compose/?to=/r/Coronavirus) questions concerns.* Yeah agree, said it. reason probably hiding numbers, also reason well Covid. ""extreme"" measures, necessary situation, much easier apply absolute power people problem applying mandatory laws locking people everyone complying. 

In democratic countries, mandatory measures always possible people decided much control freedom choice. valid concern, specific scenario, dumb one. conservative party guilty using pandemic try put people anyone wanted measures applied (for sake people) said would going freedom, thus, authoritary. even mentioning disservice hearing specialists going good everyone. Mothernature's version purge.  submission automatically removed linked source may reliable may dedicated mostly political coverage. possible, please re-submit link reliable non-political source, reliable news organization recognized institution.

Thank helping us keep information /r/Coronavirus reliable!


*I bot, action performed automatically. Please [contact moderators subreddit](/message/compose/?to=/r/Coronavirus) questions concerns.* Absolutely! [This *very* intro-level explanation Cuban serve starting point links sources description.    two years... effective vaccines available half time. 

While terrible far, could much worse, even close end yet.   2/3 would amazing! submission automatically removed linked source may reliable may dedicated mostly political coverage. possible, please re-submit link reliable non-political source, reliable news organization recognized institution.

Thank helping us keep information /r/Coronavirus reliable!


*I bot, action performed automatically. Please [contact moderators subreddit](/message/compose/?to=/r/Coronavirus) questions concerns.* know someone covid denier. couple months ago father (also denier) got virus died it. dude double full denial. pretty sad. small study big margins error. studies found bigger benefit vaccines.

I tried post link study question, automod thinks Science Daily dedicated political news. Two years back saw unravel itself. Always thought ut devastating comes country thought prepared, thought could face storm keep family safe. Afterall knew coming, would taking every possible precaution. let guard last year, Dad. another person dead covid among 5million+ now. Can't believe prevent it, knows who's next.  Frontline worker manufacturing, shocked. barely testing never told us anyone got Covid. I’d count immunity tested… it’s bit like wearing seatbelt don’t think you’re going accident…. Well first quarantine, US anyway. thing mask mandates go ignored part anyway. Second, still dealing millions people refuse get vaccinated, breakthrough cases spread amongst vaccinated. vaccines still highly effective severe disease hospitalization. Can’t socially distant Tackalua Link, people practically defenseless authoritarianism

At least authoritarian government pretended care wellbeing people particular issue.

Incredibly, many democratic countries leaders national lower levels plainly *did care* people... even voted them. one shot two, kids? can't find info. know dosage smaller.  parents know vehemently pro-vaccine hesitant get young children vaxxed.

A months back similar KFF poll parents 12-17 year old kids eligible. Something like 40% vaccinated parents said vaccinated eligible children hesitancy parents definitely real.   comment automatically removed linked source may reliable may dedicated mostly political coverage. possible, please re-submit link reliable non-political source, reliable news organization recognized institution.

Thank helping us keep information /r/Coronavirus reliable!


*I bot, action performed automatically. Please [contact moderators subreddit](/message/compose/?to=/r/Coronavirus) questions concerns.*  know someone like this. kid turned 12 weekend. bet ass got vaxxed ASAP. Assuming approved CDC next week, long kids get it? Short Metastasis ? Maybe part transmission continues kids raises risk new variants could deadly, evade vaccines, affect kids more, etc. swear approval process feels like mountains climb keep thinking you’re approaching top realize it’s false summit along ridge still miles go.

Hope miles go quickly! chance summary paywall block? Thank info. get downvoted given rate obesity US children think covid puts higher risk. opinion   get wrong - overjoyed idiots getting vaccines *no matter reason*....

There side me, though, cannot help despise *even more* get shots. listen shit TIME....at least stand beliefs walk. 

These people hypocrites, cowards, generally annoying. Results clinical trials children 5 could come soon end year, Pfizer spokesperson confirmed. Results children 2-5 come first, followed children 6 months 2 years old.

The damn kids turn 5 approved 5s. Come man.  0.06% world population. I’d say we’re ok.  Yup, total control dissenting opinions shared much. Yup. people terrible evil plans. tell voters stay home plan insurrections ""the troops side"", meanwhile absolute hatred science facts means troops thought gonna take inside bunch losers outside again.  7M hunger last year well, nobody gives fuck. Similar numbers COVID everyone loses mind.   exactly. 

Yet failed prove point wrong. 

To said, people also trust govt harm comply. Complete govt control wins either way, whether love hate totalitarian government. enough countries report accurately could extrapolate much accurately non reporting countries. bit different it? understanding Google still company, Facebook not. Google Ireland. COVID

Ireland one highest vacation rates world.
 91 percent population 12 older vaccinated. 

And currently experiencing COVID infection rates rising.
Their scientists claim vaccine temporary fix capacity vaccines prevent transmission wanes time. (And lot time).

Until ""transmission blocking vaccine"" developed COVID going away. 

Vaccinated = helps body fight virus. 
Vaccinated ≠ stop spread virus. 

Idk care anyone vaccinated, going effect you. 

The whole population vaccinated change thing. still wear mask prevent spread still catch COVID. 

The vaccine heath individual only. covid happened feasible work home, 10 years ago. pandemic going history books sure. likely hear much anything Pfizer posts top-line results. Due insider trading laws, information could impact stock prices tightly guarded. happens, hear lots information.  theory estimate real number deaths 10 million, US would increase (but much) 900,000 deaths. would account 9% total deaths little less include deaths directly COVID, COVID lead healthcare collapse... used live (seriously). decided wanted live, left. that’s benefit health care infinitely better available past pandemics. 

That’s benefit scientific knowledge viruses light years beyond knew 1918, existence viruses theory. 

And that’s also benefit DNA sequencing modern genomics, exist 1918. 

And benefit unprecedented amount funding research, production distribution highly effective vaccines. 

And benefit technology allowed scientists collaborate across world, allowed people work shop home.  Maybe said ""the one advantage"" instead ""one advantages""

Trying bit funny rather advocating political dictatorships. Well said 10/15 million Economist says 10/19 million, could agree 15 😅 Turns pockets inside out. know. told effort get LGBT equality constitution, homophobia island rampant get put in.   It’s bullshit lmao. really expect educated, professional people--but turns morons among us, every group.  Reading lot resources, thought actual death toll 4-5 million, least. July estimate posted still early evaluation. speculations maybe 8 million. many thousands cases since July. Well, effective wait. decision depends risk meantime. mask sight, although appear two rally goers garbage bag hats? Ok, sure, agree learning always helps, will. Still, relevant, dictator Lukashenko Fidel friends. I'm ruling out.

I live US, I'm make assumptions countires; know people done that, like governor DeSantis Florida oh, right, members central ruling party order stand ""election."" mean, really crisis? call election want, ban opposition parties meaningless bullshit. article says average age ventilated group lower rest. 


This likely means there's bias introduced last group. person expected die COVID ventilated; old person several orders magnitude likely die COVID young one. Therefore, old people would normally score lower every test simply exclude last group, skewing statistics. might driving seeming increase scores several tests authors say intelligence-demanding, digit spatial span emotion discrimination. also means overall intelligence drop ventilated group likely \_\_underestimated\_\_ -- terrifying thought. regarding public health I'm pretty sure religions version ""love neighbor love yourself"". refusing something help others around ""religious"". 

Humans weird, religion that's another story. Wait 5 years count ones lingering side effects, lung transplants delayed cancer treatments etc. lives cut short. Yes, likley 4 million.

[India's Pandemic Death Toll Estimated 4 Million: 10 Times Official July 20, 2021  doesn’t innovations? send thousands doctors abroad &amp; specially developing countries &amp; highly regarded there. Cuba also always performed better countries region infant mortality life expectancy. None needed happen give notice beforehand get out? planning long parents alive sure hell want sealed in.   saying government attending needs wants population boosted popularity, sure: that's works. understand portray bad thing.  Small pox didn’t play I've seeing lot people feed getting boosters. I'm assuming eligibility varies state state?

I'm going traveling holidays, extra peace mind would great, look like I'm eligible booster yet. would US exclusive issue? bet many many countries exact thing whether it’s malice, incompetence, lack ability.  Ikr? could arrogant rely information reputable sources. Better trust word random internet stranger. Amirite? Gov must rickets kid softened brain. still elections, people elect representatives within party. multiple parties isn’t requirement elections. ""strongly held religious beliefs""

I evangelical pastor decade. time, ever asked fill vaccine exemption, even opinion it. controversy, got shots stay healthy keep neighbors healthy.

Now sudden people religious objection? call BS, using God justify fear selfishness addicted bad info social media.   Good. uncivilized shouldn’t work civilized people Yup, 34% reduction. That's big news, big blow screaming 'vaccines dont reduce transmission '. data shows otherwise.  lot ""religious exemption"" people wanted (recent) nutty politics. Thanks tip!

I got one shot Cansino, second jab Astra scheduled like another month, making two months since first, think take it? wait.  I'm feeling owned I'll sure cry paycheck get home. definitely fear. That’s got booster. 

That's fear. That's protecting myself. assume people wear seatbelts, wear bike helmets, get tetanus shots living fear? Im done Covid, like everyone else who’s gotten survived

Aside people article linked died. done covid (I suppose now, though). big problem is, covid done us, including you. NOOOOOOO! NEED FREE DIE PREVENTABLE DISEASE POLITICIZED CONTRARIANISM! NOOOO! stuck beliefs

Which 100% wrong. people act like they're entitled reality. 


Vaccines work, covid bad. Argue virus, I'm out. Yup, 34% reduction compared unvaxxed people, huge, especially since these.are intimate settings people spend substantial time peak infectiousness. Also, Id love see breakdown everyone household vaxxed. It'd definitely even greater reduction.

Awful headlines circulating around study. Par course. Fear sells, suppose. wish authors headlines integrity. love Pete!    Thanks insight I'm glad agree capitalism great either - like ""work hard capitalism get rewarded"". lot people easy. dangerous mindset leads looking poverty people simply work hard enough.

I think interesting know living misery got out... wonder many cubans get end worse capitalism. reality is, we'd never hear due nature homelessness poverty. going annual enrollment right little surprised see surcharge covid vaccine. rumors anything, there's already surcharge tobacco use. may early, know. I’m young third dose, live UK Seethe. Every year 8million people die smoking tobacco, yet tobacco legal. Dear reddit,

When people compare long haul covid post viral illnesses, ***NOT*** downplay deny long covid, provide medical context precedent it. Also 56% people hospital vaccinated BC? Cope. Plot twist. world loses every life. Fucking morons. Every last one them. ...but know measurable immune response phase 1s linked reply extremely effective, likely two mrna doses time period. Keep coping, never stop seething. Imperialist cope delicious flavor. post appears vaccines. encourage read helpful resources COVID-19 vaccines:
  
[Vaccine FAQ Part FAQ Part appointment bot, action performed automatically. Please [contact moderators subreddit](/message/compose/?to=/r/Coronavirus) questions concerns.* comment Belarus educated topic, Cuba Belarus presume know Cuba based that.

I encourage read books history present draw conclusions. Something's going give point. COVID endemic can't ""new normal"" 2 - 3 times per year, medical care rationed, procedures put hold, ICUs capacity antivaxxers. causing undue suffering right thing risk something beyond control. mention toll physical mental well healthcare workers straining exhaustion watching people die almost every day. equal law Cuba. Cuba wrote new constitution excluded Lgbt people. arrested attending pride celebration. Things getting worse Cuba gay people. holding Russian style election vote ban gay people equality.  poor Vaccination rates Africa, sadly going get worse gets better. Dont stress much. Y'all fully reopened, right? Youre going see increase cases happens. UK us actually seeing decrease cases again. It'll peaks valleys, hospitalizations remain incredibly low compared last winter. copied headline since part sub rules. article talks actual number Germans reasons.  3-4 doses spread 6+ months highly effective delta matter vaccines are. I'd wait least 3, maybe 6 months second AZ shot though (boosters close time nothing, vectored vaccines eventually build resistance vector additional shots effective). probable realistic estimate puts India 2 million deaths

And provided ""most probable realistic estimate""? [apparently serious (though admit I've skimmed quickly) provides estimates three different methods, ranging 3.4 4.9 million. that, bet many drink, smoke, eat junk food, etc… wish would shut whole “ dOnT kNow WhAtS iT” BS.

And I’m … friend mine recovered drug addict friends past present drug addicts seem anti vaxxers spouting “I don’t know it” nonsense. Dude smoke meth don’t give shit “you don’t want put poison body”. 

At least conviction say don’t want vaccine don’t want it. Don’t lie it. think worst part people losing jobs seen martyrs cause glorified others like them.  There's 1/10,000 risk under-30 men/boys heart inflammation week two second dose. cohort put risk strenuous exercise (hundreds hospitalized worldwide, though nobody died AFAIK). gotta new, transmissible variant sub variant. Last time happened red flag delta coming, UK variant. It’s getting predictable pattern. Nailed it!  Absolutely. society (generally speaking) we've decided OK people die streets. Anything makes likely, dumps costs public tail end, far expensive offering earlier care.  history denier, huh? India lowest deaths per million large populations smells fishy. Coz little lower others. way way lower. rough average around 2000/mil. India like 400/mil.

I suspect India's actual death toll 4x maybe 5x reported count. [Highly need negative test get [third 2-3 weeks before. was. sad, really popular lot kids looked like assholes made leave. Ugh. baby December. Looks like locked months. 

Glad decided invest home (new home theatre setup, new outdoor furniture/fire tables, etc) since spending lot time there! seem super low remember 5 million far *even after* harsh lockdown measures, development vaccines, development treatment protocols. Imagine chaos measures taken. would people die home en masse without receiving treatment due overrun hospitals (see India Spring 2021 even US hospitals Winter 2020-2021 peak), people non-COVID issues would never able get spot. think research this. Side effects probably could worse. adjuvants flu vaccine could also probably make COVID vaccine effective. best part going months read articles nobody hire people weird reason. I'm pointing can't without relaying propaganda lol That's likely due high testing. incorrect: **no** parties allowed campaign candidates all, including Communist Party: system based around voting parties, rather directly voting people. 

The socialist character cuban state declared constitution, ratified 90.61% voters total turnout 90.15%.  Close 1 400. You’re worried test positive point able travel? hypothetical? 

In some, maybe many locations use document show proof recent infection waive testing, since people aware PCR’s show positives while.  would first line get hands 2 kids!  И кто этому противоречит? Гондон ты рваный. Научись читать и контекст оценивать. А теперь отъебись и не грузи меня своими заебками. Они только в твоей голове существуют. Lol, watching it, it’s probably news, it’s entertainment.   travel, require negative PCR. don’t covid work testing people I’m kinda worried need show/get negative PCR? considered contagious 10 days positive test symptoms.

You test positive PCR weeks contagious. went Seasame Place couple years ago fun man crowd trashy... walked past least four different instances grown adults screaming fighting other. Never seen anything like it. imagine covid would place.  'more relevant' dors say? think numbers near 100%, cuba made huge efforts educate population Batista ousted. made priority build schools hospitals remote areas, doubt small island, they’re able reach almost everyone.  Yes countries recommendation aswell. First thing remember: Listen body. reactions like body ache fever? dont put big load also found think difference two great, except jj haha hero zero - zero acting potentially infecting heroes former Citi exec, must say proud this. course florida  Whenever hear this, immediately think person young never heard (or willfully ignorant) bout Polio... plague... etc.  That's smart thinkin. Duh Cuba, Mr. Whatabout? post appears vaccines. encourage read helpful resources COVID-19 vaccines:
  
[Vaccine FAQ Part FAQ Part appointment bot, action performed automatically. Please [contact moderators subreddit](/message/compose/?to=/r/Coronavirus) questions concerns.*   indeed commenting covax, acknowledge path (if checks accuracy/effectiveness) worked out. I'm saying impetus behind selective inclusion different elements global market (both voluntary involuntary) complex often reduced propagandistic terms--misunderstood amplified social/popular media stateside. Blaming blockade lack vaccines common example this.

To reframe: people bravely demonstrating streets desperate vaccine access frustrated clamps government. Whether U.S. would helpful covax partner &amp; influencer question I'm asking. Rather, managed snuff protest movement call shot bolsters medical capacity. fact reliable numbers China tends support estimate. surprised highest death total, hiding it. Stop talking morons. They're rare stupid. Platforming people lead deaths. doctor advising this, do. Saline rinses, jamming neosporin eye couple times day. Last time also would put wet black tea bag affected eye lay like awhile day seemed help.  providing perfect example point. want ""living COVID"" mean living 2019 instead adjusting life new reality.  know, standard ways, [doctors per 1000 people, Cuba 8.4 compared US infant mortality, Cuba [3.81 per 1000 live US sits [5.56 per 1000 live previously covered longer lifespan.

Oh, lets also forget chances becoming bankrupt seeking medical treatment also drastically lower Cuba. There's elections Cuba, period. able get flu vaccine butt muscle arm hurt less husband got flu vaccine arm (he booster week before.)

so anything might ask flu vaccine butt muscle (it's upper butt like barely pulling pants down.) would personally love get covid booster next time butt muscle kills arm. There's reason can't give muscle shot butt thigh.  Yes that’s asking someone also bad reaction shot, got flu booster together tell experience. know won’t guarantee, looking extra opinions children don’t mention masks distancing required.

Governor Polis punted hard decisions local school board &amp; local health department level stand antimask/antivax crazies. local fallout act political cowardice awful throughout almost state.

He desperately wanted completely hands-off entire pandemic, finally catching us.  likely we'll shots kids' arms end next week. Jokes Florida goes underwater literally never made comparison liberal democracy. see mentally checked discussion, so, bye. ""can happen time""
New fear unlocked Flip coin, matter two. Unfortunately, could lead dangerous variants. forget Brazil 210 million inhabitants United States 330, poorer would difficult deaths US (even end far) 

As estimates deaths, India would actually country highest number deaths thought (about 2 million, say even unlikely) United States second 100/200 thousand deaths official number (therefore 800/900 thousand). remember Russia Brazil third fourth place, Mexico Indonesia far  yesterday's discussion. reality total higher, probably much higher. recently got booster shot. cellphone working great. 

There side effects though. three days, voice head kept telling buy Microsoft products. gone now, thought odd. funnel resources projects tend actually produce results. think numbers somewhat trusted complete fabrications. ones significantly less likely anti-vaxxers Armed forces need stop playing Fox News loop every TV every base. Maybe don’t that. (checks barren field)

Nope. Still fucks. bare minimum faced consequences. I’ve never proud anyone bare minimum. I’d lost respect anti-vax coworkers long ago. What's difference? They're refusing either way. saying people getting vaccinated, higher risk becoming even stupid? meantime, already check doctor getting flu shot way. Spot Well, maybe actually read article understand Cuban political framework instead assuming liberal democracy superior democratic centralism default. makes lot sense.

Yeah, think inevitable we're going get point. Even everybody got vaccinated, think Delta contagious enough keep spreading low levels evolve slightly effective descendants. vaccinations, worse bad cold flu, many people ever even know it.

Those ""the top"" may share viewpoint everyone going get whether they're vaccinated not, said loud, antivaxxers would strip nuance words claim proof vaccines work. 

What ""the top"" could saying remaining truthful everyone get vaccinated likely get virus *within next couple years*. Delta contagious enough seems likely almost everyone vaccinated get soon. vaccinated may go years get it, course milder get thanks vaccine, plus treatments may much better time. ibuprofen, kratom, alternating heating pads laying hot bath got worst booster shot stuff. think nice schedule feeling ill getting done less 2 days rather coming covid even minor case would probably feeling cruddy week. maybe doesnt say much isnt true, state propaganda website need elaborate further. one predict reckon lot dumbshits come stock. say descendent German immigrants.

""You’ve got remember simple farmers.
These people land. common clay new West. know…"" Automatically read south park news reporters voice. Article says hospitalized ventilator got equivalent -7 IQ points. 

The ten year decline cognitive ability. 

Ouch. Considering alternative quit continue whiny princess shitbag, I'm proud making change life better even mandate. still choice decided get vaccinated.  Pilots engineers make small fraction air force....  good run.  Even Florida wins, legally put mandate future contracts make requirement get federal buildings, effectively firing people without keeping official mandate. Numerous federal contracts medical requirements multitude practical reasons challenging could disasterous spirals. Federal offices also eased teleworking requirements, making possible move jobs Florida, well. losing battle. anyone link shows effectiveness, percentage-wise, starting J&amp;J vaccine getting Moderna booster preventing symptomatic infection? 

