,date,text
July 4th - 179.7 - 67.5%

70% 7/22 No, I'm saying all. I'm saying US could sending vaccines American embassies number citizens know country. 

Those us Canada ones least danger, honestly. Americans random countries elsewhere could really helped program. Younger age groups aren’t eligible vaccine yet it’s spreading fast groups bcos obviously age groups mostly mix whole argument minor inconvenience exchange courtesy. think minor inconvenience wearing uncomfortable, says much care fellow human. never worn mask long enough got used it? like complaining wear shirt restaurant, would think someone like mentally weak can't suck put shirt situation? Calling shirt uncomfortable subjective, like subjectivity makes argument weaker. part developing vaccine.

If call so, call vaccine Fosun-Pfizer-BioNTech vaccine. 

The whole pharmaceutical system needs total overhaul. clearly working. vaccines. Money never decide gets live not. ethical axiom. I'm sure. recall, mRNA creates spike protein, antibodies natural covid infection created targeting spike protein would same. there's surge 2 weeks memorial day, it'll wait see 4th July next.

Why hard people admit vaccine working... suspect still place want reward people traveling US get vaccine.

Probably nonsensical reason could think of. vaccine passport, implemented see changes. 😂 Dude that's funny. Idk what's people holding high value political views anyway. Like bro, get Fox get hobby. dad three things... Politics, cook, complain. Every day shit painful, mental health completely disintegrated last year. cannot wait life get back normal much I'd cut finger expedited process. Safe tough understand reopening anxiety. worst year ever. you’re asking US get Canada - sovereign nation - change border rules? That’s going happen. 

Repatriation one thing. I’ve witnessed that. 

But you’re describing, embassy saying? Kent variant UK ""Alpha"" variant. People outside UK necessarily know Kent is.

Now, unless read report wrong, case fatality Delta variant low, would good news. I’m pretty sure differentiate since vaccine gives antibodies spike infection gives others also. watch utube 100% distrust government, especially way conducted throughout I'm hesitant, vaccine &amp; anyone starts racking I'm anti vax 🙄 That's COVAX existed. Moderna approved 16 year olds US since 1st approval. There's significant side effects age group different adults. 

There cases heart inflammation cited potentially associated younger ages mRNA. still investigation extremely small percentage vs number vaccines given. even assumed vaccine driven, still seems decently higher risk heart inflammation covid among young adults vs vaccine. may vaccine driven. UK 51 cases per million. Portugal 54.

Is UK UK list safe countries? world news? agree isn’t high priority, think it’s going happen either way. helping reduce impact would good

Also, Japan needs help anyway. don’t like articles like always imply people anxious returning normal social anxiety. I’m really dreading full return normal would rather spend time home family getting sucked back commuting work, going work social functions work trips return social obligations like seeing family often going parties hosted friends acquaintances. don’t social anxiety, prefer spending time wife kids people (especially work socializing). know people excited return office don’t get it. I'm given free cure, I'm Turkish, Turkey traditional US ally.

This seems unethical me. decide someone'll die live based government does. one's secret. keep vague online lmao CDC reported among US cases: Beşiktaş? Europe Canada looking real good. Indias deadly wave dropping fast. Hope September marks real turnaround world. Helping Olympics priority.  still debated!? posted stats without specifying relation he's going for. missing relation prompts others ask ""and?"". Since relation unknown, anyone's intepretation. US give Canada fuck all. loaned doses use. generous. fully vaccinated Feb. you? Funny seychelles story gets regurgitated every days realize trying argue subjective? try insult someone disagree think works, frustrated? side effects, you’re talking nausea stuff right?  I'm American living Canada can't come back US get second dose Canada's border restrictions. Pretty sure thousands American citizens similar situation am. CDC page category ""&lt;12"", non 0%. this, count ongoing studies, exists, else take &lt;12 kids get legally vaccinated now? Misinterpreting 9 word sentence quite impressive. imaginary arguments somebody else. ***Biden-Harris Administration Unveils Strategy American Taxpayers fund Global Vaccine Sharing take credit it.***

Fixed  Idiots fact Trump broken clock moment might gotten part right clearly problem discussion. People backgrounds seem incapable setting bullshit craziness aside examining matter hand. It’s maddening. would submit discussion might comment cedes forum crackpots. show flu deadlier covid young children. 

Comparing 2019/2020 pediatric flu deaths 2020/2021 pediatric covid deaths US fair, safety measures put place 2020/2021. 

Comparing 2020/2021 pediatric flu deaths 2020/2021 pediatric covid deaths US better straightforward. reason one redditors make comparison one parent comments.

Another possibility assess severity covid flu viruses children look elsewhere. multiple examples show flu deadlier covid. Different parts country strange me. elated hair stylist told fully vaccinated. went first hair cut year, talked respective Pfizer experiences, among things. 

Just... yuck. mentally weak you? really uncomfortable. tbh little worried quebec delaying 2nd doses 16 weeks, im glad paid (got 1st shot 2 weeks ago) point, vast majority testing positive idiots refuse vaccine. They're getting deserve. statistics clear. Close 90% deaths people arent fully vaccinated. 75% adults fully vaccinated numbers drop. government also possibly missed. trick banning flights India soon enough think. Though America never Im wondering thats really cause(as opposed enough vaccinations).  Thank you! Go event friends. comes back quickly. Google says 69,125 military personnel WA. assume military person least one person (spouse, teenager, etc) lives eligible receive base, becomes 138,250. could account half? I'm familiar reporting shots though, military personnel something I'm aware counting towards state total. It’s complete joke! 99% mortality risk UK vaccinated they’re still flip-flopping travel lists. need open move on, otherwise never ends. surge infections Seychelles provided “critical case consider effectiveness vaccines range reach meet herd immunity,” Yanzhong Huang, senior fellow global health Council Foreign Relation, told Washington Post time. panel report last month found vaccine 79 percent efficacy rate stopping symptomatic covid-19 adults 18 59, citing evidence clinical trials China, Bahrain, Egypt, Jordan United Arab Emirates. week, millions Sinopharm doses rolled production line Beijing, intended play major role United Nations-backed vaccine sharing program Covax, amid persistent shortages. Life significantly easier extroverts today even beginning 21st century. Cause loads morons believe vaccine to__________ (insert whatever uneducated conspiracy theory).... That's post appears vaccines. encourage read helpful resources COVID-19 vaccines:
  
[Vaccine FAQ Part FAQ Part appointment bot, action performed automatically. Please [contact moderators subreddit](/message/compose/?to=/r/Coronavirus) questions concerns.* difference others subreddit know want go, that's fine.

A lot people still want go also want go wedding.

I issue someone relatively anti social want others way well they're scared covid. understandable 6 months ago really really isnt.  presenting Brazilian data, third world country, low vaccination amongst adults we're talking US? low c That's like comparing malaria CTR's Mozambique NY. continue fail recognize socio-economic impact.

The reason get frustrated CONTINUE fail grasp this. idea variables are...

Ok, vaccinated? think current climate fear conspiracies many people little bit edge, whether rational not. unfortunate truth enough understand world way know 100% sure nothing happen 20 years wait 20 years.

What however compare vaccine similar treatments past, knowledge human body, conclude things know safe, probably well. know negative effects tend fade time, amplify, know decent amount immune system works, seeing red flags year+ data have.

At end day, fear logic we're using applies anything. technically possible latest flavor Pop-Tart uses combination sweeteners preservatives kill us exactly 19 years now. unlikely worth talking it. Humans managed go millions years changing environments circumstances without something wiping us out, we'll probably make one too.  Ok little incentive country able produce vaccines much faster covax funded. US knew would able manufacture huge dose count quickly took gamble knowing mutation would make vaccines useless unlikely timeframe. reason didn’t explicitly include J&amp;J? first time I’ve heard someone outside US talk positively US Reddit. Nice. many lives would lock for, then? make tradeoff? CA massive state far monolithic. tons Republicans there.   must capturing positive cases 10 plus people dying every day. Vietnam also reporting low hundred cases per day might 1 death day only.

Really need increase testing capacity get better idea many cases actually are. fawn Sinovac either. proving insufficient drive cases multiple countries. Chile almost entirely Coronavac struggling contain surge ever since began reopen. giving false sense confidence population really borderline effective two doses (50% protection symptoms, 70% protection hospitalization death) useless one (literally, Coronovac estimated 3% effective one dose). 

And efficacy numbers considering vaccine evasion strains may push even further. numbers illustrative only, SA variant drops Pfizer ~95% 85-90%, drop likely put fully vaccinated coronavac individual something like 30% - good enough. 

This nothing ""China bad!"" somehow implying making ""bad"" product. vaccines definitely better nothing, clearly old school inactivated viruses showing weakness relative modern miracles mRNA vaccines (and viral vector matter). immune response intracellular protein production clearly much stronger dead virus particles floating bloodstream (and improved use stabilized spike protein). mild case, according him, also made clear doesn’t plan vax “it wasn’t bad”. I’ve simply even stopped trying people.

Come people hospital. It’s bad! probably gave you. SMH Get refund. hope daughter covid. might want get tested. COVID-19. hero American democracy wanted...but apparently think fix stupid. fingers crossed soon!!!!  Got first shot today, little sore arm lift it, glad everyone around start get vaccine (18+ without health condition, France)  live heavily populated area? live suburb Kentucky last checked vax rate county right around 50% adults. cases tanked hard, 0-2 new cases per day, it’s weeks since day 2. mean 3% cases people vaccinated?! Yeah I'm vaccinating everyone including teens children, makes sense prioritize 18 first, especially 30s 40s still relatively higher risk hospitalized due Covid-19. small office, everyone comes gets temp blood oxygen check work every day, pretty much since beginning this. think nearly us vaccinated now, it’s still standard process. anyone feels sick all, cannot come in. lot company remote. Everything cleaned disinfected daily well. We’ve zero issues. main Coronavirus Reddit page, click three little dots top right corner go ""change user flair"". don’t understand flu deadly cases. means covid dangerous flu measures contained flu, virus.

At rate, comparison flu shown repeatedly worthless. virus different dangerous flu. Maybe people don’t care kids get sick, long don’t die. Iota already claimed. next available letter Lambda. According him, two weeks advised doctor 14 days (rapid tested) negative end time.  suffered obesity diabetes, conditions predispose patients negative outcomes, hospitals near overcrowded, preferred try push house. Many us lost family members: Another relative mine northern India — father cousin’s husband — died days ago weeks-long battle intensive care unit. One father’s best friends got sick peak surge; spent weeks ICU, told end stay owed sum far beyond expected. Yeah like people like ""nooo selfish online classes goooood spread corona maaann""

But exactly great time high school, relying Uni change everything. Hopefully classes on-campus, yeah

I'm studying teacher *really* hope VFU online. Screw that. Except semiconductor shortage dragging bunch US economy. said political spectrum like circle. go far either direction end batshit craziness. can't reason someone position reason to. office 2 weeks still considers mild case? Well guess alive haven’t even flu lasted week 5 yo goes preschool dominant blue area ant-vax teacher refusing wear mask restrictions public lifted (honors code you’re vaccinated) . straight told parents vaccinated worried herself. wife expressed concern yesterday situation teacher responded aggressive way giving refund wanted month June. Well last night got email teacher/school saying 2 kids tested positive covid daughters class. SMH...we wonder unvaccinated teachers gave it? Either way, keeping class now. **You repeating myth refuses die.** 

Young adults (and even children) absolutely get covid. What's more, younger adults likely develop severe lasting symptoms may never go away rest lives. million sources supporting this, 2:

[Covid 19: Younger Adults Risk, Child Covid definitely single life. could’ve prevented!! Every country disadvantages opportunities, mean think UK competent job hand dealt all.

Either way, comparison making I'm glad I've Finland whole mess. Whatever reasons, we've order magnitude fewer deaths per capita less way restrictions. spam since kid. Funny story however, taking family family trip near end year Hawaii. told daughter spam breakfast there. gives evil look that. 3% vaccinated? That’s good. full protection kicked yet. takes least 2 weeks 2nd dose 3 months. Georgia close 50% adults  exercise dont bee otch, fine. Half people comment section hasnt run mile since grade school Broken link bruh  Yeah, notified well, month half ago. Hopefully situation changed since they’ll let us least physical classes. antibodies?!?! That’s especially “wiped out” still still transmitting. This, plus people vaccinated areas going exposed virus much given timeframe. granola hippie types

I'm glad I'm one thinks strange anti vax coming now. 100 million seems fast gets us 5 billion end year.

Most vaccines require two shots may correct vulnerable vaccinated, half population still lives fear end year. reference adnan case?? Love waiting playing it. different weapon. vaccine BB gun. virus shotgun. Went away Friday came back easter.  Cool whirlwind combating misinformation learning go.

Very true.

However, majority misinformation targeted, aim causing deaths. I'll ignore anything coming layperson implies people get vaccinated soon possible. recently, I'd also ignore anything arguing safety measures unnecessary.

So that's part it, part propaganda, effective, usually entirely subtle. Propaganda victims often use call ""cargo cult arguments,"" parrot phrases they've heard contexts without really understanding they're saying.

For example, week two ago, see people coming woodwork saying ""trust science"" effort get people stop wearing masks. meets conditions. seems oddly aggressive common safety measure, uses particular set phrase turned bit shibboleth.

I guess that's third thing. People sudden repeating message, even something quite make sense. favorite recent example people saying wearing mask cases drop somehow implies lack belief vaccines work. bit two-fer allows propaganda victim attack masks also managing sneak negative comment vaccines. ever past Poughkeepsie?   100 percent catch polio unvaccinated too

Weird statistics work mean, get parents inherently cautious kids getting sick, flu literally deadly COVID young children. backed science statistics.

Could mean ""will"" Fauci always balance politics job running NIH. He’s damn good that’s he’s lasted decades.  already that. look daily death totals dead people unvaccinated.  Christopher Walken spouts classic line “yaaaaaaaah” post appears vaccines. encourage read helpful resources COVID-19 vaccines:
  
[Vaccine FAQ Part FAQ Part appointment bot, action performed automatically. Please [contact moderators subreddit](/message/compose/?to=/r/Coronavirus) questions concerns.* submission linking yahoo.com automatically removed source may reliable may dedicated mostly political coverage. possible, please re-submit link reliable non-political source, reliable news organization recognized institution.

Thank helping us keep information /r/Coronavirus reliable!


*I bot, action performed automatically. Please [contact moderators subreddit](/message/compose/?to=/r/Coronavirus) questions concerns.* Title misleading. vaccine patch uses micro-needles, effectively needle-free. Thank you! Glad feel fine. Continue spread word family/friends received yet! got two options, either get vaccinated infected. would consider mild, however bad someone vaccinated. say seemed like vaccinated folk mainly asymptomatic. could barely talk coughed every time tried. looked sounded like shit, plus got fatigued. Luckily kept smell taste however. get medical information YouTube videos, you’re probably idiot. cities places great

Well, someone's never heard Colorado Springs...  point cases continuing plummet, think people care much hitting specific vaccination target specific date. 

If 64-66% July 4th cases 10-20k day, life continue return normal.

I think long tail many work places starting formally incentive encourage getting vaccine though. formal full approval summer sometime may help little well.  people unaware privilege selfish posts like this?? that's downplaying mask effectiveness. downplaying mask They're using Sinopharm. Sinovac.

The latter real world data showing works. former much. Warning ""new normal"" mentioned. wait two weeks bro - WAIT TWO WEEKS Sorry, allow posts link tracking websites. welcome post link comment Daily Discussion thread, stickied sub's front page.

Thank helping us keep information /r/Coronavirus reliable! ([More bot, action performed automatically. Please [contact moderators subreddit](/message/compose/?to=/r/Coronavirus) questions concerns.* post appears vaccines. encourage read helpful resources COVID-19 vaccines:
  
[Vaccine FAQ Part FAQ Part appointment bot, action performed automatically. Please [contact moderators subreddit](/message/compose/?to=/r/Coronavirus) questions concerns.* think people consume ""news"" sources. One friend mine always sharing anti-vax pro republican disinformation. Tbh think actually kind stupid. nice enough.   population categorised, most. present 40 show shot, that's relatively recent thing. month ago 60 health care worker eligible.

Frankly, poor, least worry rampant cases submission linking yahoo.com automatically removed source may reliable may dedicated mostly political coverage. possible, please re-submit link reliable non-political source, reliable news organization recognized institution.

Thank helping us keep information /r/Coronavirus reliable!


*I bot, action performed automatically. Please [contact moderators subreddit](/message/compose/?to=/r/Coronavirus) questions concerns.* like personal accountability aspect. rescind government cost ownership unvaccinated COVID cases. 

If you’re vaccinated don’t syndrome precludes vaccination, trees time to, possible death, long-term maladies resultant illness bills now, fellow Americans. ""Herbal treatments""?! They're selling literal piss shit. Yup, friend MS got vaccinated ASAP. doctor highly favor.

Internet disinformation makes sad. We’re stupid species. see path 62.8% 70% next 31 days. daily increment averaging 0.1 0.2 percentage points declining. remained constant, we'd end 65.9% 69.0% July 4. Accounting decline, we'll probably end 64%-65%. government adjusting messaging NOW. might strike disingenuous government announce 65% new good-enough target, alternative target simply met July 4 become apparent chance met end Summer. Political horseshoe theory - fringes either side loop back other. left, conspiracy corporate greed. right, government corporate cronies. lead place. social safety net, think bud begets another variant, name iota - utter disregard even iota common sense. Even people *can't* get vaccine, less likely work problems immune system.

This exactly *everyone* get it. Vaccines work population level.

I'm particularly worried catching COVID right now, that's I'm vaccinated *and* area almost new cases. latter reason came people vaccinated. Denial really first step Apparently scientists learn new stuff unfolding scientific situation. OBs office seem little stricter some. I've heard still allow spouses 12 20 week allow all. Mine allows none.

Also, pretty sure wife's exception, rule, research I've done. moving Florida next month I'm researching OBs, even allowing spouses. think love Spam (the canned meat thing) join Hawaii culture. Yes lots people skeptical CDCs recommendations 18 months neverending mistakes lies. Especially came new mask recommendations clearly attempt get unvaccinated people take shot based reality pandemic. still wearing n95 absolutely go somewhere vaccinated. studies showing vaccine efficacy six months old point CDC said longer tracking breakthrough cases unless someone ends hospital. flying blind reasonable take precautions get hit virus continues evolve possibly escapes vaccine immunity. Unless you’re fully vaccinated course, lick away :) Well half right. Vaccinated people don’t need testing they’ve around covid positive person showing symptoms. different unvaccinated since recommend get tested circumstance. 
The article makes sense testing 2 groups compare? Probably people touch chairs go outside take masks without washing hands. meantime forces making sure everything possible spin world way real whats happening friends, family neighbors. pandemic never go away--- seeds sown meantime grow giant evil oak trees. Presidents pretend care *

This nearly enough. 25 million vaccines billions people capacity much . sake able say something  Afraid? No. Hopelessly disillusioned number people *actively embracing* post-truth information warfare reinforces childish views social obligation society? 
 
Hooooo boy, yeah, that's one. 
 
I mean, literally half America socially stunted would insult memory half million dead Americans refusing put aside politics single ounce solidarity, else capable of? want head Normandy piss grandfather's grave? dig fuck rotting skull we're it. floor far tell. Indian variant rise UK, infectious. 75% adults first dose, include children. Children also susceptible catching schools spreading vulnerable children adults. 75% entire population done, *then* reaching herd immunity. is, quite there.

The good news vaccines used work Indian variant, need push many people possible given least first vaccine. Someone else posted link said 75% vaccinated.

So 97% cases occur 25% population 3% occurs 75% population, that's 99% efficacy preventing COVID first place. deep web. new cases dropped like 40%+ last two weeks  Henceforth idiots acquire covid. already shipped AZ doses Canada Mexico AZ passed review Mexico Canada. would foreign countries waiting FDA?  point made covid dangerous populace.

sadly people like give single solitary shit anyone else. much look consider evidence supports narrative. Sloppy/incompetent, yes. Lack caring, no. don’t understand, didn’t people say “but gave immune system” Twitter Facebook? happened? think confused ultraviolet sterilization robot. recent uptick probably caused imported cases India. UK permitted hundreds flights India country huge number cases. distribution infections supports view. Thats behind paywall see study cited. lead paragraph

The experimental drug TEMPOL may promising oral antiviral treatment COVID-19, suggests study cell cultures researchers National Institutes Health. TEMPOL limit SARS-CoV-2 infection impairing activity viral enzyme called RNA replicase. work led researchers NIH’s Eunice Kennedy Shriver National Institute Child Health Human Development (NICHD). study appears Science. short answer virus nationality regardless is. Although variants, seem imported/exported easily without restrictions. 

A longer answer although situation much much better right US elsewhere world, due covid weaker flu. due relatively widespread vaccines and, importantly, due many sacrifices healthcare workers parents made far.

The risk calculation differs family family. still many parents US want take risks unvaccinated children. untrue ""children risk covid"" ""the flu literally deadly covid young children"" 

There also article Lancet saying ""Our results demonstrate relaxing social distancing measures vaccinated individuals would minimal impact incidence, extending guidelines individuals adequate vaccination children could fuel rapid rise COVID-19 cases, hospitalisations,  source number vaccine administered manufacturer Canada? I.E. # Pfizer doses, Moderna, etc?  That's great article, thanks! Seeing Georgia Virginia's stats general vaccination rates kinda explains see partisan states strong correlation political affiliation vaccination rate. I've primarily lived states. Three days two weeks since second dose.

I'm almost home free! mean get point US almost 3x many deaths per million people Canada did. We've always careful wanted avoid that.

