,date,text
0,2021-11-25,"   reviews Michael Worobey’s dissection early COVID-19 cases Wuhan, discovery herpesviruses assimilate cellular kinesin produce motorized virus particles.  Quarantine? Cmon man that’s insane. proof vaccine pcr test. mean, what’s end game UK?

Let’s say compete Delta. UK isn’t going permantely closed border, it’s going get eventually, likely pretty soon. 

What’s value delaying couple weeks? It’s ultimate outcome.  far   vaccinations help variant? two variant. asymptomatic believe. Hopefully stamped out. forget towel!  suggest instead? Masks mandates, social distancing, limited capacity occasions, etc?

In US even dems don’t push things anymore, completely unsustainable. potential vaccine handle many mutations rate. lucky mNRA vaccines already developed influenza nothing exists (from knowledge) counter act multiple mutations rate. 

This serious issue. Wow cant wait US ignore /s 

I tired.  Makes wonder stop treatment covid patients certain timespan. patients like would die, hand, massive numbers people would saved killed new variants. Definitely hard ethical question. Nice thought theory, impossible reality: airlines massively intertwined safety. Safety something handled extremely poorly private businesses inevitably grows lax ""nothing ever happens, paying much this?!""


In general overhead trying build a-la-carte government would likely result greater overall expense simple ""everyone pays pot"" system many countries chosen.

So yeah: vegans pay meat plant inspections, pacifists pay tanks, people walk pay wheelchair ramps, non-fliers pay TSA, NTSB air traffic control. list goes implementing larger exact system would tons overhead.  Hey! South African here, two days ago peaked 1000 cases last night tipped 2465 cases day. cases definitely going again. Prior week, 800 day ( could wrong know Wednesday first time went highest it’s while).    like ""capitalist"" vaccines, go get ""socialist"" one China Russia. Oh wait, vaccines effective best ""capitalist"" vaccines? Shhh... Yup, variant truly much transmissible Delta, time identified already late. Department Health revealed Thursday night genome sequencing analysis confirmed patient, arrived city South Africa, another hotel guest tested positive days him, infected B.1.1.529 coronavirus variant. fully vaccinated.

There many questions: long ago vaccinated, vaccinated with, booster, etc. 

We know much yet hard know whether initiate Delta like world-wide wave. idiot know went Disney posted vitamins took essential oils used shield kids effected recently vaccinated  *sweats Eastern European*  variant already sequenced three countries. US holiday season, unfortunately. Why? Yeah know measures come pass without compromises support. cannot expect successfully introduce new travel ban vaccinated people.

Maybe wholesale travel ban, status check could still happen due B.1.1.529  see excess death graphs. Easily triple report COVID deaths.

We one obese, hiv tb infected countries terrible healthcare bad inequality. would surprised good fatality rate. Monday unrelated went away sleep ""socialism never fully implemented"" human nature cooperate comes personal expense, minority people ever it, unless threatened force   do. mean enjoy treated poorly. Feeling lightheaded week later. Flaring anxiety making worse. feeling lightheaded all? Oh also arm still quite ok, injection site. Lower. Elbow, forearm area. Joe ain’t malicious bruh  Yeah, I've flying regularly nearly 20 years, count incidents one hand, definitely seen flight attendants absolutely lose shit passenger warranted.

Your livelihood hands really bad day. week Pfizer booster I’m feeling lightheaded, it’s fueling anxiety making feeling worse. Anyone else feeling lightheaded week later? read forums people complaining 7 days dose 2 still feeling lightheaded. first sequencing lineage weeks ago. Scientific discussion seems go back 2 days ago. yesterday news picked up. 7-day rolling average cases South Africa tripled week, Johannesburg rise much faster. actually even long enough sequenced cases hospitalized yet us judge virulence.

The available information quite alarming. really much it. easily dismissed like...all of...the false alarms before. wait week see.

Get first/second/third vaccine dose, convince someone else to. South Africa 28% first-dose rate; vaccines work. Yeah Blackpool particularly special case odds ivermectin hdq studies populations high rates parasitic patients?  referring doctors upthread injecting dose rationality discussion. capacities better US. Unfortunately. New variant identified South Africa herd immunity last wave. (Which, however, may strong enough prevent wave) false sense security ... people vaccinated need take precautions

What saying? People vaccinated *are asked take precautions*. false ""sense"" security. current mode operation many governments. unfair putting blame individual individual told need vaccination go back licking others noses whatever *Gestures broadly every country world*  incredible sequencing capabilities owing work TB/HIV. going poison people taking label? Also no.

This verges medical misinformation.

I recommend unless trained medical professional, refrain giving medical advice, especially advice could get someone killed.  Let's first wait till spreads think it. That's done! thing think acting quickly would ban travel South Africa. that's hoping one variant left country already. 1 person did, already late.  US domestic carriers effectively ""lowest cost""? Like Delta might expensive, rate experience planes better flying Southwest.

The whole process across airlines seems designed make humans feel powerless, like cattle, they'll happily charge hundreds dollars thousands dollars it. Easy caps bucko own. Going road I've ever known They're going leave borders open like India weeks days get citizens home US like Delta variant. definitely worked here, got wanted, nearly collapsing healthcare system due variant wanted.

We'll probably see new strain wait weeks days.

Why government like this.  100% knew link would lead hope spreading furry. came backlash received lying credentials?? ""Here go again"".... Im getting booster soon rate...when end. saw Pfizer BOD guy MSNBC say point, could go new variant sample sequenced, adapt vaccine it, produce millions new vaccines ready produce billions 90 days. go FDA approval original one. expert, takeaway asking question is... yes, 3 months plus distribution time.

That like month ago MSNBC. Go Saw another thread wanted make sure noted. Best news I’ve seen today. likely see Nu full nAbs escape vaccines likely barely issues severe disease. encouraging. thread also shows likely won’t outcompete Delta. “ Can’t state still restrictions. Blackpool, UK? Fecal matter? Uhhhh ass dirty bro? Spoiler Alert: end dead point lives. think best could expect ""soaring"" low vaccination rate new variant reduces vaccine efficacy source looking? Please compare Wait see indeed. We’ve holding booked last week fly RSA leaving Dec 7 MIL ill felt might last chance see her… 
Something happen fear none good.
As say, wait see.
😔😞😥 fact people still traveling internationally pandemic insane me. like stupid? know fuck doing? 

You're guy computer home training medicine, experience government, awareness read reddit headlines. Fairness dosent matter. Preventing spread virualant virus does. Saw comment thread wanted make sure saw this… reassuring comforting pray case nu variant. likely see Nu full nAbs escape vaccines likely barely issues severe disease. encouraging. thread also shows likely won’t outcompete Delta. “  big heart sibling. Restoring hope humanity. said data dump. worrying however, displacement Delta undoubtedly Insurance ?   Cause alive go sleep Yes read correctly based total 77 instaces endemic means. fouled out.  Serious publications scientists never showing level concern one. UK already banned travel 6 countries, measure never took L/M.

It could still overblown, knows, early signs same.  Another interesting fact South Africa they've reporting high case fatality rate since beginning pandemic. commentators I've read say tend underreport cases high proportion population access testing. monthly strain! dystopian thing lol I'm starting think thing going around long time constantly hacking away killing small percent population ruining health many others. long long time? Penalties rarely deterrent effect. People think far ahead. death penalty stop murders, example. Tho fair, -8,000 people ~8,000 sq miles, almost automatic social distancing… meatheads Fuck. take booster today US likely follow suit months. Possibly. new variant lmao. recently told peer (I received vaccine already support vaccinations): said flush covid vaccine explained comparing getting bit snake prevent venom spreading. **It's right? say her? get resources/links/articles related statement?** Thank much advance help. Happy holidays. would take long time would difficult process. would also cost massive amount money. She’s prominent presence covid/virology twitter year huge following. fake grifter someone would exposed now. Username checks out. Pfizer make double profit go back months later start Delta though good starting point hop fitness level from. much can. mean uptake issue, quite disaster people anticipate. Ahh, nice live world look last 2 years world wide fuck ups early attempts reopening able make statements like straight face.

So sad... variant have?  may sound like strange solution, that's exactly gotta do. enforce vaccination. article states mostly unvaccinated driving surge mortality, distancing mask rules less stringent last year. 
It includes also significantly higher percentage people 30s 40s last year. seeing pattern. 
I watched closely since late 2019 / early 2020. 
I’ll tuned laser focus weekend seeing develops. hate people this. want reminded comment 10 days? rub guy's face he's wrong?  anti-vaxxer people use kind stuff proof science flawed

But course, fact ""vaccines cause autism"" research retracted, exposed outright hoax *not* prove whole antivax argument flawed.

It's standard thought process conspiracy theorists: evidence refutes beliefs criticized. theoretical evolutionary biology dropout (due illness, incapability) expectations indeed way transmissible Delta push Delta. said thing Delta found India people like 'don't worry, India, we're good here'; case heavily interconnected world like world today. !remindme 20 days Lol I'm 90% vaccinated country tell yet. Fucking hell read 4 different articles get good idea scientists worried transmissibility high variant. honestly even know best one send to, seemed shed bit light situation. They've sequenced 77 instances (that's sequencing, case load) province Gauteng since early November, every genomic sequence conducted variant. amount time, since early November, cases gone couple hundred day thousand day. assuming present outside Gauteng now. 

They're starting restrict flights require quarantine pcr tests get quarantine traveling South Africa. 

I saw first article post online yesterday skimmed assumed, like many, would probably another dud variant scary spike protein mutations low transmissibility. there's still chance relatively innocuous, really looking way, looking good, scientists known raise alarms often raising alarms right now. furry disqualify someone ""proper profile"", take attitude right back 2013 No. I'd rather die. pandemic end soon. refuse let life. explain further? basically Delta everywhere, variant take hold?  Chise extremely prominent figure covid twitter year. sort fake grifter someone would exposed now. knows shit I’m sorry upsets also furry lol Czechia 37% positivity rate seem hit 40% week end. spread others, like vulnerable loved ones visited holidays. People really like thing guess. protesting masks whatnot article says South Africa 1200 new cases day. county Midwest USA 23x cases per day, per capita. Either testing program sucks, they’re lot better mitigation. Ok. I'm abolitionist. Missed part it’s likely evade vaccines huh?   knew could happen world gotten vaccines Africa vaccination rate dismal. Maybe would prevented variants getting churned rate. Can’t update vaccine particular variant, worst came worst?  pretty eerily similar early 2020 started like. 
I’ll watching developments closely extreme interest.  
Whatever SOB turns capable of, really hope doesn’t turn set us back couple years. 
I guess happens get see quickly mRNA vaccines really “re-tooled” needed deal new threat. I've read paper accidentally talked gnome instead genome. Typo's happen. BBC reports giving extra dot. Canada accept challenge 
/s Boosters rest lives Hopefully new variant like new got new variants blew days one talked What's third base? Another vaccine inbound  I’ve got somethin you, snakes money says $1000 unsub /r/Coronavirus... guys suck back in.

Fuck. Pfizer concerned driving drug-resistant strains; people taking pill supposed quarantine. Mixing multiple drugs reduce chance. right nothing mutations people talking Nu. like iOS update. need one unless need one

This true iOS updates too. phone allow that. C-C-COVIDBREAKER  quotes tweet Bloom Labs saying *complete* immunity escape ignores next one says *most* escape we've seen variant.  Increased hospitalization fatality rates vaccinated sure sounds worse. good place ""which decision ethical""-type questions? Subreddit, Twitter account, etc. Specifically wondering whether friend staying quarantined elderly parents ethical going hotel good cleaning practices isolated possible etc estimate .8 incorrect. probably misunderstanding difference R0 effective reproduction number (R-eff).

R0 reproductive number population without protection. virus R0 .8 would able get ground due negative trend would impossible become pandemic first place.

R-eff reproductive number population protection, factoring natural immunity, vaccinations, masks, social distancing, more. virus wave peaks, looking R-eff less 1. Delta R0 around 8, could easily R-eff 0.8 wave peaks.

I believe Alpha R0 3-4 Delta 5-8, 9-10 significant improvement virus could similar game changer Delta was, drastic thinking. new variant delta UK seems 10% transmissible 30% less symptomatic, one hope I'm sorry deal this. lot us dealing sort experience long COVID. we're welcoming want sub  vaccines rendered useless. might offer protection, certainly completely ineffective.  pulling opinion from? looked beginning pandemic. US international travel $214bn per year. We've spent $4.52tr covid related expenses, lost almost 800,000 people. would definitely worth I’m sure fine, it, guys….  Don’t complain global warming hoax Honduran farmers come droves farmers California can’t grow anything... oh wait, it’s already happening would totally get it, even rushed get appointment late December. risk get shorter intervals reason decide 4th dose pull shit again. mean is, totally counterproductive discourages boosters among healthy vaccinated people likely end mild flu. Man, vaccine took months ago looking weaker every passing week. tired loosing hope things getting better, cannot see end this. scares though current vaccines going completely stop effective, even boosters. current vaccines might relatively ineffective new variant South Africa (which I’m positive already coming government won’t impose &amp; keep travel restrictions). 

I agree Long COVID, feel like needs emphasis figuring causes Long COVID long.   basic premise question wrong.  Yup!  UK already countries confirmed found in. 
Probably still late…   Fu*k officially want fucking die already. Pre-Nu ...more variants. America.        It’s already South Africa likely already around world. always case testing lag. 

This need kick high speed mRNA vaccine apparatus gear.  link,

*This new variant, B.1.1.529 seems spread quick! less 2 weeks dominates infections following devastating Delta wave South Africa (Blue new variant, 75% last genomes soon reach 100%)*

So seemed Delta longer dominant due new variant. Govt begging everyone get boosters 5 months time implementing stupid rules. can't make s**t up. Look Screen shot Emma person. Low incidence delta prior  issue took comment somehow “end” this. point can’t.  people like seriously still beating economic drum Covid restrictions?

Simple question? long-term economic impacts 5+ Million dead world wide almost 800k US?

What economic impacts tens millions Long Haul Covid?

What economic impacts Pandemic killing people millions making rightfully afraid traveling personal business needs? Fk shit Australia PBS means household collectively spent $1500 (or $320 concession holders) medication pharmacies year pay $6.60 (or free concession) per box rest year *inhale* North Sentinel Island? get die means. Yeah I'm pretty much ready log server. Dunno getting downvoted much. people want shitty limbo forever. Either literally lock people houses law restrictions. middling shit working. Yeah, please, someone give hope, don’t want go back living 2020. variant going reset everything? wasn’t. low case rate much compete with. makes feel better, it’s HIGHLY unlikely defeat vaccines entirely. hope! B.1.1.529/nu low case fatality rate three suggest, may good news even spreads much quickly delta did. South Africa lot testing per case US UK combined.   likely see Nu full nAbs escape vaccines likely barely issues severe disease. encouraging. thread also shows likely won’t outcompete Delta. “ Indeed, B.1.1.529/nu low case fatality rate three suggest, may good news even spreads much quickly delta did. South Africa lot testing per case US UK combined. I'm sorry, maybe add context. said rest world dirty job fighting pandemic wasting time bureaucratic crap like giving variants greek letter names, help much. truly wanted end thing approve Sputnik Sinovac vaccines, make assessment Covid pills, deliver vaccines third world. Instead, every week exact thing, keep whining ""boosters bad"", ""vaccinating children bad"". thing done naming variants fancy letter names.  I'm sick tired sick tired   Madagascar too.   seems Delta dominating variant emerged. . missed something tweet chain I’m sorry. way it’s end times said variant push vaccination efforts square zero. already though time booster shots cannot imagine outrage ignorant people require 2 doses new variant.  Merry Christmas filthy animals turns Resident Evil Dead Aim. know know.   dunno seems like lot opinions do. scientists think go based hospital cases, think restrictions continue zero covid. good maths well-informed. danger"" good thing annual boosters use target new variants. 

You need new shot new mutation, need annual booster date version vaccine possible. 3rd dose people receiving basically 1st annual booster, \*not\* used target new variants. 

Seems bad.  live Bermuda heading home time States. nice time visit, everyone excited holidays. kept asking people plans lovely hear folks excited families. straight deny entry US citizen territories? States can’t that. care getting covid I'm vaccinated? care getting sniffles. least enough go lockdown prevent sniffles. thing, younger healthier getting vaccinated part protection vulnerable advocating. Glad agree everyone get vaccinated. know living said post, scenario even job forced temporarily shut down, company would required federal government keep employee pay regular salary month, company receive funds government able well stay business. 

If said company shirks fulfilling requirement either pay you, lowers salary, fires you, would violation, federal government would give salary was, pay every week monthly.  Translation: ""I idea I'm talking about."" What? far know asymptomatic though, encouraging. things normalize

If idea would be. remember planning last spring, decided wait mid-late summer assuming would low point. Turns month Delta wave. matter? well squander  There’re whole bunch clinical trials. It’s exactly secret. would get booster 5 months 8.5?  long allready europe. find within next days weeks variant-specific booster would need shown significantly effective (against infection, hospitalization, death) booster original vaccine. Thus far, least Delta, case. Even Delta-specific booster effective regular booster. Maybe true new variant, that's there's less urgency targeted vaccines.  B.1.1.529 seems obviously *at least* variant interest (has genetic markers associated predicted increase transmissibility virulence, changes receptor binding, immune escape, reduced treatment effectiveness, diagnostic failures)

Whether promoted variant concern (direct evidence increase transmissibility, virulence, immune escape, reduced treatment effectiveness, diagnostic failures) issue weeks now. 

South African viral genome sequencers, well sequencing nations high traffic South Africa like UK, running nonstop weeks.    Covid 4, time it’s personal. Delta isn’t dominant SA right now….not much outcompete. 
I’m trying urge people stop acting like end times  new variant results square one I'm probably gonna Corona proved even ""community masks"" effective, usually much medical masks. live country low/no/poor vaccine availability. That's outcompeted means. environment Delta remained flat Nu grew high exponential rate. 

Unless environment.  EXACTLY! Thank you! fighting pay increase penalties! it’s novel. 

If think it, new virus infects humans first evolutionary pressure it’s going face going getting better infecting humans. essentially Petri dish selecting mutations better infecting us. 

Viruses endemic humans longer already picked “low hanging fruit” - simple mutations make infect us better. Furthermore, humanity prior exposure (and thus immunity) them, evolutionary pressure isn’t selecting ease-of-transmission rather immune evasion.  stay Holiday Inn Express last night ""Google friend.""

That's deliberately obtuse.

""Just break law cops judges anything you, bro.""

Just gonna deepthroat whole boot, huh? capacities better US

***looks burnt antivax healthcare workers***

\*chuckles\* I'm danger mistaken. 
All effective restrictions relatively effective, regardless contagion rates. compare Delta? compare infections disease Covid currently compared to?   Shouldn’t put fly list every airline? It’s odd don’t already get charged felonies that, there's also huge counterproductive incentive this. South Africa amazing job genome surveillance detect coordonate transparently experts worldwide. Governements elsewhere might inclined spend less kind scientific research thing gets travel ban. friend sent today got bit scared. kids getting second dose thought finally feel like get new variant! Strap folks. Get ready lock fire ye old money printer. holding gold, nows time buy in, countdown liftoff inflation rocket. Correct, meaning, theoretically, spike protein hasn’t mutated enough vaccine still effective. Israel making Early days yet, Australia drugs like would covered Pharmaceutical Benefits Scheme cost heavily subsidised government. give example; needed antibiotics years back, paid $9 pocket prescription. Hi max. Enforced border quarantines success last 5000 years.

They aren’t haven’t effective disease contagious COVID is. 8 year old tested positive wife vaxxed get least show symptoms. 3 year old really lethargic couple days popped like normal. What's chances know it?  Ontop assault charges. throw 7+ years fly list 2022 looking dope  Even ban international travel, virus still somehow leak country. look China.
 strict measures air tight still get leaks fairly frequently. I’m telling downvoted dude. I’m gonna argue mean imply.  might getting downvoted people think you’re antivax troll. You’re clearly based history, trolls like say things like “15th booster now, waiting daily gummies” whatever way mock vaccinated people. 21st century egomaniacs want disguise faces frenzied flying monkeys follow graves. We're putting number African countries Red list today. Sunday travellers countries quarantine Variants always happen, happen frequently spread. People like majority.

And that's problem, reason we'll live (or occasionally die) foreseeable future. would chance new variant makes much less sick? know massive hopium, could also way pandemic course. 

Any data sick people get variant? example 80% people unsymptomatic, could also explain 'sudden' rise (since exponential growth much phase). 

Again, hopium, I'm looking data here. Faster spread bad healthcare infrastructure one main concerns seeing I'm overdue surgery year. local hospitals still clogged antivaxx idiots pretty dramatic effect care people chronic illnesses. Oh, definitely will. want to. going new delta?  Time what? world community failing again? Anti vaxxers fucking again? 

This anything variant considerably lethal Delta straight jacket  make sound simple logistics double vaccinating continent composed mostly third-world countries easy cheap.

And amount despot leaders really think jabs make way arms citizens sold countries? Ur mom mean UK even implement travel bans whole year late. take long, it? curious believe could severe. something makes believe that, bc possibility could go either way? original Hong Kong case received Pfizer May 13 June 4, actually recent 6 months ago. ???

Spanish flu much worse coronavirus - killed far people general, also killed far young healthy people.  lol imagine casually outing brainwashed Greece also impose 7 months validity ages 60+. happen next two weeks so. UK actually careful analysis finds cases variant. EU countries really analyze anything, overlook cases, ban non essential travel UK. hate much, stupid delta already.  'there concerns variant could cause severe disease.'

