,date,text
It matter 1% 100% patients die 3 weeks exposure if, 2 weeks, walking around feeling mostly fine infecting others. purely speculative. See thoughts Hey friend, please consider getting therapy doom filled internet echo chambers. distressing post, take care yourself.  Yeah really wait see many breakthroughs conpared delta breakthroughs. knows Well, Hong Kong, vaccinated individual transmitted another vaccinated individual indirectly doorway (infected individual opens doorway - later person opposite door also opens door becomes infected - basically insignificant ""contact"" imagine) (extremely noisy unreliable) data SA suggests might vaccine protection (9 19 cases, 1 sequenced breakthrough case, vaccinated, vaccination rate \~30%) I've seen sort thing American Dad, means totally possible.  hear nowadays, believe even person vaccinated, could still spread around. means matter vaccinated unvaccinated, international travel(especially red marked nations) risk others.  chances transmissable, less deadly? Let's hope that's case.  mask violate freedom 🤠 would guess though severity infectioj fatality hospitalization rates 3 correlated. hate admit it, looking forward ""new COVID"" memes. mutations! far thats evidence. Lets wait watch. kind sensationalism without solid evidence needs stop-Unfortunately media catering folks extreme anxiety You’re misinterpreting important studies Nah boat longer much water making be. It’s Nu? still call Nu Omicron variant that's case, ain't stopping it. one fully vaccinated? offense thats really clean bill health. Depending age group, you’d probably labeled unhealthy demographic standpoint Last night told going name Nu started using that. Today decided name Omicron instead. Probably best since already Mu, gonna take least hours reddit catch up. choose get wouldn’t choose neither? That’s saying first place Biden stickers going hit different gas prices drop suddenly. truly believe Covid less deadly disabling instead left disfiguring mark, like red eyes swollen ears such, people would demanded lockdowns trampled vaccine. touch good point. downplaying anyone losses high survival rate really worth living constant fear? always disease death. feel big difference constant stream negative information. little cynical, boring newscasts don’t get viewers lower ratings means less revenue. It’s best interests make news riveting scary keep coming back look it. take grain salt. Live life, enjoy it, fun. That’s going help healthy too. know stay home worried. Every stay home beginning normal people made decision going whatever small risk comes day august found. CDC reported ""3x case growth"" combined 3 days data 1, retract days later cashed empty paranoia. know little yet. Cronvid21 Found toilet roll seller! weirdos Salem Unicron’s big brother.  vaccines still great hospitalization? seems like best case scenario. Get booster move life. what's naming scheme right now? reddit new variant called ""nu"", German news outlets called ""omicron"" today.

I'm confused. chances 2020 low. Unless avoid T-cells completely, back square one Yup, people saying ""we know"" need realize certain people get info first act it. We'll learning US senators sold months confidential briefing  Republic, representative democracy. isnt problem, corporate influence is. need dismantle corporate power taxation regulation. different situation describing. We're locking humanity Another potentially crucial update:

South African Minister Health says still early process gathering information learning strain, thus far, EVIDENCE vaccine immune strain.  That’s false. Stopping additional spread important. bring cases needlessly. likely take month longer sufficient data new variant. see enough real-world patterns, everything informed speculation scientists. Sounds like name boss sega genesis Nope....that's going happen. relax. That's prudent thing do, trying stem tide panic poor math social media like trying stop flood scooping cup cup. Yes except skipped nu, likely pronunciation confused new English nu (naked/nude) French, xi likely name world leader.

The last Greek letter named varient mu Twitter users others guessed one would nu. 

Not Greek letter named varients super newsworthy long may missed them. sort came went got outcompeted varients used hearing of, particularly Delta. 

Mu Lamda remain varients interest, others never got bumped varients concern downgraded former varients interest. one, Omicron, jumped straight varient concern. pandemic, response pandemic things. sooner people realize government holding us hostage, unvaccinated, sooner get back normal new. They've almost 2 years analyze situation, look demands study population disease statistics. situation obvious lack funding -- they're currently tossing around multi-TRILLION dollar spending packages Congress.  

At point, there's excuse. health care system overwhelmed, deliberate decisions address problem. planes would kill 1500 Americans every day would freak fuck out.l Yeah, going back recently. Why? people staying home beginning. Bulls vacay cuz enjoy life, better react wrong take small hair cut buy next week. sold puts bought calls upro bottom today. Cooler heads return Monday. Big discount today. Combine short trading day, going weekend, full day market closed incubate. Perfect storm. think we're green Monday unless get wild news weekend Exactly. Appreciate SA sharing info new strain. China would hidden it. xoubtries right responsibility take beat action themselves. seems like Reddit never ceases ""eViDeNcE"" based video games. hope there's new variant every single year. 


Why contain it? Let spill schools churches. Let bodies pile streets. end, they'll beg us save them.


Praise Saint Fauci! Take breath consider evidence still rolling in. don’t know much yet. find out, adjust.   Well HCoV-OC43 still around since jumped species horses 1889.. would extremely good time buy day trader, especially tech sector. first two years therapy. causative relationship press x doubt. least gave cool-sounding name guess. Oh dang everyone, think got 'Cron. Please stop encouraging hording, makes things 10x worse ""Israel identified four cases B.1.1.529 variant, recent travelers. One case, 32-year-old woman returning South Africa, triple vaccinated Pfizer 3rd dose two months ago."" go?     kind wonder also necessarily happened turn advanced province Africa ( near Johannesburg ) instead that's place paying surveillance, virus variant came elsewhere, interior Africa Yeah. anxious long time. soon know bad could be, make easier. I'm you. wife first June 2020. cancel Christmas visits last year. Finally got see family first time ""Hopeful Vaccine Summer."" I'm eyeing news wondering another Christmas cancelled. Africa destroying doses, no; let’s forget it’s parliament extremely slow approving them, mention vaccine hesitancy within population like every country. big bad first world countries blame variant could easily come zoonotic source. said worry delta. new variant really bad people say is, current U.S. stance appeasement conservatives act like babies preventative measures stop immediately. garbage going far long. would require antivaxxers care people's well being. Feels like March 2020 Time buy. keep hospitals getting overwhelmed...

Only true testing people get diagnosed early enough drug effective. aren’t yet.

Plus, really expect unvaccinated people (who driving surge hospitalizations, death) seek testing second get symptoms take medicine? subscriptions lagged like Epsilon, Theta Zeta used VOI longer monitored (likely outcompeted Delta). sure used new variants crop up. vaccine stopped pandemic? *remembers tweet said evidence human human transmission Covid 19*

It's hard freak news like this. Plus market typically knows all. Maybe go back second grade math relook Switzerland graph again… least PCR tests still work, don’t think know yet different brands do.  think we’ll good constant COVID whack-a-mole driving wall someone whose loved ones chronic conditions. wonder skipped nu avoid confusion ""new"" traveling Berlin second weekend december, please dont. Vacinated people filling hospitals, unvaxed.

If vaxed point well going follow lock restrictions Thank god aren’t massive holiday lots traveling week. Didn’t shit happen Delta too? like Labor Day weekend next month funeral funeral funeral. stopped going third. Covid-era funerals basically pre-gaming death point. fking embarrassing response. fking close borders get data. Better safe sorry, fking imbecile. Better stock TP non-perishables. one going ride.  used go school time sick, nothing new here. never late flatten waves enforced border quarantines. 
New dominant strains next wave usually sneak prior wave. ""Go back fucking Belgium""
-Gordon Ramsey sounds like merck re-purposed ivermectin lmao would bad. Belgium lol not? What's limit? Lol, think there's lot people US think witchcraft real? Reddit reading fucked China late January 2019, next day sick... Covid, I'm pretty sure. thought cases states time, recovered symptoms Covid became publicly known, checked almost boxes. NYC. time, many coworkers acquaintances also came something really bad. Covid-19 US long anyone even knew.  Lockdowns definitely work. United States fucking half-ass attempt so. Italy already reduced 9 months validity ""green pass"", necessary pretty much anything. Michigan get direct flights Johannesburg. You’d connect DC, Atlanta, NYC would anywhere states. Take upvote  Everyone eligible really enthusiastic getting vaccines right? Stop living fear. Get vaccinated go normal life. Meanwhile Ireland can't get PCR test massive demand overwhelmed system Well. they? mean, Trump got blamed Biden said plan. 

So expect side. 

Biden pushing vaccines mandatory fashion new variant occurs drop numbers, side suddenly plan. probably bunch nothing folks looking hope. 

Perhaps push Biden stop CDC FDA playing slow game. could new RNA vaccine month, still going require month trials? guess see, depending real threat Nu is. even math? Exploding means pace infections accelerating rapidly, large number infections. 2800/day 600/day last week.

Doing nothing someone shares information effective nothing one shares information you.

Stunningly stupid statement. guess China shared info, everyone gone day let virus spread everyone infected. Yep. think good news say, slow sequencing process isn’t needed.

I’m still unclear though whether says PCR tests detect infection one PCR test also tell infection due variant, PCR tests detect infection due variant. think it’s former.  said there. selective pressure comes response it. Essentially likelihood deathly sick person nastier variant spreads others goes awareness safety measures. ""sneakier"" cases minimal damage remain active enough spread.

But depends global efforts. vaccinated conservatives enjoy luxury.

Unvaccinated conservatives next November probably much anything ground.  Sounds like someone supports Brandon 🤪  seem though understood thesis post impossible data now

Would advise take look front page every news site world right lol... Quick, what's percentage vaxxed vs unvaxxed there. Without that, give fuck. like 10 1 unvaxxed. 

Let rot. happens don’t abide lockdown?

Cases get control hundreds thousands people die virus. (Not government lol) great hear, find this? something HIV, really.  


It survived someones body long enough able mutate several times. able person immunocompromised. 


It could happened someone Lupus, make airborne lupus mean first case Omicron Prime Wow, pretty far past Delta old Greek Alphabet... like ""Delta"" ""Nu"" variants named Greek letters. dropped, stopped. still 4.5k YTD, seems like dropping unless something new comes out. market spook suppose? don’t want live planet anymore  immediately? No, let’s give everyone days panic travel get patient zeros chance return home…  You’re right unfortunately people desensitized point they’re willing risk lives we’re going lose. Yes, good news purpose detection. Alpha variant property. Labs use particular type PCR test (which widely used) make distinction Alpha/Omicron variants time determine whether test positive. That's means it'll much faster easier track thing. Right now, followup sequencing probably still needs done, Alpha might still around small numbers. Omicron gains foothold, one start assume tests exhibit gene target failure Omicron.  Indeed right that, risky behavior people still get shots.

But foolish think vaccines alone would prevent new strain spreading.  still don’t understand. intent affect findings? I’m actively looking new variants I’m testing everyone. new variant find nothing. half population new variant find that. Forget Nu, happened Omega? vote calling Dirk. declared Omicron 2 hours ago. Prior that, *assumed* Nu everyone else. would afraid called Omega mention collapse health care caused high cases burnout.  problem steadily solving itself. Next variant list: COVID-19 Mega-destructotron variant. proves need send vaccines developing countries.  u fking mate ELI5? I’m praying version transmissible less dangerous. screwed. Even Delta evade vaccines anywhere near rate media makes seem. absurdly contagious unvacinated individuals.

SA 21% vaxed, really way know. ""The Omicron Variant"" sounds way much like title paperback thriller buy airport. fucks sake. scientist woman comment nonsensical. whole lot. reason concern transmissibility vaccine efficacy due mutated strain (30 mutated spike proteins, vs. Delta's 17). fucking magic bullet. Half people ventilators die. 'enough beds ventilators' solution. wish anyone end ICU covid, matter full half empty ICU. daughter got delta 10 days exposed nothin vaccination status. first four infected Botswana fully vaccinated: 

“The variant also identified Botswana. country’s health ministry confirmed statement four cases new variant detected people fully vaccinated. four tested planned travel.” (Source: New York Times) Source happen. ""Right now, talking sort like red flag might issue, know.""

What? Nice analogy! even vaccines effective variant variant still infects humans, believe would possible variant less deadly. 

Honestly, COVID mutates avoid vaccines ends roughly bad common cold, I'd fine that. I'd get vaccine variant available though would like get sick.  That’s citizenship works. Well BJ want trip India......... Hongkong one came Canada. Well I'm screwed lmao Lrrr, omicron variant. skipped Nu probably avoid confusion ""new"". also skipped Xi. guess why. far phizer looks really good   havent SA wouldnt say thay enough vaccines. true though lot anti-vax sentiment. US result &lt;30% vaccination? Im sure  Thank service! Yes agree. mean use word fear something said read/hear almost daily different platforms. Sorry - mean that! 

Weigh risks/benefits, take precautions keep facts.

That do.

Good luck you. Hope get Colorado. love there! anyone think new variant resistant vaccines countries would actually go full lockdown again? honestly don’t see happening… least USA. No, are!  No, 1.5% Portuguese adults haven’t covid vaccine. Ireland 7%.
 
Maybe difference Portugal considered people prior covid infection last 6 months “fully vaccinated” one dose?
  gonna okay, friend? Sending virtual warm blanket cup tea internet. feel coming from. pandemic hard brains wired handle ongoing stress long. Bloom lab great, Dr. Bieniasz. 

Hope best prepare worst. Hate challenge worldview, but, “uhm”, see sentences New York Times article -

The variant also identified Botswana. country’s health ministry confirmed statement four cases new variant detected people fully vaccinated. four tested planned travel. summary: amazingly effective. doubt has. “Exploding”? US currently 28 times cases per capita 4x high positivity South Africa 

There’s already least one case Belgium linked counties list, plus 2 Israel 

Containment futile situation, travel bans disincentivize counties sharing info outbreaks general, makes likely something contained isn’t it’s kept hidden fear reprisal Beats substituting wishes opinions data. sources like: 

- Daniel Griffon Friday episoldes Week Virology (twiv) always good. look forward he’ll say he’s working today.

- think r/COVID19 really good. Chatter days still comments content-full. 

- Dr Topol Scripts. twitter feed like curated annotated r/COVID19.

- Dr. Fiegle-Ding bit emotional also sifts explains latest research.

- Dr Wachter UCSF solid too, rarely adds sources say. Ok excellent analogy. vaccines come here? One fav Metallica songs. # would way less critical vaccinated. take basic precaution wanted travel another continent pandemic... mean, cares society Lol what? That's dumb age good. Go /r/nursing, there's lot people second third careers. Almost key word.....especially viruses similar C19. mean, shut literally everything immediately locked everyone homes, we'd done COVID month. However, would cause many issues would potentially much devastating COVID, including things already affected COVID like supply chain. Hard feel optimistic much moment. behavior collectively going change much (collectively) learning lessons, really even are, enough people effectively pro-virus can't shut door. 

Pretty much hope 'weaker' variant, maybe communicable less damage. vote reddit gives nickname ""Lrrr"" would make first case Omicron Prime fact allowed travel internationally.

Ohh true dat. WTF doing? unvaxxed, get travel (with exceptions course) considering many lives putting risk Yeah found first case country followed path person met past days case still chance prevent spreading. Meanwhile borders open turns later people died country month first case detected Well easy. go indoor places unmasked people. Lrrr, ruler planet Omicron Persei 8! Whelp standard operating procedures many countries around world. Hell, Japan lowered recently 6 days vaccinated travelers recently. 

Its maybe, maybe, traveling global health crisis encouraged first place. Link? One Belgium confirmed. Unvaccinated 30yo coming back trip Egypt.  Can't trial administering medications, possible? would reduce chances virus making strains would make medications ineffective.  Egyptian doctor would dance street ever hit 40% vaccination rate mark :( Yes probably elderly people children planes. Yeah, get fuck outta already appointment booster booked next Friday really hope variant isn’t bad sounds boosted antibodies level able stop/reduce it.

But I’m worried even bypass antibodies assume booster also boost t/b-cell response aren’t fooled variants. Ah understand now. apologize misinterpreted you. lot people right overreacting bit trying say permanent travel restrictions etc straight dystopian horror movie. get little hot headed people say destroys public trust public health. misinterpreted saying definitely apologize! right, lot good places US Canada worth visiting. song never ends 
It goes 'round 'round, friends 
Some people started singing 
Not knowing 
And continue singing forever because... that's guaranteed, current vaccines still need tested new Ask doctor Noble Eightfold Path right you! Actually they're supposedly asymptomatic problem partially-effective vaccines. known scientifically long million mutation. need 1 mutate right direction fuck rhe entirety humanity. 

Guess what, covid enough space mutate millions times want sell newspapers, isn't. New Zealand 42 deaths total . Alabama. (with similar population ) 16000


A complete total failure indeed unvaccinated person allowed enter country without pcr quarantine? Right fully vaxxed people protecting 40% catching Delta variant offer good protection hospitalization. still catch spread disease. vaccine without masks social distancing like wearing seatbelt airbag. discover variety it’s always everywhere Tell people saying game over, doomed. “Adolescents might need boosters point, ""it less likely will, healthy, strapping teenagers much better stronger immune response elderly person. gulp say elderly truth,"" Dr. Anthony Fauci, director National Institutes Allergy Infectious Diseases, told CNN's John Berman Wednesday 


I’m elderly immune compromised fuck would need booster? mouth.  vaccine-evading variant ever comes around actually likely emerge highly vaccinated countries

Countries low vaccination rates eventually high rates natural immunity (or may high rates already, probably case SA). create similar pressures evade antibodies, since cases higher, there'll opportunities mutation. Evolutionary fitness reproduction. Period. Faster cheetahs, smarter apes, cuter dogs fit kids, average. Evolution, things equal, favor genetic variants tend lead offspring, period. talk levels selection (my favorite field) bio 101 that’s pretty much worry about.

With viruses, you’re looking easily spreads. virus quickly incapacitating less likely spread, things equal, infected person usually become less likely interactions people. However, factors lead infectiousness (how easy given exposure cause infection) independent quickly kills you. turn lethality infectiousness, end either cancelling (same level spread) even disease deadly contagious.

It definitely lead astray take general rule thumb like “less deadly viruses spread equally” interpret kind universal law. I'm understanding saying correctly unvaccinated people could really screwed variant. Correction: change tackle covid.

Because know deal it, us simply decide to.

Say goodbye illusion humans ""rational animals"". Sure. I’m saying people shouldn’t travel internationally. want to, go it. It’s longer priority me. US blessed lot amazing, diverse, beautiful places. really want see places Canada. important fact *appears now* put competing delta Nu strain, right still mostly unvaxxed people hospital, might bode well vaccine's protection. Travel restrictions never really worked well anyway. lockdowns effective. first story saw said determined yet current vaccines effective.. So, know easy start worrying worst case scenarios.. one travelling countries pandemic. get need move food/goods it. Everyone else (politicians, business, family) use video/phone calls.  invent new process coat plastic vials thin layer glass using sputtering technique. think that's much concern time around. says words “evidence based “ y’all swoon. he’ll send emails private masks don’t really work…but public insists do. happened wearing double masks ? Vix levels twice already year. Bet can’t guess times It'd still better virus could walk around even longer 2 weeks infecting people. New variant, Tiger King 2 out, feels like Groundhog day... Belgian person unvaccinated flu symptoms reflect vaccinated audience gets pandemic news YouTube going skew far toward conspiratorial read/watch/listen traditional media. uncertainty. We'll know soon turn another boring grind. also said delta variant and, oops, one disappear. lived world took pandemics disease transmission half-seriously decades leading this

Not true, least US presidents parties putting together measures place act accordingly scenario deadly pandemic may happen. perfect storm happened inept self-centered president US history. rest world, efforts prevent control pandemics partnership WHO.

That said, guarantees life, even best efforts can't guarantee see deadly pandemic spread. Remember according laws statistics simulation, small chance something may happen, happen given ample time. US also done 40 times many tests. test positivity rate South Africa twice high US.

Comparing cases rich countries (with vast resources) cases poorer countries (where mass testing possible) best ignorant worst disingenuous.  Yes. worse worser goes. understanding Delta, contagious variant, outcompeted others essentially took dominant variant. Proceed like normal would guess. think humanity dumb uncoordinated. Imagine there's team ""pro-COVID"" wants spread virus much possible. Keep international travel? Check. border restrictions? Check. entry quarantine requirements? Check. vaccine mandates? Check.

Virus give shit freedoms. Clinical trials shown vaccines offer less protection Beta variant. Genetic sequencing suggests new variant shares immunity evasion mutation. similar concern Mu variant; also similar vaccine-resistant mutation.

The question whether new variant becomes globally dominant outcompete Delta strain. reason simple - barely 2 days since variant became talk internet, so, almost anything else answer - one knows yet competition. Oh didn’t know? Fauci reevaluating “fully vaccinated” considered. can. read today changes like mRNA vaccines would require regulatory reapproval would take max 6 weeks. sure long production changes would take auntie evolves balls she’ll become uncle. Also wrong. transmitted droplets  Yep Guaranteed already undercook turkey? Right jail, right away. Mexico use four color alert system: Green, Yellow, Orange, Red. 

The time pandemic passed green right midterm elections.

Before big festivity (Christmas, St. Valentine's, Independence Day, Mother's Day) took color. 

They refused move system red even numbers said should, moving instead ""Orange Maximum Alert"". 

It ridiculously obvious doing, yet lots people bought it. Delta new variant, *was* objectively contagious. Sometimes new variants fizzle sometimes don't. hoped lockdown would enough. 

I hoped getting vaccinated would enough. 

Hope pandemic done nothing ; allow leaders control us before.  Laugh mock want; guys one saying get vaccinated all
Go away. listened. Maybe it’s time guys listen too? mean I'm really trying negative think that's true al.

If live US suspect live somewhere west coast liberal city think that's going.


