,date,text
No one could sure production producing commercial scale would quite recent Arizona Mississippi done worse states except NE hit hard early course they'd among first drop mask mandates. get it. We've learned nothing.  Rich people willingly go poor neighborhoods pharmaceutical products 🤷‍♂️ Blocking exports company blantantly disregards EU orders yet fulfills every one EU production facilities logical. would bans kept word least let failures effect anyone proportionately, EU. make money, example made contracts South Africa almost twice price EU.  good article reasonable scatterbrained hell-for-leather capitalist wet dream.  want get political, administration made huge deal COVID plan put day inauguration. guidance pretty gaping hole plan like that.

And honestly, reason done lack time - wanting define success. That's true - due 2 reasons. There's higher chance complications vaccine older people actually catching covid moment. second they're going ""stop spread"" approach older people less likely catch spread it. issue wanting use elliptical. Even so, matter issues are. unsure process capacity go sell figured running. best incompetent management. think real problem authority figures acknowledging. Americans almost faith government institutions. People blame misinformation it, help, people willing trust misinformation government health organizations regularly, unapologetically admit blatantly lying important issues perceive greater good.

It's okay, keeps getting worse. government keeps complaining people trust them, they're comfortable blaming anyone world themselves. Eventually someone honest going gain position authority really crack nonsense admit long legacy self proclaimed ""white lies"" public health, we're going get people trust modern medicine. period blindness eyes worked process info. Like could see girlfriend know looking person.

I stopped cycling driving two months. Luckily work home drive.

Also times would go catatonic stare 5-10 minutes move.

Took 4 months went away. Honestly thought would go disability. absolutely way brazilian statistics reliable french swiss data. 

Furthermore, comparing European countries different demographic profile. average european covid victim, 80+ year old man, type person barely exists Brazil. People dying Brazil relatively younger, possibly healthcare bad quality.  source? “one reputable public health bodies world wrong”. Got it. 

As far papers, isn’t like masks new idea. It’s studied many times, community use non-medical, reusable masks doesn’t value. changed thinking China able stop Covid tracks happen wear masks. that’s it, happen wear masks. also quarantine entire cities army send 1st, 2nd 3rd level contacts positive Covid case quarantine hospitals, non optional compliance. That’s pretty much extent evidence masks - correlation along much effective, expensive authoritarian measures. value use them. absolutely want go back normal except one thing. hope stigma masks remains dead. covid, stepping bank mask recipe disaster. Wearing masks plane garnered angry looks. 

I've sick year, previously always sick flu colds winter long. Much due traveling. Pre-covid, overseas least 2x month, plane least 4x week. life returns ""normal"" I'll continue wearing masks close proximity crowds (airports/planes). even shipped one vaccine yourselves, about! least we've tried share supply others. Leave mainstream media somehow portray greatest large-scale medical success achieved centuries ... negatively.

I mean success sure think eradication polio would ""greatest large-scale medical success"". EU produce export vaccines. Companies factories within EU member states use produce export vaccines. Seems lot EU residents falling EU press office line others thinking clearly.    Outside heavy squat deadlift, exercise home, next couch. people shitty knees 400lb squat deadlift. Blocking exports company blantantly disregards EU orders yet fulfills every one EU production facilities logical. would bans kept word least let failures effect anyone proportionately, EU. citation comment less deadly kids? (Sincere question, dont mean sound like dick) came mention Ireland repaying Native Americans 10,000-fold  O:-) one favorite news stories recent years, much-needed bright spot amid horror show 2020 AZ performing around 30-40% REDUCED delivery Q1 point. care difficulties may be, problem. made promises could keep, hard time believing even process engineers believed could keep. exponentiallity simply true. limited number bioreactors example, limited capacity filtering etc well fill finish. It’s impossible know could end.

The last administration gave whole lot fact free false promises would over. Italy's vaccines produced Italy already sold promised Italy someone else's vaccines. Anglicans think 100% vaccines belong them, made USA UK made outside USA UK, one else needs accept bullshit. 

YOU FUCKS EXPORT NOTHING TRY PAINT BIGGEST EXPORTERS VILLAINS. exponential build production, means start difficult see taking schedule since behind weeks result massive differences outcome.  still sure think UK export ban. AZ decide export doses UK provided UK stipulated number doses UK government would able take court beach contract, legal way export could blocked (unlike EU)

Ah yeah, free export whatever want, ""just"" break government contract. powerless UK government one choice, send intern file complaint local police station wait trial. excuse, shortages over, UK recieved lot fewer doses AZ Pfizer initially promised, notice UK demanding EU make shortfall Pfizer vaccine despite work EU plants main cause shortfall

You still get it. one single approved vaccine UK producing UK, that's AZ one. one, export ban get 100M doses. single one left UK, single one reach milestone. export ban.

Meanwhile EU exporting every corner world AZ Pfizer vaccines ban. Including fucking UK received millions Pfizer doses EU production sites.

So yeah, complain keep everything themselves, would complain production sites, company send anywhere? know. Maybe I'm weird, given point return complete normal, really bother concrete plan.

Like, come May vaccinations easy get, going happen quick enough. think run far higher risk pressure cut restrictions early rather keeping around long.

It probably helps school aged children yet. I'm working service industry, think bunch metrics things go back normal would really change stress levels single parent waiting tables struggling make month month right now. Competent leadership important unsure that. read something suggests true, I'd love give look.  think you’ll see red states restrictions mid april, “moderate” blue states mid may, bluest states like CA June most. well said. think people (me included) desperate (rightfully so) get back pre-pandemic normal can’t see happening. permanent changes pandemic. positive, take getting used to. deaths really start dropping think celebrate   Idk ends justify means that's moral question can't answer.  statistical result favors US give result similar since Covid deaths skewed towards US. Like this; Almost 90% Covid deaths happening countries high wealth rates. better; Almost 90% Covid deaths happening countries high  wealth inequality. thinking states like alaska smaller population killing vaccine rollout. Eventually won’t need vaccine shipments go elsewhere guess concern back thought would July shots opened thinking that. entirely depends ask. would say already can, say pandemic made realize large crowds inherently dangerous matter what. asking whether expect you, presumably younger American adult, peers able get vaccines summer almost certainly prevent severe symptoms transmission- would say answer very, likely ""Yes.""    even need pair sneakers, little active. would testing waters see get away with? Like 90% people Australia live one three cities stealing. never Australia's begin with. may placed order, sometimes orders get canceled postponed. I'm sure contract deals eventuality. 

Maybe offer insight consider theft. Yeah stupid idiots wearing masks mandate, mandate, mouth breathing inbred trashcans people won’t wearing masks anymore Gyms can’t fix bad diet. higher income can’t stop bad spending habits. can't say, commercial scale process could simply less productive, could caused multitude technical challenges management related.

I agree incompetence bioprocess team could something intrinsic process can't fixed technical hurdle encounter. literal Silicon Valley, Volunteer Contact Tracer County. seen heard first hand. Testing bit way, lot walk testing sites too. straight drop clinics vaccines, many 9am get wristband, come back. seniors always easy, places really meant local neighborhood, meant spread word mouth, local groups, targeting communities hardest hit Covid-19. Particularly Zip Code. 

I also team ""Vaccine Navigators"" help individuals contact Covid-19 past get vaccine already. already vaccinated scheduled heard fair amount ""Oh mess internet"", ""What website again?"" ""I would rather go local walk clinic."". heard barely straight ""No.""s. encountered well though, nitty gritty get vaccine gets muddled long warning question. Particularly one PEG. real reaction people might have, great examples possible things people may allergic past. think way phrased scares people away sometimes. manufacture single 250k dose batch. batches significantly larger. AZ can't gain anything, simply testing waters see get away with. Fauci stepped line said non-medical related things people got mad. keeps line people get mad.

Eventually guidelines like surgeon general's warning. people COVID equivalent smoke, others disregard it. like one understood joke all. Vaccine production like producing tin cans fixed manufacturing capacity. art getting yield right. time reach anticipated production right yield issues, since vaccine exponential build capacity weeks behind schedule means sending small part expected amount. number papers backing mask use homemade otherwise. home made ones varied effectiveness depending construction even small reduction better nothing.
Masks use 100 years used 1918 flu break masks using cloth home made masks.
The ECDC wrong conclude masks don’t work.
Educate people correct construction use masks even people don’t follow rules better mass transmission air borne virus. How's vaccine programme going? Hopefully get vaccines fast dramatically lower deaths hospitlisations. honest, that's definition export ban, think broad lose useful meaning. sense 'export ban', legally bound Volkswagen via contract export car - buying them. required deliver me, (e.g.) pope. car, VW's, want export drive it, guess export ban car remains place. think we're seeing many states lift restrictions ""early."" think bit [Wisdom phenomenon. assume point appropriate lift restrictions mask mandates, recognize United States coalition governments operate deal autonomy, basically inevitable got closer appropriate time reopening, states would preemptively. similarly somewhat inevitable states frustratingly later necessary.

I think we're going see least half states rescind mask mandates remove public health restrictions April. Probably more, say least half. We've already seen five states rescind mask mandates, eleven states without statewide mask mandate, one state already announced they'll dropping April. seen ""floodgate"" reopening yet, feel we're beginning end curve. interesting see who's going first it'll interesting see goes last.  kids serious medical issues die COVID

You know dies Covid well? Adults serious medical conditions. Even better, ending state wide mandate, never state mandate, blocking local mandates, Doctor dad want another source :)

It's SUPER common media strategy clickbait ""no new normal"". author responding that. sort titles make sound like we'll never hug loved one again, that's true. love that, good ❤️ agree! Yeah good point! remember pre-covid going office traveling work (one-foot-in-the-grave) sick seen badge honor...showed motivation. Hopefully culture also over. least anyone kind cold/flu symptoms pressured wear mask. Yeah think points fair. gained 10kg lockdown.

I invested commute time daily excersises listening audiobooks. Effectively reasons though, high5. That's speculative since say ""full vaccine distribution"" means. could mean anything every adult opportunity able schedule shot, could mean waiting everyone state, including children, gotten shot. mind ask still wear mask?

(only reason asking bc know people who've vaccinated / Covid months ago longer wear masks. idk feel about. TECHNICALLY probably okay still feel like wrong?)  I’m gonna continue wear masks even this. didn’t catch flu anything else past year that’s would actually happen mask mandate lifted tomorrow? like Washington ""mask mandate"" places like grocery stores hospitals would place even Governor cancelled mandate tomorrow, they're private property. Media companies disliked that. Hi AZ, system overloaded ship people state, thousands died would've without stressed systems. dude, today, expect tomorrow going forward. trendlines give great deal hope. Thank god I’ve vaccinated 6 months don’t suck Go eat indoors, go back gym local hotsprings. Others things pretty careful. live rural area limited oxygen healthcare options. There's 7 hospital beds county, zero respirators ICU beds, notably great place respitory illnesses. necessarily. depends diligent preparing accounting factors , company experience would reasonably done. diligent would still liable, whether challenges unforeseen would immaterial point. said , get jail free card. Yeah, I'm sure he'll still get shit it. matter guy people made COVID restrictions part personality, whether 100% abiding going them, argue he's handled horribly. 

Could biased he's governor, FWIW think he's one best handling crisis; especially earlier pandemic first close schools, restaurants, even cancelled Arnold single case confirmed here. 50 per 100k cases two weeks good goal; stringent CDC itself. wonder happens Ohio goes back that. read thing done Italy final packaging vaccines made Australia.

Regardless even AZ made deliveries Italy justify Italy stealing vaccines belonging Australia. example, article, posted 40 minutes course vaccinated people would stop following restrictions. exactly point, right? Even ""broke rules"" waiting full vaccination cycle complete, first dose already reduces risk considerably, looking UK's trend infections deaths, exactly problem.

But, course, Guardian always find expert, professor, say horrible scolding tone. understandingly, people increasingly tired tone. might virologists, adults risk assessments. feel tone media politicians though: according them, still March 2020 🤦‍♂️ amazing. course also zombie apocalypses start. (kidding course).

That said... software person, sounds familiar. editing kind ""code"" software genetic, small change lead unpredicted consequences. fear technology simple mistakes could disastrous consequences adequate testing performed.  Oh, ""it"" mean contract government? far know, jabs earmarked come production line. would anyone know jab produced UK meant UK? telling UK imposes everything produced UK must remain contract fulfilled regardless competing contracts place? would amount EXPORT BAN.

Meanwhile, EU implements ban, control requires authorization. case satisfied doses priority backlog owed them. It’s trite. point instantly undermined full mask mandate nothing whether vaccine effective. fact, opposite,"" said. ""Those get vaccinated could still carry virus. puts people vaccinated people remain part vulnerable population risk.""

He's literally saying I'm saying ""full vaccine distribution"" opposed opening right away 15% vaccinated. He's even saying could happen FASTER vaccine shown stop spread. options available already bike. Quality dumb trainers like CycleOps, Kurt, Tacx going cheap CL eBay gearheads upgrading interactive trainers. Mount bike trainer get whatever kind workout want. Zero effort sprint intervals. Yep, unused vaccine (distributed, administered) hovering around 20M doses since early January. past week, jumped 23M 27M today.

This representation delay distribution administration. appears 1 week. Namely, started seeing increase distribution 2 weeks ago increase administration 1 week ago.

We see first 3M administered day hopefully next days reporting (which delayed 2-3 days). Things speeding quickly! pretend half million+ deaths happen. massive spikes exactly epidemiologists called it. None happen real.

/S

You may sick hearing it, lot people got actually sick, suck up. half summer?? macron pitiful leader Governors coming woodwork definitive plans finally! Feels like there’s new one every day current vaccines fine variants. 

Even trivial figure variation vaccine. coronavirus, cancer. reality almost everyone ignores health advice almost time.

If not, would never eat burger, drink beer anything fun.  death cult mantra. It's...the incubation period virus. expect people refer span time relevance?  message obviously “keep getting vaccines open up”.

Fauci/Biden’s message “vaccination let live less differently before” tells someone like (a person lowest risk COVID) nothing would change, bother?

We can’t stay locked forever. can’t stay 25-50% capacity forever. Sooner later things open back up, best way threatened COVID vaccinated vaccine production continues ramp up. painting AZ free choice export product put sale, doses already ordered, payed, contractual delivery schedule flicking middle finger to.

They want production surplus owed EU, long they're producing owe EU within EU, see difference vaccines US. fact, US morally way worse unmet contractual quota, blanketly prohibit exports matter much produced... Yeah let leave asked prior reactions vaccines. Good luck. I’m going get vaccinated. Screw locked forever. Charlie Baker, Governor Massachusetts, [yesterday mask mandate nothing whether vaccine effective. fact, opposite. OP yes want make sure immediate (I assume allergic) reaction it. high-risk mom got yesterday (hooray!) wait 10 minutes leaving last pre-covid trip cinema good friend watch Onward, really hope go back! shit job exposing anything ignorance trolling ability. Blocked, go take verbal dump somewhere else. color like yellow Orange.

so... worried time? (I mean know parents anyway ... mean specifically ""worried rdmc23 could get hit terrorists"") 3 Wyomings day 60. reactions describing happening people 50. many foreigners understand Australia Australian population highly concentrated major cities (and come look population density whole continent).

For example, Sydney (5.23M) Melbourne (4.94M) would third fourth biggest cities Europe located there, behind Istanbul London ahead Berlin. People saying wait two weeks Florida since September. expect governor clue virus worked. Except arguing one. one saying can't go back normal full vaccine distribution. Pretending enemy exist pubs like best. What's important percentage. getting much larger percentage us. AZ honest would delay deliveries equally. know saw article state officials said using much percentage supply future shipments could cut sure something they'll actually empty threat get states moving. pretty job someone's got it. think people lost perspective. Whether cases go back again, still unacceptable level new cases deaths, worse points last summer. need give push vaccinations social distancing. Yup, that's straw-man lot people creating. saying ""we can't live like forever."" Well shit, month grey zone everyone chance vaccinated?  initial start plants produce small fraction can. Production increases exponentially reach capacity technical challenge reasonably predicted prepared best effort protects it?

The EU released AZ contract, says point correct section then? would honestly okay kept masks tactic spread/catch diseases.  Cases even testing went *chefs kiss* I'm expose

Hahahahahahahahaahhaah 

Oh boy, another YuRoPeAn keyboard warrior eXpOSiNg people  arithmetic thing.

According Bloomberg tracker, stats Netherlands:

Total doses given: 1,011,426

Doses per 100 people: 5.87

Daily rate doses administered: 20,120

The Netherlands population 17.28 million.

Jabbing rate 20,120 day take (17,280,000 - 1,011,426)/20120 = 808 days. 2.2 years. one dose per person.

In order achieve end June (ie. 4 months), need jab rate 135,571 day tomorrow. words, increase rate jabbing factor nearly seven *starting tommorow*. two doses per person June, need jab rate 270,000 day. fourteen fold increase now.

The longer leave it, need day catch up. evidence Netherlands useless can't 20,000 day, able dial jabbing hit target. They'll still locked winter 2021.  Good Italy. Australia struggling virus much wait turn. homemade mask homemade vaccine? Double protection. Interesting. TX? live really conservative state Target really well. Costco exceptional, checkers line even would correct people wearing masks properly hope sick people wear face masks, plague, mine keeping face warm winter maybe bad pollen days post appears vaccines, please see [our answers frequently asked questions regarding COVID-19 vaccines. comment containing misinformation removed user potentially banned.


*I bot, action performed automatically. Please [contact moderators subreddit](/message/compose/?to=/r/Coronavirus) questions concerns.* people realize first pandemic? read really anything (respectable) 1918 flu. could simply accepted EMA recommendation made 29 January. Five weeks wasted needless posturing. ""best efforts"" mean ""we best can"" , mean second best effort, mean average effort. Courts gone far even require contractor perform actions interest signed ""best efforts"" contract, precisely mean second best effort. get jail free card. understand perfectly one vaccine produced UK, export ban. contract UK AZ people seem mistaking export ban, people appears since imposition export controls EU attempt convince EU good guys imposing controls siezing shipments big bad British give vaccines EU demanded UK Contract AZ. refused allow AZ give vaccines meant UK EU. EXPORT BAN. 

The EU contract AZ. refuses allow AZ give vaccines meant EU Australia. 

Where difference? Fill finish often done contract manufacturers.  post appears vaccines, please see [our answers frequently asked questions regarding COVID-19 vaccines. comment containing misinformation removed user potentially banned.


*I bot, action performed automatically. Please [contact moderators subreddit](/message/compose/?to=/r/Coronavirus) questions concerns.* never dropped green blue, guess b/c want foster complacency

I think become accustomed world live in. past, believe future, unthinkable kind stuff happen. wish I'd go away. I'm expose BS comes keyboard.  guess need preface saying wear mask everywhere required right masking, soon longer required wearing it.

The biggest reasons looking forward lifting mask mandates are: 1) able see facial expressions people conversations leads feeling connected others feeling isolated times, 2) hearing greatest able see mouths move people talk coupled mask muffling voices leads efficient conversations, 3) keeps fogging glasses even masks pinch nose, 4) breathing feel restricted times wearing long, 5) another thing carry won't.

I think even mask mandates lifted, plenty people continue wear feel comfortable, point think risk infection fatality gets small percentage effectively 0 required. Maybe milestone marker could used likelihood dying COVID matches common flu living like before. I'm sure percentage population would need vaccinated happen, least data point try get people fine taking chance before. criteria make sense end certain mandates compared ""it feels like right time"". 1b. Project soft power overseas offering trusted, FDA-approved vaccine inducement/carrot negotiations parties developing world, hedge practice currently employed China Russia. total cost far less new aircraft carrier. Newly installed Italian Prime Minister Mario Draghi criticised export vaccines recent meeting EU leaders late January.

However, millions AstraZeneca doses put storage across Europe citizens refusing take them.

Italy received 1.5 million doses AstraZeneca jab administered 350,000.

French President Emmanuel Macron falsely called “quasi ineffective” elderly, comment widely seen caused huge damage crucial public confidence jabs.

A string nations Europe earlier year said vaccine given 65s, citing lack trial data. However, reversing decision given vaccine proving hugely successful Britain. feels like there's lot people talk like that, reality tiny minority. Soon kinds opinions swept aside irrelevance go back normal vengeance. Reddit said small, isolated islands like NZ appropriate reopening model U.S. /s Ya well terminated, using/accessing government systems. knows supposed using even though still it.

On top this, know think Florida lying COVID data. CDC's projections data Florida independent sources universities tracking using approved hospital data.

Even Florida's data well actual, 48+ independent sources tracking CDC who's variations data within standard deviation. posed question (""what makes think didn't"") posed question back. could also posted information instead asking rhetorical questions, riding ass.

Go away troll. guess really hate walking outside, want elliptical (I used like that) kinda SOL. learn suck up, realize want needs different things started finding ways.

For example, bought used folding therapeutic bike CL $70 last summer. elliptical still mindless cardio watching netflix hour. Put 1500 miles bike tensioner inside bike slipped destroyed bike trying fix it. Totally. I'm ill future still healthy enough work/travel, wear mask protect around me. might also wear one I'm going event know others ill.

