,date,text
Another thing vaccination went fairly good, country surpassed US first doses close full vaccination. Even conservative people ended mostly taking end.  ""The findings report subject least seven limitations. First, although analysis designed compare two groups different sources immunity, patients might misclassified. SARS-CoV-2 testing occurred outside network partners’ medical facilities vaccinated persons less likely seek testing, positive SARS-CoV-2 test results might missed thus patients classified vaccinated previously uninfected might also infected. addition, despite high specificity COVID-19 vaccination status data sources, misclassification possible. Second, aOR could stratified time since infection vaccination sparse data limited ability control residual confounding could magnified within shorter intervals. aOR adjust time might also subject residual confounding, particularly related waning types immunity. Third, selection bias might possible vaccination status influences likelihood testing previous infection influences likelihood vaccination. Previous work VISION network identify systematic bias testing vaccination status, based data May 2021 (1). Fourth, residual confounding might exist study measure adjust behavioral differences comparison groups could modify risk outcome. Fifth, results might generalizable nonhospitalized patients different access medical care different health care–seeking behaviors, particularly outside nine states covered. Sixth, statistical model incorporated use weighted propensity score method subject biases estimates standard errors propensity score model misspecified. Numerous techniques used reduce potential suboptimal specification model, including limited including large set covariates machine learning estimation propensity scores, including covariates regression propensity models, ensuring large sample sizes checking stability weights, conducting secondary analyses assess robustness results. Finally, study assessed COVID-19 mRNA vaccines only; findings generalized Janssen vaccine.""  point really ought lose parenthood license. important point there. post appears vaccines. encourage read helpful resources COVID-19 vaccines:
  
[Vaccine FAQ Part FAQ Part appointment bot, action performed automatically. Please [contact moderators subreddit](/message/compose/?to=/r/Coronavirus) questions concerns.* movie title gave idea. former smoker, I'm betting 1 *especially* 2. can't smoke work, buy less cigarettes home chain smoke day want. surprising all. India fewer restrictions, delta variant. +cuz Covid-19 bad health There's way would able hide highest death toll. CCP omnipotent.  Job openings, yes. Actually hiring positions? always clear... One elderly family friend kept saying hoax dying breath. funeral people mask socially distance even though full retired people. refused go dad went think COVID big deal.. Byeeee Fucking Luxembourg. Wuhan much, much stricter restrictions. like war. say 75 million people died WW2 directly affected it, possibly murdered armament. 

However, many killed affects war? many starved, many left without parents, without husband provided home? many died hospitals available, doctors, on. 

The long lasting effects huge, Covid. many people died mental state went shit? many died die Covid hit health? father battling covid winning it, heart attack week later put stent artery near heart. health forever affected might die younger would think it.  

And worst COULD done better greed incompetence leaders. dealt horribly this, specially conservative ones, denying everything recommended health organization specialists. Shit show. never forgive give vote happen case need. wish see ignorant comments actions anti vaxxers anti maskers covid existing ""that bad"". can't imagine fury must feel faced shit top losses. shocking seeing little people care others. China definitely underreported (as every country) numbers likely still low. get crazy mass death without mass hospitalization, that's impossible hide. CCP omnipotent, would able keep something like wraps. there's question strictest restrictions world. COVID-19–like illness hospitalizations among adults aged ≥18 years whose previous infection vaccination occurred 90–179 days earlier, adjusted odds laboratory-confirmed COVID-19 among unvaccinated adults previous SARS-CoV-2 infection 5.49-fold higher odds among fully vaccinated recipients mRNA COVID-19 vaccine previous documented infection (95% confidence interval = 2.75–10.99).

English: mRNA COVID-19 vaccines 5.49 times effective preventing infection natural immunity. New Zealand perspective, like 5 million people. remember thinking knew everything right everything, too. time move past phase. accepted reality decade ago. “odds laboratory-confirmed COVID-19 among unvaccinated adults previous SARS-CoV-2 infection 5.49-fold higher odds among fully vaccinated” precise, 5 million New Zealands   Russia known hide Covid deaths. lots articles this. India poor test everyone. Brazil dealing incompetent corrupt   rational person 

I appreciate kind words, let's go far lol Replace ""vaccines"" ""seatbelts"" 'Drinking driving' might accurate. ""Plead freedom!"" Oh, please. 2056: Time everyone get 85th booster  someone share high quality information rate false positives PCR rapid tests? need decide test select entry UK. dealt false positives leaving Peru rapid tests, want repeat experience. However, would like real specificity data PCR rapid tests make educated decision. sources found Google searches would give actual number. Boosters? Sure, problem. Work home norm? Sure, option, vaccinated people option work person...I know personally strongly prefer it. Masks public case rates high? ideal world, sure, think cases high(ish) low, many people want wear masks long term.

Rethinking large group events? Fuck no, I'm sorry. One reasons get shots go back large group events fun. Getting back CFB games, big gatherings, hockey games, concerts, etc. amazing, I'm gonna pissed ever go ""new normal"". require vaccines, let's big events again. looking specific county data?  Let’s hope demographic remains permanently unemployed. hope so. found weird left article. They're curing covid, look dipshits taking horse dewormer. vaccine villain. Interestingly, know long-term effects Covid vaccine, *do* know something Covid--we know people sick quality life issues time. know develop scarring organ damage, kidney problems. know neurological problems. know they'll still issues 10 years, know least now.

Whereas know people who've vaccine *no* issues right now. Assuming experience life-threatening allergic reaction shot, they're fine.

So choice ""illness possible short-term substantial effects possible death long-term effects"" ""less likely develop illness effects beyond short-term injection reactions"". I'm betting man (or man all), were, know I'd putting chips.  thing commonly say fight court want. 

When unions get big NYPD’s you’re going literally viewpoints represented. case vaccinated members really dog fight. unions hearing anti vax folks. I’m ok advocating members since paid do. right outcome imho.  not? It'll local regional issue first. areas worse others, though that's true while. Gotcha.. think came took families’ doctors’ nurses statements left. doubt trooper wanted all. Generally hospitals law enforcement positive working relationships. True, nuclear bomb arguments. Sure might end it, fucks lot things time. bit surprised  .. people complain till end .. 

if dont care people really dont give shot post appears vaccines. encourage read helpful resources COVID-19 vaccines:
  
[Vaccine FAQ Part FAQ Part appointment bot, action performed automatically. Please [contact moderators subreddit](/message/compose/?to=/r/Coronavirus) questions concerns.* Fantastic, please stay away me. also know possibly fatal short term side effects Covid. starting get colder people go inside, holidays coming up, we'll see proactive first wave vaccinated booster.

I need look trending point last year. I'm hopeful, cautious optimism best route. see least it’s mainly Rocky Mountains PNW bad numbers   You’re definitely first line! 12 year old vaccinated 8 months due trial.  literally done nothing misrepresent everything I've said throughout entire exchange going nowhere.   work company handles major government contracts, try submit fake card feel sorry raised stupid. It’s accurate. Florida currently lowest infection rate country. restrictions Covid burned via Delta left bunch dead behind. 20th population. winter wave came much earlier last year rest country. Parts country decided mitigate block delta wave instead suffer catastrophic deaths, parts mitigation. parts still work do. post appears vaccines. encourage read helpful resources COVID-19 vaccines:
  
[Vaccine FAQ Part FAQ Part appointment bot, action performed automatically. Please [contact moderators subreddit](/message/compose/?to=/r/Coronavirus) questions concerns.* May intentionally clickbaity. pervasive belief pediatric vaccines ""less necessary"" children at-risk.  WTF, read OP article?

And google 'Protestors Blocking Traffic' 'Protestors arrested'

Being pedantic look good Well, put shoes. would view gambling child’s health sake maybe potentially preventing stranger getting sick. 

I understand sides wish people would stop trying antagonize people based don’t trust putting bodies. dude, it’s over, wise get it.  putting words mouth. NEVER said long covid big deal. said precedent post viral illnesses thing. contrary, long covid research we'll able treat effectively. Christ irony talk back Prozac crowd starts using instead vaccination.   quite understand rolling eyes supposed life partner fucking gullible nutjob.  Colorado one small state fuck? SSRI BP person like gas fire. wait March 25th get 4th one, needed, I'll certainly get it! would fill last slot vaccine card. put 30 yrs. ""I demand morphine pump!""

""Sir, Wendy's"" long give care anymore, huh?

Colorado's cases rising 25% week &lt;200 ICU beds left. Unless vaccination rate rises dramatically 5-11s third doses going months over. Toodles may level soon, bets half-term – NHS faces winter crisis regardless

Decent summary article header Got ya. Sad never got try one. live wasn’t another PICU within 1000 miles? patient needs leave hospital AMA take whatever little heart desires meant confrontation officer hospital. 3 year old CCHS. soon Delta variant confirmed US, put away cloth masks house. 

If we’re indoors, one family wears anything less KF94 KN95. also N95s adults, can’t find small enough fit daughter. Yes. East Coast cities mainly still masks. 

Where live it’s optional technically probably 95% adherence public indoor spaces. There's probably high correlation active covid cases strain medical resources. I'd less living pre-covid medical resources stretched, that's pretty much Delta surge. Problem mask mandates dropping. Well hasn’t yet. state legislature investigating overreach AG. (They staunch republicans se goes). special council nothing happened yet. 

The hospital sent notice staff basically saying shouldnt talk media without PR person right harassed/threatened etc. basically encouraged call security sign issue, hang heckled phone etc. report incidents. Keep mind countrymen taking jab would rather *opposite* hated mistrusted leader would tell do. Yeah, that's kinda joke did, know it. weird ax grind comments bad faith. Enough. teens kids’ school around ~75% vaccinated (same county numbers) according school nurse. personal guess 5-12 slightly less that… maybe mid 60’s. 

My youngest 2nd grader &amp; don’t personally know single parent isn’t dying get kids vaxed. know speaks “bubble,” still… feel slight optimism. Getting 5-12 vaxed surely help. Or… fire them. So....acknowledging connection long covid CFS = Downplaying

Whatever man 1 26,315

As getting myocarditis covid itself, study found puts 1 2,222. 

So ignore risks COVID look myocarditis, COVID 13x dangerous. (Of course countless problems COVID cause addition this, additional vaccination side effects concern)  Pharmaceutical-grade cocaine 👍  city plans deal problems. need everyone deals public vaccinated. can’t handle another large outbreak heading winter

It’s also odd COVID number 1 killer police officers. vaccinated families. It’s interesting see propaganda turn them. How’s Iran pandemic? live sticks I'm used arriving timely fashion I've planned accordingly. Florida says "" Hold beer. get number back up"" operative words ""insufficient start infection"". That's scenario. immunity (from real infection) last long coronaviruses general.

This true, would expect waning antibody levels happen either natural vaccination immunity. However, there's still strong memory cell presence coronaviruses. issue coronaviruses flu viruses infect relatively quickly (2-4 days average) memory cell response play catchup, overall odds getting severe disease drop dramatically still memory immunity. It'll get top infection much faster.  5% 20% 1%. Move decimal places apply discount self-reported bullshit right track.  fat burger longer really around. idea source correct. Obviously hope is. end-of-2021 projections keep going even seem keep getting reach, though.

But even 1.6 billion doses month lot. That's first dose everyone Africa within month, governments willing pay them.

And undeniable reported daily/weekly doses instead dropping. bad part, whether first third doses give need keep used. Define 'Often'

And evidence occurred mask vaccine mandates, like claimed? Thinking people constitute silent majority highly correlated kind mathematical aptitude leads identify ~1.5% population ""a majority"". weird, exact opinion except reversed. culvers disappointing Even inadequate testing, Africa major problems Covid, would know now. Like India corpses flowing rivers funeral pyres overrun, haven’t similar reports Africa. 

WHO saying Africa would inevitably become boiling pot pandemic ever since Pandemic happened, yet occur. Even faced small delta spikes, cases went down. Simply put, Covid hasn’t major issue Africa. YEAH!!! possible get flu shot w booster (the 2 week window longer needed). got time!!! likely also lot countries face problems make COVID smaller problem those. Civil conflicts, violence, starvation, even worst kinds disease...it doubtful time makes sense big. like point maybe data reliable moment. article fails explain connection covid patients title. DIVI intensivregister website shows state Germany 11% intensive beds occupied covid patients. Also categorization vaccinated unvaccinated. seems different problem shortage ICU beds.

The current spike infections unsurprising, considering vaccinated people untested therefore able detect infections. govt ignored possibility bid make vaccination attractive people get back freedom. least hope high vaccination rate keeps patients ICU. state attorney general, Austen Knudsen sent state trooper, county attorney. clarified article. Since Helena capital see rushed past distinction.

(I’m nurse here) post appears vaccines. encourage read helpful resources COVID-19 vaccines:
  
[Vaccine FAQ Part FAQ Part appointment bot, action performed automatically. Please [contact moderators subreddit](/message/compose/?to=/r/Coronavirus) questions concerns.*  No, they're normal. Normal people gotten vaccine. people definitionally abnormal gotten vaccine, whatever root abnormality is--be stupidity, rampaging narcissism, sociopathy--all signs point shitty people. yea 99% people arent. n popular institution california. way deeper comments ITT touch on. Russian Government (ie Soviet Union) succesfully executed 40-66 million (true estimates vary) citizens imprisoned millions more. happened 1930s 1991.

Many older Russians lived atrocities alive today remember exactly government lied, tortured, executed. little Putin Lenin Stalin. History casts long shadow. Moderna, Pfizer fine. know regional case declining similarly time last year. started call Long Winter one week Thanksgiving. We've got 50% vax rate know booster situation is. 

Cautious optimism at, now. counties 25% population confirmed positive (not once). yeah, non-vaxxed, non-infected population must small.  Fine whoever looking boosters? Dunno, Florida gone bottom level cray-cray get appointment? places already booking spots assuming approval next week? They'll selling Monat. Didn’t shipping unions retail meet Biden Monday? asked postpone Christmas. Greased palm boom. true American political fashion public got sold big business. asked exact question lol Side tracking here, ever going vaccine kids RSV? hear time dangerous RSV younger kids (especially 2) would definitely love see vaccine  time frame get third shot, Moderna consistent immunity far, know vaccine get. doses also kicked butt.  That's total population, forget ""elegible"" part headline, that's something even Brazil already happened (São Paulo 100% first doses adults), impossible. Experts seem consensus this. I've seen suggest may last big wave everyone either vaccinated infected would difficult current strain spread rapidly again. Pfizer booster end Sept mild side effects shot #2 Feb. mild lasted longer. happened UK too. I'm letting guard yet Glad idiot losers keep weeding productive society. got flashlights butts happen next wave UK? fingers crossed happen here. Curious old kids are? son turning 10 one month, feel comfortable based 12 year old population received dose 3x larger. apples apples exactly, think could expect something reasonably similar Rapid tests showed son negative (PCR confirmed). They’re useful many days infection kind use them, rapidly knowing carry normal. perfectly sums kind people regularly found n  excellent point. proven long term effects cigarettes alcohol, people use time without second thought!  TIL South Carolina actually west North Carolina. rename it. Awesome, thank you. gonna overthink it, gonna grab Moderna soon can. 👍 /woosh Freaking tragic would risk grandchildren's lives play Lone Wolf Hero.  bugsbunny.gif   Going third substantial. said, look daily noise. Nah, indiscriminate healthy, fit people happen get long covid. incorrect generalization based science literally replying to. Long covid happen anyone. symptoms due people's comorbidities.   issue likely antibodies. That's protection severe disease death declines much less-- T/B memory cells chance ramp up, much better position, take long enough covid, replicates quickly high viral loads already trouble happens.

The Moderna shot produces much higher antibody levels, turn produce better T/B cell response. JJ produces lower antibody levels, help mild/moderate disease, severe disease protection wane much. 

We know long antibodies booster last; likely longer they're high. turn might lead better memory response future. covid rare instead extremely common, makes less sense worry maintaining high antibody levels fight infection.

Needing every 6 months least likely scenarios. roommate’s mom nurse, got fired refusing vaccine. she’s looking nursing jobs. Dunno long it’s going take figure nursing degree worthless everywhere unless gets shot. clinic sure hell isn’t going hire people. Diabetes happens one organs, think pancreas? Stops making insulin. obese one way long covid damaging pancreas means also stop producing insulin. end point Long Effectiveness heterologous ChAdOx1 nCoV-19 mRNA prime-boost vaccination symptomatic Covid-19 infection Sweden: nationwide cohort study

The New England Journal Medicine. (2021, 09 15). Protection BNT162b2 Vaccine Booster Covid-19 Israel. NEJM, 8 pages. (2021, 10 15). Heterologous SARS-CoV-2 Booster Vaccinations – Preliminary Report. medRxiv, 28 pages. here: Answer: check last link theres pic, probably moderna, biontech also fine  You'r*  don’t  forget Idaho thing.... research federal funding $35 million $1000 - $1500 million cost develop drug.  4 MMR need 5th immunity mumps. got 4th immunity measles. much keep kids safe

""Hey Jimmy. know want go school, play sports, see friends, drive car older, generally experience world life, mother decided important keep maximally safe physical harm we're going home school keep home always. age suitable clean partner picked reproduce with.""

Do lie awake night thinking far higher ratio deaths population countries still waiting first vaccine, prioritize getting another dose achieve lowest possible risk yours?

Do mourn children lost vulnerable parents covid countries?

Oh what? I'm unfair clearly ""black/white"" issue? possible go far one direction point side-effect costs?

Well know climbing horse absolute moral authority?

Mean? Probably. Next time maybe insinuate others care 700 dead children act like much better them.  still discussing nonsense? lower east side nyc larger population people nightly basis. vaccinated sounds like is. thing spreads based seasonality people don’t immunity…that’s got email I'm eligible J&amp;J booster, said choose available vaccines second shot. keeping research. get second J&amp;J one mRNAs? one? tend follow isolation even post shots. houses movements tracked community spread. went back normal shopping masked go back indoor eating delta wave arrived. boost soon go back normal community spread low. Quit job much greater chance dying covid. reaction first two Moderna vaccines, mild reaction booster. ""McCoy ordered pay Sesame Place $48,0000 restitution""

I know trying say $48,000 $480,000, whichever is, money paid Sesame Place kid assaulted? Yeah, mean study 621 people 73 Delta cases. much possibly draw small sample, particularly face other, better studies looked much larger groups people? r/russiantrollsatemyface  Ohhh mom found solution one!

She told dad ""It's vaccine divorce ""

My antivaxx dad fully vaccinated still much married. ever goes rants added bonus reminding vaccinated definitely don’t think time allow flexibility, I’m also saddened many working class families ultimately lose employment they’ve fed lies brainwashed folks internet.

I’m part union, upside could potentially buy us time give us leverage negotiating back pay allotting additional sick time individuals receive shots.   Yeah, little surprised 5-10 year sentence got. read further, yeah, makes sense. Broke minor's jaw kept assaulting kid unconscious.  lot people masks aren’t nothing. disagree, you’re representing solid, majority position fight court privately funded taxpayer funded? frustrating happening almost two years pandemic. remove religion too? like antivaxxers switch excuse, unless offering comparable secular exemption (an individualized medical one come close comparable), they're constitutionally obligated offer one.

In fact they're going wind legal trouble trying pick choose religious exemptions allow denied categorically. Rapid, point‐of‐care antigen molecular‐based tests diagnosis SARS‐CoV‐2 infection Handling accuracy four rapid antigen tests diagnosis SARS-CoV-2 compared Systematic review meta-analysis accuracy diagnostic tests COVID-19

tldr rapid tests place depending onbrand, pcr tests lot better thing understand one dose benchmark kind study? Pfizer, AstraZeneca Moderna's vaccines designed two-dose vaccines maximum effectiveness. Whoever made study can't good faith say applies fully vaccinated people. got third yesterday. Switched Moderna sweet double dipping action. I’m relieved thankful, though first time I’ve side effects beyond injection site soreness.  [archive link anyone trouble accessing article got archive work phone. New England apples vs Florida oranges messaging 4 months [**2022-02-28 22:41:47 UTC**](http://www.wolframalpha.com/input/?i=2022-02-28%2022:41:47%20UTC%20To%20Local%20Time) remind [**this send PM also reminded reduce spam.

^(Parent commenter ) [^(delete message hide still wear mask going despite ""double jabbed."" unvaccinated kids.

I family members high risk suffer breakthrough infection. wear N95s, they're widely available, indoors shopping errands. would like smile strangers see smile, wait another day. RemindMe! 4 Months Damn thank G take many Well DeSantis offering $5,000 anti-vaxx cop relocate Florida Anytime see 100% population analysis like they’re either lying suck math I’m afraid lost. It’s clear sacrificed humanity fellow man earn “virtue” points online. set stone beliefs point straight authoritarian. want understand us gotten vaccine one giant body people think same. We’re real people real thoughts. Stop stripping people single decision. You’re literally saying almost half country sociopath. family psychotic empathy. Get fucking grip look mirror flown since Pandemic. Next trip February though.have whole family. Anyone else get moderna 3 flu shot time? hitting like truck... think Russians can’t see benefit traveling Moscow shut high numbers cases highly contagious virus? yayyyyyyyyy one less person line Yeah, really sure what’s happening happy it. Thanks Florida Let’s go Cuba 🇨🇺!!  mean agree, pointed days dipping cases lead less cases last week. think drop looks substantial compared massive decreases historical peaks Iran, low days previously mentioned 8th 9th. pick time frame week point toward drop well.

If ""decreasing"" originally said mean decreasing look 7-day timeframes, yes, going down. pointing statement inaccurate look day-by-day basis, especially take account dip caused 7-day timeframe case drop 5-day fluctuation lower cases seems risen again.

