,date,text
China vaccines. Agreed privilege part, one grateful available I’m glad government sharing considering surprising drop vaccinations find bit infuriating considering live alone isolated almost year straight seeing mediate family members always masked indoors due risk mother. know number people recovered without many adverse effects current knowledge taking consideration damage may come light later life (people 20-30s), also know people lost sense smell got vaccine, said thing aweful, effects vaccine fun felt like weaker similar feeling onset virus described “familiar” one friend, told far better actually contracting it. also know couple people went hospital (at risk age group 50*), know one person young healthy guy 20s known risk factors got got long covid (beacuse got early hard get test confirm didn’t seem show heavy symptoms), time confirmed (months later) health severely impacted long term energy breathing issue lung damage, spent months home recovering still isn’t back normal. wouldn’t wish anyone even fools anti Vax anti mask kills people chose both, like Typhoid Mary spreading virus around. mean “the United States tax payers buy 500 million Pfizer vaccine doses donate”. Argentine, appreciate this. thank every tax payer helping finance poorer countries’ vaccinations. save people's lives save too. Dumbass understand viruses mutate. longer takes entire planet get innoculate, higher chance there's variant beats precious vaccine completely whole cycle starts again.

Short-sighted fools would rather gamble another year two life help stranger. living twilight zone? whole point. believe came nature, others believe came lab. matter anybody believes. Let scientists analyze figure out. Assuming narrative false proper analysis shows mind already made up. scientific approach all. knew worked trying argue it... point Trump seems factor depressing vaccinations.

Sure, long ignore vaccination rates based demographics would show demographics opposed Trump also tend least vaccinated despite disproportionately higher effort specifically get vaccinated. Like, sure. literally elect people spend tax dollars behalf? Meaning energy spend tax money building roads, weapons? choice either, that's elected officials us. Lol, amusing comment. Reminds P.1 one fear crap I’d see around you.

The mRNA vaccines, least Pfizer, found 88% effective Delta variant. UK already study this. 

And ya two doses needed. always been, way. UK found one dose 51% effective B.1.1.7. begin with. comment US. Guess much supply they’ve giving second doses months regular intervals? US. 

Almost Delta variant cases UK among unvaccinated younger people (who still don’t even access vaccine) one dose. 

Again, amusing comment. hope every ignorant, covid denying, male gets COVID, spend weeks hospital, survive shit sex life. wasn’t, it’s speculation. Canada slow reopening, hence said joke like tax money helps people 3 June data show 12,383 cases Delta variant, 464 went present emergency care 126 people admitted hospital. 126 people, 83 unvaccinated, 28 received one dose **just three received doses vaccine.**

3/126 = ~2.3% hospitalised doses,  
28/126 = ~22% hospitalised single dose 
83/126 = ~66% unvaccinated (mostly 30) 
12/126 = way compare similar unvaccinated control group. course difficult real world rather controlled, blind trials, still lot better looking percentage vaccinated people get sick. 

That said, clear vaccines really, really great. Everyone get vaccinated, get vaccinated. Fair point. said ""committed donate."" might bit biased, faith they'll follow through. isn't. There's sort options provided purpose 

Buddy even best search algorithms world somebody following along covid information know there's information sexual health matter they're looking. Part job news organizations supposed provide keeping relivent information public discourse. surprise new story written today covid effects sexual health. Immunocomprised people hospital need exposed hospital workers won’t take shot. guess find different profession US grew always loved. Good see return. 

Next list infrastructure. problem takes long time vaccines delivered, administered actually aneffected. takes months, time spread may already gone down.

Also, countries *haven't* affected ones greatest risk, ones lowest natural immunity. Biden, though take credit.

Yes. government taking credit government action things work. Everyone knows money comes taxpayers. government good smart things money government gets credit. far people want transfer permanent work home option. haven’t made easy option though. Many hoops jump through. work sensitive information proof people can’t see computer screens, hear phone calls, meetings. spoken many people work, people looked list requirements said screw go back office. going jump hoops. 

At least giving options us. keep saying, working home August privilege, right. Definitely lot sensible rules, can't see nearly 100k people coming abroad spreading virus, even Japan offers vaccinate athletes. doubt athlete would want potentially screw last minute training taking shot somewhat harsh side effects. 

This sucks athletes. They're going enjoy playing front near-empty stadiums fans Japanese-only. Unable physical contact 6' within anyone else, even team, even they're vaccinated. Unable travel essentially anywhere. take time one's day use tracking app every day movements tracked. fuckass I’ll never meet covid six months. Considering tax bracket I’ll buying seven doses, I’d rather extra side salad next time eat out.

Do understand mutation works? bunch fuckasses still getting COVID eventually there's going mutation beats vaccine. fuck good extra side salad going then? Imagine getting hung point. always rely Americans right thing - tried everything else  USA update first dose shots:

322,692 first dose shots. Last week 244,706.

7 day rolling avg 474,263 (463,122 yesterday)

172.0m age 12+ first dose - 60.6% (171.7m - 60.4% yesterday)

164.8m adults first doses - 63.9% (164.5m - 63.8% yesterday)

86.5% 65+ first dose (86.4% yesterday)

51.8% overall (51.7% yesterday)

At rate, first dose shots:

On

June 15th - 174.8m

**12+ population numbers (based 284.1m population)**

On

June 15th - 61.6%

65% 7/6

**Total population numbers (based 332.6m population)**

On

June 15th - 52.6%

55% 7/2


**Path 180.6m/70% Adults (based 258m population)**

7-day rolling avg adults 357,697 (341,330 yesterday)

June 15th - 167.0m - 64.7%

July 4th - 173.9m - 67.4%

70% 7/22 haven’t donated anything yet tho, correct? target delivery Q3.

Not say New Zealand isn’t HUGE SERVICE. tiny country ordered tremendous sum vaccines already promised millions surrounding pacific islands. 

Meanwhile, Australia promised PNG ton apparently hasn’t delivered. Yeah I’ve told dad seems affect beliefs. firmly believes wave like fall winter. 

Arguing people like arguing anti-mask/anti-vaxx folks Good. Unlike politicians, ensuring neighbors well good public policy. Good them. patients immunocomprised get risk infecting them? tell one horse going bar point think we’ll lucky even get 60% total population least one shot. disappointing. fucked hoping country instead state.. amount, thats problem. choice, power money going why. Besides vaccines donated China, straight up. UK epidemiologist said Delta 60% transmissible Alpha variant, turn transmittal original virus.

Two doses needed get full benefit vaccines Delta, especially true UK using AZ spreading time shots. trying shorten time give better protection. 

Even decent vaccination rates UK seeing numbers head wrong direction due Delta.

The mRNA vaccines looking less effective Delta.

Delta joke.  It’s second graph article well. God. That’s abominable. I’m disappointed surprised. Spend small amount money, save potentially millions American lives... hmmm... sounds good me. Currently toddler fever. tried half day summer camp fever day 3. wore mask 2 3 hours outside. Couldn’t push another stimulus end student debt though… *American taxpayer pays them*  saw FF Roseland Ballroom 20 years ago, still kick ass! exemption might still able proceed planned.  feel like waiting...everlong? Fire every single one them. average person always use X experience extrapolate conclusions there. common. CureVac offer? better boost approved vaccines?

So far Pfizer main one deliver guess others along. take that's sarcasm. Australia terrible response pandemic I'm glad least stories coming light. Ok big difference 2.5% risk. covid risk children similar flu important keep perspective Dense. …but people died getting it, right? incredibly unlikely new variant makes big enough difference justify lockdowns even there's way government could convince people start over. pandemic socially US. gym 100% unmasked liberal city shopping centers also 50%  That's fair. data means people trials. way see main reason vaccinating 6 year old greater good reaching immunity, therefore willing wait data. 
As example, AstraZeneca blood clots seen initial trials found millions recipients. I'd rather wait large amount recipients know putting child risk potentially low risk side effect. approve children age 12, I'll happily oblige Dr. Fauci. Google source information. PDF is. like library source, book. 

The bakery ordered bake cakes gay couples, fact. Many states vaccine registries. think vaccine lotteries? Australia's rules Covid gone past sanity seems. better strict Covid care like US, making rational exceptions situations necessary. they're vaccinated, what's problem? Uber might free you’re getting vaccine.  blame like stupid irresponsible.  Bruce r/springsteen prove vaccinated? Anyone link study? seems like rather dubious science based survey. Thanks warning. Pussies Well probably yes, happened lot countries pandemic crises.

Check france's new cases november 7 Yes, taking virus seriously looks like. putting safety community ahead individual wants looks like.

This civilization looks like. you’re already familiar, look RCCX theory. data points

Such what? always like data. specifically would convince though? Full licensure? Actual approval? Supposedly single vaccine fully licensed, vaccines approved EUA. even sure &lt;12's handled licensed adults EUA comes kids. 

The 2 things make think worth theoretical risks are:

1) dose mRNA body gets finite body runs it, disappears. Meaning *theoretically* long term effects. Covid-19 infection SARS-CoV-2 virus limits, often said lingering virus may cause ""long Covid"" occur.

2) WOmen pregnant received vaccine now, various stages. babies born protection transferred mothers. vaccinated, next closest thing. immediate side effects young children(newborns), would alerted now.

If could sign kids trials, would(and have, called back yet.). Spoiler they’re ready everywhere. Ok, care black people business motivating people get vaccinated, making excuses don't. 4% adults US immunocompromised/immunosuppressed. It’s lot people.  reporting WSJ article posted already, repost essentially - saying anything new. That's mandatory quarantine particular places monitored perimeters. Damn right not.  kids sore arms unlike knocked butt next day half. Antectodally, it’s 20-50 year old crowd vaccine symptoms. feel like trying entice people get vaccinated saying vaccinated people need wear masks going enable people going get vaccinated stop wearing masks demanding see manager. treatments pipeline think show promise? Oh yea?!? Well India third variant!!!! then!?! two cents: 


I got ticket. I'm excited. I've seen band times, superfan, going cathartic. said, bit nervous, risk-averse since March last year (my last indoor show MSG, incidentally, masks, vaccines...well, one mask, woman next me, drank night, really on). attitude is, I'm gonna get plane July...go wedding August...see indoor concerts August/Sept/October/Nov, etc, different? people, sure, actually near 90+% them. masks, sanitizer, I'm vaccinated, I'm protected Brothers (Allman) concert last year. public transport since night I'll take subway train friday get acquaintance's car get bachelor party...so things opening (I FIRST meal outside home (other hospital food) done since...babysteps...and admittedly big step day, feel comfortable, I'll sell ticket eat (bought cheap one).  


Also, think 16 vax test rule stupid, especially father's day show...how many dads bringing kids this... expected along. I’m sure people surprised. see countries this? Russia’s death toll least 100K one listed now. US too, likely programs conducted CDC last decades, call bad actors? Let's ban travel forever  double vaccinated easily verified Vams - otherwise known CDC log CDC shows vaccine certificate status.... Montreal come. Bringing USDollars too. kinda like going places care health own. Refreshing. 

CANT wait. point facts explain black community behave way, entirely fault. government needs more. bad actors, programs supported U.S. government. sad situation her, can't lock society incredibly slim portion population physically get vaccinated. alternative solution protect them. listening interview doctor C-SPAN today said:

""We know strong benefit natural immunity think probably lasts least year. We’ve virus around little year we’re sure long that’s going last.""

However, still advocates getting vaccine even natural 00:01:28)

As far know current COVID-19 vaccines original strain virus, show body spike protein. Whereas natural infection body sees entire virus.

I'm entirely opposed vaccines. going take one would prefer take one mimics close possible natural infection, would live attenuated vaccine.

One concerns current COVID-19 vaccines injected muscle, place body sees virus first natural infection. natural infection body sees virus respiratory system first, maybe intestines virus swallowed food drink. respiratory system intestines part mucosal system different immune response rest body, I've heard. even get vaccine might still get infected mucosal system spread virus. That's reason health authorities saying still wear mask vaccinated.

So ideal vaccine opinion would live attenuated nasal spray form, perhaps oral pill infect intestines. Codagenix vaccine nasal spray. vaccine already exists flu - FluMist Quadrivalent AstraZeneca. recall studies, efficacy plateaued 28 days, efficacy measured 28 days. explains real world efficacy could slightly higher (i.e. measuring 35 days would give higher efficacy).  Exactly right. Covid us 10 years impacting don’t get vaccinated. Additional lockdowns moot point. Get vaccinated live life. not.  shame lol. Happy admit that. There's reason even offered people anymore. Happy real risk {Herd immunity} different area, community.

Right. We're going reach different times different states multiple reasons:

* population density
* mobility transportation
* maskwearing
* vaccinations
* age population

Etc. messaging 1 month [**2021-07-08 22:48:05 UTC**](http://www.wolframalpha.com/input/?i=2021-07-08%2022:48:05%20UTC%20To%20Local%20Time) remind [**this send PM also reminded reduce spam.

^(Parent commenter ) [^(delete message hide would great. lot effort needs made mobile clinics. would help push us over. 2.5% hospitalization rate children? seems way high. get number from? too! hard. opted cheap seat ($50+fees...um, that's nice price!). almost got one behind stage, wings. Pearl Jam amazing, Radiohead side, also sweet. $119+fees made hesitate, I'm trying budget. Plus, believe one behind section, stand, dance, etc without anyone breathing neck (literally/figuratively). fun, safe! Florida Texas trying figure sue him. E.U. countries planning allowing vaccinated Americans Brits summer? Spain Italy announced months ago. Remindme! 30 days Cross Royal future vaca cruise options... check. Something tells physicians weren’t part walkout… see line branding problem ""Delta variant"" strike fear people like ""double-mutant"" variant even BB-8 variant. respect that, I've yet go public transport since March last year. experiments happen? pass along Aunt Uncle case friends neighbors need assistance. 

Thank You! about? know trials needed approve vaccination children countries too? countries swimming vaccines. Strong similarities proposals War Terror. Big scary threat civil liberties must sacrificed altar safety. always. Honestly, people can't wrap heads around issue hospitals overwhelmed... point... worth anymore. top anyone says something like ""not many people died"" ""they weak going die soon anyways"" obviously lacking empathy worth involving life way. Fuck self-centered assholes. Thank much.

My husband also that. want pass loved one. 

And fully vaccinated, reason. know feels like lose loved one, want cause heart break.   got JJ 13 weeks ago US, sign one two doses Pfizer moderna? They're demanding STIs anything else though they? again, probably always were, world decided liberal democracy great idea, rightly ignored branded cranks. Haha appreciate desire help! course never wrong internet myself, I'm sure happens best us occasionally. even mean?! fat unhealthy worthy living earth? 

I swear species incredibly fucked up. Holy shit. 

I sorry loss(es). Truly. anyone know sources papers regarding vaccine effectiveness Delta variant and/or probability asymptomatic transmission vaccination? family still refusing budge back little normality think still 2020 ... maybe I'm wrong one maybe I'm jumping gun. 2019 version bill made through.

Correct, said completely rewritten

Nope, amended. I’d listen random Reddit guy, make sense. Gets confusing it, better simplified naming system. sharks? Politicians? Businesses? Regular people? rising millions too, good current data UK’s cases terms distribution vaccinated unvaccinated? know days ago incredibly disproportionate (something like 80% infected unvaccinated) wondered still following trend. Wearing masks outside longer requirement. need remove ban non-U.S. citizens United Kingdom, Ireland 26 Schengen nations Europe. 

With vaccine avail testing makes sense anymore. I'm curious too. Happy sign kid up. think us opposed vaccine passports envisage something considerably invasive that. share bank balance every Tom, Dick Harry temerity sit cafe order coffee. much might disagree would turn vaccine, believe deserve excluded society, least undermines principle informed consent even reduce vaccine uptake. Quite apart fact want quasi-punitive impositions like health cards inflicted vaccinated people either. know you, enough trust fully vaccinated personally care (neither business) vaccination status another is. pose danger me. Memories . . .

Light corners mind  Yup, totally nuts. parents fully vaccinated, tested negative covid multiple times, allowed see child even wear hazmat suit. Completely bonkers.  boat you, 2nd dose really put (47) son (21) girlfriend (20) week. far good younger two, they're mostly complaining arm sore side effects. daughter went first day summer school problems. Honestly, never really know vaccinated! opinion children's reactions hitting hard all! Good luck! (briefly) lived bush Alaska state flew nurses give immunizations. federal government something like this. Fewest new daily cases since September, lowest active cases since Halloween going down. finally ok shape.  Canada consistently ranks higher US human freedom index. US isnt even top 10. still bothers always say this. Thanksgiving dinner grandma really appropriate time this. Also, Uncle Ned's funeral wrong well. even talk wedding minister said, ""If anyone objections, speak now......."" right place I'm saying. Downvoted stating fact

Gotta love sub  Clearly im talking norovirus. comment started shoot thread mentioned passing regarding cruise ship reputation. 

Covid though entirely different transmission potential problems cruise industry. Haha worries all! kinda jumped without saying OP. good day really wish would make scalping illegal. Foo completely screwed Oh good, I’m sure won’t cause international Covid variants spread. hope bring light what's going here.
It's unsettling put lightly.  What's US going do? Knock tell us open door? Americans dont take covid seriously stay care. Forging CDC seal felony. 
 March, Federal Bureau Investigation warned public using fake vaccination cards bearing government logo crime. 
 
and case bar owner selling fake cards - 
 Anderson charged identity theft, forging government documents, falsifying medical records loaded, unregistered handgun Fwiw Hasan Minhaj tickets upcoming show Radio City went sale today available cheap $45 (plus ticketmaster fees, ~$65 after). hopeful that's sign shows reopen tickets immediately spike roof  Well said. Need jabbing first concert ever tour, broke foot. Dave came chariot fire remember right. damned cool. really type thing that's  not. Virus circulating amongst younger population. Hospitalizations deaths increasing. Question is, .4% physicians ICU’s hard work, entire hospital staff matter responsibility? certainly 10,000 ICU nurses doctors hospitals Texas. again, isn’t everything bigger Texas? Lol directed 117. Dang, wish AZ!  Everything world digital. banking digital. employment record digital. social media presence digital medical records already digital. Covid vaccine anyone's digital hill die already live life completely digitally, whether like not. can’t wait get mine since I’m 18, it’s significantly harder find adolescent targeted COVID shot know is, mom won’t drive because, “traffic.” Yo wtf 187K deaths Peru? new? UK 40% population 2 doses, still pretty good. first dose prioritised UK ran risk running out, would even worse Unsubscribe CARES Act drafted signed law 2 weeks

Uhh, no. can’t believe shit upvoted. It’s modified bill already going house senate since start house January 24, 2019

Signed law March 27, 2020 born resist, immune? think Dr Kim saying need careful nothing currently certain. He’s extremely cautious everything says based current studies.
I don’t think scientist moment say anything certain one us individual react vaccines differently. Im currently unvaccinated due shortages live certainly take vaccine I’m offered. people realise vaccine stop everyone getting covid stop serious illness hospitalisation. However unless large proportion world vaccinated takes one person unlucky one new variant formed vaccines protect vaccinated think also reason Science community telling people cautious.
I’ve friends countries they’re vaccinated live countries quickly vaccinated citizens least one shot. country live able access vaccine older generation given it. People 60 access summer.
The majority countries position.  76% 18 population ontario 1st dose 2nd doses speeding every day. livid slow lock haphazardly opened before. opening patios non essential stores 15% capacity far reckless point. Lay’s Oreos  Efficacy phase 3 studies measured 28 days. Protection appears increase time passes, could indication efficacy still increasing 28 days could end higher 88%. key point. one interesting things I've learned pandemic. Yee man I'm lookin fo better job StubHub Vivid Seats businesses hope went due COVID-19, disappointed. Norovirus.

As coronavirus asymptomatic vaccinated individuals quarantine requirements comes coronavirus. current world different one year ago, least States.  Dang. would definitely take strong background customer service. worked many years tech security electronics firms also experience retail customer service hell. couple things. article says ""In U.S., Delta variant accounts 6% cases scientists able sequence, said. actual number likely higher, U.S. running genetic sequence fraction cases."" assumed higher? tested fraction cases likely lower.

And even higher, U.S. cases still trending down, shows vaccines possibly natural antibodies jobs. talking USA? fixed bet vast majority 117 pro-t**** idiots. Sometimes, can’t change anyone’s mind regardless proof. 9,883 hospital workers? number ICU’s, “over 10,000” full hospital staff? country 🇨🇦, province Ontario controlled stage 1 re-opening starting June 11th. Woo hoo, can’t wait stage 2 hopefully July 1st celebration confederation occurred July 1, 1867. Finally. good news. 

It’s time hold people account actions. live Phoenix, AZ area get job. still require local :(  bad!  make miserable onboard w/o vaccine. vaccine require wear mask everywhere stateroom. free roaming ports. $200 rapid test get boat. 100% crew vaccinated 80%+ customers saying would, pretty easily sway needle 95% total making customers opt out. that's into. Imagine wasting time money career destroy idiotic beliefs. make even less sense consider purpose pharmacist...🤦🏻‍♀️ don’t see riding naked idiotic. ok. depends. states making laws make discrimination based vaccination status illegal... outbreaks probably talking contaminated food, cruise ship. 65+ first dose (86.4% yesterday)

Typo revise numbers? Large portion atleast ski season domestic Aus tourist. ones dependant likes Chinese tourist ones hit hard. guess somewhat flawed first place 🤷‍♂️.Ski fields fine atleast backbone tourism area  going punish airlines industry? Yeah band headlining Bonnaroo Lollapalooza doesn’t draw fans. two days time US 600,000 dead. average flu season kills 60,000 average. like zero idea affect us long run.

You also plausibility think could negative consequences long run.

How long going wait see whether something go wrong not? 12 months? 18 months? 30 months? 60 months?

