,date,text
0,2021-11-14," Despite popular belief, USA behind many many countries world many many ways. Even country question Bolsonaro charge, countries tend still actually function, unlike USA.

# surprising least country publicly funded healthcare outperforming USA public health obstacle. totally agree people get vaccinated protect people. sound like sooner get vaccinated, better protecting people around me. simple. Even thinking others' welfare own, makes sense delay vaccination. Here's why.

 state CDC currently pacing lowest prevalence category. 3 levels ""minimal,"" state lowest 3 levels. means very, very, cases flu area. chance catching flu right now, &amp; thus posing risk people, therefore also very, very, low. get vaccinated make 50% less likely catch flu, chance catching flu go tiny extra-tiny. Meanwhile, time passes, immunity decline 10% month. flu peaks around in, say, January, level protection around 10%. means time there's real risk catching flu passing on, almost vulnerable flu unvaccinated person. there's lot flu around, chance catching becoming contagious pretty high, even old, worn-out vaccination board.  

Which better: 50% protected catching passing flu there's almost flu around, 10% protected there's lot around? flu 2018 weak opening door doctor’s office difficult. wasn’t fun. Yes also fact, fuck costs masks. course people dumb hence spiraling deaths restrictions due control spread again. looked around non national chain pharmacies? Pfizer x2 Walgreens spring got Moderna booster Friday local grocery store that’s kind regional name. borders open tourists thinks?   far they've strayed anti fluoride protests. achieve anything protests? ""Healthcare professionals"" US build lives top system bankrupts people takes advantage desperate jacking prices outer stratosphere.

You really think system going give bonus? caught flu Hong Kong, long covid bed hotel room week straight bed home another three weeks.

hey thanks bringing back you! Iran, India, Indonesia tons working-age Covid deaths, though. That’s ultimately, selfish either sides determine they’re limited Pros cons exist, people weighed stuck believe best them. restrict them?

By logic, people allowed drive drunk, drinking driving choice, drunk driver thinks best them, restrict them? knew would happen. Obesity personal institutional failure. many people participate failing institution able make choices sacrifices necessary maintain healthy weight.    new card immunization record card fits passport. Maybe CDC card also intended fit passport? line ""by educating people scientific reasoning"" laughing. clearly paying attention. people believe u/letsGoBrandonQAnon1 ever listen doctor. trump doctor  That’s opinion. still look far worse world? Northern Europe seeing surges bringing line UK months months.

And yet we’re enjoying life zero restrictions. I’m certainly complaining. Source? One causes all.  happens Singapore. government gave front line workers massive bonus.  surpassed highest infection rates pandemic quite bit. measures slow (according experts). yeah, coming Austria next weeks sounds like bad idea. Right heading another lockdown everybody. Based Austria seems like British government willing tolerate high case numbers long period time, whereas governments many European countries start shitting bed soon cases start going again. Doctor - Here's something keep alive, turn 100% chance dying

Idiot - choose die

🤦  new thing restrictions unvaccinated people, country need vaccines updated get access schools social security example    said would first line take doctors told should. Based context, clear saying take *only* Donald Trump says take it. Completely reasonable, since Donald Trump consistently proved completely ignorant health issues. Got college. Lost 20 lbs month. spent weeks sleeping chance got. Horrible, horrible illness. Cry childhood city 91% 12 1 shot 84% last week 5 1 shot.

I know 6 year old 7 11 year old cousin's shots weekend bump number higher.

Their school district already hosted vaccine day well. Every time mom gets hint fever, claims coming flu. takes handful vitamin c 6 hour nap. wakes ""miraculously cured,"" therefore ""doesn't need stupid flu shots."" Drives nuts trying explain handful vitamin C cure flu never first place. think lot MILLION people confirmed dead covid, likely millions go expected deaths vs actual deaths, lockdowns massive public safety measures. 

You think overblown personally affected. buying propaganda think covid measures fucking power grab trick ""to progress science"", whatever fuck that's supposed mean... government telling since inception. already mandated get vaccines, go speed limit, steal kill. 

Thinking THIS, free vaccine limits unvaccinated people spreading disease, flexing power absolutely moronic Unfortunate obvious would happen. yet UK experienced bigger surge cases, didn’t introduce restrictions all, cases started falling anyway.

Your government simply shit bed. Manitoba Yeah know law enforcement arbiters justice. simply individuals following orders (thank using straw-man argument). 

Now don’t get wrong, everything mentioned previously another redditor merit, however problem argument regarding cops getting vaccinated law law particular gonna unintended consequences, it’s good one. Why? Well let ask questions: know long takes train competent cops? know long takes recruit new officers work particular station? Ooo here’s one million dollar question: cops fired complying mandate long think it’s gonna take LAPD start fully staffing competent cops one vaccinated, two willing deal incredibly shitty people throughout scope employment? find answers following questions, ask this: long think gonna take LA county realize shot foot legislating silly mandate gonna eventually lead high crime rates? Californian lives LA county myself, deeply concerning me. Yes important get many people vaccinated possible personally think it’s bad idea tell people bodies mandate. gonna make people become reluctant get vaccine make people starting questioning authority figure(s)’ motives issuing mandate first place. 

Also another flaw found argument hearing lot sources (word mouth, news stations(yahoo new, msnbc, etc.) reports people fabricating fake vaccine cards get around vaccine mandate. Im kind curious aware piece information. 

P.S. call stating like following orders gave impression must type would follow law, matter silly unconscionable right minded person. Californian fully vaccinated moderna, don’t like mandate cause potentially lead high crime rates throughout LA county, law enforcement unable quell chaos dumb vaccine mandate telling cannot work, dine out, go public places unless vaccinated. It’s sounds incredibly classist discriminatory toward people unvaccinated and/or towards people choose get vaccine whatever reason may be.

What thoughts this? :) Zero covid work even try contain covid every beginning passed point return early. got booster last week! Pfizer third shot bad second shot.

Second shot took 5 days fully recover. Muscle aches fatigue. third day, felt like flu 4-5 hours.

Third shot felt fatigued 3 days felt like cold second third days. made week maybe month 

This excellent plan universal imo

Ty posting [State CA Digit Covid-19 merely illusion Tedcruz multiple beings whose social media mind gone rogue.  true cases flu mild. much overlap colds symptomatically. nose stuffed temp bit sore throat want sit computer watch stupid videos, probably cold. shivering blanket high fever, everything hurts, mustering walk bathroom, that's flu. Highly capable disease detection, China, (didn't detect case SARS-CoV-2 seroprevalence 9 states US 1.1%; delayed PCR testing due first testing kits botched CDC)

Highly susceptible population (high percentage anti maskers, anti vaccxxers, extremly high total cases.) Even fully vaxed get tested watching movie going late night restaurant club.

Only Vienna.  Yes, reddit likes use logic someone gets stopped speeding tells police arresting murderers. Point someone else bad (or even they're worse) absolve harmful actions. know sadly doesn’t way 

It’s purely self inflicted wound lack better term Getting vaccinated reduces spread area.  question asked article. get worse next years.  Anything vaccinated Hetero women? Sorry loss. That's absolutely fair, sharing one perspective pro-vaxxer. assume get flu shot similar reasons... matter awareness visibility think, convince others get it. got one last year happened waiting 15min CVS get prescription filled. Yep. delays restricting unvaccinated mean restrictions vaccinated line. Hardly ethical vaccine mandates. I've got friend recently booked trip Austria wife around Christmas. good time traveling there?  mean, pharmacy give third full dose instead booster, believe incompetent. also fill card, thankfully online database state.  Something go court without clear precedence exact situation, that's contradiction. one said zero chance getting Biden ""admitted"" knew that. fucking weasely. I've mild flu multiple times (mainly started getting flu shots) relatively bad flu once, young healthy. distinct memory body freezing whilst drenched sweat bed, begging die also argument imaginary man room (shouting real f\*\*\* off). terrible day so, took well week really get back normal that. No. keeps repeated last time actual Austrian said article wrong get entry fee waved. still need pay ladies. YES! Ohmgd, never thought that! *Brilliant!* weird thisnis getting hyped FALA DE NOIS COMEDIA give mild symptoms, yeah basically ignorance. “With 65% total population vaccinated, Austria one lowest vaccination rates Western Europe.”

Worth noting US currently 59% fully vaccinated Olympics July, Japan's vaccination rate like less 20% US crawling barely 50%. around August, vaccination drive exploded, surpassed US September bunch European countries never looked back. 75% fully vaccinated now. They're gonna catch Canada surpassed soon.  think good point make, would come say doctors tell us take it, I'll first line take it.

Seems perfectly reasonable me. Israel data pfizer 10x reduction positive tests, 20x reduction hospitalizations. numbers actually better younger people, except hospitalizations low measure phase 2s measuring antibody numbers Generally wrong. covid anti vaxxers, that's much part ""I research"" verbiage, discredit real science. unintentional treading area, people see statements way. tremendous level dehydration (and therefore extreme headache) right first dose. second third one loaded electrolytes right away. feel always thirsty pick pedialyte similar. Fortinately BS sort accepted many places employent especially vast majority health care. that's flu story! ask, corny sense humor fit right looking like Westley? yeah, make sense me. people either gotten covid, know people covid fine, also know people gotten vaccine gotten myocarditis after. dad example, everyone household vaccinated, except him, help one us may gotten myocarditis it. federalist nation. states ton power throw massive roadblocks. top that, states, like own, municipalities level power relative states. mean we've already guy refuse rabies vaccine exposed bat. That's bad enough is. Good. Want lockdown? bare minimum decent part society. rage inducing, particularly if/when person dies, lumped ""fully vaccinated"" category unless fraud detected. place, 42%, 200%, 1000%. Mixing 1 week several weeks.  


Somehow get 42%, without taking account factors. make calculations, based 42%, draw conclusion that. Misinformation? ****? would listen head Pfizer former head FDA, trust sources?! remember said recently) ""The pandemic January,"" ? Cite better source I'll take that. moderna [phase trials run 6-8 months second dose. complete pfizer trials &amp; real-world data, includes [third doses right 6 (showing 10-fold decrease positive tests versus 2-dose cohort) ~[11 (showing 20-fold decrease symptomatic covid).

We know moderna creates initial antibodies, takes longer wear off, timeline ""needing"" third dose slightly back versus pfizer. [3-6 months protection severe highest, likely waiting lot longer going help much.

Most likely everyone countries pandemic get third dose 6 months. lot done state level. use Docket App NJ, Utah started it. Colorado database well. similar rules made Singapore, unvaccinated allowed enter malls, eat restaurants go tourist attractions. telegram anti-vaxxers happy, dare start revolution smth like that. (We also app show status) first thought 'Oh come on! flu shot now?' actually makes perfect sense. convince science medicine real got hard back track reality. husband says thing... fools think flu big deal either never mild case. 

I'm sure I've ever not.... I've pretty ugly viruses though. I'm asthmatic make sure get flu shot started getting pneumonia shot 30s Andrew Wakefield, disgraced ex-doctor tried connect MMR vaccine autism sell fake alternative (and also tortured children, btw) guest honour Trump rallies 2016. Trump claimed connection vaccines autism least remember.

So, vaccine safety non-issue already political/partisan.

I like word ""polarization"" current political conflict, implies two less morally equivalent sides. true.

When one side lie, invests specifically rejection critical thinking objective reality, baddies. necessarily make guys good, better.

Distrust institutions inherently bad, healthy valid reasons. distrusting reasons based reality that's problem. This, again, neatly divided two across political lines. i'm actually surprised numbers high

wonder they're like live. given free, I've never yet considered getting one, I've never flu symptoms hate timeline live in, really  double vax rates low Germany compared UK Spain? supply issues attitudes? Germany use AZ vaccine? briefly used Canada seems canned. Canada high double vax rates.  They’re still though. entire world, even ones believe science, suffer it. Historically communist countries Europe seem low vaccination rates.

I assume anyone grew place like would learn authority figures can't trusted.

In East Germany, may added complication: country, injected athletes experimental drugs order improve performance. Many suffered severe permanent side-effects. Obviously, doctors would complicit this. would presumably huge effect extent people trust relatively new vaccine. good way get people shots? PSA: Given estimates 22 million kids missed MMR vaccine shots pandemic:

* gotten MMR (mumps, measles, rubella), please so; would gotten shot prior 1989 (or, like me, mumps rubella vaccinations, *not* measles), consult healthcare advisor getting one.
* TDAP (tetanus, diphtheria, pertussis). Tetanus cause muscle cramping severe *break bones*. [Most people need booster every 10 Flu shots save lives. - looked it. looks like vaccines stop getting it. 

They make less make u less likely pass on? 

That too.

Also, overwhelmed ICUs anti-vaxxers threat everyone needing ICU bed. means people die due fucking idiots. currently biggest problem German speaking countries due incoming winter wave. hubbub now?

Traveling necessity. Even working specific company necessity. nonessential places want deny unvaccinateds that's one thing. think crosses line someone denied entry grocery store buy food unless inject themself something. understand mask sufficient cases, especially protection vaccine. I'm incredibly sorry friend went through. :( six month wait booster arbitrary current circumstances, idiotic. still effect everywhere?  secret organization known bacterium can't afford it, round trip ticket America like six months full time job pay me. Plus third world countries citizens cannot fly somewhere want, visa exemption like rich countries people need apply visa months advance, costs alot money too. vaccine people economicly weak neighborhoods foreign speaking ones.

I think important. know comment downvoted. experience, German authorities vastly underestimate bureaucratic difficulties many non-EU foreigners others living places like Neukölln. traditional vaccine campaign reach somebody health insurance angemeldet living. think us since 90s they've way vocal last year ideology colliding reality (and really happen often) really really stressing people out. 99% countries allow patients refuse life saving treatment Resuscitate orders? find hard believe. one ever mandated flu shots vaccination certs phones easy spoof? Singapore, anti-vaxxers would try gaining access showing screenshots people's vaccine certs passing own, app makers modify status screen prevent sort thing. stated press conference government. try dig something out. Well, choose term then: competed it? can't actually find anything chance getting rabies bitten rabid animal, impression almost certain.

Everything could find chance animal even rabid first place odds case.

Also vaccine works clear would vaccinated time.

If know anything specific subject googlefu better I'd love know there's also chance catch bitten it.   vaccination rates East lower? something historically part East Germany? vaccine requirement venues “hygiene theatre.” 

It significantly reduces odds catch Covid one events.

At last check Colorado 145.6 cases per 100k vaccinated week 10/24, vs **559.6 cases per 100k unvaccinated population.**

It also encourages vaccinations hesitant. 

A mask requirement restaurants sit take mask “hygiene theater.”

Vaccine requirements make sense. mindful takes ~2 weeks fully effective Hey, want say I've upvoted posts here, really appreciate good writing is, well articulated viewpoints.

 disagree everything saying, narrow-minded short-sighted selfish way thinking, appreciate cogently stated everything.

But seriously, realize contradictory thoughts like ""everyone deserves safe society"" ""people high risk covid deserve go everywhere without restrictions"" are? Me, too! need encourage family same.  Well expect least number customers rise again! know million people die car accidents every year, right? surely advocating banning cars.

No, proper safety enforced, safety belts, following rules road, speeding, etc. complicated. Yeah things looking good winter 21-22. :( right. true. pandemic *real* (for people) happens *you*, good friend, family member. 

Since ""it's happened"" around often, take seriously. That's got booster shot flu shot, spent weekend bed. 

In day return work, test hundreds happy seniors go cruises visit relatives Thanksgiving. 

I discussion mother we'd see other. calculated next Spring, goes well. Honestly, I'm afraid her. think good shape (at least, Florida) guestimates. We'll see. That’s great. 

It seems parents last feel “comfortable” bc kids couldn’t get vaccinated.

I hope lot parents feeling relief right now. county Southern California college students working hospitals really bad fall-winter surge last year. :( Honestly, could good thing. flu shot already tragically used Democrats see duty 49% population getting flu shot might actually improvement past years.  Aw. live within walking distance testing centers, requirement negative test would limit life lot. :( Thankfully I'm Vienna. terrifying, frustrating, infuriating exhausting turns American right now. wonder teens anxious. Literally everything say correct! That's specifically bothersome. statement line people normally would get flu shot, getting playing political COVID antivax game.  Luv 2 navigate different doctors use followmyhealth mychart make sure QR codes apps He's busy thinking fake adverts making fun real. absolutely support Republicans abstaining getting life-saving vaccinations. choice, respect decision die misery leave rest us peace.   hard educate covid19 vaccine? internet, social media news paper, television. point anyone still wanna play dumb covid19 vaccine purposely choose ignoring facts. 

You know unvavcinated could carry virus spread around everyone including people could get vaccinated due health problem, freedom choice live?

If someone act extremely selfish want harm society, think fair society repay them. Vaccine absolutely personal choice, unless decide meet person life. print…. TV. Mainstream media loves scapegoat internet media problems crystallizations traditional media. Traditional media making bank rage decades Facebook came along. difference Facebook doesn’t actually produce content, way they’re simply middlemen. root cause problem actual, non-social media creates poopy content first place. Portugal 10 million people, though; inhabitants constitute minor part portuguese-speaking world. portuguese-speaking people net come Brazil, there's lot africans also speak language natively. Brazil's general appreciation vaccines comes culture, Portugal's.  Stalin said, 1 death tragedy, 1 million statistic. compassion abstract number. truth. could lie make people feel better, case, think better blunt. 

That make bad person, makes human being. phenomenon called psychic numbing. lockdowns restrictions, we're pushing limits people capable psychologically handling. least past times, people could turn friends families support comfort, responses pandemic precluded too. 

Most normal people going compassion large abstract number. truth. Maybe morally superior people, salute that. I'm though.  gotta kidding me!

Seriously, flu?!


When anti+intellectualism end? ok hand gesture, someone lost job racist symbol   Well damn, goes theory virus hiding nerve bundles. *not* neurotropic. *where* hiding long COVID patients?! NYS   would thought difference vaccine efficacy preventing symptomatic asymptomatic spread among previous iterations COVID, delta, enough make clear. Breakthrough infections delta exponentially common original COVID. feel like basically vaccine mandate except starts consequences non compliance first. Vaccine mandates proven difficult enforce places maybe something many countries either lying covid cases (like Tanzania), don’t test enough people. Tanzania reported thousand cases far, despite massive population.

And countries like Ethiopia Nigeria reported hundred thousand, consistently 10-20% positivity rate, meaning cases likely lot higher.  I’ve never taken it. never get flu one time actually got flu shot, ended getting really sick. saying it’s pointless, immune system hasn’t let far. That, terrible needle phobia. pass every time get shot, avoid possible. Yet another reason get vaccinated wear mask...for four footed family members. Thanks non-patronizing response. agree—that sounds like we’re headed. don’t hear much covid Africa. bad there? Don’t hear stories like Italy last year India etc.  low vaccination rates imagine it’s pretty bad  Imagine picking evangelical, molesting, lying grifters medicine, science &amp; history. I’m sorry don’t understand polling works Well, whatever good them. good authority. really worry means next generations. babies old enough get vaccines, protected herd immunity vaccinated even getting boostershot next month. Someone functional healthy brain understand normal.  Pharmacists nurses. wheelhouse. Pharmacies labs either charge testing. ideal.  Also, diabetics supposed they’ve maxed four insulin injections? Yeah ok. population isn’t even polled. It’s select groups. even say that’s accurate? last sentence basically magical thinking.  Everyone understanding this, I'm sure. Really? Smokers already singled pay insurance.

Let's unvaccinated. Er, guess write two polling firms involved research quoted article let know personal anecdote data? Japan actually one worst vaccinated OECD country world.

[Japan 9th 38 OECD countries percentage population fully Japan Portugal, Chile, Iceland, Spain, South Korea, Denmark, Ireland Canada.

Behind Japan Belgium, Netherlands, Italy, Finland, Australia, Norway, Sweden, France, United Kingdom, Germany, New Zealand, Luxembourg, Lithuania, Switzerland, Austria, Greece, Israel, Hungary, Latvia, Estonia, Turkey, Czech Republic, United States, Costa Rica, Slovenia, Poland, Mexico, Colombia Slovakia. Stupid could vaccinated year ago longer antibodies course people get vaccinated get boosters soon can. Humanity's stupidity remains boundless.  “COVID shot controversy” say “Vaccine misinformation spread primarily republicans” Well fair, people actually catch flu usually sick care *what* have.  six months based best evidence vaccination committee point. more, good data comes change. Yes effect people immunocompromised. evidence claim arbitrary? vaccination sites struggle deliver vaccinations due lobbyism many closed. Even could follow current surge demand wouldnt help current wave would effect next year according Drosten, Wieler etc. Okay, get doctors note. People set appointments get vaccine, don’t get doesn’t mean don’t need documentation like rest us.  mild serious cases flu (diagnosed medical professional).

The mild one debilitating could walking around. serious case was... devastating. thought would stop breathing care.

I've also colds - used lot colds. worst cold mildest flu same... unnecessary. problem effectiveness diminished time, delta. booster good delta tailored vaccine. vaccination like hepA+B need 3 injections time span recommended covid -- weird though 3rd called ""booster"" instead ""part base immunization"" (though ""immunity"" ""train body long term) -- also, accepted flu, get yearly vaccinations strains mutating last year's. would people accept SARS-CoV-2 necessary?

People double standards afraid new shit.    Yes, hardest lockdown government **legally allowed** place population -- 

* cannot forbid going **single person recreation** (going walk - means, big groups going walk together), essential physical mental health constitutional right good health
* cannot restrict social contacts (but limit least **weekly contact lockdown**, visit single person household), human contact essential mental health constitutional right good health
