,date,text
Just house already fire, mean want keep throwing gas it. Well, here's quick glance less deaths per Capita New York, despite way risk people (above age Thanks updating. holding hope wasn’t boosted asymptomatic. It’s definitive way knowing lethality, it’s nice footnote nonetheless  traveling home Cloth mask still 1000x better mask That's different claim. claim else equal, vaccine evading strain outcompete non vaccine evading strain trivial. claim made along lines environment likely induce mutations. Basically smallpox this. R0 3 5 (maybe bit less Delta) IFR 20-30% so. last outbreak Europe Yugoslavia 1972, put via martial law massive mandatory vaccination campaigns. New Covid. Really rolls tongue. There's always israels data graphs vaccine gives protection limited time, time booster may available person extend immunity.

Acting like surprise smug Well, takes time make, ship administer vaccines.

Plus uptake probably going lower people get COVID fatigue start lose confidence vaccines protectiveness wanes.

Not saying fall category, it’s true. comment automatically removed linked source may reliable may dedicated mostly political coverage. possible, please re-submit link reliable non-political source, reliable news organization recognized institution.

Thank helping us keep information /r/Coronavirus reliable!


*I bot, action performed automatically. Please [contact moderators subreddit](/message/compose/?to=/r/Coronavirus) questions concerns.*  proposing illegal US direction? Ban people coming in? one single specific country COVID doesn’t travel quickly others? always variants long pandemic worried. It’s fearmongering point since boosters media cycle guess scientist warned strain lots eastern regions antivaxx don’t resources vaccinated. vaccine’s efficacy may little lower, I’m certain become useless Even better question, allow unvaccinated go anywhere? Building forced labour camps can't take long... 100%. already making rounds SA since surveillance countries (maybe even most) given HIV issue dealing decades “You’re going die.”

“….hi sorry told last week, meant you’re going die.” nature. strains viruses zoological factory farming churning out. think climate change far bigger challenge, perhaps (probably likely according you) pandemic going go years. may get worse, become endemic, may also hard valuable lesson mankind solving global issues. younger self would cynical depressed. Talking feel good thing. Enjoy holidays! grounded, actually alarming me. expect media freak anything, even moderate concern widespread among experts, lot unnerving news clickbait.   clinical study involved de facto hold hospital beds blocked COVID patients now.

Our population proven uncapable reasonable, uniform behavior.
We need honest mandate now. dim wit ideas ""pressure"" ppl vaccinate. honest name is. removing everything unvaccinated ppl nothing else mandatory vaccination, honest maybe it’s squeezing left COVID paranoia winter surge isn’t panning bad last year thanks vax natural immunity Chise like post saying pretty clear way control get antivirals onto open market, make affordable promote hell them. 

They hopes Pfizer pills, thus far, look much promising merck option. anyone involved selecting residents:

Rachel Lynn Magliulo, Matthew Shea Willis Kristen Willis Hall three names keep pinned wall individuals suited practice medicine.    say so. One handful cases may still manageable. flights kept coming every day, would impossible enact measures.

What's really important contact tracing immediate quarantine possible contacts. Sorry misrepresented that, 2 doses Pfizer, fully vaccinated May/June so. booster. Please right please please please /r/blackmagicfuckery right there.  Obviously offenders shot virus adapt immune response, also adapt medications designed interfere it. Possibly easily - immune system pretty damn effective.

Also, vaccines extremely safe, small amount needs produced per person. mass administered, antiviral drug would given people actually ill maybe prophylactic immunocompromised.

Personally, expect drugs important manage endemic covid long term, rather stopping currently spiking infection rates.

But expert means. tools certainly better. wary people (not you) would skip vaccine drugs give false sense safety. also doesn’t make “airborn” commenter stated mention analysts suggested starkness market moves might exacerbated thinner trading volumes due U.S. Thanksgiving holiday. U.S. markets closed Thursday operate noon Friday  Africa's low vaccination rates there's little selection pressure virus escape immunity conferred vaccine hopefully still works it. vaccine always side effects. isn’t talking camera stating opinion. side effect videos academic merit like stillborn study. going depth about, that’s intellectually honest way go this. Explore people worried calm down. jailed per capita think thats hes getting Yea, Covid weird middle ground scary, quite scary enough change behaviour stubborn. Less scary we'd probably consider another flu, scary we'd react like ebola would beaten it. like evil Goldilocks. ""and vaccine-evading variant ever comes around actually likely emerge highly vaccinated countries."" 

Source? Bingo. better question, allowed to. world got punked delta variant nobody wants happen again. We’re careful past instances necessitate it. many words “we don’t know anything yet 10 mutations” never said  They’re alone I’m reading view. Doomsday variant, comes. either bad news badder news? :(  regurgitating I've reading. concern new 'variant' high probability evade vaccines. Anyway like said time tell take everything read grain salt. heard anyone dying they've identified strain Tuesday, November 23rd. Boosters meant create immediate defensive line infection potential propagation. problem enough people vaccinated causing mutations - means previously vaccinated people need get boosted - we're essentially going circles minority. 

 point, is, must data driven approach, needs dealt reactively based situation ground.

The end goal always cut daily cases becoming severe, cause hospitalization death, burden healthcare system. Let via boosters, OTC medication (hopefully coming soon), testing masks.

The problem see general population reactive impatient, continues inflame pandemic. vaccinate, mask spread good word, even difficult achieve days. federal, state local governments pushing messaging several months people ignore it, believe facebook posts, fb private corp done nothing help propagate misinformation.  American can't travel Europe without vaccine. Maybe requirement everyone flies. OlD PeOpLe

FREEDUM !! Okay, believe ""lockdowns"" completely voluntary, consequences noncompliance? patient question young unvaccinated woman

Well, thank you, stupid fucking bitch submission linking businessinsider.com automatically removed source may reliable may dedicated mostly political coverage. possible, please re-submit link reliable non-political source, reliable news organization recognized institution.

Thank helping us keep information /r/Coronavirus reliable!


*I bot, action performed automatically. Please [contact moderators subreddit](/message/compose/?to=/r/Coronavirus) questions concerns.* Mmmhm sure. I’ll believe healthy young people start dying number. let’s freak want booster shot maybe another booster 10 months based delta/nu relevant spike variant. plus everyone either infection immunization should, think, make next winter (and winters thereafter) fairly normal, though probably we'll significant Coronavirus season top influenza season forever. new variant discovered SA SA. probably one many African countries less 10% vaccination rate. presumes adaptation due selective pressure vaccines. 

The reality, though, mutations may well coincidentally something allows escape immunity. mutations happens virus continues spread. literally variant SARS-CoV-2 virus. new virus. start spreading misinformation, really need right now. trying get information new variant Twitter

I think see problem here. European countries Friday joined Singapore, Israel others restricting travel southern Africa frantic effort keep newly identified, apparently significantly evolved, variant coronavirus crossing borders.

In past, governments taken days, weeks months issue travel restrictions response new variants. time, restrictions came within hours South Africa’s announcement — least 10 countries around world announced measures South African scientists finished meeting World Health Organization experts variant Friday.

There proof yet variant could diminish protective power vaccines, uncertainty question one factor speed countries’ move toward restrictions.

The new variant, initially called B.1.1.529, “very unusual constellation mutations,” according Tulio de Oliveira, director KwaZulu-Natal Research Innovation Sequencing Platform. protein helps create entry point coronavirus infect human cells, new variant 10 mutations, many dangerous Delta variant, Professor de Oliveira said. I'm bit south, moved Connecticut year. say people incredibly nice good natured comparison.  Kind refreshing disagree still treated like human beings.

Have great weekend know we’re already hoping best. Look European countries, data new variant yet, lockdowns waning immunity.  Frankly think cycle new variants new mrna vaccines/boosters rolled one side ""wins"". knows long take... takes 10 different boosters five years... yeah, I'm thrilled I'm willing get means eventually dies out. Well house pretty much every day lockdowns started anyone point gun UK. blows mind dont send poorer countries matter cost. Whatever cost far cheaper another economic hit lockdowns furlough's pills speak of? wait. If, huge point, variant bad seems might be, we're going get object lesson death 1,000 cuts. Labor shortages already huge problem. supply chain becoming increasingly snarled up, creating shortages higher prices. divisiveness violence we've already seen vaccines, masks lockdowns going become exponentially worse tee another round nightmare. 

There point center can't hold anymore... good know. Hopefully mild symptoms, any. sincere hope current vaccines still provide robust enough immune system response keep vast majority people safe serious health issues. person clearly never heard 1918 flu pandemic lasted whole 2 years killed 25-50 million people black death basically wiped estimated 200 million people. first pandemic we've last article saying experiments underway. 30 mutations spike protein concerning, many permutations still allow infection human cells. reason, vaccine still effective degree. Whether degree sufficiently high protect people question. Higher 70% effective goalpost tossed around vaccines first came out. ??? country already worse shape ever was. Seems Delta currently. Likely soon vaccines wane more. Key quote:

“Officials also expressed concern mutation could result immune evasion enhanced transmissibility virus, *but added early tell kind impact mutations vaccine efficacy.* studies also need conducted understand clinical severity variant compared previous variants, officials said. still unclear effective vaccines new variant flagged team South Africa, displays mutations might resist neutralization. several dozen cases fully identified far South Africa, Botswana, Hong Kong new variant, B.1.1.529, “very unusual constellation mutations,” 30 spike protein alone, according Tulio de Oliveira, director KwaZulu-Natal Research Innovation Sequencing ACE2 receptor — protein helps create entry point coronavirus infect human cells — new variant 10 mutations. comparison, Beta variant three Delta variant two, Mr. de Oliveira variant shares similarities Lambda Beta variants, associated innate evasion immunity, said Richard Lessells, infectious diseases specialist KwaZulu-Natal Research Innovation Sequencing things give us concern variant might enhanced transmissibility, spread efficiently, might also able get around parts immune system protection immune system,” Dr. Lessells new variant largely detected among young people, cohort also lowest vaccination rate South Africa. quarter ages 18 34 South Africa vaccinated, said Dr. Joe Phaahla, country’s minister cases variant mainly concentrated country’s economic hub, particularly country’s administrative capital, Pretoria, “only matter time” virus spreads across country schools close families prepare travel holiday season, Dr. Phaahla said. hand, sound alarm turned deadly, criticism hindsight take seriously enough media downplayed it. catch-22. Yes delta R 8, highest virus know Measles 12-18 really can't spread much faster currently. name variant Omega. last one. Support get rid it. Mark zuckerberg knows that’s pushing VR social platform meta trying get everyone use technology.. quickly moving dystopic society dangerous strains continue popping things done home case Belgium unvaccinated traveler. vaccine requirement air travel Europe. Really? Florida people always hated everyone- assume heat, snow birds tourists. Source: native relocated away armpit US.  It’s still possible it’s less deadly others. Haven’t heard anyone dying it. it’s much less deadly could actually good competition delta.  Lol. rate 2 weeks going everywhere. Nu news basically head’s things could get worse. Nu could like new disease vaccine got can’t stop. already resubbed today. Fuck ~~probably~~ ~~the~~ us already... Wow dude, say anything lock scared. dramatic much? Europe seeing digital COVID passes masks used compared shit show home states stark comparison. seeing unhinged seemed response shows you’ll completely miss nuance I’m saying.  tag line literally they're racing determine *if* threat, implying know. news outlet claiming somehow whole new pandemic making stuff up. downvoted literally nothing say backed available science right now, even doomery predictors new variant saying anything remotely close this. Yes, Covid going end. eventually become endemic. really don’t think understand isn’t one bad, next. It’s essentially certainty. We've seen things before. understand point trying make, directional decision making useful, give best accurate picture. don’t know give gold, know made day. sound snarky all. person little overly defensive IMO. hand, reports suggest spike proteins variant differ current vaccines designed protect against. Think communication breakdown here.... Infection chance infection severity two different metrics look at. current vaccine reduces delta older strains. new variant mutated bypass vaccine's reduction infection CHANCE. However, enough data say whether variant also bypasses vaccine's reduction infection SEVERITY.
The ""best"" case scenario would vaccine still effective reducing infection severity new variant, time (and science) tell.
So words, bad recently boosted person got infected recently boosted person getting severely sick. Pls get vaccinated. dont take medical help get sick COVID understand listening scientists, virus mutations tend favor contagiousness severity symptoms survival virus reliant contagious deadly is. found pretty interesting. Depends entirely go. typical western-tourist centric beach hotel curated excursions see pyramids? low risk (setting aside corona). number mutations make difference though; mutations equal dangerous. emergency meetings likely name accused inaction, fact matter would far better over-react turn another Lambda, nothing become real problem. point, little data pointing critical emergency.  Horse medication curing covid19 come? bald guy says worked  Hong Kong cases also fully vaccinated Pfizer. one spread other. vaccinated vaccinated transmission, airborne. Okay, tell me, happens completely ignore lockdowns? Deadlines also depends fast spreads wave big hospitals colapse death rate go lot. Hey, I’m making mistakes. saw breakthrough cases variant. We've seen someone get face eaten Velociraptors. know literal, perspective important. Hope so, friend. Good luck us, directly Portugal! infectious big red flag. virus infects, chance mutate we've seen Delta whatever variant is. mutates longer incubation time without side affects turns ramps deadly worst worlds. best bet try eradicate mutates. antivaxxers seem hell bent letting happen. happened literally nobody. even paid businesses trouble shutting wish people would point frequently talking variant. 23 November, South Africa reporting +/-300 cases day. Three hundred.

Of course new variant took numbers low. variant extremely contagious. transmitted Hong Kong two people quarantine hotel rooms across hall other, otherwise contact other. firends symptoms 10 days catching Delta. similar period time. Haha, yes- take Nobel prize!!! I’ve lived 5 different countries 50. Pretty big bubble. Keep telling poor people need charity rich, instead systemic change. guy Hong Kong, asymptomatic. careful separate testing positive actually getting sick, two things necessarily equivalent. saw thousands people lose livelihoods work, did, they'd get fined, pay they'd get arrested, resisted arrest, they'd get shot.  ""contain"" degree, keep carrier that's one outbreak avoid, possible patients call work sick &amp; visit ICU help keep things normalish till better grasp &amp; updated vaccine ready. think vaccine prevent getting covid help die Single data points, indeed, necessarily indicate trend.

But one see someone get face eaten Velociraptors, reassuring. Optomistic, flawed. enough data make sort concrete conclusion Isn’t fun living knees? America lost balls don’t see power play. Get ready vaccines policies required order enjoy regular freedoms. 5 million 7.7 billion people died Covid 2 years. 1 million deaths common flu last 2 years. dont see counters points, course scientists concerned, variant spread lot. doesnt mean panic mode super worried put everything back square 1. Perhaps maybe understand things enough know people quick say covid wont major threat forever. say things like ""no pandemic last forever "" (I know that's technically true) something similar like person responded to. like said, flu? still Spanish flu strains here. flu kills tens thousands people every year US. Maybe jut another virus kill hundreds thousands people every year going forward now. 

What exactly preventing happening? someone says ""vaccines"", yes know. clear vaccines alone enough stop virus plus millions people never take it. Also we're witnessing today always threat variant evades vaccines.

I dunno, I'm hard time visualizing world covid always surging, always producing new variant, always killing least tens thousands, possibly hundreds thousands people every year something like full fledged cure take point become infected. UK put red list - isn’t advisory - direct flights banned hotel quarantine restarts Sunday - non British / Irish / residents cannot enter country SA (or 5 countries added red list) previous 10 days. Anectodal evidence worthless Arblus look, it’s Omicron! case Belgium clear chain transmission back South Africa. already escaped Africa. Sounds like want get accused taking seriously. Seems strange move straight VoC virtually non-existent data point time.  Legit read list mutations morning ran lab model it, thing insane. New variant lot mutations variants concern have, bundled together mutations aswell. Analogous increased transmission delta, compared alpha wild virus, saw higher viral load early infection. means mucosa lot virus particles, hence easier transmission.

A lot studies linked article: Yes no. worked health service since start pandemic formally qualified, generally rule...

You always want less severe disease, least disease capable badly impacting high risk categories. Ebola, example, cause global panic deadly - actually less deadly, therefore able spread without burning infectious group quickly. 

A virus want kill host. insentive to. reason common cold evades us easily due little effect host also easily spreadable is. 

The problem infect people easily. happens chance hit risk, especially many places stepped many covid restrictions.

A deadly strain apparent knocks host within days may go 100 people, less deadly strain takes host notice disable sickness may go 1000. strain that's deadlier kills 10% 100 takes 10, one less infectious spread 1000 kill rate 5% takes 50. problem.

It happened Delta. 

Thank god system designed get vaccines quickly safely. curriculum taught Buddha nature suffering behaviors lead end suffering lifetime remember anti-lockdown people said every time COVID-19 thing would seem control, there'll new variant push control general public taking away rights? Glad good time! Hull fair? Hopefully one everyone goes space, that's probably gonna COVID 6 so. Time travel probably COVID 8. backwards. First form opinion, decontextualize verses support it. Vrrrr Omicron-Persei 8 Yet need Delta, would need variant? bar high yet clear it. still know lot things regarding variant transmissibility/severity. I'm suddenly flashbacks childhood 70s. Thanks input. way I've leaning. I'm Canada issues initial vaccine rollout. That's important consideration thought before, appreciate mentioning it.

Just record, I'm personally eligible booster yet, parents shortly - likely data vaccine efficacy vs nu available.  kind envy guy degree.  Imagine living way look away problem disappears. like baby never learned object permanence. January 2020 already know can't lock humanity months end. fit variant, find way matter do.   Wait Omega variant Keeping boosters wearing masks indoors around new strangers horrible ask; people return sense normalcy abiding precautions. makes everything sound negative; think world ending needed wear condoms avoid HIV eat raw eggs avoid salmonella.  Didn’t post heavily downvoted? pointed previous comment extremely rough estimate based extremely rough estimate transmissibility. seriously doubt 500x number heard going stick, wait see. there's evidence contrary either right? simply wait couple weeks data jumping conclusions?  Maybe sequence new variant, way ever promise re-develop vaccine timeframe. wonder ""less deadly"" newly identified (just identified Tuesday) lot data track yet. Obviously hope that's case, think people transmit it, higher deaths rise. 

The average age Africa 20, hits US full obesity, co-morbid conditions, older population, could bad news. Elaborate? health experts Friday cautioned alarm said would take time assess potential impact variant there's evidence existing COVID-19 vaccines continue Isaac Bogoch, infectious diseases specialist Toronto, urged Canadians get vaccinated already.* addition, said discovery new variant shows importance ensuring everyone world access vaccine, variants originate among unvaccinated people.*

Well, may bring horror vaccinated shows still need rush vaccinate still take jab. That's definitely name virus b list action movie us already. seen stated anywhere person unvax? vax unvax catch spread. Africa low vax rates 3rd world, can't blame eithier. varient replaces delta vax work well it. Go get booster today tomorrow. Given covid waves work 3 months varent specific booster available already peaked current one. Monica Gandhi painfully wrong time, would never use source.

Here's one aged-like-milk know happened next

Here's mask ribbon cutting ceremony right Delta ravaged could keep going think get picture. Downplaying new developments kind brand.  HIV/AIDS epidemic Africa. absolutely promise 3-day turnaround Really feel like weekend everything closed March 2020. least surprised time gonna use saltwater risk getting eaten type barnacle every time gotta go. fact can't even decide Nu Omicron really give lot confidence moment Michigan called military help deaths/server symptoms situation though.  Whats greek name? ""The cautioned countries hastily imposing travel restrictions, saying countries instead take ""risk-based scientific approach."""" Ross, largest friend, simply eat friends? agree you, issue society gotten used comfort instant gratification. longer prolongs social damage  clear, health care costs *already* skyrocketing. Health care size **6%** US economy 1960, **16%** economy time ACA's passage. eaten 2 percentage points *more* per decade, **18%**.  shotgun mouth may well legal euthanasia. Hopefully legal wherever are. Ross, largest friend, simply eat friends? post locked due off-topic discussion per Rule 8 r/Coronavirus. Please remember keep discussion focused COVID-19 - off-topic political discussions better suited subs. Thank understanding.  Ebola also reasonably low R value simple fact gets severe quickly. don’t spread don’t socialise cause you’re sick dog. lords colonists.. medicine tougher swallow Decepticon, especially scary one. take mansion, sky? fact skipped VOI phase went straight VOC is... concerning me. Delta VOI reclassified VOC. voice excellent credibility. Go get booster, encourage everyone know get boosted. going beat thing half ass lock downs flight bans.  Plenty vaccinated people still following mask mandates vaccine mandates, extremely reasonable. similar fashion, fact briefly difficult buy toilet paper early pandemic nothing actually kind production shortage disruption; stores ran days many people bought case really shortage, process created one.  Every voc evades vaccines. difference 80% immunity, 95%, 99% extremely large. profit Got link? makes sense. ""let's wait two weeks see deadly variant taking precautions""

