,date,text
0,2021-06-02," Doesnt seem like people underestimate easy thing spreads. kind comparison useless. area hit badly U.K. was, maybe haven’t seen first hand effects Covid, aren’t aware worried Covid death. 

As someone living London, it’s estimated 1/4 population Covid total, know quite people age 20-40 hospitalised and/or suffered long term side effects. Stuff like constant brain fog, hair falling out, inability exercise, months end.

The risks associated vaccine statistically far, far lower risks associated Covid. adult age group. That’s facts. New COVID-19 variants highly transmissible, Dr Bloomfield reporting index case Victoria's current outbreak caught virus window 18 seconds.

What?? Damn. UK vaccines per capita Canada. took strategy Canada would people first doses. Instead chose give people second doses. can't figure vaccination rates stated CDC tally what's reported respective state's Covid dashboards. State reported figures seem lower across board. Anyone clue that's case? GIVE MINE ALREADY! 

I'm 18, have, like, 2 months get first jab? People downvoting know situation India is, denial. plenty time prepared, August 2020, Modi announced 'Vaccine Rollout plan ready'

&amp;#x200B;

Vaccines available adults India *in theory*. practically, able book slot vaccination next impossible. vaccine drive slowly ramping now, doubt could achieved far higher rate vaccination prepared Although agree tone changed, article light science instead repeating oft incorrect trope ""just wait two weeks"".

It became almost rallying cry people trying justify restrictions, regardless science saying. easier live alone. :( *starts looking mountains hike downtown Toronto*

Anything else change life make pleasing you, oh Internet stranger? Briefs boxers? ""Mom"" bicep barbed wire tattoo around arm? name firstborn? Teach me, oh wise one, game life. I'd vaccination since Tetanus booster 1991 (according NHS app data), amazed barely felt anything all. cats claws jumping lap. Ok. Explains CO still highest 7-day case rate per 100k *shocked Pikachu face* Buzzfeed news FOIA'd bunch Fauci's private emails Jan-June 2020 one sub discussing real substance emails? Mainly scientists, conspiracy theorists, telling virus could engineered? everything political. 

I don’t care Fauci, overall think great job, I’m pretty pissed incompetence China likely letting virus leak, governments institutions around world lying us hardly possibility engineered.

This straw break camels back real global sanctions China. money talks nothing probably happen. Flu transmits differently coronavirus. Best protection flu hand washing/avoiding surfaces others touched. believe it’s called ‘formites.’  Coronavirus transits primarily aerosols, contact surfaces. Kinda like smoke. ventilation key corona, hand washing flu. True. issue one dose much Indian variant (the variant that's currently causing rise cases there) people protected. Got - nobody live WW2 complain anything ever again. Thanks clarifying! I..I see there.... Not. Everyone. Is. So. Introverted.

Are seriously incapable understanding there's one type personality? (Which means terrible empathy therefore fully human, based definitions.) trolling me? bother replying - post another ""holier thou"" thing, I'll block without reading it. US globally?

I live New England we're essentially back normal. stores still recommending masks, % people still wearing already dropped lot since state updated policy. September going thing past. tell conservatives that. explain Canadian think Cuomo's really like? remember NY covid surge, least giving serious daily briefings pandemic, breath fresh air compared Trump. Also getting flu shot reduces severity flu get it. People also mistake cold flu. it’s over… remember.. it’ll late. Elections run state won’t fair free anymore. work started long time ago. you’re aware suggest inform yourself. Wait till UK Canada open eligibility 18-30 age group. see countries ultimately reaching 80-90% population, eligibility questionnaire says I’m “not current phase”. 

And it’s opaque confusing. bet lot people assuming they’re eligible someone tell if/when are. realising actually book appointment go. 11% (15 million+) visitors EU US. Mostly (6 million) Italy, France Germany. many informal system. thinks flu kills 600k people US every year? still boggles mind people would play Russian roulette life/health like that.  tell that’s cuz less people seeing need get tested - probably vaccinated , virus spread slower (positivity rate low ). good point, guess we'll find next week fluke *cries Australian* Wondering see little rebound since holiday weekend. Lots people traveling want get shot around time shows vaccines potential completely shut virus practical purposes enough people get vaccinated. plenty politicians pushing alternative medicine too.

There difference politicians pushing government officially supporting name culture heritage. mean efficacy 97%? yea thats kinda bonus massive economy, diversified even tho hospitality tourism got smashed, everything else largely fine. that, due taxes, california ended $76 billion budget surplus, states lost billions tax revenue explain this. British voted Prime Minister wanted inject Covid live TV people dying prove hoax voted Brexit. Italy made mistakes hit hard early new virus world still trying make sense it.

The reality Britain currently reaping sowed. here.

Coasted couple decades without major colds flu.

Got flu one year bad remind bad could be. 
Been getting flu shot ever since. Sorry hear that! PATHETIC! Step number one nation! 12 50 good enough Yes bring bag :) Yay! free gas instead post appears vaccines. encourage read helpful resources COVID-19 vaccines:
  
[Vaccine FAQ Part FAQ Part appointment bot, action performed automatically. Please [contact moderators subreddit](/message/compose/?to=/r/Coronavirus) questions concerns.* look incidence curves USA EUAs yourself; divergence \~13 days. comment automatically removed linked source may reliable may dedicated mostly political coverage. possible, please re-submit link reliable non-political source, reliable news organization recognized institution.

Thank helping us keep information /r/Coronavirus reliable!


*I bot, action performed automatically. Please [contact moderators subreddit](/message/compose/?to=/r/Coronavirus) questions concerns.*  didn’t read 3200 emails, seemed like saying anyway? Ireland slow Compare place like Italy allowed leave home could exercise within mile home fill paperwork ahead time could day. Fail comply fined arrested. US nothing remotely like that. Also, non-essential businesses free conduct business online chose time frame many did. Yeah, even said blood came out, bandaid red spot lol. arm also sore day so, nothing major. UK high AZ use, 12 weeks optimal, problems here. “244,706 first dose shots. Last week 696,649”. Ouch might one worst turnouts while. Hoping FDA approval come soon might able bring back totals 2 weeks ago least. learned hard lesson 3rd wave. Things get hand quickly I'm surprised gov taking cautious approach time. Cases falling fast vax going quickly well start opening soon. Yeah it’s also dependent oil gas tourism. 

That’s states like Alaska, Nevada, Florida got hit hard. 

Tech farming done really well year. Cruise ships, much! slow learners. Wait think Short talking Covid symptoms? always plan. 16 week timeline worst case ontario. since adequate supply theres reason move 2nd dose. quarantine killer. technically ""allowed"" visit since immediate family, would forced stay without leaving 14 days able leave house either 14 days left. Considering jobs, can't take much time work visit them, option. quarantining 14 days seems stupid vaccinated!  Yeah New York City 63%. It’s lot easier get NYC 70% bunch smaller towns 50%. 

Today’s announcement said something city competitions, great idea mayors customize incentives. Oh could ever guessed would happen way people didn’t get vaccinated They're vaccinating freaking 19 million day right Honestly, given many AZ doses sitting GPs, getting delivered, I'm inclined believe complacency. I'm 25 got Pfizer shot last weekend Sydney – household healthcare worker. eligibility actually quite broad. feel like Africa completely undercounted want start seeing stats listed daily deaths including many unvaccinated. really want buy much vaccines US. Several DPP officals invested domestic vaccine, hold lots stocks. want people take domestic vaccine without full phase 2.

There's ONE trying stop buy vaccines JNJ far know.  Illinois New York entered chat. many places de facto 12-16 year olds even legally required. Kids young can't drive (nor many older teens practice), unless convince non-parent adult drive without telling parents happen live go school within walking distance pharmacy need parent get there. problem free all, pockets usually hung around eachother vaccinated. States broad requirements better faster.  post appears vaccines. encourage read helpful resources COVID-19 vaccines:
  
[Vaccine FAQ Part FAQ Part appointment bot, action performed automatically. Please [contact moderators subreddit](/message/compose/?to=/r/Coronavirus) questions concerns.* worst part work together place 200-300 employees. shutdown got least dozen emails people died... relatives employees, former employees etc. know real people effected, even believe 'lamestream media'. Moderna 4 weeks, Pfizer 3 weeks. option single dose. US lower rates vaccination across age stack daily vaccinations continue fall. give anyone free ride though. I'd rather double number $50,000 scholarships. rejected said would need careful scanning businesses. typical cherry-picking conspiracy nut jobs? Gotcha, nothing see here.   post appears vaccines. encourage read helpful resources COVID-19 vaccines:
  
[Vaccine FAQ Part FAQ Part appointment bot, action performed automatically. Please [contact moderators subreddit](/message/compose/?to=/r/Coronavirus) questions concerns.*  much people like draw parallels Boris Trump alike. UK also polarised sake things like COVID. US clear differences COVId behavior depending party.  smart, gives something 15 minute observation period Yeah that's lead believe. bf visit presuming he's States. able visit him? Anything want life found here. need better distributing wealth raising lower class, yes, America called land opportunity reason. Endless possibilities ""California less contraction last year Texas, Florida Indiana, states fewer restrictions, data show. Overall, economic output shrank 3.5% average U.S., compared 2.8% California.""

thats economists saying, makes sense since california economy robust states Yeah, I’m keen either. fan drinking liquid plant, honestlh  I’d rather see map counties. Even blue states like CA LOT people gone disinformation rabbit hole places like Central Valley. depends live. Basically hunger games map America’s hesitant frustrating gets it’s still working fine comes case numbers. No, looked like shitty, terrible people people believed one horrible one handling well partisan-poisoned idiots. lmfao ur really brazilian dont think blame people getting vaccinated. dont believe vaccines, get vaccinated something dont believe in?  Pretty sure multiple companies paid lot try that. sort doubt get done time still matters though... guess based things normally go How’s France doing? I’m moving school September wondering restrictions (if any) then? absolutely expensive understand agree upset expense, want see expensive look quarantine hotels Red list countries cost. Vaccine hesitancy India high. 2/3rds doctors vaccinated far spite exclusive vaccinations 1 month. vaccine hesitancy amongst doctors delayed vaccine uptake new orders govt wondered needed spend 10 billion dollars given poor India is.

At start vaccination program 40% doctors offered shots took it. really didn't. Anyone paying attention knew Cuomo piece shit mishandled pandemic start.

The fact people actually fooled fucking depressing.

And say total idiot. known long time, asymptomatic spread fake? That's news me. source posted said 59% transmission comes asymptomatic presymptomatic COVID patients, dated Jan 2021.

Maybe ""boost"" wrong choice words, really meant one way another, immune system fights virus, vaccinated not. understand vaccine make vaccinated asymptomatic individuals less likely spread unvaccinated asymptomatic individuals, apparently asymptomatic spread happen all.  everyone feel travel? We're booked flights Paris late September I'm kind anxious mostly feeling okay. home (NYC) things almost completely back normal us. feel bad Hawaii.I assume culture Polynesian? Maybe 2029-2035 best goal could end long aids currently is. heard someone talking experience finding cure similar aids. Currently anyone 18.  would go cruise willingly without vaccinated and/or knowing others board havent vaccinated...couldnt Weird... reactions people allergic peanuts?

Either way least one dose get significant immunity. surprised got first dose 2 weeks ago nurse said 92% effective 2 weeks. figure even that's using different measure 95% figures see thrown about, that's pretty great. question, fully vaccinated donate blood. antibodies potentially pass donation recipient? mean anything friend fine indoors without masks period time want. per cdc. got vaccine, get sick anyway. Maybe go 2030 cure found (similar AIDS) “To report suspicious activity involving fake vaccination record cards, please contact appropriate government agency state jurisdiction, call HHS-OIG 1-800-HHS-TIPS visit Internet Crime Complaint Center online www.ic3.gov.” younger (27) co-worker basically said won’t get vaccine “there’s much conflicting information” since beginning. fully vaccinated still wear mask - something loves “call out” literally every time around other. 

We forced small conference room together several minutes couple weeks ago. next day, out. week that. Mid way next week, still wasn’t back asked was, since wasn’t showing requested vacation, etc. 

Turns out, covid time room together. symptomatic, work, really hit day room together. 100% exposed never showed symptoms - attribute fully vaccinated still ardently wearing mask around non-vaccinated people. 

He mild case, according him, also made clear doesn’t plan vax “it wasn’t bad”. I’ve simply even stopped trying people. Vaccination shots specifically, bird shot... ""...but saying since beggin-""

""I SAID NOTHING COULD IT""  Oh, that's awesome. I'm new Canada, looks like I'll binge TPB now. Stupid. Stupid. Stupid. waa looking state's health department website, super unclear. There's info filing complaints sorts things specific situation. Minnesota two things going it: summer-like weather one higher vaccination rates country. surprising. elaborate that, Missouri 42.12% population partially vaccinated, 34.30% fully vaccinated less 10,000 vaccines administered last 2 days.

This unfortunate sad, especially look statistics cases deaths changed since beginning March.

Meanwhile states 50% vaccine rates, cases plummeted lowest ages 0 deaths areas.

Missouri (42.12% partial,34.30% fully): York ( 56.05% partial vax, 47.23% fully vaxxed):  shout Germany! country BioNtech developed first m-rna vaccine. Pfizer perfect partner. Thank both! Go live woods then. We've got Philly Pittsburgh 300 miles barbarian lands holds 10% population picks 60% reps.  safe hang friend us unmasked indoors? fully vaccinated hung indoors twice far nothing happened masked.

My apologies asking current situation seems volatile like things could get back horrible day due lack people taking shots. want pay less taxes  I've couple reactions it. one case, think must sensed coming something, getting flu shot came mind. completely harmless, correct first shot carries biggest risk.

The risk UK AstraZeneca vaccine blood clot observed 1:118k, specifically 1:90k first dose, 1:120k second dose. Bankrupt medical bills. Stupidity isn’t cheap would argue emotional type dangerous susceptible act violently things go way (ex : January 6th)... King County, 75% residents 16 years age older received one dose, 63% fully vaccinated.

Assuming unvaccinated includes also got one shot, point efficacy \~98%. Probably herd effects play though. Again, got number exact conversion euros dollars, bad, figure time pay hotel ten day quarantine, food, transport, $1000. tourist, find intimidating hunt cheaper test options, knowing find places would staying, go general. joke. ""Okay heart, keep beating! it!"" really understand anyone could die flu; it, easy imagine would happened it'd frailer. Wtf love sours. specifically, lambic style, sort subset type. guess understand know infected vaccinated people spread disease unvaccinated people. know people work medical facilities around who've told employees patients going required wear masks regardless vaccination status least rest year, I've also heard Pfizer requiring employees facility same. exactly inspire confidence, especially CDC's statements whether vaccine stop transmission kind tepid, i.e., heard anyone flat say ""yes confident vaccinated people spread COVID"". can't derive efficacy, two populations self selecting. comparing vaccinated vs unvaccinated. comparing people CHOSE vaccinated vs people chose be. confounding variables like risk tolerance behavior likely different. % population vaccinated? easy estimate efficacy What’s like able see sounds? State health department? Nestlé would follow suit give away water free, **MASSACHUSETTS UPDATE**

**CDC** update first dose shots:

7,158 first dose shots. Last week 14,188. 

7 day rolling avg 14,378. 15,383 yesterday. 

4,594,429 residents first doses - 65.36% (4,587,271 - 65.25% yesterday)

4,365,073 adults first doses - 77.24% (4,360,174 - 77.15% yesterday)

75.30% MA's 12+ population, (75.18% yesterday)

At rate, first dose shots:

On

June 15th - 4,781,347

**12+ population numbers (based 6,101,782 population)**

On

June 15th - 78.36%

80% 6/22

**Total population numbers (based 7,029,917 population)**

On

June 15th - 68.01%

70% 6/25

**Path 80% adults (based 5,651,189 adult population)**

On

June 15th - 80.55%

80% 6/13

**Fully vaccinated estimates**

By June 15th, estimated 4,071,871 residents (57.92%) fully vaccinated. (7 day avg: 27,182).

Notes: 

* Population uses 2020 estimates, such, percentages slightly lag CDC's 2019 population data. California bunch rural counties heavily vaccinated. some. Yup, housemate works disability took client (down syndrome) get vaccinated. Client it, freaked needle relax etc. Housemate got vaccine though eligible carer. (Australia) *Oh no...* 
*Anyway!* would love able around vaccinated people. Unfortunately, everyone opportunity. also decent sized Hispanic population work farms meat packing plants, terribly trusting government. know that's thing generally, conditions make people unable get covid vaccine? They're even attenuated virus poor enough immune system could get sick. Allergies might restrict ones available basically vaccine everybody? Lol case me. got covid even vaccine. I’m unlucky person :( advice is, look needle all. go in, answer questions, make conversation person administering shot like guy can't shut distract true kind imply people develop symptoms spreading disease?

This known long vaccine boosts immune system point fight virus better different people whose immune systems strong enough fight vaccine?

[No, boost. training, priming, preparing.

I bet know fight bear. could train it. really matter strong are, would need trained order survive. bet super strong dudes died fighting bears.

Pre-symptomatic spread different asymptomatic spread. Huge difference. **New Jersey Update**

10,555 first dose shots. Last week 24,700 first dose shots

7 day rolling average 19,810 first dose shots (21,831 yesterday) 

5.381 million NJ residents 1st dose - 60.6%

(5.37 million - 60.5% yesterday)

5.156 million 18+ 1st dose - 74.3%

(5.147 million - 74.1% yesterday)

90.2% 65+ first dose (90.2% yesterday)

4.362 million fully vaccinated - 49.1%

(4.342 million - 48.9% yesterday)

At rate, first dose shots reach percentages on

**Total Population Numbers(60.6% Now)**

65% - 6/22 (6/20 yesterday)

70% - 7/15 (7/10 yesterday)

75% - 8/6 (7/31 yesterday)

**18+ Numbers (74.3% Now)**

75% - 6/6 (6/5 yesterday)

80% - 6/29 (6/27 yesterday)

85% - 7/23 (7/18 yesterday)

**65+ Numbers (90.2% Now)**

95% - 7/21 (7/17 yesterday)

**NJ case count**

7 day average 256 

272 - yesterday 

448 - 1 week ago (42% decrease)

1383 - 4 weeks ago (81% decrease)

*percents based 2010 census percent estimates 4-5 % lower values listed using 2020 census numbers 

Noticeable downward trend last days. Hopefully it’s partially holiday weekend rebounds latter half week. suspect part peaked week ago initial rush 12+ also part due Memorial Day. honestly thought gay pride group. think ever argued otherwise regarding relative risk. matter practicality.

I'd rather walk field 80% safe, 20% clearly labeled danger zones, field 95% safe held completely unlabeled land mines. everyone? Doubt typo hear lot living Ontario, believe trailer park boys started way back whem Sucks want vaccine, can't get medical reasons... I'd bet real world breakthrough infections common clinical trials suggest.

You consider even people took virus seriously start resuming normal life getting fully vaccinated. Even people know isolated year started hanging friends, going restaurants vaccinated. 

Real life like clinical trials blind 50-50 chance getting placebo therefore can't really start living differently. post r/MapsWithoutHawaii . Get Extra Strength Tylenol case get fever day Covid vaccine shot.  know fully approved. 

Honestly, I'd love see insurance companies cover covid hospitalizations people vaccine (unless medical condition something). I'm sat watching US pissed hell. I'm 29, I'm actually allowed get vaccine yet. Whereas twatbags USA available every adult turning turning up? Fekk people. clearly want badly. Hannibal Lecter. much longer. may updated week, per time stamp: ""Posted: June 2, 2021 8:16 PM ET"" effective give 1 dose 60% people give two doses 30% Shhh, shh... *they* get *their* free beer, free donut entry lottery. ***/s***  ill allow nearly 2 Billion worldwide! Fully believe thousands people states like Florida would alive they'd done same. got interested going back news compare response fascinating people try burn anything fReeDOm...*eagle cry* disagree headline. one strain SARS-CoV-2, fast-moving beast.

If accurate, would used ""variant"".   state state worldometers right? I've gotten arguments bunch idiots maybe around December this. tried tell said something first mean that's keep doing....as got new information he'd tell us better things do. NO, contradict whatever says trump tucker asshats told it'll mean they're tough oppose ""weak"" libs....and thus got 500,000 dead. Dumb AF. extremely suggestive aerosols play important role flu transmission. 

You probably still want wash hands mindful good ventilation probably better flu prevention.  don’t think rich people volunteer get vaccine lol  never know, I'm mindset said ""Hey everyone, really using better masks"" ton people would go ""see, masks worthless"" wear nothing. people ""love"" CDC probably independent research buying KN95 is. Agree disagree public reaction guess. So...is speculation, everyone wondering things like that?

I saw snippets emails, sounded like responses disgruntled employee who's constantly stepped allowed job properly. could also see face he'd trump administration tv vs biden's. Beaten vs. active hopeful. correct though can’t say you’ve never contact covid. absolutely cannot make assumption unless live bunker haven’t met anyone 2 ish years. option choose door. reality go one them. argument covid isn’t issue still selfish. don’t get vaccine you, it’s fir everyone else well since get covid without symptoms, never know it, still pass someone else. Dude’s conservative troll. Ignore him. Lol next time admit you’re irrationally afraid covid even taking amazingly effective vaccine. falling allergy excuse Probably involves ""underage women"" a/k/a girls. using AstraZeneca various vaccines? I've tried ""Schadenfreude"" ""Bazillion"" reading Trump rally I'm sure. authoritarianism bit we?   certain part population, yes, people love CDC would follow whatever said. think messed saying cloth masks ""good enough"" regular people need anything that. could least recommended people wear better masks protection choose so. 

I mean pretty much Fauci back January said people could wear two masks protection. would gone straight recommending N95s/KN95s instead idea wearing two masks kind silly dumb, opinion. Absolutely. Great plan. place people firearms.
 
I think fantastic idea.

🙄   exactly needs shouted. doubters naysayers hurting now. stats need show scream hear. educated people? really understand get brainwashed like education access internet.

That's SUPER shitty, though. church spreading misinformation COVID? like we're talking abortion... Pretty much opposite anti-vaxxer here.

