,date,text
0,2021-03-04," Yeah according website says it’s phase 2 trials already. I'm totally board mask mandates long takes though take toll people mentally. distanced lunch new co-workers first time realized working months without ever seeing faces. “Study shows healthiest group people planet didn’t get sick got covid” 

Thanks guys Well also didn’t millions millions vaccines lmao hardship! true? hide it? serious illness it’s disgusting downplayed mocked flu. hope keep improving. wow. fukin guy... No, wrong. confusing export ban contract. export ban government unilaterally bans exports. place UK - UK government negotiated right buy first 100 million doses AstraZeneca; nobody forced anything country doses seized. isn’t good news want go back normal, tried last summer didn’t go well way months! There’s 200 Million adults living here! Maybe April you’ll get appt submission linking yahoo.com automatically removed source may reliable may dedicated mostly political coverage. possible, please re-submit link reliable non-political source, reliable news organization recognized institution.

Thank helping us keep information /r/Coronavirus reliable!


*I bot, action performed automatically. Please [contact moderators subreddit](/message/compose/?to=/r/Coronavirus) questions concerns.* article two weeks ago.

3.5 weeks. basically eternity ago comes vaccine availability projections. person gets sick responsibility protect themselves. Makes sense. /s What? can’t believe actually agree article Reason. going crazy? gotten vax? I’ve also seen reports people said cured covid long symptoms. interesting graph: 

Shows deaths vaccination status. thing can't imagine shit can't imagine shit either upvotes determine factuality articles now?
If popularly believed, true, implying. means covid really hoax enough people believe true. Republican man bad do, store kick want people assholes. serious?? Subsidize leafy greens instead grains corn.

I want cheaper broccoli. Sounds like 3 week gap got ovet COVID got first shot.

If get shot did, eligible probably another two months. UK government bought UK production. EU bought EU production seizing EU production buy. good metric... 50/100k accept flu year iirc. rate vaccine distribution going, likely I'll vaccinated well ahead friends due job. I'm planning eat outdoors myself, simultaneously questioning whether even ""necessary,"" since dining ""necessary."" United States respond things restraint. It’s one extreme other. Nothing ever middle. 20s think id say J&amp;J. chances serious outcome covid already low chance cold high. Without data back up, assume J&amp;J going knock either get infected symptoms. I’d prefer J&amp;J want go pharmacy once. Couple things differentiate TX MS:

1. CT significantly better vaccines two states: 21.4% gotten least one shot vs. 14.2 Texas 15 Mississippi.
2. take effect two weeks whereas TX MS rolled things back immediately. We're point two weeks make huge difference.
3. They're lifting mask mandate. Whether think early order operations correct, business restrictions costly mask mandates removed first.
4. Fewer essential workers eligible vaccine right TX MS CT

That said worth precise criticisms people got skis trashing TX MS yesterday. real issue repealing mask mandate. I'm sure there's case restrictions businesses really suffering half 65+ gotten least one shot we've seen increasing evidence one shot Pfizer/Moderna effective. Biden CDC set clear date that's realistic (i.e. June 1, ""the fall"") states lift restrictions going continue happen states across political spectrum. fellow citizens duty protect themselves. Got it. serious cases deaths going down, slowly. Ah didn’t see this. Thanks!  Moderna given two shots J&amp;J one shot. J&amp;J slightly lower efficacy preventing illness though may due trials performed. excellent preventing hospitalization death. find good data comparing side effects. Italy one single shipment UK everything AZ produced UK since beginning.

That's true - doses UK received bought UK, bought countries seized. last month. great, crowd seemed everyone complying mask rules. get people give hard time. Yeah, gotta make sure everybody's safe. Sadly, probably wearing mask rest life. awesome. discounting Aussie response COVID great. vaccine greater urgency countries wrecked havoc. Otherwise virus continue mutate new variants could potentially negate vaccines long drawn war. sad way view future... feel sorry friendly. type mentality incredibly unhealthy. Reality is, people like get left behind. people change attitude quickly faced medical consequences. I've lost hair 80 pounds tell experience multifaceted issue, especially United States.

For personally, coping mechanism anything leads addiction. Sad=eat, happy=eat, lonely=eat friends=eat. think case lot people food becomes comforting necessarily thinking negative effects health. 

There's also issue lack education behind nutrition healthy eating habits US. Cereal breakfast, takeout lunch carb-rich processed foods dinner semblance portion control found. kind thing taught schools aside anecdotal recollection food pyramid 2nd grade probably standard many parts US. There's steep learning curve overweight/obese US starting get healthy changes entire perception nutrition, caloric intake portion control.

There's plethora reasons obesity rampant fad diets, diet burnout, able understand can't out-exercise bad diet digress. Actually comment removed months, think I've ever posted r/conspiracy, got autocorrected convenience convince I'm mobile. sure I'm bad guy. 

You study adapt open social media, that's admission. compare apples oranges mean use tools eat them(unless peel oranges). 

Your assumption I'm disaffected right wing nut job conspiracy land telling. Hard imagine someone agrees pandemic could disagree methods, yeah? 

Obviously I'm saying obtuse still responding. Hyper literalist insist being. Ok paper manipulation title, guiding public discussion forums can't described manipulation? I'm sure tracks. 

If place open attitude two unmentionable subs cesspits. people could exposed reality would temper extremism, cure it. 

Reddit moderation nothing like influencing academic discussion groups. be. Unless society suddenly develops social skills taught elite university programs, going leave lot people behind. Imagine like this. Don’t like this.  reason never nuanced conversation sub ground rules, agreed upon truth. Quotations medical professionals, public health experts, official CDC opinions mean nothing judged unpopular. opinion random layperson valid CDCs bunch doctors. even valid appeal popular sentiments sub doctors say something unpopular. Remember gem? 

Georgia’s Experiment Human months absolutely nothing happened Texas, one ever stop think maybe wrong. drives nuts most. never going stuck like forever, take time end. true. least time vaccines rush things unlike 1918. Moderna I’m thinking well. feel nervous second shot side effects beats getting covid. bother?

So get covid... *Just wait two weeks!* would recommend incredibly careful tracking calories. there's medical issues simple science. can't magically gain weight calories allow they're cautious, they're unintentionally sending message vaccinating fifth American adults matter, talking vaccination campaign matter. dangerous. sending message vaccines. contributing way imagine they're intending to.

It's crazy really seems like *you* one sending message. Wtf. US placed export bans vaccine contracts signed. UK also blocking AZ exports. part mesmerized fascination levels crazy extremes one blossom america without stopped judged. (like TV preachers have, simply feasable France)

You Marine Le Pen need enough protect people working quarantines, airports, shipping ports, etc. etc. 

Otherwise get hand we'll another giant block people need vaccines. Considering barely vaccined 2 million people today, I'm gonna call bullshit one. two weeks second pfizer im getting airbnb vaccinated friends feel 0% bad welcomed TSA open arms.

Still can't bring liquids certain size someone brought liquid-based bomb flight years ago people don’t trust try even harder convince something usually isn’t strategy get thing. Masks important vital even vaccinations, now. UK bought UK production, EU buy EU production - Australia bought too. Vaccinations *are* leading people ignore restrictions, hardly imaginary worry. choice, wasn’t depriving anyone else knowingly, would absolutely go Moderna. Higher efficacy mild/moderate COVID J&amp;J good deal real-world use already. 

Both reduce chance hospitalization/death near zero, though, definitely don’t disappointed don’t get one want. probably mostly immune going die next 10 years anyway. Let grandma hang friends Give cattle prods please. It’s shooting someone.

Not fucking isn't. even close. fucking ridiculous take. Fully accepting WFH least hyrid schedule 100% good with. hate working office, like socializing co-workers anyway WFH allows (or would allow normal times) time see socialize friends, aka people actually like socialize around. part ""new normal"" I'd 100% good with.

That said, rest absolutely sucks. Masks forever, restaurants, seeing friends lol. That's hell. Chicago? June? I'm sure anyone would even take money right now. article two weeks ago. pull quote weddings, talks industries well.  Fyfe, founder CEO Paramount Events Chicago, large caterer staff  more 500 people, says “I won’t even sign contract  200-person wedding early summer. confidence  it  can happen.” UK blocked AZ vaccine exports UK EU. AZ confirmed this. US blocked exports contracts signed surprise increase close number vaccines shipped J&amp;J week (4 Million). Introducing brand new vaccine liable introduce lag time states figure how/where use it, etc.

Optimistic much easier give burn backlog quickly catch up! forget India, SII massive inspected order export vaccine EU. Well, bad flu year yes. see 60,000 covid deaths every year + 1:10 year flu season (roughly - based last 10 years US flu seasons). Well said. sub really needs nuance. Also:

3. Mask mandates last restrictions remove.

Masks make huge difference preventing spread aren’t causing developmental, social, economic harm like restrictions are. Actually anything masks economic benefits. would avoiding businesses much possible right going around unmasked strangers. That’s awesome, would love case Cobonavirus Israel (which religious comparable US), 94% 70-79 year olds got it. Tbf restrictions 1918 flu last nearly long. cases implemented multiple times, typically lasted 2-3 weeks. UFC trying book fight Texas now, take long.  Good info still points obesity issue. people never left normal. huge chunk people kept going bars restaurants. whole bunch don’t think masks work. 2/3s country back normal summer, whether it’s good idea not. give get first shot get second shot also deaths/million. lockdowns restrictions worked would expect countries/states lockdowns&amp;restrictions lowest deaths/million. Instead many restrictions many deaths, restrictions deaths, ..... color depended Republicans election cycle. UK hand blocked AZ exporting vaccines produced UK This.

I want ""new normal"" allows fully accepted WFH least hybrid schedule accepted. works since hate working office, plus like socializing co-workers anyway, WFH would allow spend time friends people actually like socialize with.

However like anything else ""new normal"" would entail, especially anything pertains socializing store/capacity limits. Absolutely not. Legally speaking hospital cannot stop leaving immediately, deny second shot you’ve left premises. went grandparents they’ve waited car standing outside case something happens. benchmark ""new cases need eliminated"" comes from. people say Illinois Department Public Health's website state's current policy, one point updated statement governor contradicted yet.

In fairness governor, original DPH guidance, admirable set actual standard, incredibly poorly written. surprise 1 prongs satisfied 3 months another satisfied 2(?) state reopened. standards particularly logical start with. wonder written genius fucked Fair Tax Amendment language. works fine See, argument makes way sense. concrete problem, concrete policy view, willing stand it.

At point, simple disagreement policies would provide greatest good greatest number, that's conversation have, use evidence help sift through, compromise on.

My problem bigger, fictional, idea large group people never want open up. fictional, can't actually conversation imagines 'other' something not. promotes division, kind division cannot overcome compromise mis-imagines others want.

Let say hope restrictions modified sensible way helps get back work protecting still need transition back normal. helps think it, really politicians anyway. Individuals businesses largely drives response, individuals driven physical reality virus. want know normal coming, look politicians, look numbers. answer question yourself, promise. count least half dozen states started dropping restrictions within day other. It’s happening folks... Hint: wouldn’t. UK helped fund \[not research but\] production facilities upgrades

I've read several times now. reason doubt it, information production facilities funded UK government, much paid?  fucking guy advocating nuanced look reality! Get him! mean, know articles say, grandma hears stuff thinks we'll never able visit again. People scared they're stuck half-life forever, clearly agree that's true. People anywhere near assured enough there's end sight, that's original article talking about. domino effect happening holy shit! still banning govener mansion? Yeah dude. Like reading way much “terror threat” level. 

Also didn’t help belt way sniper happened right around year 9/11 jump started whole thing again. serious here? realize much angst cause people already think opinions science match corporate desires? There's already fear certain scientists papers censored telling things certain people government want hear fund corporate donors. fear justify permabanning people might opinion like? would mods microscopes already accusations suppressing articles want add accusations? Especially right turning corner getting point restrictions eased up, especially masks.

And censor first place? heard, especially something add? understand assholes (and no, doubting mask effectiveness government mandate automatically make asshole), respectful it, allowed discuss views alongside everyone else? Makes sense, especially now! Two months recovery though confusing go away within minutes said another comment thought pillows strange know confusion lasted minute most. Bravo! Ah, someone unclear difference 90% protection 70% protection? felt like screaming void bringing things like positivity rate cases going last week. vaccine man? India using soda water Chinese vaccines Calling now: massive screaming match and/or fist fight next week. hell getting many downvotes? everyone eager “open up” completely forgot situation first place?  agree, also please stop saying individuals go back normal second receive first shot! go back normal whole soon large portion population received *both doses waited appropriate amount time full immunity*. article even notes 4th July reasonable target, advocates wearing masks distancing vaccination everybody complete.

Unfortunately, people want hear that. Yes, end sight, yet. Even enough vaccine (in US) adults end April, realistically going end May everybody actually get *first* dose, means end June reach peak immunity.

All asking continue wearing masks public time. whatever activities want! vaccinated, hang vaccinated friends family much want! please continue wearing masks public everybody (who going to) protected. People acting like biggest inconvenience could possibly imagine ruining life. Que redditor thinking ""My (intert subgroup) deserved front line"".  Mine Impractical Jokers movie!  That’s it? skipping one day 80 exactly skipping one day 18, time-wise. sounds great, miss gym much! Covid lend martial arts training...Best wishes ♥️ government source that? This. article title misleading. Superbowl official events ot superspreader. events associated were. numbers went up. surprise. live Tampa Bay. dark day humanity seeing people celebrating. fact football game held deadliest pandemic history encouraged events, led cases, led hospitalizations, led death, families hurt. would respect NFL said, ""You know what. Let's skip game year."" though? think public collectively decide mask wearing health officials give ""all clear"", likely never happen. public declares unofficial end pandemic differ region (and prevailing political orientation). 9 10 fact. lie. logic flawed =/

I'm admitting even need fact 9 10 people died Covid 19 lived 50% overweight countries. 

Even stated, countries west overweight, 9 10 becomes kind irrelevant data. can't miss fact (IF ALL) WESTERN COUNTRIES OVERWEIGHT, 90% Covid 19 deaths happened countries. 

Is directly related obesity? can't know. researchers clearly stated can't know. reliable correlation obesity Covid 19 deaths? confirm. 

If read paper, see exactly approach researchers: **all** deaths result overweight? can't tell. overweight correlated Covid 19? YES. **What it?** 

Really, could saved half lives lost Covid 19 simply food, diet, exercise sunlight, we? feel reply helping anyone. Feel like cases wrong metric basing of, no? talking about? EU sell Australia? Astrazeneca delivering vaccines payed seems able export places European factories? Fuck that. noooo problem allergies sinuses last year, might wear mask outside bad allergy days. nose tell so.  see. understand agree would good leadership. think polarization issue preventing people finding sensible middle. friend doozy case Covid Arm -- rash way arm several days. fine, second dose -- hopefully happen again.

But info anecdote. Thank you. Ohio's hospitalizations going drop 1000 first time months tomorrow probably :D [Figure 2 - symptom onset (+5 days infection) drops almost completely around day 1 - viral load positive tests (+??? days infection) drops 75% around days That's B.1.1.7 could different delays infection day.

Those pfizer. [Moderna near identical - also figure different, around 15 days symptom onset ~10 days infection - figure seen comparable data AZ.  California still mask mandate 5 years now. ignored everyone outside Bay area. original order November makes little sense, know outdoor transmission relatively low walking outside people tens feet away pretty safe. message ""wear mask, time, exceptions"" simpler gets desired results

Every known-to-be-dumb policy put place makes people trust rest policies less. I'm wrong contract referring contract. EU also funded production ramp up, gave AZ EUR 340M UPFRONT make sure doses could delivered agreed upon. 

What say Pfizer entirely hypothetical. says UK government demand everything produced Pfizer within UK must go towards servicing UK contract?

Meanwhile, far know, UK receiving Pfizer allocation EU plants. much export bans, hey? articles talk permanent psychological changes people go, people angry sub mean want things open up.

So...if things open relatively soon, think differently 10 years...does anyone problem? feels like nonsense argument having.

Like, problem tech people work remotely couple days week on? climate scientist, let first say ""Oh no!"" third month still suffering...looked pillows day amazed them, first know realised thought cool was, covering thought duvet cool cuddling me. post appears vaccines, please see [our answers frequently asked questions regarding COVID-19 vaccines. comment containing misinformation removed user potentially banned.


*I bot, action performed automatically. Please [contact moderators subreddit](/message/compose/?to=/r/Coronavirus) questions concerns.* says that, created ""a perfect storm"" diseases wildlife spill humans spread quickly around world, scientists encroachment natural world speeds process. outlook comes global health experts study new diseases last 20 years, we've six significant threats - SARS, MERS, Ebola, avian influenza swine flu,"" Prof Matthew Baylis University Liverpool told BBC News. ""We dodged five bullets sixth got last pandemic going face, need looking closely wildlife disease.""

I recommend read whole article, however obviously don’t care mask. Hell people advised even eat eggs easy. 2million times! don't. We're hurting bad leadership information. spent whole time fighting culture war instead informing people. I've also done un air conditioned UPS facility jeans long sleeve. legitimately felt like dying due stifling heat absurd humidity. would like two things:

* 1) Stop saying can't go back normal vaccines

* 2) Stop pretending ~20% population first shot means whatever fuck want immediately. 

The reality neither extreme. go back normal, eventually. Getting vaccinated good thing increases amount things low risk. still need show caution moving forward, risks manage proactively. Seeing mask subway mean we're ""back normal"". 

I'm tired seeing ""we can't go back normal"" I'm tired seeing ""I'm totally done matter Spring, mask, distancing, nothing"". sides need grow up, nuanced reality. Roughly 60,000 (in US) - equivalent bad flu year. 

The thing is, keep using ‘lives lost’ metric that’s entire story. 

We really looking *excess lives lost* - lives lost vs expected lives lost end day ... **most people dying end lives anyways. end day, old people die**. 

If covid still killing 60,000 healthy 20,30,40 year olds year ... yeah, say continue mask wearing. number ‘lives lost’ still heavily skewed towards elderly 60,000 year acceptable number eyes. Similar accept flu. anyone data 3 vaccines efficacy vs original strain, UK, SA, Brazil? I'm saying open up, I'm saying needs encouraging vaccines develop goals based vaccination transmission numbers reopening. really right now, he's downplaying importance vaccines sending inconsistent messages importance different health measures. lost 50 70% income last year, ruined years therapy, lost girlfriend learning shit course half assed zoom lectures. can't take four, six eight months this, overzealous politicians went fanatic zero covid plan. almost entire europe, life less free one year ago. feel absolutely transition taking place starting. straw man, several ghastly plans potentially semi permanent vaccine passports already discussed. would fine answer government set actual standards actual policy. year they've winging decide restrictions get enacted lifted. 

The lack clearly defined policy enacted via proper channels failure every level government. point needs free that's get vaccines arms fastest 65+ done risk factors death go extremely far. batshit insane. Unfortunately, think lot public health people think way. could talk experts; turns actually bag boys, access incredible range resources. Everyone working COVID COVID related policies Biden administration already elected. Many people roles working institutions, top entire academic community public health epidemiology research -- often cities Governors sit. got vaccine upstate NY, got PS5 3070. Best Buy best queue system. use vaccinations. Abbot's move, right wrong, definitely got discussion kicked high gear. suspect we'll hear lot exit plans coming days put health line enter vaccine trial. I’m weak mean, yeah doubt messaging shitty also Governors states. Elk Lodge's Chapter President making Facebook rants masks telling 6 people show wear them.

They direct access White House staff I'm sure even president. know vaccine distribution going allow everyone wants get vaccine May. know vaccines seriously reduce necessity wearing masks. 

They also know small portion population vaccinated measures likely increase level spread.  political decision. example article 10 upvotes talking rules still effect vaccines barely fully distributed.

This I'm talking about. discussion sub become pretty trash. comment excellent example people talking past other. literally one behavior one problem with. people businesses behave point them, may feel 'normal' time since things open, that's ok too. good know! last week go vet clinic guy came pick something mask on, chatted reception bit like, ""I'm fully vaccinated, mind take off?"" like sure! know technically everyone safe still felt weird like change subject... assume means know wrong regarding contract.

The UK helped fund research production facilities upgrades, return facilities supply EU first. vaccine ban.

If Pfizer opened factory UK produce Vaccines UK export fine. cannot call vaccine ban vaccines exported. hospital 9 days.

But hospital heard conversations part filled blanks crazy thoughts going on. honestly thought military spies cheating husbands nurse daughter truly believed ignoring later realised me. Two months released saw one presents 12 year old sons birthday 7th March...I stood started removing wrapping handed box showing sketchers shoes.my wife looked asked , told forgot give present.
..only tell birthday two weeks away time.

Multiple things happened often now, maybe three times week. agree, pretty misleading people want eat restaurant go date without masks put headlines like that. I’ll using air-miles airline status expires. Sending overseas diplomacy Fully vaccinated wear mask stores outside. still mandated state safe. many people around neighborhood definitely vaccinated wearing masks. people vaccinated I'll probably stop wearing outside. also hung maskless friends inside nice return normality  feel reaching. I'll grant give specifics right point out, think able agree opening 15% vaccinated unwise. 

