,date,text
[Vaccine FAQ Part FAQ Part appointment bot, action performed automatically. Please [contact moderators subreddit](/message/compose/?to=/r/Coronavirus) questions concerns.* Masks make growing hair electrolysis lot easier too. thought we're certain vaccinated people less infectious unlikely event infected. Australians aren’t allowed leave country citizens coming back it’s complicated. unaware what’s happening there. Look up, it’s intriguing. Many citizens stranded abroad year now. vaccinated doesn’t make different all, anytime soon. 🙌🙌🙌  guess assumed airborne cause thought that’s droplets were? Eh. 99%+ chance totally fine predictable actually. Tons young adults haven’t given shit since pandemic started. wear mask anyway. Ur welcome. borders probably. longer 3 months! Well Gottleib saying saw two doctors CNN say thing. Fauci said time start thinking Week.   swab test 2 days ago maybe 1 hour taking swab test noticed streaks blood mucus try spit out. tried observe today still blood. chronic sinusitis, possible swab test caused infection? I'm 20s UK I'm looking getting first dose July :(

And second dose around October 

We're even going slowly, nearly every single person wants vaccine. Nope. Fuck that. We’re done. Wear mask want. second try force others who’ve vaccinated case numbers low are... fuck right off.  even really exaggeration. plan deliver 70 million doses Q2. end Q2 still need deliver 200 million doses existing contract. Assuming keep 70 million doses per quarter finish contract somewhere Q1 2022. Sure one assume speed deliveries hand EU countries plan everybody vaccinated latest September. vaccine availability already issue anymore that. lot existing AZ contract delivered longer needed EU. order more? blame you. protected. unlikely transmit. courtesy others point may vaccinated still actually worry catching it, keep others give care people check compliance. They're probably half-assing too, least mask offering protection none all. Seems like vaccine resisintat then. hope. Well guess doesn’t matter don’t live western countries. First beat old East Asians, suppose anyone looks brown next. company willing give domestic production UK go. they'd partnered company based somewhere subsequently decided implement export controls (e.g. US), there'd thousands dead UK right now. Aus originally went AZ ordered 5million doses Pfizer (For health care workers, border staff old age care).

Since blood clot issue became apparent ATAGI (EMA equivalent Aus) restricted AZ 50's .

Since Aus produces AZ locally (now 1million doses week) actually surplus AZ 4million doses produced ~2.2 million administered, decision made open AZ appointments 50's wanted selective appointments 50 start new larger Pfizer order started arrive. increase physical isolation social isolation among respondents COVID-19 social distancing policies. However, respondents experienced change digital isolation loneliness. increase physical isolation present people high COVID-19 concern whereas people low concern experienced change physical isolation. suspect natural immunity much higher many people think. college student, know many peers get tested inferred caught covid, even including asymptomatic. Even likely overlap, probably won’t need full 70% vaccinated reach herd immunity, considering natural immunity robust vaccine stop reinfections. Case numbers lower they’ve since beginning pandemic, we’re zero risk new wave overwhelming healthcare systems. point enough enough? first symptoms started showing 16 hours shot (second dose)

but varies everyone parts country, supply vaccines exceeded demand. couple weeks, everyone wants vaccine given opportunity get one, REALLY need get away caring who’s vaccinated who’s move towards “take care shit. Wear mask want don’t. It’s health.” Luck practice. lucky low amount cases early on, could quarantine international arrivals. large wave one state solved expensive (17 week) lockdown. states bit scared let short lock downs (about 3 days) one case. federal government also gave income support many people work. stand want take respect that, please respectful someone else continues bit longer. chronic illness fought tooth nail get health back past 5 years. I'll unmasking fall earliest, maybe winter. continue mask stores. keep mask much cold mask. agree. Completely pro-mask. hot really don’t like it. everyone ACCESS vaccine, whether avail not, I’m done it. won’t protect via vaccine, accepted risk virus. wish they’d vaccinate? YES. make choice. vaccine free, widely available, easy access. county 75% adults (16+) vaccinated first dose. Almost there. hope enough vaccinated protect can’t, won’t, get vaccine. I’m ready return normal, live music, gatherings, restaurants bars... Duh. Brazil's struggling vaccinate pretty much population general. dad's bit 60, got 1st shot days ago. I'm 42, knows I'll get jab. ;-( Yep, walked family local restaurant yesterday eliminated restrictions, immediately turned around walked went another restaurant. normally spend around $80-90 meal place, won’t go back. country gave nuance subtlety long time ago. like every single issue. What’s latest status vaccines available kids 12+ US? 

I thought FDA approval supposed happen last week…. Washington Post number, that’s total shots given, I’m sure out-of-state individuals. state us little 4.4 million, approximately 64% (using 6.9 million number) approximately 61% (using 7.17 number). state says 4.7 million 70% threshold, calculation, total adult eligibility 6.7 million we’re currently 66%. Israel run massive supply snafu Pfizer refusing give more? wrong metric. Every legitimate source CT 57% (which close best country). Unsure math behind 70%. key word register. can't actually give date get vaccinated yet believe. No. fucking isn't, incredibly telling traumatic year everyone, especially youngest done everything could, got shots second could I’m just... done.

Same here. 13 months never leaving house except go grocery shopping hiking woods (and religiously wearing mask did), fully vaccinated month now, continued moderately cautious getting vaccinated give everyone else chance get theirs. anyone wants vaccine get one day without appointment, I'm done. Pfizer reported sign decline 6 months, youre actually probably wrong last part

""However, get second dose vaccine, you’re training immune system,” said Boslett. You’re strengthening response antibody-producing B cells you’re also activating memory cells stick around much longer.” Getting doses vaccine means body shown spike protein multiple times short duration. “So immune response might bigger, better longer lasting getting infection one time,” said.""

from last year day coming. applications process anti-vaxxers lose disingenuous excuse. wouldn’t. 

I keep seeing thing people like “just say don’t wear mask socially distance anymore get vaccinated” cause people go get it. Maybe people would, let’s honest reaching point want could gotten point getting soon anyway. don’t want tend never really cared Covid/mask wearing first place. 

All that’s going basically make everything return normal spot. outdoor masking restriction changed, one read “fully vaccinated” read “no masks outside” stopped there. fair, never knew rule outside large groups around people. people read “no masks”. going enforce that? Vaccine passports? already know people faking shit. 

Those don’t want it, don’t care, probably never never will.

So goal return normal, yeah say that, it’s get people vaccinated, don’t see work. extraordinarily rare brave throughout all. Well done. Wearing mask traumatic . evidence vaccine might prevent infection reduce symptom severity given immediately exposure. Note Covid research, diseases. Basically, post-exposure vaccination ""race"" virus vaccine. diseases long incubation periods, like rabies, vaccine effective. Covid average incubation period 8 days according recent research know trial volunteers saw evidence efficacy 11 days take incubation period account protection earlier that. good chance reducing symptoms severity, probably infection prevention. im honestly curious different things would pilgrims forced wear masks since know outdoor transmission extremely unlikely, especially masks on. soon fully vaccinated. Maybe year so.

You *probably* many antibodies vaccination would take really huge exposure enough virus get make far past antibody immunity. Blows away sitting millions vaccines. agree, weeks. However states open weeks already masks distancing vaccine wasn’t even available adults wanted it. Hell made first shot available adults weeks ago, even adults (like myself) really jumped opportunity went day available them, still haven’t second shot (mine scheduled Wednesday). Pfizer. Sore arm, could barely lift straight way head. Absolutely side effects though. that’d great idea kids also permitted vaccinated. Unfortunately won’t  It’s pretty unlikely side effects hit quickly. Also, people claim “my allergies went away masks.” don’t think that’s seasonal allergies work. I’m pretty sure allergens pretty easily penetrate get cloth/medical mask, also get home much open window. thats part it, runs deeper that. apparently theyve similar panics side effects past, japanese government also stopped making vaccines mandatory would legally responsible side effects didnt want deal Get get hug, pint, shag Well states lockdown india including mine. one petty thing learned pandemic much hate menus phone. even dinned anywhere, ordering takeout, like paper menus much more. depends case. times, vaccine prevent feeling symptoms young healthy. cases outbreaks vaccinated nursing homes, vaccinated elderly patients (who otherwise would've severe cases) instead asymptomatic light flu-like symptoms. course sadly rare instances vaccinated people getting severe cases Covid. plenty people think rightly wrongly COVID nuiscance go ways vaccine think they'll things. thanks. probably go this, though phrase wear ""if anyone unvaccinated would like wear it,"" rather making assert they're emotionally uncomfortable something i'm doing. 

it going bit strange regardless. there's pushback CDC relaxing guidelines vaccinated people (like sister saying vaccinated people wear masks outdoors recently) get purely emotional level, since living way long behaviors feel safe, regardless they're actually safe.  literally used words ok lol. Maybe read lines understand didn’t mean people take words face value. someone expert makes quote media hot topic choose words carefully. far understood media, large plants mostly packaging individual vials, actual vaccines created large quantities small labs, plant Marburg gets actual vaccine delivered bulk BioNTech headquarters Mainz.

I assume vaccine packaged Fosun plant come BioNTech lab Singapore. doubt BionTech hand production actual vaccine Chinese companies, would go everything Merkel telling ihrer Wortmeldung sagte Merkel Freitag, dass es niemand wollen könne, wenn China die moderne, im Westen von Biontech und Moderna entwickelte mRNA-Technik think better go proper safety testing first approving vaccine youngsters. would pretty bad vaccine hesitancy got child-specific risk popping couple months vaccination age group, caught expedited testing. 

The regulatory agencies know doing. let job; vaccination younger age groups come soon enough. Meanwhile, adult gets vaccine one fewer person liable pass child can't vaccinated yet! poorly ventilated space. interesting translated word “Olympics” picture, translate back English becomes “five rings” honestly, what? Statistically, doesn’t much them, rest population already vaccinated what’s big issue? I’d love see science concerns look at, say Israel, seems issue whatsoever. I’ve vaccinated month, longer wear mask indoors, zero issues. people don’t want mask makes idiots? Maybe worry yourself. Canada’s vaccine rollout embarrassing Wait, whole time conservatives liberal liberals conservative? Kids summer camp age can't even get vaccinated point. Source: oversee summer camps read guidelines daily basis  love Olympics much, try win vaccinating? I’ve seeing people come without mask.

Around strictly enforce ""you must wear mask wait line outside enter restaurant"" rule. instant sit table everyone takes mask leaves entire time there. put leave, walk 20 feet table door. could design ""not based sort science"" policy tried. fan experts general Dr. Wen generally sensible one. think fear mongering, saying may resurgence enough people get vaxxed. take stats class sometime  say thinks start again. talking possibilities. Scientists would foolish deny real possibilities escape variants emerging large levels spread/mutation opportunities still emerging. RNA vaccines likely hold strong time idea long. AZ already drastically reduced effectiveness SA variant example. legit concerns deny layfolk can't handle contemplating possibilities, even unlikely, would insanely foolish.

This fear mongering. science. can't handle discerning two stick profession vaccinated yet? maybe read article assume talking world lol whole family vaccinated, except 16-month-old son right pandemic hit. struggled infertility years him. stuck inside get vaccinated one slight health issue doctors concerned Covid. whenever want go anywhere, see mom inlaws watch him, nightmare 2 people pick since friends nearby get vaccinated. can't wait take places, seems like wait next year turns 2. mental health taken dive bring another child world. Living Florida help. cases lower, doctors would feel better taking out. also help area one wears mask. Hardly ever begin with. Re-read article 10k variants. wasn’t 10k one day. Australia overseas still challenging. caps numbers passengers coming Australian airports overseas. working hard get many Australians home possible. overseas wish come home, prepared delays disruptions travel.

Sounds reasonable? Lmao must live Florida. honestly wearing mask outdoors fucking brutal Florida Disney to. youngest 5 higher risk, I'm eager get vaccinated. Unfortunately area barely cracked 30% vaccinated, transmission rates high and, pediatrician told seeing tons kids come covid wait bit longer venture out. almost put money Biden making big announcement Friday going 4th July weekend stop social distancing masking public fully vaccinated

Still hoping happens Friday going Memorial Day weekend instead. current rate vaccine decline, 5 weeks difference two dates likely going get us additional 1% vaccinated. many currently vaccinated start getting booster shots Sept / Oct, hopefully keep Fall increases minimum. lockdown allowed ive always wanted do: absolutely nothing Even people ""believe"" science hate masks. wear alternative COVID widespread control worse. know single person actually *enjoys* wearing masks. ask brand new card filled out. 10 covid variant cases since March. one day. I’m getting tired mismessaging too. wife works ER Florida COVID basically thing anymore there. Ultimately, that's still harnessing regressive religious ideology. say people manipulated actually follow text intention religion, unification religious ideology (even name) still fallout religion problem.  reported 12,000 covid cases. country. forced. Got it. 6,000 people small sample lol. study, especially surveys, prone inaccuracy, want clear, representative sample 6,000 people pretty good they'd wait 50s? interesting move. simply speculation, two supervisors elderly Japanese people one get coronavirus vaccine (US) recently wanted wait data Japan. Apparently, may anecdotal (I found one thing quick Japan HPV search), increase serious side-effects HPV vaccine released. caused lot skepticism around safety vaccines lot Japanese citizens, according her. HPV vaccine moratorium placed research done. seven get negative test result. also believe 14 days actually switched 10 days test result needed point. realized ""2020"" games gonna take place late july, japan cancel them, clocks ticking makes think 100% committed go matter intense protests get. hopefully gonna shitshow given whats happened india massive religious festivals, im holding hope mean Florida right middle pack terms people vaccinated? people even look data, lol?  officials say ""well we'd like follow CDC guidelines, also can't implement vaccine passports therefore can't say does/doesn't need wear masks indoors

Once adults vaccinated daily vaccination results slowed trickle one else wants vaccine, right answer drop restrictions everyone let vax-refusers bear burden risk. adult vaccination rate likely prior infection rate, healthcare system safe, goal along. We're maybe 2-3 weeks away point now. article basically covered bases: short, japanese people hesitant get vaccinated, even japan logistical issues, theres many japanese people rushing get vaccinated right Unfortunately, self-centred asshole anti-vaxxers sufficient enough COVID keep spreading mutating.

Those fuckers going get vaccinated people killed. yet tolerate bullshit. That's weird! sounds like vaccine definitely cured strange thing lingering. One colleagues tested positive .

So office asked us go seven day quarantine return office (provided get negative test)

However googled ,it recommended 14 days quarantine mandatory.

Anyone know logic 7 day quarantine . even bigger companies (where friends work) also asking 7 day quarantine returning work get pharmacy webpages? It’s sign up. Need find pharmacies offering vaccine site filter moderna/Pfizer (since eligible AZ), go pharmacy webpage. pharmacy page click “No” special criteria “Yes” “I hour get call” button... way extra cancellation get list. Curious. Israel waiting US FDA approval? usually base medical choice FDA? they're already plummeting good thing y’all done lol. remember everyone saying Canada one best. It’s shame didn’t put bigger emphasis getting vaccines. hope y’all get enough soon  socialize? Avail number free video chat/conferencing services available. Want socialize without anyone watching like NSA? Use Signal also offers video chatting. Realtime face face socialization without need physically room.

A poor substitute actual socialisation well adjusted individuals. Yet sold us doses promising deliver time. COVID never going away. Ever. Likewise, policy needs evolve match seasonal flu pneumonia like issue vaccinations recommended people, including high risk people, assess whether want shot not. wearing mask right protection, wearing properly. know apply wear mine properly.  Half “life hold” people complaining prob don’t go anyway. Laughably entire company forever

The pandemic still going. far concerns AZ, over. non-delivered production capacity cost refocus business overprized cancer drugs big aquisition. SARS-CoV-2 gets body you’re fully vaccinated, able feel anything immune system reacts?

Like could feel minor symptoms day clears right away? feeling minor fatigue body kicks gear? It’s sickening see selfish pathetic society is. Nope everyone country school Hahaha stunted? You’re pathetic. school ffs. Also don’t give shit socializing since started. Source fiancé teacher. Stop clutching pearls agree Indian statistics highly undercounting cases deaths real number deaths [close 3x](http://www.healthdata.org/special-analysis/estimation-excess-mortality-due-covid-19-and-scalars-reported-covid-19-deaths) official numbers nowhere close 10 million. I'm going need look wow. idea mandatory vaccines. Good know travel. Yeah understand. I’m suffering Covid fatigue. live part country people don’t give shit masks vaccines I’ve done much could year mostly every one around nothing. It’s frustrating Sunk Cost Fallacy. looking ventilation rates people return indoors, feel like almost completely overlooked. know Germany says June/July much doubt 99%+ population hesitant take vaccine. Odd...I thought govt forcing masks people year liberal policy.. Florida’s spreaders tourists. 

They go Florida, spread covid go home. 

So Florida’s numbers aren’t going lack restrictions unquestionably causing covid cases rise. 

If anything numbers this. think anyone problem someone choosing continue wearing mask. problem people advocate mandates based scientific fact. Cool Reading article, weird way perception starting reopen. Schools open since start March, shops, hairdressers etc 4 weeks iirc. Foreign travel aside, control point, there's pubs restaurants opening indoors feel normal again. I’ve definitely wondered next year look like. 

Considering violently opposed rural areas acknowledging pandemic, doubt majority would even consider getting COVID test/going see health professional get sick. means we’ll likely never good understanding outbreaks actually happen. kinda care kid suffers Long Covid. submission linking google.com automatically removed source may reliable may dedicated mostly political coverage. possible, please re-submit link reliable non-political source, reliable news organization recognized institution.

Thank helping us keep information /r/Coronavirus reliable!


*I bot, action performed automatically. Please [contact moderators subreddit](/message/compose/?to=/r/Coronavirus) questions concerns.* want zero risk, go hermit never leave house let rest us live lives. Vaccinated -the way God intended. submission linking google.com automatically removed source may reliable may dedicated mostly political coverage. possible, please re-submit link reliable non-political source, reliable news organization recognized institution.

Thank helping us keep information /r/Coronavirus reliable!


*I bot, action performed automatically. Please [contact moderators subreddit](/message/compose/?to=/r/Coronavirus) questions concerns.* got say creative case reporting I’ve seen yet. Florida’s 7 day avg case volume 40%+ since mid April yet article seems twist message say cases going up. keeping running tally variant cases obviously go up. don’t mention total cases falling. don’t feel great honesty article.  Lots surveys done 50-60% food workers go work sick. keep lot safety protocols, hand washing, plexiglass waiting food, glove wearing gloves, distancing, etc. normal illnesses won’t problematic. Isn’t large portion population elderly? covid got loose real wouldn’t fairly catastrophic? turning fucking heat! tired government handled situation. US eventually got relief Biden. We’ve relief. That’s fair, wish would know. Right us immunocompromised children trying make best judgment call moment moment stay safe. 

I agree us vaccinated it’s productive worry things daily basis. could see masking protect type transmission first go (and maybe could already stopped), simpler rules better large groups it’s probably going one-time change masking indoors locations events, masking indoors. 98% hesitancy.

Japan also ultra bureaucratic government extremely slow moving suspect factor.

I know inlaws want see grandchildren (my kids). can't either get vaccinated small children get vaccinated. 15+ hour flight theyre upper 70s, risk high otherwise. US, prioritized awhile now. wanting it. numbers low? Florida variant cases United States. State health officials say two weeks following spring break cases doubled surpassed 11,800 cases, Wednesday.  fear “less one-half 1 percent cases studied mutations,” increase variant cases seeing could indication spread accelerating, [***South Florida reported.  [**ABC 753 variant cases three strains reported March 14 Florida. April 15, 5,177 cases five types reported. less two weeks later, April 27, number cases surged 9,248 variant infections. number people who’ve died variants state also doubled sits 67. submission linking techarp.com automatically removed source may reliable may dedicated mostly political coverage. possible, please re-submit link reliable non-political source, reliable news organization recognized institution.

Thank helping us keep information /r/Coronavirus reliable!


