,date,text
0,2021-05-09," Remind me! 6 months policy line data behind vaccines disease spread?

In perfect world keep wearing masks extremely low burden vaccines 100% effective. sucks 'best' option going, ""well, enough people give shit virus, able drop numbers low enough safely remove restrictions, remove even though cases/deaths remain pretty elevated alienate even larger percentage population."" know I'd go outside New England. pros outweigh cons me. handling pandemic, following science, basic human dignity things far many states lacking taste. I'll pay goddamn taxes. may well safety profile children age justify vaccination. It’s best prepare outcome. What's problem asking question exactly? obviously entirely topic. That's interesting, according [the BBC's third active cases vaccinated two doses, would suggest significantly lower efficacy. told HR guy I'm going return office vaccine policy put place enforced. think I'm going working remote forever. 1) pointed repeatedly thread, vaccinations attend schools way new concept.

2) There's something little insidious, unintentional, asking COVID vaccines ""the new norm"". agree vaccines around longer masks distancing, means vaccines key returning level normalcy prevalent longer people comfortable with. asking ""IS NEW NORM?"" they're ignoring is, extension, also *old* norm.

3) feels like phrase everyone using year ago figured could pique interest recycling it.  got “extreme” part right. It’s extreme wear masks indoors, especially cdc still recommends use. I’m calling shutdowns anything like that. What’s hard wearing mask?  realize may sound cynical put way, could say evolution finally caught religion?  think biggest hold outs necessarily GOP strongholds, ones large, rather inner cities poor/minority areas access severe reservations vaccinated always even reflect thoughts shots themselves. 
 
Which I'm glad Lamont like going force areas make sure anyone wants shot get it. It’s ten million doses, 1/9 total vaccines needed. would ironic? lot people incorrectly arguing last May actually makes sense May. Thats point. Cases went even without vaccines can't assume vaccines responsible current reduction. least wait summer see get continued progress surge like last summer. hospital pressure old ones deaths, contamination climb hospitals going even harder time... has. Pfizer shipping doses Michigan Mexico last week. going therapists hanging around CVS waiting people talk them? Money Pretty bad issue statistically would occured max around 330 people nation 330 million required week long pause almost completely nuked reputation vaccine otherwise quick option vaccinate large number people. move alone may add 50-70 days time takes get back life normal. Absurd, planet cali? disagree. Florida chosen basically ignore pandemic point fact multiple variants circulating means tourists become new sources spread home states. Put simply, Florida choosing pursue tourist dollars cost continued outbreaks America. That’s 300k CDC estimates. 1/3rd small business closing failure amount largely failure across country, Florida didn’t well regard, pretty average. claimed unemployment low, instead, it’s middle road losing ground. Basically, there’s metric I’ve seen shows Florida anything pedestrian middle road country, recovering faster country. made real estate claim somehow well real estate people moving terms, again, it’s actually well metrics, either. looks middling.

So, claiming skipping lockdowns solution red hot economy false: Florida better average. Yes sme fully vaxxed people die, particular old ones. Nothing unexpected.  ""What want?"" * *Beer* *
""When want it?"" * *Beer* * Yea that’s pretty inexcusable teachers vaccinated. Understandable parents want continue keep kids home (especially high risk kids), schools back. needle thin.  Large-sized people? That’s term? 70% zombies kill come next year... feel way Hepatitis? think I'd take business elsewhere. feel like remember shots hurting lot kid. think shots adult barely prick. Maybe sensitive kids? city last night felt pre-covid. voluntarily went gay bar though - would’ve cooler drag queen. never implied economics serve human lives, brought idea.

No, say that. pointing focusing wrong thing, brought ""economic fallout"". economy can't car thing pretty irrelevant still

As mentioned, point invalid use cars argue accept covid risk. responding statement Nearly everything risk associated it. Driving car? get accident.

I hope deliberately misinterpreting points, suspect might be. Take care problem unvaccinated people outnumber vaccinated people 2:1 don’t see changing time soon least enough get herd immunity. I’ve thinking mask mandates lot lately, despite fully vaccinated feel strongly don’t want indoors unmasked non-vaccinated people. realized basically 100% young children. able vaccinated, don’t think would worry do. able vaccinated, dropping mask mandates indoors makes indoor situations dangerous expose kids to. really think need get vaccines approved young kids ASAP, suspect lot opposition dropping mask mandates subside. Joe Rogan said immune I'm 60 went sauna one time! hand athletes talk show hosts, definitely hand people like Gottlieb. Agreed. take hit worst could happened.

If pause found J&amp;J lots instances blood clots etc, LOT damage would done vaccine trust instead J&amp;J(Look instance covering Vietnam War permanently damaged trust US government lies uncovered) PA 52.6% first dose hard support want us support efforts help India kind stuff goes on.   uptick restrictions lifted. science spoken go saying Florida basically failure saying they're average average pretty much every regard. it? 

And read article? definitely ""tear people moving Florida narrative shreds."" literally says people moving Florida others moving out. think it’s also older generations Europe remember times vaccines things. UK Spain older average USA well. Plus many problems certain communities subjected medical experiments government, case USA black Americans. Yes, breakthrough deaths vaccination. It’s one million chance though. Right? newsworthy. like CEO Frito-Lay saying expects Doritos variants near future. hope understand 'no masks required vaccinated people' stage. 'no masks required anyone' stage. Unvaccinated people comply raise hell privacy asked it. 

I would like see 7-day average nationwide deaths around 200 day get point, line bad year influenza, live without affecting daily lives. Right we're bouncing 3-4 times amount. Every one receipts copy Secret back small font. Especially since CDC already inched forward direction revoking masking vaccinated people outdoors.

Maybe I’m reading right, didn’t outright say vaccinated people don’t need mask outdoors? Well, fully vaccinated person isn’t going affect unvaccinated population. can’t expect people stay indoors forever sake people don’t care probably high-risk activities anyway, you’re fully vaccinated you’re pretty much safe regardless variants. weird hill die on.

I'm also confused made far attitude Singapore. Probably nicked blood vessel.
Nothing worry about! haven’t pushed, don’t know. guess he’s read anecdotal reports Moderna likely strong adverse reaction.  **Location : Belgium**

*Translation*


The resident, already received two doses vaccine, nevertheless infected.


A patient nursing home Borsbeek (province Antwerp), already received two doses vaccine, died infected Indian variant. information confirmed Flemish Health Agency.


The death occurred Compostela nursing home Borsbeek, two patients infected Indian variant. One two patients, considered doctors fragile, survive.


After death, mayor decided quarantine nursing home. ""It known residents infected Indian variant. still carrying checks. virologists, easy give answer residents vaccinated"" , underlines Dis Van Berckelaer, mayor Borsbeek.


Virologist Marc Van Ranst reacted. ""In first wave, peak 100 deaths per day nursing homes. currently less one per day. thanks vaccination,"" said. waves VRT.


And virologist stressed value vaccination: ""It may 100% effective, far threshold.""


As Mr Van Ranst admits, vaccination may less effective variants. ""The figures show Indian variant perhaps 15% contagious English variant, contagious original virus."" exactly COVID... guys really see that? That's America's Ass  CT neither large extremely rural, CT excuse front pack. Israel really well now. far today 7 cases reported (although weekend numbers). total active cases 1000.  teen remember reading John Grisham Robert Ludlum novel CDC supposed unparalleled futuristic organization top tier researchers infinite funding.

It’s saddening see throughout pandemic incompetent ineffective bureaucracy. FYI friend, picked wrong flair - ""South &amp; SE Asia,"" ""Central &amp; East Asia"" scientist biopharma ""we developed this"" ""we developed that"" arguments sides idiotic. Every team every project I've ever worked career international. guarantee Americans working Pfizer vaccine Europeans working Moderna, etc, well numerous nationalities across multiple research sites several countries. Science, maybe defense R&amp;D, global endeavor.

Just venting here, personally! positivity rate really good indicator bad outbreak is. Right tests going people absolutely symptoms get tested regular basis part job.

The positivity rate really tells reliable case numbers are. starts getting high know case numbers probably low. difference 3% 4% telling.  without proper tools, without effort, right. Exactly. tell us hide basements today miniscule chance debris falling Chinese satellite could hit us. There's always acceptable level risk. Life goes on. Colorado (Where I’m at) rolling thousand far.

Vaccines get done, cannot assume you’re 100% immune you’re even fully vaccinated. It’s risk reduction. great news, im still baffled near half USA lazy, misinformed bothered board masks. 

I dont even notice mask anymore, like socks. 

Anti sockers next???????? BAN SOCKS That’s terrible it’s yearly like flu shots. Guess worry immunity wanes point folks think safe suddenly get issues Wow thats amazing hear luckily enough feel side effects second shot around. feel really bad first one though, went away quickly. vaccinated? Like unvaccinated listen 70% efficacy J&amp;J, 90% Moderna/Pfizer. wildly incorrect backed science?  post appears vaccines. encourage read helpful resources COVID-19 vaccines:
  
[Vaccine FAQ Part FAQ Part appointment bot, action performed automatically. Please [contact moderators subreddit](/message/compose/?to=/r/Coronavirus) questions concerns.* Western mass people area. Eastfield mall Springfield, UMass Amherst atleast one, baystate Holyoke, castle knights Chicopee places offer walk vaccines believe. Otherwise Mercy Baystate hospitals Springfield scheduled vaccine appointments. never, ever eradicated. Sorry. They've working polio generations, measles, too. Undercook? Better believe it, jail. I'm half vaccinated. state 50% vaccinated. New variants popping daily....I wear mask work public indoor spaces. want stop wearing one anytime soon. I’m talking who’re vaccinated. don’t live states haven’t worn mask year imagine pretty annoying while. Overcook chicken? Also jail. still incredibly conservative outdoor ones. can't even take mask outdoor stadium. I'm thinking much change. probably like, okay alone cubicle!   Doesn’t fall ass far behind? insurance doctor. tried playing sport mask on? already vaccinated? Well, it’s great thing immunocompromised automatically mean cannot get vaccines, automatically mean vaccines won’t work you. Yes, immunocompromised people cannot receive vaccines, universal truth, contrary popular belief. 

According CDC, immunocompromised patients indeed receive Pfizer Moderna vaccines: I’ve said previously, number people literally *cannot* receive vaccine tiny fraction population average person willing continue alter lives way past 15 months order protect people. yet... CVS gets way. tried breathing ventilator?

Just it. Yeah, well guessing would able rid world new disease, actions ""well, worry it"", option respect. Bring back common cold, want Covid-19 fucking eradicated. sorry board. Yes ridiculous. someone wants wear mask, yell one making wear one? whatever want. kidding. point dying covid either bad luck stupid tax.  Thank you

Fingers crossed 🤞 Must nice

*Cries Iowan* frame way? obey sun wake morning? Pfizer Moderna preparing boosters don’t know yet. *worst case* scenario may need one around 1-year mark vaccination need live apparently. would awesome live amongst normal people want right thing! Good them! That's unpopular all. We're always guessing. Guessing die car accident way work school, guessing good chance survive millions possible ways could die today. Dogs can’t get COVID you’re good Depressants depress immune system.

No don't. misunderstanding depressants do. think epinephrine shots work quickly allergic reactions?

Epinephrine works allergic reactions completely unrelated mechanism. can't take methamphetamine allergic reactions, going work. Epinephrine adrenergic agonist causes smooth muscle relaxation airways prevents chocking death. bodies adrenergic receptors everywhere drug useful variety medical applications. dopaminergic drug going anything you. posted April 22nd: 27th CDC changed outdoor mask mandate: 5 days, hoping case time well. Super appreciate posts. keep data anywhere, like public Google doc? It’d nice graph first doses daily. don’t see existing anywhere else slow. Jail.  right getting shafted, tiny population. 

An estimated 10 million people United States are considered Asstute even. post appears vaccines. encourage read helpful resources COVID-19 vaccines:
  
[Vaccine FAQ Part FAQ Part appointment bot, action performed automatically. Please [contact moderators subreddit](/message/compose/?to=/r/Coronavirus) questions concerns.* going crazy? event extremely irresponsible. packed thousands people indoor arena. Assuming they're vaccinated 95% efficacy rate, statistical likelihood transmission definitely happened. without crowd? mention message sends.. Really? see information? remember us hitting number. scared

uncertainty breeds fear, guessing good enough me. can't wait smoker pride movement. maybe media campaign trying remove stigma drunk time (it's choice! Propensity towards alcoholism correlated certain genes).

Perhaps Teen Vogue one day put someone needle marks arms front cover? feel like reaching point enough evidence high vaccine efficacy, cases dropping precipitously pretty much across board, demand dwindling vaccines us able ditch masks.

Yes yes, know, cost nothing wear. continue wear mine. would lying say wish mandates would end go vacation end month. fully vaxxed person, feel much risk, mask without, vaccines work, work well. data supports that.

I think US needs start pushing hard ""wear mask whenever feel sick"" messaging magical cure-all, Laotian Lotion? given faith indoors mask mandate ever ending all. figured going permanent. US reporting lowest single day case count since June 2020 Cases low enough Fall, matter. vulnerable adults vaccinated want be. Families choose risks they're willing take like always do.

I think good idea virtual options scared. much talk boosters such? Wonder folks vaccinated December losing immunity  What?  Nope, testing unvaccinated, kids unvaccinated. alarmist, way handling since tests. what's carrot going be????  Drive car fast? Believe not, jail. That's incredibly alarmist. know long term effects anything. keep kids home 3 decades figure out? Naah, medium rare try food poisoning joke. lost ten pounds five days. chance might spread food poisoning others eating medium rare steak government asked eat well done year try reduce number deaths, I'd gladly comply. wish, still obeying. mean…you get $5M life blow rapidly depreciating cars? guess can’t buy way complete dumbass. isn’t vaccines themselves. fact many people willingly ignore science education terrible worrying indicator. believe summer 2021 still worried risk covid, either A) stay inside house indefinitely covid become pretty tiny risk areas country shrinking day, life tons risks similar severity, B) get vaccinated ""can't"" catch either. both. Either way, problem anymore.

I thinking today. work grocery store we've maybe 50% compliance past month so. vaccine available everyone 16. I'm fully vaccinated. really want gamble take precautions, that's you. part keep family safe. make sense keep mask people want get vaccinated. prob go doctor insurance unfortunately. Anyone noticing folks area aggressive folks mask? Seeing folks area seemed offended masked person presence post appears vaccines. encourage read helpful resources COVID-19 vaccines:
  
[Vaccine FAQ Part FAQ Part appointment bot, action performed automatically. Please [contact moderators subreddit](/message/compose/?to=/r/Coronavirus) questions concerns.* Biden's going step us West Coast. They've told us district they're going back ""full time"" expect less hours days school. powerful teachers union. Kids finally back, 2 part days per week. Probably. incredible chunk vulnerable population vaxed, number still rising. Get move on, tell others get theirs, quit negativity tried working wearing mask? literally millions people. tiny fraction. would ideal people could patient months. might affect people psychologically. took 5 year old daughter indoor restaurant first time since pandemic yesterday, nervous seeing people without masks indoors didn’t even eat. concerning. saying reason people shouldn’t wear masks, something think about. someone remember much time pass Fauci’s outdoor mask comments actually removing outdoors masks? 

Just idea expect here. bet months pretty much every country resources larger percentage population vaccinated US will. Thanks I’ll prob wear one traveling things level play ear. I’m worried folks harass still mask cause right winding bet cook meat well done don’t eat raw cookie dough.  
The evidence there. can’t find single study shows vaccinated people transmitting virus significant amounts r/iamverybadass think update may 5 may 8. Adequate tech help expensive. wish made more, pharmacy technician highly paid.  I’ve got second dose Walmart CT week! district, given much choice. School reopened fully, Zoom school still going on, class sizes slowly expanded, zero testing unless someone symptoms. Next year, given 'choice' either going back, going back ""at home learning"", going back all, finding alternate school.  Kids woods yet, single family could expose entire school Covid, vaccinations option. far concerned, family protecting kids last year, supposed rely single teacher watch whole classroom, consequences may long term. testing, know coming who's getting next? Waiting inevitable downvotes /r/Coronavirus really answer question. Eh. think wrong  It’s annoying it’s pointless. university even you’re one gym shooting hoops mask on. dumb Normalcy next mother's day? Nobody US waiting year....

Especially kids get vaccinated, remaining hesitation vanish. Yeah people vaccinated afraid? forever maskers becoming bad never maskers. CDC guidelines ridiculously risk adverse point useless actually read ones outside COVID

[No eggs runny 1 drink per day women 2 drink alcohol birth imagine restaurants/bars followed CDC guidelines? Show prescription birth control get single drink evening. Singapore always ahead curve. Beautiful country amazing airport! start mandatory therapy their
staff.

What clusterfuck are. Really? think wearing mask sick going become normal Asia. People going ok someone unmasked coughing nearby anymore. standard ""essential worker"" broadly set federal state agencies, included many people lol Florida gets numbers control I’ll think wearing mask. many people getting vaccine here. wonder everyone going sound really loud pandemic, we’re used talking masks mean, yeah, know sure possible unlikely infected top less likely spread even infected. Nothing 100%, damn good case. Yet thousands medical students hundreds thousands debt chance forgiveness 6-10% interest make 50-70 per year residency I’m Cali we’re putting kids back daycare soon. Super nervous happen building, outside! /s Yeah that’s true lol Hello! I’ve checking post curious you’re doing! symptoms subsided?! Suburb Seattle people would lie already plain refusing wear masks that's moot point. mean, next one follows *all* guidance point.

But plenty people vaccinated yet think nothing going change follow rules less. That's group we're talking - one knows big crowd is, there's question mind exists. stand corrected, years behind.

I thought old(ish) tech hey prescribe medicine well? Spit buddy Don’t know you’re getting downvoted. studies last summer, added CDC smallest fine droplets, aerosol particles formed fine droplets rapidly dry, small enough remain suspended air minutes pretty sure 49% people, adults. probably correlates something like 62% adults. Even vaccinated, countries playing safe. many variants, still raging elsewhere, irresponsible fully open.

If look Singapore, even zero community cases, fully re-open. still cautious, rightly so. Didn’t seem stop attending concerts ?

think opportunity society improve. 

people refusing vaccine illegitimate reasons ostracized environments pose risk members society. allow minority hold rest country hostage? 

Thats conclusion? 

The obvious thing would force people get vacine. got second shot yesterday morning. (Pfizer) long protect coronavirus? I've run 9 miles treadmill mask on. 


It's big deal. fine. focus breathing bit more. 


I really get big deal wanting wear masks. Personally, think infinitely comfortable bra. Especially sports bra. Thank you, confused. Appreciate correction. consensus seems yeah technically could carry spread odds really, unrealistically low wearing mask. county officials say ""well we'd like follow CDC guidelines

Obviously don’t live Texas. densely-populated areas still kind government mask requirements. Even then, people aren’t wearing masks public settings anyway. used commute bus pre-pandemic US (fully remote now). amount weird stare get ridiculous. Meanwhile bunch people shoulder shoulder coughing sniffling one bother. wanna know grab gatorade walgreens without put mask migh 1.2 billion reducing .  Remindme! 6 months reading language .gov site, think probably right ethical standpoint. admit know everything related nuances behind PPP system. know seems morally bankrupt force employees to, work heights pandemic actually essential workers, also make 6 million dollars risk. hope future mask wearing ended people know sick flu whatever decency mask up. It’s never part culture hope be. slippery slope logic. level effectiveness deem adequate? 75%? that’s case, everyone whose received Johnson Johnson vaccine inadequately protected. 

Yes immunocompromised people, vaccines effective healthy person. However, something better nothing. 

But point can’t all, can’t save everyone, continue alter society way 15 months protect people. certain point, it’s protect themselves. yankees love gubment tells anything different elite get bailed US government? 94% effectiveness means 94% reduction risk contracting symptomatic COVID-19 compared weren’t vaccinated; vaccine won’t work 6% time.  cousins Texas went.

They're anti-vax. Plenty states already done Thanks explanation! 

That’s awful. I’m glad doctors colour medical staff working it. hope vaccination uptake census really brings issue forefront it’s tackled aggressively. Without boost exposure sounds like something would likely buried. body simulated intense trench warfare WW1 second shot. appreciate it. “have compassion” gas chambers one post. idea india works. yesterday throwing dead bodies river understand mean. wife dining restaurants ever since became fully vaccinated, I'm hyper-aware people's gross habits. restroom dude really wash hands, rinsed fingertips. gave look like ""wtf dude, even pandemic ok"" Apparently, NZ researching last 7 months. 

[Vaccine research insights, NZ April 2021, following:  


* around 69% respondents ready take vaccine. 
* 9.4% definitely \*not\* take vaccine. 
* 20% (which includes previous 9.4%) unlike vaccine offered. 
* Hesitancy dropping, number people get vaccine steady around 70%. 
* main reason taking vaccine worry long-term affects.  


I feel 70% adoption number going seen globally. going take Travel Passports incentives push further. understood reference Man, enlighten us. Maybe someone find tenuous link masks cancer? point wasn’t can’t get it, isn’t effective  Anyone remember FEMA’s Katrina response? waited every adult get second dose, we’d masked we’re dead. forever holdouts. Really depends state wonder planning look overwhelmed pharmacy staff. Retail pharmacy notoriously horrible workplace covid-19 made worse. data? small real world studies show they’re pretty well far(two studies). that’s far. speak 1.4billion people? No; refer *people size* people vaccinated need wear mask according data right? anything annual two week pollen bomb make sinus headaches worse. 

If another pandemic, I'll get more. know work Amazon Etsy. 

Keeping things ""because something may happen"" hoarding extreme prepping starts. trying keep clutter things actually using moment. could've put dogecoin paid back full! /s think idea know vaccinated people spread Covid. Yeah vaccinated, yeah ok encounter virus...but carry around? Probably not, know sure yet, they're playing safe. would think something scary threat dying new disease would motivate try lose weight

