,date,text
Edit: Manaus link... recent allotment vaccines, vaccines overall. imagine many states similar position interest declining. time start cold calling people offering transportation scheduling get vaccine?  It’s really interesting see people’s perspectives (or comfort levels) fully vaccinated. 

Case point vs one girl I’m friends Facebook. 

I’ve shots, I’m comfortable normal stuff (yes keep wearing mask it’s right thing yes hate it). Like mom ate restaurant moms birthday today felt comfortable. 

On hand, there’s girl I’m Facebook friends shared post Ron Desantis signed ending executive orders (which tad early IMO, Desantis I’m surprised god hope Florida votes next year) like “well I’m going keep staying grocery delivery”. Granted baby makes sense, she’s also fully vaccinated little freedom say sister still airhead getting shots. 

This going really fascinating watch people navigate like fully vaccinated life next couple months.  400lbs 12yo slightly higher normal BMI unless talking 12 year old gorilla. I'm pretty sure talking humans, case 400, excessively overweight ANYONE, especially 12 year old child. always get much comments headlines. Thank perspective! Australian, feels pretty relatable. quite possibly worst ever fire season COVID. Way overhyped lol, everyone hyping ""double mutant"" indian variant already proven vaccines work Killed duty cop 69% everything else contract Novavax even signed yet even deliveries expected large quantities Q4-Q1 2022. lot people wanting J&amp;J, export 100% countries, heck export J&amp;J india we're good Moderna Pfizer hoard J&amp;J one wants it. 4/5 friends randomly chatted gotten vaccines say they're scared can't opt J&amp;J. Luckily got moderna 2 dose. offered J&amp;J would refused, reason 100% J&amp;J can't exported Thank much. really 'suffer' though, knew would switch spring, trade longer intervals. longer interval scheme worked fantastically, covered vulnerable groups responsible 95% deaths less half time ultimately saved thousands lives.

That's win.  hard feel good knowing many walking refuse get shot. Living MN I've got better lot still. I've got nephews nieces etc still feel could walking danger. I'm two weeks second shot tomorrow now. means data fully vaccinated act carriers long asymptomatic virus linger mind. Maybe there's I've seen yet try pretty hard stay stuff. Yes. great allowed us give last 65+ crowd az shot, meaning could save 200000 doses pfizer younger demographics speed rollout 60+ group, went incredibly quickly, might add. one thinks getting 50%+ adults least one shot great fucking achievement? That’s massive portion population. Back December/January quick gate. Im jusy going polls

[Gen Z Interest COVID-19 Vaccine Plummets Country Reopens, New Poll Covid-19 vaccine push, one speaking Gen Z’s polls get outdated quickly vaccine efforts havent concentrated Gen Z could something it. article says that. Well depends data source, UK still ahead per person 7 day average. One Germany ahead 0.04 vaccinations per 100. Iowa actually right line national average per-capita vaccination rate, outright exceeding weeks. Uh....cause kids get covid too? can't wait get 4 9 year old boys vaxxed unknown. unknown causes fear. I'm little bummed getting second shot weeks. huge homebody COVID I've really enjoyed ready-made excuse stay home. I'm fully vaccinated, excuse hang in-laws? Hell yeah! I’m 15 I’ve waiting forever. Approved authorized emergency use? 330 million...roughly. prevent hospitalizations deaths.

The primary way preventing infections, least serious infections. need calculate infection rates fully vaccinated order get clear concise picture happening.

Also, could tell source percentages? normal times, it'd essay instead paragraph nation 12-15 year olds demographic kids likely frequently mixing crowds public help us lot getting transmission thinned enough get back normal quicker post upvoted 6 trillion times? entirely agree. lack vaccination sucks, first-world problem. inefficient stock every pharmacy country week's supply vaccine, we're probably going anyway. Meanwhile we're entering summer already-declining cases stable medical systems, much rest world *really* needs vaccines *now*. last main point - every anti-vaxxer one dose someone else needs more. variant California since least 4/3 - think wife also might overreacting. background, would love perspective: live Los Angeles, fully vaccinated 10 yo twins vaccinated bc approved age. Wife 50 MFTR (this classify immuno compromised help). Since kids vaccinated comfortable sending back school even school starts back fall. part sort understand. However, also ok us go outdoor restaurant, visiting fully vaccinated families (their kids vaccinated) people house fully vaccinated. supposed travel Spain late July canceled trip bc also comfortable flying w kids. So, go camping August California instead. ok seeing mom unvaccinated (my mom QaAnoner why). So, sum up, ok going restaurants, fully vaccinated people over, going anywhere beach hiking trails kids fully vaccinated. think qualifies Covid Anxiety? I've pretty cautious whole time. going places outdoors, n95 inside, etc 

My wife took first flight year half felt strange, cathartic. love travel refreshing able again. said still wore n95s whole time, used nasal sanitizer pre-travel used counter rapid test got home seeing daughter.

I think, me, good see people living life. seen much lately gave sense much needed normalcy.  Sweden seems poised hit average 100k day well. 130k last friday. wish piss bonfire; however, all-time low zero? 6 months yet except ~15k trials. Within months, though, 6 months data literally tens millions people. Soon that, hundreds millions. Safety data collected tremendously fast, rate collected also rising. Ive 1 CT scan year past 5 years. fine Q propaganda. entering masses now. Oh doesn’t bode well places haven’t vaccinated 40%. 

Get vaccinated people! study Brazil yet (I guess we'll get Serrana). 
But Chile.  

16% efficacy covid, 35% efficacy hospitalization, 42% efficacy ICU, 40% efficacy deaths.  

Although would say harder get proper efficacy rate first dose interval pretty short (28 days, protects 15-20 days first dose...).
And see Johnson (and cohort Brazil¹), efficacy grows overtime. 

1 *Estimated effectiveness 50.7% (95% CI: 33.3-62.5%); 51.8% (95%CI: 30.0-66.0%); 68.4% 
(95%CI: 51.0-80.8%); 73.8% (95%CI: 57.0-84.8%) 2021 epi weeks 9, 10, 11, 12, 
respectively. weeks correspond 2, 3, 4, 5 weeks 2nd dose CoronaVac, 
respectively.* actually does. Or, least it’s big part it. 

The TL;DR back olden days, fires used regularly come landscapes clear dry undergrowth/debris leaving many established plants. 

Then, got really good fighting fires started putting whenever could matter federal state policy. 

So, debris undergrowth built up, fire comes there’s much heat devastates everything. 

We’ve finally (mostly) recognized error ways, variety factors (lack funding support, people liking smoke planned burns, many houses, etc) we’re far behind prescribed burns. 

Timber Wars really good it. Great news! sure can't drive shit, Connecticut folks good work drive thing back. I'm member family who's vaccinated. rest terrified it

But they're still planning ton vacations remainder year. tell get shot first, get ""you're kid, I'm parent"" treatment

They budge pls - Canada Pay (or offer relevant trade) get vaccinated. can't rationally debate insane people, still bribe smart thing add year (depending age) onto lives. 380 million Americans right? fair amount coverage. always hear kids health issues COVID pose risk group disease, flu? fun allowed headline fucking ridiculous tiresome. Children account cases adults vaccinated. higher percentage concentrated children better. Source 40% reduction testing please Colorado may first days decline. should’ve clear comment, it’s second Pfizer dose didn’t even “choose” Pfizer, facility went gives Pfizer. 

I’ve signed second dose coming Sunday now. know I’m gonna get silly comment lol First all, I'd get second dose time soon after, regardless. card piece paper need worry much.

But able get replacement card. Call original place ask them. probably differs state. around inch shorter is. rate growing, pass within next 6 months so. sometime know &amp; next vaccine approved be?

As far know Novavax supposed coming longest time - 2 dozen vaccines phase 3... FWIW, IL issue today pharmacies, like Walgreens, report doses. know states affected. Manaus never herd immunity. using IFR covid deaths rates never 40% infected. False positives PCR ""in theory"" impossible. Yet, course, keep happening. likely answer sample contamination - requires infected person vicinity sample, flat rate go away nobody infected. I’d argue one saying reason, people arguing isn’t immediately perceived incentive instant gratification kind way Thank I'll try Driving CT scan potentially cause fatal car accidents. look precise risk level? Mine big enough well, like might well considered 12 one. think makes bad parent wanting to, see would proper documentation records. Cause fill paperwork kinds info , insurance u might have, ssn, etc. F*ck coworker! freaking idiot probably would vote bolsonaro chance

Edit: sorry words, I’m tired seeing people denying covid FWIW land incorrect visa, etc usually airline return next flight. (They may try recover costs later) Presumably Indian Airline would deny boarding first place knew passenger would rejected customs. deport person either a) end detention India b) come agreement embassy Australia would take care quarantine. guess depends much bad pr Australia would thing would get it. probably resources handle random people trying sneak back in, special case like I'm sure could meet plane quarantine. Probably something like plane disembark via stairs go terminal. Europe US bought billions vaccins need themselves. would expect vaccins end less rich countries.

India, China Russia also producing lots vaccins, appears everyone competing gets send vaccins where.

It's ideal, probably fast go. miracle richer countries least trying somewhat disease still raging home.

I think take 2024. take time, billions people vaccinate.

The concern variants real, annotation vaccinated variant ever dangerous original virus was.  TSA extended mask mandate public transportation September, would surprised flu season. expect able get public transportation without mask least March 2022. sometime know &amp; next vaccine approved be?

As far know Novavax supposed coming longest time - 2 dozen vaccines phase 3...  immune COVID-19 said so.  10% 16 17 year olds gotten vaccinated eligible weeks now. probably see 10% 15% 12 15 age group too. 77 dog years What?! long? way. even think we'll even wearing second half year 2022. approved lmao 

they’re giving emergency authorization Hearing young children India Brazil dying Covid shows young people invincible like previously thought   enough people want it. even going make 60%. Germany probably top around 70% well confounding variable that, fda probably approving pfizer 12-15 year olds next week, theres question enough pfizer juice everyone wants one. given fact ""certain states"" declining huge amounts vaccines due low demand, id bet answer ""yes enough pfizer juice everyone"" Maybe it’s fears unvaccinated people claiming they’re vaccinated feel power taken away people anything now. There’s also lot premature lifting mandates happened, like Texas, feel like push even wrong direction. I’ve pretty much stopped wearing mask work mountains see almost one. still chin case run situation need quickly. Wednesday two weeks 2nd dose I’ll still play safe store wear mask. I’m nervous getting plane still probably cases next zero. get science don’t really feel ready go back yet. I’m really rush join society messed shit last year. sometime know &amp; next vaccine approved be?

As far know Novavax supposed coming longest time - 2 dozen vaccines phase 3... Ain’t truth! It’s huge %, covers middle high schools huge potential spread, would probably help quite bit. 14 weeks *after first jab*. Remember UK 12 weeks jabs.  sure considering it. bad? It’s risk tolerance versus his/her. Mine too. He’s easily big enough wouldn’t make nervous get shot... plans visit Orlando fall. Considering vaccinated go, somewhere dr office. make terrible parent? yea nuanced answer yes, spread even youre fully vaccinated, similarly, still catch even fully vaccinated. however, chances either happening minimal best get information like that? believe correct term catastrophizing. know Germany going continue speed right close gap weeks go by.  say “variant B.1.617 super spreaders reason severity second wave” Um, please read thread, research.

Cooperative R&amp;D, sharing knowledge, help production indeed initial plan. BMGF one major players opposed this, eventually helped scuttle it.

&amp;#x200B;

You might think ""IP laws"" important, money important lives poor, brown people, keep ind mutations globalised world eventually spread everywhere, case. One also sheer self-interest. Idiots Walking Around? tons universities requiring tons 18-22 yos college getting it...how manage go day thought processes like that? Locking people left right doesn’t anything police state? Lol 
Get real  Yes, much :(

That's 0,225% total population 1 year take account excess mortality.

But US far 0,215% countries worse numbers:

In Peru already 0,505% died direclty indirectly Covid-19 according excess mortality.

Bulgaria 0,44%, Albania 0,394%, Czech Republic 0,358%, Mexico 0,357%, ...

 [The 30 worst hit countries Covid-19 pandemic according excess mortality 2020 April 2021 - I'm feline either. wait? Take whatever available you, vaccines work. Unfortunately think correct. many people won’t get vaccine all, bailing second shot avoid “possibly” feeling day two. I’m U.S. can’t speak rest world it’s sad. fine. get daily years end, mind. Everyone ignores deaths send help. Either fearless helpers use medical equipment see bullshit saying. Sounds like win-win situation. Yes no... Yes government funds health care system, adverse events paid them. highly doubt able seek damages like wrongful death claim.

The vaccines also still approved. Theyr deployed standard program. What's unclear one would opt in... read go doctor convince authorize discussion risk. mean standard weekend UK two day long ?

Or students. “With masks”. God, hate Chicago. probably last state still masks. Yep. concerns. Damn ya'll hitting Israel numbers. Still summer 7 day average. open state? isnt true. schools shit show worldwide. kids dont care, about. I'm saying logic let 64 year olds get wrong. logistics easier let schedule. vaccine approved 16/18+ first, never medically age 64 65. someone 15 turning 16 can't get birthday. 
Personally, care 15 11 y.o. gets it. Ah yes bad isrealnationalnews site reporting this... You’re right, weekly increase rather concerning. wasn’t trying downplay numbers rather explain stating percentage increase decrease seem alarming numbers low (single digits) explained statistical noise natural fluctuation, yeah you’re right case here. Mayday bank holiday always first Monday start May, always leads three-day weekend. bank holidays except Christmas/New Year (and four day weekend Easter). agoraphobic tendencies, thanks panic disorder. pandemic done favors. fully vaccinated less month, slowly trying come out. met friend outdoor mall last weekend, sat restaurant took mask! First time since March 2020.  Nothing wrong wearing mask comfort level. like, I’m fine going vaccinated friend’s place dinner anyone problem that, they’re literally anti-science Dropping J&amp;J apparently caused 2-week delay Denmark's ""Vaccinationskalender"". expect abundance Biontech Moderna doses Q3.

Seeing J&amp;J rather poor efficacy, probably (and herd immunity) mind decision. happens even easier:

How explain 275587 excess deaths 2020 pandemic weeks?

[Painel de análise excesso de mortalidade por causas naturais Brasil em 2020 source Brazil (Conselho Nacional de Secretários de Saúde).

rickk79's coworker either blind stupid... need downvote comment. That’s likely recent poll taken.

[Carnegie Mellon showed 34% vaccine hesitancy Gen Z, highest amongst age groups.

The timeline moving fast course hesitancy go people get there’s better outreach everyone. Yes correct. Let's give J&amp;J homeless export rest. Germany expects minuscule deliveries CureVac. What's expected number doses Q2 Sweden?  Awesome! Thanks! seatbelts cut risk fatal car crashes 45%, yet still probably drive around wearing one. Pfizer better producing tons, hope world vaccinated asap 💖 Kill bug (even say unlikely still want optimism, thanks) comfortable wearing masks you’re vaccinated. wonder Denmark Sweden completely skipping J&amp;J rare side effect. J&amp;J shot essential part EU vaccination campaign. Even US approved age groups would totally get away without using all. people say follow science actually following personal anxieties drooping CDC guidelines align them.

Now mask guidelines relaxing vaccinations go continue shown effective, anxious doomposters latching onto every little thing continue giving rationality insane levels personal lockdown subjected year now. Correct I’m wrong wouldn’t “all time low” covid hospitalization in, say, 2018? Okay. you. I'd ask 11 year old. Worst they'll say no. CureVac next one. According Italian press, approved end May. There's absolutely nothing says ""drop mask mandates"" quote given: Key word, ""easing restrictions"" 

""Chapek said outlook parks “really going determined rate vaccination public.” also said, “And could accelerate expectations, give people confidence need come back parks. overlap know herd immunity? Sure will. believe we’ll state 6 foot social distance mask-wearing 22? Absolutely not.”""

And one said think masks scenarios gone end year. Chapek confirmed even year Disneyland best case scenario. Cases probably low summer anyways due seasonality, long we’re number fall surge okay. round applause people sticking tests lions nose losing limbs. That’s incorrect. Florida made vaccine passports, businesses asking proof vaccination customers, illegal. stop military, schools, employers requiring vaccines. gotta real brave stick testing swab q tip lion’s nose it’s feeling sick grumpy. Luckily Chuck Norris world’s greatest vet. medical purposes  get stat ""fully vaccinated"" ""first dose""? Funny see Swedish Grammy winner named press. Even Swedish press called “Older man guitar”. necessarily. 16-17 year old largely make choices whether vaccinated, younger kids/teens taken doctor parents. Plus, like 90% older teens vaccines interest getting vaccinated. some, might true, also way logistical nightmare vaccinate teens, especially since need bring parent them. vaccination rates go time. Gotta let people know baby brayden/jayden/cayden/hayden/raiden/scorpion coming Please hurry up, want travel Japan least next year. holding year :(  Yeah lands weekend rolls Monday 3 day weekends uncommon. Two May use leave right usually get weeks without using annual leave. sure vaccination rates plummeting cliff? gonna longer. sorry hear daughter, hope gets better. Living India, I'm happy guys, also EXTREMEMLY jealous right now!

&amp;#x200B;

The condition absolutely fucking horrible here. Bruh. one going let summer pass us elderly vaccinated. Luckily vast majority one shot June current rate. least Sweden we’re 1% day now, hopefully 70% come around late June, assuming taht actually give 2nd shots already vaccinated. Right? Pfeizer study done now. Data excellent. 

Sorry trying protect children global pandemic!!! I’m terrible mom. 

WA surplus vaccines. taking anyone. I’m lucky live place excess vaccines instead somewhere ravished pandemic. I’m taking granted; I’m getting vaccinated.   take unless permission land. It'd discussed diplomatically, exceptions would likely made. Otherwise guess Australia may offer pay fee something person incarcerated time India deported. put house arrest embassy restrictions lifted. Private malls, private amusement parks like Disney, private music concerts, going dealing lawsuits liabilities things continue sell demand high. Yes start increasing %'s 25-50% eventually 100% masks thing.

You think Disneyworld says, ""You must wear mask""? demand go anything? absolutely not. ....

You go outside get hit car. say ""what expect living police state?"" sound silly?

You bad night, can't sleep well, wake next day feeling grumpy. say ""what expect living police state?"" sound silly?

A people expect quarantined fully vaccinated still got quarantined people close proximity tested positive. say ""what expect living police state?"" sound silly?

I say one last time. smart. cynical certainly infantile. Otherwise look like buffoon rather someone contribute HK's path freedom. Fascinating! Please Stockholm follow suit. uptake terrible now. want shot party come summer. People still doubting based DeSantis. think lion Tell friends book vax CVS, show location vaccine. think false assumption. know lot people vaccinated, think anyone thinks going cost pocket. know state require id insurance vaccine. ask can't require deny anyone lack it. proof vaccine afterwards though, yes-that could tricky part. unintentionally racist it’s almost funny least bit appropriate. normal. I'm meds, wish so-called professionals clear, truthful, willing help. Instead deceiving people telling get negatively impacted go screw themselves. Right, I'm saying medical purposes consider ""I'm going 12 time 2021"" count 12 2021. Like people turn 65 October 2021 able get vaccinated 65+ became eligible back January/February despite actually 64. considered 65. stubborn, South would finally kicking North's ass something. 

/s Canada ""Provide"" technology, partnership CanSinoBio NRC (from Canada) started long vaccine development. vaccine developed China CanSino Yeah, it’s crazy far away feels. hype “Group 4” (18-59 year olds) starting May yet we’re finding group split 10 year sub-groups. way people 30 getting vaccinated August. word vaccines elementary aged kiddos? fully approved though right? Still emergency use like everyone else? Correct. FDA covers vaccine liability United States - hence article title. also incredibly strict authorization.  Sinovac? (Real question, achieve immunity today people convinced work)  day every year ?

Because assuming labour day holiday Saturday .

It would mean guys could potentially three day weekend every year. TBH, lot anxious types could go rest life see hear again. would bet it, next vaccine approved Western World probably Curevac one, since started rolling review procedure February.

They aim end May/June EU iirc Eh think people tired “lockdowns”. think people seeing past notice businesses affected restrictions happen small businesses. little guy shut Home Depot, department store, etc hasn’t felt even little pain whole pandemic. I’m sorry facts twist. said expect living police state. pretty straightforward statement Yes. CT taxes everything. would tax “your shit” could. state embarrassing.

The numbers promising though. still half state without shot. Two 14 year olds home autism plethora health issues. We’re happy dance finally immunized mentally speaking im counting 2020 2021 one year correct consider opinion make sound like people vaccinated yet quarantined protestors.

Be smart. Learn like 羅冠聰. fight oppression stupidity unreasonable arguments, score points HK govt eyes others. map (scroll down): would using J&amp;J 50'ies prevent death per week? past year 3 category died.

You mention one million, US data - likely end bit worse data places tick - magnitude less AZ. vaccines stop catching covid, 90%+ effectiveness mRNA. read otherwise somewhere? source making things up. surprised, work Sweden’s biggest hospital it-technician(on-site support). Haven’t gotten vaccine yet...  Everyone masks last year though Children risk Hep B, that's required. agree happen FDA approval, think make list. Ngl think government dropping ball they’re updating guidelines vaccinated people. know people mentality “why would get vaccine? government tell finally 6 feet apart another vaccinated individual middle forest without mask?” 

Like get need bit conservative, large portion needs vaccinated already haven’t wearing masks while, maybe bit aggressive. 1. polls use NBC source. necessarily knocking NBC, know much track record, can't count separate sources.
2. particular poll surveyed 2,200 people. that's pretty small sample size compared studies. I've heard lot teens waiting final exams also. fires distant memory, yet talk world good month two...then COVID really hit. Why’s that? 👎 sensationalized headline makes sense, 👍 good news!   Huh, never thought would wonder someone Tory going BLM 'defund police' bollocks. got second pfizer shot today way. 2 weeks I'll staying home. 3 kids cannot get vaccinated yet. think you‘re comparing vaccines Medication? apples oranges. Medication doses changes travel bloodstream, needs different doses depending persons size (compare effects alcohol small/large people). 

Vaccines create cell response, educates immune system create right antibodies get sick quickly. education active ingredient vaccine large, dose small already. far know, might different vaccine sizes different age groups, best guess case vaccine didn‘t time test extensively. 

I 100% sure right also sure also 100% applies mRNA-vaccines, understanding. 

