,date,text
The Pfizer’ Paxlovid sound less scary (doesn’t wncourage virus mutation) preface rich countries could done much better job spreading round vaccines, case South Africa asking suppliers stop sending vaccines demand low. Transmissible vaccines risk allowing unpredictable future mutation (or set mutations) might turn dangerous. yet informed enough design transmissible version given virus highly infectious guaranteed never go dangerous random even several mutations. Due absence guarantee, stick injectable vaccines control cannot mutate. high prevalence contagious variant might cause trouble - instance, Delta share around ~100% sequenced genomes Brazil months, cases lowest levels since start pandemic.

That's Delta already burned first spike. like waves grow forever. Happy able share it. offers far grounded perspective alarmist media outlet posts last 24hrs.  Israel reported case too. interesting thought.

What principles mechanics one strain becoming dominant one squeezing predecessor Yes. supply chain. like everything else Capitalism. 

Did go see person get yours? Disrespecting nature well  Guess I'll start drinking death today. wait mutant COVID come claim me?  wear masks quarantine two weeks. Remember, two weeks slow curve! vaccines reformulated matter days. pills reduce symptoms factor ten. new variant cause alarm point? never better prepared combat disease history. Sorry I’m trying mean, figured important acknowledge there’s reason one talking yet Ya, virus naturally work. original COIVD 19 strain likely extinct reason Delta decimating brothers sisters. 

That said, variant could compete Delta spread nearly deadly. another variant comes, lets hope plays out. Otherwise worst ahead us still. COURSE GOT \[bleep\]ING BELGIUM. COUNTRY \[bleep\]ING NUMBN\[bleep\] WOULD \[bleep\] ENOUGH DUMB?! 

No, seriously. hate vast majority Belgians. hate. hate all. Especially politicians, might well called murderers point.  Apparently go SA AUS UK. ideal cheap people skip red list snark strong one. best post far subject. Thanks bringing site attention. statement woman alone worth everything else read morning

Prof Sharon Peacock, Director COG-UK Genomics UK Consortium,  
and Professor Public Health Microbiology, University Cambridge

And there's lot there. Late last night UK, sky news reported 3 cases Botswana, 53 South Africa 1 Hong Kong. Today, flights suspended 6 countries Africa UK. anything, media reported numbers. I'm fully expecting restrictions come force UK sooner rather later point. booster Sunday morning, doubt I'll immune new varient, reported.   think US 5-11 year olds lowest group hospitalization death. 

But yeah, husband allowed allocated 4 doses, two would gone 3 year old could 1 dose each. happen won’t end see it. think end acceptance thing forever also people accepting understanding vaccine okay dangerous. took long time realize accept life gets much hopeful. Pandemic diseases fear turn gave crippling anxiety life. pandemic hit legit lost still keep working. I’m telling know feels hope happening thinking never end. protect point makes us comfortable. comfortable 3 shots, wear mask inside others around, sanitize needed, try take precautions keep safe. honestly started feeling way probably 6 months ago. don’t give up. world get you. may dodge initial antibodies T-cells still able recognize help launch new improved B-cells make better antibodies.   nothing else, speaks need far stricter policies allowing unvaccinated people travel

I wholeheartedly agree statement. We've soft unvaxxed travelling, NGO-HR groups well stated restrictive unvaxxed violates ""human rights"". ago create Twitter list epidemiologists like. That's usually listen info Covid Twitter. even ignore evidence, even assume lockdowns could somehow stop COVID...

That's logical assumption ignore can't hold someone hostage house gunpoint, absurdity.

Nobody ever Bullshit. South Africa sits pile vaccines using local scepticism.  Sounds right, Finland they've said unvaccinated 19 times higher chance ending hospital. 

But 80% population vaccinated, total numbers start get closer equal. would start Israel. one place nearly 100% vaccinations. goes show vaccine work! Huh? Assuming vaccine taken Thanks, makes sense well.  Man, really hope thing overhyped another delta. I’ll worry starts happen large scale. unless happens, im going anxious every day. answer pretty simple: Medical experts know they're talking about. Newspapers not.

Someone like Fauci probably presents information correctly, news sources paraphrase says may highlight one detail another order many reasons- know better, clickbait options, etc.

The easy answer people stupid qualified making statements public. always media hysteria surrounding Covid lol Mostly don’t learn answers questions first days know variant exists. Never trust Merck shit pulled Finasteride Shenanigans Don’t know Belgium compares, South Africa apparently among best screening delay even strain became dominant. Might needle haystack Belgium moment.  woman whose virus accumulated 32 mutations seven months reported June, AFAIK, virus unrelated B.1.1.529/Nu.

South Africa many economic problems. also center scientific expertise much sub-Saharan Africa, several plans set vaccine manufacture there. 

It regular commerce southern African nations (Angola, Zambia, Zimbabwe, Mozambique) comparable HIV+ positive rates, poor ability monitor Covid cases, much less sequence identify new variants whole genome sequencing. Whereas South Africa sequencing per case country developing world.

Please take analogy racist anti-African, one year, apartment neighbor left pizza boxes coke cans littering floor, apartment near spotless. building serious cockroach problem, reported him, care. discovered reported landlord me, looking.

South Africa may may origin several variants, like Alpha, C.1.2, Nu originally detected there. detected South Africa means (whole genome sequencing) identify them. American we’re fucking stupid shouldn’t regardless vaccine status. Also don’t states agree adopting standards, one state could restrictions one everything right they’re right next other. Also American currently Europe, don’t jealous. wish US could impose nation wide restrictions.  Well even ignore evidence, even assume lockdowns could somehow stop COVID... would still totally immoral. can't hold someone hostage house gunpoint, absurdity. Lol. Yes. I'm scheduled 8pm today. Oh, rotten pie, way slice it.

After last two years we've experienced, I'd always prefer countries proactive reactive.

I'll often hear phrase ""we're going learn live COVID,"" agree...but reasons. Volatile markets far acceptable ill allowing new (and potentially extremely transmissible) variant run wild, unchecked. 

That said? also see mean.  didn’t even think that, good point. welcome death evolutionary pressure one way. pressure become less deadly, become deadly. balanced. new strains ""looked for""? Like, normal covid test also identify al strain, different test view microscope something? definitely sounds scary, important remember single data point cannot indicate trend. point -- enough info yet, good cautious. keep thinking this!  assuming you’re isn’t really possible places like Europe. Traveling across countries easy going across state boundaries. It’s hard police thing got one blame. earth would think twitter would place go actual helpful information. place one massive cesspit moment vaccines officially approved.  lol.. single data points side thoughts new variant:

* Vaccine still efficacy, especially terms case severity / fatality rate
* primary concern new mutations impact severity / fatality rate
* significant increase either, think society less marches on
* increase case severity and/or fatality rate, especially combined vaccine evasion, worst case scenario realized
* Society extremely fatigued COVID controls Guy Hong Kong booster? wasn’t confirmed hours ago. sec imagined Roid fuelled parasites even kind steroids. well ivermectin pretty good antiparasitic think take word trials malaria treatment. hopium tested years know bodies /s  could mutate something less deadly though. Third world country man, always like people toke roof train want step front, khow trains India... Seriously, current shit taking long. one, many. Keep mind yet much data, everybody, everywhere talking (mostly) behind :) goes burning out.

That's fine smaller infection pool.

The problem virus spread much that, variant popped able burn out, people would get infected different variant would fill gap.

You spread variant around world fast there's guarantee new variants go same.way.  would extremely unlucky everyone else there. SUPPLY short CURRENT WAGES SCHEDULES.

Hospitals across country currently trouble filling vacancies travel nurses offer double triple wages good benefits.

People like articles like willfully ignore well documented number nurses left profession past decade half they're subservient profit driven system.

Millions nurses would return workforce FUCKING PAID ENOUGH stressful job perform shit schedules work. mean, fuck know - literally section defending biological warfare medical studies. scare people man, play Nostradamus, thing ""big one"" expected happen preliminary theory variant “cooked” HIV patient…

Not sure could found though scientist tweeted said theory lowers credibility well. Great idea, think invented tomsething. Let's find name it.... mmmh vaccines ? sounds great Agreed. also think people confuse flu cold. people say flu big deal wonder really flu - knocked shit I'm young healthy. Belgium? that’s case big oof. encouraging terrifying Someday, may appreciate irony situation.

For now, I’m fourth hour trapped tarmac Amsterdam’s Schiphol Airport, officials allow much catering truck bring us water. appreciation irony elusive.

My flight took nearly 16 hours ago Johannesburg, people abuzz news discovery coronavirus variant spreading South Africa.

This variant many mutations, particular spike protein helps enter human cells, fears might able overcome immune response generated vaccination. variant spreading relatively quickly around Johannesburg.

South Africa’s National Institute Communicable Diseases shared knew midday Thursday, even took off, Britain banned flights southern Africa. Europe apparently panicked somewhere Sahara; time landed, told would permitted plane.

The irony lies fact South Africa report risk variants emerging countries low vaccination coverage — impressive, multilayered approach South Africa using try protect global public health. spent time labs scientists who, yesterday, made announcement left hostage planeload strangers “the authorities” somewhere debate us. capacity areas.

Eh really. ICUs north fine vaccination rate like 75%. mean, really want brought less resources us *but* option exists. … data point one place abnormally high vaccination rate data hospitalization death, primary focus mass vaccination campaigns. Okay, that’s great basis giving up. did, variant. hope that’s case. can’t deny things it’s better safe sorry. Better put restrictions place rather later. Like everything else covid, it’s buying time. heart goes medical community dealing almost two years now.  seen someone get face eaten Velociraptors

*so far* Nature unfortunately used :S like beginning.  Wealthy tourists spreading virus.  

Please halt international flights. Please? sentence make sense grammatically

if mean flu symptoms serious would ""mais PAS de maladie grave""

if flu symptoms serious would ""ET de maladie grave""

So idea mean maybe start giving vaccines? instead hoarding it? simply There's nothing wrong concerned, anyone claiming existential threat longer worth taking seriously. There's nearly enough data draw conclusions yet. fuck fucking shit jesus christ Viruses spread quicker people taking precautions. ya cuz learn ebola outbreaks... worth lot money, that's whatever wants. long go full henry ruggs NFL keep job. reporting 500% increase delta atm... already evidence quarantines specific country unfruitful.

The way completely monitored quarantine anyone enters country exceptions. never happen. may need booster tailored variant, research start immediately. probably sounds cold, need stop allowing non-vax clog system. care enough get shot, wanted live lives, mask play smart. minute get sick run ER call ambulance. people blame Vac mandates hospitals reason medical staff quit. non vaccine people causing pain. continue, like people told eat better smoke less, exercise...but end hospital. numbers ""Not shot"" kind people. frustrating seeing happen local area. WSB GME people going want piece action Cases US grossly underreported. Testing varies drastically state state, many people don’t feel need test symptoms, assuming it’s cold something else. Quick tests done home prohibitively expensive many people ($12 each), means going testing site, challenging people work day. personally feel testing consistently way keep spread low, think ease getting test paramount IS, especially since many resistant wearing masks getting vaccinated. Many fellow citizens want imagine Covid overblown. It’s unfortunate. waste time say lot word word trick Hopefully variant rub rest anti vaccinated. Anybody going wake US government officials get travel ban? following this? care?

Last checked, USA still universal healthcare. (They for-profit system stay sick and/or die can't afford medical treatment.) really think care people. Pfizer said could make new formula 100 days, could skip trials? flu vaccine update without trials? Can’t follow safety process totally different situation?   missed point comment replied entirely.

Viruses *don't* necessarily evolve less deadly. deadlier variants *don't* necessarily burn out.

When walk around two weeks infecting people even know sick, actually matter virus eventually kills not. selective pressure lethality all. Hate break Africa n=1? tells us really anything.  scenario described find ourselves, don’t see it’s treated like annual flu shot. Unfortunately, flu shot never anywhere close 100% uptake, even close. won’t ever rid it, best would likely able hope annual semi-annual variant booster. COVID IFR 20% contagious delta societies would collapse fast entire damn pandemic, whenever question ""is worth something even buys us time?"" answer always ""HELL YES, NEVER PASS OPPORTUNITY BUY DAMN TIME"".

I get frustrated ""well already spreading light fire let consume us"" comments. I'm gonna IGNORE advice furry crazy 4 cases Botswana

Lmao things work. never said less severe, said long incubation time compared Delta might stupidest damn question I’ve ever read  much three day turnaround least they'd die lot easier scenario. Getting everyone vaccinated would great thing. Mind blown Lol well sit back wait find out... learned nothing past two years, mean fuck. Stop reacting proactive. Stupidity part evolving species. It’ll sort way nature type thing. sexual side effects WAY overblown. Follow-up research showed rare reversible. 

People get hair loss around age start getting fat high blood pressure, inaccurate correlations initially spurned. 30 mutations first seen November, month are, complex understand new variant behavior days data. Gonna bet variant actually Europe reason behind current wave always daily video vaccine side effects That's true still explosion cases. South Africa reporting around 200 cases day new variant brought 2000 daily cases. I’m shook Society would crumble. Literally. Yeah problem started saying ressemble flu, since clot thingy problem (forgot name) affected lungs, people assumed damaged (of calling ""like flu"" done) Cough sources everything saying bullshit. need learn stuff. wanna see scary graph, know find it? know, Egypt 11 days prior showing symptoms lines *maybe* so. mean, could international line passport control getting Belgium know. long going live fear like this? old sick? long awaited follow song Miley Cyrus? agree vaccinated people still get spread it. goes back statement correct. Thanks Corona made quit Twitter. Way many people expected covid zero real thing. number virologists Twitter quite concerned variant. vaccinated might survive apocalypse round 6 unvaccinated much. Heartbreaking valuable worthy human beings world without access. access get booster comes community. go again! one pronounce Caren French? That's vaccination comes in. spread we'll dealing restrictions. high vaccination rate allows us let spread without causing health care system become overloaded. People really think don’t die it’s going fine good. Stories like others dealing long Covid exactly new strains cause alarm. ""just shut international travel"" without ever considering consequences

Well, everyone month everyone complying, yes. happen. Half assed implementations work. you’d still solid chunk population opposed every step way. Welcome... Metaverse. Remember covid overhyped, feels age ago now.

Here's hoping right! person consent laws mandates? Would punished? pandemic end everyone gets vaxed infected. Lol. Lmao. Oh yeah pills actually ""have"" yet, real world data yet regarding much impact need taken within 3-5 days symptom onset lot people even know sick covid? sound good remember spring vaccine supposed end covid. Go cobble together N95 underwear keep COVID Farts spreading ""Twitter experts"" like Feigl-Ding want, fine. One days, Ndnd…Bang! Zoom! Straight third moon Omicron Persei VIII! use infectious vaccines quite bit historically. Polio springs mind. also interesting gives good overview mention would extremely racist stop BIPOCs travelling.. right mind would even support that? Update:
My wife maxed antibody test u/ml). J&amp;J March full dose Moderna booster November. Omigod! Would mind posting source quoting? Omi-Rona dark horse I’m loop one different? can’t refuse US citizens entry country. could add mandatory quarantine. Wrong what? think fit variant, think discovered, going disappear countries restricting air travel weeks? Think minute.  hope restriction make sure returning US citizens lawful permanent residents carry virus. Best quarantine safe, block like Australia. US Citizens still gonna test get back regardless This. going give award you’re getting downvoted. Covid isn’t problem. It’s selfishness. boggle mind. looking multivalent vaccines many months, universally raise effectiveness across board existing unrelated variants. would guarantee would effective future variants, variants exist yet bothered.

By switching multivalent vaccines months ago could halved dose needed get effect, better future-proofing. downside except involved applying science reasoning. I'm really surprised all. Alabama ranked bottom states nation USA ranked around #30 world. state Alabama basically 3rd world country pocket money. course something. called mitigation. basing on? Agree. coverage variant absurd. Remember hyped mu variant vaccine evading variant disappeared. Hopefully source? Y’all exhausting, grow guess wrong. done chatting kind obviously support ""going living without fear"" may to. really bad? sore arm day. I’ll take Covid. omicron, nu? view surveillance way reactive possible 

By time discover highly contagious variant it’s already set waves many places 

Not saying that’s case contagious it’s late *laughs american* got kind lucky Delta transmissible less able escape antibodies variants. Omicron gathered lot mutations, increasing risk escape. Long distance relationships suck. tired videocalling! Remember vaccine immunity wanes vaccinated people protected disease death, getting infected.

More importantly, Omnicrom variant pops differently PCR tests would noticed. That’s thinking anyway.  scrolled read entire thread reassuring. Natural immunity last 5 years.Vaccine six months? “a study  US citizens allowed bring home variant? Yes, surely *this* time we'll learn lesson. Sigh. always hope guess. Everybody put fear panties start jacking off!!!! I’m feeling bit like iPhone now. I’ll get whatever upgrades need I’ll glad settles down. FFS, Delta, designated Omicron.  know. actually care took vacation. seemed like quite humble brag pretentious. 

""I've vacationing another country 2 weeks sooooo scared go back diseased home America"" live? US life mostly back normal cron-a also help neither Greek symbols would familiar people anglosphere. Oh, hard pronounce? worry, say like Ξ ξ, easy Vaccinated people catch transmit quite quickly shot

Well everyone told wait weeks let vaccine work start travelling. Vaccinated people lower chance ot getting covid lower chance transmitting it.

Get shit straight. study /= fact. doesn’t answer question. suggestions help stop pandemic? Wow that’s fast. fact woman infected Egypt

That’s fact. 11 days ago. One pros communism strict regimes general. Agreed. fair news nothing help Ya pronounce ks? think English speakers would confused ee Hey hot shot, guess US agreed accepting it’s normal get anxiety hearing news paired basic knowledge breakthroughs? It’s normal anxiety Nope. One big headaches talking COVID assumption every change virus inherently negative humans. Delta actually less dangerous terms vaccine escape Beta, spread means terrible consequences unprotected, still handled quite well vaccines terms serious side effects. Especially among boosted folks.

From evolutionary biology standpoint, ""perfectly fit"" virus would one monstrous R value little/no mortality hosts. Dead hosts = less chance spread. Probably unpopular opinion… but, new variant made headlines important USA holiday families together. coordinated attempt maintain Covid conversation topic, boost vaccines rates place. Also, stock market closed TH open half day Friday. Perfect timing large institutions play short game profit. 

The upcoming OIL crisis serious best way governments save face limit demand. inflation. Fear best medicine fight inflation point.

I’m pro science, booster all, but, timing seems fishy taste. Follow $ political interests. posted link one comments. idea less virulent previous lineages; nobody Johannesburg sick long enough yet need hospitalization.

This like previous lineages, even Delta completely missed chance slow halting flights. Cases Johannesburg increased something like 5x week, Delta numbers remaining flat time. either beyond credibility timeline lineage spreading worldwide half previous lineage (1-2 months). Buying extra time would tremendous value medium-case scenario.

Get next vaccine dose. many covid deniers here, doomed lol. Yeah would end times. No-ones risking 1 5 chance dying anything except get by. People suddenly stop loving loved ones pandemic go god-knows long. know reasons. Right, like traveling nations requires 3 shots. Except H strain, H strain ever identified individuals unusual immune systems allow fight HIV naturally, PreP effect either. need try delay it. I'm UK. worked hard keep cases high summer 😉 get Christmas! Can't spoil now. need understand happen vaccines. 50k cases Delta today. Boosters really reducing hospitalisations / deaths manage high case numbers. wrong people start infected we're us shit creek NHS already knees really got winter yet! Omicron. Guess wrong: It’s matter time Gavin newsom breaking news talking right back square one. See late January, Gavin Guess wrong: Well fucking dumb. now, give window people rush get here? think anything, likely already here. Anything paywalls boomer source. Overall structure no, it’s still spike protein, detailed level yes lot concerning ways. Lots mutations around receptor binding site. ( one set appears shifted whole loop anchors place make stronger contacts.) I’ll know simulation docking done Guess wrong: west snoozed hard Delta, embarrassing little done contain spread India UK US.

All experts talked little know best worry it. TWiV especially guilty creative word play keep calm pre-Delta Beta Alpha worse. Yeah think around 7% main area spread.... Literally sucks even doctors help spread panic posting information new variant leaving key information like cells still strong even current variants makes people like “oh, vaccines useless !!” repeating tons mutations number mutations doesn’t say it’s dangerous no, I’ve reply several comments people panicking claiming vaccines ineffective Instagram post well known doctor live posted panic inducing information. said something similar mom around February 2020 poo-poohed it. . . . lottery. straight offered 1000 bucks bet would seen least faster uptake. Guess wrong: I've personally known 3 people last weeks fully vaxxed who's popped positive. There's players/coaches sports testing positive. I'm getting nervous already here.  haha saw it! Good! That's good reminder get booster ASAP. 
I hope hospitals get overloaded again. UK acted contain Delta much slowly. trying better omnicrom.  I'd curious see would still elections wondering Maybe feel sick unhealthy havnt workout year? Go doctor step scale. gained lot weight since pandemic? guess yes announced flights SA 7 countries restricted starting Monday US oh fucks sake man keep together, there's zero evidence point strain dangerous vaccine resistant.  h transmit quite quickly shot, strain could worse sure vaccines based fir

