,date,text
0,2021-05-03," OMG, say ONE TIME I'm going block move I'm pretty sure trolling point. trials showed 95%. can't use breakthrough numbers time delays.  example, lets say fully vaccinated, I'm person protected vaccine. lets say eventually catch COVID 3 months now. Well, next 3 months would counting someone protected vaccine reality I'm make breakthrough numbers 3 months.  breakthrough numbers would eventually trend towards trial numbers given enough time. that's fine - 95% REALLY good. - Tests: 1,211,012 - Cases: 45,265 - Deaths: 362 - Currently Hospitalized: 35,414 - Currently ICU: 7,346 (+/- compared day last week Tests/Cases/Deaths &amp; yesterday Hosp/ICU)

Source: Covidactnow.org measuring percentage entire population received least one dose. headline referring percentage adults fully vaccinated. They're two different metrics. vaccines available USA went 3 phases trials drugs need go prove safety Efficacy BNT162b2 mRNA Covid-19 Vaccine

That trial 40,000 people it. think missed opportunity. Even great internationally attracting event (do go never been), could scaled local event closer roots. Could fun. 

I'm Canada event here, Calgary Stampede, basically big rodeo. They're going year I'm sure it'll smaller scale think it'll like ones remember 80's. I’m sure know lmao. would someone change single word title ought simply copy pasted without desire change tone? main reason Israel 60% population 30% population 18. Average age Israel 30 question raised patent confiscation vs. buyouts, vs. nothing. I've read, broad consensus Sputnik highly effective, manufacturing, QA ""vaccine diplomacy"" (ie, geopolitical shenanagins Russia) making lot Western authorities uneasy. I’m friends any, feel like I’m missing much They're process developing tablet spray, fwiw Show quote doctor specialization vaccines worked vaccine approval says it’s less safe full approval change position. and, again, said another thing entirely.

first question answered: would someone covid related anxiety avoid indoor dining first even they're vaccinated?

my answer: because, terms risk infection, past year so, effects vaccine rollout, dangerous setting. someone anxiety pretty likely avoid first, probably depending factors like community spread (and hospital pressure) restaurant specifics (say, place widely known caring restrictions past year). even maybe someone household vaxxed yet can't vaxxed. 

i never meant say people done second dose (or Johnson) absolutely partake indoor dining. Thank you. Yeah, must US trial thinking of.

In Australia, 50M doses Novavax waiting delivery approved TGA (Therapeutic Goods Authority), version FDA. said slow decision making based Novavax supplying sufficient information TGA, concentrating completing Phase III trials elsewhere.

Clearly means Novavax focusing getting Phase III completed FDA approval United States, tackling administrative overhead Australia (a far far smaller market).

&amp;#x200B;

Thanks information! Sounds like authoritarian nightmare - perfect Aussies suppose. Well said! Time export them! fear mongering? headline stating approximate percentage increase. pretty damn dry... I'm young that's still 4% life. understandable want over. Unvaccinated people don’t attend large gatherings either. August choice don’t care happens them. know. wish people would chill fuck get vaccinated already. Happy means get quicker whole San Marino thing hilarious, glad *have to* go stadium, can't really call masks ""harmful"", you? Again, hopefully August enough people vaccinated. Answering first question: Kids low risk COVID, certainly hurt vaccinate them. Anecdotal, I've known probably 30 people 18 catch COVID (none particularly high risk), none lasting effects. Vaccinating also comes benefit making herd immunity come quicker easier. CVS setup stupid unless it’s changed.

When trying get appointments wanted schedule exacting days wife case either us commission day after. 

So pick time don’t tell day. Well heck work? got appointment window assigns day. Well that’s great lot people need definite days especially 2 part vaccine. bet tons get cancelled never scheduled that. K send Canada please. Thanks. could manufactured many countries 

Where vaccine factories sitting idle used? Even India maxing production Astra Zeneca vaccine.

Moderna enforcing patents. countries making vaccine? Late summer-early fall, seems That’s awesome! Keep up, we’re almost it! Yeah safety COVID important thing either. definitely bring back life millions killed CCP last decades. Thanks, definitely am. going out, still wear mask try keep distance! 

Stay safe I've fully vaccinated month dont want go anything. I'm working home dont want commute stand next anyone. going anywhere affected I've gained weight know go dont wat to. I've actually started seek professional help, I'm afraid I'll gain much weight could really mess self up. Yesterday went run errand afterwards sat park ate. nice wound spending several hours there. think COVID anxiety get help late. Good luck get beautiful world regardless gross is. fully agree need accelerate production complete worldwide vaccination effort sooner. disagree IP waiver helps us achieve goal. may sound idealistically attractive paper, discussed real chances increasing probability manufacturing tainted vaccines reducing future research investments, current bottleneck see production requires IP waiver address.

You seem getting angrier frustrated every reply. I’d encourage pause, collect thoughts, compile coherent argument side discussion.

What *specific problem* exists manufacturing pipeline requires forced IP waiver? aren’t partnerships rival manufacturers, kinds forged last six months (Pfizer/Sanofi Novartis, J+J/Merck, AZ/Serum Institute) leverage existing factories better option?

I really want move past insults you’re throwing get specifics think actual problems proposals solve them. unfortunate. UK got pandemic AZ. general consensus people vaccinated hanging haven't? point vaccinated person reluctant hang anyone else unless also vaccinated wondering experts data say. Continuing test safety imply vaccine less safe. continuous safety testing imply rollercoaster put operation prematurely? That’s you’re making assumption. ....and hell you? herd immunity unattainable, even vaccinate group? seems diminishing returns higher risk. shots would better developing countries, preventing (or least slowing) emergence new strains. text zip code GETVAX VACUNA spanish.

&amp;#x200B;

**Need COVID-19 Vaccine? Biden Admin Launches GETVAX Text Line Search launched Friday two text lines. text zipcode GETVAX (for English) VACUNA (for Spanish) get message back three possible vaccination sites, phone numbers call appointment. Canadian ask.... share WHAT?

They closing clinics Ontario any. complaint absurd.

We donated hundreds millions COVAX purpose. Rabies vaccine humans depends weight. Heavier are, shots get! read Fall pretty big differences European countries comes vaccine hesitancy/antivax. suspect see large differences uptake countries. worries, really. understand people would see going top I’m okay it. think best enough me. Hope you’re staying safe there, too! CTAP, yes. fail see country’s relevant. well regardless hypotheticals, real problem India potentially rest world managed well. plateau. Even vaccine inclined nations, early run, end plateauing. vaccinating first vulnerable spreading important. Yeah, vaccines really kicking butt many thread haven’t come terms risk profile post-vaccine.

Great data. I've already explained misleading use breakthrough data rather trial data./ repeat case simply read first trials showed 95%. can't use breakthrough numbers time delays.  example, lets say fully vaccinated, I'm person protected vaccine. lets say eventually catch COVID 3 months now. Well, next 3 months would counting someone protected vaccine reality I'm make breakthrough numbers 3 months.  breakthrough numbers would eventually trend towards trial numbers given enough time. that's fine - 95% REALLY good.

On top that, various issues testing reporting, etc. simply misleading people use breakthrough data instead trial data, gold-standard controlled, double-blind data. ...the mass vax center near broken up.

they're going teams 2-3 schools such.

the kids next. 

no need parents drive stadium. don’t believe Iowa authority export vaccines given feds nations Sorry, context disabled physically mentally, totally understand.

My apologies. pay taxes footing bill Stockholm, largest Sweden's 21 regions containing 20% entire country's population, looking start phase 4 week.

Phase 4 includes everybody 18 59, although (all?) regions going descending order.   Don’t let facts get way Well, no. Obviously I’m hyperbolic. left house. I’m ready protected thing. 

I can’t speak everyone child disabled physically mentally, multiple surgeries multiple weeks-long hospital stays past year. taking every precaution make sure he’s safe be. There’s lot times life 0.01% outcomes happening somehow happened him. 

So, yes, totally understand would large would probably okay (as matter fact I’m pretty sure caught one hospital stays) I’m still going everything protect him. 

I understand sentiment I’m upset point I’m willing gamble health. Even 99.99% likely fine. company planning require vaccine employees working site starting August. Informed us last week. Apparently one employees already threatened sue.

It's going interesting months think see vaccine requirements vaccine requirement bans taking effect. You’re one bought CTAP up. many acquaintances would likely agree, thanks :) Yeah steroids guess Guess got real deal lol. harm it’s hot outside annoying. It’s one thing it’s necessary safety reasons August there’s good reason it. ...and could manufactured many countries, preventing countless deaths, Gates intervention protect pharma IP profits.  probably October. Pfizer started clinical trial 6 month 12 years March. expected take 6 months puts results September. 12-15 analysis example, take FDA month analyze data. puts approval time October. barring problems. Check post thread. 

Again, data FAR better representing. 

If dose risk profile SIGNIFICANTLY lower post vaccine nothing convince you. actually read article either, law effective July 1st. Even 95% Reddit going done masks two months. Cringe previous imbecile-in-chief

That agree on. issuing EUAs three authorized coronavirus vaccines, FDA held meetings independent Vaccines Related Biological Products Advisory Committee review data vote whether recommend EUA. happen extending EUA 12-to-15-year-olds, FDA told CNN.

&amp;#x200B;

Looks fairly straightforward process. pour data (which doing) amend EUA. big meetings needed don’t know stress pandemic caused household. think herd immunity ever goal.

Depends - [the mayor New Orleans insisting remove mask mandate (which even apply outdoors, continued recent CDC guidance) herd immunity nice see times true need, even massive amount enmity (in opinion) manufactured hate two countries enough stop us empathizing other. indicative that, times tough, naturally feel relate to, India Pakistan are, even everything, countries similar other. anything positive thoughts everyone know regarding India, even though recently time real bad blood. Hopefully, use common touch point improve mutual diplomatic relationship. One friends 4 days substantial flu-like symptoms doses. think that's pretty much worst case outside vector clotting problems.  available though poor rollout previous imbecile-in-chief relevant? word Moderna vaccine testing? Cool sounds good Given rarity side effects would say make sure young women fully informed risks let make choices. belittle achievement, main source use kinds data (covidactnow.org) CT like 5th, 55% vaccinated. NH first 60% total population vaccinated 10 states 50%. 
  can’t read article due paywall. doesn’t really matter much, discrepancies always interesting. places already seeing good effect comes mortality. Even cases high, deaths much lower previous waves many vulnerable vaccinated. Oh yeah we're weeks away ""FDA approval rushed!!!"" wasn’t even available pharmacy locations January. blaming governors entire government it. I’m blaming pharmacies. vaccines very, effective it. studies show efficacy symptomatic infection declining mildly, efficacy transmission vaccinated people (which want know, really hard measure) appears still nearly complete. Efficacy hospitalization death likewise appears nearly 100%.

B.1.1.7 dominant strains taking country country [some kind horror show playing real Oh no, ever would done?

Oh wait. would done exactly already That’s uninformed are? don’t even know referred to. I’m sorry I’m sure you’ve linked helpful. you’d insane thing COVID-19 Technology Access Pool, C-TAP would helpful. talking increasing vaccine production world wide. Meanwhile Third World still struggling vaccinate elders

There's need America vaccinate teenagers low risk complications due COVID. must donate vaccines poor countries otherwise millions lose lives. FDA give approval 12-15 year olds, go ACIP meeting vote, checked ACIP website meeting month Rabies Wednesday, see anything Pfizer. yet one else signed C-TAP either. Last time checked US western based pharma companies weren’t ones came vaccines.  Yes blame governors. pharmacies Fearmongerers: ""Only listen scientists. Trust science!""

Scientists employed Florida government: ""we think necessary...""

Fearmongerers: ""NOOOOOOOOO *THOSE* SCIENTISTS NOOOOOO"" Approximately 1.19M doses given today, lowest number administered since Feb. 23. governor allowed ages 18+ first unless healthcare worker. Oxford vaccine going patent free Bill Gates swooped protect pharma industry profits ""incentivized"" work Astra Zeneca 

Which also produced India. Lol state 25% fully vaccinated peak 53,000 33,000. even going hit 40% fully vaccinated. Ya take stories huge grain salt Relax buddy I'm anti vax saw story wanted see discussion it. social media post, know even two shot chances low dying Yeah, even require 300 deaths per year make top 10 child adolescent deaths makes sense. Knowing things like fires top 10 makes completely believable, agree expecting it. We've thankfully come long way childhood cancers lifetime.   really bad facilities outdoor dining I'm from, they've giving lot space cars restaurants temporarily. really hope stays permanent thing. needs obvious enough meme cultural reference throw nutballs.

Like say something crazy, could say ""the carrots *their own* forks!"" would realize know living fantasy world. Yeah understand now, social media post can't verify authenticity it. Even get shots still chance dying low.  worked outside living, learned love Neti Pots! hope continue turn vaccines one allowed 12 - 16 (or younger). feel shot , arm sore next day. fda approval coming? Really? Bitchin. source that? Last read thought could spread it. That's true - exited covid restrictions (Perth, June last year) right avoid popular night spots bit. Everyone forgot handle drugs alcohol, random murder nightlife district (well, may random stabbing), lot ambulances remember, vibe bit disconcerting heap people throwing streets.

It's good now, assume people jump straight able socialise, especially intoxicated, without hurting one another moment things open fully again. There's learning process involved. Risk variants lmthe possibility long term damage guess. met southern california

Same here. California, suggest going California subreddit every time state lifts restrictions see people claiming governor irresponsible he's afraid recalled. declared Bill Gates new King yet? simply enjoying superior wireless speeds mobiles? large numbers last read big reason vaccinate children spread it. Granted, info constantly updating may outdated point. Pre-COVID would go shops browse possibly buying things wouldnt really need. think useless expenditures time money, feel grateful dont want things go waste. don’t think it’s pressure, it’s change. (Yes, opinion.)  say someone whose kids fully vaccinated:

Going ahead vaccinating low-risk adolescents idiotic. rarely spread rarely suffer severe issues. Even importantly, give shot single child know every elderly person worldwide first access. Yeah, that’s one read. don’t factor natural infection all... don’t get it.  SPIKE PROTEINS. SPIKE PROTEINS EVERYWHERE can't reason someone believes made facts. desperately want live different reality. Literally nothing say, save breath. thought 12-15 year olds aren’t even getting sick Covid im doctor, heres cdc page tho: tell, penicillin medication allergies arent relevant:

""Even allergies penicillin, antibiotics types medications risk get COVID-19 vaccine.""

from: experience may vary got vaccinated, asked allergies history country breakthrough issue Chile, they're using different vaccines US EU.  spread covid, lesser degree get covid. pro-mask come, I'm really tired talking one. Went eat first time tonight still abided silly 5 seconds mask wearing way out, I'm ready done.  talking treating very, large populations, means you’re going see usual run mortality morbidity see across large samples. Specifically, take 10 million people wave hand back forth upper arms, next two months would expect see 4,000 heart attacks. 4,000 strokes. 9,000 new diagnoses cancer. 14,000 ten million die, usual all-causes mortality. one would notice. That’s many people die get sick took ten million people gave new vaccine instead, there’s real danger heart attacks, cancer diagnoses, deaths attributed vaccine. mean, reach large enough population, literally going cases someone gets vaccine drops dead next day (just would *didn’t* get vaccine). could prove difficult convince person’s friends relatives lack connection, though. Post hoc ergo propter hoc one powerful fallacies human logic, we’re going get rid time soon. Especially comes vaccines. We’re 70% doesn’t include natural immunity (and got hit pretty hard initially). numbers going drive straight CLIFF  Wooo corona basically done US  crowds gather watch? impression audience going much smaller normal. know article read, leaves unanswered coming conclusion rather making long-promised exit, virus likely become manageable threat continue circulate United States years come, still causing hospitalizations deaths much smaller much smaller uncertain depends part much nation, world, becomes vaccinated coronavirus evolves. already clear, however, virus changing quickly, new variants spreading easily vaccination proceeding slowly herd immunity within reach anytime soon. Wait see impact freight costs consumer goods. Full containers China New York normally cost $2,800. They’re upwards $10,000 departures six weeks later. could find items shelves higher cost stock periods time. people industry expect continue like year. I'll read these, thank you. might hit 60% nation whole regions like Mississippi Alabama might even hit 40% fully vaccinated. Virginia seen 40% drop cases last 3 weeks hospitalization rate lowest since *The Biden administration supporting Pfizer Inc.’s move begin exporting U.S.-made doses coronavirus vaccine, White House starts unleash production shot-starved* nations abroad.

“We glad see working countries help meet supply needs,” Jeff Zients, President Joe Biden’s Covid-19 response coordinator, told Bloomberg News statement. said company ahead schedule commitments supply U.S.

The governments Mexico Canada said last week expected begin receiving doses Pfizer’s vaccine U.S., first time company’s American-made shots known delivered buyer American government.

Zients’s statement first indication administration won’t stand way exports Pfizer’s product doesn’t pass hands directly.

Pfizer said statement started exporting U.S.-made vaccine, declined specify countries. “We continue use global supply chain ship vaccine doses governments, delivering commitments ensuring continued reliable equitable rollout,” according statement

Pfizer rose 3% New York trading Monday, vaccine partner, BioNTech SE’s American depositary receipts rose 11%.

Vaccine shortages worldwide spurred countries blocs impose export restrictions, limiting ability manufacturers send product across borders cases.

Early U.S. production wasn’t subject export ban gobbled entirely government, used wartime powers prioritize orders, cornering market domestic production. allowed U.S. race ahead peers, spurred calls distribute doses countries without production. hell children need take vaccine ?? Thanks! employees already got vaccinated? miss pay/time acting early? weary out, period

If vaccinated still true they're ones drinking misinformation.  attribute greed idea here, least directly.

They making much vaccine currently. need future product appeal investors, needed not, boosters look great investors. think need them, think Pfizer Moderna think either. 

We however need investors fund mRNA company investments research vaccines TB, Lyme, Malaria, various STDs, probably universal flu vaccine. Backs beginning - aint happening yet [beyond said, already contracted] think freak lightning storm made last year's fire season unusually bad, may dry year think unlikely like 6 7 huge fires start time again. Lightning storms super rare Northern California/southern Oregon That's huge progress. Gives lot hope summer. don’t know you’re downvoted. You’re moving pace comfortable you. Enjoyed family visits! fully vaccinated parents won’t go dinner fully vaccinated people. :/ answer likely metabolic issue. kid could probably quite obese certainly thin eat well exercise trying counter hereditary metabolic bs runs family. people know could something wrong know eat limit impact. feel bad travelers all. brought themselves. said he's going increase lockdowns tomorrow. Guess want give powers. Realistically, US hit 60% total population get rid Covid. Israel shown that.

What it, like 45% total population vaccinated now? Add another 5% 12-16 year olds, 10% fight tooth nail for. still tons things try reach encourage vaccination. Totally sounds doable. 1-2 months Wow got downvoted hell Worldnews awhile back suggesting using gas generator chest freezer store vaccines vaccinating Indian villagers. Got told vaccine kept freezer temps vaccines like J&amp;J hope rural areas world. guess moral story people bad wearing masks here, think things going 49 states lol Vaccination Demographics update 2021-05-03

**% received least one dose age**

|**Age**|**May-03**|**May-02**|**Apr-26**|**Daily Δ**|**Weekly Δ**|
|:-|:-|:-|:-|:-|:-|
|**75+**|81.7%|81.7%|80.8%|0.05 pp|0.97 pp|
|**65-74**|84.2%|84.1%|82.9%|0.08 pp|1.3 pp|
|**50-64**|63.4%|63.2%|60.8%|0.18 pp|2.6 pp|
|**40-49**|51.5%|51.3%|48.6%|0.21 pp|2.9 pp|
|**30-39**|44.8%|44.6%|42.0%|0.21 pp|2.8 pp|
|**18-29**|35.4%|35.2%|32.5%|0.22 pp|2.9 pp|
|**0-17**|3.0%|2.9%|2.5%|0.05 pp|0.52 pp|
|***16-17***|26.4%|26.0%|21.8%|0.40 pp|4.6 pp|
|***16+***|55.8%|55.7%|53.3%|0.18 pp|2.5 pp|
|***All***|45.0%|44.8%|43.0%|0.14 pp|2.0 pp|

**Percentage point changes received least one dose age prior week**

|**Age**|**Δ May-03**|**Δ Apr-26**|**Δ Apr-19**|**Δ Apr-12**|**Δ Apr-05**|**Δ Mar-29**|
|:-|:-|:-|:-|:-|:-|:-|
|**75+**|0.97 pp|1.2 pp|1.6 pp|2.6 pp|1.8 pp|3.1 pp|
|**65-74**|1.3 pp|1.7 pp|2.3 pp|3.7 pp|2.6 pp|4.6 pp|
|**50-64**|2.6 pp|3.4 pp|4.9 pp|8.3 pp|5.0 pp|7.6 pp|
|**40-49**|2.9 pp|3.9 pp|5.2 pp|7.5 pp|3.9 pp|5.1 pp|
|**30-39**|2.8 pp|3.8 pp|4.9 pp|6.8 pp|3.3 pp|3.9 pp|
|**18-29**|2.9 pp|3.9 pp|4.9 pp|6.0 pp|2.5 pp|2.9 pp|
|**0-17**|0.52 pp|0.67 pp|0.65 pp|0.56 pp|0.19 pp|0.16 pp|
|***16-17***|4.6 pp|5.9 pp|5.7 pp|4.9 pp|1.6 pp|1.4 pp|
|***16+***|2.5 pp|3.3 pp|4.4 pp|5.0 pp|4.7 pp|4.7 pp|
|***All***|2.0 pp|2.7 pp|3.5 pp|4.0 pp|3.8 pp|3.8 pp|

**% fully vaccinated age**

|**Age**|**May-03**|**May-02**|**Apr-26**|**Daily Δ**|**Weekly Δ**|
|:-|:-|:-|:-|:-|:-|
|**75+**|69.3%|69.2%|67.7%|0.09 pp|1.6 pp|
|**65-74**|70.4%|70.2%|68.1%|0.13 pp|2.3 pp|
|**50-64**|46.2%|45.8%|41.2%|0.36 pp|5.0 pp|
|**40-49**|34.2%|33.9%|29.9%|0.34 pp|4.3 pp|
|**30-39**|28.5%|28.2%|24.8%|0.31 pp|3.8 pp|
|**18-29**|20.0%|19.7%|16.7%|0.28 pp|3.2 pp|
|**0-17**|0.94%|0.90%|0.58%|0.04 pp|0.36 pp|
|***16-17***|8.3%|7.9%|5.1%|0.39 pp|3.2 pp|
|***16+***|39.9%|39.6%|36.3%|0.28 pp|3.6 pp|
|***All***|32.2%|31.9%|29.2%|0.23 pp|2.9 pp|

*pp are* [*percentage arithmetic difference today's percentage prior date. example, group 55.0% today 50.0% before, 5.0 pp difference.*

Notes:

* raw data downloaded exact totals every age group downloaded [CDC vaccination demographic trends CSV. CDC indicates data ""Date Administered"", actually appears ""Date Reported"".
* Texas (about 9% US population) excluded CDC demographic data, tables match national totals.
* CDC reports vaccinations 0-17 age group. 16-17 age group calculated using 2019 Census estimates 11.4% aged 0 17 ages 16 17, assuming 0-17 age group doses given ages 16 17.  anyone help stats understand stats. crazy site (rightfully) banned here. Basically claiming ""8000+ dead, 350000 injuries!"" 

My crazy relative sent family thread, I'm sure even numbers correct (though expect lot correlation vs causation fallacy), small fraction people suffering negative side effects vaccines still far better everyone caught COVID...

Not sure even worth trying, wont change mind regardless... find hard keep mouth shut stuff like this. understand. I’ve working home since March last year rarely gone pandemic. haven’t seen friends family since live state. panicking returning work later week first time year. I'm disputing numbers. I'm thankful it. goddamn lot stupid fucking people wearing masks wonder get sick. T-cell immunity driving bus, extremely robust works differently antibody immunity.

