,date,text
Which variants win spread beat variants something don’t want find out. patrons making decision eat there. point, it’s don’t think? shouldn’t hand-holding stop there? I've seen articles kids getting hit harder Brazil India. I'm curious, want clarify mean kind pejorative way toward people countries, could worse outcomes among children partly impacted things like poverty associated malnutrition, poorer overall medical care, etc., purely function new mutations? Idk. I, folks know shit ACT went college straight students. think better ways assess students’ capabilities. colleges don’t test much know general, test content taught you.  Spoiler alert: *always* going billions people aren’t vaccinated. *always* going chance new variant (or new virus!) emerges. Covid always going exist. Better get used learn live it. vaccinated greatly reduces chance spreading transmission. much money need vaccinate 10 million people? estimate $ 500 million. I'm sure single country world spend ten times money year weapons would need vaccinate people. 10 times, say 100 times? heck Arkansas Well front guy make sure it’s “real” Thank you. stay home Thank you. feel much better expect US vaccinate population first? person 18 get jab here.

Not saying precautions aren’t needed job probably hell Earth workers families get protection need meantime ""We flying blind"" contradictory statement ""we homing in"". noticed many teachers universities also stopping teaching mostly old ones cause dont really feel teaching poorly like + trying use new platforms reopen everything, everywhere, restrictions now? I’m getting tired hearing “incredible number” vaccinations yet restrictions still feel (in Washington state least).  11 days air hotel vancouver Canada 2000 CAD per person.. takes full day half get  money?

Do really think so? literally got J &amp; J vaccine tested positive day later Welp, good run. vaccines proving protect variants. imagine health students, university cancelling practices passing theory alone put leaders place take virus seriously, competent, develop comprehensive plan, secure funding help states distribute administrate vaccines. get results. exhibit good government action. Daily threads anti-mask anti-lockdown.

Even asking restriction gets downvoted. Even unlikely, completely invalidates said. anymore last year. Millions people celebrated 4th last year BBQs/parties. people stayed home nothing last year probably stay home nothing year- “but variants!” “I’m going isn’t single case Covid” “you still follow social distancing even vaccinated.” 

Yes people like this. Quebec target June 24th ease lot measures. 
Keep hope. also great summer I'm sure. might half-baked question, but: wondering reaction vaccine acts indicator vaccine effective?

Obviously, know vaccines effective even without side effects, curious strong response could indicate real-world effectiveness body, vaccine protect *everybody* symptomatic infection? infected spread it. Israel reported 34 cases 1 death. Get damn vaccine, haven’t, end thing. throughput organization got mine really quite impressive. I'm sure they're well done, pandemic help create blueprint ever needed future. wish they'd focus getting seniors fully vaccinated giving absolutely everyone first dose.

My 75-year-old father currently hospital (non-Covid), Covid patients floor. think probably needs second dose 30-year-old sister needs first dose right now. experience, anything Youyang Gu's modelling inaccurate. way hell Ontario 5-digit case numbers summer due seasonality increased vaccinations. blows mind Canadian European officials throwing around idea restrictive summer last year. That’s exactly thought last year. End April felt like allergies, tested positive first day May. Can’t believe it’s almost year since it. sitting mountain AZ vaccines never use letting rot warehouses. that, also banning exports rae materials hinder others making said vaccines would never use. took two weeks 40% first shot, UK. So, we're probably two weeks plus couple days. Please hurry Canada seriously denying title purpose. Uptake like 80% age group.?.?  WTH? Hope younger folks match it. HK, apart anyone 16 get jab (either Chinese BioNtech - choose) get on-site certificate first second jabs.  It'll nice Canada gets cooler full vaccines. right. Probably little vaccinations  completely real accurate testing needed. someone dies don’t count falling cliff covid covid death car accidents. die covid. Got J&amp;J last Fri good midnight got chills fever migraine felt like crap 2 days .. . regrets Yeah since said safe drink...did drink it, invited Chinese, object dumping. seem much confidence Japanese scientific acumen integrity. instructors also getting realtime feed back student. Usually instructors try explain something better see class looking lost. get mostly one way online instruction. province in? BC published plan age group advising sign vaccination schedule Yeah, Bavaria vaccinating many people. Something incredibly rare maybe happening AZ...no, stop using now!

Try something tested trials still ongoing...yeah, that's good.

Interesting. three countries? Aside Philippines Japan, infection rates deaths much lower western countries overall. Even Japan it’s poor handling still fared relatively ok due things like mask wearing. Great. also helps Moderna Pfizer vaccines made US pretty good distribution network states. It’s lot harder get overseas due temperature requirements. I’m assuming they’re working manufacturing overseas well, haven’t looked details yet. Every Farman state different system. got apartment Bavarian system. money. enough vaccines going around. countries produced getting shots first. That's we're seeing here. place big push 1st's 2-3 weeks ago primarily 2nd shots right now. state New England still struggling get shots arms cities economically disadvantaged post-industrial areas. lack resources, rather appointment making hesitancy. said state leadership pulling stops (mobile clinics churches community centers, door door appointment scheduling, working local leaders overcome hesitancy, etc) get done. I'm cautiously optimistic we'll good shape end May, slightly sooner. already posted Reposts removed. Also, future, translated title post needs match actual article. example, post, actual title is: ""Study Sinovac carried Chile showed 80% effectiveness preventing death."" There's prolly bigger problems, sure. But, we've 100% learned one biggest problems public health messaging. covid vaccines miracle level that's preposterous. 99.9992% affective preventing getting covid fully vaxxed. lead messaging. Get it, wait, live life. downvoted? Dumbasses crickets man. Thats going hear problem federal government power ordering things necessary, like lockdowns curfews. That's states, last days actually discussing changing law give power federal government regard till passes Merkel try convince prime ministers states right thing even ones party really follow lead.

Merkel consistently predicting what's going happen states ignored her, weeks later predictions happened states suprisedpikachu.jpg.

But course people going blame anyway. enough vaccines world. money only. feel like deaths never get super low old people want vaccine. know people social circles want get vaccinated covid-they're healthy enough get vaccinated, want to, longer want anything them. I'd rather less friends selfish short-sighted friends care right thing.  know mean, think referring like 3 East Asian countries ""most countries Asia"" here. problem can't approach forever...people need get vaccinated want protected expect shut things every time covid spreads...the vaccine works. Nope, state made illegal issue fines violating local mask mandates. I'm exact same. find reading pandemic less less. immediate family close friends fully vaccinated too, I'm back normal hanging them. Ah, clarified, ever eradicated one *human* disease. second eradicated one cattle disease according article.


But yes, technically correct eradicated 2. technically correct best kind correct! fuckton functioning people. That's title IX ramifications, 85 college football scholarships means school must provide 85 female golf/tennis/gymnatics/diving, etc scholarships - programs generate virtually revenue substantial logistical costs bleed money. men's basketball, baseball, etc.

Athletic departments overall may struggle break even. Men's football basketball typically self-sufficient generally fund sports. similar experiment back grade school agar Petri dishes. 
Hand towel far worst household.  
The toilet flusher hand could eaten of. getting vaccinated is.


Given data vaccines protect nearly everyone death hospitalization, showing promise stop spread, vaccination clear thing service employees control.

Any public facing job risk getting sick, that's new, least covid effective vaccine...we can't protect everyone getting covid... treatments already, move along stop living fear. I've seen several sets numbers like mortality prevention number lower hospitalization number, understand works. Would happen know? would fit right 1930's Germany. Brass mouth. Tepco claiming contains Tritium only. entirely transparent before. general advice UK well today, apparently enough Moderna Pfizer given pregnant women US assess safety. never got flu shot 2019. noticed would get flu every three years sucked. get horrible fatigue lose smell taste days. mother died 2018 grieving process caused get constantly sick months. horrible flu month death. thought, ""fuck this, I'm anymore,"" decided get flu shot year after. really gotten sick since. mild cold January 2020 lasted 24 hours. There's chance still get flu getting vaccine due different strains hit less hard unvaccinated. 

Covid really changed perspective except maybe wear mask I'm sick. already wearing masks airplanes tired getting sick every time flew somewhere. standing long line Subway yesterday 3 maskless people eating, standing line food. first time throughout this, actually calling assholes mind. thought ""you know what? Odds antibodies prior infection and/or they've least one vaccine dose."" Plus 2 weeks since 2nd Moderna dose whatever 40 reporting in. Got 2nd shot yesterday. I'll feel much liberated I'm done tired (so tomorrow day after). Thankfully side effect got time around. find this? vaccines worse trials. So.. natural immunity little better little worse, depending vaccine, right? I'm sorry hear - know lockdown easy Germany. similarly insane Italy. none things got vaccine last week Saskatchewan Long term impacts vectors spreading disease. *I* seriously don’t understand there’s misunderstanding that. 

My goal parent give child best quality life possible. low bar making sure stays alive. Tell countries Asia. One human disease. Ok bot didn’t like link (an article linking study) look COVID FAQ sub, you’ll note jump 57% (protection *between* days 14-20) 76% protection (day 21) cannot find damned link discussing doubling antibodies week two three it’s driving nuts. feeling? got second Moderna dose yesterday feeling like hammered death today.

Worth it. that's means. people go ICU die. let's say 50 people without vaccine go ICU. 90% (89%) less would 5 people vaccine going ICU.  hopeful. think complete eradication disease one human-kind’s greatest accomplishments, hopeful contribute accomplishments. Probability. man truly psychopath. little doubt US would similar position dump Trump. Gotta make next 10 year count! haha Sorry, using word “several” wrong. We’ve eradicated two. [(unless Wikipedia next 15 years pretty bad too. think going hard time making kind justifiable claim herd immunity long time. LA County, reached [1% positivity rate today lowest record since pandemic started. peak positivity rate 20% estimate 3 million infections occurred across county. county 10 million people 41% 16+ least 1 shot. 

I’m sure don’t want jynx looks like we’re approaching community immunity Los Angeles. really know. could combination seasonality (they big spike exact time last year), B.1.1.7 sooner elsewhere, poor urban vaccination levels, low immunity levels due good containment prior recent months, total inability legislature governor cooperate anything. Actually, also eliminated one additional disease: rinderpest.

[source know quite ways away, honestly believe collective ability completely eliminate two diseases (worldwide) one greatest accomplishments (human) race. month ago lockdowns supposed lifted 18th, May even June. think need come end point. point varies state, province, case rate, slew bunch things. ultimate goal end mask mandates eventually ending prematurely could detrimental. state 28% people fully vaccinated; governor dropped mask mandate week ago. means 72% people either haven’t gotten choice (oh well) haven’t able get appointment either first second dose yet. That’s premature IMO. FDA revoked emergency use authorization (EUA) hydroxychloroquine treatment COVID-19 June 15, 2020, results several clinical trials failed show HCQ could safe effective treating preventing COVID-19 (here , July 1, 2020 FDA published summary review safety issues use hydroxychloroquine treat hospitalized patients COVID-19, seen . Chanapa Tantibanchachai, Press Officer FDA, told Reuters via email April 9, 2021 FDA’s recent update such, FDA changed position hydroxychloroquine since June 15, 2020. really surprised this, flu shots something get annually, would make sense covid. One shot year big deal unless stop making free get. Yep. Even vaccinated every female 18-49 (the group appears risk) looking way fewer 100 deaths current rate (I think closer 50 can't recall exact numbers). Meanwhile covid already killed something like 12000 people demographic. what's real risk? problem vaccine supplies far level makes sense start allowing this. deliveries ramping up, next weeks might see approval this. That's rude way refer trans person Yep, Europe right absolutely sucks. Netherlands we’ve lockdown since December 15, stores closed, gyms closed, basically everything closed. Restaurant closed since beginning October. Doesn’t seem like it’s going end soon either. Hypocritical probably closer truth I’d love reexamination many parents send sick kids school there’s leave parents. It’s better year hope continues! think points really accurate. vaccine prevent infection symptoms large majority time (like 65-85%), even larger majority time (like 99.9%) prevents serious illness death.

For second point, vaccine prevent spread, sufficiently studied whether enough know. Basically population vaccinated enough know conclusively, even though almost every vaccine history prevented spread target virus. opinion plenty studies Israel shown greatly reduced transmission pretty safe assumption opinions vary. appropriate title would ""almost fully protects"". one main result study says, previously infected marines: ""Infected seropositive participants viral loads 10-times lower infected seronegative participants "". means severity disease decreased. original study Lancet gives neutral interpretation, authors Mount Sinai newspaper chose show data pessimistic prism. live Germany, mom Asthma, getting shot. frustrating go FDA/CDC briefing covered stuff like this. confidence interval sides really wide. Take JnJ, 6 cases 7 million injections. 6 3.5 million women? 6 1-2 million young women? probably cases announced soon. one say risk actually based current data. thing Covid risk. odds dying Covid blood clot depends exposure risk addition factors. confident enough knowledge right simplifications like risk/reward. I'm scheduled next Tuesday. can't wait start feeling comfortable 6 weeks Y’all advice alcoholic abuses women emotionally. Don’t think right give anyone advic idea research works? Canada done first shots early June now.  


Really? Clearly metric tonne vaccines coming Canada's way. UK currently way ahead Canada expected vaccinate youngest adults mid late July. seems like good way start heroin epidemic. No, yet, soon. Vaccinations one half equation. Plummeting infection rates next step. US closed borders travellers hotspots unless US citizens residency. fiancee getting without visa country hotspot. It’s realistically marginal number doses going tourists, yes American paying honestly I’m going sweat waste military spending. right start exporting surplus doses Agree you. J&amp;J claims sell cost though. Hope joking, lot research done post rollout. told you. Yes vaccinated, can't know personal health situation. people, even post vaccination may still elevated risk given health status. 

And regardless, risk tolerance. Even perfect health vaccinated small level risk. may comfortable that.

I would pissed too. experience San Francisco, no. check id make sure zip code county. also see others thread saying opposite. would say stopping make sure 6 cases blood clots. could take time happen find. AstraZeneca think found total 79 cases 20 million shots 4 million. still small enough concern study. think everybody admit Russia well this. Like probably created successful viral vector based vaccine far. AZ J&amp;J seem less effective, also less safe. wonder vaccine causes clotting too. saying no. would worry much. exactly point vaccines. even get it, very, likely mild case. Yes government could easily made vaccine without help private enterprise. It’ll take long wait DMV, it’ll done eventually... looking covid numbers, seem set [take like [Reproduction Rate (R) 1 2 months increasing. hope lockdown measures effective vaccinating huge country India mammoth task. Except American government ie tax payer paying it. Would better export doses pay tourists get vaccinated. nothing else US saves administration &amp; service fees allowing one else jab.


Immigrants whether legal status vaccinated. may US legally selfish reasons vaccinating neccessary. Also Michigan! Damn glad I’m vaccinated fact June 1st everyone wants appointment Canada booked anyway, least first shot. Given today’s update we’ll enough stock fully vaccinate 80% adult population end June. absolute asshole thing insist Biontech 60. lead 10 million doses sitting unused warehouse June, younger people still waiting vaccine. growing community transmission high average mortality rates coronavirus Malawi, widespread concern among country’s health care advocates week authorities announced would throw away 16,000 vaccine doses expired. U.S. military, federally run vaccination sites host private companies, including CVS, Walgreens, Rite Aid, Walmart Publix, also paused injections . “entire regions countries remain insufficiently vaccinated,” said, “it continue ravage populations persistent morbidity leave larger global health community always vulnerable virus.” post appears vaccines. encourage read helpful resources COVID-19 vaccines:
  
[Vaccine FAQ Part FAQ Part appointment bot, action performed automatically. Please [contact moderators subreddit](/message/compose/?to=/r/Coronavirus) questions concerns.* One person died vs. millions died. Seems pretty clear true danger. trust data wait medical paper providing strong evidence suppositions based something extremely rare rate occurance. need stay month? world probably doesn’t care US, AZ abbreviation state problem disclaimer doesn’t protect vaccinated people exposure cause breakthrough infection. think better approach allow mixed groups mandates distancing masking use passports allow fully vaccinated gathering proceed like 2019. reason need restrict activities vaccinated people, allow unvaccinated people participate indoor activities everyone masked. don’t see big deal.  amazes narrative vaccines never prevent infections continued repeated again. Even solid data fact significantly reduce infections. Hello Michigan! keeping plague going strong!  Yesterday wife celebrated exactly two weeks past second Pfizer shot going parents house family party. played nephews first time year hours. really excited age spray spit make noises playing. 

When we're getting ready leave sister informs us nephews physical school moment one best friends tested positive Covid deemed close contacts. parents also fully vaccinated year paranoia, getting spit night couple possibly Covid infected kids irritated me. know good, never tested might even it, livid told me. Guess going take bit longer get mental hurdle ""back normal"" thought. Thanks goodness science vaccine protection though! transparent though? 
Why lay math used derive risks exceed benefits?

Like way look certain assumptions would true risk vaccine exceed risk covid. Taking account things mentioned. opinion publish assumptions, outsiders evaluate reasonable.  

My perception based feelings risk, hard data.  benefit abundance free testing linked civil registration number.

Denmark testing around 200k per day via PCR population), slew others via antigen tests. going vaccinate not?
This article saying much could vaccinate really gonna start, miss something? 
🤨 clearly putting words mouth. I'm saying vaccine super joint project many countries involved development. could always bypass border using many unguarded crossings. I've AZ jab. strong supporter AZ doing. comes point trust data accept problem needs managed careful selection recipients. Denying problem helps nobody. probably best study this: /r/COVID19/comments/mfrv1i/interim_estimates_of_vaccine_effectiveness_of/ ""Under real-world conditions, mRNA vaccine effectiveness full immunization (≥14 days second dose) **was 90% SARS-CoV-2 infections regardless symptom status;** vaccine effectiveness partial immunization (≥14 days first dose second dose) 80%"".

Note ""regardless symptom status"" part. includes asymptomatic infections. vaccines prevent infections entirely 90% time, symptoms. Weird. People Nordrhein-Westfalen seem still fairly well following restrictions. Like everyone still wearing masks part least. We've yet curfew though Ontario here. want wild ride. 

Ford complete disaster. Months non-science-based half measures gotten us here. tired schtick deflecting blame federal government vaccine procurement isn’t working anymore. third wave government.  I'm sure find exception there, trend exceedingly clear: UK turning inwards. skin cancer spots?!

can specific mean why, cancerous, removed doctor? hard line. going depend regional risk Covid, availability vaccines, etc. sure it’s match harass women drunk bbc fantasies? Yeah father law got doctor. I'm sure could managed online confusion call doctor (or see regular checkup) ask it, that's lot people end getting it. 

Navigating multiple sites different login info, limited appointment availability disjointed hurdles people far doubt prevented otherwise-willing people getting vaccine yet, I'm sure time trickles regular medical care outlets we'll see willing unable numbers dwindle.  CCP evil also capable scientists working it. sound like child. 3 year old nephew anaphylactic food allergies trial related one, otherwise sister would tried get one trials. said, vaccine authorized EUA age group, he’ll get vaccine long isn’t contraindicated (although reason think would be). far CVT 4 million Pfizer / Moderna &amp; 5 AZ used lot AZ UK. Though Oxford study &amp; behind AZ combination low platelets 

There concrete proof seen state low platelets related blood clots. seeing low platelets could related unrelated clots. theories causing vaccines are. platelets well may causing clots, also unrelated side effect. Covid cause blood clots, low platelets &amp; spike used may causing immune response causing issue.







If choice wait MRNA AZ going wait vaccinate vulnerable ? mrna use sure cautious. choice AZ maybe mrna come summer 70+ would wait ? think what's lost debate risk mrna available. either Az nothing vulnerable globally. groups dropping like flies covid &amp; collapsing hospital systems. There’s opinions; facts. It’s one sure truly right. know humans destroying planet causing catastrophic climate breakdown. know coronavirus exists, kills people; know vaccine far safer letting virus run rampant Keep money, please throw lumber fence. ragging - honest - instead want say find use word ""sauce"" place usual ""source"" utterly delightful

I hope starts trend :) guys responsible study obviously. couple bad scientists don‘t mean everyone bad. Also last time checked, age building influence intelligence people within, maybe oxford study too? supplement industry trying put exercise pill feel like need keep repeating stating obvious. I’m saying people without college degrees can’t high-paying careers can’t get good jobs, general, holding else constant, college degree makes candidate attractive. Additionally, college-educated people make money average people without degrees, that’s backed data. qualify receive vaccine (age / occupation), free, includes visitors. ask ID check age. long registered online local address (which check). 
 
However border suspect might entering US get vaccine turn away bar fr entry future. correct. works vaccinated group control group (unvaccinated) size. states don’t care. People state (Michigan) getting vaccinated Ohio Michigan opened Q: buffets open?  Pfizer lol Probably vestige America extremely plague-ridden, due vaccine less less true passing day active area study using genetically modified viruses fight tumors. Obviously dangers, might mean studies using coronavirus oncoviruses.  Frau Merkel, you?

Obviously next lockdown come total censorship media, traitors saboteurs can't make fail simply stating work. maths assume populations size? think article gives enough data calculation. Unless I'm misunderstanding something, already various ""double mutant"" variants get media fixating much idea particular context. threshold acceptable risk FDA? 

