,date,text
[Vaccine FAQ Part FAQ Part appointment bot, action performed automatically. Please [contact moderators subreddit](/message/compose/?to=/r/Coronavirus) questions concerns.* told could use Google transcript translate video played background, translate everything believe go ahead let Google translate you. Cubans getting internet, patients able take pictures videos conditions post Facebook. real name get visit police internet access get restricted. Good Cuban people protected, caveats limited skepticism data exaggeration. Remember government rejected standing global vax invite protests pitch, US lefties claimed blockade responsible lack vaccination access. serve justification rulers' means end multiple fronts.

This probably stave whatabouts yes, kind caveat apply domestic US politics well (i.e. Trump re-election earlier vax messaging adoption rate higher, people would bemoan 'at cost' public health win come at.). briefly looked they’ve passing anti-nepotism laws year listed least handful former complaints. sounds like kids. conversation we're constantly deciding fly every given situation. 

Please act like understand. provides options people.

Like dealing child offer two choices satisfactory system decide they'd like:

Get vaccinated

Get tested

Don't work

There's non zero subset people would get tested get vaccinated. know couple personally one hospitals work at.

Of course think get vaccinated, staff shortage crazy regular testing provided consider acceptable alternative tell development is? seems would refer sequencing DNA HPV vaccines mid-80s subsequent (+20 years) development Gardasil Cerverix? must bigger that, can't find mean.  safe assume forced. communist country. Funny thing is, insurance companies actuaries could final bulwark rising tide stupidity short-sightedness deal *actual* reality *real* risks, *financial* consequences pay things like increased risk death and/or disability COVID, greater risk global warming, etc drive premiums, *that*, ultimately, may spurs action.  Yeah same, woke feeling fine. thought would never see Granma article Reddit 1 question ,which arm Coming say choice orange/yellow decrease blue increase garbage Cuba many times, no, really any. Cuba lot issues, people would generally considered poor US standards, electricity often unreliable, country good providing *basic* level subsistence everyone preventing *extreme* poverty. There's essentially homeless population, there's big emphasis education, means there's essentially illiterate people. everyone capable accessing least level medical care well.

By far biggest thing keeping people Cuba poor US embargo, really fucked population Cuba nothing effect political change originally intended to. problem low resources. make two hospitals, one people likely serious issues long term willfully, one group likely survive, usual medical rules treatment supplies go group likely survive - vaccinated. okay, let's build two hospitals, staff unvaccinated hospital unvaccinated, get ""overflow"" supplies, what's available left treating vaccinated people. 

I'm gonna guess would scream discrimination, usual, that's actually hospitals make decisions every day, pandemic no. hope recover quickly! definitely know reporting definitely sure reporting telling reporting about, right? Nobody lost job citi yet. get vaccinated approved exemption wlll not

So anybody get impacted blame ""Ich bin ein moron"" actual difference eight months they're widely available? people gotten yet, they're anti-vaxx matter dress up. Spoof Town USA Exactly everyone overlooking, fact jobs high demand ridiculous benefits giant waiting lists get them, I’d willing bet majority people lists would willing get shot order hop jobs vaccine mandate seems like mixed blessing. You’re losing cops. maybe shouldn’t cops anymore. Seeing can’t one thing stay healthy insure safety meant protect. aspects job careless irresponsible about? Cuba 11 million people. Anything less .000009% less one person, percentage work. Wait second. thought Cuban regime extraordinary controlling reported what. come able present critics sudden? fits narrative rely journalists gvt controlled outcome evaluation concluded international team? Yeah, we're done here. I'm surprised 1 20 us complete abject imbeciles. Good know (US) aren’t country dumb shits. Rapid Antigen tests better many people seem believe. would cost effective way catch cases. Could keep (somewhat accurate) PCR tests travellers from
countries higher rates Covid). It’s matter dropping testing requirements entirely keeping place. getting downvoted Cuba obviously dictatorship certainly corrupt shady western world. spewing chauvinism sake it.  Right there’s literally giant waiting list NY firefighters they’ll replaced pretty shortly word? No, watch footage hospitals I've linking judge think great Healthcare. That's all. Talk doc ASAP Nobody wants come think anyone saying China deliberately released virus. question lab released virus studying due negligence. example potentially similar situation, check [Sverdlovsk Ah see. take word it, right? absolutely ridiculous huge waste tax payer money! pay state back salary loses. Yeah true, one time hit might not. insurance wellness screening stuff $100 *per month* added insurance premiums. ""Susan I'm mall Florida speaking circulating Coronavirus particle. wants endorse De Sanctis re-election 2022, saying, quote 'the Governor great job we're firmly behind another term!'"" I'm trying avoid going around people possible; since car can't pullup testing end began. lot states tried giving literal money get shot worked extent. ones left $500 wouldn’t budge I’m sure. intellectually disabled people, autistic people etc? excluded denominator? point decide someone who’s way behind reading school gets classified “excused literacy count?”

I’m reminded infant mortality US inflated early pre-term births counted live births put NICU, suboptimal survival rate. countries, count early births hopeless stillbirths. fucked up. still get it? matter actually citizen. reliable source, period. researcher, scientist kind, journalist kind, dude internet telling opinion. That's it. That's are. care ID slightest. Even **if** would provide it, change thing. still random dude internet. form sabotage definitely, still blockade. know blockade is? bottom slimy health insurance companies be, think distinction vaccine diabetes many people develop diabetes lifestyle. argument Covid ""well, could gotten vaccine probably avoided incurring costs."" Lmao!!! Another incorrect fact. I’d actually argue you’re one exhibiting lack empathy. 

Not everyone constantly close contact unvaccinated family members point means (what see mind as) gambling child’s health. 

Again, situation theirs. put people’s shoes try bit understanding decisions. feel like route would met less resistance mandate. would less political would led less obstinance. think Cuba would still comforably fall within definition third world, considering low living standards, meagre career opportunities... yeah, adding totalitrian regime top that. Thing is, I'm sure ""robust"" concise definition third-world, rather, use refer underdeveloped countries. I'm undermining - life Cuba clearly extremely tough majority, plenty kids rich first world countries surviving school lunch. Capitalism prevent problem, all.  picking sides likely argument politics opposed medicine, information always better less:  Umm located? BC we're nearly 90% double vaxxed without harsh gathering restrictions minus vaccine passports non essential services (which bother me) lifes feeling hella normal last couple months. liar Cuba's last census 2012 vaccines approved children aged 12 older Europe Norway decided give children aged 12-15 one dose.   Yeah, 3d August. mass vaccination kicked in. think quality healthcare life expectancy different things. Americans love stuffing unhealthy shit destroy health something else.  really can't risk elections US 90 miles away. US long history interfering elections depose leftists, especially Latin America. That's also Cuban government restrict media. US tons money easily propaganda Cuban government push politics right. Soo... 3.6% maybe say that. 

3.6% refuse take vac... discharged public sector struggle find jobs unvac people. covid-positive person arrived flight New Zealand reportedly hotel quarantine, **hopefully ensuring disease doesn’t spread throughout unnamed person arrived flight Christchurch, New Zealand Wednesday 215 people.

I bad news Tonga.  people work acquaintances gotten covid clients dumb companies made dumb individuals. hear X person company got covid… everyone like, yeah, kind expected guy antivaxxer would get covid (guy well known generally idiot).  Probably US. wrote census timing constitution back 1789 really hard one. representation congress (and political tricks like gerrymandering) tied census, people power tend want change system put power, hard change. wild, know means, playing stupid refusing acknowledge I'm using third world way ""underdeveloped"" rather NATO vs CIS meaning. guy continued striking teenager even lost consciousness. He's lucky escaped attempted murder charge. case lot gruesome white guy yelling at/shoving employee... 
**This article originally published 7 months ago may contain date information.** 

The original publication date April 1st, 2021.
&amp;nbsp; 
&amp;nbsp; 

^(This bot finds outdated articles. impossible 100% accurate every site, differences time zones date formats may little off. Send message notice error would like bot added subreddit.)

[^(Send ^(|) [^(Github - ^(|) [^(Github - Chrome Honestly feel like reasonable response. costs money unvaccinated people. pre-existing condition. Free market, right? sweet summer child.

oh paradigm perfect united states destroyed! innocent! Thank illuminated redditor showing way!    What's Cuban government lied past? trust onher data more? know pharmaceutical companies lie regularly, all. Type PIN Number ATM Machine Hey loser, socialism works well, CIA toppled every socialist leader and/ cripple economy economic sanctions? Checkmate 100% ""eligible"" population mean 100% population. Without knowing define qualifier, know proportion population vaccinated. sound counter-racist, know anything Philadelphia Sesame Place, would know immediately perpetrators black. Idk, maybe comment history r/Cuba sub years might convince you? I'm sending ID citizenship card stranger

Like... grandparents? aunts? uncles? friends?

The lack empathy staggering. ""pov"" nothing conspiracy cannot see already addressed blinded narrative. I'm done here.  Abstract

We conducted severe acute respiratory syndrome coronavirus 2 antibody seroprevalence study among domestic cats 4 countries first coronavirus disease wave Europe. found 4.4% seroprevalence using virus neutralization test 4.3% using receptor-binding domain ELISA, demonstrating probable human-to-cat transmission.

Conclusions 
During first COVID-19 pandemic wave, reported seroprevalence levels domestic cats ranged 0.4% Netherlands (4) 23% among cats COVID-19–positive households France (13). Similar seroprevalence levels cats humans areas found us others suggest absence another known source (4,13; C. Schulz, unpublished data) (Appendix Table), SARS-CoV-2 infections cats likely due human-to-cat contact transmission. 
 
Most natural SARS-CoV-2 infections cats appear run mild subclinical course, respiratory gastrointestinal clinical signs reported confirmed natural infections (6–8). Evidence experimental studies suggests cats susceptible SARS-CoV-2 infection maintain virus within cat population spill infection backward forward species (2,3,14). However, evidence cat-to-human transmission, cat-specific mutations variants SARS-CoV-2, detected thus far (8,12,15). finding contrasts reports minks kept farms, mink-to-human spillback infections mink-specific mutations reported (5). Although evidence currently suggests domestic cats play role epidemiology human SARS-CoV-2 infection, clinicians veterinary practitioners recommend SARS-CoV-2–infected persons avoid close contact domestic cats practice nonpharmaceutical prevention measures toward cats prevent human-to-human infection. Lol good post.

But here's thing, actions , people, short term cause/effect things, dont think anticipate chronic always believe stop harm themselves.

The jab one done, red blue pill decision. Modern medicine long line screw ups. progress perfection. Covid vaccine, accelerated progress hoping close perfection. may be.  
Some folks hesitant bad end 'experts' medicine, like me. 

So lived like hermit waited see happened everyone else getting shot. First one bad, waited 8 weeks , took second one ZERO side effects. NOTHING. worry actually got flu shot immune system screwed catch get seriously sick Covid anyway.

All gambling opinion, gamble take. could live like hermit anymore make decision.

We never get raise drink covid over. People realize one day, long time since wave hit areas, parade absolute day call thing done, everyone nervous another variant cropping fall spreading around, another virus like come out, sars3 whatever. 

Innocence lost. wish rule workplace. I'm tired continual outbreaks.  Cuba inspiration. Despite 60+ years illegal US embargo, interference, aggression managed provide people world class healthcare system. accomplishments astound me. trigger mania, cause bipolar disorder. happened finally diagnosed released hell depression. father in-law antivaxxer high risk many conditions. recently went funeral 7 days later couple people funeral tested positive. best course action make sure catches he’ll fighting chance? 100% ""eligible"" population. might define ""eligible"" include something like ""we even know are."" Don’t forget give magical 5G powers. flu shot today option get booster. pretty bad side effects second covid shot originally vaccinated. know it’s “safe” I’ve looking mentions anything bad side effects before, it’s ok get time knowing you’ve bad side effects. want get done since I’m already going today. usually reaction flu shot. high school wasn’t bad.  first time two decades, cigarette sales increased last year COVID-19 pandemic, tobacco companies also beefed spending promote Federal Trade Commission, annual Cigarette Report, said manufacturers sold 203.7 billion cigarettes 2020, 202.9 billion 2019 — increase 0.4%. said ""The US like 30% illiteracy ""21% adults functionally talking mathematical illiteracy.  grew reading King James bible Shakespeare can't comprehend anything reddit comment two clauses less. Cuba higher live expectation US Citizen? wild even Google pointed bank wanting cut hand help greater good. Getting vaccinated helps public health. person's freedoms end encroaches people's. source. nothing random stranger internet rambling narrative trying prove YouTube videos. That's are. sure hope. would love see big retailers require it. One big employer place recreation town.  Calling rule federal contractors must show proof Covid-19 vaccination submit weekly testing “heavy-handed mandate,” Gov. Ron DeSantis Florida announced Thursday administration suing federal government challenge requirement.

The lawsuit, filed U.S. District Court Tampa, seeks block Dec. 8 deadline imposed Biden administration federal contractors get vaccinated.

Legal experts say federal government broad authority address public health crisis like pandemic measures like vaccine mandates suits little chance succeeding. Supreme Court turned away legal challenges vaccine mandates Indiana University health care workers Maine.

Mr. DeSantis, Republican, spoke news conference Florida Air Museum Lakeland, nod state’s aerospace contractors. Among named defendants lawsuit NASA administrator, Bill Nelson, former U.S. senator Florida.

“We’ve got big footprint companies contracting work federal government,” Mr. DeSantis said state. “There’s lot folks cross hairs this.”

Joining Mr. DeSantis news conference state’s attorney general, Ashley Moody, several contractors relatives. One contractor provides vending machines federal state buildings said yet gotten shot “waiting information” vaccinations.

Information Covid vaccines issued vaccine makers, Food Drug Administration, Centers Disease Control Prevention many news organizations.

Mr. Biden told would-be litigants vaccine plan “have it” announced September. several Republican governors vowed that.

Lawrence O. Gostin, Georgetown University law professor specializes public health, wrote email “DeSantis almost certainly lose lawsuit.”

Mr. Gostin said expected Biden’s order vaccinate federal workers contractors would stand, even states banned vaccine mandates, Constitution’s supremacy clause federal rules pre-empt state local dictates.

“The president head federal workforce,” Mr. Gostin wrote. “Just like business employer, clear power set reasonable, evidence-based rules ensure safe productive workforce.”

Lawsuits like Mr. DeSantis’s politically motivated, damaging feed public doubts vaccination, Mr. Gostin said.

Mr. Gostin said thought mandates include religious exemptions, like one health care workers New York State, could legally vulnerable.

“I feel strongly legal requirement offer religious exemptions, Supreme Court highly sensitive religious claims,” Mr. Gostin said.

Mr. DeSantis faces re-election next year, considered leading hopeful Republican presidential nomination 2024 absence bid former President Donald J. Trump, state last two elections. months, Mr. DeSantis forceful opponent Covid vaccine requirements.

This year, Florida Legislature Mr. DeSantis prohibited businesses requiring customers show proof vaccination. Mr. DeSantis said intends call special legislative session ban employers requiring employees vaccinated. also vowed Thursday Florida — requires students public private schools get least six kinds vaccinations, including diphtheria, measles hepatitis B — would require schoolchildren get Covid shots.

On Thursday Lakeland, Mr. DeSantis stood behind lectern sign read “Protect Florida Jobs,” warned wave attrition federal vaccine mandates allowed take effect.

“We going deny people ability make living based decision injection,” said.

— Patricia Mazzei Abstract 
Considerable uncertainty surrounds timeline introductions onsets local transmission SARS-CoV-2 globally1–7. Although limited number SARS-CoV-2 introductions reported January February 20208,9, narrowness initial testing criteria, combined slow growth testing capacity porous travel screening10, left many countries vulnerable unmitigated, cryptic transmission. use global metapopulation epidemic model provide mechanistic understanding early dispersal infections, temporal windows introduction onset SARS-CoV-2 local transmission Europe United States. find community transmission SARS-CoV-2 likely several areas Europe United States January 2020, estimate early March, 1 3 100 SARS-CoV-2 infections detected surveillance systems. modelling results highlight international travel key driver introduction SARS-CoV-2 possible introductions transmission events early December 2019–January 2020. find heterogeneous, geographic distribution cumulative infection attack rates 4 July 2020, ranging 0.78%–15.2% across US states 0.19%–13.2% European countries. approach complements phylogenetic analyses surveillance approaches provides insights used design innovative, model-driven surveillance systems guide enhanced testing response strategies. Procrastination one factor. cities Germany success going socially disadvantaged quarters vaccination buses overcome barriers vaccination. post appears vaccines. encourage read helpful resources COVID-19 vaccines:
  
[Vaccine FAQ Part FAQ Part appointment bot, action performed automatically. Please [contact moderators subreddit](/message/compose/?to=/r/Coronavirus) questions concerns.*  Ya you’re getting Moderna. Likely it’s got way mRNA juice Pfizer, really went overboard miss shot. 

It also shouldn’t affect all. rest world mixed doses since day 1 due lack consistent supply. Canada anyone AstraZeneca first dose (not mRNA) got mRNA second dose, simply they’re much effective. Could little off, I'm sure huge decline *wouldn't* expected one largest local spikes covid history. lot people could get infected, got infected lax enforcement masks, social distancing, lower vaccination rates.

Vaccines definitely job preventing mass hospitalizations deaths, Florida's approach may quicker herd immunity. cost many, many, unnecessary deaths illness.

But obviously yeah, could definitely underreported quite bit still due changes reporting dishonesty irresponsibility current administration. Dude, source, born raised Cuba father died hospital that's showed videos. No, I'm gonna send father death certificate yes I'm giving much personal info public site. friends family Cuba I'm republican all. seen live videos go seen profiles people went school getting deleted posting them. Sadly left leaning source gonna talk like right talk something fit narrative. call carrying costumers. don’t understand neglect children getting sick. UK it’s like don’t care. wedding last days far around 10+ back positive including myself, rough stuff. vaccinated one badly sick surprised much spread small group.. Yes, nearly sharp previous waves. numbers infections near doubled last week might bit early see means terms hospitalisations. critical, continues rise might trouble later winter, especially combination flu. Unfortunately, herd immunity means may pipe dream. Early estimates 70% vaccination required proved inadequate. likely need closer 90% vaccination. Subtracting age 0-4 results 96% uptake remaining population. Knowing vaccine's effectiveness decreases time and/or variations disease, uptake needs completed certain timeframe (I'm guessing 8ish months based recommendation booster shots elderly). assuming US bubble too. Open borders would require 96% uptake globally less effective vaccines removed equation. China's Sinopharm, rather large example, estimated 70% effective best. true, China needs start using effective vaccine. would first admit vaccine good, though. would extremely character them.   second world term slightly undeveloped economies stronger cultural unity, case didnt know Well weekly testing imo good enough. get tested come negative go work, catch covid know week later, exactly many people might run around infecting? Iˋm really feeling lot better now. day half feeling ""negative"", canˋt quite describe better. Christ almighty, Iˋd hate real thing.

All AZ shakes chills afternoon, negative feeling.  actually originally term used cold war, referencing countries third parties ""war"" part NATO Warsaw. Cuba side Soviet Union literally second world country poster understand Cuba controls media narrative. Tiene la cabeza metida en ya tu sabes donde. cUbAn bOrN rAiSeD

Sorry man, lost there. problems constant attempt use Cuba's problems sort mental exercise, missing entire irony using links news prove one points deny ones dumb

Good luck googling stuff, se que funciona de maravillas para alguien que quiere jugar la carta de que todo es propaganda en todas partes. 

Talvez tendrías mejores resultados intentando leer sobre Cuba en reportajes en español, de primera mano, antes de siquiera intentar asumir la nacionalidad de otros.  I'm going guess type person throws punches told follow law CEO high ranking individual workplace. likelihood particular person randomly rich pretty low. Last time checked, September, 54 US military deaths.

There's saying military sign, body belongs Uncle Sam. shoot head choose it... define something even close 100% population? Lol, don’t spend money troops. 100% literally means everybody. bad practice round without specifiying decimal rounded. say example 99.6% implied rounded first decimal. move Florida; hear DeSantis welcome open arms country's idiot un-vaccinated.  They'll need pursue civil case that. case friend, would doctored sample size credibly say 100% even though bullshit. purely hypothetical though. (Yesterdays numbers, forgot post yesterday)

USA update first dose shots:

Last 7 days: 1,724,085 (previous week 1,671,170) 

7 day rolling avg: 246,298 (238,739 Last Thursday)

221.3m age 12+ first dose - 78% (219.6m - 77.4% Last Thursday)

206.1m adults first doses - 79.8% (204.5m - 79.2% Last Thursday)

66.7% overall (66.2% Last Thursday)

At rate, first dose shots:

11/30: 229.2m 

**12+ population numbers (based 284.1m population)**

11/30: 80.8%

80% 11/21

**18+ population numbers (based 258.2m population)**

7-day rolling avg adults 229,971 (217,877 Last Thursday)

11/30: 82.8%

80% 10/30

**Total population numbers (based 332.6m population)**

11/30: 69%

70% 12/13

_________________

This probably last update 12+.

