,date,text
0,2021-10-28," irrelevant. work first responder, public safety number one priority. anti-vax Officers Firefighters. mean sound racist totally expected white people can't help think everyone eligible part got vaccinated necessary. lot dumb people think everything conspiracy theory are. FL high overall case number states already spikes significant portion population antibodies?

If rates stay low extended period time anti vaxxers get again, little encouraging East Carolina represent harder pharmacist administered said she’s seeing go ways different patients.    Well, let's start ex-USSR people way accustomed death relatively young (by Western standards) age way reasons worry daily basis.  


This one alone helps ""even die, least I've seen sea one last time"" mood. comment nothing subject matter. NYC First Responders. debbie downer much would things like testing sites closing availability take home testing kits affect this? things would skew number down. know LA area much harder find testing sites was, I'm sure places harder. could lot unreported cases. opinion, done earlier. mandates important public health standpoint. They’re way increase effective tool suppressing pandemic: vaccines. Mask mandates, boosters: make somewhat difference scale getting first two doses. US? Bad news 

New study shows waning immunity 6 months getting vaccinated Mexico seen plateaued increase cases last 7 straight weeks. NM among first states get vaccine roll out. first in, first out. places vaccinated first seeing waning immunity first.

The FDA support booster shots everyone instead muddled mess message sent out. thought way. 🤔  Oh, family politically connected high levels (Republican). example care home SE Oregon

Of places... trying quickly make space new customers? They'll hold anti-vaxx gofundme reap thousands. Seriously.    growth ? Russian purchasing power hasn’t budged 10 years Unreliable doctored numbers. Florida seceeded US ways legally. Florida. (MT) State Medical Director resigned shortly new gov arrived. this. viruses creep back decades later initial infection -polio chicken pox name couple. Seeing covid crosses blood-brain barrier - worried covid infection something like vaccine side effects. imagine 20 years now, whole generation young parents dealing kind post-covid syndrome? kids, thank you. Well fair, lot scientists believe covid airborne virus long, long time. Good. patient asked prescription. I'd need see evidence ... think bad.

The booster almost recommended risk reduction small ... vaccine effectiveness reduced, much. difference risk vaccinated unvaccinated 20x (for Pfizer), efficiency loss much smaller. Put another way, vaccinated year ago, still much smaller risk never vaccinated.   melhor 7 1 Neither true Obviously communist plots ""Big Librul"" 100% right Bruh wife going right now, wrote mom 3 page nice handholds letter basically tell butt out.

Her response - ""don't take seriously lol""

🙄

If start setting boundaries young adult, narcissist parents respect you!!  Ah, Wisconsin. get lost, don’t worry, you’re right Iowa Ohio. They'll tasty &amp; anti mask, ditch job, carry sign like fool...until rent due, truck payment, Cheerios &amp; milk gone, nobody wants attitude job interviews. Either need shouldn’t flexibility, don’t need mandate first place. I’m supportive mandates, I’m getting tired government implementing requirements enforcing them. makes worst worlds.  got moderna booster yesterday (first two moderna well) it’s completely laid today. Much rougher two, could also I’m pregnant. Gonna suck finds IRS local government tells pay taxes gas, food, property income.

Also laws things live state nation. “Most likely die” puzzled physicians past… hey algorithms used determine that? 

#They biased fuck. “Do harm” Gotta let gramma take one team /s issue whether got prescriptions Internet. did. Wink. NIH saying least 8  5% lot. Something read recent NYT article Putin's opposition distrust among Putin's supporters. got wondering govt tolerating even encouraging misinformation one hand, Putin promotes other. playing political double game disrupt opponents? ah yes. Makes sense. get overall, one difference April October amount vaccinated vs unvaccinated. fact way vaccinated also drive breakthrough cases sheer numbers? Though logic, unvaccinated people declining, either getting vaccinated dying (antibodies likely help recovery) yet numbers still went up, also mean much higher % unvaccinated got infected, too?

Idk I'm dumb reddit browser making casual observation, maybe I'm missing something. mean likely smartest bunch… ""You need put mask!""

""Says who?""

""Sesame!!!"" Hi everyone - looking peer reviewed articles looking natural immunity vs vaccine-mediated immunity vs hybrid (infection + vaccine) terms preventing spread infection/longevity protection. Also articles addressing side effects (mostly autoimmune/cancer) would helpful well. anti-vaxxers family baby way... sigh. following literature long time since got vaccine quite early. Anyway, thanks help! Colorado behind rest country since least spring. think probably something right 20-21 winter delayed surge every state saw. guys covid going summer state long past big spike Yes. can't ship people larger hospital adjoining state. I'm living right now. Lil' niece came visit Sunday, basically took cell phone said ""bye Felicia"" played Fortnite left Tuesday morning, tested positive Covid today. think got Saturday cousin coughing visited her.

I know barely saw (2-minute max) parents presented symptoms (all us vaccinated. Parents SINOVAC, one dose Cansino April one jab Astra 3 weeks ago, waiting second dose)

Cue grandmother, want vaccinated bedridden fever, headaches, cough. suspect Delta since symptoms appear rapidly.

Here's hoping trend continues. tested good measure Saturday. far, good. vaccine history vaccines 100% effective preventing infection. Oh boy. McCoy's ploy hurt boy annoy running comedy


In seriousness though, major lost opportunity media get declare ""THE OMEGA WAVE"" mean early history pandemic gone little differently, hyper-partisan Ds might become anti-mask hyper-partisan Rs would gone opposite direction.

For example, Trump freaked virus restricted China demanded mask mandates lockdowns confirmed cases US, easy imagine refusing wear masks get vaccinated might common among Ds (as symbol defiance).

Neutrals might still mildly pro-mask Nobody knows true denominator, bit both.

But Cuba given [2.24 doses per far country. They're using protein subunit vaccine (similar novavax much lower dose), highly effective great safety profiles. [Case plummeting (R(t)~0.7 5-day serial interval). so-called adults  400 severe cases 5,000,000 vaccinated people. 13,000 infections total. data studies focus on: test pick symptomatic people covid? situation opposite: testing vaccinated asymptomatic people yield false positives real positives, big risk false positive?  tell base truth. KNEW air. said it. Denver/Boulder/FoCo better that. Nowhere else mess Big Bird. Nobody wins. Checking Google, upward trend time last year - dip behind us. year, looks like we're legit moving (but average still higher last year per day). 

I'll take cautious optimism. Automatic translation bot, action performed automatically. Please [contact moderators subreddit](/message/compose/?to=/r/Coronavirus) questions concerns.* post appears vaccines. encourage read helpful resources COVID-19 vaccines:
  
[Vaccine FAQ Part FAQ Part appointment bot, action performed automatically. Please [contact moderators subreddit](/message/compose/?to=/r/Coronavirus) questions concerns.* I'm gonna cynic say states fully reporting again. sorry dumb question, uniquely bad situation Hawaii? island? Probably coincidence Cuba's literacy rate 99.75% (US's 79%). Got booster last weekend. daughter's husband also got boosters, waiting word 17 year old get booster. us got flu shots, too. prepared, hope.

edit: word Also, Knudsen signaling partisan hack, currently trying conservative creationist governor. takes every opportunity make front page effort forward national political career. think early pandemic read something saying never reached herd immunity disease infection only. become endemic. was, old SSR's broke away 1991.

I fall old habit overestimating population. boosters approved everyone, age now? Regardless it’s Pfizer, Moderna, J&amp;J? 1.5-3% state ~2% overall (states vary 41% (WV) -71% (VT)). Worth noting portion numbers 12-17 yr olds may jobs... *is* effective (in doses would kill horse, much less human.) go habit burger instead.  raised prices bit bit expensive INO burgers much better INO lot better side selection soggy fries. it’s impossible they’re literally saying isn’t single random eligible person anywhere island isn’t vaccinated. need either prove could possibly know say 99.9%    Well take Aspirin, duh! Use Tylenol something. 🙄

^^^^^^^/s Means getting Moderna booster I'm pretty sure. Maybe pull complete 180 get anti-vaxxers vote progressive policies like UBI! Well, gosh! put way.... Well union funded member dues. city pay expenses defend case. Yeah pediatrician list receive began setting appointments.   feel like glossed much financial liability unvaccinated employees are, Delta Airlines said average employee hospital stay Covid-19 $50,000. Unfortunately many never leave hospital disabled Covid-19. Nobody's employer wants pay hospital bills testing vaccines free readily available.  Google show county level data Staving BS artists.   people somewhere around 10 times likely die become infected unvaccinated people

I know need new glasses think statement means intended mean. FWIW got Covid Effexor still almost killed me. *Back 90s* long term effects? (unless it)  idiot office side pond time. Unfortunately still making noise office idiot fan base. definitely make pandemic go worse. Next month itll probably 105% Adjusted population what? Show work. article place: lots different studies sequentially mashed together without consistent narrative. eye-grabber headline yet peer-reviewed. sound like good friend.

If me, probably wouldn’t restraint tell off.  Cases falling similarly UK too, hopefully continues. Nah Sweden definitely positive excess deaths. Norway negative, perhaps that’s source meant. hours post this, Hawaii announces they're readmitting fans proof vaccination beginning 11/3. I’m King Co WA think there’s good chance we’ll get point. But, myself, I’m trying make time point future hospitals operating normal conditions treatment methods advanced much further. meantime family members immune deficiencies vaccinated taking appropriate precautions. antibiotic abuse, unfortunate enough get stomach bacteria took 6-7 years eradicate almost died it. shame hospitals caving $$$ results people's suffering...oh wait...that's American Health Care system  See ya. Rooting guys. know feeling. Looking booking photo woman, think got punished enough. looks like thinks everything right. Fart Ass Farting Olfactory Think that’s fucking weird look Dutch Wonderland. two places DisneyWorld kid One possibility: may already recovered sesame place via workers comp claim.  details aren’t yet, seen violation $14,000. sure consider workday separate violation well employee. count separately, gets prohibitively expensive. Also put onus company record keeping employee saying tested, doubt many companies want setup department keep track tests. This. Someone said Russian people fell misinformation campaigns, true all. 

Russian distrust governmental institutions long history. also suspect Russian cultural views suffering, pain, perseverance play role death toll unwillingness vaccinate.

Also, shame person said Russians ""reaped sew"". actions Russian trolls, part Putin's security apparatus, separate general Russian populous used condemn population also victim authoritarian government. Excellent. really well protected now. fired instead? Personally, endemic state COVID start (in area) mask mandates lifted (including local transit), become personal decision (if someone wants mask, can, mandates). Since mask mandates still place area (Boston MA)  Oh doubt viral load high enough makes sick, immunity long lasting general, recover. all, immune system makes difference whether antigen vaccine virus. response fairly similar, except differences intensity due differences dosage exposure times.

Apparently, strongest immunity found people recovered got vaccinated. [The CDC people require testing decide around others... around others * 10 days since symptoms first appeared * 24 hours fever without use fever-reducing medications * symptoms COVID-19 \*Loss taste smell may persist weeks months recovery need delay end isolation​ FDA warns using humans!! Shit, it’s 79%? Even functional literacy? would thought bigger maybe?  guy tryna pick fight. Report mods. mean, dude teenager gross, kinda spot here....  Bruh called dewormer! one said bad drug. uses. using dewormer virus, MAKES SENSE. dewormer...parasitic medicine virus???  got first booster Moderda got J&amp;j back Aug  hope Trump pulls 2025!!!!! suck balls corrupt heck!!!!! asked doctor give ill family members antibiotics cold, would it. diff covid dewormer? defending wacko dewormer lovers  Oh no! Anyway... point determine patient longer contagious, method?  feeling booster? I'm trying decide day get it. Honestly seems like chance symptoms. timeframe China noticed, identified, reported, sequenced virus, figured dangerous began lockdown Wuhan, SARS-CoV-2 seroprevalence 9 states America 1.1%. add Apple Wallet, days doubt numbers real    think one primary reasons low wage jobs struggling hire.

We know psychos waiting snap ton people probably choosing walk job things start feel unsafe.

The people willing take risk ask enough make ""worth it"".

If feel unsafe job DEMAND $5 / hour raise. quit give you. Either make work space feel safer get pay extra. see bottom line changing they'll make changes. middle school teach online last two weeks many cases. Guess said finally came back today, “we going enforce mask mandate school students teachers.”

Guess fuck happened, kids quarantined. people never learn.  comparable numbers. number Cuba (and pretty much numbers find comparing countries literacy rate) measuring known ""basic literacy"". measures ability things like write name read basic signs. US (and developed countries) also 99+% basic literacy rate.

The 79% number refer US measuring known functional literacy. sure exact figure comes know exact definition using, usually refers ability things like read understand news articles. certainly useful number, cannot compared basic literacy numbers. quick google search come anything functional literacy number Cuba, even different studies tend different definitions hard compare. Sorry hear, yea winter coming too, stay safe! Triple shot! Done yesterday. Currently feeling like doo-doo. Worth it.   many clues, counting-enabled anyway.  antivaxx movement strong Russia, fact Eastern European countries, like Romania, Latvia, Moldova, Ukraine etc. 

Maybe try soft people. Instead forcing (like communists would do) try persuade people, since believed Democratic way. Nobody wants associated communists, anti-communist movement incredibly strong post-soviet countries. get shot! Yes u r right Maybe syringes lesser problem doses themselves, probably **not so** short time send asap too. submission automatically removed linked source may reliable may dedicated mostly political coverage. possible, please re-submit link reliable non-political source, reliable news organization recognized institution.

Thank helping us keep information /r/Coronavirus reliable!


*I bot, action performed automatically. Please [contact moderators subreddit](/message/compose/?to=/r/Coronavirus) questions concerns.* read thread posting, made analogy

never said article No, probably infected many slowing down. Also may changed behavior. make decision, one needs know why.

You considerate enough tell decision was. enough. Makes way less depressed covid.   Yoooo! need get mine ASAP then! incredibly false. approve booster anyone 18+ 6 months past second shot. announced last Friday.  go Cookie Monster him? Tried twice respond. let say stupid swear all... Lol I'll DM think 18+ basically get one reason. Like, they're going verify whether actually particular condition whatnot.

That said, people mental health conditions added high risk category, think criteria covers something like 80% adults now. heat subsided it’s safe go outside Florida, fully vaccinated rate ~60%, imagine good portion 40% remaining antibodies. waves followed similar trend last year too.  people able get booster now? Like people protected group? don’t remember now.     people know it. Cuba would lot better inhumane blockade imposed U.S. 50 years. United Nations told knock 30 years ago. Literally nobody Earth except U.S. Israel supports blockade. misinformation though. CoviVac fiasco (authorizing efficiency shown)

That kind shows CDC covering assess protecting American people, lost much trust could ended like Russia here. absurd think that's option everyone. Cuba authoritarian single party communist government wealthy individuals office population lives extreme poverty. Cuba sucks. fucked regime, US.  Economy too.. no, wait  Good motivation get vaccinated :) I’m seeing doesn’t say “anyone”. high risk individuals. definitely “Gretchen, stop trying make fetch happen, it’s going happen” energy, “shot” really better? Add ... unvaccinated rest world. want vaccines there, snapped countries whose intended targets willing take anyway adults go Sesame Place without kids? done front kids? One thing learned pandemic disposable respirators, N95 filtering facepiece respirators (FFRs), suitable solution protect exposed pandemic pathogens due crisis capacity issues. recognized OSHA ETS regarding occupational exposure COVID-19, released past summer encourages employers make use elastomeric powered (PAPR) respirators prevent OSHA therefore clarifying respirators required protection workers exposed suspected confirmed sources COVID-19 healthcare settings, cases respirators must used accordance Respiratory Protection standard (29 CFR 1910.134). _OSHA also encourages employers, possible, select elastomeric respirators PAPRs instead filtering facepiece respirators prevent shortages supply chain disruption. crisis capacity strategy less protective, employer use crisis capacity strategies limited period time **take immediate steps purchase use elastomeric respirators PAPRs order prevent future shortages** expose workers grave danger COVID-19._

Manufacturers performing ongoing work improve elastomeric half mask respirators use sort situations, including producing models without exhalation valves improve source control speech diaphragms improve communication get unlucky enough go another major pandemic lifetime, improved elastomeric respirators / PAPRs help avoid months-long respirator shortage experienced spring/summer 2020. read second half sentence Borat voice. course leaves better fight next time (for VAST majority peopel). wasn’t true vaccines wouldn’t really work well either.  remember forces work last year time. Lots people traveling home holidays. Okay, two things here, speaking CA.

1) Life pretty much gone normal masks. Concerts, bars, sports, beaches, theme parks, everything open. Disneyland? Packed. Hollywood? Packed. Santa Monica Pier? Packed. consider harsh?

2) Florida currently 7th total deaths per capita. California *35th*. saying Florida better results? Better who? Maybe crematories need look trending point last year. 

This point last year everyone decided go travel Thanksgiving Christmas spread COVID.  Sweet. Stay home isolate.  mean, would not? Unless like one-way mask something, can't help feel would violation physics, something, particles could easily enter exit. gets completely lost discussions PFE, unfortunately. There's mask filtration rating. ... would force drink antifreeze pass out... driving rural Oregon , recently hit really hard covid , dude said, “ it’s demon possession time high”.  before. believe around early summer last year  never discounted anti inflammatory properties ivermectin. It’s strong enough case push anti-parasitic medication unnecessary risks side effects plenty anti inflammatory medications indicated respiratory infections sepsis. 

Antiparasitic equal antiviral Thank you. Don’t understand possible write entire article figure wrong without posting correct number! Oof. trying find jobs elsewhere get out. former teacher (quit bc pandemic response) 3 kids. wish live AZ throughout shit show. McMaster Canadian university TOGETHER large scale platform evaluating multiple drugs. Ivermectin one, fluvoxamine one, multiple others. 

The ivermectin community believes medical community conspiring discredit ivermectin name profit, social control, shit. Acknowledging valid study acknowledges TOGETHER trial ivermectin also legitimate. way that.

Here slide deck interested: mean pharmacists pharmacy workers trained jab. Safest bet nurse hospital Fantastic. rest don’t work disease spreading vectors anymore. Possibly, figure going remain problem. level short-term side effects - dehydration, flu-like symptoms, etc - normal vaccines. fell propaganda directed USA.

[Essential topic. Viva la revolucion! Also never trust Florida data - someone moved Florida  Mate behind medial paper reading- pop Google scholar Google anti inflammatory properties Ivermectin.
Just something heard mean new idea wrong.
Also antiviral comment automatically removed linked source may reliable may dedicated mostly political coverage. possible, please re-submit link reliable non-political source, reliable news organization recognized institution.

Thank helping us keep information /r/Coronavirus reliable!


*I bot, action performed automatically. Please [contact moderators subreddit](/message/compose/?to=/r/Coronavirus) questions concerns.*  Totally true! vaccine prevents people getting spreading COVID never another variant pops up. clear, COVID gone forever. type out. great expression, flows better annoying look up.

The first time saw used Capitol Riots Ashli Babbit took one neck. watching stunning video reddit, someone comments said, ""She fucked around found out."" Putin spent [decade spreading anti vaccine disinfo internet, unfortunately him, internet worldwide, he's getting blowback dumbass propaganda infecting people.  white. Excellent  Myocarditis linked hit vein What’s shitty Cuba stuff US done continues Cuba. Um.. WA state 3.3k today, twice amount yesterday.   likely, kid working time assaulted, workplace accident sesame place probably paid it, workers comp did. case, main party financially hit Employer. kid still free pursue civil charges, judging character criminal, probably isn’t worth it. doubt much money pay anyone Hey now, two countries shitty time.  comment automatically removed linked source may reliable may dedicated mostly political coverage. possible, please re-submit link reliable non-political source, reliable news organization recognized institution.

Thank helping us keep information /r/Coronavirus reliable!


*I bot, action performed automatically. Please [contact moderators subreddit](/message/compose/?to=/r/Coronavirus) questions concerns.*   I’m whatever bunch is. Speak (as 🥴) I’ve drawn beliefs opinions throughout none doubting efficacy surgical mask. 

And none ever vouching use ivermectin (other weakly proven therapies) best practice. Initially got J&amp;J available time, following guidance. Almost conjured tears joy getting Modena booster week. Cool. Based pics protesters heading subways, aren’t even masking go subways. That’s meeting basic requirements existing NYC much less requirements public servants. protestors misinformed, entitled, egotistical, selfish short sighted. they’re also powerful city.  5% seems really high. I've reading seeing, 5% say wont. However, week deadline, 1% less get vaccinated. That’s share U.S.-based United Airlines employees vaccinated Covid-19""

Go month without paycheck UI. people get vaccinated back workforce.   know it’s controversial, plastic used syringes easily sterilized. I’m betting you’re coming country lied it’s way killing hundreds thousands Iraq. Go though. ""mere cop"" might intimidate doctor, easily injure kill them, patients, arresting reason. psychology matter here, fact police infinite, unaccountable, power, does.   new coworkers aware antivax lose face shouldn’t mandated FDA panel. scenarios lead favorable risk outcomes. cases vaccine hospitalizations outweigh vaccination outcomes made available mandated. need follow studies catch rare side effects. Well, shouldn’t mandated states still will….. move FL Mills McMaster runs

I idea means.  select high risk environment go. won’t asked single question. really easy. Yeah mine yesterday morning hit last night 12 hours later. still feel kinda funky- like last day missing work going back. warm weak tired. It’s different ivermectin. I’m sure proven ivermectin effective, unless it’s last resort would take Merck pill needed three varicella vaccines finally pop positive antibody tests. never caught kid bizarre reason.  lab theory relevant could show risky research negligence caused pandemic. could bring criminal charges prevent similar pandemic future. hypothetical, prediction.

That's says ""if.""

