,date,text
Our wider use mRNA vaccines certainly put us better situation important fill partial fully vaccinated gap too. That’s part never understood  Better nobody able anything than, god forbid, let people longer risk stuff asking still public health risk stay home. Amirite? That’s nuts. sure haven’t seen. fuck care?  share borders Idaho meaning eastern parts states crazy AF. Seriously. Oregon part white militias are. Lucky. eligible yet can't bloody wait! Agreed, TV news loves hero vs. villain narrative, spring 2020, really easy tell story Covid Cuomo bravely standing evil despotic Trump. Plus, NYC based media scared shitless, got personal them. Righttt. Guess depends want life. little slow holiday plus think anyone wanted one already. Hopefully get kids get Agreed. used work kids family two babies, toddler disabilities one parent worked overnight shifts. definitely complicated people depending situation. That's still way high. expensive test provider listed gov.uk last time checked like £120. thing one says american. say equally hyperbolic statement opposite. never seen people say America doesny problems, always see people unnecessarily shitting it. average person, amercia still one best places could possibly live. states keeping track, theres nothing national level Maybe signed vague. way check card real? digital signature something see issued central authority not? IG FB flooded people whining ""CDC Leak"" can't find anything all? You’re getting downvoted, know I’ll wearing one public transportation flu season. indoor dining/bars, max 100 people events (until last week 25), masks mandatory indoor public spaces + outdoor markets (and similar spaces) plus ton small regulations clearly devised bored bureaucrats - nowhere near insane onerous places *but* they've recently gone whole-hog vaccine passports become permanent fixture life, sadly. we're gonna reach 60-70% vaccine coverage people trust government, - hell, stated goal 50% end June. fault top 5 corrupt EU governments, really.

Also, plan returning normal, vague promises ""somewhat normal life"". messaging local public health experts boils ""don't even think taking masks"", ""we cautious long virus among us"" (so, permanently cause sure hell going away), ""maybe something normal mid-2022"" classic ""vaccines stop transmission"".

Oh, Israel, 85% vaccine coverage among adults (I think something like that, might misremembering) *still* indoor mask mandate. read somewhere sub might rescinded next several weeks know point ""a couple weeks"" turns months months. vaccine rollout Australia utter disaster blame lies firmly Federal Government. Rank incompetency. dos semanas deux semaines due settimane Well vaccines 2 doses right? skeptic ever use line ""do know anyone died covid?"" great followup now. There's pandemic work kids neighborhood I'm sure, personal experience exactly scientific. however seen multiple kids ten neighborhood really start go deep end last months. kid friendly everyone cut contact several neighborhood boys truly disturbing behavior. problems probably work covid can't imagine pandemic helped anything damn bit. really consider past year wasted year all. 

The bad: skipped social engagements, avoided dining quiet holidays immediate family. laid job employer took massive financial hit due pandemic.

The good: spent shit ton time outside exercising enjoying life. Dozens mountain bike rides hikes; 50 trips mountains snowboard. managed land better-paying job employer saw huge increase business pandemic.

If life sucked past year lockdowns prevented dining going bars, well, maybe spent time re-assessing priorities. Developed countries privilege developing countries don’t have. leads freedom ignorant.

I’ve seen people classify preventable diseases get vaccinated “mild childhood diseases”

Polio measles definitely mild. you’d rather disease vaccine, you’re creating problems don’t enough.
You’d think access amazing healthcare technology would allow people make better choices that. card name, vaccination dates lot numbers vaccines. Can't remember doctor signs Meanwhile, Australia... 🤦‍♂️ increase cases leading increase hospitalisations.

Which entirely expected happen. Link soft paywall. brief needle-free COVID-19 vaccination passed pre-clinical trials, developers excited possibility painless, easy-to-use patch could roll future waves coronavirus Australian company Vaxxas, spun University Queensland develop technology, working University Texas Hexapro vaccine candidate UQ’s David Muller, running pre-clinical trials, said seen excellent results mouse models, even better results vaccine administered via needle patch thousands tiny “microprojections” mini-needles surface coated Dr Muller said delivered vaccine specific layer skin prompted immediate robust immune response compared tradition Unlike needles, patches hurt, single-use risk Hexapro relatively stable vaccine, patches stored room temperature, tested remain stable least 30 days 25 degrees one week 40 degrees. guys signed cards? hell even issued? doctor writing ""swear mum guy vaccinated""? Damn internet speed going fast. Reddit users American. post appears vaccines. encourage read helpful resources COVID-19 vaccines:
  
[Vaccine FAQ Part FAQ Part appointment bot, action performed automatically. Please [contact moderators subreddit](/message/compose/?to=/r/Coronavirus) questions concerns.*   awesome idea imo    people complain probably sacrificed least. Excuse I'm willing sacrifice grandma *economy*. managed get appointment AstraZeneca Germany (late 20s male). Looking well gone UK, guess worried rare clots that? :) listen, comprehend unless someone tells baby talk. think Trump popular limited vocabulary really resonates idiots. links Ardern denying it? curious two weeks flatten curve begin. It’s almost like scientists change say based readily available information. Huh. “doctor,” Rand knows this.  Governments Canada Ontario. Look article sources.  Go read Vicent Racaniello's reply thinks need boosters today's AMA. T-Cells recognize far virus antibodies. got watch 10 people die March 2020 March 2021. 2020. Watching someone die pretty much every month so. Stood side many graves. Went virtual funerals. even services due covid. covid. One cancer. One various medical issues. Scattered amongst people dying phone calls got panicked friends telling husband/wife/mom/dad/grandma/grandpa hospital think going make it. dad (who estranged spoken 5-6 yrs) called one night told mom (who knew sick) probably going make prepare myself. people ended making including mother idea going case got call people didn't. lift covid restrictions back March nothing could've ended side 20 different graves instead 10. better all? 

And I'll say year entirely make life entirely make it. turned 40 2020. big birthday bash planned Disneyworld family/friends. Instead nothing. suck? Yes. make have. 

In 2020 running ever (couldn't get house otherwise early days lockdown) ended pretty great shape 'til injured Oct. learned noodle around ukulele messed around number hobbies skills. working home isolation. planned 2020? Absolutely not. could make best bad situation. drama queen. I'm fully vaccinated still need go bullshit last year travel work. patience things get back normal. hoard vaccines Big pharm make killing crisis, China taken overwhelming lead supplying developing world vaccines end global health emergency. earth would Taiwan (which ALWAYS China, get it!) need fucking vaccines west, unless trying tear China apart? (which western imperialists totally trying btw). dollars donated doses. money COVAX received used purchase vaccines poor countries. 

The way COVAX set rich countries pool money together bulk contract deals pharmaceutical companies 2:1 ratio get keep. every $2 spent rich nations get $1 vaccines. $1 goes poor countries, way rich nations get something also donate something return poor nations.

COVAX delivered decent amount vaccines far poor countries Canada making impact. 

The criticism made Canada receiving $1 $2 spent entitled COVAX system. criticizing stating believe Canada instead giving full amount paid COVAX vaccines go poor nations instead 50% COVAX system intended work.

This fair criticism. Canada able receive large amount vaccines unilateral bulk contract deals made pharmaceutical companies. high vaccine rate compared world average, criticism made enough. would agree that. think Canada donating point. issue really specific COVAX though, Canada matter. broad Western world vs rest world problem.  St. Louisan here. Busch water treatment plant. Yup-the wave seems dying majorly. Lats month would hear stories people dying everyday, relatives hospital every week, huge oxygen shortages etc. None past 2 weeks. situation still bad catastrophic before. see wave ending july. threaded needle around outright lie.

They said basic masks reduce spread, true. also said primarily protect others, wearer. Also true.

They relied old shoddy research suggest normal people learn take good advantage wearing small particulate filtering respirator. weak knew it. wanted preserve supply medical providers. entire time they’ve using clip January saying literally exactly what’s emails “proof” lied. they’re pretending email brand new information prove point. everyone who’s paying attention knows asymptomatic spread less likely, China didn’t report numbers, masks protect others droplets, wearer. There’s 0 new info. opposite isn’t true, Canada accepting foreigners unless they’re travelling approved reason people don’t fit narrative silenced. got banned sub expressing contrasting beliefs. Come humanity, better forget scared!


- CNN That's low risk... 24 million children age 12-17 US. vaccinated, almost 100k would experience SERIOUS side effects. what? Protecting unvaccinated adults? Serious MIS-C rare even worth mentioning context. Furthermore, vaccines even shown anything regards MIS.

It everyone's mutual benefit. ones benefiting unvaccinated adults. Statistically, children seem real benefit it.

The Alpha strain around since November, dominant strain Europe since. 

Personally, think vaccine mandatory adults. Leave children it, benefit them. people freaking Indian variant not, interesting note rise cases India widely covered media nobody talking fact cases India 30% peak.(400k May 8th, 130k yesterday).

And yes India underreporting would true May 8th like today landed moon (69) time realized segregation bad (65). Humans simultaneously smartest dumbest living things planet. UK probably far less natural immunity US does. got info digging! Thanks info didn’t mean mislead anybody. Shocker absolutely nothing states vaccines immediate effect (even small one). CTV News, Government Canada. happen. Israel, US part Canada lifting restrictions way EU lift restrictions 60-70-% vaccinated.

What exact restrictions country? 45 years might lifetime parent’s, calling privileged view. example holds true though, done progressively better limiting loss life due war, famine disease, yup absolutely. events happen, even North America. It’s choice (and other’s) either make best year completely write off. Like said think latter privileged view. Yeah, pretty complicated. strong state governments (Mostly Labour.) really saved us federal government’s mishandling covid. liberal government PR arm (The Murdoch Media) absolutely went apeshit trying undermine them.

The Federal government responsible vaccine rollout absolutely botched vaccine rollout.

Zimbabwe Brazil amongst countries vaccinated greater percentage population Scott Morrison managed. Considering rich nation amazing infrastructure relatively low population absolutely shameful. Basically going emails Fauci said things like Masks working can’t spread asymptomatic people. don’t point emails sent January February last year close nothing really known virus. Basically classic republican truth bending flew back States volunteer political campaign fell love it. No, far perfect, also amazing. Americans FARRRR interesting friendly Canadians (who polite quite dull). 

I get someone wants hate America need process brainwashing got kids. Hopefully eventually come back around loving amazing, incredibly imperfect, place. (AMZN.O) testing front-line staff Britain coronavirus variants feeding data public health officials, including hotspots strain first found India spreading fast. Aided rapid vaccine rollout, Britain verge reopening economy months lockdowns Delta variant first found India spread, including areas Amazon lab fulfilment centres. Luke Meredith, director Amazon Diagnostic Laboratory Britain, said company open offering service United States, rule making testing programme available UK public future. compare everything Black Plague, then:
""Did 33% city die? No? stop complaining!""

Nowhere say anything remotely close ""it's bad war!""

This is, however, worst disaster least 45 years North America. Peru worse off. looks like Uruguay getting soon. Get numbers right friend... one test “fit-for-fly” test cost £169 outgoing £210 book gov website. Interesting times alive live Europe lol. Vaccinations guarantee normality Europe. be, much pretty clear statements I've read - talk ""normal summer"" (implying beyond summer normal) ""some sort normal"" actual, restrictions normal. pretty much seems like pipe dream point, way we'll ever get permission actually live life fully again. Hell, ""experts"" already started warning 4th wave fall, least country.


Plus, whole vaccine passport thing despicable repulsive me, bald-faced lie would used make travel easier. clear, I've already signed get vaccinated want second-class citizen want basic right going shops/restaurants without brain poked every 3 days ""privilege"". Raking tourist bucks patch wrecked economy =/= return anything resembling pre-March 2020 normality. Europe gone deep end restrictions, zero chance we'll seeing restriction-free life regardless vaccine uptake. There's difference virus yielding immune response - normal - strong enough protect year later variant immunity evasion.

Neutralization titers reduced significantly vs. several variants. Looks like vaccination drive turning great opportunity promotions freebies boycott cruises, period. Awful environment. gone now! usually signified † character vote count. think enough people upvoted comment finally push solid positive territory. Go France! 🇫🇷  Sadly given wealthy countries. Still good sign progress countries good vaccine statistics begin look helping countries Global South. R/angryupvote also: 2 UAE, 1 Egypt/Lebanon vaccines made better! Good news! UK general low hesitancy vaccines compared to, say, France. prominent antivax celebrities authority figures. initially hesitancy ethnic minority communities prominent people got board campaigned. Plus then, tangible impact, vaccine campaign gathered momentum. 

I think vaccines centrally controlled, via NHS, probably helped well tbh. I'm aware of. information Government  currently allow links ibb.co difficult verify information posted there. Please consider posting link original source instead.


*I bot, action performed automatically. Please [contact moderators subreddit](/message/compose/?to=/r/Coronavirus) questions concerns.* YEAH Canada! Cool. Around 12 billion shots go. I'm really cruises reasons. comes novel pathogens take genius guess cruises would major problem COVID. would say significant part there’s lot national pride trust NHS. Maybe. US like 75% people 40+ well. main unvaccinated population *are* younger population, motivated risk simply smaller. Lot anti-maskers comments. Vaccinated*; ""partial"" bullshit semantics, propagated cowards. Yes, fully vaccinated 5/19 Pfizer, left trip 5/25, showed one symptom 5/31, tested positive 6/1. Very, rare, almost noticeable symptoms. Vaccine job yanks vaccinated hopefully Nonewnornal already. Calling faucis arrest too. Probably around 70% end summer, 75-80 end year. that's guess Yes think accept 500-1,000 deaths year Covid without making changes masking social distancing. average 500 deaths year flu. oh good know, thanks I’m guessing would doesn’t full FDA approval sounds similar schools able require pupils reason. major reason called ""under developed"" nations way resources going towards survival due geographic issues beyond control remnants colonization.

As healthcare nations systems obviously well funded total dollars they're pretty smart systems.

We could definitely take lesson two. Incorrect, there's absolutely zero effect vaccine day 10-12. studies done, no-one saw statistical effects day 13. friend got mrna vaccine absolute unicorn  loathe needles that's big part get it, though now. get COVID vaccine recently eligible get second too. $1000 figure incorrect. get packages test release less £300 (the £300 highest end provider offering Test Release found shopping around regular PCR). talking hotel quarantine dramatically undershot cost almost half. I'd curious got figure. got close. due first one last Thursday. 

My partner tested positive COVID last Wednesday. we’re isolating next chance 23rd, goes well.

So close. It’s annoying, really. managed 1.5 years shit safe sound right last hurdle. seeing many “just begin,” “end beginning” type articles? new hip phrase? Can't Mississippi State &amp; Ole Miss competition see get proof vaccines game something? Hey y'all, hoping someone help me. noticed coworker today making fake covid vaccination cards. They're kind person likely give friends use family travel purposes. entity report to? so, what's best way so? get vaccinated, pandemic over. Paywalled. post appears vaccines. encourage read helpful resources COVID-19 vaccines:
  
[Vaccine FAQ Part FAQ Part appointment bot, action performed automatically. Please [contact moderators subreddit](/message/compose/?to=/r/Coronavirus) questions concerns.*  proof UK smarter USA. (I'm American citizen). vaccine denial hesitancy true IQ test   Complete opposite live. Cities rural areas hesitant ones would think would go way since vaccinated people likely people take virus seriously.  Color surprised Michigan would much higher city Detroit would get higher 34%. Even rest county outside city limits 60s. recent poll shows 10% ""never"" jab. apathetic hesitant another 20-30%.  Flu season shorthand kinds respiratory crud peaks around time - influenza, adenoviruses, rhinoviruses, RSV, endemic coronaviruses, name peaks. see preprint? study peer reviewed submitted medical journal already? I’d love read it. true, one many reasons statistics complicated would initially think. going argue that. running vaccine campaigns...the intention vaccine campaign protect individual, it’s reach enough people vaccine actually takes steam pandemic community. definition vaccine campaign incentives used drive meant reduce mortality caused disease. 

With said, don’t care anybody’s motivation is, got shot you’re part solution. \-- Alarmist Name News walk get vaccine places Missouri. unfortunate people getting sick, themselves. Ctrl+c state's excel sheet national one? Vaccines given age state. state got equal amount vaccines per capita. Vermont vaccines longer. posted another sub I’ll cut paste here:

I feel like really non-story. 

They already know exactly many people got AZ first shot, last date AZ first dose given out. 12 weeks date (plus weeks wiggle room), point necessary doses spoken either via second dose, appointment one. 

Unopened vials AZ shelf life least six months. expiry long know need them, words. 

Whatever left, whatever else we’ve purchased, donate countries need. It’s rocket science. That's elitist. wonder many rural people think people cities assholes want tell live. goddamn PRESIDENT pushing alternative medicine entire Republican party. That's ""a politicians"". Try racism somewhere else, k thanx. Yup. aunt like this... somehow nurse. surprise? It’s made abundantly clear nobody charge cares kids. paper they’re alive, that’s schools still marred restrictions next year, they’re open all. double digit percentage gen Z kills within next 20 years almost medication mental problems, nobody care. fact life.  would literally take act Congress.

The group people charged tobacco users. 

Because using tobacco thing people choose increases chances needing medical care. flu shot’s around since 1940s… like mess drag years. Goodbye.

Antivaxxer? Excuse me? miss part said get vaccine? exactly say people get vaccine? 

Just capable understanding risks 30's take AZ (unlike you) mean anti-vax. logic entire UK government anti-vax absolute fucking moron. 30 wants safe take alternative vaccine AZ. think that's anti-vax even dumber thought.  wonder fact things getting good US (aka decrease cases) part reason people rush get vaccinated. Compared countries like UK/Canada is/was recent wave scariant fear. India stopped prioritizing bullshit religious treks actually fighting Covid would much better. hand, CDC fomites first idea damn near everything, *and* know droplets still major source COVID exposure (See: early Korean air conditioned restaurant study: 100% gravity effect COVID transmission suggests droplets primary form transmission) say aerosols form occurs, droplets seem far dangerous. like Fomites occur, it’s extremely uncommon. wait see going looking case counts get summer. much case counts tied seasons (I.e. US massive spikes holidays individual states spiked people likely outside). 

If get summer waves I’m going feel way comfortable dropping mandates rules. I'm sure evidence Curevac, Valneva, Novavax &amp; GSK/ Sanofil better, offer effective, scalable production? 

So we'd chucking eggs Pfizer basket hoping get supplies ordered decent time.  Haven’t suffered enough? saving lives thing obviously big thing, ""others"" never majority folks concern.

I would wager majority people got vaccine themselves, probably various reasons, ranging wanting get sick, wanting get back lives, simply wear mask anymore probably reason cannot think of. 

I sense preventing death others high many folks list reasons, might say nice side benefit, see main driver folks getting vaccinated.

Personally speaking, got vaccine desire get sick, protecting others really part thinking, though nice side benefit

Edited correct grammar **Jun. 3, 00:00 (UTC+9)** 

... 

Since Feb. 26, 

403,780 vaccine doses newly administered 

1st vaccine doses administered : total 6,741,993 

- 381,551 doses newly administered 

- AstraZeneca : total 4,296,043 

- Pfizer : total 2,445,950 

2nd vaccine doses administered : total 2,220,728 

- 22,229 doses newly administered 

- AstraZeneca : total 564,526 

- Pfizer : total 1,656,202 

... 

( # local transmissions Thursdays Aug. 6 '20 Jun. 3: 

23→47→276→434→188→141→145→109→67→60→95→104→106→108→128→293→553→516→646→993→955→940→833→496→380→479→429→467→590→369→401→444→427→419→537→674→670→715→650→562→692→619→620→672 ) 

( # local transmissions day May. 28 Jun. 3: 

571→505→464→411→449→654→672 ) 

... 

681 confirmed positive: total 142,157 

- 9 imported 

- 672 local transmission 

3 dead : total 1,968 (case fatality rate 1.38%) 

-2 severe/critical : total 149 

631 released : total 132,699 (93.35%) 

Infection unknown routes 2 weeks (~ Jun. 2, 00:00 ) : 28.0 % 

77,049 tests new cases 

- 37,974 tests suspected cases 

- 34,335 tests temporary free-testing sites Greater Seoul Area 

- 4,740 tests temporary free-testing sites outside Greater Seoul Area 

36,388 confirmed negative, including negative results temporary free-testing sites 

Tentative (conservative estimation of) positivity rate: 681 / (681 + 36388) × 100 ~ 1.84 % 

... 

Among 9 imported cases, 

America : 7 

- US 6 (4 foreigners) 

- Canada 1 (1) 

Asia outside China : 2 

- India  (2) 

... 

Among 672 cases local transmission, 

Metropolitan cities 

- Seoul 215 

- Busan 32 

- Daegu 73 

- Incheon 22 

- Gwangju 4 

- Daejeon 15 

- Ulsan 8 

- Sejong 1 

Provinces 

- Gyeonggi 207 

- Gangwon 16 

- Chungbuk 5 

- Chungnam 13 

- Jeonbuk 12 

- Jeonnam 3 

- Gyeongbuk 11 

- Gyeongnam 23 

- Jeju 12 

... 

S. Korea increase contributions global vaccine mechanism: PM 

... 

Companies increasingly adopt 'vaccine leave' amid accelerating inoculation drive 

... 

Gov't expand in-person classes month amid concerns education gap Automatic translation bot, action performed automatically. Please [contact moderators subreddit](/message/compose/?to=/r/Coronavirus) questions concerns.* post appears vaccines. encourage read helpful resources COVID-19 vaccines:
  
[Vaccine FAQ Part FAQ Part appointment bot, action performed automatically. Please [contact moderators subreddit](/message/compose/?to=/r/Coronavirus) questions concerns.* already studied one back January among thousands study participants got tested weekly People say time disparity attention negative news attention positive news. like also makes sense right? something isn’t going well want draw attention people power communities take action help out. I’ve seen articles highlighting positive news, wouldn’t productive wall wall coverage ""Supportive community""? Hah, literal opposite 2020.

&amp;#x200B;

The actual Covid-19 support reddit fit mold little better. call once-in-a-century pandemic ""unexpected circumstance"" can't imagine would qualify ""crisis"" book. mind's eye, hellscape dimension everything tries kill you. (Like Australia, cubed.) months averaging 10 deaths per day, MN finally seeing significant decrease. I'm hoping genuine, delay reporting. last 3 days, we've 1 death due virus. occasional zero-death days past, pattern new. Pa gop special breed stupid. special breed election rejecting stupid, point someone couldn’t get sworn in. 

