,date,text
If reasonable think could suppose mean something between. example, would expect restaurants opening much sooner point daycare workers stop wearing masks work. feel like asking black white answer recipe argue much argue about. mean, that's even last one. [We one decade We’re probably better majority young people unable make living wage, never able homes, gap rich poor increasing. bother trying improve broken system jump back making billionaires richer. state too. viewed parents health care providers outside health care setting. Lucky make judgements whole country. F you, got mine

The mantra weak. girlfriend brother!? promote…stiffness… side effect. nice reminded there's stuff we're REALLY good at, too. dudes fool reasons chess master one one them... guys downvote
me, idc, past year really going shame people overly cautious unsure/asking advice? think it's
completely reasonable ask questions like I'm glad people give best advice opinions. public indoor setting. I'm gonna continue there's mandate, vaccination open everyone. AZ cannot legally export dose 100M delivered UK, export ban. Period.  Rekt 💀 lot things people looking forward normal summer take people, money, planning. one going spend money hire people able plan.

Would like attend concert, art faire, wedding 51+ people, festival, etc.? Chicago, none things officially scheduled yet 2021. Whether engaged couple Live Nation, booking venue putting money know allowed host event.

Unfortunately, events take time plan. Illinois announcing clear tomorrow like Texas did, still going months get events back motion. planning massive festival, need permits, hiring contractors setup, booking bands, selling tickets, etc. make matters worse, live event/convention business, going need rehire staff laid last year. lot hotels straight closed. Again, rehire everyone housekeeping bartenders. 

If want actually events summer, needs plan ASAP. wait much longer, things going get pushed back fall pleasant outdoor season fall Chicago short. convention industry Chicago already written 2021 hesitant book anything 2022 know hotels vendors still going business. actually initially gained 15 already overweight is. changed things up, added exercise. slow steady.

Edit: gained 15 lbs, probably 7kg Governor Abbott may unintentionally put pressure every governor country realistically talk reopening plans. People would trust told ""two weeks flatten curve"" one year. gray zone moment outside US: risk stable decreasing Europe, restrictions get tighter tighter. Plus, scientifically illiterate talk around mutations makes lot people anxious goalposts moved again, vaccinating almost everyone deemed enough.

For absolutely straw man. Perhaps different perspective Europe. Iwasa joins TWiV recount became molecular animator, including pivot Ph.D. thesis research, value animations science, latest animation SARS-CoV-2 entry cells.

[Janet Uh, what? people sub even look numbers... like ever? Texas California Florida similar number deaths per capita.

The difference California still ridiculous restrictions, whereas states freedom. choice seems blatantly obvious. ok, fucking pay australia them. australia literally subsidizing europes fuck reimbursement Climate scientist friendly reminder pandemic one way relatively soon, permanent changes coming anyway.

RIP Polar Bears Literally 520,000 Americans dead. folks, lives come end. It’s way worse thought beginning (if listening anyone consequence) it’s hard say mental health ramifications event (not mention lingering health ramifications got Covid). Everyone forum seems think losses experienced somehow inevitable anything but. quite frankly don’t know what’s tragic: lives lost fact we’ve learned nothing it. US banned exports countries signed contracts

The EU banned exports countries signed contracts

The UK banned exports, countries contracts mean, problems arithmetic fact adults planned vaccination (as said original comment), entire population 17.2 million. said ""vaccinated"" ""fully vaccinated."" 3 million doses receiving Q2 one-shot J&amp;J jabs, making ""two jab"" argument mathematically flawed. everyone even want vaccine (since compulsory). important fact truly care debate I'm going bed. :) Bye! CA least megasites running full capacity---we pretty massive stuff. think US could easily 4m /day Agree. Like get year. sick duty protect fellow citizens can.  exactly. ....huh? ""Ben Shapiro"" talking point? sounds like well thought opinion me. Except brazil 2% population 80 yo europe 7%

That's reason many dead people. africa Potentially dumb question -- husband going waiting vaccine unless try hang around CVS extra shot end day. know people success that, I'd willing try (better doses going trash, right?) failed happen upon second shots suggested time period? Would better waiting eligible? matter much? break Finally got vaccine appointment (excited!) told could either choose Moderna J&amp;J. vaccine good one would choose? I’m 20s. Fine, volunteer someone wants give Sunday ticket Masters... that’s timeline CANADA you’re US expect June feel like 2019 Happiest place earth, mother f*cker! No, EU's contract says initial 300 million doses must made EU (not including UK). Later doses come UK. Oh dare EU place export ban contracts signed like US UK I'm going realign views important topic whiny Twitter guy happens agree me. party like 1920 Yes, 7 day average lowest since November - immediately prior substantial surge point current situation virus much improved couple weeks ago, vaccine rollout quite quickly escalating.

But that's point. Nobody debating whether situation improved. point currently 80% population unvaccinated, 10% population partially vaccinated, community transmission level know historical data cause rapid rise caseload. stupid mismanage things, could still see another spike.

On final note, 'indefinite' mean forever. would stupid remove mandate now, still clear stupid. know everyone wants decisive action pretending certainty point wishful thinking. one mere blip compared covid-19. bad. I’m done pretending like I’m sick. Wearing mask reserved sick people personal choice. Anything else Munchausen Syndrome, mental disorder. thanks. common cold also causes this. flu. weren’t concerned happening before? Nothing stopping pharma companies setting production facilities UK exporting 100% output. UK wouldnt able thing. sure hope so. 

I almost feel like death. scare anyone know body working hard try fight new pathogen yes hope turn strength point. Er... said wrote doctorate manipulation public health forums. challenged identify page discussed doctorate. Please. Quote page. 

Using academic peer reviewed community (a what? communities peer reviewed - papers are. PhD thesis actually peer-reviewed, examined, different) blueprint one largest open discussion forums creates huge problems, why? That's like saying studying engineering building bridge creates huge problems. studying English literature writing novel. study something understand learn well. That's point studying it. 

The rest post makes literally sense. Political convince? even mean? changed saying I'm manipulating narrative right (but claiming wrote doctorate so, actually read doctorate, you, thought repeat something saw r/conspiracy?) except I'm ... manipulating narrative? what... abiding subreddit's 'no politics' rule? make rule, rule abide that. exactly seem manipulative me. think putting practice something studied manipulative? 

So exactly point? removed comment sore it. accused something called it. want comments removed, abide sub rules (which write) think I'm ""manipulating narrative"" report moderators, reddit Admins it'll make feel better. That's one reasons Connecticut age group plus teachers. got rid essential workers people comorbidities defined phases mean, planning getting married year, I'd issue putting money June wedding. What's point, countries handled COVID-19 competently pushed back vaccine queue?

Australians population one highest proportions overseas family members normal times among frequent international travellers. 

Every single day border needs remain closed health advice causes immense harm suffering Australians clear path alleviation vaccinations. Oh hey list highest infections per capita! This.

Like perfectly OK discuss proceed towards relaxing restrictions bit, moving phase reopening given declining case trends. extensively, especially Texas did, irresponsible right time that.

I wish place discuss COVID nuance now. subs far ""oh we're still screwed forever, doom"" phase time sub especially daily thread opposite phase full ""reopen everything now, still careful call restrictions doom gloom"".

While dislike abhor centrism typical applied place politics, room moderate debate COVID wish people subscribed nuance comes understanding are. Yes, better place yes, relax restrictions bit, extensively Texas did, time stop careful. Hyperbole reality. adults vaccinated yet. Hold horses months. Yet America didn’t do, numbers better populated countries Europe enforced draconian measures. 

Interesting, that. Me: “young people sacrificed prime year life”

You: “young people haven’t sacrificed prime, it’s year” 

Lmao glass required different.

The vaccine vials need boroscilicate glass type glass stand frozen -20C -70C without shattering. type glass used beer bottles different (and beer bottles never get frozen). That's true, AZ selling vaccine cost. true, I'm 23 infected there's high chance i'd stuck home bed while. Whereas 70 year old nan got it, she'd likely go hospital.  US export ban UK not.  rebounded still fell year countries didn’t woss lockdown halfway through. don't, that's unfortunately still incredibly probable vulnerable population vaccinated. point need perfect solution. need realistic plan. 

Look around. People *done this*. goal set realistic -- social perspective -- date prevents worse case happening. People going wait forever. 

If clear, near-term, attainable date, states going Texas did. need convince hang short while. time, give people restrictive states ability plan life going forward. probably went school every day pandemic. wrong people? fucks sake. Spreading touch though virus masks would work case Vaccine hands anyone explain masks would required schools, especially elementary schools, places US next fall?

Good chance won't, really depends case counts look like point imo cases way communities like expect probably much point making kids wear masks even they're unvaccinated, like said huge cost kids wear person talking brought kids vacced yet (how many kids affected? Also, heard coming summer?)

Pretty unlikely kids vaccinated fall. trials right trying expand age range 16+ 12+, could get approval end summer, meaning high school middle school kids could vaccinated fall. elementary school students might come bit adults vaccinated then, especially way things ramping up? Meaning herd immunity?

Even every adult vaccinated, COVID still spread children like respiratory illnesses do. super unlikely cause serious harm them. wife pediatrician, sees plenty kids test positive COVID, small minority symptoms bad enough admit hospital. think question more, vaccinate teachers adults schools, vaccinate parents, likely COVID could sweep young students within school, harmful would even be? super unlikely harmful, need masks. likely potentially harmful, masks might still think vaccines work not? really frustrates me. I’m trying understand endpoint masks required.

Vaccines extremely effective. vaccines administered younger children, see zero reason would need masks schools. Agree. also hope brings end people going work sick. Hopefully we’ll never hear coworker coughing blowing nose day. Oh God, don’t tell that. going well. Although I’m day seven feeling like crap. that’s first Moderna shot. 

Going annually I’m sure. 🥺 Yes, watching fucking idiots running around infecting killing people gonna hilarious. Hilarious. think that’s fair criticism political all. think it’s little easy feel complacent comparison low bar set. definitely need “better”. Well would assume wrong. get 10k-12k steps day winter walking dog kid morning evening. light yoga hop elliptical 20-30 minutes, decent (above 40 degrees) kidlet, ride bikes go little 2-3 mile hikes. 

I insulin resistant PCOS. uhhh kind sucks. Ifuckin hope  1/5 Los Angeles County day! offence, Europe far densely populated Australia also continent close borders easily. Also EU vastly larger population Australia, go sanctimonious somewhere else. Also potential problem mutations.

When million people day sick one million event happens every day

Uk track every adult vax summer yet putting money future vaccines, money research make library vaccines mutation pops production weeks.

Usa, EU, uk updating vaccine studies requirements new vax fast tracked needed. New vax based previous approved vax updated variant variants need trials 30,000 less like yearly flu vax. 

I'm glad planning ahead many acting like want bleeping stuff going around around around banning even minimum risk reduction masks unless hospitals start filling person wastewater testing upticks 

It's like repealing intoxicated driving laws certain % fatal 

Us enough vax adults couple months, keep masks bit longer distancing slowly let capacity limits % region fully vaccinated. practice expert ban rate take four months get entire country inoculated. Agreed, give years forgotten about. hell that!! I’ll eat damn eggs easy! Psssh NEXT?!? Don’t eat Bacon?!  think easy selfish asshole people seem hell-bent it. Except full three weeks getting first dose. full protection.

This stupid them. worried I’d catch COVID sitting 15 minutes. It’s inevitable someone somewhere going die sitting around indoors 15 minutes getting shot. Oh dear Literally though? planning getting vaccine? way thinking makes sense vaccine People want clear message going get one far many factors play. things happen cause issues. wish still could keep least April, I'm objective think that's going end world either. already know people city continue wearing regardless (Austin), people really trying already.

I really think that's states like Florida without mask mandates relatively hit much harder, people going would anyways. ""Little impact"" - Millions people strict lockdown, half ass lockdown. Lock leaving house, unless exercise 1 hour per day within 5km home better part year.

Yeah much better rampant death sure please, shit walk park either. least tried contain it.

I personally fine going somewhere cases please minimize effort collectively put get are. way EU went though great though. add another bit data vaccine responses, got first dose Moderna yesterday morning thanks phase 1B qualification expansion. additional symptoms beyond slight soreness (nothing like pain led expect) injection site, slightly increased salivation minute two directly shot reason. One friends healthcare got Moderna back said randomly got really ill hour like week later, experienced side effects. It’s really interesting side effects varied person person. EU simply enforcing contract AZ , go blame AZ. agree first line, humans stupid! Non sequitur. think India needs Canada, makes little sense sell off. pragmatic point view, makes sense vaccinate nation's worst outbreaks first. US happens large manufacturer hardest hit (raw numbers, though admittedly per capita). India happens large manufacturer relatively cases massive size. India cases, truly believe would vaccinate domestically prior shipping vaccines, would make little sense. Target hotspots. We're **supposed** enough doses adults end May

Yeah, don't, I'd much rather set metrics forced pull rug dates set. anyone else annoyed worthless term ""doses"" J&amp;J requiring 1? Mexico wealthy fat never say safe wear masks. they'd blame person gets sick dies (of forever way masks stop required people stop wearing them. that's happening rapidly now. old, weren’t quashed. going down, there’s reason think would go low numbers stay low without addition restrictions. Now, month later, we’re stalling near *the peak* second wave - looks better we’ve failed miserably expectations shifted. three vaccines available US provide neutralizing antibody activity variants. J&amp;J clinical trial data crying loud.

All three turn variants (at worst) something unpleasant fatal. Zero exercise assume. Even completely sedentary accomplish  it’s kind attitude contributes fact UK USA still collective arses Covid.

Australia &amp; NZ extremely high levels compliance, terms asked them.

USA UK - significant amounts population ‘know better’ 

How places doing?

Here’s article (the first came to) linking many studies efficacy masks.

Maybe share scientific evidence, mask wearing zero positive impact, terms Covid transmission? must plenty ""Lower effectiveness"" surprise. That's probably J&amp;J 66% effective South African trial, ~80% American trial.

But that's still pretty effective. ""Resistant"" makes sound like even less effective that. Vitamin fat-soluble vitamin stored fat cells. much fat results Vitamin locked-up cells inaccessible body use. fat body, Vitamin need likely deficient. issue necessarily Vitamin consumption problem requires supplementation raise Vitamin levels. virus airborne. unmasked, infected person exhales, expel virus air. hang air 3 hours.

If someone inhales virus air, lodge back nose, top throat. invade host cells there. gets stuck substance found back throat called ACE2. stuck ACE2, virus uses spike pierce healthy cell membranes inject RNA.

I think virus air pollution, air pollution kills relatively quickly, ie, 3 weeks inhalation.

We regulate emissions plants protect people. lot different.  Virus alive such. like poison commandeer host cells. Air pollution also involves poisoning air.

So, parallels drawn here.

Since one owns air, since breathe air , since anyone breathes air risk virus...

it makes sense take measures, across society, protect air becoming contaminated virus. Sounds like c-ptsd amnesia. I’ll probably get downvoted sympathy fat people. respect care? Except case threat real. one year’s time already know multiple mutations varying degrees response vaccinations. agree susceptible given priority, really want stop disease gets rid old people...never mind. point reached yet, UK plants supplied UK first 100M doses additional doses sold abroad. That's UKs contract AstraZeneca (UK) says, got terms throwing boatload money first sign supply contract. 

Additionally contract EU signed AstraZeneca (Sweden) 300M initial doses specifically stated doses made EU facilities, optional 100M could made elsewhere. 

Every vaccine manufacturer delivered, almost like trying manufacturer vaccine middle pandemic using cutting edge methods massive scale 20% time traditionally took runs production issues. 

Only EU said would never introduce export restrictions start pandemic, waited facilities built within EU production starting struggling overcome production volume issues, introduced export restrictions. 

This *will* long term repercussions global manufacturer looking build factory think twice whether EU stab back. totally normal gonna take little break year-long way living thinking 🤦‍♂️ Talk missing forest trees. going able month so? curious? Scott Gottlieb person seems good this?

On CNBC Wednesday, anchor Becky Quick [asked Dr. former FDA director Pfizer board member, whether Texas' immediate lifting statewide COVID restrictions, including mask mandates, problem. answer question obviously ""yes."" also needs ""yes.""

Gottlieb got balance caution hope correct. noted, March going weird month. February, epidemic ""raging,"" April likely ""profoundly better."" month, ""we still face lot risk resurgence."" time yet pull back completely COVID restrictions, Texas Mississippi done, soon time ease many measures — weeks, months, given accelerated pace vaccine rollout.

Unfortunately, public heard ""give bit longer"" message lot before. nearing one-year anniversary [""15 days slow okay public health guidance change circumstances change, 15-day promise never credible issued. public understandably weary year rules, wary public health establishment — first overconfident messages — often seems loath admit things get much better.

To credible, people hope influence public behavior need meet public — giving realistic guidance concrete timelines change behavior soon, right *now*.

## Excessively cautious public health guidance bad public health

While Texas Mississippi rushing restriction quickly, public health officials federal government given us insufficient guidance expect start easing up, now.

Even though 30 million Americans received two doses vaccine (an impressive feat!) still awaiting broad guidance Centers Disease Control fully vaccinated, guidance CDC issued far almost comically over-cautious. instance, CDC says okay quarantine exposed COVID long asymptomatic received vaccine doses least 14 days ago — [also longer 90 days CDC reason believe vaccines stop working 90 days, 90-day window informing aspects federal public health policy — we're telling people go get re-vaccinated 90 days.

Yet, goes CDC, positing *extremely* narrow band newly-allowed behavior vaccinating. 90-day guideline also bleeding state recommendations. New York creating another exemption travel quarantine rules, time people vaccinated, also [limiting exception people whose vaccinations less 90 days message send public?

On one hand, yet another government message suggesting vaccines good. policies built implication vaccines work three months, encourage people get vaccinated? hand, people *are* going eagerly getting vaccines reasonable assumption vaccines work, perhaps lifetime, much longer 3 months.

Absent surprising new research findings, — — going ignore public health directives tell us act though vaccines longer effective 90 days.

## need honest realistic people

Gottlieb urged public officials set date-specific targets future expect lift restrictions. provides hope public good argument continuing comply restrictions now.

""March little bit premature, think, lift everything, certainly getting glide path towards lifting lot provisions right makes sense,"" said.

But worried new CDC guidance vaccines instead ""overly prescriptive conservative"" — onerous people ignore it. Instead making seem like choice Texas-style free months tight restrictions — would result many people choosing former — middle ground keep people safe encouraged get vaccine.

## Tell people hug grandkids again

Gottlieb Quick noted guidance relaxes restrictions interactions among groups *everyone* fully vaccinated plausible time vaccines approved use children.

A major reason older Americans lining get vaccines interact children grandchildren ways recently able do. Vaccines provide extensive protection recipient, especially severe disease death, recipients — should, that's want — use protection resume closer contact relatives, including unvaccinated children. Gottlieb notes, need plausible advice mitigate remaining risk that, guidance tells wait several months so.

Our lives get lot better. okay say — necessary, want people listen along way. phrase banned. I’ve waiting 2 weeks year  ask then? reads like cowardly sucker punch. known decades high cost healthcare US subsidizes development new drugs, treatments techniques exported countries socialized medical systems. immigration policies favoring highly educated people comparatively high pay medical professions mean country 'investing' domain while.

if there's one thing bloated, expensive unequal healthcare system world buys you, home field advantage comes early access cutting edge treatments. question logistics risk management, easy tee-up white house adminstration. submission linking businessinsider.com automatically removed source may reliable may dedicated mostly political coverage. possible, please re-submit link reliable non-political source, reliable news organization recognized institution.

Thank helping us keep information /r/Coronavirus reliable!


*I bot, action performed automatically. Please [contact moderators subreddit](/message/compose/?to=/r/Coronavirus) questions concerns.* think potential differences beer bottles sterile vaccine bottles? smug they? Nah. Two weeks another spike could avoided though, yeah.  Pulling mask whenever get closer 100 feet annoying, I’m going walk leave whole time.

Will still happy get rid vaccination available everyone. Don’t assume someone wearing mask want wear one forever, haha. know members Dutch government EU, right? Dutch government conservative estimates despite (or maybe due to) EU Commission's incompetence. even know Abbot's messaging supposed be. ""No masks! still need cautious! masks, capacity restrictions! Lick doorknobs French-kiss everyone!"" course Why? would please you? remember parents would worried I’d hang friends color like yellow Orange. People subreddit saying American hospitals two weeks total collapse year now.    impossible know exact date. However make claims "" start removing restrictions achieve X percent vaccination"". Like Governor Whitmer Michigan. sell cost, extra costs distribution SA etc ...I’m sure point you’re trying make. Beer bottles washed, sterilized, made ready reuse incredible speed. 

But they’re built machines built specific job. can’t high speed mini bottle washers existence. That's best effort clause comes no? can't predict productivity pick reasonable number say 'best efforts'. 

