,date,text
And say ""protect"", mean ""from death"", simply mean ""from bad time"" I'm dick. gf weird bro LOL EU rightfully warned vaccine nationalism essentially embodied allowing happen. 

Because know company could fuck us way arbitrarily deciding orders fulfilled, exporting tons vaccines literally unaffected countries less thousand deaths? literally mocking us I'm happy EU starts something this. I’m missing anything. It’s overused think trump told cdc open work governors.... well bridge bridge sell you. Trump’s twin brother except don’t like.  According UK Vaccines Taskforce, 4m doses AZ procured EU. take word yours. Whenever hell get crisis whatever world looks like afterwards, EU seriously think they're going sort Pharma industry left?

Every thinking company going say ""fuck that"" sticks move, UK elsewhere.

God forbid, there's another Coronavirus, EU going reliant hell lot imports go round they're going find much sucks orders seized. correct assume translates approx 3.5 cases per day per 100T? Trying match stats nytimes.com Exactly people realise Brazil doses shipped to. Italy would still stopped it. yep people dont understand aus mostly desert middle state allowing anyone see friends? there's way enforce anyway. want go friend's house nothing stopping guess means long maintain social distancing rules there’s set capacity limit mandated state. let’s say high-end restaurant already sitting people 6-feet apart pre-pandemic, open full-capacity Jan 1 , 2021 customs records UK still single market. even , AZ transhipped Northern Ireland , still customs record. nothing red herring. Ben Shapiro talking point, FYI. Victoria one longest lock down's world.

you can't say now, london, europe worse lockdwons Pfizer vaccine found effective British variant, experts fear variants may less susceptible vaccines.The South African variant one far linked lower effectiveness jab; also caused [reinfection among recovering worrying experts mutations protein wrapper, virus uses bind cells. changes make distant variant original coronavirus – one vaccines developed 450 cases infection [have far Israel, health professionals estimate dozens infected day.  Health Ministry’s committees vaccinations pandemic said two weeks ago variant spreading beyond control. Masks even one layer cloth reduces distance expelled air lungs possibly infected person.
Tell use helping stop air born virus ?
Universal precautions work, keep working.
The ECDC wrong - like wrong saying Covid-19 virus air borne.
It’s family flu virus air borne. CT get backlash like two states yesterday? think dosage eventually revisited. mRNA vaccines turned extremely effective covid-19. Pfizer Moderna probably dial strength formulas Sometimes gotta blame big guy everything ""new normal"" means we're able go sports games conventions crowds, new normal working even less old one.

If want new normal crowded conventions (say) government-funded paid sick leave, that's good thing. please, specific, I'm allergic people saying ""no crowds ever even everyone gets vaccine."" export UK vaccine allowing every country make themselves

And AZ exclusivity , right .. countries these? Connecticut still mask mandate. already vaccine humans developed early last year. Vets needed jobs keep animals safe.

We’re currently supply constrained. hypocrisy business usual

FTFY children higher risk severe illness Must flower pollen then. Even work, also amazing source kinds vitamins nutrients.

Still worth shot make go away forever. probably citing Lancent paper Cambridge actually found 4x reduction symptomatic asymptomatic infections 12 days first vaccination. short time period.

The Israeli data show vaccination preventing 90% infections, including asymptomatic infections.

And neither studies actually address transmission risk. Asymptomatic infections likely significant transmission since household attack rate asymptomatic unvaccinated infection least 4x lower symptomatic.

Transmission risk vaccinated individuals likely 10% less unvaccinated vaccine time bake. 80+% still lower 94+% stuff absolutely slammed since Covid hit.

TX state parks reservations months sometimes Putin hasn’t gotten Sputnik V vaccine yet able safely gather 20-30 *thousand* people more, long take jab (which available soon already). One first mutations 614G identified early January. West Coast East Coast variant could distinguished mutation. evidence increased infectivity disease severity seem escape antibodies. pretty quickly became dominant strain.

The later variants basically result evolutionary pressure. There's speculation variants may arisen immunocompromised patients long term COVID infections basically breeding antibody resistant viruses. really rocket science. times virus replicates, mutations occur greater chances beneficial mutation arising. We're fortunate enough vaccines seem generally still effective antibody efficiency notably lower cases. think depends death rate. vaccines effective, applied vulnerable, see massive drop deathrate soon. 7 day average falls 100 deaths per day id feel comfortable. Remember, 102 people die per day car accidents still drive. true increasing supply like US has. lot rules currently place built around limited supply model. Yes. need clear plan political leaders goal stop wearing masks. Guidance chaotic far. need get shit together. stop wearing masks 80 percent adults country vaccinated? 80 percent adults children? 85 percent? fucking goal shooting for?!?! governed imbeciles. AZ said thing December original Q1 deliveries. incompetent liars. amazing tx % totally vaccinated? Hope higher rest usa really need it

Nationwide hit 10% leaves least 65% estimates herd immunity... Higher needed infectious and/or resurant variants area 

The idea minimize spread outbreak people, dozen infect another dozen overwhelm hospitals can't normal stuff like cancer screenings catch things early send someone far away less full hospital possible heart attack delaying treatment giving worse results... post appears vaccines, please see [our answers frequently asked questions regarding COVID-19 vaccines. comment containing misinformation removed user potentially banned.


*I bot, action performed automatically. Please [contact moderators subreddit](/message/compose/?to=/r/Coronavirus) questions concerns.* Exactly ‘irony UK US’ irony neither UK US Australia.  long ago Covid? sounds worse people experienced. There's literally whole sub people eating bwlow 1200 calories. maintain 1200-1300 too. eat 1100 want lose 2 pounds month. exhausting. Neither anything positive. Agreed, also, jealous society. Peeps might rightfully walking around without masks cause got vax, will: 
1. make people uncomfortable assume point
2. contribute general impression back normal people may pay much attention news work bees gather pollen things allergic to, includes mold, dust tree pollens. data see state website shows today lowest 7 day average since November, dropping. slight bump last week (like saw country), clearly due horrible weather week prior. long term trend line remains rather stable pointing downward. 

The point current situation virus much improved couple weeks ago, vaccine rollout quite quickly escalating. Saying masks indefinite either weak wants someone else call end, overly controlling. recognize vaccines last step, beyond citizens accept restrictions. right, that's exactly risk loosen restrictions. comment brigaded. 3M day let’s goooooo

Vaccines moooooon I'm wondering able hang friend's house Covid month two ago. seen friends since pandemic started parents risk, we're going get second doses next week. source posted;

""The U.S. Food Drug Administration European Medicines Agency issued similar guidance."" Well, Brazil makes Texas look good. Realistically, public mask mandates continue everybody wants vaccine received reached full immunity, means 5 weeks first shot. that's probably gonna closer end June. end least sight! vaccinated people hang vaccinated friends family private much want. whatever want public long continue wear mask then. big deal. There’s actual science supports wearing compliance rag. Maybe makes feel good, it’s actually protecting you, anybody else. So, could low level virus, send hospital kill you, could pass someone else vaccine, could hospitalize kill them.

But hospitals full that's really problem? Today's Au rythme actuel (moyenne des 7 derniers jours), l'objectif de vacciner l'ensemble de la population adulte serait atteint le 7 mars 2023.

(at current rate--average last 7 days--the objective vaccinating whole adult population achieved 7 March 2023).

For lulz, check today's average 30 year old Au rythme actuel de vaccination (72 749 doses administrées par jour en moyenne) et selon votre profil, vous devriez pouvoir être vacciné entre le mardi 15 août 2023 et le jeudi 24 octobre 2024. Au moins 32 494 616 personnes doivent se faire vacciner avant vous.

(At current rate vaccinations ... able vaccinated 15 Aug 2023 24 Oct 2024.)

Supposedly going ramp vaccinations, see literally sign it. excellent news. EU countries hit worse. yes, thought deaths lower, since respect cases per capita, UK #15 Europe.  Damn Looking figures first set lockdowns worked exactly expected number cases plummeted lockdowns went on.

And achieve long term? countries lockdown proved end result similar. Yeah like right path, people getting vaccinated rate going up. We've year now, chill bit longer til people vaccinated  much vaccines Yay Still ""only"" 5th Europe. worse thought, give that, terrible people make seem... Oh know. Masks still mandated state want make sure I'm keeping safe making others feel comfortable well.  I’m opinion. soon get summer vaccines available go whoever wants one, everything slowly go back normal. imagine we’ll see small wave winter, summer return normal. Well think specifically using academic peer reviewed community blueprint one largest open discussion forums creates huge problems. Straying objective papers research hitting insults politics makes sense academic realm. wide open public forum scientific method gospel, political convince becomes ""objective fact.""  

In regard manipulating narrative allowing concerted effort entire political apparatus go unchallenged calling would ""political."" Sorry, masks work, distancing works, pandemic now, vaccine give sterilizing immunity might fall. facts, call opposing sources requires naming bad behavior charge (often political) motivations. read whistle blower reports FDA approved pharma plants India?  Well first Macron get TV tell everyone shit vaccine AZ absolutely ensure Europeans keep refusing take find warehouse use them. Lol COVID discussion inherently political point let people talk  partial herd immunity need much vaccines. Andrew Cuomo staring possible impeachment moment, I'd assume every move makes optimized towards getting enough short-term popularity fend rather sound science sustainable solutions. terms cases per capita, UK 16th place (6.2 % population tested positive) Europe Netherlands, Sweden, Spain, Belgium, Latvia, Portugal, Slovenia Czech Republic (11.9 %) (that's EU countries). terms deaths, higher 5th place (182 deaths/100k) Europe, Slovenia, Belgium Czech Republic (195/100k) hit harder.

So guess total numbers, agree right hit quite bit. right now, 74 new cases/week/100 k UK 790 Czechia, 660 Estonia 300 Slovakia. people become obese without sort medical condition? 

I get frustrated angry see mirror extra fat around waist. workout 3 4 days week keeps good shape. 

If can't work days manage intake food. 

I assumed people do?...People eat fat foreign concept me.  say that. 😂😂😂 couldn’t help it. Vaxhouse Madison Yup! easy masks! put well, Texan frustrating see ""end world"" comments week. Like yes political messaging poor scheme things we'll okay. think outraged Abbott completely fine Connecticut/other states rolling back consider why. TX waited bit longer we're going vaccinated soon big deal. Efficacy original strain 95% 94% 72% (based US trial data).

J&amp;J showed efficacy 64% South Africa cases SA variant (20H/501Y.V2), 68% Brazil majority cases Brazil variant (P.2) - say, variants South Africa Brazil seem modestly reduced efficacy J&amp;J vaccine, much people worrying. efficacy numbers Pfizer Moderna SA Brazil variants phase 3 trials conducted variants observed, know lab experiments show people vaccinated Pfizer Moderna somewhat diminished immune response SA variant would expect like J&amp;J would still protective somewhat less original strain.

None three vaccines phase 3 trials UK, existing evidence suggests vaccines target original ancestor strain provoke similarly strong immune response UK variant would likely show similar efficacy, born 89% efficacy Novavax vaccine UK phase 3 trial observed effectiveness AstraZeneca Pfizer vaccines UK Israel.

Note raw efficacy underrates useful vaccines are. seems likely three vaccines available US would nearly 100% protective hospitalization death due COVID, including variants concern. Tours? Probably. never anything people wouldn’t losing minds Texas Mississippi stopping measures. No. I’m pretty sure (if all, vast majority) U.S. supplies produced Moderna, Catalent, Lonza Massachusetts, Indiana, New Hampshire, respectively. non-U.S. supply produced Lonza Vins, Switzerland. Lots businesses Well much longer want us wear them? already 2 vaccine shots. Millions Americans vaccine well. much longer must wear 2030? 2050? ""iT's eYe sToRm"" Ohio 170/100,000 now. county state 50, couple close. 50 goal imminent, realistic. Seems like exactly right approach! What's wrong timeline ""at point everybody wants vaccine received doses reached peak immunity""? happens article recommending. many people want lift restrictions we're still beginning vaccination rollout. article lists 4th July reasonable expectation, agree. happened too! little bit first dose 3-4 days second. finally went away completely really feel anyone long term. idea they’re working holding job. would literally stand front fridge couldn’t remember walked wanted. like stoned days. Please take Americans idiots rhetoric elsewhere, thanks. lot us zero contract friends family year it’s insulting  Pfizer, Moderna J&amp;J completed US trials AZ Novavax not. jail No. practice common sense people get vaccinated. color coded tear system likely terror attack was

Oh yea, remember that. 5 colors, blue (no threat) green, yellow, orange, finally red (HOLY SHIT)

But effect, yellow orange, first one other, over. never went way red, thank God; never dropped green blue, guess b/c want foster complacency

or standup sage Ron White puts ""There two stages. Stage 1: get helmet. Stage 2: put helmet"" people angry scared. claim everyone Florida Iowa would dead? would Super Bowl Spreader? Newsom Cuomo good jobs? true aren’t vaccinating people 65 years old there?  audit process factory importing vaccine. Mainly see appropriate quality control I've fully vaccinated since February 19th.

It's really hard convince I'm safe I'm ever going be, I'm sure that's small part due media scares compounding already extreme anxiety disorder.

I went store today caught thinking ""I gotta get here, crowded"" keep reminding myself, ""hey, vaccinated. Chill."" think there's reason optimistic. Many airlines waving change fees go ahead book UK trip later year. Getting first shot modernq tomorrow! purpose waiting 15 min allergy/anaphylactic reasons? last comment. know subreddits like promote eternal doom society, believe not, everyone actually die covid, even nothing stop it. Chinese, thinks trash Trump said drinking bleach would cure it, would promoted it. 

That's he's sinophobe idiot. health minister Netherlands said expect adults vaccinated end June.

The EU making grand pronouncements since last November vaccination program none come pass.

In order get vaccinated June they'd increase daily jabs fivefold. Every day delay, they'll catch up. got logistics achieve it. would that? AZ gain? Brits fat american fast food Yes, half data OUS. It’s modern clinical trial design goes. JNJ example 8 countries participating. may so, fundamentally issue science, management issue. AZ sales management made promises knowledge whether would able keep them. incompetence. AZ management thought based advice scientists &amp; process engineers would able deliver quantities incompetence part scientists process engineers. quality comments sub dropped significantly I've stopped skimming. skepticism, conspiracy subs infiltrated reflected content. prep come back.

I mean prep want. fact politicians health experts shied away giving sort indication return normalcy burning goodwill public has. real virus American  Transmission risk apparently reduces two thirds elimated virus spreading high levels really encouraged. course make arguments old etc that's different story 2 4 since BioNTech funded German government. Unless consider pre-ordering doses, development funding.

I'm assuming leaving one Russian Chinese vaccines. Obviously Americans get vaccines, lot developing world probably will. wonderful person!  come, time. J&amp;J vaccine loaded mobile units pull shopping center parking lots scheduled days. need remember many short months even vaccine difficult handling conditions come first two. Congrats CT! like huge helping eating beef, pork, butter 24/7 think J&amp;J would better though since single dose. Bottles sterilized filled quite different maintaining sterilize environment. cross reference flu ifr estimated covid ifr (the UK fairly good estimates) 0-18 year olds. though remember covid equal flu demographic. Fauci awfully close saying it.

This projection. People hearing things based imagine people different political persuasions contempt expertise general. Florida: *You guys wearing masks?* I'd much prefer new normal. old one really working. right. Would agree North Dakota South Dakota comparable populations/climate/density etc?

One mask mandate restrictions, one didn't.

Similar case-rate, little difference overall covid trajectory.

Would agree mask mandates restrictions completely useless? There's similar state-by-state comparisons across thee midwest similar population varying levels restrictions, end overall similar covid case trajectory. post appears vaccines, please see [our answers frequently asked questions regarding COVID-19 vaccines. comment containing misinformation removed user potentially banned.


*I bot, action performed automatically. Please [contact moderators subreddit](/message/compose/?to=/r/Coronavirus) questions concerns.* twenty percent people, adults, Connecticut gotten least one vaccine dose. almost certainly going past fifty percent month.

I think pulling back restrictions sends good message. tells people strong vaccination campaign means return normalcy. feel that's message that's going make people root vaccine want get themselves.

I understand Fauci Biden cautious pulling back restrictions, especially dramatic pull backs like Texas Mississippi, calling people Neanderthals saying inexplicable want normal lives back really send message feel imagine does.

Yes, they're cautious, they're unintentionally sending message vaccinating fifth American adults matter, talking vaccination campaign *will* matter. dangerous. sending message vaccines. contributing way imagine they're intending to. brewer sterilization essential beer. Bacterial wild yeast ruin brew. product rely sterile packaging. difference capping methodology fragility glass. Finally number 1 something-covid-related horrific. weren't. If. already know since takes 10 seconds find out. Spoiler: stupid calling *inside* state. I'm going cite page numbers give 24 hours high light make list. 12mb pdf. 

In interim I'll link it: others read it, might also see playbook moderation style here. total straw-man argument. That's anyone saying shows either profound lack understanding outright bad faith effort rage machine say otherwise.

If think think able go back normal full vaccine distribution, understand fellow man. may happen speed want, may happen everywhere time, may require masks places get children vaccinated, small chance require extra booster make happen, happen. one, literally fucking one, saying years.

Stop getting hate boners, enemies here. tolerate fullfilling countries orders literally laugh face token delieries last minute cancellations?  Australia developed biomedical industries manufactured vaccine. kind argument. Chicago, vaccine slots 65s filled. hubris think design better vaccine God Himself. kidding sounds dope. Unfortunately US country trying inform people \*is\* culture war. Cause Australia thing things reversed. mutation found States sooner definitive answer vaccines respond it. hold, basically game normalcy right around corner. like you. US draconian China New Zealand-style lockdowns; that's true. However, ridiculous claim nothing different 2019 here. aspects life dramatically different many populous parts country. you’ve reached maximum immunity feel really really safe outdoors. data shows transmission outdoors minimal even without vaccination That’s great!

I hate stop wearing soon allowed. 'playbook' moderation style - I'm denying that. Challenge misinformation. Remove incorrect misleading information. Signpost users towards high-quality information. 

Manipulating narrative? Waiting page numbers. Go ahead post found it. called upon sit upon sofa months.

Shows touch are. I'm sure work struggling bills bunch whiners right references three vaccines used US. work fine variants. Clearly production capacity, much AZ using produce vaccines ship abroad... tendies... stuff way complicated scientific. I'd much rather make fun blame everything one guy saw walmart without mask last month like politicians told do. We're supposed enough doses adults end May. time set date, metrics. might able convince people go symbolic July 4th, honestly June 1 would reasonable opinion. trying bring cases zero, trying preserve health care capacity. end May, latest, elderly highest risk population vaccinated. I’m used seeing people spell things incorrectly inside comments section. pathetic though. Patients different patience. Smh could walk around metal keys coins pockets? everyone constantly jingling? Brilliant move. EU needs find warehouse use them. don’t care people decide this, don’t hand sanitizers. Others wear masks everywhere rest lives, long don’t try make same. care mandates restrictions lifted, metrics used determine lift them. real number 120k, no?

And that's really number I'm asking for, though, unlikely save anywhere near 60k bad flu season masks. Similar story COVID deaths years. really can’t express enough damaging whole “we’ll masking rest year” shit is. one day wish Ohio. supply eu sold higher bidder. time. Evil. agree vaccinations put hard time limit long pandemic go for, cases deaths really dropped past week. hand hospitalizations dropped like rock time continuing to, guess metric could understand argument more.

idk, I'm really disagreeing much, seat someone managing pandemic guess would cautious try make predictions far future. I'm firmly side Massachusetts practically back normal summer, can't imagine Baker going public 70+ percent state vaccinated. thought wanted save lives? Yup, Los Angeles checking well. 8/10 joggers also masks. 10/10 walkers do. time I've gone unmasked since last March probably walking park past 8:30pm, grand total 10 people park. This.

Texas governor lifting mask mandate less 25% population vaccinated begging deaths 300lb roller skaters follow instagram would never lie me!! Daily new cases Mass stopped dropping past week moving average 1,500 per day. That's looked like early November immediately prior largest spike yet.

Furthermore, 20% population gotten vaccine. one dose. think problem “normal, eventually” isn’t good enough year restrictions. need clear metrics goals reaching actual normal. something along lines ‘eventually, maybe fall, may reach semblance normality’, need either thresholds lifting restrictions timeline so. really hate intense desire vaccine made feel competitive it. Like I'm essential worker working public since started found really bitter people able social distance able work home able get shot me. fault. Anyway, got first dose days ago, actually way sooner expected (NC started vaccinating essential workers week). much this. I'm sick seeing people sub acting like everything going back normal cases vaccines happening. yet, get closer closer ""there"" every single day clearly fucking measurable way. wait it. equally understand they're coming from, reason non-insignificant number ""experts"" talking bullshit never go back normal even post-vaccine, they're probably mostly pushing back hard that. export would legal doses specific factories 100M mark factories delivered UK would breach contract. came another factory owned AZ licence holder contractual issues either. Either AZ licence holder could set another factory UK factory could export first dose without contractual issues.

Would characterise contract EU AZ also bring export ban? contacts fairly similar apart doses counted contract (the UK one first x doses EU one X doses date). either constitute export ban not, given EU enacted specific powers allow block export vaccines implies export ban. numbers incorrect 1,470,623 doses/8.42 per 100 administered average 40-60k per day last week two.

Fair enough. still 17.28 million people Netherlands, adjusts figures two weeks.

It literally impossible Netherlands hit target two doses per person end June unless least 250,000 jabs day **starting tomorrow**.

We know start tomorrow 250,000 day. They're incapable it, they've pfaffing around hardly anything months due laziness.

So yes - EU union incompetent plague countries. 

