,date,text
Which ya, btw still clear getting vaccine super effective. seeing giant number next small number going mislead people. caught couple seconds. Maybe I'm idiot kid gets Covid, you’ll wish deal snotty mask instead vent. don’t understand people’s short sightedness. It’s crazy! shitshow. hospital cases could virtually zero. Shocking actually think about. People way (and possibly always even available vaccines, though efforts) reason every school going person Survivors get attend Super Bowl like Sandy Hook survivors everything OK right? /s Yes conspiracy theories done wonders many countries, especially US leader Covid infections. Well done. ""Life   Plus protects new Vietnamese variant: Phovid I’m UF student I’ll say yes Miami university perspective damn good education. Miami produces lot solid students. ever tried mask gator? Yeah, unfortunately can't really answer say attorney I'm referring practices northern state.   Inoculated small pox. vaccine time. 0 6 times.  feels like ask money venturing fraud territory Well, there's one less Dick world. Death rate lags infection rate two weeks, unfortunately rising. I’d like see blow torch idiotic know-it-all go every Florida’s hospital’s covid ward telecast bs seriously sick background see. doesn’t guts that. subreddit full people caricature everybody greater risk tolerance Covid anti-vax Covid denier. Big Break Small pox animal reservoirs - infected humans. COVID observed infect cats (including big cats), dogs, mink, ferrets, hamsters, white tailed deer, fruit bats, otters, non-human primates. Getting rid unlikely trivial vaccinating 7 billion humans period time shorter however long takes virus evolve vaccine evasion. tradition. replied right above. fucking dumb man be? leg room think pandemics politics don’t mix. clue  CDC think enough lifted federal mask mandate, hoping incentivize antivax. We're living aftermath ""underthinking"" now. 

It's ""overthinking"" anticipate antivax defiant enough get fake vax card. come ironclad solution. That's way get this. Karma. Yawn... idea about... seem empty.... Lots cops hate working SF. Wouldn’t shock easy way get unemployment quitting. I’m end run covid. mild fever, chills, headache, muscle ache.

My sense smell dull completely gone. Feeling kinda tired could due taking easy week general. Usually I’m super active. Yeah, it’s already established anti-vaxxers reasonable would trust info even given accurately. mean, agree everyone informed much possible, think issue right anti-vaxxers hesitation vaccination less health experts disseminated info time emergency, general skepticism science making people ill-equipped receive info. 

in opinion, entire government could done way better establishing system move people action pandemic hit, including education public health commonplace, similar prepare earthquakes shit, unified message top bottom response outbreaks, listen science. wouldn’t still common sense listen experts science.  audit it. Fairly easy. Uhh, also polio 30-50x deadly. 

Don't dare fucking compare kids permanently wheel chairs everything tasting like burnt popcorn year. Lolol there’s actually many, many more. 

But friendly “congratulations” always welcome.  I'm also patriotic area I'm terrified school year. went orientation nights ago around 300 people, six wearing mask. two them. Herd immunity threshold Delta variant 80-89%. Amen I'm sure also spikes RSV cases children exited wearing masks. reason give immunocompromised people now. 

That false. Lol 50?   comment automatically removed linked source may reliable may dedicated mostly political coverage. possible, please re-submit link reliable non-political source, reliable news organization recognized institution.

Thank helping us keep information /r/Coronavirus reliable!


*I bot, action performed automatically. Please [contact moderators subreddit](/message/compose/?to=/r/Coronavirus) questions concerns.*  Smug, cavalier trolls short supply unfortunately. felt like heard 3 different occasions   No, transfer unvaccinated adult 150iles away admit baby. ridiculous. Lol lawful think getting EUA EULA mixed up. Congratulations! You’ve found exception rule! We're fully ""back normal"" except requiring masks inside

Pooled testing case updates included sure. Unfortunately online classes work parents unemployed able shell full time nanny day. absolutely agree mandated vaccines.

Of course thousands thousands cases kids, prove deadlier time goes on. really loss logical path forward here. Modern society complicated usual pandemic coping skills. different, fucking dipshit. Polio 30x deadly minimum. Y’all Variant America’s winning. vaccinated people get covid still transmit others, ppl vaccinated, less chance transmission overall. sure we're widespread Delta hospitalization right US, I'm quite sure point is.

My point wrong UK hospitalization specifically. UK extremely high immunization among vulnerable groups. unvaccinated population largely constrained under-30s. such, hospitalization much much smaller might expected based daily case rate. Feigl-Ding right concerned case numbers actively lambasting people confidence UK's high immunization rate vulnerable populations would result hospitalizations. Indeed, exactly happened.

Quite specifically, I'm giving example Feigl-Ding wrong Delta outbreak UK. wrong this. Hospitalizations never reached critical numbers predicted.

In US, immunization much worse. Delta ripping communities immunized. Many vulnerable populations remain completely unprotected political propaganda country fucking nightmare. think Feigl-Ding right concerned happen regarding hospitalizations here.

He often correct says. frequently hounds people disagreeing even though may good foundational reason disagree (as UK immunization rates effectively mitigating huge Delta numbers). Get vaccine Natural Self-selection It’s law, binding agreement. Giving third doses could subject facility lose vaccines fined.  Pro-vax arguments sound like pro-life arguments..

""I'm right *you* support killing people"" know joking actual Funeral home hospice companies invest stock market. people wear seatbelts good idea - people think seatbelts good idea they've gone front windshield. I’m wealthy woman certainly trust it. never want leave house guess really need vaccinated. HIPPA *medical* companies divulging medical information others. tell 3rd party medical info they’re mot medical company share whoever want.

Employers don’t “right” know medical history, aka divulge certain things free will, make divulgence requirement employment.

Again, *you agreeing* abide policies order work them. *rights* involved here. Rights things government cannot take away you, nothing happens enter contract private party. understand cerulean blue surrounded people not.

I understand people rockers.

I dispute they're going pull weapons roll Raytheon whoever main contractors supporting local base ready blast got laid off. 

Menacing someone porch who's asking vaccination status (which happen) very, different threatening government contractor employer, scale consequence going clear even mouth breathers. know family 3 times 9 months… still think immune now, holiday… world crazy… Yeah. Shit. apologies. Mental illness mean anti-vax. would say certainly applies way around though.  say rather stabbed, blown beat death first one? Sadly think multiple entities fit criteria.   whole point we're gonna get eventually. difference vaccines keeping us hospitals Id take guess alot people rapid antigen tests typically sensitive enough show positive results symptoms begin. people typically infectious two days symptom onset ...... Well explains it. 

This CDC allows PCR tests ""early release"" quarantine.  Chicago lowest test scores country. assure it’s Republican school system Can’t smell taste since last December read history vaccines things change, stay same. kind people demand schools pages pages dress codes. be...The Military REQUIRES vacines manner diseases, ensure ready deploy.   Who's they?    survive last show? *laughs Texan* mean drive 10 hours??? Ina book reading pushback people getting tetanus vaccine. really vaccine causing method injection. Still people believed it. gave fucks back would go house house forcing people get vaccine.   “Shove ass”

A real mature response.

“Na schools make decisions”

What schools dont demand students vaccinated?  Offer health care incase get side effects. Sure, they’ll give vaccine free, already poorly operating heart gives out, I’m fucked.  call Natural Selection See ya bye. People’s poor decisions lead people’s deaths. That’s logic simply Doesn’t work.

But America doesn’t teach us think critically things Nope, actually seen (in students' permanent file) multiple hand written notes parent school board saying child going forced get vaccinations. Often, little letter parent it. I've seen student's files before, yes, child unvaccinated. kind law can't actually enforced. kind like go anywhere (putput, anything could somehow dangerous, way hospital surgery) sign waiver hoping 99% people dumb enough think, 'well damn lost foot can't sue signed waiver'. absolutely sue win. 'laws' actually laws. That's stand court. Zones: Weekly Deaths Capita Heat Map Florida Longer Reports County Mortality Data)*

How convenient Florida 🙄 census wrong. news give context high covid hospitalization site said covid patients locally  Tennessee, schools open last year.


Maybe infants toddlers avoid RSV Covid again. Since avoid it.


Until time get vaccinated least Covid. worry RSV Covid. Executive summary: know much lambda all, we're worried laid waste Peru. New Jersey, New York, Mass, RI.

Guess win? 12 - Online vaccine tested. 

Over 12 - Vaccinations required class learning. vaccinated online learning. 

What think going happen? know teacher vaccinated (as school personnel). second day fixing classroom told someone tested positive Covid. Likely breakthrough case. tested immediately. happens kids there? Keep mind breakthrough case transmit virus others.     Nope. 

If math, 120M unvaxxed US simply means three weeks longer patient zero hit hospitalization population peak last year.  No.

A weeks takes undetectable you. source virus room. There's virus left room. link Seattle Times  Maybe, win Florida. He's already murdered margin victory last count.  don’t care moment get sick. “sorry” expect healthcare workers save them… till get better (some don’t) return selfish rhetoric. See post bmi index total bs often, skinny white person came them. saw muscular black men tip top shape get forced military soft bodied white folks used bs bmi numbers put folks thorough source super interesting. Thanks posting this. Totally meant post one mobile tired long travel day. Thanks! Unnecessary think general people pretty tired pandemic denial shit getting serious again.  No. Especially mRNA vaccines. least Lane Kiffin finally successful something! Yeah please share verified source claims it’s classified mild severe? Headline seems contain needed info anyway ;) get upvotes. Data much. ""just numbers"" boss, neighbor sibling gets it, even plenty stories people clearly denial dissociate melt loved one ends ICU. shoving throat. asked speak doctor. knows health, situation, direct impact community. never said get it. never insulted accused anything anitvaxx. never said listen random doctor online. said speak doctor. bring concerns either talk them, share concerns agree getting vaccine. 

If car broke googled issues, Google told based issues car totalled, would take shop get looked accept sell car? likely not. Let professionals guide correct decision you. agree know people say worried long term effects vaccine since untested. 

Also untested: long term impacts COVID. Longest examples got even two years old. there's plenty reason think long term impacts disease much worse long term effects vaccine. Anecdotal, interesting sure. Thanks sharing! name single instance vaccine taking year manifest side effects? Okay, respect point view. Since it’s Sunday dawned church bad. data, afaik, indicate death rates since widespread vaccine availability. Information saw elsewhere, unfortunately can't recall where, showed data indicating blacks hispanics %'s getting vaccinated similar percentage overall population. expect may vary sharply region places south getting hammered overall vaccination rates lower southern states, expect they're lower black hispanic Americans states well. Unfortunately ""experts"" make soapbox, twist facts lately push agenda whomever provided soapbox. entire separate section US codes EUAs. good example fact twisting news stating headlines ""EEOC says employers require vaccination"". Well, EEOC law stating employers can't require EUA drug, also law stating could require either. fact is, EEOC decide addressed government elsewhere. Anyway code 21 USCS 360bbb-3(e)(1)(A)(ii)(III)  guess thing everyone running around stating facts vaccine requirements, forget talking EUA drug, people refer vaccine. month ago could said pandemic over, exists pandemic. point, pfizer would lost EUA would illegal administer shot point forward. instead paying people get shot. true pandemic need news tell existed.

EDIT: thank normal discussion. Pretty sure replied reasons people asked. U.S. slowing since April way early slow down. clear gap would closed. lead headstart Absolutely, remember 7 100k frightening last year. Yeah dumb ass parents make sense bitching get another vaccine. HOnesly

&amp;#x200B;

\- afraid nah

* *afraid vaccine-resistant (the apocalyptic scenario)*
* *nah fine jab*
* *nah .. fine - might need reinforcements years (influenza)*  completely understand - sucks fear always leave faced contrary information. tried therapy? might help provide strategies working fears. One downsides policy like though employers might use control employee’s behavior hours, saying won’t pay test positive something view unnecessary outside work. Worked school shootings, right? won't.

We fantastic guy heading state department health pretty conservative guy, smart. conservative governor knew happening covid early tried reason people explain things like economic impact. still terrible mask compliance vaccination rates. people selfish people ever meet. literally care nothing immediate convenience. matter put care. threw Ivanka Trump bus posting vaccination picture social media darling. There's big movement undermine childhood vaccination mandates people. I've tried reasoning soon hit cognitive dissonance block shut down, get angry cut off. believe facts, accept academics proper sourcing. manage get turn around cover ground next week went back anti-vaxx friends Facebook propaganda. never get anywhere anti-vaxx groups prolific well funded.  hope make full recovery soon! Thanks sharing. beatings continue morale improves! parents go Westside church Placerville, CA. covid outbreak December 2020 still person services apparently encouraging people come vs online thing. one wore masks practiced social distancing there. I've told, announcement warning kind active outbreak. parents found mid-late January cases pastor got sick enough need go hospital. 

Idk church members died, many emitted hospital. 

As disclaimer, actually go church (or any). parents told  That's apocalyptic scenario lol, 18 months pandemic human beings earth poised never get jab amid constant need boosters worse variants coming along That’s money shot. Good job. 38, male good shape/healthy - I’m fitness industry exercise 4-6 times per week eat clean. don’t know exactly could exposed gym others daily - enforce mask wearing. also ate outdoors restaurant 3 friends, vaccinated none showing symptoms date. Adults acting like children really. say percentage 70%. even saw elderly yesterday wearing mask  Automatic translation bot, action performed automatically. Please [contact moderators subreddit](/message/compose/?to=/r/Coronavirus) questions concerns.* one wants logic! 

antivaxxers dont care. theyve heard arguments . theyre toddlers point. headline near perfect since follow 5 7 word rule extremely accurate specific. totally object opening paragraphs quickly state 53% Californians fully vaccinated means vaccine highly effective Delta. gave name get started. Here's [another Mine works friends' works. 
The weight politics misinformation 
Politics weighed immunization process, like many apolitical priori aspects American life. Race, religious ideas level education show clear differences level inoculations. survey carried July YouGov collaboration Economist shows, example, probability person vaccinated rural areas almost 10 percentage points lower average, explained lower risk perceive due less accessibility distribution centers. Still, according statistical model, biggest predictor whether average American got vaccinated whether voters Donald Trump Joe Biden.. 13 points less likely former vaccinated 18 points less likely latter have. 
Epidemiologist Susanne Straif-Bourgeois University Louisiana School Medicine especially blames misinformation social media. ""They read things like harm fertility women, pregnancies, true,"" laments. Pastor Spell one explosive anti-vaccine spokesmen, religious extremists, represent bulk population yet gone injection. people doubts. changed minds week seeing state news across country new major focus contagion. Brandon, practitioner one capital's pharmacies, corroborates this: ""I noticed many people coming days, vaccinating 20 people day."" Jackie, 71, waiting turn Friday morning. son died covid last year. think many drugs never even heard given put medically induced coma. painfully stupid people. 
Louisiana, current record covid cases United States, experiencing toughest moment pandemic half population remains without immunization due fear, neglect rejection Government 


Scott Dowell, 60-year-old Baton Rouge protective equipment factory employee, vehicle.  
The number hospital admissions reaches level never seen, intensive care unit main health center Baton Rouge, capital Louisiana, run beds. number deaths triples 14 days; contagions, doubles. might seem like news year ago, more, news March April 2020, war part southern US state, experiencing worst moments pandemic spoiling thousands vaccines citizens get. territory highest number infections per inhabitant entire United States third tail vaccination. Louisiana, 47% adults complete regimen, 55% injected first dose and, thousand requests authorities, millionaire draws 616,000 deaths throughout country , who, like Scott Dowell, he's planning it. 
“The vaccine yet approved \[the US drug agency authorized emergency use\], rushed get out. wife partner works ER says caused strokes, side effects ... proven enough, ""says Dowell. 60-year-old employee Baton Rouge protective equipment factory, fears cure disease, convinced current variants virus less dangerous fairly healthy person. ""I really believe news saying either,"" adds. 
The covid become crisis republican states 
Distrust, hoaxes run social networks coffee conversations, complacency general improvement situation, allergy government intervention, laziness. cocktail disparate motives weighed vaccination United States , advance delta variant set alarms. United States, 71% 18 years age taken least one dose, differences large territories: Vermont, 87% done so, Mississippi, Wyoming Louisiana, done it. 51%, 52% 55%, respectively. 
Tony Spell, pastor Tabernacle Evangelical Church Baton Rouge. / RAEGAN LABAT 
Tony Spell, pastor Tabernacle Evangelical Church Baton Rouge. / RAEGAN LABAT 
Louisiana, conservative religious fiefdom, true anti-vaccine apostles. Tony Spell, pastor Evangelical Church Tabernacle Baton Rouge, framed multiple arrest bail warrants accumulated year half refused comply every one rules. authorities. never stopped holding indoor meetings never worn mask church. course, neither customers vaccinated. “I trust government tries promote vaccine made year need decades, top work new variants. God given us immune system resist virus social distancing weakened it, allowed us achieve herd immunity. 
The queues receive injections seen beginning pandemic stadiums big cities seem like another world piece America, hardly anyone seen vaccination centers. population 4.6 million inhabitants, registers average 4,600 cases per day, 99 per 100,000 inhabitants, highest ratio United States. 
The political dispute progressives conservatives - former inclined restrictions latter suspicious public intervention - also manifested inoculation process. governor state, Democrat John B. Edwards, already vetoed three bills state House, Republican majority, sought prohibit different measures require stimulate vaccines. Franciscan Missionaries Lady hospital network, largest state, issue order staff vaccinated coming months, laziness doubts reach sector itself. 
Joshua Denson, director critical care unit Tulane Center New Orleans, speaks disheartened tone: “Today admitted three people intensive unit none would here, vaccinated. , could be. Half quite likely die, enough confidence science, frustrating. "" Specializing pulmonary medicine, Denson experienced outbreak pandemic 2020 stupor rest profession. “Many us afraid treating covid patients. community asked lot health workers crisis demoralizes mistrust ”, adds. 
Meanwhile, outside building, streets tourist center New Orleans , French Quarter, abuzz people delta variant preceded roam freely. tourists, bachelor parties, crowded concerts, hugs friends back. Customers burning return burst life hoteliers keep businesses alive, unbeatable alignment interests. bars, Effervescence club AllWays Lounge, Marigny, begun ask vaccination tests masks whoever wants enter. happen schools, despite increase hospitalized children, since law Louisiana protects parents want immunize religious philosophical reasons. 
The incentive route seems exhausted. Governor Edwards announced June raffle scholarships cash prizes, including one one million dollars (850,000 euros), vaccinated July 31, move foundations problem. general trend throughout country, stimuli type proliferated. Alison M. Buttenheim, specialist behavioral economics develops trials campaigns prevention infectious diseases, explains trend studied States carried initiatives “there spikes numbers inoculations ”. “What works especially people trust get vaccinated encourage so,” adds. 
For some, Jacc Mikel, awards even counterproductive. 53 years old, African American get vaccinated last Thursday feared possible side effects suspected interest authorities. ""If look back, born, system used black people guinea pigs test things, lot ignorance, misleading, many people died, including children,"" explains garden one houses cares New Orleans. 
The black population, poorer legally segregated half century ago, decades cannon fodder medicine United States. Tuskegee Syphilis Study aberrant example. developed 40 years Alabama population name consisted, basically, taking 400 black men infection denying possible treatment able analyze progress disease then, died, study bodies . began 1932 continued 1972. time made human guinea pigs without knowing it, told evil suffered. experiment ended right came light press scandal broke. 
African Americans' mistrust white doctors lasted long time. Jacc Mikel emphasizes things changed, misgivings remain. recorded video getting vaccinated Thursday began sending young people neighborhood believes help. 59% population New Orleans black. 
“They call Uncle Jacc here, respect me, know? I, stubborn, end put on, think impact ”, says man, dedicated taking care houses, walking dogs kinds fixes botches put contact community. says if, all, overcame misgivings, Leo, 10-year-old boy area told him: “I want anything happen you, could \[the vaccine yet approved children 12 years age \], would get vaccinated ”. 
The decisive prescriber may be, some, 10-year-old child, months turning deaf ear authorities. trigger may death close friend. impossible figures Louisiana lives days. Republican politicians, too, begun reinforce pro-vaccine message months little enthusiasm issue. Sorry, HIPAA filters every class? would something see. bleep anything related discussing medical history real time?

Guessing wanted HEPA. Heads roll beyond ridiculous!! kids chance without Vaxx it’s children Fucks Sake! Don’t encourage morons.  Excellent! surprising considering Americans tend distrustful authority therefore prone anti vax sentiment. 

It also noted European nations. Many Eastern European nations lagging behind. post appears vaccines. encourage read helpful resources COVID-19 vaccines:
  
[Vaccine FAQ Part FAQ Part appointment bot, action performed automatically. Please [contact moderators subreddit](/message/compose/?to=/r/Coronavirus) questions concerns.* really care communities. care themselves. CVS booked days! surprised, would go deep burbs. That’s problem though. still unvaccinated unbelievably selfish don’t give crap anyone else Yep industrial livestock habitat loss self perpetuating cycle seem cause pandemic. agriculture animal agriculture together make pandemics. Much like palm oil pig pandemics.  post appears vaccines. encourage read helpful resources COVID-19 vaccines:
  
