,date,text
* Make sure know free, quick, easy get vaccinated. know number people religious, advanced degrees science technology STILL believe whacked-out conspiracy theories. almost like, everyone knows bad government society fucks us over, might well fun nutty fantasy dark society could be, even evil threat issues like medical bankruptcy mass shootings threaten us daily basis. [2020 party affiliation (by region) 18-29 year Republican 

* Northeast: 25%
* South: 36%
* Midwest: 35%
* West: 30%

Gen-Z less conservative older generations, still quite conservatives. return normal past pandemic, including ones bad worse Covid? 600,000 people died United States 1918 Influenza pandemic, time US population 200 million smaller today, yet still “roaring 20s”. without vaccine. wore mask international flights since already breeding pit cold viruses pre-pandemic look Texas. opened completely, virus exploding.  J&amp;J Moderna around. Blaming US makes 0 sense. Edit wrong thought South American countries taking Chinese vaccine? hack Oxford copy paste everything one?

Wouldn't completely surprising, evidence? seen anything past last year's allegations hacking attacks. Sputnik V Oxford/AstraZeneca two-component vector vaccines developed almost time, use different adenovirus vectors. Sputnik first vector vaccine created Gamaleya Research Institute, like lack experience create it. considering AZ agreed Russia trials combined Sputnik+AZ shots, seem holding grudge either. Vaccinations certainly part ""the game,"" they're beginning end, man dumb conversation **Does anyone really sincerely mean question anyone THINK WANT locked ?**  


I used drive freeway see family lives hour away twice month more. enjoyed going bars old friends drinking Saturday away . miss taking girlfriend nightclubs dance . Hell world lockdown used one day Disneyland 3 day pass 2 days kind assume gone feel comfortable using anyway. 


I've spent majority past year largely locked apartment , sparsely heading freaking fuck forget mask walk two steps away front door.  


I need mental therapist got laid can't afford mental therapist got new job hope first real check months afford mental support. 


The amount people happy lockdowns small think mot lockdown supporters WANT locked . hopefully reduce spread, help manage vulnerable amongst population communities . rest us vaccinated intermingling possibly spreading virus want pretend gone bringing people vulnerable us acceptable eyes.  


Everybody keeps pretending like country vaccinated that's true significant portion accepted pursued vaccination everyone large pockets gonna ravaged delta , delta plus, inevitable delta ultra super max reason lockdown try beginning try curb spread...you know curb spread?  


Opening everything resuming life antivaxxers intermingle among us we're right back God forbid super resistant variant develops nothing.  


They say ounce prevention worth pound cure , Let's work prevent covid decimaitng us like 2020 . feel like we're groundhogs day people keep rooting dive back opening everything get see wave happen . ludicrous like shit going across world pretend show doorstep like EVERY SINGLE TIME 


I people want lockdowns accept alternative nightmare never get ""normal "" back work preserve little progress we've made.  


Australia lockdowns far restrictive suffered fewer casualties managed virus infinitely better us , returned version normalcy us envy longer periods us seen last year. 


We stop insanity insisting immediate normalcy actively making covid social effect worse every time.  Nice finally see acknowledgement evidence losing mind. Also piece emotional response new; figured depersonalization due gas-lighting. 

Here's hoping there's way reverse this... COVID dementia sucks.  Hope goes well! I’ve feeling like crap day ( feeling worse first AZ though ). Pfizer second. 

Hope don’t feel bad afterwards.  Scary think delta would ripped world back early 2020. Yeah, typo part - 59. Gen X Kennedy died onwards. never said same.  yep. count matter. old people, 50%+ people perfect health. 

The comments sub taught that. young, fit athlete-types matter....except bad reaction COVID, matter anymore since rare. welcome Fox News  make vaccine passports. Young people love travelling. Vaccine passports alone probably whittle 25% hesitancy rate 10% less. Wow, thanks. That's pretty close I'm after. feel way support mate 👍 know live, many people still voluntarily wear masks socially distance. California reopened six days ago. help Australia Russian skepticism authority century totalitarian dictatorships oligarchy, isn’t extreme religious fundamentalism, racism, conspiracism American right.  I'm arguing efficacy vaccines anything like that. I'm saying we're gonna ""overly cautious"" towards covid, virus low death rate, even lower people demographic, I'm going cautious regarding vaccines regarding health effects. make sense pick choose chose level scrutiny cautious. Covid effects small percentage ppl, vaccines. I'm going equally diligent There's lot it, see megacomment below. huge one links.

If good way say ""mixing vaccines doubling doses/vaccines dangerous, basically ever, time either, unless talked doctor (mostly wasteful necessary, vaccinated fine)"" fewer words, I'm ears. aren’t low hanging fruit options. They’re impossible, illegal, options. What!
Source vaccination covid recovery increases blood clots.
I take vaccine tomorrow did. governments. Taiwan example surge thought over. Many national international experts jubilant Covid India managed well. Govt appointed panels commissioned sero tests found 60-70% people Covid antibodies already. Infected people getting hospitals within day two. everyone became lax. People refused take vaccines. Doses thrown out. delta variant hit changed everything. Yeah I’m wondering well. pointing lot shitty things Trump did. arguing that. 

However, point make we're *now* (not could gotten bad) vaccine rollout. big vaccine distribution centers rolled almost state run, federal. (For instance, Dodgers Stadium clinic busiest clinic US run state). federal ones set rural areas primarily, main issue places supply, getting people willing. worth trying, kind wash. 

Mask wearing go Biden took office. Would higher president entire time? Likely. that's question. We're talking we're now. I'm saying Trump lot shitty things, I'm saying know Biden get us point much faster trajectory on. hit million shots day office, original goal reach first 100 days. What!
Source vaccination covid recovery increases blood clots.
I take vaccine tomorrow Congratulations recovery far best wishes going forward. incredibly self-righteous, you? Consider getting high horse.

The reason cases mean fuck causes mild bout sniffles, also known cold. vaccines best, rate 92% 96% AZ Pfizer respectively vs Delta, variant highest transmissibility (this mean 8%/4% become deathly ill either). impact clearly seen countries high vaccination rates, US, UK, Israel.

So, uninformed one here. world opening again, without you. personal kit test antibody level ? Lol, FDA looked yet? We’re everywhere. Death illness aside, things went still going AUS way miserable. top that, American ass worry friends family states.

Thanks recognising logic. whole point people shouldn’t dying amount death celebrated. I’m disgusted much opposition that’s met with. Newsflash: Every country world preventable deaths. see 118. States seem report thier numbers weekends, data dumps something Monday. CA had...620 cases yesterday...and today...1,214 5pm CA time. cases double 1 day. (if would bad sign....)   multiple states list thier totals seemingly Sundays, shows 0 but..the next day...a bunch. Michigan today 36, yesterday seemingly data. Colorado 32 far today...yesterday...a ""zero"" probably, data. go combined 0 68 one day.  Looking Monday's useful imo. (today far 196, ""double"" one day...its weird reporting weekends.) It’s three shot . Perhaps countries options might use it.  bad it’s clear effectivity might delta variants. Nope. Actually home grown vaccines expensive vaccines far. 

I think production capacity. China 1.4 billion population simply rely BioNTech promised 200 million shots China.  Hopefully things pick later week. I'm hoping 55% July 4th stole someone, maybe you!

I'm trying cover multiple bases though, including ""I got J&amp;J/AZ/Novavax, get mRNA booster?"" thing.

So fuller exploration questions warranted. want read parent develop antibodies vaccine... is, given place. Australia done it, really takes lot effort. hope US it, cause otherwise, somewhat sad timeline. risk Covid significantly higher whatever risk vaccine carries.

And notice rapid decline cases deaths Covid US right? think may ask you? booster works 2 doses current 2 dose vaccines still effective. less effective original strain, wild-type SARS-CoV-2, seems disappearing it’s replaced infectious strains. would like signal highest displeasure pandemic handled. given much social life year half. lost 42% income 2020 compared 2019. one seemed give shit. People canceled contracts could worked almost zero covid risk. behavior elected officials, health bureaucrats, media appalling. getting vaccine seems leverage them.

So method protesting Covid restrictions behave manner risks extending pandemic restrictions? really thought through?  Well people get vaccinated then. point it’s you’re adult get refuse. don’t feel bad people get sick die. made choice. shut why? people won’t get vaccine? Go away. then? Get vaccinated. Pfizer awesome. help figure second dose. delta vaccine works yet? large population zero natural immunity, vaccines lower efficacy, low vaccination rates 

What said applies Hong Kong. Pretty much telling happens leave decision freedumb loving mobs. ... like covid? chance anything bad happens demographic extremely low, get vaccine? I'm going apply high level risk aversion covid, I'm gonna vaccines I'd go Pfizer second  really tell concerned really about. 

They saw J&amp;j issue instantly paused looked more. fact taking serious stance shows big deal J&amp;J issue Sure that's 100% completely different argument population size. wonder today there'll new restrictions announced. mask mandate across entirety metropolitan area. Although said, influx cases yet. You’re risk far things compared whatever risk second shot Covid would bring. It’s astronomically low chance second dose anything bad Yeah real. damn health line. I'd appreciate hurry fuck maybe take holiday day Trump plan distribution. big public centers, example,. Biden did. 

Trump mostly telling people mask, use cures work actually hurt people, virus big deal. Biden.

Trump's administration literally stole masks protection states trying procure hospital staff others. told states buy own, states did, Trump's administration stole it, resold states. Biden would never anything like that. keep trying find affect children. kids 12 cannot get vaccinated yet mean them? demand freedom die burden society.  NHS privatized healthcare ""emergency"" meeting really emergency. Yah one particularly dumb. Giving shot rich, white people great method targeting Black people.  Ironic, considering many conspiracy theories started spread Russian govt. USA update first dose shots:

254,664 first dose shots. Last week 394,090

7 day rolling avg 444,054 (463,972 yesterday)

177.0m age 12+ first dose - 62.5% (177.0m - 62.34% yesterday)

168.8m adults first doses - 65.4% (168.8m - 65.4% yesterday)

53.4% overall (53.3% yesterday)

At rate, first dose shots:

On

July 4th - 183.1m

**12+ population numbers (based 284.1m population)**

On

July 4th - 64.5%

65% 7/8

**Total population numbers (based 332.6m population)**

On

July 4th - 55.1%

55% 7/4


**Path 180.6m/70% Adults (based 258m population)**

7-day rolling avg adults 353,119 (369,589 yesterday)

July 4th - 173.5m - 67.3%

70% 7/24 9*5=...45 Even northeast.. I'm stricter lockdowns hardly ever see people masks. Seems like guys always excuse come vaccines people already it. hospitals already diverting patients 40% nursing staff vaccinated. There’s major urban rural divide current case spread state appears level areas without hospitals seeing high increases. next 2 weeks I’ll bet graph across state. cities low vaccination rates too. even guy making decision 50s.

That happen often. USA 5 times population UK.    US currently sitting 45% fully vaccinated vaccination rates plummeted. I’d thrilled ~only~ 20% didn’t want vaccinated.  let's **ALWAYS REMEMBER -** US 350 million fucking ppl probably diverse, every imaginable way, country size. Medications negated vaccine. interesting picture [the spike protein [Nature article September counterarguing wanted show picture, quite interesting article well. 🙂 prohibiting travel unless prove vaccination status medical exemption IMO. responsible enough get vaccinated, allowed privilege. money.  Yeah meant sources evidence led believe that? Genuinely curious... California taxpayers pay unpaid rent. Thanks Joe! always case. Pfizer Modernas' vaccines 95% effective original strain, 100%. body-building. Yeah, pandemic 100 years ago still completely failed prepare manage one. Epidemiologists said pandemics future significantly worse. shown well capable complete societal collapse. hospitalization rate people age fitness level rounding error. Regardless, point assertion impact validity.

You asserted, certainty, matter time mutates makes current vaccines ineffective

I explained true. *might* happen--no denying that. does, *should able to* boost said variants. one speaking absolutes. mask protect wearer. protects others YOU. wife,yes problem yet,just Canadian born ,permanent residents essential workers,probably late July August Ok, imma stupid haven’t following covid lately I’ve fully vaccinated. strain one resistant vaccines? problem Putin?  find moving helps pain. Tylenol also helps lot.  hope one recovered COVID-19 develops long-haul COVID loss brain tissue. 
       
r/covidlonghaulers/ 
     
""COVID-19 may cause loss brain tissue; Delta variant fuels steep infection rise England"": sort witchcraft this? Time move great country Cuba. I'm worried family members immunocompromised. protected, hell point everything? Stay pressed loser, 6 figure death count untold economic damage.  Mostly Pfizer Moderna Ontario. Well...the reason everything March 2020 beyond protect people. reality epidemiologists said relatively mild compared pandemics still expected come future. Even gain total immunity covid something else comes that's much worse. keep mind scientists warned decades pandemic exactly like still completely failed prepare it.  hope one age contracts COVID-19. 
       
""COVID-19 may cause loss brain tissue; Delta variant fuels steep infection rise England"": STAT good collection info Covid treatments. Ivermectin one them. Like HCQ, pre-print, non-peer reviewed study Ivermectin cited conspiracy types, time shown ineffective repeated studies, info already web. 

There number ""doctors"" scamming people. careful sources. think facebook twitter following CDC guidelines choices block. Yes. (?) one wants hear it, cases going due vaccines *in combination with* public health measures. Vaccines set increase, public health measures depend public continuing buy take long term view. I’m afraid given get laughed saying remove public health measures insofar removed, Rt stays 1, continued waves outbreaks covid happen.  Wow 8 million day! Go India 🇮🇳  
I expect figure rise coming days/weeks.

The reason India’s vaccination numbers significantly lower due State governments’ incompetency vaccinating, hiking prices, playing petty politics, etc.

Now it’s good see Central government led Modi take control vaccination drive, improving governance. Hopefully 1.3 billion Indians vaccinated soon. remember tornado wiped neighborhood except one house. mom like, ""Isn't miracle God saved one house."" see wanna see. lot landlords need rent pay mortgage.

that eviction moratorium meant lot landlords got screwed.

they're homeowners 

&amp;#x200B;

**What Mom-And-Pop Landlords Relieve Eviction Ban Pressure** landlords approximately **77% small building units,** often affordable single-family rental homes large apartment complexes. ***These small investors tenants likely vulnerable economic downturns, according analysis Urban Institute.*** looks like linked r/CovidVaccinated, focuses anecdotal experiences COVID-19 vaccines. Please aware self-selection bias impact information presented. Individuals negative side effects likely seek communities find support, whereas less likely individuals neutral positive experience.

If looking information vaccines, please check [COVID-19 Vaccine bot, action performed automatically. Please [contact moderators subreddit](/message/compose/?to=/r/Coronavirus) questions concerns.*  saying vaccine infects COVID? COVID vaccines live attenuated vaccines (which infect you). Live attenuated vaccines older technology, show body produce antibodies virus appear, infected. Hope things continue improve. Best wishes there! i'd moderately amused add masks TSA-Pre stupid shit they'll let pay of.  definitely page. surprised took 100 years global pandemic scale occur, make clear Ill equipped are, shows bad next one could happens apathy passed.

Gosh forbid another pandemic next decades, refuse undoubtedly dig heels further, susceptible giving see fruitless adhere public health directives large percentage population clearly doesn't.

We downfall, late learn mistakes. Usual disorganized crap woman tell ""WHY? over!"" handed mask told put entering clinic. response her, I'm afraid, growling ""NO, NOT."" hate say fed people like her, am. also like use *The Voice* people. drains me.  Automatic translation bot, action performed automatically. Please [contact moderators subreddit](/message/compose/?to=/r/Coronavirus) questions concerns.* long karma still lives hills, we’re gonna keep digging fact I've stated clearly talking cases article talking hospitalizations. saying Utah part south using reference point states. agreements disagreements article. disagreement rush jump conclusions. 

If would read article would read last part agree generally comment. 

""Many states better states parts country. article one big lie get clicks."" 

From article worst-afflicted states, situation nowhere near alarming residents survived recently February; absolute numbers hospitalizations remain far lower. signs uptick come amid jump cases U.K. attributed spread highly transmissible delta variant. think he's right wearing masks right thing do. reason we're removing mask mandates restrictions businesses US nothing vaccination rates politics financial contributions. Aha! That’s brilliant. loan forgiveness criteria qualify for? freaking sad. Ridiculous. asthma **so there's still risk** *(and gets really dangerous)* Take 0.1% military budget year spend vaccines everyone - US far advance strategic objectives globally military expenditure makes year. vaccines? problem one south asian countries vaccine. work good been. over. Really disadvantage would it’s 3 shots. Cuba’s medical track record though makes promising alternative. would hope Pfizer provide updated vaccines never absolute, know mechanisms couod mutate. Regardless, point assertion impact validity. grown man, atheist, practically crying keyboard news whispering ""Thank God"". Haha placed large order cure vax last year. Also Sputnik, sinopharm, sinovac, moderne, Pfizer, AZ, j&amp;j. 

The cost overspend vaccines nothing compared ongoing costs restrictions financial support (which still ongoing industries remain affected). also hospital parking lot field ICU Hundreds millions people already shots without issues. I'm sad many people gonna die till control. Hopefully variants evolve ignore vaccines. Herd immunity never thing people decide vaccines political view (they not). Many conservative counties barely 20% vaccination rates. Yes. on-going trials UK. believe first finished (with positive results) second underway. Google COM-COV lot people don’t look data read headlines.

The narrative surge south isn’t happening. post appears vaccines. encourage read helpful resources COVID-19 vaccines:
  
[Vaccine FAQ Part FAQ Part appointment bot, action performed automatically. Please [contact moderators subreddit](/message/compose/?to=/r/Coronavirus) questions concerns.* even enough supply. Seems like diversion tactic Thats situation all. UK offering vaccinations adults.

There pop-ups places far live anyone rock-up get jab.

We supposedly enough non-AZ 30s. age recommendation non-AZ raised. good example EU asking reciprocity bad move, hoping come 4th July :( enjoy trip! consider total population size, consider population life threatening condition instead. 

Most people healthy suffer lack health coverage. pool people life threatening diseases, much much smaller total population (although know exact number), 45 000 died directly lack healthcare.

For reference, ""only"" 3 000 000 Americans die every year. Lots due old age accidents factors, even then, 45 000 3 000 000 much higher scarier number 45 000 300 000 000. 

And finally, consider deaths preventable. Cancer big killer, half million year, spend enormous amount resources lower number, without much effect unfortunately. situation heart disease, deaths hard prevent. universal healthcare known solution proven effective every country world could prevent 45 000 deaths, according many economists, spending even less money currently. 

That's absurd Reddit makes big deal it. [COVID held pavilion 84A Redhill Lane void deck 89 Redhill Close today Wednesday. Residents asked carry NRIC identification purposes. Happy getting vaccinated. everyone could see ugly COVID hospital ICU, vaccine-hesitant people would sign vaccine.

I got Moderna. shots made feel like shit. whatever, knew whatever felt would immune response unlikely actual sickness/reaction.  data misleading everyone symptoms. Studies suggest 10 - 20 times people covid confirmed cases. Delta varient give good shot. Well CIA done lot fucked things. understand Americans dislike them. mean eventually contagious variants pick communities refuse vaccinate? long flip certain states blue? guys see valid reason celebrate? Please, war yet. Sure hear cough, perhaps night time?  mga idiots na lang matutuwa sa Duterte Drama na yan!! Viet Nam here. follow harsh program since Day 0. trust cyber firms, fight like hell since Day -1.

Total deaths due COVID 1.5 years: even 80 yet. Fewer 10 deaths 50, think, probably 1 death young known health complications. 

And poorer US, less robust Healthcare system, worldwide institutions suspicious us default (proven pandemic) more. this, can't guys? either court system people ending jail. So, I'll try keep short. We've coming US many years. planned big proposal (soon be) wife last May 18 months, (everything paid etc) Florida last May cancelled. ended locally UK still nice same. stag (bachelor) party planned mid-September Vegas honeymoon (Florida) November. I'm starting get worried also cancelled. interested understand view American citizen fully vaccinated tested tourists. Thanks replying! want give link regarding efficacy j&amp;j vaccine. say fake? someone used antivaxx, believe they're anti science. believe understand science better do, doctor does, even vaccine manufacturer. 

The antivaxx stance bipartisan attraction, New age woo witches quiverfull fundamentalist christians. 

This another situation online communities become main way people network instead face face. Online surround like minded thinkers gain satisfaction faux confidence one ""really sees what's going on"". they're oppressed, folks onto big pharma, losing autonomy bodies. 

It's quite scary, pandemic made type social isolation divisiveness worse. Exactly, roughly 150 000 people die day. media solely focusing covid? sure old are, Menactra slightly newer, it’s possible group got missed roll out. Here!’s CDC’s [recommendations needs Meningitis vaccine. You’re probably fine!! would say losing election? fittest healthiest people planet died virus? guess virus must fake /s  Oh yes could missed Hydroxychloroquine injecting bleach plus heat helping kill virus predicted. Sometimes stupidity fatal. that? Yes. know long term effects mild COVID long time. Brain tissue damage rarely recovers 100%. effects likely chronic, telling sort health issues occur track.

I deeply disturbed people taking vaccines basically whatever want, used tool - conjunction social distance/lockdowns/testing eliminate virus. South West, east Maharashtra. North Punjab sure presence delta variant brought NRIs vast numbers mean… works I’m sure humanistic ways convince people take vaccines…. it, enjoy stay, thanks conscientious.

Where visiting? US big place. delta variant spreading UK, growth rate slowing hospitalisations deaths still low. vaccine working here.

Whilst would preferable get delta variant all, vaccines deal (albeit needs two doses). Totally agree, can't stop deaths, try? Let's dismantle entire healthcare system, one person dies what's point?

You dolt come tons athletes gotten returned playing within months? Kai Havertz couple months ago ended scoring winner uefa champions league final... Weird. guess must dying. media went rails decades ago. None surprising. It’s seemingly new phenomenon, don’t know antivax stuff started I’m even old kid everyone got shots that.

