,date,text
Of course, quarantine month, even fully vacced. wish vaccines, good. Things looking bleak restrictions pretty tough developing economy. lot reasons USA per capita COVID deaths places, ranging poor response poor overall health. danger success, creating false sense security. friend Taiwan one vaccinated April give away doses. doses scarce recent outbreak, could avoided greater uptake vaccines.  I’ve two doses az, crazy get third shot Pfizer? world turned around quickly? mind paying much even money taxes, I'd love if, say, instead 25% federal income tax assessment going military spending, would go towards education family relief (child care, elderly familial care). Maybe even towards health care... think few. Zero realistic everyone got vaccinated, hospitals probably even require PPE anymore almost everyone hospitalized covid unvaccinated. Wow you’re struggling here. evidence 164 people dying day capitalism? ""It affect me."" says group people. Ethics, morals, greater good window. Thank job idiots got vaccinated things like polio without able pull bullshit selfish card. try avoid checking kids going one 'very few' serious complications. OP, situation. absolutely believe science statistics. max vaxx missus well max masks whole family. 

There enough vaccinated people yet make science statistics work us. Friend mine journalist. He's utterly appalled badly media behaved this.

Fear mongering, spreading misinformation guise sides asking questions. mother law another friend weird hangups like this. They're anti-vax keep coming excuses stall. point enough people gotten guess they'll probably fine still annoying. 70%!!? 😮 vaccinations India almost done covid. Thank goodness!! Look Germany. send people fat farms get healthy government's dime. Cheaper paying long-term health issues. Wait shouldn’t nervous surrounded probably unvaccinated people restaurant rn? I’m vaccinated parents Lol I'd like know too. saying 164 people die day inability pay? high hope vaccines rolled we'd get this. Now, see light end tunnel anymore.  reason internet reddit particular like make fun people think rights good. bizarre. type ""muh rights"" misspell makes proud rights dumb. live America, Walmart’s CVS’s selling Abbot rapid testing kits $20. comes 2 swabs gives result 15 minutes. It’s bit less accurate traditional PCR, way better nothing. measures put reactions terrorist attacks/threats, government mandates pandemic. That’s entirely different situation this. 

Come man, really think airports, obsessed identifying potential threats, wants thousands people walking around concourse concealing half faces isn’t pandemic going on?

Use brain second. CDC needs meme army  become resigned believe things fantasy?  I'm Missouri. town friend in? confirmed Delta variant? How's doing? think. least would. They're going isolated they're vaccinated, anyway. Maybe they're content staying home allowing visitors? US power per capital covid deaths UK. tell need hear order get tested... Fever, cough, fatigue. Nice. bout 6.9 Stranded die alone? Lmao fuck even talking 😂😂😂😂 sell tests otc Walgreens go to. according mechanic 7 day average takes account   Better pay even money deal consequences much worse homeless problem. Risk clot second dose way less. fine Miami-Dade Broward county high vaccination rates, actually national average.

Wouldn't terrible idea avoid packed nightclubs crammed bars tourist areas Friday night otherwise enjoy trip.

Total population

53.4% USA

56.6% Broward

65.1% Miami-Dade


12+ 

62.5% USA

65.7% Broward

75.3% Miami-Dade


18+

65.4% USA

68.6% Broward

78.6% Miami-Dade


65+ 

87.3% USA

92.3% Broward

95.8%   They're occurring unvaccinated. don't. AZ's vaccine trial showing 10% efficacy Beta. exact time updated trials would start? Still pretty tragic :(   would guess, CDC decided themselves.

We really care asymptomatic non-infectious breakthrough cases though. Like, point vaccine prevent disease, doing. 

If start seeing symptomatic breakthrough cases, there's evidence spread via breakthrough cases, boosters something.  you’re US country it’s extra hard get vaccine get J&amp;J. 

You’d miss July waiting Pfizer first dose like 38% effective. J&amp;J you’d like 64% past 4th. becomes determined need sort booster rollout infrastructure fast enough US. 

There misconceptions efficacy J&amp;J. go page 34 CDC overview 
You see efficacy actually continues increase past 14 days, lower number submitted phase III trial couldn’t obviously wait 57 days out. You’d 76% even got 2nd Pfizer.

However don’t mind waiting month that’s fine too. I’d rather something sooner delta variant starting go around. Overpopulation red herring. advocating population controls response “overpopulation” believing Malthusian trap borders advocating eugenics “over” populated countries (namely poor ones). reality small population rich people, predominantly wealthy countries directly indirectly responsible outsized amount pollution environmental degradation. global society equitable richest didn’t live excessively, wouldn’t issues facing terms “destruction”. undercook fish? Believe not, jail. Vaccinated Californian here. state mask mandate lifted, back now. Tonight work, picked groceries wear mask, to. Felt like reaching milestone, cuz was.

Tomorrow next night fellow fully-vaxxed coworker friends gonna grab drinks. bar. Inside. full capacity.

As someone stayed distanced stayed away medically compromised family always wore mask public respected gravity whole pandemic, I'm hyperbolic say awesome. big.  variants “pick off” vulnerable. That’s defines vulnerable. Better nothing, I'd still take it. noted paper peer-reviewed yet. “You really careful statements made papers haven’t vetted,” Holbrook said.

Needs verified stop spamming thread. like 50% people church vaxxed


As someone goes church, I'm afraid number optimistic :(

Anecdotal course dad hardcore negationist antivaxxer. got first dose Sunday (basically soon could).

If 20 still parents tell instead thinking head need grow up. European here, went huge spike, areas delta variant increased cases hundreds percent. Season seem matter much here. New variants contagious lethal, get following evidence. Younger people making majority hospitalizations. Again, dont expect information make it’s way beyond screen you’re reading on. drink shots (which 1 1.5 fl oz) stopkas 50ml (1.7 fl oz) common. Vaccinated people tend get mild COVID. also lose brain tissue? I'm foreigner Russia vaccinated sputnik soon available. Like said, vaccine technology extremely well established, I've read peer review literature top vaccines. would take offered. *laughs Delta* Considering vaccines work basically variants, I'm sure fine. seems comment contains 1 links hard tap mobile users. 
I extend they're easier sausage fingers click!


[Here link number 1 - Previous text ^PM ^[\/u\/eganwall](http://reddit.com/user/eganwall) ^with ^issues ^or ^feedback! ^| ^| That’s generous. say August we’re fucked again.  lockdown first wave even strict Europe North America. Everything shut police stopping anyone moved. electronic 'pass' system anyone outside without pass fined.

Once sputnik vaccine available though, government seems backed attempt restrictions. Even recent restrictions 'mildly' enforced. Aye. Definitely get vaccinated, I'd caution use data say flu. Even mild cases result brain probably want avoid virus even fully vaccinated. Weird title. guy's uniform says охрана (security), think qualifies ""prankster."" Mild cases still cause brain warrant investigation celebration. do? lockdown another year? I’m trying flippant, I’m genuinely curious alternative is. wife staggered it. Even though J&amp;J Pfizer accounted schedules potential downtime. Even get Covid don’t die end hospital unless you’re asymptomatic you’re likely downtime well, likely vaccine. wonder means mild cases among vaccinated? vaccines still protect brain damage, lock downing tie sh!t virus.  burned people countries care type government runs country long keeps sight interfere daily lives. Governments take care keeping roads passable state, remove garbage basic policing. Anything else seen authoritarian. 

This mistake Soviet Union satellite states. amount BS people endure daily made unpopular. also reason many people oppose dislike covid related rules. fuck government tell wear face? many people meet? dictatorial Well that’s good sample all. America’s biggest spike January, nobody vaccinated. probably makes least half ‘99.75%’. need sample last month something gotta say, x-ray vision awesome extremely American-centric. know delta variant didn’t mutate unvaccinated Americans, right? India, couple percent vaccinated. Variants poor unvaccinated countries 100x likely harm Americans long run else going show new Botox injections?! Yup. Remember went away election? Good times. Ever heard Northern Ireland? Given it’s around months, especially time UK, absolutely would heard kids risk before. they’re not. Calm Found human bad analyzing risk  wish people understood this!  hard understand? choosing go fight battle wear armor not? correct answer ever to? Lol problem us want Pfizer, Moderna. Sinovac demand here. Outside week? Yes.


Currently? really depends area rush are. 5 neighbours got shots yesterday, 2 different sites, got Pfizer. (All 18, youngest 20) told might offered moderna ran out, could say thank come back front rebook date guaranteed Pfizer second dose wanted.  1 (1)

Ugh, hoping ever see again. Like one part? Here’s info side effects Pfizer. really hope has, I'm also suspicious, wonder politicians pressured low numbers districts. Ok Cucker Tarlson.. sure downvoted. Worked state county government. Whilst programs great, LOT waste, inability accurately keep data, plan programs based outcomes, analyze data accurately. much really looking? imagine plenty ended (or didn’t even make begin with) wouldn't. nitwit pushing propaganda agenda post appears vaccines. encourage read helpful resources COVID-19 vaccines:
  
[Vaccine FAQ Part FAQ Part appointment bot, action performed automatically. Please [contact moderators subreddit](/message/compose/?to=/r/Coronavirus) questions concerns.* take alergy meds?? I've got Johnson Johnson, decided despite lack data followup mRNA vaccine, I'm going get second dose Pfizer next week. wish J&amp;J would taken initiative commissioned study safety this, didnt potential make money. best avoid products moving forward negligence crisis. already disliked immensely talc powder scandal. population roughly 20% USA's. current 7-day average 10, dipped low 6 Delta became issue.

So equivalent 50 30 USA respectively. We’ve already multiple waves covid way less damaging Spanish flu Yes correct. Spanish flu second wave way lethal. That’s true. normal feel scared. list pros cons.

Then decide. Yeah, I'm mobile. Hard connect links.   Long haul Covid children real… love children everyone’s children enough care… Unamerican unpatriotic people don’t care long term health children due negligence flat earthers one I’m banging mom    Great see excellent ground work former president Trump put left office starting pay off.  Take heart. majority people don’t anything worse sore arm perhaps little tiredness. sore arm lasted 24 hours. 

Even feel sick, probably last less day almost certainly less 2. 

Overall, side effects vaccine big fat nothingburger. Covid what’s dangerous likely eventually catch don’t get vaccinated.  evolve spread easier order survive, usually expense lethality. Covid novel all, follows basic rules respiratory virus. Eventually settle becoming common coronavirus like H-Cov, etc. disagreeing. 

Can explain not? inhaler used asthma actually recommended mild covid treatment. Ignorance detected thr contrary Oxford want replicate Sputnik now. Pfizer supply reliable increasing? long decreasing 2nd dose available everyone got 1st dose.  Directly linked - doesn’t include deaths could prevented preventable care example. (It was, again, Capitalism) Cuzzzzzzzzzzzzzzz we’re stupid!!! don’t evidence yet variant worse outcomes kids variants. 

I know everybody wants right kids numbers don’t lie: covid particularly dangerous children. total, 322 kids (17 younger) died covid US. That’s 74 million kids. odds kid dying covid extremely small. It’s comparable odds dying pneumonia influenza, two diseases probably never lost sleep before. Yes course poor health outcomes besides death covid true pneumonia flu, again, probably never lost sleep those. 

Humans bad analyzing risk. Covid literally tens thousands times dangerous old kids. take deep breath recognize covid isn’t serious threat children. No, time 45+ allowed vaccines, theyre mid thirties Im sure religion huge factor, there's lot countries religious getting vaccines others refusing it. think US's problem culture, dog eat dog country. country stepping opponents toes get leg competition unfortunately bread apathy. feel like lack empathy general, people gotten point longer give fuck people dying. USA ""free society"" hyper focused individual, whereas countries form social responsibility ingrained politics culture. That's thoughts anyways.    post appears vaccines. encourage read helpful resources COVID-19 vaccines:
  
[Vaccine FAQ Part FAQ Part appointment bot, action performed automatically. Please [contact moderators subreddit](/message/compose/?to=/r/Coronavirus) questions concerns.* mean center corrected stupid policy. still done states supply ensured centre, been. They'll thinking statistical likelihoods. chances happening low. know lot young people get flu shot either. anti-vax read Facebook posts. feel vulnerable effects viruses. really hope find two brain cells rub together. live Texas opened everything March, long anyone else. great challenges getting Texans adhere mask segregation mandates. 

Oddly, numbers started plummeting right removal mask mandates - long many received injections. 

It initially seemed anomalous many us seems like could one-off. intellectually challenging part Texas pretty large sample size. 

Are states opened early experienced similar results? Colleges requiring students good bump demographic lacks incentive yet loves about… there’s guy worse. country stuff happening that's beyond conspiracy theories, like Argentinian cocaine story (the President's security service using presidential jet smuggle cocaine Argentina Russia) FSB replacing Olympic athletes' urine samples holes wall drilled specifically purpose. point, can't certain shipped 60 thousand doses smuggled Moderna San Marino. Western country, would rightfully called conspiracy nut. 

I still got vaccinated though. giving us anything except Sputnik, bother whether works not?  That’s dangerous playing fire.  

Let’s hope good % number recovered covid that’s root hesitation. --- vaccinated worry un-vaccinated? would someone else's health affect boosted immune system?

Because want die, absolute imbecile? Yet restrictions extended month. Lol. 

What’s point vaccines we’re going open up? Wow. That's good. Fully vaxxed. 18-29 y.o. people? reading 18-29 y.o. vax rate MO low 38% nationwide.If one person gathering, going get seems. And, now, course can't tell vaxxed isn't.  Hope quickly recovers emerges better ever. expected bridge difference lower Pfizer deliveries make Q3 yeah seems able July deliver LOT expect fullfill Q3 commitments long wait ingredients vaccine degrade within couple days?  Ohio twice week now. China   group worked closely together group 5 6, except vaxed one came COVID. understood point, I'm completely take butt pounding downvotes support you. We've spent decades dividing ourselves. reds definitely worst offenders bring stupidity, blues love love love dividing well. Lets pretend sort anomaly, everyone put blood sweat tears make sure country divided possible every single front. 45-60% in-law’s church covid (they got acting like full morons) smarter people like in-laws (probably 25-30%) stayed away vaccinated returned.  wouldn’t surprised congregations, even low vaccination rates experiencing higher levels herd immunity people think. Family caregivers allowed take care relatives care homes. Institutions can't trusted take care vulnerable people cause they're revolving door people coming going. may good-intentioned, know people care see short time. Others overworked pay attention care. actively malicious bad-intentioned. 

It's like residential schools. government kidnapped children parents, threw bunch strangers without parents allowed see them, mistreatment resulted.

Then there's people get medical tests procedures done. list probably go on. What’s difference heard immunity sort-of heard immunity. 

Has study show heard immunity possible mRNA vaccines? (Serious question cuz I’ve seeking data bit) whether Christianity true contingent American adherents year 2021 morons vaccination England sends people, sending best... happened work except opposite. Almost us vaccinated except 1 stupid guy gives vague reasons wanting it. unsafe whole thing somehow avoided COVID rest us got sick. BUT, weeks ago, vaccines widely available whole time, got sick. small office hour symptomatic. tested positive next day. Nobody got sick except one unvaccinated employee. Many us office actually symptomatic sore throat, coughing etc ""allergies"" lol. Cases dropped 35% last 3 weeks, death drops accordingly would 200 average daily deaths 3 weeks now. bet go 100, quite margin still. Personally also think quite likely average go 100 2021. Even churches northeast tend pro-science elsewhere country. church attend NJ physically reopen (basically fully online-only) August, extreme restrictions, drop mask mandate last week, month state government did.

Correlation imply causation, yadda yadda yadda, mean correlations use. Thank you. Eric Ding professional fearmonger king cherry-picking data arrive scariest conclusions. disputing statement, fail understand anyone think feeling mildly sick 1-2 days shot (which given, seen people got sick one none) going better actual sickness. someone gets sick, there's good chance force work days weeks could drown medical bills! Even asymptomatic, anyone finds realizes sick could fired forced get sick leave...

I fail understand logic people. Okay, let’s aim zero every country.

Nobody anything 3 years. social contact, travel, nothing. What’s fucking point?

I get friends think acceptable. Vaccines turn COVID cold, literally whole point. people still die? Yes. People die rhinovirus colds too, know. Can’t protect everyone, frankly, I’ve stopped caring protecting others’ grandmas. They’re part life, capacity caring life zero. mine vaccines, they’re safe. large portions population American states chance vaccinating lot, exactly considered healthy?  Millennials get dam vaccine! Inject veins! Now! People simply refuse live mental state allows sliding scale risk. People lose sh*t attempt fit mental frame mind binary situation. Either COVID history, we're doomed. interesting also recommends vaccinating children 18  Posting Reddit celebrating? Taiwanese really appreciated gesture goodwill. say I’m actually somewhat embarrassed. looked numbers Lithuania actually many covid case Taiwan 1/9 population 1/3 fully vaccinated. metrics every right worried first , make gesture even meaningful , , Thank Lithuanian. hope one day turn repay kindness expressed opinion myself, mainly done enough reading past news stories back. whole thing seemed absolutely beyond crazy first glance I'm surprised he's news time/other countries around planet intervened.  submission automatically removed linked source may reliable may dedicated mostly political coverage. possible, please re-submit link reliable non-political source, reliable news organization recognized institution.

Thank helping us keep information /r/Coronavirus reliable!


*I bot, action performed automatically. Please [contact moderators subreddit](/message/compose/?to=/r/Coronavirus) questions concerns.* Wharves expected date USA reach 70%? even possible? happens reached? Could mean USA Turns variant factory? don’t yell rafters exist beyond me.  Ive put hands plenty people last 2 months word mouth.  instant, accurate (if someone contagious faze), cheap. analysis • Pfizer-BioNTech vaccine 96% effective hospitalisation 2 • Oxford-AstraZeneca vaccine 92% effective hospitalisation 2 comparable vaccine effectiveness hospitalisation Alpha work remains underway establish level protection mortality Delta variant. However, variants, expected analysis included 14,019 cases Delta variant – 166 hospitalised – 12 April 4 June, looking emergency hospital admissions England.  What's attitude? I'm saying cases increase south. I'm saying article deceitful saying already started. messaging 8 days [**2021-06-30 12:46:14 UTC**](http://www.wolframalpha.com/input/?i=2021-06-30%2012:46:14%20UTC%20To%20Local%20Time) remind [**this send PM also reminded reduce spam.

^(Parent commenter ) [^(delete message hide hospitals already diverting patients 40% nursing staff vaccinated. There’s major urban rural divide current case spread state appears level areas without hospitals seeing high increases. next 2 weeks I’ll bet graph across state. cities low vaccination rates too.

I'll take bet.  Testing years normally do, stakes raised thousands dying everyday. Also, data vaccines looks really great, ""present narrative"" encourage uptake?

Also, think reasonable people want understand vaccines better, I'm honest think desire learn going here. Everyone know get vaccinated want nothing it, aggressively so. waiting data, get vaccine 10 years data still looks great. problem something else. Remindme! 8 days  I'm sure that- currently, cases UK [increasing steady case increase last week steady 31-33% last days, enough signs slowing yet. test positive irony too? Biden authority shut anything borders. Everything else state’s responsibility! could also include medically unable receive vaccine. folks could considered protected. Paying impoverished single moms carry extra-judicial hits suspected criminals way fight drugs, utter madness. assuming going continue stay rte rather fall even more. deaths caught covid back like march april random twitter user, appears cat, calling AZ thrown away, even donated another countries high COVID case loads.

FTFY

I could easily say:
Americans think world flat! [insert link American flat earther here] Cases falling quickly Germany think vaccines might outcompete Delta resurgence, cases halved last week instance. clearly talking cases said was, ""Every state south, outside Arkansas, flat showing decrease.""? That's obviously clear cases hospitalizations decreased. got caught reaching.

The article implied states south showing rebound cases/hospitalizations. true irresponsible reporting. got sudden urge buy Xbox series x Microsoft 365. see cases flat. see 7 day rolling average moving low 400s low 600s month. That's exponential growth starts. Slowly. suddenly isn't. 

Now, maybe Missouri enough vaccinations + ""natural"" immunity avoid rapid increase cases, people would predicted UK going see rapid case increase either.   go bragging. yet. Absolutely fact Pfizer given younger younger pop vs AZ older pop matter? I’m forties younger dad worked different parts Asia visited whenever possible vaccine passport present immigration. Depending flying from/to get different vaccines. knew vaccination isn’t foolproof careful. Surprised see people vaccinations days… biggest worry it'll mutate something harmful kids. basically miracle affect infants badly. good sense affect children worse likely sort mutation might be.  


And yeah, Texas super pissed Abbott neutered use masks schools (schools allowed require it, course families resistant covid prevention, vaccines, etc going use them). Regardless relative risks kids unnecessary butt-head move. Reasonable. Figure too: collectively exposed virus, less “novel.” So, past infection vaccination good. Minor infection (think young people) good society well. Yes, way, doubling every 10-11 days. Think due scotland lowest infections per pop home countries. Hi. clarify - “need doses effective variants” doses confer highest protection sars-cov-2 virus, including variants. One dose confers protection. doses confers more. Cuba rocks inactivated easy update, no? need change virus seed need cultured..
 
viral vector works quite way mRNA send genetic code spike protein cells create spike protein.. similar difficulty..
 
there reason firsts covid vaccines developed viral vector, mRNA, inactivated.. post appears vaccines. encourage read helpful resources COVID-19 vaccines:
  
[Vaccine FAQ Part FAQ Part appointment bot, action performed automatically. Please [contact moderators subreddit](/message/compose/?to=/r/Coronavirus) questions concerns.* small difference Duterte actually cares virus. fields, differences small believe structure Brazil Philippines completely different.  reporting daily data. Weekly data still reported seven day average. biggest disappointment Covid similar - respond immediate, much impactful (in terms visible, personal impact) problem there's chance ever properly take climate change. hope climate enough tech innovations occur people accidentally contribute solution buy new shiny things. However repeat vaccination won’t using 2 dose Sputnik vaccine. 

Instead 1 shot Sputnik light vaccine, another vaccine Russia using.  meant weeks ago regards Delta variant. should’ve spaced questions. Unless enough people vaccinated negate antivaxx effect. seeing covid19 becoming disease requires us health care industry manage it, society goes business. Yes absolutely right. already underlying conditions. health minister kept reminding us fact.

