,date,text
0,2021-08-07," Chode-Vid never delta/lambda/whatever strain. suggesting wear masks forever? Cobain agrees Yep. something. See get antibody test. Right? It’s like dick anything, he’s like “yeah we’re trying get sick one will” people acted like entitled go around breathing band. entirely fair comparison, non-hispanic white Americans part covid-denial political party also one likely vaxxed groups. Lumping covid deniers dilutes data. true, flip side also true. Many low income communities don’t work, wouldn’t issue. we’re talking elephants room, notice many working age adults communities magically weekdays BLM protest last summer. I’d love see vax rates protesters. isn’t black versus right democrat vs Republican issue. It’s education level issue. don’t classify Republican, I’m Deep South probably 95% people know interact personally work are. can’t count unvaccinated people know personally single hand, circle mostly affluent, college educated, professional types. Almost Republicans. 

We need stop making fucking excuses communities won’t get damn shots. Easy free access universal. Enough enough. Darwin eventually take over. Yeah, is. Missouri counts. That's true, would like links? “Third wave” first one end? dont quote this, it, survived, prob doesnt need first get vax (however still get it) afraid! afraid! Go house lock door never leave! Never go local gym! shake anyone's hand! even look anyone! make sure wear mask shower! realize can’t film ICU ER there’s nationwide conspiracy among doctors nurses make things sound worse are. many nurse friends working different hospitals including ER travel nurse stories different numerous ones online. sudden drastic increase covid cases coming hospitalizations. someone give name, done different state? Could get trouble? St. Louis south. submission automatically removed linked source may reliable may dedicated mostly political coverage. possible, please re-submit link reliable non-political source, reliable news organization recognized institution.

Thank helping us keep information /r/Coronavirus reliable!


*I bot, action performed automatically. Please [contact moderators subreddit](/message/compose/?to=/r/Coronavirus) questions concerns.* Religion Exactly. notion marginalized communities “unable” get vaccine getting ridiculous. 

I read something day claimed clinic/pharmacy hood $65 shot one wealthier part town free, like first assumption haven’t really done digging it. 

But everywhere go, travel bit work, vaccines free snd available without appointment. 

I think misinformation campaign real cause facts remain poor people tend uneducated, thus leading getting vaccine. show cards. think non issue.  actually huge issue taxis town weren’t carrying insurance someone badly injured lobbied retaliation get Uber/Lyft finally allowed taxis dangerous. Classic St. Louis. awwwwww mean 'thoughts prayers' little 'god' didnt shit keep safe? 

&amp;#x200B;

mind blown. lol choice send kids…and teachers.

I’m concerned kids can’t vaccinated. teachers least choice decent level protection vaccine.  prob :) carpet world people  family member federal worker someone knowingly came work sick weeks ago started outbreak. told rumor worker could fired existing COVID policy seems like might actually try push back. LA doctors lick balls I...I appreciate youths found platform fun on. 

Not bag, good them. judgement. Yes, give liberty safety deserve neither. owe people nothing. views extremely entitled. Yeah, figure 4 also spells pretty clearly aggregate. say assuming original comment conservative white Americans vs overall black Americans, neither sources address that. I'm lazy look. test viral protein viral RNA. mean viable virus time test, point.

That nuance important.

An antibody test look Spike antibodies Neucleocapsid antibodies, both. three vaccines US induce Spike antibodies, Neucleocapsid antibodies, exposed virus point. submission linking businessinsider.com automatically removed source may reliable may dedicated mostly political coverage. possible, please re-submit link reliable non-political source, reliable news organization recognized institution.

Thank helping us keep information /r/Coronavirus reliable!


*I bot, action performed automatically. Please [contact moderators subreddit](/message/compose/?to=/r/Coronavirus) questions concerns.* I'm sure probably underreported populations since vaxxed people might asymptomatic mistake something else due mildness antivaxxers known comply public health measures. 

I currently sibling breakthrough case, thankfully mild. Yep. part many people forget about: even vaccine means you’re unlikely need care due covid, still face usual risks living world we’ve always faced… vaccine uptake Romania small? Thank  actually believe right decline vaccine EUA.

Every legal expert I've seen subject thus far said think refusal would supported courts company government mandates vaccination service.

What right CURRENTLY varies state federal government anything force it. believe government tied funding vaccine mandates, states would fall line.

Except Texas, Texas run window lickers.  Russia going totally collapse **cease exist?** Germany Scorpio Gemini variants gonna rough. Looking figures 3 4 appear opposite GP. Black Americans appear significantly vaccinated states vs demographics. makes sense religion based ostracizing people almost-random would good pivoting ways, too. society care productive, funds subsidize addicts. numbers back # deaths higher. say less likely vaccinated. I’m guessing lot deaths pre-vaccination-widely-available

I remember reading article stating political leaning biggest predictor whether vaccinated not. race, education socioeconomic status. Can’t find though.  We'll never get Lambda 3. Gabe Newell's laziness saved us I’m still naming variant politician encourages people wear masks.

Trump variant, DeSantis variant, MGB variant, etc. etc.  difference is, people scenario chose take job. free quit anytime free take job smoke, take job chose vaccinate

I fully support private business's right require masks every person choice whether go there

But mask mandate takes choice it. requires people something will. never get board something like that

I also add sucks people taking virus seriously hopefully people Florida realize dangerous Covid be. Dragon Con cap although they're saying is. They're expecting 50% 2019's numbers around 40,000 people. Galaxycon Raleigh last week MegaCon Orlando next weekend. question great one answer complicated. Typically cancer survivors good blood counts considered immunocompromised. stays complicated there. Blood cancer survivors, like lymphoma, worse outcomes disease. studies still trying find why. consider less high risk getting high risk dying it. add lung issues. lung fibrosis bleomycin lymphoma treatments. doctors said could put higher risk getting higher risk dying, emphasis could. finally comes vaccination issue. People blood cancers less chance producing antibodies vaccination general population. right it’s also looking like we’re retaining long. I’m study exact topic. expect members study invited booster study nothing promised. I’m antibody t-cell portions study. 

At time, don’t seek boosters general guidance I’ve seen far offered, we’re going wanting get them. living we’re healthy people vaccine instead double/n95 masking household members behaving aren’t vaccinated me, husband never dropped mask protect me. Also, dad known exposure positive person, likely meets new guidance receiving convalescent plasma treatments even positive test. It’s treatment shown work especially improve outcomes blood cancer survivors make sure everyone care team knows this. I’m 16 year lymphoma survivor NCCS advocate I’m medical professional. attend programs put doctors help encourage people talk doctors also know doctors behind times since focused protecting active treatment.  Perfect time folks scoop federal jobs lol  Wealthy people tend large, diverse social networks travel around LOT, coming contact kinds people include friends employees personal service workers. leaves enormous potential spread long incubation period COVID.

Much different blue collar worker puttering back forth home job factory.

Early last year lot headlines skiiers Italian resorts initially spreading virus country, describing gregarious behavior traveling hotspot hotspot. That's one example. kinds people pensioners office workers holiday Manchester. consider rational smart people already got think that's fairly reasonable? 

Maybe guess  Wish US  Look Figure 3 link shows % vaccinated race per state. surrounding areas trump loving antivax antimask freaks lol. Yeehaw reasonable people realize become endemic. California online system verify really got it. fake card online version it’s provided state. verifying everyone. card make sure matches online. easy pull Less white conservatives long shot.

This false. might true early pandemic, data month ago, [Blacks ahead last month, blacks hispanics outpacing whites terms % vaccinated per day. racial gap disappearing least bit surprised whites last racial category (with conservative whites even lower) get full approval CDC wave mandates businesses, etc. Right move. Still would need bunch corrupt vax technicians makes much much difficult forge piece paper. system 100% secure, it’s major improvement compared paper cards. afraid doesn’t mean shouldn’t take seriously. could still get covid one wants sick. point live life take reasonable precautions can. I'm also Brevard county, though work hospital, teach health sciences college though. Thanks hard work.

 several past grads friends colleagues work various hospitals facilities county nuts. can't stand many folks around still acting like pandemic happening/serious. 

I hate governor. Like, unaware vaccines already required healthcare workers? Like flu hep b mmr varicella? (With exemptions solid reasons course).

 hate clueless folks try act like know wtf actually going on. Ugh ties rigorous studies put protection infection 60 - 80% completely wrong No. addressing travel started dystopian fantasy you’re fighting system selling diapers someone doesn’t imaginary ID card, that’s gets roll it. rule Diaper Games.  mentioning github, read pretty obvious actually trying make accurate.

""This map combines health capacity data Harvard Global Health Institute ventilator supply estimates 2010 study."" 2010 study? seriously?? issue AIDS crisis severely overblown. never going get strong foothold outside gay drug addict populations. warned Freedom press/freedom speech.

One could argue falls ""yelling fire movie theater"" rule, naturally government needs tread CAREFULLY around speech press.

I really wish could force ""news"" organizations like Fox MSNBC rebrand half time news, opinion. HIPAA paranoia someone might seen without consent news getting medical care fault lot this. one's willing put job line bring personal cameras ICU show situation they're dealing with. wonder people skeptical. look Figure 3 10-20% difference vax % black vs white states. 

In large US city, massive efforts get A-A community vaxxed (including offering at-home vaccinations) seems falling deaf ears. knew guy friend. sad Full transcript here: Question haven’t seen answered anywhere maybe someone point right direction answer exists.

I take medication slightly suppresses immune system. got second shot moderna sick two days fever, chills, aches, etc. mean vaccine worked me? Also he’s got funny way trying hide fat body wearing big, boxy, ill-fitting suits. Google Image search him. kids can’t get can, can’t get can, won’t can, won’t die! &lt;———You  people around might vaccinated.

Masks vaccines go together concord. One prevents spread prevents infection.  makes people feel like it’s “post apocalypse” even it’s literally that’s depressing. wonder DeSantis’ t-shirt sales doing? We're going run constellations. My, state value lives profits, offer Smart Health Cards QR codes name DOB, vaccination date(s), cryptographic signature states heath agency generate anyone verify. It’s not, live estado policial fascista  got unintentionally appointments mom signed turned one, aware time. definitely happy I've fine far. side effects awful night getting least glad need second shot, I'll definitely take MRNA booster shot recommended. point start becoming fault?That line reasoning infantilizing best, directly implies needs sort ‘savior’ get people right thing. 

As availability, CVS Walgreens parts, appointments wide open. recently booked appointments family friends low income demographics, low income areas (household median &lt; $30k/year) literally shortage easily reachable clinics. It’s easy far cry shortages experienced months ago argument would valid. There’s also $100 recently instated bonus getting shot fantastic incentives low income individuals. “The fear misinterpreted numbers cause vaccination rates go down” says Seattle Times put misinterpreted statistic goddamn headline.

As vaccination rates go up, cases breakthrough. isn’t news anyone three functioning brain cells. least tried spread word, guess. I'm starting feel sorry anti-vaxxors - really stupidity point lack education majority cases ultimately ignorance could kill them. know nothing person died particular certainly case majority people remaining vaccinated. lied manipulated. Multiple doctors office really encouraged it. office also works closely university known medical programs. think trust makes sense, faith vaccines work.  wish completely wrong reopening read anything would give hope unvaccinated. need vaccinations, including kids.

The school friend works seems going motions. think interested getting funding. classes size before. kids, heard, free mingle classes. know last year segregation proposed help isolate outbreaks apparently happening. Bad bot.    come straight school daycare side visit friends Canada.  Awards best pizza? Eh. disagree. hear, people getting paid like crap treated like crap want return, especially deal vile anti-maskers. Else pretty much everyone else I've talked want get back work, want level work-life balance. They've working whole bunch home used to, seem burnt out. 

I'm boat, like face time team, current state affairs 30% population sabotaging recovery causing surges every months. Safety First. I'd rather team focus work, worry getting vaccine ineligible / immunocompromised family members infected.  Kids arent unvaccinated choice tho &lt;rubs hands together licks there's least one major manufacturer using serum kids adults, make huge difference.   ""Get 6 month covid booster fall flu vax local pharmacy Walmart!'""

Unless mutates complete vaccine disregard. Then... Well fuck.  I'm 38/m north Texas currently quarantine home delta variant breakthrough infection. vaccinated May/June moderna. still wore masks anytime public seem help, still got infected people want vaccinate thus breed new mutations.. bloody hell.. think we'll ever get   false assumption held incorrectly many people “Trump voters ones getting vaxxed”.. fact highest percentage non vaccinated populations compared total populations Black Hispanic groups. White Asian race groups rates expected. maximum gap doses 12 weeks? Perhaps title changed ""People 65, got single dose March restart regimen Monday""? true 50 crowd fear dismissing danger younger people contributed stupidity we're seeing anit-vaxx crowd. Everyone get vaccinated needs get vaccine. Even 1% younger people get sick die way know 99% 1%. Imagine game Russian roulette 1/6 chance death, 4/6 chance flesh wound, fun times Breakthrough leading hospitalization around 1 25,000 certainly rare enough use word, go off. return normalcy hospitals able elective surgery pretty big win. Florida winning exactly? feel sorry mods thread; fingers get blisters deleting celebrations.

The sad thing like 30-40% _entire world's population_ anti-vaxx. easily fixable problem.  Los Angeles we're known restrictions, clubs open far know. hear loud music buildings going home work. city thinking requiring proof vaccination things like restaurants clubs nothing's final. Private businesses require want know many would bother unless to. thing mask mandate. Yea free legally required stuff save popular opinion.  many ended hospital (That vacinated)?  Ron DeSantis knows better, he's soulless political creep actively planning letting people suffer die droves order get ahead politically. sees totally counter-intuitive, is. needs politically destroyed made example order get people wake take virus seriously.     submission automatically removed linked source may reliable may dedicated mostly political coverage. possible, please re-submit link reliable non-political source, reliable news organization recognized institution.

Thank helping us keep information /r/Coronavirus reliable!


*I bot, action performed automatically. Please [contact moderators subreddit](/message/compose/?to=/r/Coronavirus) questions concerns.* much longer, larger reliable source different results. May new variants Kentucky study way limited.  Oh nurse say fuck ever want get tiered bs   Natural selection work. You’ve made ur personality vaccinated haven’t ""Farrel’s partner, Kit Farley, wrote Facebook, “He known Rush Limbaugh. heavy heart, say unexpected.""

If way minimise risk. Blue nobody breath properly anymore?  don’t remorseful. protect everyone.  strange want doctor care evidence.  Dick Farwell mean, Dick Farrel.   Like driving drunk property Nah wouldn’t. guilt would eat inside eventually. Every new voc shows vaccine resistance lab. Lambda delta beta. 

Delta far away contagious others voc matters anymore. One may certainly come along anyone's radar yet. Great! hate get delta variant legs get cramped ventilator. much extra it? Dick Real Bit they'll zero tourism. 30,000 new cases day pretty bad business. welll fuuuuuck him. privatized industry corpos goddamn power.  
Seriously, go ahead take power away corporations.  Way completely avoid post, reality. Scientific studies significantly better regarding comprehension novel virus talking primary care physician. 

Some great studies, well current research available topic presented thread. valuable. means, go whatever last 24 hour direct care center tells you. Aww, bad sad bye bye. state government failing citizens. Ah yes ol doctor think like find one does.  unvaccinated coworkers it. It'll called teambuilding exercise. Supposed like lol create whole new platform excelsior pass works well?  Depends complexion. They’re kind willing bear suffering alone. debatable bodily autonomy directly negatively impact around you, point legitimately killing them.

Vaccine mandates used US great affect, there's reason except fact particular vaccine becomed politicized nonsense, anti-vaxx apparently hip trendy thing doing.  Alright, guess we'll postpone trip Disneyland Zeta passed alphabet letters virus mutate into. deaths worry about, long term complications getting covid. Whether long covid damage done severe case, deaths outcome recovery. I've sick 19months one first get covid (before knew covid was). can't even begin explain hell I've healthy, 40yr old (now former) endurance athlete. think vaccination goals met, could perhaps focus attention fact CCP intentionally released virus, rest world gangs kicks CCP ass? Maybe Chinese people decent government?  Got mine local urgent care. regular clinic. wasn’t trying hide getting vaccinated, one knows whether you’re vaccine, stubbed toe, x-rays. 
Seems like good set up. sources information? course morons it. anyone vaccinated basically saying want 100% freedom along 0% responsibility massive piece shit. Florida....Killing locals since...well....Florida  find actually pretty sad. Yes, responsible actions spread propaganda, sad took effectively dying change mind. suppose still feel sorry people like final moments, like afraid shocked they're going die, entire world come crashing around them. like one religious SoCal Twitter guy went viral later died COVID. I'm sure questioning faith asking ""Why me?"" intubated. Judging final tweets, probably shook put under, unsure he'll ever wake up. sad dying preventable.  Refused vaccine, refuse virus. Check r/nursing, nurses beyond fed FDA approved yet? feel teachers starting school new cases high shoulder business thicc guarantee people blame teenagers forced wear masks. Would bet amount money this. others advised doctor get vaccine medical reasons? getting normal vaccines child ended reaction caused one entire legs become temporarily paralyzed several days, reaction medication (not vaccine) caused seizure. I've hesitant aggressive medications since I'd really like get vaccine I'm afraid. Yep. People Orange County great, part. would good know many children hospital previous wave. numbers still seem relatively low, maybe that's data compare with. damn community needs step up. 42% population fully vaccinated.

The nurses talk rightfully pissed heartbroken wave didn’t happen. still understaffed, appreciated paid.

There’s damn reason left, take care while. choice. Freedom that. 

Meanwhile others far deserving medical resources. 

So wife accept responsibility actions try avenues. Prayers Baby Jesus said effective. animal sacrifice. Hydrochloroquine good too, horse dewormer. Many options. you’re promised things return normal post vaccine need wear one around everywhere again. actually expect go bars clubs wearing one?  hope right regular vaccine updates combat it.  Fauci well known conservatives targeted him, media keeps bringing technically eye turning talking heads.

There talking heads, one looks ones much. Seems pretty normal except mask shops etc im totally fine that. Exactly. disease much much worse covid. massive meteor strike..that kind thing. stop validating nonsense asking explain  necessarily, still show symptoms even go get tested.

No, don't. Anyone go get tested time. Masks **not** punishment. 

Neither bathroom signs telling wash hands.

Neither seatbelt laws. 

Requiring restaurant refrigerators functional isn’t punishment either. That's really smart. thought that. kid def plan feeding cereals, mixing breast milk yogurt smashed banana would tasty bet. Neither things normal expected either though.  number studies show natural immunity effective long lasting. 

Link study shows real world benefit getting vaccinated top? latest research shows 1 dose good enough rather 2 doses. truth is, it’s overkill. yet post implies things common.

No ?... 

What said (bolded ""...that **some** people planning schedules around.""

""some"" defined as:.. ""an unspecified unknown number of"" Oh really? Thanks! no. 

They’ve done part past year want back what? exposed onslaught purposely unvaccinated COVID patients? overwork bunch hostile people zero appreciation? anyone experience rapid result tests coming back negative Delta, symptoms?

 Last Saturday, family car broke family get ride back home. husband called MIL agreed pick us up. antivaxx believe covid husband confirmed sick going anywhere. lied. Two days later husband called check coughing uncontrollably, difficulty breathing, food tastes weird, etc. words ""no fever, I'm sure I'm fine"". progressively gotten worse. daughter, husband, started showing symptoms Wednesday (husband vaccinated, daughter young) rapid test Friday. came back negative. symptoms varying three us. Daughter low fever headache better now, husband coughing, I'm coughing, headache, low fever, chest tightness, fatigue. quarantined case, really feel like result wrong. Curious other's experience been. MIL refuses get test done, can't rely her. sure I'd feel told tested positive Covid-DeSantis. I’m sad he’s retiring, I’m glad we’ve year. (Even weak mayor set up, it’s nice good communicator helm.) True, agree you. Well, option close borders response would huge.

Under current framework, would violate many citizenship rights, start developing means so.

Infectious variant appears? Boom, close borders. Three week forced quarantines military bases travelers returning homes.   Since 2 week schedule legal requirement? recently, company store level workweeks start Saturday end sunday. Employees got schedules next week Tuesday before. Hours kept 35 costs shifts would shortened instead extra days off. We'd rarely 2 consecutive days (grocery store) [Fucking China  mean don’t see it? see people saying vaccines “don’t prevent infections much”. agree vaccines perfect act like don’t prevent majority infections misinformation. know that, don’t get wrong, others definitely are.   I'm starting erasmus next month Finland. course, I'm fully vaccinated (got 2nd Pfizer shot 2 days ago). hope things normal enough enjoy experience!  “How let socialism take poor church?” - Floridian, probably. Oh jeez guess delta getting crazy we're take figures face value, vaccine currently 60% effective. Someone correct math I'm wrong. I'm thinking 100% effective, breakthrough cases would 0% cases. vaccine effect, breakthrough cases would 50% cases. 20% cases would translate 40% ineffective, thus 60% effectiveness.

The vaccines intital studies around 90% effective, correct? picture seems deteriorating. Speaking breakthrough cases, seventeen year old son found mother I've friends tested positive. entire family vaccinated. rest getting tested today. thought too. state leadership needs step first. Running slander job cheap political points… causing hundreds deaths months economic devastation.

