,date,text
As someone worked nights on-call, assure everyone hospitals really quiet pretty much every night, except perhaps ED/A&amp;E. others wanting live appears. United States don’t even wait. you’ve got star flag, let it. anything. voter, people may taking issue saying willing locked care others. Yes. outdoor concert venues. built heavy traffic large numbers. Japanese government requested immigrants quarantined two weeks. Brazil allow leave country? due Japan? think Japan criticized countries generated COVIDs countries allowed COVID-positive people leave country? Great, know can't expect anyone entire state responsible. Good idea imagine still believing bs made crazy ppl 1800 years ago developed world SHIT WANNA SEE, IVE SAYING LETS GOOOOO Lol..Mexico never denined Swine flu, neither hide evidences lied infectiousness virus China did. Also Mexico never deleted/burned/removed research investigations associated Virus...as China did. think world brainwashed ....I see brainwashed. brainwashed never see brainwashed. post appears vaccines, please see [our answers frequently asked questions regarding COVID-19 vaccines. comment containing misinformation removed user potentially banned.


*I bot, action performed automatically. Please [contact moderators subreddit](/message/compose/?to=/r/Coronavirus) questions concerns.* President David Panuelo acknowledged development ""alarming"" country's 100,000 inhabitants said case contained ""For reason, citizens across nation remain calm,"" said televised ""Do panic situation contained."" ever considered may linked research project Fort Detrick shut July 2019? weird report. 

""
However, in-hospital mortality intervention arm, 4 deaths placebo arm.
""

And ignore part, focus primary outcome. Meantime, four dead people 55/57 kind ignored. certain point people who'd potentially die dead.

That North Dakota's strategy. still many religious institutions direct community work (Sikhs, Muslim Jewish groups come mind). 

Those ones keep tax status sure! think means full event winter summer Olympics once. vaccine coming think 2022 normal Thanks source delete previous comment? Shouldn’t spread misinformation like without facts back up.   closed?? south stopped packed since April Transmission symptoms occur little 10 viral particulates (this evidenced CDC studies). Evidence suggests vaccines slow spread greatly reduce mortality. We're going endemic Sars2. True herd immunity pipe dream. r/ConfidentlyIncorrect call anything happening North Dakota ""intervention"" yes. people moving right around restrictions. Contact tracing/genetic analysis... Im pretty sure America given I'm trace 98% transmissions. businesses fined it. Lock psycho They’ve already trimmed OC plans way hopefully question doesnt get political response, but, feel like completely fair reject socialized healthcare country big America. wait times would astronomical. whether cheaper expensive, id rather private healthcare able get care want want wait long periods time see specific specialist dr want see. Ireland UK way worse are. How? Dying much cheaper medical care? make sense mutations using six distinct categories. first common type substitution. go, example, G somehow ends instead. Unlike RNA viruses, human coronaviruses come equipped corrective machinery normally fix substitutions. so-called proofreading mechanism SARS-CoV-2 thus far yielded rate error much lower RNA viruses like HIV influenza. virus lacks capacity variation, makes large number people infects—meaning variant catch on, spread like second type deletion. Deletions occur polymerase skips, leaving gap genetic code. nasty thing deletions virus cannot correct retroactively. Though likely disrupt function substitution, capable killing virus altogether, deletions, small large, still allow virus grow. mutations sort advantageous virus—and concern us—alter virus significant kinds deletions exist—in frame, frame. long deletions appear multiples three, remain frame, unobtrusive protein whole. However, deletions occur singly doubly—out frame—disrupt entire protein, unlike misplaced letter run-on sentence causes reader stop third type insertion, mutation observed occasionally amongst hundreds thousands genomic sequences stored GISAID, open-access sequence repository. Insertions describe extra bits genetic information, whether it’s one nucleotide entire segment, end given genome fourth type inversion, happens segment genome flipped head, reversing order polymerase stutters spits bit information again, duplicate created—hence fifth type, sixth final type recombination. Literally, parts two separate viruses become conjoined. two different viral genomes find cell, bits pieces shuffle one other, unwittingly settling new forms process. way SARS-CoV-2 produces proteins encourages recombination. Even region crucial protein could existing literature coronaviruses already tells us recombine, least bats. fact, process likely SARS-CoV-2 came born, possibly ant-eating mammals known pangolins. unpublished reports recombination among SARS-CoV-2 variants occurs. dense crowd, one person might infected simultaneously two different people, reinfected subgenomic remnants first infection still linger system. SARS-CoV-2 also infect animals live closely us, recombination events combining SARS-CoV-2 animal genes might also occur, changing virus unknown possibly dangerous high prevalence SARS-CoV-2 cold-causing viruses time, suspect events either already occurred inevitably ill. first glance, none mutations, taken isolation, would appear capable kickstarting new variant disease. Calculated conceived scale, however, swarming certainly startling impression begins substitution. average, viral genome 30,000 units long, substitution alters one unit every 10,000. can’t say sure many viruses teeming moment within one person infected Covid-19, know every milliliter contagious nasal fluid contains something like 10^8 (one hundred million) 10^9 (one billion) viral billion viruses, per one per 10,000 average, means three billion substitutions—and that’s one drop mucus. Multiply actual volume active virus single body, number active Covid-19 infections given populace, long you’ll find well quintillions. words, mutations give way viral variation happening time rates nearly inconceivable. lot events 100% outdoors. Everything I've seen said vaccine prevents sickness, necessarily transmission. 

That's primarily trials focused measuring effect vaccine people getting sick. completed studies impact transmission, medical experts erring side caution telling people assume reduction transmission.

However, would surprised vaccine impact transmission all. vaccine effective preventing illness, leaves people contagious would without vaccine would strange. honestly understand spousal transmission low. Spouses literally sleep bed exchange respiratory droplets (aka kissing) shit headline. Since Dec 13, North Dakota reported deaths Sundays. 7-day moving average deaths 6 right now, 300+ equivalent deaths CA. wonder kid Wyoming. Kids usually rebel know. Native tribes America barely get help care surprise all. said, much effort enacted reach rural isolated areas country, people often higher risk limited resources. I'm already abhorred disgusted American government treatment Native peoples large really shows done anything improve since pandemic began. need feel guilty, feel normal. listen downtrodden people subreddit makes sense, yeah given short notice. Kind dick move. Winter starts October ends mid April.

I remember sports.

We've also extremely mild winter far. one two weeks bad cold gotten snowfall town twice first time melted away, time stayed inch. Reddit moment  Maybe trade tax exampt status would Jesus kill tithes? South Dakota recorded 15 deaths today. population 880,000. 
 would equivalent 665 deaths California (the state news).

That's one day. representative: 

7-day moving average South Dakota 10 deaths day, equivalent 390 deaths day CA. CA's 7-day moving average 476. 

North Dakota's 7-day moving average 6, equivalent 308 deaths day CA.

So no, they're well. always bunch things instead single one.  post appears vaccines, please see [our answers frequently asked questions regarding COVID-19 vaccines. comment containing misinformation removed user potentially banned.


*I bot, action performed automatically. Please [contact moderators subreddit](/message/compose/?to=/r/Coronavirus) questions concerns.* Yeah could start anywhere didn’t lol swine flu didn’t fuck world two years In-n-Out Burger states. People line hours get it, even anti-vax idiots. think we're seeing right anyways virus less run course current amount potential hosts combined vaccination effort, beginning form better picture.

Yes assume well, vaccination + careless people infected + rest simply careful takes toll virus!

Congratulations Europe, dont let guard another while! People downvoting me, tell alternative please. Everyone know comes work knowingly sick paid sick days living paycheque paycheque is. joke fucking tired worse live lost people Covid. forgot add: entire congregation That's based model. Serological antibody testing North Dakota says otherwise. problem model uses factor serological surveys conducted early pandemic without taking anything like population density account. 

Mathematically, simply cannot 3x positivity rate would exceed population state. that's using peak positivity rate applying entire outbreak. decrease positivity rate increases number test subjects needed. Yeah 80% correct, 100%. Like another Redditor said, 2022 realistic. people vaccinated dad’s 80 heart problems still can’t get appointment. wait 3 years, make sure everything clear stick regular schedule afterwards?  get vaccine questions properly answered becomes readily accessible. lot questions confusion issue, one seems good credible sources information help make decision. mean know anything companies manufacturing it. know differences ones they're testing work. even know mRNA is. However, seeing people medical field hesitant concerning leaves alot confusion people like me. am. Read on, want know personal reasons stand.

 time, hesitant due unknowns others mentioned, addition simply decently afraid suffer GAD, anemia, CFS, seemingly become prone infections within body towards end 2020. (I total 3 different types past 5 months). None serious, alarming sudden increase despite leaving house working half time period. infections gone except one I'm currently dealing with. 

As fear, bit anxiety disorder relating issues less unknown. I'm afraid needles use clinical trial patient quite studies years ago. However, struggle take new medications recommended, even new higher dose, I'll inevitably fall anxiety attack causes get angina one long enough. concerning heart slight arrhythmia given long list family history many heart health issues especially immediate family, cannot afford take risk lightly. past September, ended nearly go urgent care heart would stop squeezing/spasming irregularly chest half hour. eventually return normal went anyways get checked (I'm uninsured), felt inclined take wait see approach. happened since day. 

 beginning past year, admit adamantly getting simply believed young, decent enough health, therefore need get it. downplay could get flu. simply looked numbers went statistics. get regular flu shots last 14 years. I'm opposed people getting Anti-Vax way, simply want know diving putting substance body given I've listed above. 

 yes, maybe even bit paranoia play believe media always honest general public. I'm never gonna change mind that. honest feelings without fear-mongering using pseudo-science ""prove point"". addition moderate distrust higher end pharmaceutical industry American government shady dealings, still have, even I'm taking time think accurate information available me. mom got sick (her covid test inconclusive) ending ER, made reconsider stance I'm looking information make better informed decision get vaccine time. sure best option they're accessible everyone. 


TLDR; confused, afraid, questions, health related issues. sure vaccine best even I'm good candidate despite health issues. grandpa driving van nursing home producing $10M economic output? No, that's rich people. restrictions, likely districts There's nothing statewide could've done unless something united *nationally*. Even California 40% Republicans. even Trump thing, though help. US short-sighted pro-business ways done kind extended national lockdown required actually stamp COVID. Also, Spanish Flu started close WWI. basically, 100 years ago, fought another world-war level pandemic. vaccinating then? People know? Thanks mate.

I'm big fan learning behavioural economics human decision making (driven personalities experiences) irrational, rational believed traditional economics.

Behaviour fascinating brains work way generally advantageous think way upon time.

So presented different opinion mine, try determine truth. care less right knowing truth.

My opinions ultimately drive children experiences, think important know true.

All said, one favourite articles, thank job IOC? IOC disappearing party's guest list issue? think liked get attention middle expensive party venues. announce cancellation Olympics, problems solved. Oof, that's discouraging. think it’s spelled boreder also like part assign lower value Italians. check math confirm. People still going work... could also backfire people want get vaccine doubt second dose available on-schedule. Epidemiological analysis put IFR less 0.7% official death count ~372k (and actual number likely [30-40% means absolute minimum 53M infections 16%.

I think Youyang Gu cautious refuses use excess deaths data. that's case, [91M infections estimate probably closer reality. point doesn’t work way. notice, positive correlation accross Canada cases CT values: Yup, imagine much reluctant people get vaccination lose confidence government's ability ensure timely access second dose.

I one sure hell getting vaccine feel confident second dose administered prescribed schedule. “Researchers found 76 per cent discharged one hospital Wuhan, city centre outbreak, still showed least one symptom associated disease six months later. 

Fatigue sleep difficulties, occurred 63 per cent 26 per cent patients respectively, common problems. 

To surprise researchers, third patients showed signs kidney malfunction, led problems increase bodily waste blood increased risk sexual dysfunction.
Read feel like already case 😅 one society, even best leaders world except centenerians still living experienced something like magnitude pandemic wise, even one experience call economy industries affected this. Similarly grandparents tell us stories war fought hid bombs, feel we, old frail tell kids' kids tales stay inside weeks end world fights virus tired hearing NYC did. think comparable.

Yeah I'm sure indeed sick hearing example blows whole argument up

In 1947, NYC started mass vaccination program overnight got 6 million people vaccinated 3 weeks.

Over 70 years later, NYC started vaccinating people multiple months notice. got 520k doses delivered city, three weeks vaccinated 200k.

What stops using least half doses today exactly? forgotten vaccinate people since mid-century, point vaccinate 10 times less people? can't provide reason, glib dismissal example find single one next two weeks, either. guarantee that.

I certainly hope not, states seem finally start addressing poor rollout, hopefully correct linked article says they’ll finish first doses Jan 25 I’ve never paid much attention Florida, seeing governor reacted virus I’ve decided 0 interest ever visiting state. fucking degenerate life worth $10M life insurance profitable? pay $1M pocket $9M? Thats weird wrong way look ok. need chill. I've never unplanned pregnancy. stereotypes make seen really insecure unhinged.  nobody pays though essentially free. people can't afford pay relative's death. Tier approach fine burden proof receiver. make announcement saying X date we’re receiving people healthcare, grocery stores, teachers, etc. would provide proof employment arrive register online something. ISE US EXAMPLE. Without getting details let sink in: governor mandated masks fist time NOVEMBER. 2020. Well, competent leadership would helped. Plus know n95s actually really block virus. maybe would..and Covid fatigue bad 6 months ago. 4 weeks Covid could levels Australia. serious contact tracing quarantining. Great points. kiss ass I'm gonna need build mod PITA EHR improve metrics believe Florida 25th per capita deaths. bad considering everything open. honest question, free ensuring people going get second dose right time?

I see many people advocating states start giving vaccines anyone wants speed things up, seems pretty clear needing two injections within time frame makes utterly unrealistic. boring friend? we're states. Small businesses going rapid rate government imposed lock downs, mostly state government mandating. big box stores running full capacity. Walmart, Target, home improvement stores open operating raking big bucks. Fast food chains thriving thru drive thru services, chains indoor dining spacing tables. Yet little grocer mom pop joints told shut doors. 

Someone said 1% that's fueling lock downs right. Name one big box store actually stood little guy. one spoken know why. problem. ones benefiting lock downs. competitors gone. 

Now need look politicians lobbyist big box stores. bet thry holding hands. Democrat run states worst far imposing lot unnecessary lock downs. Except half population would refuse wear :/ need medical staff right badly, making point worth risking people's lives ICUs become understaffed Well, huge surge reinfections far I've heard we're 10 months point, seems immunity definitely permanent, getting infected seems give immunity people. People fearmongering reinfection since beginning pandemic, still remains rare(especially considering claims reinfection likely cases someone never fully getting virus virus suddenly causing symptoms again) somebody looking forward vaccine, great. someone getting whatever reason, great. People reasons getting it, like people reasons getting it. valid. end. Wonder conspiracy theories rampant. Maybe politicians want crisis go satisfy thirst power? 


You would think vaccines would priority #1 Summer. article says, idk they're reading! I'm taking total number people positive entire period time. I'm looking single day. I'm taking cases tested positive midway August today multiplying 3x factor. maximum positive day 18.5% I'm applying entire time period.

If 18.5% tests positive everyday mid-August now, virtually everyone would infected Coronavirus Resource Center’s current approach calculating positivity throughout site Approach 4, following reasons:""  4 ""The number people test positive divided either **unique** people, encounters, tests""

So unique tests could people taking multiple tests factoring numbers. old deaths 🧐 I’m far Ontario thing happening neighborhood. Parties every weekend hear. data yet.

But assure Saturday way better last Saturday.

I realize talking first shots shots. Shut electricity gas. Seems simple enough.  Every year nation gets new flu vaccine. don’t know hard. Spread word, virus man really said Daytona 500 National super spreader event☠️ mRNA unstable begin although stabilized vaccines, point cells around days disintegrates. months certainly years - days. There's really nothing vaccines (and vaccines general) sticks around long-term, since definitely established vaccines *not* like therapeutic drugs taken regularly given period recovery, really understand general fear long-term side effects vaccines. started Christmas. tens thousands facilities. finished date article. 2 weeks now: Calgary Pastor says God lrt die vontracting COVID. 

10 days later: Calgary Pastor broke local COVID rules dies COVID. 

 heard hear first all. Happens like nearly every time. guy blurred legal definition cherry pie? want make profitable need go Western large cities already stadiums place demand brand spanking new everything.

A place like Chicago already everything place could host Olympics building new apartment complex probably desperately needed anyways.

But instead choose Rio builds bunch stuff plan use it.

Stay away authoritarian regimes willing dump truckloads money prestige IOC would better off. ran people kill? It’s shitshow cvs. Cvs always devil. many yesterday (Saturday)?  think fair count M-F ignore weekends.

Anyway, 700k still closer 500k 1M. Yes, know different person made claim. please stop bullshit conjecture of, ""unreported cases"", rampant, ""asymptomatics""? actual evidence supporting been, despite nonsense circulating months.  


People want true, keeps coming up. sarcastic, aware they're tied 4th deaths per capita? Actually important stuff usually rational people seek information for. really devolved much species need nanny state hold hands everything? mean, education understand grown people think going spoon fed encyclopedic knowledge palm hands. 

Physicians writing Facebook posts Twitter threads stuff forgot Google Gates forced make Edge default browser mind control powers. Yes, that's true. And, -20 F. gale force blizzard face so. Spread word. right. I'm calling lack political will. US person would assume deeply self-hating addicted drama. much thought autism related this. Infection vaccine cause it. 

My SIL advised get vaccine she’s due March. worries she’s doctor would assume knows 21 imported 48 domestic transmissions. Wishful thinking sort? mean, would nice *if* something we've already got shelf would help.

I think lot people familiar veterinary uses saw articles double-take -- know also drug humans that's attention-getter. Eh, I'll take government actually governing 1,000 deaths rather living country 380,000 died. (Assuming US) They’re ones dying I’m one kids school needs work every day. sit house indefinitely, regardless, aren’t getting either. health department freezer adequately protected right it’s ridiculous. WTF happened army standing ready distribute?!?

I mean believe him, questioned We’re to. Wait find 6 months ago government could sent 10 n95 masks every man woman child cost 15 billion. Instead trillions used prop economies. really wish could appreciate stupid sound everyone else. still mutating slowly. difference lot instances occuring lot hosts there. stopped coup? reason think North Dakota distributed 30,000 that’s nothing! can’t see harder distribute vaccine 40 million people 700,000? Yea percentage basis ND better whoop. point saying let’s hold back patting. ND much easier job CA TX FL NY pretty much every state fact. West Virginia awesome. would go 3 called get shot.  Leverage jury duty system send paper mailers. day call number learn report vaccine administration. someone explain anti parasitic would work Covid? oddly intriguing Well person replied lamented rich getting first, presumably talking period time people vaccine far. I'm pushing back saying: means less people spread disease. saying think necessarily true. Well register, might assume want vaccine. people want list, signing up, they're different list, government would know vaccinated omission. So, point worrying. can't tell government create registry people want vaccine. live ND attest. Almost every person I’ve come contact gotten it. Also, one cares COVID here. It’s actually insane. interesting demoralizing Thanks input, vaccine ultimately opt for? Sign *that* hand sanitizer woohoo! I'll bedding every hawt resident facility!! I'm sorry hear it! hope mom hangs gets shot soon. Like said, stage 4 stabilized. Communication college professors non-existent states. teaching F2F damn well deserve one. College campuses petri dish.  government's terribly inefficient someone's making money every turn.  Makes sense though. Kids going remote teachers in-person classes ones dont give rats ass vaccine covid general. 
So theyre wasting time teachers continue teach online get vaccine high risk individuals people 65-75, also highly susceptible virus wait 12 weeks(thats Cuomo’s words) get steady increase supply. 

However, bottleneck. Nurses doctors saying vaccine delaying deployment caught hospitals surplus know with.

The problem isnt vaccines. problem Cuomo’s plan, need finish group 1a jump group 1b couldve combined. 

30% vaccines administered slow so. healthcare workers/nursing staff/residents didnt want it. It’s clusterfuck. Work starve. people understand countries without safety nets choice? blame them? know wrong better know right. I've heard lot optimistic stuff virus day one, almost without exception, pessimistic case closer truth. comment originally replied mocking someone recalled study mentioning 25% cases leading degree permanent lung damage. think falls totally within realm possibility. going ignore fact medical professionals trust well least fucking ASK hesitant get it? mean come fuck people get finger blown whatever yee yee ass shit y’all do, people take care go ER. yet y’all fucking AUDACITY write possible ISSUE instead ASKING people MEDICALLY TRAINED don’t want get it? 
In conclusion, opinion actual vaccine idgaf get ffs bring back logic reason discussions instead writing people different opinion? Y’all fucking similar people condemn day long look mirror 

im done Take look [this summarizes financial report University Oxford Tokyo 2020's Olympic budget.

They've *already spent* $12.6~15.84 *billion* USD, projected spend much twice actually hold event. Talk [sunk one hand, sounds almost likely hosting event break bank, plan recoup losses (as much possible) ticket sales, sponsorship deals etc. think ever planned make *profit* games, host minimal loss.

