,date,text
I think distinction basically say peak COVID basically primary cause death, nothing done eventually everyone could expect die decade early. rather unrealistic assumption people develop immunity time, highlights severity disease peak. Initially, though costume dressing like old man, wasnt sure... concerns apparently, still get long covid despite vaccination. study israel 19% break-through infections health workers resulted symptoms persisted 6 weeks so. think masking definitely worth masking. wouldn’t send kids back didn’t least one safe guard. However agree podding wish terribly year like last year. makes sense even contagious variant last spring less protect kids staff.  back pain couple days pfizer jabs. Lumbar pain, mostly. literal pain ass.  Yeah, messed up. pandemic end damped global level. US exporting vaccines. yeah makes absolute sense infectious worse deadly. issue people infected faster winter? 30% population immune, health system collapse those?  already approval. work hospital mandate announced month ago. Reddit /r/Bugs seem eating replies you, second take vaccine caused munch hatred divide. like enough hatred divide planet already! media scaring poor folk point anxiety leaving house get food!


Maybe grasp basics: travel information systems, Internet social media, hate. saving lives cure. People throughout history always PRAISED cures disease, family get scientific medical treatment. 

You seem confusing fact **Infodemic** due Internet, Social Media, TV network media battles. suggest study Marshall McLuhan 1977 topic media violence hate due ""Loss identity"". Link media scaring poor folk point anxiety leaving house get food!

You realize scared hospitals death caused virus? seem understand science truth scares people. Like Cold War MAD.  baby turned 1 he’s grown seeing people masks outside home. Amazing learned friendly intonation smiling eyes means friendly person gets smile him. People want find reasons dispute masks, that’s is. evidence full vaccination required. One vaccination around 6 months infection provides strong protection, significantly stronger two vaccinations. guess minks could gotten minks escaped mink farms. 

I know often minks cats meet wild. Morgan Stanley CEO James Gorman said would “very disappointed” employees back office Labor Day, September “If want get paid New York rates, work New York. None ‘I’m Colorado, working New York getting paid like I’m sitting New York City,” Gorman said June. “Sorry, doesn’t work.”

Hope companies follow suit. people company taken piss like - vocal/boastful so. US shipping extra vaccine countries. Also, mean say third dose? Anecdotally, think people also avoid efficacious masks equate better protection discomfort wearing, although I've found N94s way comfortable cloth mask. hard convince others tried that's case. Defy governor. Go court. comment appearing Reddit? /r/Bugs problems? post appears vaccines. encourage read helpful resources COVID-19 vaccines:
  
[Vaccine FAQ Part FAQ Part appointment bot, action performed automatically. Please [contact moderators subreddit](/message/compose/?to=/r/Coronavirus) questions concerns.* India better look delta. Biggest spike around 2 months. Anytime lie misrepresent employer, federal otherwise, could face prosecution. Lying gamble. fail see lying Covid different. like way think. saw shit kids’ first day school would transform mama bear go maul all. use lot number trace back place disbursement. match name. really. take ages. Yes. don't. exactly suggesting ID check buying diapers? “them”, “the government”, hypotheticals… actual name actual person position enact actual proposal, speculating something things might happen. there’s something real, it’s paranoid delusions fantasies. 

And stop using poor people excuse bullshit. time people like care poor use leverage. vaccinating front line personnel priority everywhere. actually much beneficial massively increase one country's level immunity make barely dent level immunity worldwide. 

Hardly country even close that. Neither US UK. 

Even smaller European countries overtaken vaccination rates. Despite nations vaccine export stop.  And? vaccines here. I’d rather people use safe go hard, happening  lot self-fulfilling.  Take San Francisco, left- leaning city attracts lean left lean right may dislike it. means time, people move lean left, reinforces it’s identity.  Florida opposite end spectrum.  Texas (outside Austin). think better quit, let shit slip.  need see Well, hundreds miles along Florida - Mexico border.... feel pretty hopeless well, I'm Europe situation bad right now. However, maybe speak pediatrician? concerned us sending child back school, did. older family member mine developed sciatica Pfizer vaccine (they active weren’t sitting/lying lot vaccine). isolated back pain, might worth asking mom radiating symptoms. family member got better short course rx meds PT. NSW wrong. problem stupid individuals think put others risk. course children getting infected. They’re unvaccinated, far likely catch virus vaccinated individual. tragic child’s hospitalization death may be, miscellaneous cases Jacksonville don’t negate overwhelming statistical evidence shows children still low risk hospitalization death. True. Thought feel like obesity healthy crowd ton liberal fans could removed within two seconds posting incivility? Hmm? 


This bot proof. ""Don't covid? want covid? Great take ride taxi! mask ! vax! relax...as lower casket. "" probably went far could see morbid commercial head . submission automatically removed linked source may reliable may dedicated mostly political coverage. possible, please re-submit link reliable non-political source, reliable news organization recognized institution.

Thank helping us keep information /r/Coronavirus reliable!


*I bot, action performed automatically. Please [contact moderators subreddit](/message/compose/?to=/r/Coronavirus) questions concerns.* 
**This article originally published 3 months ago may contain date information.** 

The original publication date May 10th, 2021.
&amp;nbsp; 
&amp;nbsp; 

^(This bot finds outdated articles. impossible 100% accurate every site, differences time zones date formats may little off. Send message notice error would like bot added subreddit.)

[^(Send ^(|) [^(Github - ^(|) [^(Github - Chrome body aches including back Moderna, symptoms went away &lt;24 hrs showed up. dude wearing wig real hair?  Sorry bud we’re talking two different things. I’m talking scan passport buy groceries, shirts, pants shoes, tampons, diapers, formula. That’s crazy man. 
No way hell would turn away someone trying buy diapers forgot passport home. 
Obviously haven’t thought don’t care huge chunk population lives poor, rural inner city life. may come surprise lot people don’t access ability obtain IDs let alone ID passport you’ll need both. I’m staying bed someone covid it’s 5 days I’ve still tested postive. We’ve exactly still kissing not, possible might get it?  addition HereIGoAgain’s comment, people don’t always realize viruses use populations hosts readily replicate viral mutation evolution. large populations unvaccinated people become reservoirs nature, increasing chances new viral variants. Thus far, current vaccines still effective newest Delta variant, unvaccinated people still providing large body people new variants develop may evade current protections. unvaccinated people really danger even people current vaccinations - high vaccination levels best approach reducing risk. [Does Upvoted. every country partially vaccinated relaxed isolation rules utter disgrace. means pretty much every vaccinated person coming contact someone carrying covid regular basis.

I think point simply need continue mass producing vaccine fast possible get shots, including booster shots, people's arms quickly can. Look vaccine expiring southern states wait decide booster shots. There's way ship countries fast enough useful, doses could used protect elderly since already storage distribution infrastructure place. varies district. nephews niece start Wednesday. live Montgomery County, north Houston.

The Houston ISD starts 23rd. Meanwhile, seems school districts near Houston start various days next two weeks. Lynyrd Skynyrd High School ID. Bro stop ruining clicks them! points apply here. LA, insulation going fiber glass styrofoam fire code, sides blown out, cantilevered, CA regulations limit one time use.

Really thing applies fact put framing inside put interior walls shrink space. I'm sure homeless would rather something live rather sleeping park bench shelter. Dexter Holland (the guy Offspring) PhD molecular biology actively worked research curing HIV infection. Unless walls close him, Trump running 2024 wouldn’t surprised DeSantis pick VP  He's guy got sick.  Rona like chainsaw, it’ll skin ass raw. Covid-25, like Covid-19 slightly mature approach killing people. Also, craft IPAs Bud Light. book, Andromeda Strain causes rapid blood coagulation. Given COVID propensity cause blood disorders, far off... Donations happening Source countries adequately vaccinated. covax wants centralized distribution back December. Countries treated “equally” regardless receive enough innoculate intervals 20% population each. 

For example Canada would get enough vaccinate 20% intil doses “equitably” shared move next 20%. take ages. vast majority cases vaccinated people mild colds, need point stop counting cases. continues cases one getting hospitalized dying… what’s point? Florida basically going destroy Yeah but, where, except Oceania part Asia, serious attempt mitigation together vaccination?

We need help unvaccinated third world breed resistant variants, perfectly ready start gambling US EU bare minimum less \~60% vaccinated, best case. nookie Good family opening time personal space help people.

I'm Scotland, odd hearing strong anti-vax mentality am, news US long enough I'm surprised anymore, I'm curious - pay get vaccine US?

I'm trying figure anti-vax stuff exists level? Scotland asthma got two doses vaccine free, (elderly people, risk conditions high risk jobs also got free, list get free costs like £10 total). I'm also used getting yearly flu vaccine asthma local GP, again, free get medical care/medications etc free (or feels free, paid tax-payers). I'd curious Americans human approach hospitals doctors (i.e. go sick need support given basic human right, costs, stress, covered human) distrusting relationship? may naive, piece together curious sounded like part contributes problem? murky ""facts"" solid scientific data. BBC still news agency well known bias, can't rely scientific conclusions.

Germany, Israel boosters BioNtech vaccines. Pfizer moderna working boosters. Many countries testing mix-vax. use ""facts"" proof original vax work? don't.

Nobody claiming SinoVac perfect, probably 20% less effective BioNtech/Moderna. Indonesia's problem simply enough vaccine kind. Writing effective vaccine political reasons, cost lives. transcript two text messages COVID-19 situation Austin dire. Healthcare facilities open resources limited due surge needs wear mask &amp; stay home much possible. vaccinated, wait get one. Go vaccines.gov find shot. do. Along masking behavior. equated jabs total freedom, surprised. Beating beast requires layered approach, vigilance. School doesn’t start Texas, it? Unfortunately tested positive Cancer. Oh cancer cancer. COVID-Cancer Guess won’t know sure it’s tracked reported, otherwise it’s guessing based feelings.  No, no, no. Hunters? No. see shit firsthand, empathy that's sure.  school starts Tuesday state. scary parents choice send kids…and teachers. What's Israel, anyway? vaxxed well, they're struggling Delta spike, might need additional lockdown. Dozens vs millions. oBaMa 9/11 Austin proper think close 70% vaccinated Austin hospitals serve Austin, suburbs/rural areas conservative/antivaxx. 

Also noted before, governor prevented local governments issuing mask mandates, closing anything, giving money virtual school, so… Says person worshipping evil corrupt people *am* worried desperate, think reasonable feel way.

In county nobody wearing masks vaccination rate great. I'm really worried J&amp;J can't hold up. much believe. reported. Also young people far common, especially healthy ones. course was. would expect almost real punk band voice reason. least comes women groped crowd surfing. think masking definitely worth masking.

I get desire want something. everything I've read seen suggests common cloth masks, way use terribly effective *in long exposure settings*. They're great 15 minutes grocery store. great 8 hours office. However agree podding wish terribly year like last year.

The lack podding criminal book. That's effective control schools want they'd hire teachers. ridiculous. It’s almost like wearing mask social distancing works everyone stopped easy communist say since dont value lives people.  really concerning. could everything right avoid covid, get hurt require medical care hospitals aren’t able provide right due overflowed covid patients. Apparently weird base enlisted drive delivery trucks staff commissary BX Class VI stores NCOs staff technical projects infrastructure. contractors GS personnel. local people going involved.

Reality son officer who's never paid attention bases he's lived jobs. it’s requirement isn’t?   saying billions vaccines donated donated all? sarcasm provocation here, asking honestly. point people realize they're ignorant mob every episode Twilight Zone? felony. Forging official CDC document federal crime. sent Navajo body bags asked assistance. guess got message took vax everyone could. cross idiocracy contagion. vaccinated person - largely fine. unvaccinated person, almost guarantees get Covid didn’t past year half much spreads. some, it’s regular virus others it’s overwhelming hospitals parts country

That’s vaccination rates going you’re starting see vaccine mandates. Expect schools require approved children Yeah family Jehovah’s witnesses, usually don’t anything positive say religion, they’ve handled pandemic well. congregations Zoom services exclusively since last March. they’ll probably keep way next year. Everything changing evolving quickly, I've read amount children severe reactions covid small. yes there's (for now) definite small risk also something we're going live long haul. kids going wear masks 8 hours day 4-8 months. imagine trying get 3rd graders continue wear masks entire semester? real effect I'd it. stressed per classroom isolation outbreak infect whole school.  happened, you’re comfortable sharing? COVID cases among kids rise, Palm Beach County school district mandates masks  DAVID J. NEAL  AUGUST 08, 2021 07:28  mandate reinstated Broward County Public SchoolsAnti-mask protesters gathered Broward County Public Schools held board meeting COVID-19 safety precautions potential mask mandates upcoming school year. School Board voted 9-0 favor reinstating mask mandate. MATIAS J. OCNER   faculty begin year masked Palm Beach County public schools School District Palm Beach County announced shift policy facial covering.In open letter posted district’s website, Superintendent Michael Burke said, “I requiring facial coverings inside schools buses students attending Palm Beach County District-operated schools, unless student’s parent/guardian chooses opt-out requirement.”   opt out, parent send signed note telling child’s first period teacher.No option given staff, required wear facial covering indoors buses.Burke’s message said might change 30 days sees things going. school year starts Tuesday.  Well, tell say. ""they preexisting issues, obese, diabetes, healthy etc"" without realizing obese unhealthy probably diabetic (but undiagnosed) people themselves. many symptomatic, bad symptoms symptomatic breakthroughs? important details. also largest group people. majority vaccinated make 19 percent cases, minority unvaccinated people making 81 percent rest.

That include fact 19 percent much better outcomes average.

Proof vaccines work. pastor said healthy vaccinated. Four age 35.

Wow. hope vaccine push works. holding need step get vaccinated. Lol...like said...moron Well one poorest states country may completely wrong truly feel widespread cooperation. Latino Native American populations hit hardest highest vaccination rates. think everyone came together got vaxxed knew needed small businesses survive. also bunch scientists medical residents maybe helps too! Plus governor badass. Sadly bs working. I've heard relatives southern states like Virginia North Carolina states talking new wave immigrants. OK here's worry that. Say 3 months government says ""Hey decided actually need TWO shots J&amp;J considered fully vaccinated. need fully vaccinated get passport allow indoors/travel.""

So do? currently one shot J&amp;J one shot mRNA. take third shot? good thing there’s athletes world living heading back home countries soon Apparently Garth Brooks making call soon massive stadium tour he’s currently pushing vaccines, means many vaccinated. said infection occurred outside church meetings, scientist.

Unless singing chanting session, I'd say infection occurred there. know people ""wear masks"" country.  One child Arkansas isn’t great sample size.  Tuesday majority school children Florida start back. next 2 following weeks rest state returns. going much worse get better. I'm worried hell students community.   50%, possible. We're 30% 1 dose right now. Well, China sure stuff pretty much advanced technologically speaking, so...maybe 2 billions big deal export so, dunno. Sounds amazing. Still, country surrender purchases global body. gonna happen. Covax better building vaccine facilities middle income countries means maintain help mediate deal countries vaccine developers pretty much supports fact vaccinated people 5x less likely test positive COVID-19, stated article. dumb country Darwinism. sure you’re mad. hospitals aren’t collapse like before. protective gear. can’t get vaccine whatever reason access n95s. People arrogant forgo getting vaccine either wear mask well gamble life. I’m losing sleep anymore. need shutdown anything manage masks whatever. People need take responsibility. Insurance companies play ball well.. I’d say didn’t get vaccine premiums go cover short term long term complications. dangerous delta? Maybe lucky, there's kinds mask mandates re-implemented vaccinated states country right now. Thanks much saying that! call fully recovered now, much similar place. got sick June last year, kept trying push got bad leave apartment much January, finally gave active focused resting things really started clear April. I'm hiking working multiple times week. fear going back really thing keeps living normal vaccinated life now. must management evidenced unmatched empathy ability hold team together. also lot dignity shoved shelter. I'm sure give homeless choice sleeping cots 50 people one room, they'll take every day week twice Sundays. want get vaccine, it’s ultimately choice. Thank though, you. get wrong, wish best luck. seems ill advised.  no, go walk vaccine clinic say need second shot, lost first vaccince card.  doesn’t care. Transmission lower outside. would expect everyone vaccinated. I'm Denmark 73% first shot, 58.5% fully vaccinated. wrapping end august. Hopefully around 80% population fully vaccinated.  asked parents talk doctors this. They're risk live area high number unvaccinated people. also area vaccines going waste.

I worry something tested thoroughly point hope it. cant imagine small cash whole wall businesses implement realistically see N95 KN95 mandates appearing world. We're already poorly getting people wear kind mask, tightening specific sort mask going worsen compliance.

Also, logistics making sure everyone obtains fitting masks ethics making bearded individuals shave beards debatable.

The benefits specific kinds masks probably offset decrease compliance. state app work shit NY sucks ass anything right extremely rare [it Oh.. sorry go thru that. try pay visit tomorrow morning. immunocompromised like myself

Are US? Consider talking Doctor. heard immunocompromised people talking physician, getting tested antibodies, getting cleared third dose antibodies detected.  virus care they're outside, intentions. post appears vaccines. encourage read helpful resources COVID-19 vaccines:
  
[Vaccine FAQ Part FAQ Part appointment bot, action performed automatically. Please [contact moderators subreddit](/message/compose/?to=/r/Coronavirus) questions concerns.* got shot Moderna.

If J&amp;J going get shot mRNA vaccine 'booster' one would want. Absolutely nothing wrong Pfizer (I think they're basically identical) Moderna seems lot effective one shot. That's probably dose would assume get benefit one Moderna shot one Pfizer.

Best luck!  Well, here, mixing AZ mRNA officially recommended. also articles research mixing J&amp;J, I'm wondering doctors say yes already.   keep hearing much ""game changer"" Delta is, I'd honestly love see updated studies Masks V. Delta.

I especially want see flimsy surgical masks floppy cloth ones work Delta. understanding even original COVID, outside N95 KN95 another well fitting type, giving false sense security masks.

I can't imagine Delta going impeded much floppy excuses masks see many folk wearing.  I'm sure there's formal guidance vaccine mixing like anywhere world, honest. guidance telling it. think Moderna better delta no?

I think say confidence yet, maybe. don’t blame them. tell people stay home hold Olympics? one going take orders seriously. oxygen levels physician told normal, hopeful sign. stay positive much can. submission linking thedailybeast.com automatically removed source may reliable may dedicated mostly political coverage. possible, please re-submit link reliable non-political source, reliable news organization recognized institution.

Thank helping us keep information /r/Coronavirus reliable!


*I bot, action performed automatically. Please [contact moderators subreddit](/message/compose/?to=/r/Coronavirus) questions concerns.* bad, collapsed lung mediastinal shift. even crawl 4 stairs. Basically lost 75% lung capacity, doctors even amazed still alive. I'm stubborn mule. know suction canisters see hospital use people vent? filled 3 infection poured chest tube still made mess floor.

Don't like me, put off. put nearly cost life. Plus it’s way watch Spiritbox live get it. vulnerable groups vaccinated. wave bad? outside Brooklyn bridge. both. mild hives first pretty severe hives second   -- husband came COVID-19 last month, Tokyo woman 30s stymied instructions received at-home treatment local health told eat, sleep spend time away husband much possible -- easy task one-bedroom condominium. Three days advice, tested positive COVID-19 woman's story reflects feature Tokyo's latest coronavirus wave: Officials reported Thursday 61% new infections week Aug. 2 could traced home. At-home infections never topped 60% previous way could use separate bathrooms,"" said woman, asked remain anonymous. ""I resign fact would probably get husband's symptoms mild, mainly cough. hospitals strain, government urging limit admissions areas high-risk cases, fast-growing number Tokyo coronavirus sufferers like forced recover home.

… sorry. cult. saddest part is, one really concerned child die, cling them, cut ties. :( Actually, there’s extended trial results AZ demonstrate gaps much 45 weeks (~10 months) [actually induce superior antibody 45 week dosing interval first second dose, antibody titres four times higher 12 week interval, demonstrating longer dosing interval detrimental derive stronger immunity.

Median antibody titres (in ELISA units per ml, EU/ml) [923 EU/ml 8-12 week gap, 1860 15-25 week gap, 3738 44-46 week anything, people better (and likely longer-term) protection shorter intervals. need schools? suppose keep rollin.  Well informed? sources though. immunocompromised, good.  WHO: ""Let small number old people countries die, order save lives larger numbers people countries.""

Almost governments: ""No. it.""

Although might ethical moral thing species, national governments created seek better human species overall. exist sake people specific nation. Therefore predict fall deaf ears. Already are. alrighty.. thx advice. one thing tho may ask bad breathing issues hospitalised? gesture nice best way remember gather large group trying time. 2cents. [According Brunei’s Health Ministry, control measures reinstated two weeks immediate effect, including closing religious places, schools switching online learning, dine-in restaurants, closing indoor outdoor sports facilities, leisure centres u post appears vaccines. encourage read helpful resources COVID-19 vaccines:
  
[Vaccine FAQ Part FAQ Part appointment bot, action performed automatically. Please [contact moderators subreddit](/message/compose/?to=/r/Coronavirus) questions concerns.* actually wasn’t far off, far.

UK hospitalizations peaked 900. predicted 1000-2000.

UK cases aren’t accurately counted (the positivity rate high) it’s difficult judge there.

The idea Covid UK expressed wrong before. don’t think there’s new data suggest it’s over.  would still checked out, sounds like breathing mask causing would make sense since exert effort breathe mask. People COPD issues masks that. I'd get looked at, nothing else sure underlying issue going there. Like said, breathing issues something want screw around with. I've seen people put off, put off, suddenly running breath walking flight stairs. earlier something caught, better prognosis. US exporting lot Johnson &amp; Johnson doses many countries southern hemisphere. find breakdown 111,701,000 million doses here: 

