,date,text
0,2021-11-06,"   Covid thing, although girl kindergarten class (back dark ages vaccine approved) caught chicken pox, parents notified didn’t quarantine IIRC one get sick. want learn kind shot! Teach me. Thank hard work, providing healthcare people perhaps, times, undeserving. wish people would protect families get vaccinated. known many people healthcare field unfortunately somewhat common...active smokers oxygen getting breathing treatments, infants NICU mother abused drugs pregnant, etc. People make mistakes life still need compassion care. I'm sure (maybe) Aaron Rodgers Joe Rogan taking ""the good version"", many people taking human version result this. great quarterback. silly-assed, selfish, fucking dishonest human It’s marketing. He’s famous person say good things advertisements. especially useful place like Green Bay packers held high regard.  worked Disney world year roommate worked food one hotels, serious gf stuff  There's flu vaccines though always hate argument - reason everyone's preaching everyone get vaccine 100%. 100%, one would care get not, they're protected regardless do. Argh. comment shows ignorance. money even referring to? Elaborate getting money, say government, say name. can't. huge success know 2 individuals took died. Nothing could them. massive numbers cut cancer cases amazing miracle think like anything people negative effects. Yes, concern trolling worse antivax. lots problems way pharma run, vaccines well understood, sowing doubt vague accusations zero actual backing beyond idiotic. shows money proven past cut corners aware maximize profit people suffer bc it. don’t vaccinate kids shouldn’t allowed kids. literal science. introduce little bit bad protect kid dying. Please think kids stop believing believing everything read FaceBook aka “Meta” change data. Thank fuck. I'm glad hear found care needed! Hope continue make progress -- never stop fighting well being.   symptoms? daughter got today seems cranky Still “misinformation”  “If kids”-if you’re going try insult please read first. According Facebook flu. Thank you. many times mention don’t kids.. Look Pfizer’s law suits past. exactly honest.  Sorry I’m concerned ethics big pharmaceutical companies proven past shady things. Worse anti-vax asking questions? Live echo chamber much? Well, misdiagnosed long time doctors grew distrustful many result understand healthcare field seems improving many ways easier used get doctors listen health concerns actually get MRIs testing done upon request verify health issues. found good healthcare professionals recent years absolutely wonderful improved quality life genuinely care patients gone long way towards earning trust back. critique, mean independent assessment methods. audit model... look graph, top [their article central estimate global excess deaths seems twice actually reported total. There's quite lot statistical black magic (""gradient boosting"", ""bootstrapping"") behind Economist's estimates, would nice [expert all.  Get ready REEEEEEEEEEEEEEEEEEE!  Lyme, top head

Edit:    Stop talking common sense. live prayers random, untested, non FDA approved treatments here! Ivermectin forever doesn’t work, ECMO forever, thoughts prayers lung donor! Nevermind fact someone ::else:: die unrelated thing. Back up, buttercup need people vaccinated quickly possible. Herd immunity nebulous Covid. vaccine absolutely protecting individual. Guess never heard herd immunity? really individual. Sorry  virus many enablers… 700,000 It’s like there’s pandemic going around something… still... protecting unvaccinated. Rogers clearly taken many shots head. CTE incoming. lost quoted good buddy Joe Rogan. Wait hear rubella vaccine mandate! last I've heard also [provide much weaker least compared Pfizer Moderna company detected following antibody levels per Moderna: cc. 8,000 Pfizer/BioNTech: 5,600 AstraZeneca: cc. 1,550 Sputnik V: cc. 1,550 Sinopharm: cc 600 AU/mL

note: testing done Hungary (source english though), they've used wide variety vaccines. Works me! He's allergic lipds (fats), sugars and/or salts? Seriously? 4 ingredients include active ingredient - mRNA. Rogers FOS. allergic anything mRNA vaccine. Good. good point watching segment Rachel Maddow last night realize talking cheaper iv Regeneron/Remdesivir. game changer vaccines likely intranasal one Hope croaks lol  Let bust tiny violin millionaire football man  used less frequently America quite frequently many places.    they've shipping billion doses countries, well beyond EU US sent abroad.

From news article October China provided 1.5 billion COVID-19 vaccine doses 106 countries four international organizations year, world, Luo Zhaohui, head China International Development Cooperation Agency (CIDCA), said press conference Tuesday  kids! /s  Lol. antiviral = horse medicine.

Do see misinformation problem? gives fuck? vaccine shortage?
No?

Then gives fuck? Let everyone them!

so stupid Made humans, used horses. like MANY medicines are. ONLY. developed humans. hear horses now. HAHA ED, THATS HUMAN MEDICINE.

Not civid, amazing river blindness. Yeah don’t get this… vaccines go college. different?! I’m vaccinated. also still wear mask, social distance, etc etc. sometimes wonder people see think get vaccinated stop wearing mask. one wants hear medication saved eyesight millions kids. HORSES! 

So sick hearing it. almost 80 today. Tomorrow think said 76.  Since pill, theoretically possible get every willing person take pill time wipe thing out. daughter’s pediatrician held vaccine clinic today. booked appt, handful times left. Today called said cancellations happened could take earlier. 2nd dose beginning Dec. Fully covered Christmas. two trips planned delayed could vaccine. excited. Hey now, neither Cap. looks like New Jersey? would put guys 67% vs Colorado's 62% total population fully vaccinated. thing though. vaccines 1 time shot. covid vaccine looks “every 6 month vaccine”

So “this nothing new” incorrect, seem getting misinformation sides issue

Disclaimer: 10 7 year olds got covid vaccine today Yeah, OPV created best immunity could cause infections others vaccinated. Provide example proves wrong then. others stated, titers checked. joined Navy 1994 checked back then. work special education measles outbreak checked back mumps titers low. Now, gone. It’s simple blood test. caught fully vaccinated April, wore mask, work home, etc. Ended mild me, nonetheless, everyone’s got chance getting matter (unless literally go where). Many states laws requiring various vaccines children attending public school must have. Odds laws expanded current political environment slim.

It private sector exercise rights exclude based things like sports physicals, vaccination status, dress code… 

We recently attended touring Broadway show (Frozen Musical.) Masks required everyone, gaiters allowed, anyone 12+ required provide proof COVID-19 vaccination. 12 year old excited show vaccine card. 

Partner met criteria boosters (she’s teacher, got J&amp;J) planned day relaxing cuddling. needed booster side effects mental health. 

TL;DR: Damn feels good vaxxer. Right, they’re pediatrician. would expect know difference. 80% total population fully vaccinated? 80% eligible people one vaccine? mean, we've almost 9 months government mandating vaccine. People saying they'd get told full shit. time pharm company changes anything, patent continue monopoly. includes propellant, coating, solution, etc involve drug itself. pharma company also buy company makes generic. also 'branded generic' class. vaccines protect kids. US, 24 states reporting 24,498 hospitalizations children Covid. deaths Covid polio, mumps, rubella, varicella, Hepatitis B COMBINED year prior vaccines becoming available.  


CDC analysis data showed clear benefit vaccinating kids. Look slide presentations ACIP last week watch recorded video meeting- available CDC website. 

Highly politicized JCVI recommendation isn’t taken seriously American pediatricians infectious disease doctors, responsible British doctors either understand. live Centennial would say grocery stores 80% masked. Every store last couple months required employees wear masks. helps get vaccine blaming gotten continued spread? Meanwhile land free, life expectancy dropped 1.5 years since covid. I’m counting finally get enough population vaccinated put pandemic behind us. 47 states exemptions tho. Also, diseases vaccines deadly kids. COVID isnt. Also, dont need indefinite amount shots, lets even get risk myocarditis.  safe &amp; effective. whatever propaganda watch made afraid vaccines make afraid development well.

Sorry, comes point stop trying reason unreasonable people &amp; simply lay law. workers following threats quit. Natural News instance claimed Measles vaccine killed measles has. Every vaccine endless claims massive harm often use exact logic evidence used COVID vaccine. lot people naively falling anti-vax canards thinking applies COVID vaccine. Maybe opioid crisis left bad mark people.

Dr. Drew, Dr. Oz, maybe even Doctors get question medical professionals.    Vaccines came cases drop. much powerful delta variant spread vaccine helped prevent many deaths. That's hospitalizations deaths 80%+ unvaccinated people.  mRNA delivery mechanism works 20 years, successfully tested 6 years ago humans (see elsewhere comments inks)

Kids serious reactions COVID, particularly Delta variant, including death. seen article two year old toddler dying Delta...  Aaron Rogers fair many instances religious medical exemptions vaccines.  think ""undeserving"" slippery slope. Everyone deserve healthcare, principle, period. Sure, times able provide deserve, that's triage.

But best times never exclude even stupid, self harming assholes basic human right.   vocal parents anything say it.  [Vaccine FAQ Part FAQ Part appointment bot, action performed automatically. Please [contact moderators subreddit](/message/compose/?to=/r/Coronavirus) questions concerns.*  Yeah nobody going buy unless subsidized split time office wfh last week went one others uses office time time coughing running nose “just cold” suggested shouldn’t Ill thought pat going work sick, specially setup WFH want experts variants, [expect COVID-19 variants follow similar epidemiology flu variants (i.e., require new vaccine year year's common variant(s) best protection), far seen variants become common. vaccines use based wild-type SARS-CoV-2 protect Delta fine. need *stronger* protection Delta *different* protection. mandatory 6 months ago. get then?   got flu vaccine covid booster time. I've reaction flu vaccine whole live albeit minor. Usually light fever, maybe feeling tired sore. second dose covid vaccine laid midst terrible flu. Fever, chills, body aches, eat, nausea, whole nine. Magically woke next day felt completely normal, day never happened. 


My question is: possible actually feel worse got flu vaccine covid booster time? I'm throwing up, higher fever, Tylenol advil help soreness, can't even sleep off. Obviously necessary I'd rather covid, I'm curious there's reason much intense received second dose vaccine.  See response comment. main point original comment Joe Rogan took ivermectin, recovered quickly covid CNN media outlets outright lied even went far edit video make appear sicker was.  Yep,they idea what’s wrong encourage actually watch FDA meeting pediatric infectious disease leaders. Comments panel members start 6:45:00. think people would interested learn lot doctors (including chief pediatric infectious disease Tufts) think mandate would huge error, isn’t enough safety data yet. [It’s shocking people actually go directly source.  smallpox vaccine even available public anymore much less mandated. 50 years...

MMR required kids least decade invented. Here’s problem: many existing, cheap off-patent drugs used safely purposes suspected helpful treating covid. problem is, off-patent, drug company incentive conduct double-blind randomized studies required determine effectiveness covid. governments need subsidize studies. government generally doesn’t carry studies. not? That’s problem anyone wants look details cases UK. Yes, loads vaccinated people get virus. Yes, case numbers high time way down. 'stubbornly' high case numbers predicted expected summer months- possibly even desired. happening UK now, reverse elsewhere Europe high caseload summer.   talk doctor privately, may chance talk legality. seen many secsessful stories! Good luck!! US government pays pfizer $19.50 every shot administered.  Thats lot money.  Both. Deaths cases definitely undercounted ago, positivity rate pretty good indicator things are. May pretty insane 25% compared things pretty normal. opposed vaccines, time give shit refuse take it. rather die ICU take pill... Well, that's problem anymore.   vaccines listed actually prevent transmission contracting said disease. 

The Covid vaccine doesn’t either. makes less sick. long-term protection Covid well. Ignoring horse part, fact dewormer evidence works COVID. guy got better taking also true guy drinking coke. would discuss medical issues doctor.  That’s point… Critically analyzing anything new. literally everything. accept things don’t anything it, end like communist country.  vaccines cause variants?  vaccines really best solution? options deal covid? those? 84 years old? could “win” anti vaxers. took monoclonal antibodies worked. they? get pummeled delta wave? Genuinely curious problem countries ‘leaders’ lying dividing. actually sane leaders didn’t bullshit us every time opened moronic mouths, people wouldn’t hesitant. fact people picking “sides” topic absolutely foolish. People’s lives health risk people still think trolling internet appropriate. Instead insulting people, try educating maybe you’ll learn something yourself. Colin Powell thing Fox raised questions efficacy vaccine, truth death exactly need vaccinated! Herd immunity protects vulnerable, cornerstone public health century sudden uninformed decided new fangled idea. Wow 2015! track record! Beats snorting horsejunk guess. Name Ivanmakething sell rednecks... Totally agree you. People dvoted bc personally cannot grasp people handle covid well, especially children. indifference I’m vaccine. still think (if they’re eligible) kids vaccinated. time right course. vaccines last 6 months basically evaporate that. also child (3 years) I’m keeping date information including therapeutics. still feel vaccine, least look therapeutics supplements may increase immune response covid catch again. gave away?  Ivermectin listed anti-viral protease inhibiting effects reason entire thing ivermectin started suggests potential anti-viral potential like Pfizer's new results indicate boceprevir, ombitasvir, paritaprevir, tipranavir, ivermectin, micafungin exhibited inhibitory effect towards 3CLpro enzymatic Merck Pfizer's new drugs protease inhibitors Pfizer's drug literally targets EXACT enzyme reported months approved authorized, PAXLOVID™, originated Pfizer’s laboratories, would first oral antiviral kind, specifically designed SARS-CoV-2-3CL protease inhibitor.""

NIH also conducting $155 million study includes ivermectin among selection study interesting tidbits found interesting well.

""Ivermectin lipophilic concentration tissues high; active levels lungs reach almost three times higher blood detectable fat tissue least seven clear, I'm saying proves ivermectin cures covid anything sort, evidence pharm physiology effects/workings supports potential benefit, especially prophylactically, explored (which happening NIH study). I’m New Zealand won’t ever mandates kids I’m really looking forward they’re available here. Right we’re aiming 90% eligible population double vaccinated, we’re first doses 78% far (of eligible) second doses. outbreak going Auckland chugging along dampened even higher vaccination rates there. could get kids board would make quite difference us. kids board ready go become available probably basis people think vaccinated folks spread/shed covid too. actual proof covid, given historical precedence concern entirely unfounded. This. relatives aren’t taking vaccine “if didn’t shove throats would have” attitude San Francisco’s population skews young adult, it’s vaccinated city (tied Seattle) US. You’re thinking public spokesperson *waaay* rationally. took ivermectin worked though. Many people success ivermectin overcoming covid. don’t like CNN Fox News fair, CNN dishonest claimed took “horse dewormer”. Back day one person got class, kid came back early , two thirds class week so. classes started getting affected too.

I outbreak office 2 years back. One person it, started getting , vaccine drive setup immunize people wanted get vaccine.

There plenty adults never took vaccine kids ( available /common school) never got kids natural immunity either.

I imagine schools asking vaccines handle logistics. office mandates setting drive helped lot keeping control, sound unreasonable. great news. saying case actually possible allergic ingredients present vaccines “lipids, sugars fats” cover extremely wide array substances. 

From [CDC Allergic Polyethylene Glycol (PEG) Polysorbate
PEG polysorbate closely related other. PEG ingredient mRNA vaccines, polysorbate ingredient J&amp;J/Janssen allergic PEG, get mRNA COVID-19 vaccine. Ask doctor get J&amp;J/Janssen allergic polysorbate, get J&amp;J/Janssen COVID-19 vaccine. Ask doctor get mRNA COVID-19 vaccine.

There’s denying Rodgers dumbing whole ordeal people actually allergic cannot take vaccine. dismiss antivaxxers that.     Obesity mostly voluntary disease. Covid not.  Fox News watchers care something lie. They're get outraged get marching orders day. saw someone refer Joe 12th funniest cast member News Radio new go description. limited, still get abortion Texas. Don’t lie. problem isn’t vaccine itself. problem people media/Gov/NIH/CDC instilling fear misinformation people. (And blatant lies) creates distrust sole reason Covid vaccine hesitancy. ‘leaders’ killing people rhetoric polarizing everything political debate.   Imagine asking self proclaimed ""comedian"" commonly says knows nothing curious get rid Covid??? hilarious.   feel like coworkers like cringe hell. 25 18 months 1 time? literal full information entire world still...still fucking stupid type this. extremely long times determine safety, actually helped effectively eradicate diseases.

Covid stay.

Kids much longer suffer ill effects vaccines, practically invulnurable already, it’s fair force them.

You force parents risk precious world. You’re basically asking civil war.

Good fucking luck  Seems biased. different age groups. Good Germany Celtic. great traditions. like taken everything USA. say great well balanced article. First I’ve seen it’s type actually balances risks validates parents concerns fence know don’t know. Compare reporting media “it’s safe trust us benefits outweigh risks.”

We need reporting like inform parents fence able make informed decision info, good bad. opinions even problem, problem they're even based facts. large chuck country leaders chosen incorrect information basis action, staying defiant damage actions already caused. know, kids! Nothing money corruption. Moderna partnered NIH vaccine. FDA approve review finished. J&amp;J, you’ll ask them, haven’t submitted BLA (full approval) yet. Apropos name. hate people like you. work icu designated covid unit never seen vaccinated patient unless seriously immunosuppressed, like organ transplant level Don’t think “booster”, think 3rd dose series. Remember extra lines vaccine card? additional doses found needed.  


Almost non- live virus vaccines dose months initial dose doses. That’s secondary immune responses work. It’s vaccines distributed. NSW vIC actual Covid community got vaccines population otherwise indicated. NSW hit 90% double-vaxxed tomorrow, Victoria two weeks behind that, states weeks behind again.

Our federal government fucked ordering vaccines, half fully vaccinated people country first shot two months ago. could used halt potential pandemic track coronavirus pops sickens lot people local level? Thinking Wuhan taken seriously beginning residents given antibody prophylactically stop spread. antiviral.  little goblins lick play masks day lot better adults actually wearing there’s need reminded wear correctly. would load teacher’s shoulders could stop correct kinders’ masks day.

I say load affection kids. It’s understandable do, pleasant deal with. sub subreddit. fully vaccinated, last dose March today tested positive covid. 
Symptoms started 3 days ago, sore throat bit congestion lingering irritating low grade fever around 100.7 lower. Feeling tired, bit joint pain.. pin point, feels like I’ve taken Benadryl. Hopefully blow soon without complication Broken States America? Drugs don’t win Nobel prizes, people do. ivermectin originally released livestock drug continues commonly used livestock medication world. used humans, though much less frequently, parasitic infections covid. Alright, purpose mandate health reasons(you admit since shown prevent transmission), mandate health decisions? data shows people likely hospitalized die COVID, comorbidities, like pneumonia, diabetes, etc...

By logic, mandate away sugar/soda, processed foods, exercising, drinking/smoking, binge eating, etc, then, end result healthier people w/ less comorbidities, therefore, less chance dying covid(among things) regardless whether vax evergreen, went vet day, masks anywhere.  post appears vaccines. encourage read helpful resources COVID-19 vaccines:
  
[Vaccine FAQ Part FAQ Part appointment bot, action performed automatically. Please [contact moderators subreddit](/message/compose/?to=/r/Coronavirus) questions concerns.* Treat something nice afterwards. It’s great hear she’s excited get it, apprehension needles totally get! Even know want happy to, poky things aren’t nice.

I recently get #2 meningitis believing done childhood vaccines (parents forgot get last one) gave treat anxiety seriously ramped needed/deserved haha. flu shot. don’t really needle phobia, expecting pain enough psych out, feel her.

I hope goes well her, unfortunately still lot shots come future lol I’m sure seeing parents get shot helping encourage feel better it. Getting sick fun I’m sure she’s happy avoid doesn’t like germs! parents getting kids vaccinated, hope handle everything well! Wishing guys best. hundreds millions dollars it? It’s expensive, though finding less ethical doctor prescribe could challenge, many people buying horse dewormer. It’s going first city rate higher 100% vaccinated. Currently 99.72% received first dose.

How 100%? 
Some cities suburbs NSW ACT, people got jab ACT.
My understanding simply count shots divide population. NSW numbers likely marginally higher, ACT percent lower. Dr. wasn’t wearing mask time? Especially family members hospital time Covid?? I’d noped right visit. would asked Dr. wear mask remainder visit.   Ok great, news? got tested immunity pregnancy bloodwork. Came back saying get booster it. Can't get I'm still pregnant (one vaccines contraindicated pregnancy), probably get take kiddo hers. point call ivermectin people take it. care anymore. No, course not.  politicians stirring pot stay power. point surprising, NFL players believe medical science play anymore. 

 Concussions long term effects well studied. Good Victoria ACT numbers 12+ tests free mandate (if/hopefully goes effect)? know free currently. (Apologies clear) Also here's couple things CDC. quotes page basically vaccinated break infection less infectious producing less virus time infectious shorter reduces risk spreading someone vulnerable. virus transmits easily communities lower vaccination rates people get infected produce virus infectious longer periods time leading opportunities spread. spreading means disease, endangering vulnerable, also gives opportunities make varients get things like U.S. COVID-19 vaccination program substantially reduced burden disease United States preventing serious illness fully vaccinated people interrupting chains transmission.These findings, along early evidence reduced levels viral mRNA culturable virus vaccinated people acquire SARS-CoV-2 infection, suggest associated transmission risk substantially reduced vaccinated people: even Delta, evidence suggests fully vaccinated people become infected infectious shorter periods time unvaccinated people infected Delta. 

Vaccinated people still become infected potential to spread virus others, although much lower rates unvaccinated people. risks SARS-CoV-2 infection fully vaccinated people higher community transmission virus widespread. Current efforts maximize proportion U.S. population fully vaccinated COVID-19 remain critical ending COVID-19 pandemic. pharmacies treat workers best? work testing site it’s free everyone; wonder could change stubborn jackasses pay way. don’t think it’s possible.   think Wall Street journal sensationalism clicks? even read article?

Edit add: assuming didn’t- based breakthrough cases household transmission caused infected kids bringing virus home. letting post link profootballtalk atlantic

