,date,text
They've ""opened floodgates"" numbers top line. They're better average, issue oppressive tier categories, seen [them rocket top last still lag behind several states.

So defend beauracratic nightmare that's set evidence bureacratic nightmare causing slow rollout.

So, back doses thrown out. look [3 4 doses thrown New screech gone arms Cuomo killing people $1M fines.

But can't ignore absence laws, people [jump hard mix extra doses ""go waste"" call close you.

So balance two things? tough say least 1 shot arm 75 nursing home patient WAY good 1 shot arm healthy 35 year old.


Here's belief: Much issues stem federal government, people want states fix issues own. can't. money, resources, complete picture going on. feds going change anything another 2 weeks throw baby bath water (that work, see: Florida), keep improvements already seen. read ""handmade tales"" confused fxxking pretend ever believed China want scientist communicate publish special privately login protected websites? Specialist literature usually access restricted way. books, magazines, journals websites meant certain target audience. Even everybody buy access mean written way everybody understand correctly without certain domain knowledge. Canadians going fl get vaccine? even overwhelming media response, whole bunch people still don’t seem comprehend. SMH fXXking pretend ever believed China Legend says recipe gift given gods people perfected millennia. wouldn’t mind tamale hot chocolate right 65+? eligible get vaccine right now. give pointers registering case. 

Otherwise, hospital giving vaccines 65 certain pre-existing conditions part system.  
I personally taking vaccine, least understand others not.

You write teach vaccines schools, something hasnt FDA approved yet. ANYBODY takes right guinea pig. claim concerns unfounded, currently collecting data, stage 3 right now.  seen 80 yr old mom since Oct 2019. went taking care nieces nephew 4 days week, plus volunteering, seeing anyone. Maybe neighbors got cold, doesnt see anymore either. cold sit outside garden now. call daily check her, talk her. bored. Lonely. risky. Hoping gets vaccine soon. roll painfully slow elderly living old peoples home Fentanyl commonly sourced patches anymore. still happens, majority fentanyl comes powder China. comes pure, super small, cut/diluted gets destination. 

So one could go ""score dope"" used mean heroin, nowadays mostly fentanyl. sprinkle donuts. noticeable all.

Also, dopeheads often boil dope spoon injection make somewhat cleaner sterile shot. boiling, least light boiling, degrade substance. Boiling longer times degrade though. group lied everyone start saying masks effective. reactions previous vaccines absolutely needs discuss covid vaccination primary care provider. may simple ""make sure get vaccine near urgent care"" ""stick around full 15 minutes receiving shot"".

The primary care provider likely much better convincing safe.   I'm surprised additional analyses explore this,” said Manu Shankar-Hari, clinician professor critical care medicine Britain’s Guy’s St Thomas’ hospital, co-leading trial. underlying hypothesis using convalescent plasma potential treatment COVID-19 patients antibodies contains could neutralize virus, stopping replicating halting tissue damage. However, may lung damage advanced convalescent plasma make difference,” said Alexis Turgeon, critical care doctor professor Université Laval Canada, also working trial. Uhh, statistic sound like true.  Completely agree.

I wonder long media outlets continue acting everything terrible. cases deaths start go consistently vaccine progression seasons changing probably gonna write ""Well, dare happy yet: need quarantien till 2030"" shit like that. 110% this. live Florida love reading comments tourists TRAVELED PANDEMIC commenting people live ones taking seriously. Like... what???  WV rural, saying national chain pharmacies incorrect. Every tiny little town state Rite Aid/Walgreens/CVS along lots small pharmacies. used work one tech support area covered southern half state covered. Incredibly so, could easily said ""hospitalized covid-19"" title avoided confusion. get people consuming would know meant. Curfews push people place things closing earlier. politicians smart  It’s credible complain he’s done something bad. UK one world leaders vaccinations far. government seem made much better decisions areas Covid response. ""I'm anti-vaxxer, *but* ..."" sounds hell lot like ""I'm racist, *buuut* ...""

I understand people afraid, work healthcare understand benefits modern medicine, anywhere near forefront fight last year, duty basic research deal questions might have, get comfortable successful vaccines made available colleagues. Many done that. Chinese newspapers reported several cases related people back Russia southeast Asia. Oh holy shit, abuelita tamales best! comment person‘s friend perspective: aren’t together? Aren’t going feel consequences overloaded hospitals stricter lockdowns somebody needed go Disneyland? 

I read story 39-year-old whose chemo brain cancer delayed hospital overflow. Human beings don’t live bubble individualism, actions impact other. Sterilizing immunity seems likely humans given studies rodents Chimps. Ay, flaco. i'm curious, get first dose, happen ? lower immunisation rates ? nothing ? mean surely credit credit due one. government absolutely nailed vaccine roll - comparable country world. 

The decision over-order, back multiple vaccines, opt EU program - faced massive criticism, appears working.  right. place get vaccine near open like 8-12. Sure line keeps people like 2. open 24 hours day I’ve replied elsewhere here, story widespread uptake many non-specialist outlets around world, OPs science site. article requires medical education. know folks sell medical supplies meetings golf courses. Guess what? They’re vaccinated. guess I'm comparing flying staying home completely insolated. around dozen folks w recirculating air sounds pretty bad me. yeah even think airport. confirmed cases airport transmission? way complicated trace down? virus variants fake gucci shit chinese market family dolmades damn take forever make they’re good true. evidence studies this. easily assessable Google. gotta vitamin game. That’s like using 2 1 shampoo conditioner.  work Trumps team?

Mate European think Trump idiot. us understood perfectly, fault problem not. Also asking loaded questions... Especially 7 vaccination hubs opening today Kinda inevitable something like this. Emotional investment, positive negative, gradually takes and...well, there's r/covid19 science-based discussion.

Emotions usually deal anecdotes anyway. Folks come feel better.   Everyone know gotten appointment system Florida gotten card information return date/time expect second dose complicated first. That's hilarious. saw WV thought Sydney too... Although think real reason smaller pharmacies WV driving force. Small businesses get done! 

I actually really bad fear doctors/medical stuff sawbones/Dr. McElroy helped lot. I'm still queen white coat syndrome get blood pressure taken, I'm willing entertain going doctor all, I've come long way. 

Why help? dunno. scare much doctors worked like exposure therapy something... need vaccination centers too. live county big metropolitan area skews young opened vaccinations 75s. appointments booked mid February. Ridiculous. piece copyrighted AFP - apparently world’s oldest news data sources medical journals, I’d say piece much written general public. picked science website doesn’t mean article wasn’t designed general public. 

It’s also run many non-specialised outlets around world, Powder donuts. Mix powdered sugar sprinkle top. Assuming black people large monolithic group pretty irrational too. It’s clear aren’t groups making conflicting contradictory positions. leading question. post appears vaccines, please see [our answers frequently asked questions regarding COVID-19 vaccines. comment containing misinformation removed user potentially banned.


*I bot, action performed automatically. Please [contact moderators subreddit](/message/compose/?to=/r/Coronavirus) questions concerns.* country failed stupid people like Reuters article saying won’t reach herd immunity year.. especially countries. live US hope god get normality year. get vaccine (I’m super young I’ll last) I’m dammed I’m gonna care tiny amounts deaths equal flu/cold. Lots young people keep virtue signaling mask forever. I’m starting lose it, want life back bad don’t care anything else. parents get sick too? First country approve vaccine. Approved despite low efficacy rate small sample size. 

Last week, local authorities scheduled president jabbed Jan 13th. Indonesia ordered 30million doses Sinovac's. Alberta's fucking embarrassment. Thanks. basically saying travelled family group, stayed w family group, that's necessarily dangerous staying one place? pie sky thinking could actually isolated enough? think head flying among second worst things could (choir, indoor restaurant, dance club, etc much worse). sounds like longer considered bad? Would say 2 week isolation still important nah? vaccine free America. Maybe shouldn’t make bold statements like don’t know you’re talking about. agree this. friend I, probably made 50 vaccine appts folks 65+ across 3 states point. system hard, hard people good technology. 

We've calling ""adopting old people"" GRANDCHILDREN HELPING YOU?? That's media really pushing out. care visiting grandma, care enough help make appointment   Common knowledge really. Wealthy countries countries produce vaccine 6-12 months ahead others. 
We may need true herd immunity significant impact though. People talk herd immunity means zero people get covid point it’s widespread community transmission like it’s NY March. canyon’s worth middle ground.  reason everyone else doesn't

That mystery reason: delicious. virus dynamic system really single magic number represents herd immunity. people harder spread. Eventually many people dies out, behavior system point to.  2 1 pills @ pharmacy there's banter there's 'low quality information'. No, supported tythes don’t know graphic saw, bullshit.

The plane problem. plane air circulates side side, people you’re risk catching ‘rona dozen people nearby seats. air largely replaced rather recirculated - dirty air ejected vent back plane new air outside conditioned brought cabin. portion air recirculated (it makes easier keep air moisture content reasonable) HEPA filtered coming back cabin.

On hand airport nightmarish miasma coronavirus. Don’t terminal longer need limit number people get close way gate best can. That’s peanuts. France getting 70 million doses end APRIL. Yes, April 2021. Island surrounded water. 2,850,000 people died 2019...
3,000,000 2020


Unfortunately suicides rates went 150%. Suicides 50,000 2019. suicides tripled year tell you? 100,000k. overdosing drugs alcohol? significantly. extra deaths could blamed two categories well.

Not implying COVID deadly anything effects lockdowns resulted ""the deadliest year US history"" well. Shitty around course not. think enjoy pandemic lol? half set nuts collectively we'd hit covid zero mid summer Canada. us, politicians weak piss. Aussies, Kiwis, Chinese toughed out. florida deserves every bit Interesting logic zoom happy hour seems dystopian potentially spreading pandemic. advisory one thing also imposes 10 day post-travel quarantine returning Californians. also discourages non-essential travel state. WTF Good. Hopefully black market effective getting shots arms incompetent micromanaged state governments. Everyone EU countries wants get one vaccines get end May. early June pandemic completely, 100% EU member states. one fleece liner inside, would stop droplets splitting?  know hindsight 20/20, nowhere creating registry people want vaccine applying tiers registry, notifying people become eligible based number people signed tier they’re in? hard thing You’re seriously thinking making consideration wrong? Morally? don’t see able make connection. parents asses. really condone otherwise, next time mom calls selfish makes feel guilty feeling like shit this, emotionally manipulate her. less right now. dystopia waited almost 10 min today one 17 Mega churches pay zero taxes town uses police force direct traffic gigantic nd filled capacity parking lot. Nope, spread going there. Let hurry get groceries home make sure ready fun filled week work, school, elearning! Gotta keep schools closed. Wouldnt want virus spread. Folks Japan want see Olympics, stadiums. Athletes want see family stands. good chunk would like occur without masks, significant precautions required keep everyone safe. many, shot, want maximize it.

Mandatory vaccinations way could continue Olympics year. Sans travel ban, minus athletes support, covid continue run wild. every 8th year right? 4?.. regardless every even number, every uneven... OCD can't take it... push another year please, can't one.... Also 2022 likely got everyone vaccinated.. Hospitalizations leveling around 25k. icu leveling around 5k. Probably half ‘active cases’ actually active cases, think 10% number high what. less likely catch virus rich person. longer luxury lording get who. That's one reasons we're month live vaccines 2/3rd's shelf. 

One vaccinated human one less transmission vector virus. PERIOD.  realize vaccine doesn’t stop transmission right? putting patients lives risk? people go social distancing counties lmao? Probably weather. Getting cold much earlier time year ND one going shit spread well. call ""localized herd immunity""?

No. call social distancing... 12.5% ND covid, that's 1 8 people, every 8th person. I'm thinking places still ""covid free"" towns reached herd immunity, averaging 12.5% across entire state.

We look larger cities gauge we're herd immunity disease likely spread populated areas less dense areas. look Cass county Fargo located see 20,366 total cases population 181,923. That's around 11.2%. also look less dense areas like Slope County. 30 cases population 742 4%. think counties rural end things drop like that. randomly picking counties, I'm seeing highs maybe 14-15%. So, highly doubt even towns reached herd immunity unless talking places populations something like 10.  Watch new cases right? That’s define “back normal behavior” - individuals vaccine not. Maybe hasn’t caught up? governor said ago mask mandate, hard give sense urgency problem, people know numbers aren’t there. Chances deaths go up, considering went long sorta low numbers, vaccination efforts, I’m hoping won’t see massive amount deaths, barely make this. great way illustrate example someone thinking middle ground “doing nothing working socializing ten months” go 400 person rave. obviously plenty options in-between allowed people socialize safely. sister's mother-in-law nurse Riverside/San Bernardino area weeks ago said assigned patients ever cared there's way possible give appropriate amount care.  Lockdowns work Saying creates zero health issues long term complete lie. one knows yet since one experienced vaccine long term yet. 

Comparing long term smoking getting COVID comparable. One results slow death chronic health problems majority daily users. virus people waaaay overreacting terms affecting young people. CDC says [less 300K+ deaths U.S. (almost year's worth data) folks 34 years old. facts. 

And people keep saying ""long term health issues"" reason get vaccine young person. know regular influenza also chance giving long term [health too. even crossed mind flu past since covered news, fearmongering control facts right front everyone whole time.

I'm saying -- I'll advocate anyone who's older, underlying health problems already, morbidly obese get vaccine since COVID threat already fragile livelihood. However, I'm 27, work 4-5 times per week, eat generally healthy. I'm confident body able handle not, that's completely me. untrue, Japan’s case least. Even government puts full weight behind approval, won’t come late February due nationalistic laws protect weak domestic pharmaceutical companies foreign competition. president elect. 

He cannot anything yet. 
He sworn office first. read free rich donors get first, everyone else stand line see happens  mention certain respect physical boundaries Japan don’t experience asian cities. 
Only exception subway rush hours. wrote legislation, give medal... Fuck off. It’s year. Don’t act like vegetating couch watching Netflix substitution life. people subreddit delusional, privileged, shut-ins I’ve ever encountered. proof need teacher get vaccine? Islands little it, look UK far worse, slightly smaller Island NZ.

Most countries ability control land sea air borders. It’s awfully lonely sheltering place USA solo thought crowds like pandemic make anxious. It’s website linked. Here’s quote it.

“Life expectancy data available races 2018. Life expectancies black white populations updated data available. Due changes categories race used publications, data available black population consistently 1968, 1960. information historical data age-adjusted death rates available Probably literally 13 people live people problem? mean like less people vaccinate = less market vaccine-producers fight over? Poor capitalism :( people sub, no. desire ""new normal"". Watching first world privileged pratts pontificate “everyone stay home 😀😀😀😀“

Shit, even first world, ""first world people actually afford stay home"". Seems like huge cost savings me... Cool. There's 400k Americans left absolutely lifetime left, number keep going while. 

But I'm sure that's fine long get gym time. seen 3 million week thing? amazing NHS pull 🤞  Don’t turn something isn’t. expect elderly people die expect younger people die. Non-Californian seems like CA illogical lockdown measures (lots restrictions outdoor activities) still keeping indoor dining museums whatnot open? 

Also CA FULL lockdown months earlier year right?

I imagine people pretty burnt out... find upsetting global scale, several vaccines distribution (with come) seems like virus gone overdrive time starting administer vaccine (s) That's many staff lol, Let everything can't stand two feet, including medicine, fail.... expectations always late April July people start getting vaccinated priority group. ever said March earlier wrong. makes sense know politicians. Let's take drastic action news. I'm weirdo likes read stuff. OP posted helpful link anyways. agree folks prioritized, end hundreds thousands undistributed doses way.

How let priority folks get disney style fast pass skip line rest get first-come-firdt-served? Well majority first bill go individuals Oh can't wait fucking BAILOUT every place going asking (if) ever ends. Get checkbooks....   Fortunately, us get enough vitamin D, may good public health overall. sure miss Grandmother's tamales...😔 grandmothers ability cook food far beyond anybody attempt recreate. Grandmas food best best facebook doctors say fine Moderna states likely couple years [as wrote Can't think many mRNA vaccines would much different. States fine year. Maybe 100% back normal fairly close end year IMO. Whoosh. bottlenecks 'how many hours day' 'how many trained vaccinators available' 'how many fully batch-tested, bottled-up doses vaccine ready go'. scientific studies COVID-19 China preceded world became consensus

Is surprise China leads world sequelae research? all, one country suppressed massive outbreak Hmm. decisions specifically affected unknown number asymptomatic cases don’t need healthcare? Honestly sure anyone makes money there. Every girl seems now. supply must insane. Pilot's announcement: ""The flight Catania cancelled, we're turning around right meow."" Abuelita &lt;3 Que linda  Chinese person

Can define Chinese person. mean citizen PRC something else? There's really nothing vaccines (and vaccines general) sticks around long-term

Phew, thought supposed confer immunity 2 years more. Thank goodness long term effects all! Maybe people came back home via country roads? 🤔 health experts said Reuters Next conference mass roll-out coronavirus vaccines would result enough people immunity able effectively stop COVID-19 spreading.

To stop spreading internally country, agreed, vaccinating air travellers that.

It would stop spreading overseas. Losing friends stupid shit can’t control makes want give safe. ""We spend days making people happy get judged everyone. lot vulnerable clients can’t create bonds real life, human. We’re lawbreakers. law criminalises us. recognised are. normal people. pay council tax. someone’s neighbours. aliens two heads.”

Jesus Christ decriminalize already far vaccines proved effective stopping severe symptoms. Moderna Pfizer Oxford Russian, Chinese vaccines approved US EU.  think fair say vaccine developers knew expect J&amp;J would different.  
What I'm curious know, many ready deliver get approved 3 4 weeks. 50 million ready go? states remove red tape get arms quickly? Another way look infection (not case) fatality rate steadily falling throughout pandemic. Originally estimated high 3-5% CDC studies saying closer 0.25%.

I'd like see study puts US's IFR 0.25%. calculations show 0.67-1.24 (95% CI). well line IFRs calculated upshot every sick person presents case many people cases instead asymptomatic mildly ill see doctor.

Again, number people remain asymptomatic fairly small. one study shows this. meta analysis study 20,000 follow ups showed 17%. suggesting number infections 20% higher number cases? see case.

Why can't see case? lot easier case imagine herd immunity somehow kicked North Dakota seroprevalence showing 10.7%. look Manaus Brazil example. seroprevalence 44-66% September held model first place achieve herd immunity natural infection. Guess happened right paper hit biorxiv? Another large spike cases. Yet, somehow, we're supposed play make believe assume North Dakota, 10.7% seroprevalence, must feeling effects herd immunity place 44-66% seroprevalence manage achieve herd immunity? 

I'll tell happened North Dakota what's going happen. cases began spike, mobility shifted downward 18%. caused cases drop wave subside. waves basically every place last 2-3 months see similar patterns population... Cases increase, people start worry, reduce mobility, cases go down. Toward end year, Thanksgiving, Christmas, New Years. increased mobility lead another increase cases but, time less impactful (because mobility went back decreased levels shortly after) beginning vaccination. We're already starting see uptick cases North Dakota past weeks (from ~90 low point ~300 currently). thing see South Dakota, Wisconsin, Minnesota, Montana. expect see next wave mobility increases stays level increased rate (unless vaccine distribution picks up). good cook make damn good Tamales. even dirt poor Abuela put shame. making big decisions potentially dire consequences, faulty data (if actually true). Maza made?  

## Abstract

Background: Lopinavir/ritonavir, lopinavir/ritonavir-interferon (IFN)-beta-1a hydroxychloroquine efficacy COVID-19 evaluated, detailed evaluation lacking. Objective: determine efficacy lopinavir/ritonavir, lopinavir/ritonavir-IFN-beta-1a, hydroxychloroquine remdesivir improving clinical, virological outcomes COVID-19 inpatients. Design: Open-label, randomized, adaptive, controlled trial. Setting: Multi-center trial patients France. Participants: 583 COVID-19 inpatients requiring oxygen and/or ventilatory support Intervention: Standard care (SoC, control), SoC plus lopinavir/ritonavir (400 mg lopinavir 100 mg ritonavir every 12h 14 days), SoC plus lopinavir/ritonavir plus IFN-beta-1a (44 micrograms subcutaneous IFN-beta-1a days 1, 3, 6), SoC plus hydroxychloroquine (400 mg twice day 1 400 mg daily 9 days) SoC plus remdesivir (200 mg intravenously day 1 100 mg once-daily hospitalization duration 10 days). Measurements: primary outcome clinical status day 15, measured 7-point ordinal scale. Secondary outcomes included SARS-CoV-2 quantification respiratory specimens safety analyses. Results: Adjusted Odds Ratio (aOR) 7-point ordinal scale favor investigational treatments: lopinavir/ritonavir versus control, aOR 0.83, 95%CI, 0.55 1.26, P=0.39; lopinavir/ritonavir-IFN-beta-1a versus control, aOR 0.69, 95%CI, 0.45 1.04, P=0.08; hydroxychloroquine versus control, aOR 0.93, 95%CI, 0.62 1.41, P=0.75. significant effect SARS-CoV-2 RNA clearance respiratory tract evidenced. Lopinavir/ritonavir-containing treatments significantly associated SAE. Limitations: placebo-controlled, anti-inflammatory agents tested. Conclusion: improvement clinical status day 15 SARS-CoV-2 RNA clearance respiratory tract specimens studied drugs. comforts recent Solidarity findings. Registration: Funding: PHRC 2020, Dim OneHealth, REACTing prefer tamales Guatemaltecos. grew eating tamales made Mexican Guatemalan abuelas Guatemalan ones always favorite. I've heard many absurd theories. Yes said ground corn different texture maza normally wouldn’t eat baked goods brought families I’d make exception tamales Here’s napkin math you:

We’re currently 2.5 doses per 100 people US, that’s 29 days vaccinations. 20 days left January, vaccination rates US seen big increase past week so. We’re currently vaccinating 700,000 people per day now. Assuming doesn’t increase all, that’s 14 million doses given end January. Add 8 million doses already given we’re 22 million doses. that’s 6.7 doses 100 said done. pedantic, Barnard Castle actual castle (although castle, presumably owned English Heritage National Trust).    sure. nursing lounges overflowing pizza donuts ordered via delivery public Pfizer even made raw data public. no, scrutinized medical undertaking ever. could look data ourselves. 1300 30 million

