,date,text
And I'm sure breaches debated Rodgers interviews without mask, year long. kids appointments Tuesday! I'd also like add seeing lot conflicting views twitter - seems everybody wants mandate also wants covid stick around? confused lol. I'm woman, got Pfizer mild sore bicep. interfere daily activities, including workouts. think get vaccine glad done with! thread Aaron Rodgers, guy made quarter billion dollars even counting endorsements. think bought horse paste think likely pills meant humans? 

Either way, taking it, I'm certain he's taking human pills. Ivermectin, addition used horses, used humans. Plenty medications taken also used animals, mean took animal medicine. 3rd convincing fall last 3 months, low last 2 got. 

Hopefully one like last 2, guess waits seen. current rate decline enough cause drop daily AY.4.2 cases though, sustainable unless decline speeds up. 

(10% weekly decline currently, whereas AY.4.2 20% weekly advantage Delta)   Good.  Go join Trump. See ya distant future 😂. Oh, begging dying. 
#bonvoyage Scott Gottlieb believe hit nail head fight federal OSHA mandate unfolds, remember 80.5% responsible adults 18+ already least one dose Covid vaccine. level need get to? OSHA provision accomplish? less divisive ways achieve goals?  risk organized opposition OSHA mandate starts bleed broader opposition vaccination vaccine mandates generally, mandates society long embraced become part new political fashion. whole generation starts turn vaccines.

&amp;#x200B;

Edit - add know states required vaccinated attend public schools/universities jobs. experience seeing people 12-21 vaccine resistant moment, know whats driving observations small geographic area. could expand answer?  could say antiviral virus lol not. They're 100% correct. Vaccines oldest medicines still use, mRNA vaccines different live attenuated virus dead virus vaccines. mechanisms extremely well described, furthering skepticism worse antivax, especially vaccinated person. fact try label concern trolling ""nuanced thought process"" adds insult injury. hope never get another harpua. read article? unyielding COVID zero policy destroying Chinese people. need help. keep bringing size, odd. guess closeted, antisemitic, antivax conservative likely bullied physical appearance grade school. Feels marginalized society, bonds conspiracy theorists fellow “truthers” online fit in. feel sad stop responding. hope get help desperately need. Best luck :)  U.K. everything open fully time, rates falling (although high) boosters sped think well worst Meh, vaccine still better job this. People always going “be dumb tough out”, go hospital get prescribed. True. However also disingenuous claim covid affect children, Delta variant caused significant increase number children affected. Children also susceptible underlying issues, especially vascular, affect later life, well MIS-C. concerns even asymptomatic children.

Children manage get covid shown much contagious adults, means also concern vector spread rest us. Especially school, clumped together, sent home spread others. 

With covid though, concern stopping mutations popping up. also work schedule. second shot knocked day. planned around that. day relax make sure OK work. know people booster. rocked like rocked second shot. Others handled well. vaccine created quickly hasn’t long see long term effects.

Unless provide proof MRNA vaccines caused long term side effects leg stand on. 

It’s opinion anti-vaxxers vs opinion medical professionals. 

It’s apples apples. Vaccines benefit person getting it. Vaccines benefit everyone.  Idiocy differing opinion. idiocy. literally horse dewormer.

It literally [human addition used horses. People taking covid effective, human medicine, cannot argued. kids pay price arrogance ignorance. There’s human version Utter, utter nonsense. Maybe ivermectin stans got supply horse preparation, ridiculed. Ivermectin -actually- horse dewormer. 

It -actually- [human too. Wow, took what… less ten replies bring Jews? Get help dude, you’re really fucked head. COVID vaccine claims reduce spread get virus less severe symptoms    It’s misinformation it’s true: the…horses…mouth. speak. literally horse dewormer. That’s people ODing it, cause taking recommended horse dosage. U better chance child 18 get stabbed death Chicago die COVID Whenever someone claims they're anti-vax usually are. Yes that's normal immune response. antibodies short term protections cells long term. Antibodies fighter planes cells factories. threat gone body longer needs produce fighters factories still stick around threat emerge fighters quickly go back produced  it’s anti-vaxx nonsense. Ivermectin -actually- horse dewormer. 100% true. anti-vaxxers claim shot killed people COVID itself. There’s world difference. He's suffering reperconcussions. don’t care long stay away family. You’re dirty people. feel ya. wife working covid floor designated surge hospital since beginning (Feb 2020 so) boy oh boy stories tell... early thought we'd alienated position risk carries. Never would expected alienated accusations part conspiracy!

By way actually currently covid, first time. vaccinated (Pfizer) December 2020. works too, want go road. US judicial penal system atrocity.  Please, please, learn Norway. ""Dropping like flies"", 600 children age 18 died COVID since beginning. mention majority children either extremely malnourished infants children obese. 
Source: CDC.gov   Someone told weeks back didn’t know could people ten years. 🤷‍♂️ ok man. you. buy it, hope fucking expensive entire pandemic teach us bit humility figuring causes predicting caseloads.

Everyone predicted back-to-school would crush us, much country seen decline period. thought might vaccinations took Delta hit. Modelers even best epidemiologists times making guesses.

So naturally, I'm going take guess here.

It looks like Delta wave got really concentrated south Texas Florida, ever since, there's wave permeating two locations. First whole south (who got rocked hard low vaccination rates), mid-Atlantic lower Midwest, upper Midwest mountain area, even see beginning inklings spread California.

Of course, lots great experts wrong I'm guy... guess. that's antibody production works... takes week kick production up, stays months going dormant again. intend get booster Thanksgiving, get now/as soon can. time end November comes, antibody production highest giving best protection Lol, brainwashed, mainstream media - total loon suspected. Say hi JFK Jr next time see 🤦🏻‍♂️🤦🏻‍♂️ post appears vaccines. encourage read helpful resources COVID-19 vaccines:
  
[Vaccine FAQ Part FAQ Part appointment bot, action performed automatically. Please [contact moderators subreddit](/message/compose/?to=/r/Coronavirus) questions concerns.* Ah yes mandate vaccine virus literally killed little 600 kids almost two years compared hundreds thousands age group forced aren’t really forced. could always find new lines work start business. crowd saying it’s simple everyone else decades, don’t see can’t hold standard now.  6 year old got yesterday evening! wait till second dose 2 year old get it. Sad thing is, depite records, point future, define Aaron Rogers.  Vaccine literally stop spread failed one designed purpose yes let's continue blame taken instead actual vaccine Right? sons medication chronic illness 78k per year without insurance. should. dumb. Nobody forcing anyone get last months happened assholes get begin with. People say straight liars. understand want Thanksgiving, there's reason wait want now. There's plenty go around everyone. nothing like jumping line earlier year supply constrained. quite r/byebyejob step direction.  Thank so, much. I’ll referring every time someone brings “bodily autonomy” argument. almost 2022. Quit pulling information papers published first fucking half 2020, back knew next nothing virus's transmission compared now.

Wait, saying risk children higher previously thought? heard yet, considering vaccinating kids (due increased myocarditis risk children, especially boys). COVID risky previously thought kids, vaccinating probably good idea. link read more? Yes companies, mine included, decided deal logistics testing employees weekly basis mandating vaccine everyone. winter surge started around September last year, already fairly apparent October  Absolutely one other, keep apologizing unvaccinated - sounds like you’re probably one yourself, certainly simple minded enough.  got kid vaccinated walgreen. feel like huge burden lift shoulder. Everyday goes school, worry. least protection now.   seeing doctor long covid? Thank you, appreciated. figured I'd get downvoted, felt good type out. take Pfizer. got Moderna. First shot mild sore arm. bad all. 2nd shot arm sore enough get take Tylenol usually tolerate pain pretty well. day half mild body aches fatigue fine. awful. Others worse better. Worth though bit piece mind. It’s sad you’re downvoted saying this. criticize Ivermectin COVID treatment without resorting misinformation.  available without prescription horses &amp; livestock Tractor Supply everywhere. That’s many antivax pillage small town supply stores Bc didn’t need script. Pfizer better women. Bizarrely, J&amp;J serious adverse reactions women, Pfizer/Moderna men. still ludicrously rare, though; there's need nervous.   dad diabetes sister wont get 7 yr old son vaccinated goes school brings covid home I’ll fine im vaccinated think dad die diabetes high risk unvaccinated Sorry loss. feels profoundly wrong, like murdered. common allergen Pfizer vaccine polyethylene glycol. It’s bunch non-vaccine things allergy rare.

Flu shots completely different. Reacting flu shot mean react mRNA vaccine.  recovered infection naturally seroconvert? heard anyone say before. source could read it? 
 
I know vaccine effective hospitalizations mostly unvaccinated. gripe vaccine claimed CDC director protective natural immunity seems contrary current facts. 
 
That's good point nonstructural proteins something considering, thank you. long term ramifications little scary, given know much yet. Ok dude, let know feel loved one gets covid braindead nurse thinks vaccine tracking whereabouts… whatever else results someone intelligence level provides medical care vulnerable person. people dangers society dangers people they’ve vowed protect. countries aside Korea, Japan, Israel promising ""living COVID results ""? Oh man… pour drink prepare crazies.. jeezus imagine it.. *shudder* heard wrong. That’s worry - delta worse kids, let’s prevent even terrible strain getting foothold. Sure, Covid hasn’t impacted kids much adult, could easily become childhood disease. mention kids asymptotic carriers could infect unvaccinated vulnerable. awful unvaccinated kid picks Covid school infects adults love resulting death. 

My 6 year old autoimmune disorder getting vaccinated days. Finally!! need vaccine 4 year old. parent kid kid's class deadass said vaccines causing mutations, lmao. claims work healthcare.   That's right, people need drop overly simplistic view situation. kids targeted first variant, people think important focus kids, absolutely is. Like said, asymptomatic people often end long-haulers. We're gonna end entire generation disability.  3% getting meningitis way way different symptoms kids experience covid. Covid disease younger people deal well, affected everyone like under-18 year olds would barely registered novel disease anything significant pediatric formulation vials kept refrigerator 10 weeks. enough vaccine it’s ok open vial even won’t used completely. logistical challenge.   Funnily polio vaccine (OPV) known cause polio (pvdp) others around vaccinated person. still used US til 2000 used parts world. Better covid deaths children. think going end working, least foreseeable future, backup treatment kind people wealthy important enough already getting tested constantly. don’t many doses ones pretty costly work get early, don’t see helping lot normal people. $700 taking pill day five days... month intubated ICU bill million dollars.... damn, difficult choice make.... rush me..... 68%. Better average, delta still lot work with. don’t know you’re talking about. Children still get polio vaccinations. kids 9 7 children school requirement attend. keep telling everybody turn around them. think deserve raise facilities staffing levels terrible threaten walk get raise. options give raise use staffing nurses far expensive, less reliable, unfamiliar facility. They're position make demands. got nice raise said giving any. 

It's timing though. waited crisis mode strike. Everybody burnt want pick extra shifts, office nurses getting thrown floor, traveler's bailing last second, etc... happy sprung really care. Huh? childhood vaccines directed viruses (polio, measles, mumps, rubella, varicella, hepatitis B, rotavirus) vaccines decades old first required. no, none diseases higher mortality rate except measles. Actually except measles COMBINED killed fewer children year vaccines introduced Covid has. nine vaccines prevent disease completely. almost everyone vaccinated. measles outbreaks vax rate drops 95%.  article completely misguided. Young people taking third doses taking away seniors getting them. helps protect seniors.

The real question percentage seniors gotten third doses far. State Farm next. sounded like typical Old man bar explaining government trying kill you. hey don’t smart play football  *that* uncommon someone test positive seroconvert.

Here's big one:

[Intrafamilial Exposure SARS-CoV-2 Induces Cellular Immune Response without 


Also: [Reduced seroconversion children compared adults mild [Vitamin status seroconversion COVID-19 UK healthcare workers isolated COVID-19 like symptoms 2020 much less common (1-2%) someone vaccinated seroconvert. Now, antibodies whole immunity, still, vaccine derived immunity much reliable, especially already long term ramifications little scary, given know much yet.

The long term ramifications infection? Sure. There's ton know damage infection do. Vaccination? one protein, know does. Billions vaccinated, many three times. got rocked second shot, third shot much better lower dose, sore arm fatigue. job make Biden fail way can. Zombies called action.   Oh she’s worst Aaron lol. Fans start telling play, since they've also done research.  I’m thankful that. people want get vaccine it’s choice. Boo hoo It’s like seven hundred dollars course there’s barely it. Nobody ever met going anywhere near stuff long time.   about? There’s nothing wrong homeschooling. parents want kids homeschooled public schooled that’s choice. Russians involved?  misinformation, coming schools closed last year wasn’t apparent much problem Covid kids.  be. Breakthroughs happen.

But willfully protecting asking Joe Rogan medical advice catch pretty fucking stupid.   No, allows lower dosage, effectiveness raised. Also, mRNA isn’t provoking immune response safer. Fucked around went Walgreens, appointments spread 15 minutes apart...and still long wait. mean like day half, big deal.  abiding safety standards unvaxxed participants. Saw post lady killed kidneys using mild case covid killed kidney damage. ridiculous.  Cause reasons

""It's new, require decades study think another reason opposed."" we’re told meet requirements. pharmacy isn’t hard coworkers worked places like Walgreens required 100 shots day certain periods time else chastised marked. Polio caused paralysis &lt;1% infected virus.

Covid caused deaths children mumps, rubella, polio, hepatitis B, rotavirus, Hib COMBINED year vaccines approved. require 2 doses. We‘ll find many doses required go along- scientific process real time- # doses never mattered, it’s whatever takes.

Efficacy preventing severe disease death held well far, likely even better 3 doses.  took LONG time get cops wear Kevlar tbh it’s requirement vaccine work?    go effect? 100% believe curious recent trend long held policy. Masks helping spread flu colds known, proven, quite time. sure think that’s misinformation Time take government mandated pills john!!  That's want get lawyer shake someone money. 10 year old talking getting vaccine now. even showed news article school Chromebook approved kids. appointment next week. Vaccine mandates would less burdon kids wearing masks day effective.  would choose vaccine mandates mask mandates, k-12 kids get vaccinated now.  would mask mandates things really bad, means I'd basically never now, considering kids less risk covid vaccine vaccinated adult.  vaccine, risk almost certainly gonna ridiculously minor them.  I'm kinda stunned places mask mandates instead vaccine mandates. There's logic it. kids get seriously ill night asymptomatic pass CAN'T get vaccinated vaccinated greater risk... Nevermind fast thing mutating. flu vaccine lot less effective. best years, it’s 40-60% effective. bad-match years aren’t unusual lower drastically.

The main covid vaccines around 91% effective young kids. Even higher kids 12-15. last, we've lost many children.... Kansas supervision homeschooling. sign paper saying teaching home state says, okay cool, send kids school anymore.

And never check kid. Almost recognized major religions advocate vaccinations though. live society. know folks going lose minds, fucking love it. Parents tire missing work searching babysitters 1st initial fits. vaccine free reduces chance need take expensive drug. people like anything new. measles vaccine tested 400 children New York approved months later.   OP post r/NFL please. Execute order 66. January long, it’s still holidays. I’m sorry it’s available kiddos. helped initial disease stopping spread infected. delta variant.

HOWEVER, missing key bit information. Vaccinated people get infected much less often, so, since vaccinated people get infected less often, spread virus less often. yet people saying they're happy get covid jab since cause blood clots. Make mind. 🙄 regional assume?

Here New York went onto Rite Aid's website scheduled booster vaccine next day issue. five minutes. 

And already scheduled 5 year old first shot Monday. appointments available day week.  There's 1.4 billion people china, even fully developed nation assets.

With collectivist mindset inevitable I'm currently reading old newspapers dissertation research schools Virginia. finished 1920s started mandating vaccines first time. Specifically child enrolled schools, public private, get smallpox vaccine diphtheria toxin-antitoxin (that one bacteria slightly different used today). parent complaints, newspaper refused publish announcements single editorial praising new state law. Parents pay vaccines (25 cents smallpox, 10 cents diphtheria), appear financial aid, kids allowed attend school without them. exceptions. Half vaccine clinics held churches, half schools, many families would travel miles way get clinics.  even anti vaxxers. Even people others childhood balk idea covid vaxx. research those, research one cus new? Huh?

But I'm sure still get tetanus shot need booster. maybe even flu shot.

Give break. 🤦🏻‍♀️   curiosity, private school local public school policy? qualms requiring COVID vaccine public/private schools. flu shot optional K-12 three states I've lived in. childish. seems like getting loved ones initially vaccinated much easier getting boosted. I’m struggling convince around receive booster. one wants get another dose within months last one. husband received JnJ spring won’t even entertain getting booster unless it’s annual thing. That’s basically opinion rest family well (some Pfizer, Moderna). you, child? Get together act like adult. Israel highest vaxxed nation all. fast vaccinating looked like first get herd immunity first, slowed drastically applying argument actually highest vaxxed countries. actually first case:   work technically eligible booster shot. waiting people really need first. planning 2ish weeks. walk cvs get one. happen link? find anything like that. press releases find said included vaccinated people study.  flu shot mandatory?

the flu dangerous children covid is. live idiot. Look US. Vaccine mandates work - people cry like little babies, protest, moan “rights” 11th hour, vast majority comply. ones don’t place working health care removed long ago. don’t care bring duty doctors, students military reserves, figure protect vulnerable. first rule medicine HARM. cannot unvaccinated healthcare worker lifetime pandemic. Get outta crap. answer question ""are vaccinated?"" started word ""yes.""

After said immunized. could taken another word vaccinated. important thing first response question ""yes."" lied. Plain simple. Good   Shh, tell WHO/FDA though. matters bad outcomes. Goddamnit. vaccinated least?

Get antibody therapies meds immediately. Ask doctor.  spokesperson supporting health care organization's health wellness initiatives...

I know healthcare company would partner football player. specialize neurology concussions? really pay attention china, seeing adverse effects? anything like myocarditis? anything? Haha. Oh autocorrect…   Measles different virus since AFAIK, mutate often covid19. new variants covid19 form, doubt new vax developed rolled fast enough(even mandate) prevent variants. Israel example, we're \*probably\* seeing breakthrough cases variants. I’m sure team doctors would’ve monitored him, NFL bunch cowards didn’t mass vaccinate every single person organization like have.

The NBA pulled bubble season impressive, much stupid happened.  Nah, core objection like trust people recommending it.  USA? horses people need drug actual use. hospitals treat misusing drug. I'm really getting tired whole ""well, people vaccinated still get COVID, bother""

For Rogers: hide behind offensive line? get sacked regardless, bother them

For anti-vaxx police: wearing kevlar? plenty officers died wearing bulletproof vests, bother?

etc., etc. wouldn’t be, I’m fully vaccinated try careful. Breakthrough cases happen.

People go office hacking lung ones feel shame (pre covid now!) exactly ones don’t. Thanks advice. Remote medicine becoming prevalent. could video chat doctor, describe symptoms get prescription mailed without leaving house. true. propaganda work, i.e. everyone get :) Ivermectin sort magic bullet. I'm aware single study indicates anything help clear severe case COVID mandated country? Yay  understanding vaccines use N1-Methylpseudouridine actually increases vaccines safety efficacy.  poor excuse man. Oh good, sounds like obvious solution then! No. doctor determines mature enough understand consent procedure. direct contravention parents wishes patient final say. However limitations, simple vaccines becomes complex procedures.  live DC there's indoor mask mandate yes annoying. packed bar maskless, gym one near you? Lol nope still gotta wear gasping air.

To fair really mind wearing places like metro doctors offices, lack enforcement consistency really annoys me. hope end mandate January. record I'm concerned mask mandates they're required office next week become optional. They're still required indoor public businesses except eating drinking (California). know it’s hard understand, it’s simple labeling everyone antivaxxer. I'd say Q3 Q4 2022, need treatment reach hands EVERYONE, EVERYONE mean EVERYONE.

Please, please, anybody willing take vaccine, FINE, choice. please, get COVID least give treatment benefit doubt. unvaccinated people want take vaccine hospitalizations keep surging restrictions still place 19 months later, decide take vaccine decide take pill either, beyond lost cause. guess effect seasonality vastly underestimated large degree randomness. Makes intuitive sense that, since transmission outdoors ~18x less indoors (think that's latest number I've seen), average temperatures get ever slightly colder, small increase time spent indoors could lead disproportionately larger increase cases.
  
As far randomness goes remember reading one article making decent argument viruses studied parallel with/relates heavily chaos theory. instance, double pendulum (look video youtube) start flipping almost randomly compared another double pendulum started almost starting condition, slight difference. correlation Covid slightly different initial conditions lead vastly different outcomes. even places similar NIP's, vaccination rate, populations etc. may possible merely chance one group gets statistically ""unlucky"" speak (superspreaders, abnormally high (yet statistically accounted for) higher transmission certain situations)) leads different caseload/pandemic trajectories. course compounded week week could accentuate slight initial differences. instead talking hypotheticals, let's look real world examples. Israel 80% vax rate 12yr old population, highest nation. June, several days zero new COVID infections, re-opened(coz hey, covid's cured right?) within 2 months, surge new cases, almost peak. think happened? Worms got rough days. probably can, end well many workers Florida it’s listed anti-viral. I’m physician. human anti-viral utility anyone says quack. Agree messaging complete garbage day one. cdc destroyed trust general public. Finally, yes go get 3rd booster it’s least 6mo, definitely 8mo since 2nd shot saying sitting USA?

If australias rate ""pathetic"" word going use describe USA's? (~57%) Makes sense, kids dying left right shit. saw plowtruck go remove bodies streets. good. Good. childrens' elementary school Connecticut requires flu shot annually.

