,date,text
0,2021-06-21," stay inside day make sure get skin cancer, rates pretty high Australia. mean ""that guy"", even rate, it'll take 150 days vaccinate entire country looks grim since real possibility third wave. 

given stupidity government, number might encourage throw precautions air. something worried about. we're even best worst. hope proud True. think going take care itself. surprises even Florida observed mask compliance indoors.   I'm vaccinated, proposing something personally would deeply uncomfortable seeing happen vaccines mandatory, guess people's choice... Let’s homeowners residencies, otherwise rich homes.  estimate 30% show symptoms: you’re going get again… brilliant, succinct assessment anti-vaccine culture America, along note absence national will. wrote week ago, America lost spirit collective purpose. We're longer rowing direction. 

There's always strife country, galvanizing moments, circumstances focused collective energies way reaffirmed commitment American experiment. COVID-19 supposed one galvanizing moments, opposite happened. Rather come together can-do, ""We win fight"" attitude, turned other, spurred leadership emboldened fringe element within ranks challenged concept medical science, somehow succeeded winning argument simple injection edge-case doubt. long there's people trying get everyone like Texas Florida Meanwhile, Virginia old law wearing masks illegal coming back July. Lovely. went full lockdown many months understand Russia agin population ones get sickest also likely ignore advice COVID cases symptomatic, talking about? creepy 9 dead one day UK COVID 4 days ago. absolutely finding number 300 dead ""Acceptable"".   Uh, still 7,000-10,000 cases per day.....(?)  logic is...not smart. 

When cases 0...then yes, would over. around 10,000 cases per day, worse half countries world, population. Literally half world. People here, like general population, seems poor uninformed viewpoints virus. test here. It’s definitely CA probably outpace it’s Canadian presence aggressive reopening Oh thought cytokine storm experienced someone covid, post vaccination. Although, I've heard blood clots formed take vaccine soon recovering covid. understand skepticism Russia.

""HI, I'm vaccine""

""Okay, criticized Government last 6 months?""

""Yes""

""Left door""

""What hadn't?""

""Right door"".

""What's difference?""

""Well, either way safe Covid, I'll tell that. NEXT!"" higher, reddit loves hating US. Nice !  Every country* CDC website says get vaccinated you’ve covid. don’t know long natural immunity lasts effective strains. info vaccines, it’s complicated. not? I'm exactly I'm ""at risk"" demographic. Male, second dose, 19-25 Again, saying bad job, actual difference plan Trump's? bullet points remained (even Fauci said 70% same).

Like, really think much President case, Biden have, one points would different different administration. 

Plenty things different, yes. vaccine rollout really presidential task. shouldn’t hold second dose reason Jesus Christ, standard? tested, nobody died it, sure, matter? earth? Brazil. Unfortunately. ""ehh, brain tissue can't important, right"" - Anti-vaxxers Sign vaccinateme.in alerts. required, hardly anything. Less 2% decrease cases 81-100 days mask mandates implemented. Follow science.


""During March 1–December 31, 2020, state-issued mask mandates applied 2,313 (73.6%) 3,142 U.S. counties. Mask mandates associated 0.5 percentage point decrease (p = 0.02) daily COVID-19 case growth rates 1–20 days implementation decreases 1.1, 1.5, 1.7, 1.8 percentage points 21–40, 41–60, 61–80, 81–100 Ontario 66% people vaccinated it’s cases plummeting.

How still lockdown? good context! lol many stupid fucking Americans. Interesting. know public/flagship universities colleges requiring students staff fully vaccinated go back campus fall. find 25% way high. hope isn’t discussed country point don’t want take debt. Everything would get paid back.  post appears vaccines. encourage read helpful resources COVID-19 vaccines:
  
[Vaccine FAQ Part FAQ Part appointment bot, action performed automatically. Please [contact moderators subreddit](/message/compose/?to=/r/Coronavirus) questions concerns.* *twiddles thumbs teacher district stopped requiring face masks* chloroquine/hydroxychloroquine still discussed early treatment option country? Covid seem spread eating. can't survive stomach. happened emergency CDC meet regarding heart information? held second dose till meeting. result come birthdays significant source spread? 

Then published. Null result studies rarely do. Especially contradict public health policy.  'little thought' - That’s good hear. Wasn’t aware UK decent data yet. make produce vaccine passport want buy avocados, kale sriracha. Young people love avocados. People voted I've always thought govt tied vaccination bonus relief payout. One, plenty people could used money two, would probably get additional 20-25% population jump vaccine asap.

Thanks answering. states, parents consent children get vaccine. There's like one two require that, remember is. look it. Depends lot factors, mostly morality, likely it’s type coronavirus. completely uneducated thought, vaccinated reason worry. point protected ever be, go back normal. 

I hate parrot many ""hoaxers"" saying beginning this, vaccinated really able treat ""like flu"". Look, can't go around wearing masks large public gatherings forever Covid there. Get vaccine done it. assume folks need valid reason? many talk (in south) isnt even debate immediately shut attempts discuss it. Happens younger people too. Young people love blaming ""boomers"" problems even guy making decision 50s. vaccines available every drug store, including grocery stores, kind makes megasites unnecessary.

They necessity one point, kind outlived usefulness. way avoid this.

Maybe series needles, weeks apart.

Hmm.  Many probably virus already too. camp hurry get vaccinated. people change mind something really change mind (in case vaccination), applauded supported.

This commissioner kind person might reach holdouts. 

I got vaccinated day one eligibility. hold outs don’t give damn someone like thinks. would amazing. vaccines there, better. bunch different things, Federal distribution plan messaging. implication tongue cheek remark. Something like 30% new covid cases US Delta variant, diagnosed last two weeks.

Scary shit. Pretending pandemic gonna get lot people killed.  That's smart. Vacation last place want cold. Exactly Aunt Alberta EU. post appears vaccines. encourage read helpful resources COVID-19 vaccines:
  
[Vaccine FAQ Part FAQ Part appointment bot, action performed automatically. Please [contact moderators subreddit](/message/compose/?to=/r/Coronavirus) questions concerns.* problem everybody fix; long vaccinated, done part. Fine me! Yeah, mask wearing 1 10 grocery store. I'm going go ahead call bullshit report given Japan sitting cool 7.3% vaccination rate trust Western medicine. That's fine. I'm tired getting cold every time fly. less silly shoe stuff. Singapore already 50%. Singapore higher percentage US. Paul Offit, vaccine safety monitoring board, said vaccine-related (symptomatic) myocarditis occurring 1 50,000 young men.

This smaller study, showed COVID-19 causing symptomatic myocarditis 1 every 300 college athletes: 1/50,000 vs. 1/300.

That rate aligns pretty well we’ve seen major sports leagues well. NBA, MLB, NFL one two guys myocarditis COVID-19. contrast, haven’t heard major sports athlete myocarditis vaccines (I don’t know MLB NFL, know NBA players pretty highly-vaccinated point, super-prevalent issue, think we’d seen now).  20 million....  CDC needs issuing press releases...  clickbait headline writers flogged.  Keep eye it, way valid reason get vaccinated.  Yay, India! Prayers go everyone India right now, hopefully get together. definitely good news. :)  add, flu available vaccine years anyone 6 months old still many deaths. free offer everyone Pfizer second dose case. Don’t ask 40’s (in Uk anyway) take risk one vaccine another exists risk (or close enough) simply everyone else go bit sooner. true Abstract 
It recently hypothesized vitamin K could play role COVID-19. aimed test hypotheses low vitamin K status common characteristic patients hospitalized COVID-19 compared population controls low vitamin K status predicts mortality COVID-19 patients. cohort 138 COVID-19 patients 138 population controls, measured plasma dephosphorylated-uncarboxylated Matrix Gla Protein (dp-ucMGP), reflects functional vitamin K status peripheral tissue. Forty-three patients died within 90 days admission. patients, levels dp-ucMGP differed significantly survivors (mean 877; 95% CI: 778; 995) non-survivors (mean 1445; 95% CI: 1148; 1820). Furthermore, levels dp-ucMGP (pmol/L) considerably higher patients (mean 1022; 95% CI: 912; 1151) compared controls (mean 509; 95% CI: 485; 540). Cox regression survival analysis showed increasing levels dp-ucMGP (reflecting low vitamin K status) associated higher mortality risk (sex- age-adjusted hazard ratio per doubling dp-ucMGP 1.49, 95% CI: 1.03; 2.24). association attenuated became statistically insignificant adjustment co-morbidities (sex, age, CVD, diabetes, BMI, eGFR adjusted hazard ratio per doubling dp-ucMGP 1.22, 95% CI: 0.82; 1.80). conclusion, found low vitamin K status associated mortality patients COVID-19 sex- age-adjusted analyses, analyses additionally adjusted co-morbidities. Randomized clinical trials would needed clarify potential role, any, vitamin K course COVID-19. View Full-Text 
Keywords: vitamin K; COVID-19; SARS-CoV-2; Matrix Gla Protein; elastic fiber; thrombosis I'm celebrating it. I'm completely indifferent it. want protect yourself, that's fine. Nearly everyone access vaccine point, protects rate 88-96% illness nearly 100% hospitalization death. 

I've protected (and others). I've done can. I'm done worried others stupid get shot.  right, 21%. Brain fart. 

And fire hazard. Occasionally patients home O2 would show ER trying smoke cigarette wearing O2, they'd burns expect. 

Luckily people usually trying light smoke hospital. Look graph posted. US different Australia, France, Germany South Korea title kind clickbait. However, glaring Russia much vaccine hesitant others US slightly hesitant rest gives second place. need go back Canada fully vaccinated, worried higher prevalence delta variant Canada compared California… Good news I'm totally pro vaccine would happy see vaccine passports activities. I'm anti government mandated medical procedures. idea mandating injection adults America unrealistic insanely unpopular, despite effort. flu shot considerably less effective covid shots. got unbelievably lucky things! I’m Wisconsin. Scott Walker drastically reduced abilities unions fight us. Also public health dept said less six feet thing fine long kids wore masks school year. guess don’t care anymore. live student household 
 
Ding, ding, ding. 

Sharing house breathing air, going pub caught covid. One brought household huffed fumes. = science = bad

It's never simple.

These people see everything terms politics. them, vaccines science; they're politics masquerading science.

There's long history kind thing; science always gets rejected conflicts politics, even people would otherwise trust it. 1930s, German government loved science used German scientific advancement evidence national superiority. science came wrong ethnic group rejected. Soviets loved using science advance cause, threw bin contradicted ideology; Darwinian evolution went political beliefs, rejected favour Lamarckianism. don’t see 60 elderly. 70 feels elderly me. explain works like I'm 5 help tell un-vaccinated friends. couple topics always bring discussing ""vaccine.""

1 --- vaccinated worry un-vaccinated? would someone else's health affect boosted immune system? 

2 --- True false? vaccine mitigates potential symptoms? so, societal benefit someone feeling sick deciding walk around public spreading hidden disease.

3 --- find driving around, alone still wearing mask? might say equivalent wearing condom jacking off. Yup share multiple symptoms things easily confused. submission automatically removed linked source may reliable may dedicated mostly political coverage. possible, please re-submit link reliable non-political source, reliable news organization recognized institution.

Thank helping us keep information /r/Coronavirus reliable!


*I bot, action performed automatically. Please [contact moderators subreddit](/message/compose/?to=/r/Coronavirus) questions concerns.*  submission automatically removed linked source may reliable may dedicated mostly political coverage. possible, please re-submit link reliable non-political source, reliable news organization recognized institution.

Thank helping us keep information /r/Coronavirus reliable!


*I bot, action performed automatically. Please [contact moderators subreddit](/message/compose/?to=/r/Coronavirus) questions concerns.* Yeah, semantic failure part. didn’t realise needed include covid context every statement thread. get magnetic, chipped, 5G, sterile, get immunity Covid-19 vaccine without worrying passing community. live that. also benefit. many deaths still sad ... we're seeming plateau bit Illinois. still rough - people still need get vaccinated.  Ugh, vacation planned Ft Lauderdale next month making nervous. I'm full vaccinated though Yeah, realised rephrased immediately.

Cheers They've super strict lockdowns though. think they'd want make sure happen again. also island people don’t want get vaccinated around age (30), figure get Covid won’t get sick compare obese elderly person. Telling someone grow *absolutely* insult. vicious one, still.  No, argument there's enough immunity vaccines plain old exposure finally stop using masks lockdowns situations. Vaccine induced protection nature provide high level antibodies lungs nasal passages compared actually caught covid breathing in. means high enough viral load covid could last long enough people cause loss smell/taste symptoms much lower degree. 

Which adds 'We really know maybe super unlucky'. *always* secondary broader issue.

In cases, relates deep mistrust authority. think people charge societies bad criminal (and understandable people would reach conclusion, given mess they've made recent decades), trust kind medicine try convince take. inherently authoritarian nature covid lockdowns makes issue worse: certain section population, fits narrative whereby government takes away freedoms, waits people desperate anything get back normal, offers convenient solution. poke kinds holes logic, motivated reasoning lead people astonishing conclusions.

And another poster pointed out, people become deeply entwined sense identity. cases need kind coherent reasoning behind it: vaccines become associated ""the enemy"" point they're practically thing, vaccination programmes constitute personal attack people love. must gone weird place Mexico I’ve never heard people locking eclipse live there…   Wonder hesitancy Russia distrust Western vaccines disinformation campaign distrust government Sputnik V. precipitous drop COVID deaths happening without masks lockdowns. 

Is another one arguments masks lockdowns useless? way stop preventable deaths. simply impossible. One, sure. All, way. lot people seem think it’s “boomer” older person thing get vaccinated, outspoken anti-vaxxers know millennials Gen Z. people know 50+ got vaccinated. conservative. elderly people 80s 90s (silent generation) remember time vaccines different diseases (like polio) weren’t available actually pro-vaccine younger generations. seen benefits. know one “boomer” didn’t get vaccinated (not counting previously Covid) says would get one needed one travel another country. 1918 flu ravaged world two years became less virulent. Here's hoping similar timeline covid. One hospitals Texas requiring vaccine employment. Another isn't, way masks non patient areas vaccine sticker badge (just like flu). interested see work - probably depending setting, role carrots sticks.  First Covid doesn’t kill mess up. long term effects still discovered. 

Secondly , importantly, would willingly want part infection chain could eventually kill someone, mutate virus something worse? Idk said illegal yeah mean kinda like...what talking lmao effectiveness vaccine? effective! I'm medical professional, doubt please ask doctor - I've looked lot dad's sake. really folks treatments wipe suppress immune system extent can't form immune response produce antibodies worry. 

People organ transplants take medications wipe immune response body reject transplant. die without medication option pausing it. 

People chemo chemo-related drugs like methotrexate good immune response due drug - usually go medication wait they're chemo rounds get vaccine.

In short, cardiac patients good protection anyone. like said, I'm medical professional, worried dad haha. Nobody’s saying it’s acceptable. it’s huge improvement months ago. think biggest reason United States living peak ""Age Misinformation"". Uneducated folks buy everything social media tells them. Willfully pounding rhetoric spewed conspiracy theorists. get wrong certain theories think hold weight. title ""Theories"".

As soon heard whole"" great reset"" microchip idea. 2 thoughts came mind.

#1 already tracked. Ie* cellphones 
#2 elitists truly wanted common folks decreased large numbers would already done long ago. 

I always ask theorists"" Ok, whats end game""?

I've never recieved formidable response. usually ""Theories"" lot RSV area it’s easily confused Covid don’t think religion really root problem. It’s tool. root greed. 

The billionaires multi-millionaires throw power controlling govt don’t pay taxes businesses regulated. 

To buy politicians, control media etc get message govt inefficient, taxes theft, using tax money help poor communism, greatest thing “freedom” means govt tiny way. 

They fund think-tanks come bunch talking points trick people voting interests focusing things like abortion, immigration, religion. Follow money. Giving followup doses mRNA/subunit primer vectored/inactivated vaccine could effective vaccine have. individual health departments make choice; far Canada done (in part successful vaccination campaign last two months). keep rolling vaccinations going need ongoing boosters knows long. must give level, freedom member community. Unless people shouting “my freedom”, want go absolutely alone, need get vaccinated. opinion, that’s worth. Make sure keep masking. I’m fully vaccinated continued wear mask even though likelihood picking bringing home twelves slim, I’d rather safe. Wait til hear many people die day. TX, plenty people still wear masks indoors. governor idiot, glad see individuals still responsible. Delta shown easily escape previous immunity.  matter time mutates makes current vaccines ineffective, combat this?

Not inevitable, actually nearly impossible virus infects. Stop spreading nonsense idea.  part?

Laws change?

Unclear suggestions impossible?

Or openness hearing others’ opinions?

If that’s psychotic, guess I’m stricken psychosis. Haha, dude nobody saying that. point moving goalposts. acting like provided counterpoint actually completely different point altogether. one chose explain difference population me. distilled single explanation me.  good source vaccinated people catching spreading it?

Of course not.  English word lakh, I’m telugu say Laksha Telugu, say lakh saying English. Depending old baby is, perhaps form PPA/PPD? kid born February 2020 got hit double dose (yay! /s). part PPA, felt like things time, else terrible clearly kid would better without me. know sounds irritational, could convince stop going anything. Thanks devastating news. 

It’s going stop wishing well others though. Sorry hear that! find out? test this? microchip thing easily debunked too. Star Trek Borg level technology. People immunocompromised get much benefit vaccines therefore rely herd immunity. makes anti vaxxers dangerous know people heart disease? believe CAD/hypertension. Yep. anything like last year summer surge people congregate indoors air conditioning. We'll see much combo vaccines natural immunity help suppress surge.  Oh dear friend also happy meet first person talked Australia,Nice meeting 🥰💖 hugs 

Yeah government officials really selfish think citizens rather think making families rich.Hmmmm😭😭😭 map here.

I'm deeply sorry we're talking topic that's black white dead simple one little bumper sticker quip answers everything... check Daily new confirmed COVID-19 deaths per million people  sound psychotic. due respect Right, 100% antivaxxers get variant covid gonna die. vast vast majority people don’t get vaccine going perfectly fine. Coming someone fully vaccinated Yep, that's disease works. outside control world permanently different. 

I advise looking many people die cancer every day 300 figure scares you, btw. know, might lot middle ground ""come back unchecked"" ""leave stranded die alone"". right kid. Stay strong!

My kids risky conditions, new variant coming every week, wearing masks I'm anywhere crowded indoors. Delta variant breaks vacccines

Every variant ""breaks through"" vaccines, they're 100% effective. Delta variant significantly better others. breakthrough happens, resulting infection almost always natural ""immunity"" (which dissipates months, even sure, anti-bodies dissipate 3-9 months believe.)

This speculated since beginning, turns antibodies still around virus 4x stronger original

You made get immunity virus also mutates gets stronger

That mutations work. majority mutations actually produce weaker variants. video game virus ""levels get like 85% recently vaxxed/very recently recovered herd immunity. 45% fully vaxxed...is yet, thus....around 10,000 cases per day still.

This take account natural immunities. pandemic dropping despite reaching arbitary 85% vaccination, even cities open experts saying certain surges fall.

Some are, aren't. Many good track records. know tell this, utopia way people die old age realistic. see delta case numbers. Seems like likely hit vaccine hesitant communities pretty hard. Maybe delta turns around fatalities hesitant become less hesitant.  20% bit conservative number. true play words. educated folks understand getting :) Probably they've done well. see urgency. saying ""not really""? 81.9% adults UK received least one shot compared 65.4%  weekly average compared US accounting population? That's terrible. know that.

I situation someone tells vaxed get away me. coming. live NYC about.

The invaded dangerous.   live. even told doctor flight end week I’d rather safe sorry. nope. live highly vaccinated area we’re finally visiting parents (all vaccinated) first time almost two years live low vaccination area. Trying right thing masks Ohio either. gotten kids back activities overall case numbers low I'm hoping stay way... definitely watching closely. honestly depends. Usually yes, especially can’t survive without ventilator. Without going specifics, man ICU illegal immigrant without insurance, ventilator dependent since January. likely spend rest life us ineligible long term care insurance. Unfortunately, there's plenty people strongly anti-vax.  Australia? Seems strange me. Yes, less protection. Hopefully people begin trust science eschew pseudoscience. Read what's happened England. get real deal news. Google ""COVID variant Delta Britain"". talking vaccine, asking research stats.

I'm vaccinated dose myself. issue take years everyone worldwide get vaccinated. kids probably get jab year (ok, chances serious reactions low) population less developed countries unprotected.

True, variants concern likely emerge here, still, done yet idea UK estimates flu deaths 2019 flu season? We're going bit slower :/ ahead guys we've reached limits system. government willing ask privates help vaccination pace stagnated around 90 000 shots day Automatic translation bot, action performed automatically. Please [contact moderators subreddit](/message/compose/?to=/r/Coronavirus) questions concerns.* really sad. Looks like Pfizer's desire destroy competiotion stronger caring human life. safer vaccine without. Everyone else safer get vaccinated too.

It's okay scared, even rational afraid. brave means overcoming fear. part vaccination scares you? Already did, fully vaccinated :) called first deemed essential worker (teacher). grandparents already fully vaccinated, parents take second shots week so. Problem people 35 can't still go take shots. open all, government really controlling vaccinating everyone age we're still 40 year olds. 

The crappy part that, fully vaccinated, restrictions everyone else. I'm still forced law wear masks outside, I'm still allowed leave area live on. Dental sort covered NHS. qualify free treatment, £23/65/280, depending work.

Mental health cover shocking, yes, seriously needs EDIT: case want argue COVID, UK higher amount deaths per thousand US…

