,date,text
Why here? Cool runnings site linked e-commerce website allowed posts comments. 

If believe made mistake, please let us know.

Thank helping us keep information /r/Coronavirus reliable!


*I bot, action performed automatically. Please [contact moderators subreddit](/message/compose/?to=/r/Coronavirus) questions concerns.* point ones decisions impact rights

Never. inalienable rights. long person, rights *Ikiru* also paints scathing portrayal Japanese bureaucracy even remotely cool? [Zoonotic diseases travel animals humans. Besides composing frightening diseases deal (prions, Ebola, types influenza, origin HIV, …), exhibit properties make behave differently endemic diseases. 

One animal hosts provide additional environment mutation recombination, leading potentially greater variety possibly deadlier diseases. Animal husbandry practices animal density unreliability veterinary care places contribute here. 

The second animals act reservoir, preserving disease environment even it’s eradicated human population. Animals act hosts diseases without affected. case, instance, bats Ebola, believe. Yes, triage moment Indeed Thank clarification. One vaccines works fine. Problem people getting vaccinated all. “It doesn’t make sense health measures prevent excess death”  lot people thinking covidiots anti-pill, there's worse take already floating around: pill means need vaccines.

That is, course, fucking stupid. trying slow spread virus first place. Instead treating like replacement, complementary. vaccinated tested positive last night friend I’ve sharing room (also vaccinated) tested positive. pretty isolated past week likely got went Vegas wedding last weekend.

My symptoms mild runny nose headache lasted 3 hours day. long take body get rid virus ?    worked hospital, get whole bunch shots. 30 years, remember hep A/B sure. balk getting needed $3.70 hour help pay college. nice bonus going school added protection. get flu shot every year, pneumonia shot every 10 (I asthma started getting shot much earlier most), I'm getting shingles shot soon.  Yes, actually patient admitted 1 shot. intubated days later extubated transferred lower unit. recovery quite fast—don’t know vaccine anything it. However, also complex PMH, including past MI, severe asthma, T2 diabetes. seen another partial shot admission, said before, everyday. think would add previous statement emphasis observations general view.   still cannot understand people want vaccinated. mean get something injected make immune system better. What's next? Nanomachines heal everything wrong body? Sign right f**k up! Agreed. Also hypocritical. work company provides services several NFL stadiums workers even allowed stadium work without proof vaccination. exactly vaccine mandates healthcare workers absolutely necessary provide safe patient care. covid 2019, around December.
Not bad, cough days bed.
Caught 5 weeks ago, quite ill, it’s done something now.
I’ve jabs, forgot add that.
My blood sugar normal feels like I’m going pass out, tired happens.
What’s pots ? Delta sort like that, though, isn’t it? China put tens millions people lockdown couple months countries anything right? 

Honestly whats chance extra couple weeks hid information would really mattered? 

By suppressing pandemic locally, able minimize number cases exported, absolutely save many lives countries. 

For example, UK suppressed outbreak like China did, Alpha variant would never developed, many deaths would prevented. 

If China let become overrun like countries did, pandemic would developed much quicker, every county would suffered it. media report seized upon multiple outlets Russian media, including Russian news agency TASS Twitter account Sputnik vaccine.

hmmmm.  much nonsense taught school days

Yep. Like science.   62% vaccinated, leaves 38% unvaccinated - lot people! Plenty targets virus find unfortunately :-( Agreed. It’s called Dunning-Kruger Effect you’re interested understanding phenomenon detail.  What's really bad lot anti vaxx people want get it, want people get it. 

It's one thing get it, another entirely get harass, belittle, intimidate, threaten, otherwise monstrous others decided getting vaccine best them. 

And without failure... get want others get loudest scream: ""It's body, choice!""  clean, mask-wearing, vaccine-believing society bows instead shaking hands struggling bad COVID? Great analogy. I'm stealing this. Taking anti-parasitic PREVENT viral infection make sense anyone. preventative parasitic would function like flea collar maintain levels toxin. hey, you. Don’t even consider 90% NFL got vaccinated suffering it. goes HCQ, taking daily maintain immunity?   Google maps start flagging locations avoid accordingly ...that can't real. Tell that's real. feel like reddit really twisted meaning introvert 'complete antisocial shut-in"" actuality, introverts mind socializing there. need time away people recharge  dog's heartworm pills ivermectin! /s think big part people leave conversation scarcity. hospitals empty resources plentiful, conversation doesnt matter much. know anyone needs medical treatment get it. Even reason need medical treatment. hospitals overloaded, staffing shortages due burn out, insane health care costs building etc....then yes priority needs given people actively reduced risk impact. 

If abundance healthy lungs waiting patient needed wouldnt care got it. waiting list one patient isnt active smoker? think clear get priority. rarely lives seen situations dont resources provide care sides. different world.   neighbor ER doctor Denver. Apparently half Covid beds occupied people state. They’ve taking patients places like Oklahoma Louisiana surges… people tend stay ICU quite long time.   realized dog's monthly heartworm meds contain ivermectin, guess he's also protected covid /s   Would coming new variant? feel like Delta really tore unvaccinated, well lot vaccinated folk.  wonder Aaron Rodgers fiancé vaccinated polio, TB...you know vaccines everyone gets young asshole?  news story really want hear people arent antivaxx lazy get it. feel like fairly strong generation little younger (25-40) especially males. arent it, havent prioritized stuff. dont care convincing lady Live Love Laugh sign laundry room vaccine going hurt kid Braxton. want people pressure 32 year old guy works night shift doesnt think find appointment miss work symptoms vaccine. F1 drivers fit hell, also tiny yeah weird compare NFL players.  done messed A. A. Ron Olympics ended months ago 1 broad mandate survived court challenge like 40+ years, really, really bad chemical.

Anyway know Reddit one wants hear it. Remind next February went ☺️  helpful information. Could double available supply poor countries. Canada get creative well due limited supply beginning. Given Olympics, disinclined believe this. make sense me.  Yeah caught election week January (so vaccines) idea got it. always wore mask anywhere went really didnt go anywhere. back staying parents time thing think one caught school asymptomatic caught there. one else house ever developed symptoms.

A similar thing happened cousin; staying parents week started feel sick got tested Covid, parents never caught even though around couple days got tested Try 30%. can't see reason State Farm would keep on.  surprised since elderly got vaccines longest ago efficacy would wane slightly time newer strains. explains need boosters quite well actually. sad reality know there’s going tones kids homeschooled BS academics. 
They aren’t going know shit polio, smallpox, measles, mumps rubella, pertussis…and knows else. Almost like they'll listen opinions already anything else heresy know! really case simple math. Say taken prisoner me, evil criminal mastermind forced play Russian Roulette. play, whole family gets murdered, including dog, possessions given Trump campaign, kind thing. get choice revolver play with. One one round chamber six, one five. one pick? told lot, sometimes guy chooses 1-round gun loses, sometimes person chooses 5-round gun wins. Take pick. Go ahead, research like making choice- got five minutes. do, do? agree NFL players mandated get vaccine vaccinated player could also infect others saying distraction. want argue effective want try defend idea wont get sick chance ""winning"", change direction conversation . Instead keep conversation line was, ""vaccines reduce spread virus that's keep people getting sick reduce mutations. also shorten length sickness, reduce severe symptoms often keep people getting sick all. assume wash hands, cover mouth, etc sick, thing, basic steps take care others."" He’s “critical thinker” he’s blindly repeating misinformation fed idiots trolls completely lacks ability think critically enough realize wrong is.

Like, course masks help. course vaccine helps. complete idiot think wouldn’t they’re 100% effective they’re worth using all.   right, misinterpreted sorry. Even tho think phrased *partly prevent* *do prevent* since choice words give places two conclusions coming two different narratives; vaccine ineffective transmission-wise vaccine partly effective transmission-wise. 

Technically true also bit far-fetched, that's imo two different concepts clash together; common good freedom  Sounds like got idea Dual-Energy CT. Thanks explanation.  Perfect Solution fallacy grand dangerous scale. Got Pfizer booster Friday go along JNJ shot. side effects slight sore arm. Feeling protected trains get crowded. don’t think pandemic response win anyone. lack transparency hurt everyone post appears vaccines. encourage read helpful resources COVID-19 vaccines:
  
[Vaccine FAQ Part FAQ Part appointment bot, action performed automatically. Please [contact moderators subreddit](/message/compose/?to=/r/Coronavirus) questions concerns.* Illinois mask mandate well.  post appears vaccines. encourage read helpful resources COVID-19 vaccines:
  
[Vaccine FAQ Part FAQ Part appointment bot, action performed automatically. Please [contact moderators subreddit](/message/compose/?to=/r/Coronavirus) questions concerns.* Well money's green I'll voting it. noticed gem another covid subreddit think underlies awful attitude held lot people site literally enjoyed pandemic “i plan working home much possible, forever!

i deal whiny extrovert coworkers zoom lockdown. several actually told give attention usual since 'suffering'. told 'em zoom another extrovert leech them! boo-hoo, first time lives exist world designed people orientation. welcome world, rest half population introverts. schadenfreude galore!” would. worked Carlson Maddox. it. waste money though. Sign Discount Double Cross!  Nope, gets struck live it. Biden took 10 months issue 2 months go effect. It’s going pretty hard argue emergency here.    Yes, OSHA given power. think mandate would require legislation, Biden must come 60 Senate votes wants impose kind mandate. could though impose vaccine requirement collect welfare (such SNAP). Nothing sore arms here. girls played soccer games day after. court case take vaccine pay small fine. couple subsequent decisions weakened it.  I’m southern US large institution serving dense region. don’t published numbers hand, reporting see. course don’t work every day could hospitalized vaccinated patients wasn’t there, didn’t stay long enough notice. It’s largely considered significant event among unit rare is.

I’d curious perimeters ICU admission different health systems. system many ICUs intermediate units. Generally, covid pt needs vasopressers, ECMO, paralyzed sedated, they’re ICU. they’re intubated stable, go intermediate level.  Except already worked News court case 'persuasively' arguing 'reasonable viewer' takes Tucker Carlson seriously Yet another reason stop using internal combustion engines transportation vehicles transition electric vehicles, exhaust contains tiny particulate matter known affect health, particularly lung issues, study indicates literally reduces ability fight infection site initial infection. HIV extra-special regard since retrovirus. fascinating discussion sorts surprising details, see [Vincent Racaniello's virology class topic.  Get woke dumbocunts course Republicans believe virus real- developed Chinese lab run Dr. Fauci order create reason government inject everyone microchips forfeit rights breathe free...  hospital bedside nursing five years. feelings pretty much Teflon point. call whatever want to, child still protected severe disease. That’s care about. part problem, part solution. prove point. know talking about. Goodbye. Canada same. Nobody ever asks anything (I’m double vaxed would refuse show, would lose customer asked). kind person becomes cop puts wayyyy much emphasis looking/feeling tough. idiot covid vacc decliners. common viruses develop resistance antivirals time; relying antivirals alone likely fail short years used large scale. (As example another virus -- antivirals HIV, HIV treatments involve multi-drug cocktails stay effective.)

So think better rely primarily vaccines bulk job use antivirals people *cannot* get vaccinated (e.g. people certain rare allergies) vaccines ineffective (people autoimmune disorders immune-suppressing drugs). state completely ineffective, I'm saying exists breakthrough cases even highly vax population showing still transmit despite fully vax. We're still getting data around breakthrough cases, know exist.

Additionally, could argue unhealthy population is, taxing nations health resources population becomes, indeed affect everyone, even though spreadable terms.   Exactly. likely can’t get away without payout. player laugh way bank. threaten average Joe making financial life impossible vaccine mandates, millionaire football players laugh threats. We're talking Japan here, highly industrialized country whose main industries include tourism, large parts tourism income generated domestic travellers whose foreign tourists mainly come highly-industrialized countries, developing country dependent tourism survive. 

We're also talking highly-nationalistic country historically problems closing borders centuries, deem necessary national interests. expect surrounded relatives may disown hate go 'other side'. tribalism trump worship. misinformation medium communication.   Wanted keep lyrics song plans vax mandates general. discussed healthcare workers though.

People complain forced vaxed recovered allowed go restaurants, cinema similar things areas hospitals starting get overwhelmed ICU patients call ""vaccine mandate back door"".   Tens billions tourism dollars.  Pfizer tested 10ug original trials, produced much poorer antibody response.

30ug already waning 4-5 months, going 1-2 months now? nothing gain letting pestilence-demons country, lot lose.  !remindme 4 months  Yeah thinking that, I'm looking qualifications think qualifications boosters apply. might able squeeze based &lt;30 BMI. dunno. Symptoms really mild, maybe leave someone really needs it.

I'm huge hypochondriac I'm playing worst case scenarios head! way they’re going keep borders closed long. They’ll open early next year. 

They’ve already implemented relaxations (3 day quarantine) business travellers. Fair enough. respect individuals comfort level choice point vaccines widely available. anyone know find least wrote article something like 10% population led like 90% cases? need use source polsci essay tx     see think mean, think. mean, exactly intuitive.   excellent   Fukuoka. completely peaceful two new infected people yesterday. I'm going next week see autumn leaves. Doesnt matter. ppl get vaccinated non issue. dont, issue   Well, guess thinking Grandma then. thinking you. think unlikely Japan allow foreigners back virus still rampaging around elsewhere. I'd wager another year two so, may consider, heavy controls mandatory quarantines.

There's reason got situation control. Closed borders factor that.  I’m 20s, I’m good shape, triple vaccinated. necessary think me, guess appreciate it. skin back. That's fair long run. might now? use N95 exhaust valve. I'll keep safe keeping safe. worry that. realize article 'Europe' 'UK'?   Continue wearing masks what’s best you. one cares wear one. Don’t push insane agenda everyone else though. checks fine. cant seem find context. Username checkout. Stay home then. Except ones started suspending refusing get swabbed. know. like re-affirm whose fault whole pandemic thing is. clue they'll open back international tourism? not, pretty severely immunocompromised qualify monoclonals I'd think. Yeah yeah yeah mother law tested positive COVID October 29. father law really anything prevent around noticed smell Vicks congested Friday, Nov 5. taken COVID test. COVID, would safe see Thanksgiving? would 3 weeks first noticed symptoms. toddler young get vaccinated, CDC website says getting positive test need isolate 14 days.

EDIT: vaccinated  numbering root common misconception, I'm sure know. G logarithmic scale, 5G actually *ten* *times* louder 4G. theater this? Well may choice while. Healthy staff come work keep patients healthy. Unvaccinated staff get sick, spread sickness coworkers patients. kiddo turns 12 next week debated waiting. Talked pediatrician ultimately started vax yesterday. 

We far less stressed that's worth world us both.  impressive part wrong many different aspects comment. sniffles aren’t worth living compromised. Sorry man. Masks miserable. wear required to, thankfully transportation only.   Protecting parents make poor choices. Yeah said wasn’t even controversial. stated many people claimed success taking ivermectin relation COVID. didn’t realize controversial whole subject commented tbh. don’t care someone wants get vaccinated not, problem vaccine mandates assumption getting vaccinated one cure. like free ride already late. community. ambulances part fire district free anyone everyone. Costs people city $6 year property taxes. Proved useful wife hit car parking lot. I'm tired people saying vaccine keep us safe dying matters. Even mild covid cause profound damage bodies. good. Well..there go. State 73% instead 55, we'd hardly anyone dying too.  Everyone really really nicely telling get now. get breakthrough case booster could protected day putting many others risk process. people pass along to. sooner better.     truer words spoken, !!! yet cities perpetually stuck Covid mandates. It’s frustrating. know getting downvoted pretty mysterious. country went tens thousands cases 3-400 cases day fast maybe except Taiwan. taiwan much smaller population. singapore korea getting vaxxed masking cases controlled like japan. even NZ australia's cases going also. vaccination rate 77.8% vaccinated 73.1% completed second dose. second this, especially working within hospital  Never really understood americans act like immature kids, like told  much sniffle 2 years. fuckers would keep masks would great. Covid Natural Selection Steriods .....No jab .... Gotcha ! getting overturned already.   Like rain wedding day… I’ve following Covaxin long time.. give kids vaccine. one would pick. It’s super safe, doesn’t serious side effects others. hope Canada approves soon. Ocugen applied EUL back think Canada didnt want respond approved WHO. safe healthy community cool fuck.  lol? Yeah excitement get boosters odd site one.  I’m ready go back gym next week I’m going gym shopping. gym doesn’t check status, I’ll turn around leave. lot health clubs care money health. make quick easy distinguish.  Yeah maybe vaccine J&amp;J. 

But still J&amp;J nothing times quadrillion. choosing get it’s “Wendy’s” shots dumb, contributing narrative based reactionary fear people understand nothing virology, biology, biochemistry immunology called fearmongering. Especially *actual* chances something bad happening are, like said, equal struck lightning. 

Anyway, facts there. reply dumb argument won’t reading cause block people like you. Good luck. Identical last year. Compare peaks. goes south midwest north west mountain back Midwest south  kiwi's laid back people, ok? take time things. rush us, we'll get eventually.   I’m actually surprised it’s higher that. It’s lies fear mongering though. think pretty much medical professional would pick vaccines J&amp;J. Doesn’t help recent fuck up. [15 million fucked    shit. That’s point. point original comment said calling ivermectin horse dewormer “misinformation” “just bad” anti-vaxxers  Well it’s name totally ignore foundational pieces US governmental structure. must aware polio vaccine 4 doses children DTP 5 doses. adults get TDaP booster.  


But vaccine benefit isn’t measured many doses takes, it’s measured morbidity mortality prevented. Distribution maintain shelf life would require education, yes, appears something like pill form monoclonal antibody preventative treatment like this, exactly this, could used way. make ass Uma Thurman. heard of. /r/pharmacy talk code they're identified chain work for. Retail pharmacy pushes fill many scripts possible, consider skills knowledge. much people think pharmacists count pills work cash registers. question vaccine beneficial (it ) . risk children high enough mandatory one. ( opinion either way). valid question ask parents . divisions regional. They're largely urban/rural. Vaccines don’t make claims, every study looking transmission shows substantially less transmission vaccinated people unvaccinated. Vaccinated people less likely infected begin with, people infected don’t transmit. vaccinated get infected, shed virus shorter period time fewer people exposed.  Chicken pox probably spreads fast disrupts school year . 2-3 weeks home isolation whole classes required vaccinated . think schools mandate avoid logistics headache , outbreak inevitably. &lt;eye Positivity rate 1% well. They’ve done great job getting control. require legislation every rule OSHA implements. would completely impractical.  CV$ Walgreen$ care employees handle. Overall going fine. know three people lost parents. One lost dad mom within weeks. overall going okay. worried health, get shot. There's also pill two companies. Covid going anywhere. eat better, exercise continue live life. Pfizer got Pfizer booster yesterday full dose kicked ass today less ethical doctor prescribe could challenge


You think celebrity worth hundreds millions dollars helps this? Yeah bet. Logic reason tough competitors lies fearmongering. gotten around it. Luckily symptoms bad though, mild flu like. Mostly sleepy. Anything 99.5% anywhere Facebook YouTube’s faults people downvoting must really hate eradicated polio gotten disease numbers low negligible modern health advances vaccine mandates. Sucks weak toddlers aren’t dying measles anymore. ^/s mean like it’s schools summer camps youth retreats decades? really know better omit sarcasm tag. nothing it, acting like shortage vaccines think quite opposite, plenty covid shots go around 89.31% first dose.
95% figure recon end at.. still need drag morons along vac hub get there.

They going open 5+ Christmas approval process goes well, I’m convinced see 95% small children vaccinated, probably different numbers going around  article dumb, covid shots one things shortage of, able schedule covid booster several places within couple days ended going Walmart able get shot day said one taking covid pretty clear that. Energy Recovery Ventilation really standard new houses, pandemic not. lets keep house constantly ventilated time keeping warm/cool. research.  Colorado’s testing 7-8% samples genetics. Nothing report front yet.  That’s true state Victoria (270 days), New South Wales (was locked 100), state locked ten since initial April20 lockdown.

The states virtually Covid free since may 2020. Life like 2019 except 2 3 day lockdowns whenever mystery case arose could track source.  Good Rugged individualism thee  believe things changed quite bit delta variant. reject mean prevent immune response mRNA itself, (thus breaking chance manufacture spike proteins,) opposed spike protein mRNA meant produce, yes. Making sure doesn’t happen would definitely effect stated last post. one gotten polio vaccine 30 years viruses practically irradiated mention pose major danger 18, COVID suppose you’ll get mad horse disease. Where?   put others risk? vaccinated? called hero last year though? fix everything? vaccine, unlike something like Tylenol instance, based weight, maturity immune system. What’s more, chicken pox vaccine required schools grew well decades old. That’s interesting, Australia don’t mandate chickenpox. paid kids pocket anyway though flu vaccine Lot less effective covid vaccines. 40-60% good year get strains right, far less bad ones.

I’m looking forward studies Moderna combo seasonal flu+covid booster they’re developing, I’d like see effective flu.  many polio killed US last two years? Measles? Mumps? Rubella? stop vaccinating well? Fox News yesterday first broke asked people vaccinated take pills said didnt recommend it....but possible could changed yes, Im seeing specifically asked answered either. suppose we'll see develops :)  make many appointments per day can't handle all?  bet leave kids alone night wrong part Chicago. 68% 0% data far seems indicate contracting covid much likely long term side effects getting vaccine. either chiro worse.

