,date,text
Believe science    harm reduction thing basically everyone's trying since fall, failing every time. First, kind people going gather privately rules going less go too, they'll both. Also, everyone always going say there's evidence particular sector increases transmission, trying kick road know logically they're pushing envelope lot risk factors. lot places like theaters arcades poorly ventilated, indoor spaces difficult distance masks likely removed every then. pretty much tick every risk factor we're aware of, things open almost certainly going start contributing something spread; put resources in-depth studies different business sectors they'll claim there's evidence. whole ""it's fault, private gatherings (insert reason blame someone else)"" excuse, collectively used across society, probably lot never actually seem able anything effective virus. [CDC Weekly Deaths, feel like problem is, media put immunologists front center. I've watching [this YouTube, made much comfortable speed vaccine; since March I've following go (with technology even know existed). amazing stuff. think popular video less 3,000 views. 

It reminds nonsense election fraud; would useful lots ballot processors interviewed, election officials explaining way done, walking people process safeguards. Instead, absent actual information, people believe whatever non-experts tell them. Even wonky stations like PBS really get laboratories ballot processing centers (to knowlege); scattered media know get genuine information people.

(and often, genuine information less entertaining conspiracy information) can't imagine countries sending athletes. [CDC Weekly Deaths, URI? would get another test North south dakota disagree article. post appears vaccines, please see [our answers frequently asked questions regarding COVID-19 vaccines. comment containing misinformation removed user potentially banned.


*I bot, action performed automatically. Please [contact moderators subreddit](/message/compose/?to=/r/Coronavirus) questions concerns.* Ah, Typhoid Jay crew again.

Always arguments form restrictions vague hand waving actionable alternative policies. One would think would wise take precautions would otherwise something literally order magnitude worse “normal”. But, again, don’t get vibe many people pegged “wise” before. agree too. worried bot wants downplay seriousness covid. open die...  North Dakota wave lasted August 25th December 28th. North Carolina's wave start around mid October. basically two months behind. [CDC Weekly Deaths, It’s crazy people figure bs credibility goes tank. see content headlines they’re pushed anxiety like it’s cocaine. leads doubting situation shrugging guidelines. It’s like Newsome tweeting disdain people going he’s waiting waiter bring salad course. Exactly it’s like saying cop somehow must integrity average person Pandemic affects West rich nations. Yes 55 year old male, ventilator month, left hospital 42 days think. close person though they’re home healing still back work got vent, survived, healing  Ok thanks, tell arguments poor uninformed? Nova Scotia resident here. implemented rules, locked everybody (for part) followed rules laid out. cases today ~3 per day last week strict quarantines people travel here. hit around 40 new cases day started, weeks back hit ~16 day today new cases.
 
We're amazing comparison country lot people comfortably feel virus exist still wear masks, adhere quarantines listen medical community. done correctly believe quarantines lockdowns extremely effective worth it. response stop? every single time single case pops up? majority doesn’t take vaccine? Yes know like last year, right?  different someone otherwise takes vaccines cautious Covid vaccine new created new technology.

Not isn’t. **FDA** approved vaccines you’re nut job anti-vaxxer don’t trust period. else doubt every med FDA-approved?? Trumps fault right? report deaths Monday-Friday?  would expect see deaths January 11th report. exactly, no. guy makes poor, uninformed arguments therefore ignored. anyone doesn’t care people dying left permanent disabilities disease.

Anyone argument actually makes sense least considered.

Keep going though, everybody thread seems really agreeing you. somehow redditors well within expertise. think sick covid stay home, go normal time. outbreak widespread already don’t believe lockdown correct response Melbourne longest strictest lock world. Note Californians, Colorado 120 location California. one actively *trying* drag longer needs be, think I’ll go advice doctors. Utahn COVID here. confirm. Must gotten store. Good point, maybe let million people die keep economy lockdown 2025. Safety first, know. actually said opposite said “if you’re sick flu stay home”it nice try. know sure getting vaccine stops spreading exposed. know vaccine protects anyone else person got it. guess, I’m thinking he’s upset someone thinking selfishly this... government allows people skip quarantine entering country handle matter like funeral. extremely big loophole. Ireland 5km home . 120miles would get across entire country practicality controlled cases shutting New York epicenter. It’s possible even widespread infection. urine feces yes gut.  don’t get wrong, respect position. I’m planning getting public health college myself. completely absent knowledge comes basic human sociology. 

I went run errands today saw plenty families enjoying nice weather eating outside. Yeah, it’s safest thing all, it’s pretty obvious humans aren’t going live like much longer. Speaking guy wears mask everywhere hunkered even though already covid. clear:

If someone lockdowns ignored trained public policy.

If someone lockdowns, opinion valuable even trained public policy! okay killing certain number people, number high? personal cutoff?

Is exactly 1/10 covid? 1/5? 1/3? parents awful people they’re guilt tripping wanting normal life back. He’s doctor way expertise. What’s him? 

Does want economists tell treat patients? like astronomers particle research qualifications claimed knew all
about virus’ spread.

Find credible sources. Tori Lucifora sounds like stupider person ""big klit"", hilariously. Hopefully career dj goes shitter.

""Everyone needs relax spread love"". Spread something else, like.  testing pregnant breastfeeding women. making smart call. imagine American reaction CCP came statement along lack sequencing... don’t even bother consider basic human nature shit like this. It’s awful.   I’m minimizing anything. never discussed it. Perhaps borders argument old. fact cases, whereas already rampant US? percent cases ICU tiny... buddy LA?!?! part California? live rock..? Free country, knock themself 2009 pH1N1 vaccine, Pandemrix, caused many-fold increase narcolepsy among children.

Actually, vaccine caused it. virus. actual infection also caused narcolepsy. !RemindMe 6 weeks. 

My prediction: testing plan jackshit stop virus wrong. I'm constantly presented facts sub type response worse. Getting scientific debate laypeople trolls work well like think. However, specific claim like back up, course can. No, one makes sense life death way, one ignoring human cost order prioritize economy expense actual human lives.

You’re fooling me, wasn’t posted discussion good faith, you’re spreading propaganda. Knew soon saw source. You’re minimizing much give staying home. You’re ignoring cost mandatory quarantines travelers 

If could US wouldn’t 300,000 cases 4,000 deaths day.

The island argument old tired. US control borders incoming travelers wanted so. That's funny - ex Army stationed Germany 1979 1980. lived also. PX got meat UK time mad cow first discovered allowed give blood USA due possible exposure mad cow disease. found local blood bank. Nice US Army tells anyone. lay dormant 20 years. paper, are. honestly, joke. co-workers telling ate lunch, dine-in. One came back Disney World. Salons bars open, know look. None supposed happening, I've witnessed daily. 

&amp;#x200B;

Which makes tougher enter store, wondering trip makes infect mother. literally even hugged mother since last March, yet look around see people flouncing about. Wonderful feeling. conveniently left people study hospitalized. I’m talking countries next local cases like countries did. easy come examples. phenomenon people overestimate small risks underestimate big risks former rarer jump media.

Which people drive cars afraid flying, daily 9/11 worth corona deaths less bad one actual 9/11.

Vaccines unusual, coronavirus common. Thusly. don’t know anything think haha. said probably outlier :p must China then. Clean utensils. Damn, from?

I'm going much anymore (not like Corona), everybody wears mask (the correct way). I'm Germany though, guess US. Yes. I’ve direct exposure 5 times. think know misleading thing post. It’s honestly like boring point got mine end feb aware covid spreading well. Don’t freak can’t smell throat hurts like mad breathing tube. Sleep sitting greatly reduce pressure nose pain. You’re connecting two unconnected things. stock market all
the money federal government funneled companies. Nothing dead elderly. 


Sorry I’m interested talking dismiss grandparents “well family hire someone then.” You’re making things up. Lmao epidemiologists going fucking furious life normal summer. Kind like NY deaths per 100k “above average.” It’s highest nation. Reddit gonna panic soothed professionals ER doctor nurse posts twitter demanding lockdowns also ignore trained public policy decisions? Clarifying - first jab earlier 14 wks second jab later 33rd week zero deaths 2 days. think everyone else follow lead. I'm RN aka jack trades master nothing. significant impact population? know around 4 million kids born US year, people also immigrate, people die beyond age kids, could potentially see generational waves lost kids like Russia younger deaths?  Singapore, New Zealand Australia disagree. zero local cases days months. really depends done whether enforcement strict. dont worry, /u/tb0x seems think rare come talk it, get dismissed downvoted like been.

Not ""is husband OK"", ""your husband probably got 2 false positives"" Hey, im studying medical scientist work microbiology, got vaccine first chance got. Im curious nursing school, rigorous becoming scientist? join program im already bachelors science, work lab, classes score 80 test kick class school kick twice row. Great motivation stay A's damn. I've always wondered yall endure patient care side. dont really get interact w nurses anymore since stopped sticking patients often tend stay microbiology lab. lot people reporting symptoms November China too. think unlikely things exploded Wuhan first originate Wuhan. living false reality. sound exactly like deluded trumpian sycophants. mean, wrote ""airlines"" ""airplanes"".  Check gloating thread. seem basking news death.

I understand temptation it. pro-mask get annoyed people don’t wear them. point death makes feel good. would never make fun AIDS patient, knowing almost certainly contracted high risk Extremely low death numbers though, considering.  

Maybe non smoking non drinking paying people. New Zealand would probably get find IDK would get silver bronze. Sigh, want get roller coaster. realize vulnerable populations vaccinated death hospitalization rates drop, start gradually ease restrictions. whole re-opening society happen suddenly once. honestly, comments contribute discussion? merely play China hate West grab quick karma. legitimate source backing claims. problem voted. stupid misinformation needs stop. Come Detroit southern neighbor. know perfect spot southwest, tamales Storytime: wife's Tia left massive debts deceased husband. paid money back making selling batches tamales. recently got tamales. Even put ziploc, frozen, reheated microwave, tamales treat. Eh thats really convincing. 


For one thing, median ages 35 37 N Dakota, respectively. Thats 1 year US median age.  


Also really hold true similar states. Texas lower median age states CA right them. 


The biggest difference population density. True. least pay twice. happened 200? Fuuuck that’s order every Mexican place There’s woman sells minivan near me. Need go try talking about

The vaccine rollout, obviously. That’s post comments about. even contrasted aspects response. don’t know you’re arguing with.  put reruns    Following I’ll buy aunts’ tamales. I'm sure does. reinfection rate true, everyone recovered virus, 99.9% people would immunity. issue damage would caused virus infected every person. current data suggests already it, chances immune least 6 months possibly longer. I'm excited see research topic EU countries started vaccinating 2 weeks ago. No, Poland won’t vaccinate slowly first two weeks forever.  need go hungry right now. (Diets lame)  Christians tried good society rather acting recklessly endangering people?  

I'm mid 40's really. make tamale. Mexican tamales ""dry grainy"", greatly varies region, probably tried tamales north/central México. southern tamales wrapped banana leaf super moist, usually square shape. Mexico big country.

Source: I'm Tabasco, Mexico. sign incompetence rather sign infringing human rights according mainstream media like NYTimes. /s tend agree, also occasionally hear horror stories people finding hidden razor blades stuck playground equipment. think probably stuff that's happened before, idea common parents need check every single piece Halloween candy definitely excessive. Don’t worry, reach 60, dormant tamale genes express able easily make them. wish would say it’s deadly population individual. think people would easily understand that. Dallas, bunch would wheel coolers full Greenville Ave 1 AM.
Absolute genius move. call liar without reading fully taking account saying. He’s pretty consistent fall narrative past weeks. Articles like keep getting shared redundant. people die covid, somehow someone disagrees government's handling dies becomes newsworthy. where's need specify?

The need specify comes fact public figure large audience, preached misinformation disease political belief.

Social detachment holiday season right thing government encouraged tweet opposite influenced people.  drugs even AIDS now.

How long take? Congrats Grandma! 

I hope could try Tamales visit Texas someday! Hey, need someone talk to, send DM. mean thought. Incredible gesture nonetheless.  Much focus placed vaccine development.

Was really? Definitely media focus. early pandemic, nobody counting vaccines early everyone looking treatment ideas, mostly using existing drugs.

I’m doctor one scientifically studied drugs improve outcomes fairly standard steroid. reading media, smarter use ventilator oxygen. shit isn’t Christmas Texas without delivery tamales made coworker’s Abu. taste love every one. Lol fuck yeah suited (it’s also mentally weak talk personal life called crying something pathetically irrelevant), anyways stop crazy something small. Don’t got time I’m ending here. good one thanks I'm borrowing it, hardly even uses thing. Americans sitting doses can't administer get priority Phizer Moderna vaccines? 

Yes. US used less half vaccines available far. Millions doses sitting freezers people die.

Apparently, mostly due incompetence bureaucracy local level (state governors, etc). real. try pay more, try sneak tip in, discover exactly enough tamale justify tried give them. Maybe around Xmas daughter's Quinceanera accept gratuities. Otherwise, cannot change mind.

The tamale fairies wonderful group, wandering south west. I'm curious current level testing is. Fauci said weeks ago thought would able weddings June July. said thought March April would go. moved May 1 wedding seemed like would cusp, think good chance things better June.  thought dosage ivermectin treat covid humans insanely high, no? likely much. might right. protecting vulnerable basically stops deaths empties ICUs - essentially leaves behind “bad flu” class cases - don’t see wouldn’t reopen. ability smell stuck 60%.

Question: estimate part, actual medical test reports back 60%? curious, idea. thought anti-maskers US. quick story, friend contact tracer San Diego, couple times he’s cases knew positive still continued go restaurants friends, attend dinner parties etc. we’re talking 22 year olds either. people 50s 60s. one case infected four tables around them. 

So I’m sure restaurant controlled environment people testing positive still going out. people research know money going charity church. recent years left church otherwise happy (and still spend time friends met there) finances. churches pretty transparent know talk (and transparency legal course). get feeling church hiding finances, GTFO.

Mega churches, like mega anything, almost always bad. people support whatever reason succeed. average small church lumped mega churches. Small, service based churches metric shit ton good world fill gaps government programs can't shouldn't. hope waited 14 days. Can't get enough vaccines everyone Olympics? many people Olympics would need vaccines? Looks like yesterday's figure. England midnight 2.33m, pro rata would suggest UK ~2.75 didn’t intend kill him. 

Then shoot head? How’s everyone’s shoulder tried reaaalll hard reaching reasons would go past spring? :/ Indiana fried catfish man. Greasy nugs heaven shopping bag 2 a.m. missread wrote. 20% planes making profit would grounded. Awesome means summer. Mark 16:18 contradicts passage, probably got lack precaution.

The problem is, Mark 16 verse 8 [does appear oldest known believed latter-day forgery. appears unannotated King James, popular non-Catholic English language bible, lot people know fact. aired interview criticized mayor, told would kill parents tweeted about. Welp, hes dead now.

Well, didn’t kill parents, he? /s important keep herd immunity context, though. 


In dense city herd immunity would lot higher somewhere like ND. low population/low density area dont come contact many people, chances catching already lower. Hence growth curve much flatter them. place like NYC see exponential growth virus couple weeks. ND took months get control. 


Also, herd immunity magic number, sliding scale. maximize herd immunity may need 50 60 70 80%, obviously people get virus less likely spread quickly. 


So even 30% people got it, thats 30% fewer people spread it. gets 40% much harder spread. get close 50% on... takes longer longer virus spread closer get herd immunity. depend are. huge city 50% people it, still come contact thousands people day, take many infect hundreds more. small town see couple dozen people day half already leaves people still get pass onto others.  buddy wedding re-scheduled Memorial Day, 2021. I'm wedding trying get answers. they're moving forward. venue outdoor area said they'll cut invite list need be. he's also PA restrictions pretty strict. 

He got legally married October original date wife also due April sooooo.... Sex work real work /s  restaurants open California despite “closed”. Like city, even indoor dining them.  Steal spleen. love everyone damn sure thing. Seems like good coping mechanism. Thanks votes. Negative ghost rider. need people want vaccinated get vaccinated. that, they're making choice accept risk. free whatever like, time finger-wagging thoroughly over.

I believe going beautiful Spring. tell can't accept it? take chuck it? Someone gone whole heap effort ends bin? least give option take back home and/or give someone wants it. Abuela's language love tamales. Muy bien heffa, tus trabaja vomanos mi corozon muy rapido.  Well, know read it. Even sucks, reading book almost never bad idea guess.

Not gonna decide bad reviews, every single product has.  Thirty-six tamales. last day two. Yes, rather getting extra dose freebie, counted supply.  wedding end Feb, obviously isn’t ideal wish could postpone, since state zero restrictions can’t without losing whole lot money. weekend found grandmothers vaccinated wedding day, we’re feeling little relief that! also numerous guests doctors/pharmacists/nurses already vaccinated, great. Hopefully even guests (especially older ones told time don’t come stubborn determined anyway) vaccinated wedding lower risk much possible. Better daily discussion. Gulfstream jets preachers counted course. proceeds megachurch ice cream parlors, hairdressers, bookstores. history allergic reactions? Nothing wrong point someones actions wrong, hope save life others think way.  prove people gathering extent would restaurants open would agree closing serves purpose, doesn’t match I’m seeing around me.

The case numbers may rising believe would rising even restaurants open. may wrong it’s intuitively obvious empirically shown restaurants ideal environment transmitting COVID.

I feel bad restaurant owners employees they’re unlucky they’re high risk nonessential. There’s moral argument makes sense - business get forced shut public health regulations time time. isn’t fault neither there. r/coronavirus say it?!?!? I’ll panic first ask questions later, thank much. Prove it.  I'm curious excess deaths year looks like. they're masks governor give shit possible high number pneumonia heart attack deaths covid getting reported? Report Sunday, often thing, hospital dont/wont update data Monday. I’m betting 2x normal death toll ND reported sometime today. would think official would know, told staff, use term 'reset' triggers deniers.  Winning!!  FUN STUPID!  going try play pedantic grammar police make sure right first. Quarantine sick isolation attempting slow/stop spread disease.

Go look think wants $ train dry up. Jesus certainly want flock making sick dead.   December 26. bit higher now. Well, China hospitalized patients, even symptoms. study specifically looked hospital supposed treat patients actually ill. mild asymptomatic cases sent makeshift hospital included study. True. China. Instead police cameras literally everywhere. get later. /r/Coronavirus vs /r/COVID19 split seemed sensible, result there's separate platform serious discussion. know goal ""Join /r/COVID19 scientific, reliably-sourced discussion."" imply ""Join /r/Coronavirus non-scientific, unreliably-sourced discussion"", happens practice. saw brits firmly denied origin one variant, could also expect would get much chinese either. Dude really pretty simple. Crazy people keep talking public probably look crazy too. That’s good point. Maybe come work sick make point spend time executives management. interaction mention...”oh feel bit bug coming on, hopefully it’s nothing didn’t pass you” improve soon ""no statistically significant excess all-cause mortality week death 
was observed overall England"" last two weeks according ""Weekly all-cause mortality surveillance"" Public Health England. took liberty translated tree partially:   They're canteen practicing tik tok dances. CT going fine, rollout, leave us ""quarantine"" refers sick people ""house arrest"" refers healthy people nah. guy posting bs. that's magic internet, ins't it, look stuff like find stuff like that. did, found.

the whole page linking articles website called humansarefree, created, else topics have?

then list external links, yt video snippets. links real documents reveal content documents misinterpreted displayed wrong. 

bill gates said wants 15% pop erased? no. said 9billion people point future keep going, could lower number 15%.

worldbank list covid-19 test kits distributed 2017? could least read list saying? says list contains stuff classified covid-19 relevant year. whatever listed 2017 also important covid-19 response.

rothschild created covid-19 tests 2015? hell yeah, people can't read. 2020 patent monitor patients vital data uses patents 2015 dude, named Richard A. Rothschild. 1 year late. Automatic translation bot, action performed automatically. Please [contact moderators subreddit](/message/compose/?to=/r/Coronavirus) questions concerns.* dead? Isnt good thing, insane? herd immunity tyrannicaly lock everyone. Well, one aspect, also, chronic mean permanent medical terms. means disease condition lasted longer acute version disease condition, quite short diseases usually short duration. [Chronic pneumonia, example, defined pneumonia lasting longer 6 ""it free"", already future pay it. called taxes. March 24, 2020 12:25 PM Updated 10 months ago Fun fact, almost every year deadliest year growing population....   fair *really* shitty study. don’t know though nothing compare to.   Redneckville USA right? post appears vaccines, please see [our answers frequently asked questions regarding COVID-19 vaccines. comment containing misinformation removed user potentially banned.


*I bot, action performed automatically. Please [contact moderators subreddit](/message/compose/?to=/r/Coronavirus) questions concerns.* Germany requires masks times outside home car many parts country 15km rule, in, allowed travel farther 15km home.

Only grocery stores pharmacies open. live Orlando every night clubs open lines doors.

I say genuinely makes disheartened. awful. know laughing state Florida since pandemic started Like T***p said, virus would miraculously go away. eyes really opened year - lot people low level common sense. Australian here. Perhaps employing similar strategy government whereby awaiting mass shipments effectively vaccination program roll across country once? I’m arguing them. Maybe someone else I’m not. Yeah happened don’t know significance yet read vast majority people get long term immunity. small percentage don't. virus went away, like miracle. words; 

""Through fault caught disease, kill you, [left debilitated mean time hospitals become overloaded nobody care people start dying streets. 

I assure you, life health important business. 12 hour delay fetching comments.

