,date,text
0,2021-01-10," They're saying quoted proposition absurd using extreme example illustrate why. comment sex work all.  areas pushing vaccinations. Invite people get vaccinated quarantine two weeks hotel room something. Thailand quarantels travelers. know downvoted. saw firsthand last week fragile democracy easily precedent breaks down. Sticking principles important solving one individual issue.

I'm saying COVID restrictions unjustified, giving government much power could dangerous. Another Trump situation government controlled single party (vs. current democratic house) could literally see end democracy. 15+ family members got it. completely fine.  haha, yeah... that's one abbreviations better trying pronounce dragon I’ve chasing 35 years. It’s aligned caring arts general. There’s depressingly lot care especially given (in social circles) people arts far willing follow restrictions voluntarily often anyway. defend possible reopen extent safely. New York went summer low cases. likely thats going case places. Rolling reopenings vaccines become available. Badass grandma. mean, yes. Illinois worst rates infection country one point.

I want get dick measuring contest state wave disastrous (and I'm sure states bad we're currently seeing California based stories), really, really bad. really, really bad couple months California was. think another article 2 billion again, kid glove treatment police. Explaining stuff them?...just fucking arrest disorderly conduct. 

The police useless corrupt. think /u/gaukonigshofen pointing one obvious reasons leading charge COVID spread. POTUS anti-masker, minions follow suit.  California much stricter rules Florida 51,000 new cases 679 deaths Friday. talking Florida? numbers identical Cali force lockdowns masks? actually comparing situation Jim Crow? Good fucking god, get life. Every Walmart, CVS, RiteAid, Walgreens, etc give flu shot. ok people vaccinated go concerts &amp; music festivals? Seems like need type proof vaccination carry phone . Worked st comedy club covid. closed, places still open cannot exist fall best case opening. need actually care industries hurt covid

I worked city gets extremely cold quickly make vast majority money spring summer. especially summer people “let loose” brutal winter

I hate diologue around industries perceived large enough voting blocs  total war? find trial information per country unfortunately  weren’t Dodger stadium nightmare heavy traffic.  proof lol Jesus man, get entitlement checked. Dude, many people american. wife kids get flu shot. gotten flu shots 10yrs. never get sick. three hand gets sick every year. saying Nobody said anything kind. donate literally everyone, Democrat Republican. donated fucking McSally Sinema. I'm sorry, poor Gorillas :( now. Obviously eventually kids get studies done. Full circle back Harambe. curse broken. People would remotely tolerate 4 month lockdown similar March. really. obliterate way businesses one imagine. don’t get people don’t see boarded places around town There’s place hometown called Delias Tamales, brought woman named Delia great business great food. opening restaurant San Antonio, hope people able taste great dish soon. People wait literally hours sometimes get tamales! Here’s clip interview recent I'm chronic reddit account nuker.

Doing fine someone decides NEED pick fight dumb misunderstanding comments. get way worked reddit anyone ever should, nuke account claim I'm done commenting. I'm back new account month lol. Dude can't take HAND made food people pandemic NHL board crossing fingers canceled. Remindme! 180 days go back month ago buy doses ones work. SARS-CoV-2 productively infects Syrian hamsters, rhesus macaques, cynomolgus macaques, ferrets, cats, dogs laboratory experiments.

Natural infection SARS-CoV-2 also documented ferrets, mink, dogs, small large cats. makes potentially viable animal models, apart large cats typically used biomedical research.

Among species, natural transmission observed mink, cats, Yes, agree.  I’m little confused, would FDA give EUA data South African trials wait still US data? Wow. potentially big one based manufacture, easiness distribute one dose. country live (NL) use mainly one vaccinate young healthy population. Pfizer healthcare professionals Moderna elderly. someone get flu vaccine flu practically disappeared year? Instant pot steamer setting ya got Right give high risk people earlier Well, starts Trump states yes, administrations response large part blame failure, failures way every level government would unfair lay responsibility him. 

It's failures incompetence, way down.  trajectory downright scary, among least affected European countries month That's enough 200 million people. US population 328 million. enough herd immunity even vanilla coronavirus, let alone mutant strains. I’ve sacrificed make sure people don’t die get hurt em masse, didn’t sacrifice get back normality sooner   Exactly. catastrophic scenario always breakdown hospitals. that's longer threat vulnerable vaccinated, enter back territory ruining livelihoods creating poverty dangerous virus. That’s 50lbs freedom units. god that’s lot flour. get info re: tamales? matter companies listen this! I'm sure amazing troll picked worst possible band example going pay workers? going deny living?  doubt. That’s said total failure leadership levels :) 

It’s actually incredible badly fucked up. Like middle school pre algebra school student could’ve figured ... 

“If X # people vaccinated, every person giving shot administer # shots per day, many people need giving shots vaccinate everyone 3 months?”

Like seems like point anyone actually figure needed mass inoculation centers logistics set ahead time actually get done quickly. states ever large disastrous wave like California experiencing right now? Remindme! 6 months several. ask prescribed studied more, cause know. put hcq ringer decided even try anymore. I'm fat wear glasses. absolutely hate wearing masks. options go see favorite band mask go I'm gonna shit eating grin right behind mask Well yeah probably Africa poor countries lack access vaccines, rich countries will, world whole That’s like bonus every week working there! 80% hospitalizations fatalities 12-15% population, people aged 65+ health conditions. protected fatality risk drops 80% entire crisis far less crisis. Health care workers higher risk getting also spreading it. Pretty simple. whose lives worth less others. focusing people risk and/or spreading it. don’t agree one could predicted wave. People warning weeks Christmas. mean agree well. That’s good reason feel Last two years first time adult life them. I'm almost 40. Ya, lot Americans also realize many people countries travel U.S. healthcare system countries' free, lacks quality. biggest drawback universal free healthcare. Doctors selfish people follow money get paid practice Anybody acknowledge politically ignorant. abundantly obvious anyone pays ounce attention news Trump admin's rollout plan vaccines less stellar. Exactly that. can’t something solely based young healthy respecting restrictions don’t really think it’s acceptable reward st risk people punish people cannot get vaccinated yet. age groups open think that’s different high all. continue isolate they've vaccinated? whole point start opening things back up, getting people back work, getting deaths getting back normal life. [Yeah Countries can, end, choose purchase fewer vaccines — Germany's approach snap leftovers seems catching on. France, too, already begun purchase leftover doses, Agnès Pannier-Runacher, delegate minister charge industry, said Thursday. Denmark also this. [...] Poland, example, order 6.6 million Moderna vaccines despite eligible 13 million doses. Bulgaria secured 500,000 doses, two million fewer could purchased. realize US still second largest manufacturer goods right? manufacturing happens cities, plus headquarters agribusinesses located cities well. girlfriend, except since early December never tested positive. directly exposure (she's teacher). second time lost sense taste smell. last 4 months. don’t support intermingling though. I’m saying don’t open one group rarely feel lonely. especially true pre-pandemic, true even now. I've always loner. People kind get nerves.

But social isolation still wearing down. Every social interaction (whether phone person) leaves feeling anxious wracked intense self-loathing feelings. 

When variety social interactions every day, feel like this. ignore less-than-perfect social performances focus good ones. I'm reduced one interaction every days, (perceived) failure becomes magnified. sucks. can't wait till feel comfortable working office. Weird Italy strange spike pneumonia Oct Dec 2019. mention enough covid waste water detectable 2 different cities Dec 2019. Double covid antibodies samples September  Definitely like names. Naming country origin 2000-and-late. important thing people remember china evil. Regardless do, happened instinctive reaction say “despite china still evil” ........ keep belief system up! completely agree. won’t giving business, that’s sure. healthcare worker. insight many refusing vaccine? best guess. see first hand people, even young, healthy people. ready get line seeing news. 4 million people, would mean everyone jabbed gotten 2 doses.

Look numbers 3 weeks ago subtract 8m get decent count. Looks 7ish million people. I'd still need time translate German ;) Ohhh nice, cross species infection one closest relatives.. gonna get weirder!
E/ typo Nordic Model (arrest johns, providers) increases sexism.

Nordic Model sexist, punters takes away safety valve certain types clients.

Explain. true. remember reading full trial like 45000 people. wonder many US vs SA  UPDATE: Minimal staff work today, two used chin slings day Boss put saw wearing mine came in.

I saw two poeople drive work wearing mask all, fewer 10 way home.  Automatic translation bot, action performed automatically. Please [contact moderators subreddit](/message/compose/?to=/r/Coronavirus) questions concerns.* Kidney malfunction minor? Assuming 50% refused symptoms still means 38% hospitalized - fuckton people. happy cake day! Netherlands Thes trying draw clicks readers becuase cool tell friends next 2 years still going doomsday scenario. 

We could really use actual good news instead constantly telling people year now: ""You want normal life back? Well fuck you. gonna happen Screw you.""

Just objective view situation tells wrong.   may need start thinking cancelling 2022 Winter Olympics well. Hopefully transform stadiums Still argument counter epidemiologists said above?

Nothing else matters, even many downvotes. live one rural states, bottom 10 States vaccine distribution. say rural best across board. brainwashed never see brainwashed.

r/selfawarewolves Beatings continue morale improves I’m upset beginning pandemic told wear masks “it necessary” would scare people. (nurses) getting trouble wearing masks March. knew BS. knew respiratory virus. Respiratory viruses spread droplets masks protect that. That’s basic knowledge. told wear whatever could find including socks faces. began get angry. given different emergency use medications. pulled causing harm good. emergency use vaccine came be. lot nurses females child bearing age. vaccine studied pregnant people. called anti vaxxers even though nurses never referred anti vaxxers before. love vaccines. love vaccines studied 10+ years proven safe. I’m angry we’ve treated we’re expected get emergency use vaccine hasn’t studied relevant population don’t get labeled “needing educated false information.” There’s reason we’re one America’s trusted professions. Half nurses wanting vaccine red flag it’s we’re stupid. I’m upset beginning pandemic told wear masks “it necessary” would scare people. (nurses) getting trouble wearing masks March. knew BS. knew respiratory virus. Respiratory viruses spread droplets masks protect that. That’s basic knowledge. told wear whatever could find including socks faces. began get angry. given different emergency use medications. pulled causing harm good. emergency use vaccine came be. lot nurses females child bearing age. vaccine studied pregnant people. called anti vaxxers even though nurses never referred anti vaxxers before. love vaccines. love vaccines studied 10+ years proven safe. I’m angry we’ve treated we’re expected get emergency use vaccine hasn’t studied relevant population don’t get labeled “needing educated false information.” There’s reason we’re one America’s trusted professions. Half nurses wanting vaccine red flag it’s we’re stupid. I’m upset beginning pandemic told wear masks “it necessary” would scare people. (nurses) getting trouble wearing masks March. knew BS. knew respiratory virus. Respiratory viruses spread droplets masks protect that. That’s basic knowledge. told wear whatever could find including socks faces. began get angry. given different emergency use medications. pulled causing harm good. emergency use vaccine came be. lot nurses females child bearing age. vaccine studied pregnant people. called anti vaxxers even though nurses never referred anti vaxxers before. love vaccines. love vaccines studied 10+ years proven safe. I’m angry we’ve treated we’re expected get emergency use vaccine hasn’t studied relevant population don’t get labeled “needing educated false information.” There’s reason we’re one America’s trusted professions. Half nurses wanting vaccine red flag it’s we’re stupid. sure hope so. got second dose 2 days ago 15 hours strong immune response. Fever, chills, rigors, headache, body/joint pain. lasted day finally tapering down. rough say least rate still inreases day day almost definetly Summer. I’m upset beginning pandemic told wear masks “it necessary” would scare people. (nurses) getting trouble wearing masks March. knew BS. knew respiratory virus. Respiratory viruses spread droplets masks protect that. That’s basic knowledge. told wear whatever could find including socks faces. began get angry. given different emergency use medications. pulled causing harm good. emergency use vaccine came be. lot nurses females child bearing age. vaccine studied pregnant people. called anti vaxxers even though nurses never referred anti vaxxers before. love vaccines. love vaccines studied 10+ years proven safe. I’m angry we’ve treated we’re expected get emergency use vaccine hasn’t studied relevant population don’t get labeled “needing educated false information.” There’s reason we’re one America’s trusted professions. Half nurses wanting vaccine red flag it’s we’re stupid. Lol see science understander logged on.

mRNA vaccines new knowledge long term efficacy/safety unknowable point. claim otherwise unscientific. eyes reason enough people potentially make judgment receive one. It’s antivax conspiracy theory. 

As someone low risk category already gotten COVID recovered, would prefer wait receive traditional vaccine using deactivated virus Johnson Johnson vaccine, don’t think people reach decision ridiculed so. I’m upset beginning pandemic told wear masks “it necessary” would scare people. (nurses) getting trouble wearing masks March. knew BS. knew respiratory virus. Respiratory viruses spread droplets masks protect that. That’s basic knowledge. told wear whatever could find including socks faces. began get angry. given different emergency use medications. pulled causing harm good. emergency use vaccine came be. lot nurses females child bearing age. vaccine studied pregnant people. called anti vaxxers even though nurses never referred anti vaxxers before. love vaccines. love vaccines studied 10+ years proven safe. I’m angry we’ve treated we’re expected get emergency use vaccine hasn’t studied relevant population don’t get labeled “needing educated false information.” There’s reason we’re one America’s trusted professions. Half nurses wanting vaccine red flag it’s we’re stupid. country? 2021 nutshell, I'm afraid. early data accurate summer claimed herd immunity lower cases graphs predicting drop anytime soon, never came instead new wave appeared. stopped updating site then.  easy everything ok. called rights privileges apply time. Even times like this. right delayed right denied. Communism dead end. failed ideology one wants it.

I assume that's suggesting bring collectivism? forms collectivism that're economically socially viable sure, communism one them. India already reached herd immunity numbers falling since months. imagine also happen countries, hell anywhere really locked down? Even devil standards. They'll end emptiness void. hard lockdown didnt work country.


So extending it... Fair enough. That's big rabbit hole go though. could also add % chance kill/main someone permanently. Herd immunity works weaker individuals everyone gets vaccinated(or infected). 

I really care people's personal decisions body part. decisions affect others(99.9999% people denying vaccine isolate bet) rubs wrong way. Nope. dhouldn't feel guilt starting great normla life ater pandemic. generally feel ashamed happy. yor life preety much impact happens people Here? yeah testing free easy find government sites. want rapid test 150 private clinic. Even surge turn around time 2 days max. got money test everyone around somewhat safe. people raw dogging though. that's sad hear. hopefully vaccine, year years come better know never disappear sadly. whole investigation big cacophony given PRCinfluence head. Ok. scary mrna vaccine? actually provide reason besides “I don’t know science I’m skeptical it”

And yes. agree shouldn’t mandatory. doesn’t absolve people consequences actions TIL people live North Dakota ""China’s government strictly controlled research home origins virus, an Associated Press investigation found, state-owned media played fringe theories suggest virus could originated elsewhere.
The AP investigation found China’s government handing hundreds thousands dollars grants scientists researching virus’ origins southern China. monitoring findings mandating publication data research must approved new task force managed China’s Cabinet, direct orders President Xi Jinping, according internal documents obtained AP.
The culture secrecy believed delayed warnings pandemic, blocked sharing information hampered early testing. Australia countries called investigation origins virus, prompting angry responses Beijing.""  Testing understand free, though. could wrong that's cousins told me. Japan, Socialist Party also taken power past. CDP likes China, center. political problem Japan opposition fond foreign countries (China, Russia, N. Korea, S. Korea). Therefore, many Japanese choose LDP. But, Japan's LDP neoliberal, perspective average Japanese, LDP leftist believes globalism. We're also 100 years scientifically advanced medically educated. we're living 100% potential, massive factor. think part problem socialite nature LA. I’ll honest, still lived would harder resist going out. Japan reacted lazily growing pandemic Kanto hospitals starting fall apart, government continues lazy.

Considering Moderna looking approved til May....ugh. good bad points, people still vaccinated immune systems primed further.

The problem that, people it:

1. We're presumably under-testing 4:1 overall;
2. need deal long-term consequences millions, tens millions patients;
3. many people it, still spreading, *possible* (and means certain) reproductive rate even higher thought, and/or prior infection offers less protection assumed (but absolutely **not** proven could outweighed extent lockdown compliance). lest forget blocking investigation team going find source ONE YEAR after. Fighting health orders suppressed really treated like every business, ""fighting good fight"". makes plague rat . . . bad Christian. argument made every worker matter life death, though. Please see [our answers frequently asked questions [questions regarding COVID-19 comments containing misinformation removed user potentially banned.


*I bot, action performed automatically. Please [contact moderators subreddit](/message/compose/?to=/r/Coronavirus) questions concerns.* We'll see. available mean people received Thanks - missing piece information needed! 🤣🤣🤣😜😜😜 assumed isn’t salary took weekly rate. 

Not fair assume every week worked since assume contract Half-arse effective; effective. get transmission somewhere region 3-5 old/new variants, 1-1.5 lockdown, that's effective. might enough spare us severe consequences make difference many people treated time buy us time roll vaccine. course, more, would get results might right call, mistake 2/3 effective still growing completely ineffective.

Incidentally, going hard lockdown *would* going home case. yo virus real Collectivism way forward. gov confident, I'm not. not. problem government corporations shady people trust them

You _have_ trust them. complete cynic still see reason lie mislead here.

Think cynical way POV - government's corporations' best interests? Even give fuck people all, government corps reasons want vaccine work properly, without side effects.

They want ECONOMY back. economy ain't coming back unless vast majority population gets back there, working buying paying taxes. population ain't getting working shopping paying taxes unless safely. vaccine _caused_ health problems would completely counter getting economy back online. don’t care look one, even find one wouldn’t relevant. mRNA vaccines new enough point can’t know long term effects. Doesn’t mean people shouldn’t get it, everyone’s personal choice. guys see Vietnam war museum Ho Chi Minh. There's different perspective war see museums US.

Every country writes history relates them. surprising China focuses achievements rather mistakes. They’re private business whatever want! Like Twitter !! It’s fair prolong pandemic based fears zero historical biological basis. Good, glad control somewhere... hope 4000 mutations recorded Corona19 sequence, 2 actalually distinct transmission numbers, real changes appear virus.... 

This could potentially allow us pass Covid19 covid 20/21 strains Corona flues spread virus changes form variant immune slightly affected vaccines, still valid unmentioned possibility. would require efforts possibly casualties again. also 3 day holiday, probably going get real bad Wednesday's numbers. no, that's something happens later way defending beliefs; original problem People keep entertaining deep lot people selfish irrational phobia science stuff involves them. validate people themself area vax degree

I wouldn’t mind weren’t prologinging goddamn pandemic

If people called murderers wanting live pre covid lives, anti vaxxers really, mortuary. EU could vaccinate whole population within month enough vaccines right now. Automatic translation bot, action performed automatically. Please [contact moderators subreddit](/message/compose/?to=/r/Coronavirus) questions concerns.* Wtf, got downvotes stating fact? people? Lol Virus may originated China, know GFC, subprime loans caused greed Wall Street. Americans compensate world deliberate financial chaos? Give example vaccine long term side effects shownup years later anti vaxxer. don’t biological evidence going tens thousands human trials well millions shown worrying side effects. vaccines history randomly show side effects years road

You call skeptical really think somehow know trained professionals would Covid related deaths yes. people died quicker didn’t spend 4-8 weeks hospital would coped pressures lot better unnecessary deaths would prevented.

The point making death toll isn’t thing think about.  really. It’s new vaccine media fear mongering exposed conspiratorially prone people are. It’s similar USA government developed vaccine Lol. 2023/24? Typical Reddit. 

They let unvaccinated. athletes poor countries get vaccinated. They've brainwashed since kids friend, point arguing No. It’s problem people thinking smarter know something stuff don’t It’s still SARS COV2 hope wins probably afford test often. Even ton like whatever bad. Things open underground. fact anti vaxxer. vaccine people trained decades study recommending. vaccine hats gone rigorous extensive trials worldwide distribution. vaccine zero biological reasoning causing long term effects.

You endangering people’s lives getting it, prolonging shutdowns hurt people mentally financially. mostly irrelevant Olympics held though. athletes third world countries get vaccinated. fans first world countries ones matter since bring tourist yen spend. fans 3rd world countries can’t come they’re unvaccinated shame it’s major decision point holding Olympics not. post appears vaccines, please see [our answers frequently asked questions regarding COVID-19 vaccines. comment containing misinformation removed user potentially banned.


