,date,text
But something dont much knowledge in. I'm huge fan things cost saving measures, unless size exactly want. custom wooden structure insulation, interior walls, siding paint roof going pretty bloody cheap something build site size specification .  hollow box wood, starting point container gives you. roof, water proofing/drainage, siding, insulation, ceiling, floor.  nothing shed, house. time go old school [Linear think beer fest corner Grape St Harbor Dr San Diego last night. place popping packed ass. masks course. I'm sure late night weekend events similar happening country. NBA concluded season packed arenas face masks. overlooked see outrage it. see people get political want target causing spread. …is children getting hospitalized something new year? yes, I’m concerned. projections % world vaccinated end year? workplace mandate approve boosters I’d kind fucked get fourth shot. Hoping booster approval though. sport high risk want protected possible. people legislatively could removed. Unfortunately legislature stacked favor. Damn, free birth control? Lol. Agree anti vax mothers use oils cure sore finger complain loudest naked 80 year old guy walking street. want house pay rent presume patron's kids go private schools got vaccinated? Zeta 6th letter Greek alphabet. yoga vegan families? know quite (not NJ), pro-mask, pro-vaccine. Murphy pretty good thus far, cases NJ seem relatively control, NJ made sensible policy decisions past. doubt crazy families able much.  go door door law written. force people draft war force get shot. want it, happen. Lmao, yes, pharmaceutical companies supplying vaccines interest profitting always health best interest mind. Hahaha wow That’s fair defeated. Interstate flights bare minimum mandate got J+J Moderna horrible reaction Moderna dose 1 guy goes one reports

[dr Moran first mistake putting faith Alabama something related college football 🤧

I tell I’ve seen vaccine hesitant people get vaccinated though funding antivax group? really hope several key elections narrowly Democrats coming years Republicans look back handled debacle weep.  trying stop virus, trying get zero covid cases, that’s impossible reasonable person ever said that’s goal vaccinations, we’re trying make endemic issue isn’t constantly infecting large swathes people resulting death/long covid get back type normal.

But resulting deaths. still 10 fold peak pandemic. 

How go back type normal advocated restrictions masks, social distancing, covid passports, vaccine requirements, possibly lockdowns?

Mask don’t work, social distancing ineffective. thing proven work vaccine appears temporary require additional shots routine time stopped virus 2019, longer possible. 

Stop how? even mean? vaccine preventive measure covid. 

You’re talking nonsense doesn’t conflict wanting get many people vaccinated possible.

True, do? multiple viable vaccines exist. best hope adults make rational decision themselves.

Vaccines covid going annual thing like flu. said seasonal likely going case yes.

So, carry life. 12 - Online vaccine tested. 

Realistically expect households parents work full time able accommodate this? problem needing wait someone family close friend gets really sick covid realize better get vaccinated takes long time first shot till fully immunized. like Star Trek, doctor invents vaccine alien virus, injects almost dead patient, presto miraculously recovering. believe Florida weekly updates, unless changed recently they've switched back daily updates. Someone welcome correct I'm wrong though. amazon.com e-commerce website allowed posts comments. 

If believe made mistake, please let us know.

Thank helping us keep information /r/Coronavirus reliable!


*I bot, action performed automatically. Please [contact moderators subreddit](/message/compose/?to=/r/Coronavirus) questions concerns.*  govt forces us supply offspring tribute war games mean put it. 

And education mandate can't refuse educate child.

Our laws way prescribe manner provide basic education. 

If choose battle virus masking up, cautious, keeping excellent health proper diet exercise reduce risks complications upon exposure, that's human right.

At end day govt use punitive pressure force tax paying citizens make health choice virus .002% death rate general population. 

The virus us forever like less deadly cold flu cousins we've lived recent past, please understand govt never relinquish control granted additional power life myriad dystopian ways end.  Wow, thought government lazy made app unencrypted QR code, like lazy takes effort. Next part addresses unless mutation. Lambda one watch right Excited rush employers mandating vaccines. Also glad delta causing people vaccinated. people get vaccinated, better. Yes, still countries new variants pop like India, point accept certain level risk

I’m done many rolling restrictions mandates. don’t mind wearing mask it’s hard you’re vaccinated, it’s hot, you’ve worn mask distanced year. haven’t seen friends since whole pandemic began lost nearly two years college in-person learning. feels like everything enough pandemic like 90% Lol continue lurk? says stuff fact. really saying everyone already knows Send aunt thank card. assume vaccinated deserves feel like shit reckless life choices. Anyone unvaccinated point clearly thinking people. Personally, beyond forgiveness point. However, vaccinated, that's unlucky sorry. Live let, die. taxes low.  Yup, dad two kids interracial marriages still decided keep spewing racist shit. 

Then gets surprised want around holidays. Problem natural selection also operating virus might end virus even worse dumb shits  informing workers enforcing businesses? see every barrier along way adds discouraging access absolute lack safety net healthcare country, PRE-pandemic, led us current shitshow? yet y’all wanna blame instead people power. right. continue worry 'break cases'. I'm sure vax providers staying date knows covid mutate unvacinated people still about. still could get around vaccines right?

I'm also sorry 'usa problems'. joke sarcasm. assholes still refuse vaccine 'freeedooommm'. Yes also product system perfectly okay critical thinking skills. Live let, die. Adults yes kids. Masks isolation effective.   supposed know end pandemic looks like? Cases skyrocketed. Bay Pigs fiasco, JFK took full responsibility. approval rating shot up. Damn that’s amazing. basically red meat ""you know who"" crowd.

Even works, pyrrhic victory be. It’s way worse. Especially UFC event going variable based location. went shop earlier literally person wearing one, including staff customers (about dozen people), got dodgy looks wearing it. Unsurprisingly, know people catching now.   I've thoughts like too, helpful covid patients community. even mess people could wear masks, follow social distancing endure short lockdowns achieved herd immunity via vaccines? much ask?

Because almost one asked official capacity worked official policies. Instead, like, ""Just things tell stop"" effective long-term policies. two countries seem formulated actual exit plans based around vaccination levels case decline UK Singapore. get vaccine, job Federal Government requires it, quit.

It's different requiring children immunized certain preventable diseases attend public school.  substantial enough population enforce mandate tho? Seems like can’t get vaccine due immune issues/ cytotoxic small minority. It’s weird ass place. went college young couple there, culty secretive faith.  you’re risk, it’s doing. you’re scared, stay house. mask curious kids able fight virus better adults admitted hospital, place ventilators, etc???   director made apocalypse movie ""These Final Hours"" going another movie pandemic, SARS-CoV-2 arrived. That's like saying friends say smoking bad ""kinda preachy"". Like, consider might right? tourists Florida going bring back everywhere else. Thanks sharing Desantis. measuring? Average age current living residents?  Covid-19 cases U.S. rebounded 100,000 day average, returning levels winter surge six months cases Friday passed 750,000, since early February, according data compiled Johns Hopkins University Bloomberg. Almost 135,000 weekly cases reported Florida Friday, record state makes one five U.S. cases. Louisiana said 1% entire population infected last two weeks delta variant spreads, particularly among unvaccinated.""  happened check lol caught comment. 

Yea they’re great. Day Father’s Day sold 90 pair. They’re hard keep stock sure solve problem, filth cross border next closest state infect further. I’m sorry life sucks. two, going outside naked far far far less harmful.  I'm even sure harmful dragging nuts door.   Trump Ohio substantially larger margin Florida.

Ohio's red too.  post appears vaccines. encourage read helpful resources COVID-19 vaccines:
  
[Vaccine FAQ Part FAQ Part appointment bot, action performed automatically. Please [contact moderators subreddit](/message/compose/?to=/r/Coronavirus) questions concerns.* Kids don’t die one stopping lives &lt;0.1% can’t get vaccinated. 

If get point, it’s you. mRNA vaccines seem much better old flu shots though. science pretty good now. think time kept stockpile ourselves. Time vaccinate world allow Survival Vaccinated. Delta isn’t even close bad smallpox, it’s complete joke compared smallpox. Smallpox like 30 percent case fatality rate…delta joke can’t compared. CDC needs way better messaging. instance, what’s end pandemic look like CDC slow respond things like delta variant? It’s okay might know give us idea

We know always unvaccinated people abroad. Also always mutations virus current vaccines still largely work make booster shots needed  you’re parent don’t know talking about. IY  Behold! field grow fucks

  July. seemed like outside, one wearing one. inside, people - way better home. 
I feel like people (locals) much edge Covid. markedly different IMO. think they’re rock hard place needing safe Covid yet also need tourism income. BFF tested positive today Covid, full vaxxed since March w/ Pfizer, vaccinated days. lunch together yesterday outdoors, together 2.5 hours so. I’m worried her, think got unvaccinated 8 year old, positive asymptomatic. tested today three kids negative, one kid vaccinated parents positive. Ugh, ready ride. I’m going stay away unvaccinated kids get tested Monday. would think chances getting low? case vaccine. know that's simplification

Its simplification ignores massive difference telling employee bodies alternatives exist plastic guard....

That difference difference there's literally reason get vaccine millions adult babies can't own, either decide society let die make get vaccinated using tools have, employer government mandated vaccines.

I've said million different comments disagree strongly I'll list disagreements.

1. would simply die. That's factual look happen high rates people unvaccinated. Factually percentage find unsavoury would die, still small percentage would die, much larger still less majority percentage would get ill.


  reality would simply incur cost inconvenience us due booster shots variants.

2. many tools encourage vaccination numbers involve violating people/force public messaging speak people, incentives etc. also ways employers maintain safety without forcing vaccination, strict mask/test adherence. 

  also want point rates bad reddit pretends are, listed previous comment thread. think uphill battle people seem saying running options take care people. 

Your phrasing makes sound like impending doom, that's case. Again, literally people country vaccinated. That's hyperbole lie.

This idea flustered panicking everyone going supported fact.

Even context given ICU situation sound like good supporting evidence this. fact mind posted source could taken differently based minutiae term means. Like covid patients, usual numbers, numbers decreased etc etc.

Even then, feel pretty absolute forcing people. think line extremely important one. also think what's important realize vaccinated people pose little immediate short term threat us. Like little. Good. needs mandated. That's exactly meant, issues exporting jabs stuff, also manufacturing those. also major anxiety say nothing worry about. know talking kind sounds head well. may feel bad couple days worry catching disease infinitely chance putting tube throat dieing. playing Russian roulette. vaccine technology studied 20 years, already FDA approved. standard approval doesnt use much safety info. emergency one basically standard allowed made faster. There's 1 vaccine side effects chance happen got covid. covid one severe  mean guys got voting 7 points right nation ?

Yeah, he'll fine  NO, NO. kind thinking outright twisting meaning freedom.

Freedom (more precisely, liberty) unconditional. liberty goes far infringe someone else's liberty begin with. attempt argue otherwise inherently saying liberty important supercedes people's. completely unacceptable.

In context what's discussed here, refusal vaccinate interacting public increases health risk people one interacts with. also increases one's health risk, evidenced many times, plenty gets sent hospital. guess who's footing expensive hospital bill? always public, unvaccinated patient.

There scenarios getting vaccinated problem whatsoever. example, one never interacts others people. one willing take full financial non-financial responsibility infected people, got sick. many willing make commitment? bet you, ONE.

Ever heard idea cause-and-effect? aforementioned harm inflicted unvaccinated people cause. limitation choices (for example allowed indoor dining) effect. want effect? really easy, cause. want freedom choose, want right risk exposure unvaccinated people too. right supercede mine? think basically impossible. R0 Delta 7, means 10 people infect 70 new ones. get R0 1, need protect 61 70 people (so 10 people infect 9).

That means need 61/70 = 87% vaccinated. that's vaccines 100% effective, even ""only"" 90% effective need vaccinate 96% population. 

If virus R0 7, vaccine 80% effective, literally can't reach herd immunity vaccines. Even get 100% uptake, effective 14 70 people (20%), 10 still infect 14 cases rise. Nope. posted kid ventilator numbnuts responded “no price high keep freedoms”. care kids fetuses. don’t catch covid, ride free turns living Florida comorbidity. 4 million dead say dead wrong that. covid #1 killer US 2020, may top 2021 rate. 400 kids died far, number seems accelerating concerning rate.

beyond death thing happen, child could end long term even permanent damage.

and even getting issue vectors vulnerable peope. Negative. shit heads wearing mask, could use facial recognition deny admission overwhelmed hospitals. Western. mask mandate that's basically it. lack testing positive case transparency really makes believe shit gonna get real. ditched daily check-ins ""we're responsible enough keep kids home sick"". Immediately everyone asking keep kids home ""sniffles"" parents calling delta cold. entire pandemic taught anything people definitely responsible comes self interests. confirmed purchases though. sure satisfied year. I'd like see DeSantis put covid floor treat patients. Probably need PPE since believe it. seems know everyone covid, guess time doctor people. ya, probably right along basic income get too

and free housing (inside chain link fence, guess maybe call like ""cage"" ""house"" maybe...) Moderna says vaccine’s protection holds six months. Maybe got lucky avoided catching covid there. [In case you’re distant family gives main reason aren’t vaccinated. 

And late mid 80s.  think focussing wrong people case. Disinformation platforms must act twelve leading online ​Just twelve anti-vaxxers responsible almost two-thirds anti-vaccine content circulating social media platforms. new analysis content posted shared social media 812,000 times February March uncovers tiny group determined anti-vaxxers responsible tidal wave disinformation - shows platforms fix enforcing Disinformation Dozen account 73% Facebook’s anti-vaxx content.

Those 12 anti-vaxxers US Americans. clearly lacking science education. *Forbidding* restaurant workers washing hands. FTFY.  NERD!! doc note medical file adverse affects vaccine.  Possibly, higher risk people likely vaccinated, hopefully bad. 

Also 4-6 week timeline original covid (I believe). know Delta kills faster. willing, idea government forcing take medication think folks hard time, even said medication low rate negative side effects.  fly masked myself, much less child unmasked. 7-8 days. caught getting vaccine. pretty sure recovered fully own. wait Texas Minnesota state fair. events top 2 million attendees. think count unique participants, could easily 750,000 unique people each. Fauchi liar eat dick [King (Seattle area, think around 70% adults 30 day period ending July 21st: 88% COVID hospitalizations fully vaccinated, 87% deaths fully vaccinated, 75% cases fully vaccinated.

That seems bit bad me, things considered. hard make sense things, think Delta really rampaging unvaccinated cases high again. Deaths fairly low though, 0-2 per day.  “Do give damn?” Mr. Edwards asked. “I hope do. do. I’ve  
heard said often: Louisiana pro-life state nation. 
 want believe that.”

The pandemic shown none pro-life. pro-suffering, pro-disease, pro-destruction, pro-death. pro-life. One day fever really hit like truck. I've never felt tired before. took paracetamol, got tested isolated. Afterwards mostly fine. Sense smell/taste went two days later. Tiredness, dry cough. couple nights, felt breathing got worse side back. got better 7-8 days. Haahah 6 weeks ago, back getting 13,000 day. it’s 130,000. One assume back 4K deaths day. * Breakthrough cases
* Kids
* mutations become even deadly
* Immunocompromised

Let know need definitions since seems like hard time understanding simple things ^  Yeah. Russian, believe government register western vaccines, vaccination rates would shoot up. Beautiful. must crocheted framed.  florida less illegals per capita NJ, spike tiny compared florida. It’s objectively authoritarian. aren’t talking it’s optimal policy. We’re talking authority state has. vaccine mandate gives state lot authority even think it’s best  Exactly, dude. vaccines always helpful somehow, people responsible already working updating established vaccines work variant. like defense shield rather fighting shield sword.  It’s honestly mix people thinking it’s cold people thinking vaccines developed way control population take away rights. know several friends scared recently gotten vaccine since delta. went one friend get shot pharmacy tech told us way getting body friend “doesn’t this”, see even people trusted positions giving really conflicting advice information. feel sorry people sift stuff people believe smart field. 

In news, neighbor tested positive two weeks ago. Stood front yard second day screaming garage hoax. politely asked come closer. week she’s hospital.  read 12.9 billion doses? aware sick

Dude understand hating relatives giving infectious disease knowingly seems really fucking low. Yes, heard recent tech conference Miami draw techies San Fran. need emergency critical thinking classes whole country. Ages 7+ stupid business decision. Can’t go bankrupt you’re dead. 

Guess maybe owner’s morally bankrupt? chapter tax code? bullshit. answered question.  need sorry dude, SJW need worry hahahaha. worries, comprehend valid, virus may mutate indeed. we're yet see mutations soon, got it? Like, maybe years, probably...most scholars researchers said significant mutation happens slow virus. yes, know there's awful lot idiots country like think they're control need take care themselves. *mic drop ... Whaaaaat. That's hilarious. That's real news Luxembourg's version Onion something? Part site clearly satire, [The Luxembourg rest looks like legit news. I'm confused.  people without children paying education community...

And that's exactly even kids school. people without children paying around exactly said. Also something like 4-6 weeks initial infection death. one would assume rate infection higher 4-6 weeks ago. point, known someone personally bad case? people still believe ""real?"" roughly doubling every two weeks? 

Right, official reaction. mess. Personally mask back two weeks glorious self-delusional freedom. Yo! need file Chapter 11. jumped Delta Lambda... variants hear about? I’m actually teacher, teaching part could do. It’s quitting job can’t manage. I’m lose-lose situation. Uhh source come area large mexican population. moved Florida really strange really mexican culture around. outskirts one big cities.

There ""mexican food"" restaurant nearby workers white, ""tacos"" stuff like balsamic vinegar them. teacher well, can’t take homeschool. work, also means putting greater risk, too. already working boosters new variants. Many states already online systems validate info. outside. Risk transmission outside extremely low. actually evidence airborne transmission primary vector, fomite droplet transmission minor best. Well yeah tithing church member$ media money-driven, everyone else America. nobody interest clicking good news. exact thing reddit: news good, everyone super excited leave sub. source?  Yeah frustrating FDA dragging feet this. There's 0 percent chance deny approval, we've given billions doses, see hold is. competition COVID-19 Hurricanes point COVID-19 flu. Treat is. novel type coronavirus highly contagious deadly. Sheesh. 

I always think kinds growth rates (cases doubling every week two, more) signature uncontrolled spread.

This kind growth happening place US now. That’s around defamation, physical harm, restricted public officials later cases.

If John Doe gets sick dies COVID declined vaccine FoxNews told bad pretty straightforward Jane Doe sue FoxNews damage caused lie.

There already attempts “entertainment news” gets away saying [“reasonable viewers would consider contested statement that, make longer legal defense law, suddenly FoxNews change tune. guarantee it. people need hear  funny empirical evidence eventually gets ""principled"" morons change minds. population, we've loads cases time trials (~Jul-Nov last year). Every infection offers chance natural immunity. May great/long-lasting, something. population level, unvaccinated slightly less risk before. Therefore vaccines effect, measured relative unvaccinated, could lower.

All holds original wild type virus only. course know Delta infectious that, statement 'less risk now' probably true across variants. vaccines may quite great new variants also (but still good). However, good thing oxygen **will** become dangerously low

I use absolute here. would say ""most likely"" instead ""will."" uncommon, breakthrough infections require hospitalization happen. brother clinicals local hospital told patient 50 (according him) relatively healthy fully vaccinated, still spend time hospital (not sure ended ICU / vent / ECMO case not). Unfortunately, black/indigenous people color communties lagging far vaccination rates. picture really sum all. plans get full FDA approval early september, allow many grafe schools already spreads crazy fast kills host therefore reason become less deadly. get fatal here.

So likely deadlier rather faster contaminate months/years? contrary? Never, like flu. attending person meetings pandemic without vaccine time. really need warning infection outbreak? Sounds like would ignore like info available. There's nothing allows verification information that's document. form handwriting never proof anything. filled blank one made stuff one would able tell. That's problem. usual US 50 years date. important mention that, average, person becomes infected goes spread virus somewhere around 5 10 people. people spread around 5 10 *additional people*. chain continues, unless people antibodies defend it. 

Meanwhile, person contracts COVID roughly 1 50 chance death.

All preventable shot safe, free effective.

For decades, vaccines mandated (for example) attend public school 50 states DC. Vaccine mandates [safely eradicated many still get rid COVID, too. need everyone part. going say exact thing. constant media frenzy fucking killing humanity faster virus ever will. Except vaccines allow infected people get better faster. period time infections lower.



People seem overlook that.



Plus unvaccinated person likely clog hospitals, ERs, ICUs. like Florida cause shortages things like oxygen. True. older need careful general. flu, pneumonia, sorts things larger effect age. Somewhat escape immunity doesn’t mean it’s effective. Studies efficacy currently place, even lowest efficacy shown mid-60 % range, it’s still effective infection effective severe disease.

The fact case loads high absolutely consideration type business reduction shows highly doubt capacity restrictions reinstated. I’m saying it’s impossible return, doubtful. Look pushback reinstating indoor mask mandates caused. say anything dying. said recovering. indicates suffering long term effects it, recovering well it. guess answered idk shaping 20% new cases among vaccinated people, vaccinated people contagious similarly unvaccinated people. 

In event, current cases US far exceeding cases last summer still climbing rapidly. see great reason complacency. hard understand, CDC media able give facts like transmissibility without people black white going “then vaccines?!” 

It hard understand people read headlines people CDC actually say vaccine prevent transmission all.  Exactly. vaccines push mutate, basically breeding come transmissible deadly. Stop ignorant get shot please.  25% mild infections long term debilitating effects.

