,date,text
WHEN GOING STOP? Alberta dropping restrictions July 1, Saskatchewan July 11. chance would get Senate. going every single Democrat support would 0 Republicans supporting it. means possibility pass.  Think I'll pass, really understand care political stuff going on. amazed hate something leader helped create that's true awesome getting tired working home (too many distractions easy get lazy). Happy Japanese here.My flare changed ""first shot""today!(Yesterday Japanese time)  Yeah 100% protective, still protects (like 90%+ effective severe illness fully vaccinated). like wearing seatbelt car. I've never car accident, still wear seatbelt. understand still killed car crash, make stop wearing seatbelts minor inconvenience potential lifesaving gain. stop wearing them, must fairly compelling reason so. what's compelling reason forgo vaccine? potential side effects? believe microchip/5G/magnet stuff? waiting fully FDA approved EUA? believe eating healthy exercising boost immune system, preventive medicine! vaccines, getting vaccines much easier working every day way effective preventing covid. They’ve made comments like variants nothing seemed happen. really going scary making sound? meant infection transmission, ninja edit. problem boosters people won’t go get them. It’s typically less 50 percent population (US) gets flu shot. helicopter money went everyone? stimulus checks income capped. dafuq Delta plus? Sounds like premium version subscribers only...  Right, case talk one us. made appointments actual individuals calling talking to. even allowed spouses. #IN 1 COUNTRY KNOWN UNITED STATES AMERICA

Fucking hell - internet extension America.   understand either. Anecdotally, Trump-supporting older relatives got vaccinated first opportunity. glad so, knew Covid would really rough elderly former-smokers. Np, forgot specify applies Holland only. *extend pandemic hard way Trump get vaxxed make pro vaccine statements?

Go conservative sub see agree you. legit source transmission bit? don’t see it’d problem get people boosters. Pfizer Moderna already working yearly flu shot/covid shot hybrid. What's alternative? Expect everyone else continue live locked-down life pandemic yet immunocompromised medically-sensitive individuals? looking Brazil map NY times, truly calamity there, country, even India US. majority countries spikes trend relatively quickly reprieve, Brazil follow pattern. peaks valleys Virus, mound keeps getting larger. sad people beautiful country suffer... Yeah, that's everyone else needs to. Anti-vaxers going get people killed. Sweet! Thank hospitalized capacity fairly significant medical attention.

I looked around could find nothing suggest 94% reduction hospitalization one dose Pfizer, regardless variant talking about. find [a recent suggested 80% reduction hospitalization one dose Pfizer, unclear getting numbers finding minimum vaccine effectiveness  
symptomatic disease estimate would suggest single dose  
BNT162b2 around 80% effective preventing hospital admission  
covid-19 around 85% effective preventing death covid-19.

This conducted mainline, B1.1.7 main vectors, Delta.

Similarly, real world findings suggest 60-70% reduction preventing symptomatic COVID single dose. second dose brings 90%. second shot lot prevent transmission mutation.

One shot effective, two shots necessary. prerogative. one US denied treatment due lack coverage.

**Emergency** treatment. diabetes hospital going give free insulin life. Seychelles cases: [Of doses administered \(not including Sputnik\), 57% Sinopharm 43% 



[Man got 2 AZ dies 

I understand blame Sinopham?

UK experiencing surge right now, administering Sinopham too? AZ? new variant caused vaccines less effective symptomatic infection. don’t think it’s stretch future variant make vaccines pretty ineffective. Sure, could get boosters, good luck getting even numbers people get boosters vaccinated. variants absolutely appearing spread among unvaccinated.  Missouri whopping 38% fully vaccinated, tying 13th lowest country.

FWIW, states growing 14-day case counts &lt;40% fully vaccinated. Given Delta still &lt;20% cases, looks like many choosing end pandemic hard way. come many people hospitalized fully vaccinated?

wut? numbers back up? Considering ""failed obtain **needed** medical care"" means leaving everyone even bother find needed medical care needed since knew afford it. Young people inconveniently safe perspective frightening getting vaccine. Could another approach?

I hate idea anyone needs bribed, least direct payments don’t require well-intentioned PSA terror campaign. Update: starting 24th U.S. residents enter. vaccine test requirements apply. Epsilon variant due out?   Oh my, look experts here. leads genocidal thinking. Probably hell believe specific claims u/Doener23 made call question?  Starting EPMD__ wrong?

Decades decades cuts public education left America population cannot parse good information bad celebrates ignorance expertise. cannot understand vaccine, shun it.  like five year olds understanding geopolitics Exactly. Thank you. 

I've saying since vaccines available. believe US given least 20 million Irish too, media seem utmost keep us shitting it. Fear sells.   Same. 

I got vaccinated April. Still wear masks, except biking bike lane (less 5% chance pass another cyclist).

Next week, state lifting mask mandate, plan continuing wear one until/unless heat stifling. guess I'll stay home. article cover Delta variant another article states 125 covid cases Israel Monday 70%  Wow I'm privileged I've never even heard yaws before. seems unpleasant.  post appears vaccines. encourage read helpful resources COVID-19 vaccines:
  
[Vaccine FAQ Part FAQ Part appointment bot, action performed automatically. Please [contact moderators subreddit](/message/compose/?to=/r/Coronavirus) questions concerns.* really thinking COVID thought process, conditions mutation thrive changing. know viruses capable thought conscious effort.

Mutations random, natural selection ensures propagation successful mutations.

I thinking consistently even split vaccinated unvaccinated people, unvaccinated people would provide breeding ground virus intermingle vaccinated portion population. would provide opportunity various mutations target vaccinated people, possibly one that's vaccine resistant. would assume think shot contains, like, genetically engineered virus affect white people, kills black people. (After incubation period, obvious.) seems like much easier conspiracy pull getting every clinic country board genocide.  [Most US seems start Maybe export doses US two months so?

Presumably export restrictions. Smart move. They're measuring different things original comment responded to. article linked effectiveness preventing *symptomatic COVID* due exposure delta variant, rather preventing *hospitalization*. Keep mind J&amp;J around 70% effective preventing symptomatic infection wild-type alpha variants, well 90% effective preventing hospitalization variants, would expect see much effective hospitalization symptomatic disease delta variant well.

&amp;#x200B;

Without information, would bit surprising significantly worse AstraZeneca, uses similar adenovirus platform tended show similar effectiveness efficacy numbers J&amp;J. never got many, choosing let many people die I’m immune compromised take immune suppressant. I’m vaccinated living normal life fine months. 

Stop fear baiting.  Better yet reimpose restrictions. Yeah, agree. I’ve really struggling convey folks anti-vaxxers aren’t putting risk, also putting can’t vaccinated medical reasons even small percentage vaccinated folks risk. 

I know vaccine mandate wouldn’t go well, even simply proposing government could open door methods handling voluntarily unvaccinated likely succeed.

Thanks using logic, research, education form response contrast vast majority folks thread yesterday refuse accept factual information.

We know there’s magical solution, health well-being others, regardless beliefs voting habits everyone’s priority. It’s way change society better. hecka better 0! said thought trials underway see J&amp;J effective second dose. I'd curious know hope people would willing go get booster becomes thing. don’t want get vaccinated, I’ll arrested I’ll inject vaccine butt,” Duterte said.

what fuck..? Yes, vaccination guarantee get infected.

If example put small enclosed room three others positive covid, giving huge viral loads, days. Even double vaxxed immune system might still overloaded huge viral load, virus overwhelms wins. Thereby causing effect brain article suggests, leading cognitive impairment.

So key, vaccination protection. go putting huge viral load situations.

A vaccine like building Fortress. repel invaders. there's big enough siege army, fortress hold back forever. information always partial.

Why say effectiveness single dose double dose. media keep saying delta variant gonna bypass vaccine Mask mandates capacity limits \*PREVENT\* stay home orders. People creatures habit. longer wear masks work I've found starting put one going inside remembering anymore. call stressful though.

There seem like potential weird game theory-like situation combined decision masking/vaccination comes play, one known unknown. 

Depending country, wearing wearing mask signals something vaccination decision largely unknown inferred. Imagine 2x2 box outcomes masked/vaccinated, masked/unvaccinated, unmasked/vaccinated unmasked/unvaccinated, everybody peer group trying guess unknown vaccination decision based masked decision variables know local area.

Combine usual office politics/drama could create interesting/awkward/uncomfortable situations. could head. company's lawyer kind skirted idea mentioned possibility drama employees make individual decisions whether mask/unmask workplace. really wish could fast track study like include children well. literally thousands children US scans taken prior pandemic (my niece one them). Invite second scan let’s see disease really harmless children ready send back schools fall UNVACCINATED. continue hunker kiddo opportunity vaccinated. Precisely newly discovered consequences infection Covid. terrible disease. rival, man equal! post appears vaccines. encourage read helpful resources COVID-19 vaccines:
  
[Vaccine FAQ Part FAQ Part appointment bot, action performed automatically. Please [contact moderators subreddit](/message/compose/?to=/r/Coronavirus) questions concerns.* fair, messaging around AZ fucked everyone, NACI.

Normally someone criticizing Canada's vaccine rollout, they're acting like able acquire vaccines rate vaccine hoarders south even though domestic production. think one dose efficacy often measured 14 days, immunity still building up. little data come definitive conclusion hardly people getting second dose. mix match benefit viral vector vaccines others inactivated vaccines protein subunit vaccines 80% efficacy consider 3rd injection within 6 months (a lot vaccines require 3 dose 0, 1, 6 schedule) timeline vaccines available, wonder that, mask use issues? effective BioNtech, much worse AstraZeneca. Labeling everything ""China"" ""bad"", NYT really needs take lesson rasism preaches. Two way street? So... Cuba asked USA reform government, would opinion legitimate request? would two way street.

And times pandemic, set aside. least medical equipment. would humane thing do. comment automatically removed linked source may reliable may dedicated mostly political coverage. possible, please re-submit link reliable non-political source, reliable news organization recognized institution.

Thank helping us keep information /r/Coronavirus reliable!


*I bot, action performed automatically. Please [contact moderators subreddit](/message/compose/?to=/r/Coronavirus) questions concerns.*  Tbf Alabama mask mandate. I'm little jelly mom friend who's getting AZ/Pfizer combo.

(On hand, fully vaccinated since April nice too.) open pretty much whole time. Yep, ok, tried. completely incapable admitting made mistake. havent admitted specifically highlighted 2 doses 14+ days. denying basic math. interested real conversation. 

Blocking moving on. Goodbye, hope yoy become better.  really, considering he's old enough probably early vaccination anyway. think ""alternative"" people want get vaccinated actually it, them, cant protected level dont spend rest lives saying cant expect people do. Hmm actually looks like wrong. strong legal precedent gives states right vaccination mandates. still enforceable today's US political climate, might survive modern legal challenge since 100 years old, books.

The best long-term hope might fore vaccination technology get good people get vaccinated get completely permanently removed potential infection pool people want get it, well bear consequences alone. Still sucks autoimmune disorder normal flu season. managed get back last October, took six months. lucked got right things got really bad there. I’m sorry hear you’ve lost people too. want everyone safe see families safely. 
I think lot aussies don’t take seriously haven’t seen bad get. 99.3% covid cases Indiana unvaccinated people. Hasn’t Georgia open while? 20% states reached 50% **one** shot. 

There many states right things fine. Whatever way put it, surely motivate people get vaccination! Asthma wasn’t shown risk factor severe covid. statistic value well. directly tells rate vaccine hesitancy without needing additional conversion. Moderna OG, company even named mRNA. major contribution suppose there's still question different results different studies whether truly effect think we're seeing real world answer that. Non-modified RNA immunogenic. Moderna doses lot bigger (100ml vs 50ml Pfizer believe). Shame test smaller dose like Pfizer, would've doubled supply equally effective lower dose. Taiwan China's territory. China governing Taiwan. government.

China claims Taiwan. Taiwan also claims China (or least used to, know current status). No, vaccinated, virus replicate inside shedding it. 10 states reached 50% yet, wonder there's something states common. know fact I'd guess major demographic lagging vaccines right (18-26) also demographic visits primary provider least, :/   Unless actually wearing N-95 pretty meaningless. Regular masks protect others (in case sick) . help wearer may 10%. Georgia tell citizen, fine vaccine wise lol it’s science works, offered bet whether Moderna numbers within 5 percentage points Pfizer data, I’d make lot money betting are.

This *exactly* science works. 

If bet right, get grant next time round. world neither things. try Eastern Europe.  Woo Hoo Indiana top 40! Suck Georgia state live in? pretty sure fine.  Yeah masking really hard. worst, vaccine complication rate 1 per 10'000, lot means got really poor QA. COVID complication rate 10-30%, chance contract pandemic ends is, according official Moscow statistics, assuming we're middle pandemic, \~10% (you may multiply number factor 2-3). vaccine complication rate lower 1% efficiency greater 0% safer vaccine all. Took long enough understand this. 


Там не так страшно. У меня первый день температура была и голова болела, потом два дня слабость, потом норм. like underkill.  submission automatically removed linked source may reliable may dedicated mostly political coverage. possible, please re-submit link reliable non-political source, reliable news organization recognized institution.

Thank helping us keep information /r/Coronavirus reliable!


*I bot, action performed automatically. Please [contact moderators subreddit](/message/compose/?to=/r/Coronavirus) questions concerns.* 60% doesn’t sounds good… obviously talking majority. I'm completely fine taking time lift restrictions. one better? Saying many take have. statistic taken way meant valuable. see whole populatio,n age group, take.it , etc.  17-24, listed dependent got check. parents got extra 300 child check. Either way parents got money didn’t give you. Sure can't get shot, use would including statistic be? difference 95.2 94.1 isn’t actually difference statistically speaking.

To clear, difference statistically significant depending variance measure (i.e., numbers close mean statistically different). However, recall correctly, case correct. And, even statistically different, magnitude small practice think would become issue.  Kind point, no? Great news ! Serious question: need get vaccinated I’ve already COVID. Read article antibodies stay lifetime.. getting different answers Similar technology play, would make bet.  there's 12 million people CA TX. problem easy get age group ponder mortality.

I agree know anything done that. Shaming understanding going potentially kill parents probably easier. think us, even ""good kids"", done really really stupid stuff young. unnatural age grasp gravity situations.  AZ + Moderna tomorrow    agree principle, youngest baby boomers late 50s  vaccine perfect, always minority sadly react badly. 20 million adolescents young adults, 300 resulted cases heart inflammation.

The vast majority safe. That’s numbers work game changed. always vaccinations     that? USA whole unwilling what’s right. lot things could’ve done pre-vaccine mitigate this. things still options.

Literally 48 minutes ago lmao Wouldn’t Sunday Sunday 8 day average? mathing out, approximately 1 every 75,000 vaccinated young people. 80% cases mild and, far, person country died life-changing life-shortening outcomes.

When compared myocarditis rates Covid infections range 8% - 22% cases depending study reference. nearly 10,000 times likely one get myocarditis Covid get vaccine. precipitous drop COVID deaths happening without masks lockdowns. like...triggered bad news down-voting anything like

Does really seem like effective argument tactic you? US basically impossible Chinese style lockdown police refuse enforce anything covid related, attempt restrictions things like travel private gatherings point low voluntary compliance. That’s scientists decide.

The CDC decide, made statements favor opening up. over. There's also lesser greater vaccines, that's anti-vax disinformation.   deaths occuring 

Nursing homes

Hospitals 

What age range I'm taking issue idea using last winter predict winter. completely ignores vaccines natural immunities present majority. context lockdown wear makss peak flu season China? Australia 2 fatal cases 2 million first AZ shots. Mind blowing someone think government goddamn inept can't healthcare (a thing every first world country figured generally enjoys) also ability massive conspiracy inventing disease creating shot thats get microchips people.  actually know ingredients vaccines patents.

Absolute rubbish. exact ingredients listed fact sheet given getting vaccine (Pfizer), holds Pfizer-BioNTech COVID-19 Vaccine includes following ingredients: mRNA, lipids ((4-hydroxybutyl)azanediyl)bis(hexane-6,1-diyl)bis(2-hexyldecanoate), 2 \[(polyethylene glycol)-2000\]-N,N-ditetradecylacetamide, 1,2-Distearoyl-sn-glycero-3-phosphocholine, cholesterol), potassium chloride, monobasic potassium phosphate, sodium chloride, dibasic sodium phosphate dihydrate, sucrose.

I copied literally **the first result** ""pfizer vaccine ingredients"". Yep, even specify ""covid"", Google knows.

I never understand keep repeating crap takes literally 5 second search find list. actual Sunday toll 90 insane see even considering Sunday. again. Aside lazy counter-argument, you’re barking wrong tree haven’t owned car years never felt safer.

≈99.999% time, cars cause death due human error. Maybe area. area fine pretty much middle that's right - zero Covid countries.

Australia NZ much community spread begin with. countries spread got hand never zero COVID. always endemic. Well passengers plane required quarantine. unsure flight attendants that's definitely potential risk. 

All arrivals required take taxi quarantine hotel. definitely sounds like weak link me. far outbreak emerged aspect. 

I assume there's plastic screen driver passenger. know certain airport taxi drivers allowed take people airport quarantine hotels allowed collect passengers. 

They also keep record passengers matched driver. passenger found COVID, driver his/her family sent quarantine hotel too. I'm Russian. hesitant vaccine, too.

Normally, I'm antivaxxer. government promoting ineffective medicine (see Arbidol, Grippferon, Kagocel) since start pandemic, rolls something calls ""the world's first COVID vaccine"". pocket medical experts say Navalny simply metabolic disorder, people start praising Sputnik V. September comes, someone finds discrepancies Phase I/II testing protocols. Phase III protocols come, whole result refers data provided Ministry Health. whole story smells like shit mile away.

So saw San Marino's incidence rate drop like stone, reasonably confident Sputnik V yet another bullshit ""miracle cure"", hoped they'd let us get Western vaccines huge overprice. Guess I've wrong both.

""What cost lies?"" sure heteronormativity affects life expectancy

For starters, affects data categorized biased. People penises lumped certain category due heteronormative convention, among things.  know virus spreads robustly winter much point discussing further...that research need do... Australia deaths 2021…

Like There's reason say ""new normal"", that's essentially describe last sentence. there's enough vaccine uptake country, might see end year. ""objective"" ignorance internal bias. even realize heteronormative conventions implicit opinion. ""Men"" often shorthand persons penis, absolutely assume particular gender. ""gender science"" studies sex differences completely false product heteronormative patriarchy. Yes, majority breakthrough infections asymptomatic, reporting changed recently, CDC longer tracking asymptomatic breakthrough infections. That’s margin error means, it’s polling error. 20% poll really means (depending size sample) something like 17-23%. 17% means 14%-20%. get dose mRNA vaccine got J&amp;J worried work?

First, no, don't. worked. Stop worrying it. fully vaccinated, [the efficacy J&amp;J improves (hehe)

Second, able (multiple people threads tried, failed), harm anything. trials vaccines notice signed said something like ""if get vaccine (or placebo), prevent getting another vaccine become available"". Also, see new guidance [you got vaccine another country come 

Mixing Vaccines: study [AZ/Pfizer mix safe would safe mix manufacturers, get additional dose waiting period talked doctor it? Yeah, sure. **But need to, got Pfizer/Moderna/J&amp;J, done now.**

Wait multivalent mRNA boosters really feel need additional protection.

It's okay afraid needles. [Don't let thing stops getting highly effective uses older vaccine technology. promoted vaccine people think mRNA new technology get. can't come soon enough. 

First time seeing comment? Start reading read first, go back links. thing comment. 

New guidance [you got vaccine another country come works Delta Again. (June 10th 2021)

If get vaccinated, directly indirectly protecting community, [more 
[great article unlikely ""long term"" side effects vaccines show months years missed Dr. Vincent Racaniello's second AMA, [totally check antibodies fade time, [you still people fully vaccinated still spread virus people vaccinated? [Probably [really [keeps getting less (PDF) 

Not yet vaccinated? [Watch maybe [a look Comment - Vaccines variants issue.

Still totally worth checking already. gone date yet. 

[Original Comment - Additional stuff, thoughts. Much less worth checking out, things still good. 

***

The vaccines FREE US. FREE FREE, like ""Copay free"", like fuckin FREE. need insurance. Go get one. Now. something stopping going get one today? Talk it, we'll get worked out. 

If doctor offers give vaccine, take it, right away. *will absolutely free*. get bill vaccine, call cops something, [it's *ILLEGAL* charge intervals might increase efficacy extended past 3 4 CDC says 42 days doses (but may extended point).

**More variant stuff:**

Please say ""strain"" mean ""variant"". 

There [might much room left SARS-CoV-2 into.

CDC [doesn't we'll need boosters/updates/etc mRNA vaccines.

Pfizer/Moderna work [Double/Triple/Indian (and Moderna, probably) [works B.1.1.7 B.1.351 [B.1.617, Indian/""double/triple mutant"" Every time neutralization assay variant vs Pfizer/Moderna, get result. [The vaccine really important. Probably [more important works great variants, even [seven months second vaccine better disease:**

[Penis issues (but [not Covid Infection (but vaccine).

[Loss way [more think. occur vaccines.

Loss smell [really There's whole subreddit people lose sense smell Covid tired everyone asking Covid-loss-of-smell questions. 

[Fewer symptoms = less Vaccines make fewer symptoms (*if* get infection vaccination).

If got infected, recovered, got least one dose Pfizer, immunity multiple variants, also SARS-CoV-1, virus named SARS 2003. Turns much [the ""breadth"" immunity asymptomatic people spread virus much. People pre-symptomatic, go symptoms, really good Pfizer vs Variant round. [Pfizer works Indian know, stopped. started watching try know kind restrictions place one week now. really strange knowing allowed time Saturday arrives long people unvaccinated dying. lol, um, Dr. Sanja Gupta CNN yesterday believe said worried cases deaths go thanks variant. like...triggered bad news down-voting anything like...despite reality. Dr. Sanja Gupta said it...I think ""fear-mongering"". Everyone going die. pandemic over. mean next 2-3 weeks 100% confident continued decline deaths, based substantial decline cases past weeks. ""It's trick fall it"" lot easier people say admit understand works. forget constant appeal dubious authorities.

